"","arc","arc_no","episode","turn_number","segment","actor","text","start_turn","end_turn","time_in_sec","word_count","words_per_minute","encounter_count","rp_combat","actor_guest","vox_machina","guest","staff","matt"
"353","End",8,109,353,"first_half_rp","SAM","ha ha! just a birthday prank. is it your birthday?",3643.035,3666.09,23.0550000000003,11,28.6271958360439,NA,"role_play","SAM",1,0,0,0
"354","End",8,109,354,"first_half_rp","LAURA AND TALIESIN","no.",3666.09,3667.956,1.86599999999999,2,64.3086816720262,NA,"role_play","LAURA AND TALIESIN",1,0,0,0
"355","End",8,109,355,"first_half_rp","SAM","oh, got the date wrong. i need to change. i have jizzed in my pants.",3667.956,3685.292,17.3359999999998,16,55.3760959852337,NA,"role_play","SAM",1,0,0,0
"356","End",8,109,356,"first_half_rp","SAM","i'm sorry.",3697.279,3699.081,1.80200000000013,4,133.185349611533,NA,"role_play","SAM",1,0,0,0
"357","End",8,109,357,"first_half_rp","TALIESIN","too much information. thank you.",3699.081,3701.103,2.02199999999993,6,178.041543026712,NA,"role_play","TALIESIN",1,0,0,0
"358","End",8,109,358,"first_half_rp","SAM","have a good evening.",3701.103,3703.435,2.33199999999988,5,128.644939965701,NA,"role_play","SAM",1,0,0,0
"359","End",8,109,359,"first_half_rp","TALIESIN","good evening. do you walk out the main door?",3703.435,3708.041,4.60600000000022,10,130.264871906203,NA,"role_play","TALIESIN",1,0,0,0
"360","End",8,109,360,"first_half_rp","SAM","the main door.",3708.041,3709.306,1.26499999999987,4,189.723320158122,NA,"role_play","SAM",1,0,0,0
"361","End",8,109,361,"first_half_rp","TALIESIN","okay, so you do in fact trigger a bucket.",3709.306,3711.812,2.50599999999986,10,239.425379090197,NA,"role_play","TALIESIN",1,0,0,0
"362","End",8,109,362,"first_half_rp","TALIESIN","with a viscous powder that i mixed up. it's basically a flour base. it's going to be a real pain to wash off.",3724.485,3730.116,5.63099999999986,26,277.0378263186,NA,"role_play","TALIESIN",1,0,0,0
"363","End",8,109,363,"first_half_rp","MATT","you're a ghost-white, bucket-headed gnome in a silk g-string.",3730.116,3734.707,4.59099999999989,14,182.966673927253,NA,"role_play","MATT",0,0,0,1
"364","End",8,109,364,"first_half_rp","LAURA","why? why did you do it?",3734.707,3740.574,5.86700000000019,7,71.5868416567217,NA,"role_play","LAURA",1,0,0,0
"365","End",8,109,365,"first_half_rp","SAM","for the lulz?",3740.574,3743.339,2.76499999999987,4,86.7992766726984,NA,"role_play","SAM",1,0,0,0
"366","End",8,109,366,"first_half_rp","SAM","i don't know. i'll see you in the morning.",3749.552,3762.783,13.2309999999998,12,54.4176555060096,NA,"role_play","SAM",1,0,0,0
"367","End",8,109,367,"first_half_rp","TALIESIN","i'm going to block the secret passage. i'm going to shift some furniture.",3762.783,3769.323,6.53999999999996,16,146.788990825689,NA,"role_play","TALIESIN",1,0,0,0
"368","End",8,109,368,"first_half_rp","LIAM","by the way, when everyone asks me tomorrow on social media why i did it, same answer.",3769.323,3776.354,7.03099999999995,18,153.605461527522,NA,"role_play","LIAM",1,0,0,0
"369","End",8,109,369,"first_half_rp","TALIESIN","this was good. well done, you.",3776.354,3779.035,2.68100000000004,7,156.657963446473,NA,"role_play","TALIESIN",1,0,0,0
"370","End",8,109,370,"first_half_rp","MATT","after some disconcerting conversation between the married couple and a shameful walk back to your own chambers, you eventually find yourself coming to rest for the evening. after a full night's sleep, you find yourself with your spells restored, your hit points restored, half your hit dice restored, and an embarrassing morning breakfast before you. as you all come down to a fine vegan breakfast meal there on the table, you all have conversation, start plotting and planning, and you hear the gentle footsteps of one slowly approaching scanlan to the breakfast table.",3779.035,3817.209,38.174,95,149.316288573375,NA,"role_play","MATT",0,0,0,1
"371","End",8,109,371,"first_half_rp","LAURA","oh, hey.",3817.209,3818.92,1.71100000000024,3,105.201636469886,NA,"role_play","LAURA",1,0,0,0
"372","End",8,109,372,"first_half_rp","SAM","hey. didn't sleep a lot. sorry. hey, percy.",3818.92,3830.109,11.1889999999999,10,53.624095093396,NA,"role_play","SAM",1,0,0,0
"373","End",8,109,373,"first_half_rp","TALIESIN","hi.",3830.109,3835.694,5.58500000000004,2,21.4861235452102,NA,"role_play","TALIESIN",1,0,0,0
"374","End",8,109,374,"first_half_rp","MARISHA","what distributor do you get your wine from? just curious.",3835.694,3849.111,13.4169999999999,11,49.1913244391447,NA,"role_play","MARISHA",1,0,0,0
"375","End",8,109,375,"first_half_rp","SAM","i don't want to talk about it.",3849.111,3854.514,5.40300000000025,9,99.9444752915001,NA,"role_play","SAM",1,0,0,0
"376","End",8,109,376,"first_half_rp","LAURA","so, vasselheim?",3854.514,3857.097,2.58300000000008,3,69.6864111498235,NA,"role_play","LAURA",1,0,0,0
"377","End",8,109,377,"first_half_rp","TALIESIN","yep.",3857.097,3858.2,1.10299999999961,2,108.794197642831,NA,"role_play","TALIESIN",1,0,0,0
"378","End",8,109,378,"first_half_rp","MATT","all right, so finishing your meals. what do you guys want to do? you're going to vasselheim. how are you doing that?",3858.2,3869.808,11.6080000000002,24,124.05237767057,NA,"role_play","MATT",0,0,0,1
"379","End",8,109,379,"first_half_rp","MARISHA","okay. do we have a plan before we get there? before i teleport us into the middle of a city that might possibly be in the middle of a war zone?",3869.808,3879.317,9.50900000000001,32,201.913976233042,NA,"role_play","MARISHA",1,0,0,0
"380","End",8,109,380,"first_half_rp","LIAM","why don't i go see how much progress he's made? and i stick my skull out the door again and see how far he's gotten.",3879.317,3885.303,5.98599999999988,29,290.678249248252,NA,"role_play","LIAM",1,0,0,0
"381","End",8,109,381,"first_half_rp","MATT","okay. make a perception check.",3885.303,3888.308,3.00500000000011,6,119.800332778698,NA,"role_play","MATT",0,0,0,1
"382","End",8,109,382,"first_half_rp","LIAM","very good. 30.",3888.308,3891.488,3.17999999999984,4,75.4716981132114,NA,"role_play","LIAM",1,0,0,0
"383","End",8,109,383,"first_half_rp","MATT","okay. listening to your senses and focusing on the direction, still traveling. still relatively slow pace, as far as the general distance, but it's making headway. it's traveled throughout the night a number of miles.",3891.488,3908.274,16.7860000000001,38,135.827475277016,NA,"role_play","MATT",0,0,0,1
"384","End",8,109,384,"first_half_rp","TALIESIN","we should at least prepare vasselheim, then.",3908.274,3913.159,4.88500000000022,8,98.2599795291665,NA,"role_play","TALIESIN",1,0,0,0
"385","End",8,109,385,"first_half_rp","TRAVIS","yeah. he hasn't obviously gotten there, right?",3913.159,3918.079,4.92000000000007,9,109.756097560974,NA,"role_play","TRAVIS",1,0,0,0
"386","End",8,109,386,"first_half_rp","TALIESIN","if a wrath of a dark god is on its way, they should probably prepare themselves.",3918.079,3921.945,3.86599999999999,17,263.838592860839,NA,"role_play","TALIESIN",1,0,0,0
"387","End",8,109,387,"first_half_rp","MARISHA","also, i'm assuming he's traveling with an army.",3921.945,3924.403,2.45799999999963,11,268.510984540317,NA,"role_play","MARISHA",1,0,0,0
"388","End",8,109,388,"first_half_rp","TALIESIN","we would assume. with one eye each.",3924.403,3928.746,4.3430000000003,8,110.522680174987,NA,"role_play","TALIESIN",1,0,0,0
"389","End",8,109,389,"first_half_rp","LAURA","oh god. what if vasselheim is a show of power?",3928.746,3935.423,6.67699999999968,11,98.8467874794117,NA,"role_play","LAURA",1,0,0,0
"390","End",8,109,390,"first_half_rp","TALIESIN","that would be likely.",3935.423,3939.47,4.04700000000003,5,74.1289844329128,NA,"role_play","TALIESIN",1,0,0,0
"391","End",8,109,391,"first_half_rp","SAM","let's hurry.",3939.519,3943.169,3.65000000000009,4,65.7534246575326,NA,"role_play","SAM",1,0,0,0
"392","End",8,109,392,"first_half_rp","TRAVIS","where to in vasselheim?",3943.169,3944.918,1.74900000000025,5,171.526586620902,NA,"role_play","TRAVIS",1,0,0,0
"393","End",8,109,393,"first_half_rp","MARISHA","how long would it take us to get out? oh, wait. we chartered that boat; do we care about those people?",3944.918,3953.584,8.66599999999971,22,152.319409185327,NA,"role_play","MARISHA",1,0,0,0
"394","End",8,109,394,"first_half_rp","TALIESIN","wow.",3953.584,3956.5,2.91600000000017,2,41.1522633744832,NA,"role_play","TALIESIN",1,0,0,0
"395","End",8,109,395,"first_half_rp","MARISHA","or are we just going to leave them in the middle of the ocean?",3956.5,3958.292,1.79199999999992,15,502.232142857166,NA,"role_play","MARISHA",1,0,0,0
"396","End",8,109,396,"first_half_rp","LAURA","they were only going to wait for us a couple of days, and then they were going to head back.",3958.292,3962.317,4.02500000000009,21,313.043478260862,NA,"role_play","LAURA",1,0,0,0
"397","End",8,109,397,"first_half_rp","LIAM","yeah, they would assume we drowned.",3962.317,3964.481,2.16400000000021,7,194.085027726413,NA,"role_play","LIAM",1,0,0,0
"398","End",8,109,398,"first_half_rp","MARISHA","okay, fair argument.",3964.481,3967.888,3.4069999999997,4,70.4432051658413,NA,"role_play","MARISHA",1,0,0,0
"399","End",8,109,399,"first_half_rp","MATT","yeah, you gather that probably when they drove a bunch of yahoos out in the middle of the ocean to dive under a volcano in the ocean that they did not expect you to return.",3967.888,3977.065,9.17700000000013,36,235.371036286365,NA,"role_play","MATT",0,0,0,1
"400","End",8,109,400,"first_half_rp","MARISHA","we did put a 500 gold holding deposit on, an incidental that we will not get back.",3977.065,3983.485,6.42000000000007,18,168.224299065419,NA,"role_play","MARISHA",1,0,0,0
"401","End",8,109,401,"first_half_rp","LAURA","i think the destruction of the world may be more important than 500 gold.",3983.485,3988.275,4.78999999999996,15,187.891440501045,NA,"role_play","LAURA",1,0,0,0
"402","End",8,109,402,"first_half_rp","LAURA","i know.",3991.244,3993.419,2.17499999999973,3,82.7586206896655,NA,"role_play","LAURA",1,0,0,0
"403","End",8,109,403,"first_half_rp","SAM","quick, cast lesser restoration on yourself!",3993.419,3998.012,4.5930000000003,7,91.4435009797458,NA,"role_play","SAM",1,0,0,0
"404","End",8,109,404,"first_half_rp","MARISHA","it would probably take us a while to get up and out to a tree, right? i'm being a little selfish with my upper-level spells.",3998.012,4009.025,11.0129999999999,28,152.546989921004,NA,"role_play","MARISHA",1,0,0,0
"405","End",8,109,405,"first_half_rp","TALIESIN","no, i feel it.",4009.025,4010.328,1.30299999999988,5,230.237912509614,NA,"role_play","TALIESIN",1,0,0,0
"406","End",8,109,406,"first_half_rp","TRAVIS","up and out to it. up the volcano, up the water",4010.328,4016.398,6.07000000000016,11,108.731466227345,NA,"role_play","TRAVIS",1,0,0,0
"407","End",8,109,407,"first_half_rp","MARISHA","okay, you know what? don't worry about it, let's go. let's just plane shift.",4016.398,4020.37,3.97199999999975,18,271.903323262857,NA,"role_play","MARISHA",1,0,0,0
"408","End",8,109,408,"first_half_rp","MATT","that's an arduous journey back to any possible tree.",4020.37,4022.937,2.56700000000001,11,257.109466303077,NA,"role_play","MATT",0,0,0,1
"409","End",8,109,409,"first_half_rp","TRAVIS","wanted to talk that one out.",4022.937,4025.093,2.15599999999995,7,194.805194805199,NA,"role_play","TRAVIS",1,0,0,0
"410","End",8,109,410,"first_half_rp","MARISHA","yeah. i plane shift us to vasselheim.",4025.093,4028.395,3.30200000000013,8,145.366444579037,NA,"role_play","MARISHA",1,0,0,0
"411","End",8,109,411,"first_half_rp","MATT","all right, so you plane shift to vasselheim. as you guys encircle your hands once more, keyleth, you focus on whereabouts in vasselheim?",4028.395,4035.848,7.45299999999997,24,193.210787602308,NA,"role_play","MATT",0,0,0,1
"412","End",8,109,412,"first_half_rp","TRAVIS","the trial forge?",4035.848,4037.117,1.26900000000023,4,189.12529550824,NA,"role_play","TRAVIS",1,0,0,0
"413","End",8,109,413,"first_half_rp","LAURA","or melora's tree maybe?",4037.117,4042.284,5.16699999999992,6,69.6729243274639,NA,"role_play","LAURA",1,0,0,0
"414","End",8,109,414,"first_half_rp","SAM","residual magic.",4059.688,4062.616,2.92799999999988,3,61.475409836068,NA,"role_play","SAM",1,0,0,0
"415","End",8,109,415,"first_half_rp","SAM AND TALIESIN AND TRAVIS","trial forge?",4062.616,4067.949,5.33300000000008,3,33.7521095068436,NA,"role_play","SAM AND TALIESIN AND TRAVIS",1,0,0,0
"416","End",8,109,416,"first_half_rp","MARISHA","where will you not get arrested?",4067.949,4070.558,2.60899999999992,7,160.981218857805,NA,"role_play","MARISHA",1,0,0,0
"417","End",8,109,417,"first_half_rp","TRAVIS","no one's going to even notice me. yeah, they were ringing the bells and running around and getting prepared and stuff. yeah, and if for some reason, somebody's like, """"that guy punched me in """"the face,"""" we'll just punch them.",4070.558,4090.995,20.4369999999999,44,129.177472231737,NA,"role_play","TRAVIS",1,0,0,0
"418","End",8,109,418,"first_half_rp","TALIESIN","i agree with this plan.",4090.995,4095.046,4.05099999999993,6,88.866946432981,NA,"role_play","TALIESIN",1,0,0,0
"419","End",8,109,419,"first_half_rp","MARISHA","trial forge.",4095.046,4096.279,1.23300000000063,3,145.985401459779,NA,"role_play","MARISHA",1,0,0,0
"420","End",8,109,420,"first_half_rp","MATT","all right. with that, you close your eyes. beneath your breath, you recite the incantation. with that, you feel your body suddenly sucked into a dark void and thrust through the absence of space. and within a moment's time, before you can adjust to the sudden cold and dark vacuous void around you, your feet hit hard ground, your eyes focus again to the light, and you glance around and the center streets, not actually directly at the trial forge ooh, we got music, finally. in the streets around the braving grounds, you can see the smokestacks from the trial forge over the distance. you also notice that the sky above you is deep, dark gray clouds. it's as if there is a perpetual eclipse placed upon this ground. you look around in all directions, and you see this roiling gray cloud cluster that encompasses the entirety of the sky above you, which should be mid-morning or midday. it's blotted out by the storm rainfall is absent and you see flashes of light, occasionally framing strange shapes and clouds. whether by illusion or by a trick of your mind, you swear you see shifting darkness and forms, images in the clouds: giant faces silently screaming, hundreds of feet across, that extend and push out of the clouds and draw back into the sky. massive hands that push against them, only to slowly recede moments later. you blink and they're gone, leaving you unsettled regardless and uncertain as to whether or not that was just you or if everyone can see this. as your focus shifts from the sky above, you look around and you can see bastions are stationed all across the perimeter walls of vasselheim. you see large ballistae mounted and armed as watchers scour the distant horizon on all sides looking for any sign of something in the distance making its way towards the city, based on the warning you previously gave. unlit beacons sit at every major structure and juncture of the stone walls, awaiting the burning sign that an assault is spotted. militia and armored guard move with haste to stations across the city quarters. you can feel the air of war permeating the streets. the streets are far emptier than you recall, the stragglers returning to their homes with carts full of rations, produce, and weapons. fear grips their face as they pass by. you glance off to your left, and you can see a wiry old man in the corner, his tangled silver and blond hair bouncing with fervor, as he shouts out, """"the reckoning of our opulence has come! the gods are """"away and the price of our hubris comes to consume us."""" but no one's paying him mind. his tattered bones jangling his knees across each other, as he makes his way through the streets, his face a glance of utter despair. you notice an argument between two bastions and a middle-aged bearded man who is painting a familiar symbol on his front door, not too far from where you stand. a five-year-old girl cries and clings to his leg. what do you do?",4096.279,4295.886,199.607,532,159.914231464828,NA,"role_play","MATT",0,0,0,1
"421","End",8,109,421,"first_half_rp","TALIESIN","what is the symbol?",4295.886,4298.835,2.94899999999961,5,101.729399796555,NA,"role_play","TALIESIN",1,0,0,0
"422","End",8,109,422,"first_half_rp","MATT","make a perception check.",4298.835,4301.271,2.43599999999969,5,123.152709359621,NA,"role_play","MATT",0,0,0,1
"423","End",8,109,423,"first_half_rp","TALIESIN","i'll make a perception check. let's see if you'll roll a one again. no, that's much better. 28.",4301.271,4309.702,8.43100000000049,23,163.681651049688,NA,"role_play","TALIESIN",1,0,0,0
"424","End",8,109,424,"first_half_rp","MATT","glancing at this distance, you see a familiar and striking shape. it is a haphazardly drawn circle with dark, reddish purple paint and a small line and a pronged fork of four prongs painted up against this wall.",4309.702,4328.005,18.3029999999999,39,127.847893787904,NA,"role_play","MATT",0,0,0,1
"425","End",8,109,425,"first_half_rp","MARISHA","oh, hell no.",4328.005,4329.545,1.53999999999996,4,155.84415584416,NA,"role_play","MARISHA",1,0,0,0
"426","End",8,109,426,"first_half_rp","LAURA","he's painting it on the door? the guy in the city is?",4329.545,4332.253,2.70799999999963,14,310.192023633721,NA,"role_play","LAURA",1,0,0,0
"427","End",8,109,427,"first_half_rp","MATT","the father figure.",4332.253,4334.554,2.30100000000039,4,104.302477183816,NA,"role_play","MATT",0,0,0,1
"428","End",8,109,428,"first_half_rp","LIAM","yeah. it could be to pass over their house.",4334.554,4337.049,2.49499999999989,10,240.480961923858,NA,"role_play","LIAM",1,0,0,0
"429","End",8,109,429,"first_half_rp","TALIESIN","yes.",4337.049,4338.045,0.996000000000095,2,120.481927710832,NA,"role_play","TALIESIN",1,0,0,0
"430","End",8,109,430,"first_half_rp","MARISHA","pass over?",4338.045,4339.918,1.87299999999959,3,96.1025093433204,NA,"role_play","MARISHA",1,0,0,0
"431","End",8,109,431,"first_half_rp","LAURA","that's the vecna symbol, right?",4339.918,4341.884,1.96600000000035,7,213.631739572699,NA,"role_play","LAURA",1,0,0,0
"432","End",8,109,432,"first_half_rp","MATT","sensing the distance of vecna, he's still far to the northwest of here. but what was once a few hundred miles is now shortened, about two hundred or so, and getting lesser and lesser.",4341.884,4358.432,16.5479999999998,36,130.529369108051,NA,"role_play","MATT",0,0,0,1
"433","End",8,109,433,"first_half_rp","LAURA","fuck. should we go up and talk to that guy?",4358.432,4361.067,2.63500000000022,11,250.474383301687,NA,"role_play","LAURA",1,0,0,0
"434","End",8,109,434,"first_half_rp","MARISHA","maybe one of us. maybe not all of us.",4361.067,4365.303,4.23599999999988,10,141.643059490089,NA,"role_play","MARISHA",1,0,0,0
"435","End",8,109,435,"first_half_rp","LAURA","you there.",4365.303,4366.423,1.11999999999989,3,160.714285714301,NA,"role_play","LAURA",1,0,0,0
"436","End",8,109,436,"first_half_rp","MATT","as you make the shout, you see the soldiers are currently arguing with him. one says, """"you """"welcome this rubbish? are you one of them kook believers?"""" and the father is angrily staring in his face and says, """"you mind your business. i have no love for """"this, but if these dreams are true, i must protect my family.""""",4366.423,4385.121,18.6980000000003,60,192.533960851425,NA,"role_play","MATT",0,0,0,1
"437","End",8,109,437,"first_half_rp","LAURA","dreams?",4385.121,4386.887,1.76599999999962,2,67.9501698754392,NA,"role_play","LAURA",1,0,0,0
"438","End",8,109,438,"first_half_rp","MATT","they turn and look at you as you approach.",4386.887,4388.999,2.11200000000008,10,284.090909090898,NA,"role_play","MATT",0,0,0,1
"439","End",8,109,439,"first_half_rp","LAURA","what dreams?",4388.999,4390.961,1.96200000000044,3,91.7431192660343,NA,"role_play","LAURA",1,0,0,0
"440","End",8,109,440,"first_half_rp","MATT","the soldiers take a step back with a look of recognition across you as you step forward with your white dragon scale armor. they know not to approach and there is seemingly a sense of knowing who you are, at least from the legends that are told amongst the streets of vasselheim. the father turns to you and seeing your lordly approach, and strong voice, immediately. """"the nightmares i've """"had, and i'm not the first. this symbol. it scares me, but if something comes like they say it is, i """"must it let it know we have no quarrel. to leave my family be.""""",4390.961,4431.896,40.9349999999995,107,156.834005130086,NA,"role_play","MATT",0,0,0,1
"441","End",8,109,441,"first_half_rp","LAURA","this symbol will not protect you.",4431.896,4434.603,2.70700000000033,7,155.153306243054,NA,"role_play","LAURA",1,0,0,0
"442","End",8,109,442,"first_half_rp","MATT","""""how do you know this?""""",4434.603,4435.944,1.34100000000035,7,313.199105145332,NA,"role_play","MATT",0,0,0,1
"443","End",8,109,443,"first_half_rp","LAURA","because i know his followers. they won't have mercy. they'll gouge out eyes, remove your hand, and make you one of them.",4435.944,4447.277,11.3329999999996,25,132.356834024534,NA,"role_play","LAURA",1,0,0,0
"444","End",8,109,444,"first_half_rp","MATT","make a persuasion check, please.",4447.277,4449.109,1.83200000000033,6,196.506550218305,NA,"role_play","MATT",0,0,0,1
"445","End",8,109,445,"first_half_rp","LAURA","okay. hold on. 17?",4449.109,4459.465,10.3559999999998,5,28.9687137891084,NA,"role_play","LAURA",1,0,0,0
"446","End",8,109,446,"first_half_rp","MATT","okay, he looks at you for a moment, his eyes keen with fear, and his face. """"you're certain of """"this, my lady?""""",4459.465,4470.327,10.8620000000001,24,132.572270300128,NA,"role_play","MATT",0,0,0,1
"447","End",8,109,447,"first_half_rp","LAURA","yes.",4470.327,4472.106,1.77899999999954,2,67.4536256323951,NA,"role_play","LAURA",1,0,0,0
"448","End",8,109,448,"first_half_rp","MATT","""""will you protect us, then?""""",4472.106,4475.545,3.43900000000031,7,122.128525734214,NA,"role_play","MATT",0,0,0,1
"449","End",8,109,449,"first_half_rp","LAURA","we'll do our best. that's what we're here for.",4475.545,4479.165,3.61999999999989,13,215.469613259675,NA,"role_play","LAURA",1,0,0,0
"450","End",8,109,450,"first_half_rp","MATT","he looks past you, the rest of your companions, all looking well-armed and definitely capable. looks down and rubs the hair of his little girl, her sandy blonde hair curled up and a bit dirtied. looking down from her gaze, up to you, he says, """"then i trust you."""" he takes the tattered paintbrush he was using and smears across the symbol, destroying it.",4479.165,4506.139,26.9740000000002,66,146.808037369318,NA,"role_play","MATT",0,0,0,1
"451","End",8,109,451,"first_half_rp","LAURA","dear god, i hope that works.",4516.248,4518.895,2.64700000000084,7,158.670192670898,NA,"role_play","LAURA",1,0,0,0
"452","End",8,109,452,"first_half_rp","MATT","he goes inside with his daughter. before he closes the door: """"thank you. please, help."""" pulls the rest of the cart in and closes the door behind with a slam. the two guards awkwardly look at each other and back to you. """"thank you.""""",4518.895,4537.834,18.9389999999994,45,142.562965309683,NA,"role_play","MATT",0,0,0,1
"453","End",8,109,453,"first_half_rp","MATT","""""be safe."""" and they both wander off.",4550.745,4553.806,3.06099999999969,9,176.412936948727,NA,"role_play","MATT",0,0,0,1
"454","End",8,109,454,"first_half_rp","LAURA","i don't think they noticed you, grog.",4553.806,4556.676,2.8700000000008,9,188.153310104477,NA,"role_play","LAURA",1,0,0,0
"455","End",8,109,455,"first_half_rp","TRAVIS","man, i'm fucking slick.",4556.676,4559.035,2.35899999999947,6,152.607036880068,NA,"role_play","TRAVIS",1,0,0,0
"456","End",8,109,456,"first_half_rp","MATT","knowing the location, you're not that far from the quadroads juncture between the different areas. you can go further towards the trial forge or back towards the center of where the quadroads meets between that and where the platinum sanctuary and platinum dragon section is. there is the temple to sarenrae, where you left pike previously. what do you wish to do?",4559.035,4583.95,24.915,64,154.124021673691,NA,"role_play","MATT",0,0,0,1
"457","End",8,109,457,"first_half_rp","MARISHA","is the crazy zealot still running around?",4583.95,4587.734,3.78400000000056,8,126.849894291736,NA,"role_play","MARISHA",1,0,0,0
"458","End",8,109,458,"first_half_rp","MATT","yeah. he seems to be scattered through the streets. he's maybe 60 feet away, still shouting obscenities and weird doom-saying prophecies.",4587.734,4595.608,7.8739999999998,24,182.880365760736,NA,"role_play","MATT",0,0,0,1
"459","End",8,109,459,"first_half_rp","MARISHA","i walk up to him.",4595.608,4597.627,2.01900000000023,6,178.306092124794,NA,"role_play","MARISHA",1,0,0,0
"460","End",8,109,460,"first_half_rp","MATT","okay. as he's shouting this time, """"he will come! he will destroy us! you! he will destroy """"you, too! i've seen it! i've seen it.""""",4597.627,4608.589,10.9619999999995,29,158.730158730165,NA,"role_play","MATT",0,0,0,1
"461","End",8,109,461,"first_half_rp","MARISHA","yeah. i believe you. i've seen it, too.",4608.589,4611.942,3.35300000000007,10,178.94422904861,NA,"role_play","MARISHA",1,0,0,0
"462","End",8,109,462,"first_half_rp","MATT","""""good! then save yourself! run! run far!""""",4611.942,4616.917,4.97500000000036,9,108.542713567831,NA,"role_play","MATT",0,0,0,1
"463","End",8,109,463,"first_half_rp","MARISHA","wait. how did he talk to you?",4616.917,4620.487,3.56999999999971,8,134.453781512616,NA,"role_play","MARISHA",1,0,0,0
