"","arc","arc_no","episode","turn_number","segment","actor","text","start_turn","end_turn","time_in_sec","word_count","words_per_minute","encounter_count","rp_combat","actor_guest","vox_machina","guest","staff","matt"
"1814","End",8,108,1814,"combat","MATT","so it takes 17 damage next round.",12344.626,12349.489,4.86299999999937,8,98.70450339298,2,"combat","MATT",0,0,0,1
"1815","End",8,108,1815,"combat","TALIESIN","next round, on its turn. i'm burning another grit for my final shot.",12349.489,12353.595,4.10599999999977,15,219.191427179749,2,"combat","TALIESIN",1,0,0,0
"1816","End",8,108,1816,"combat","LAURA","does grit give you advantage?",12353.595,12356.827,3.23199999999997,6,111.386138613862,2,"combat","LAURA",1,0,0,0
"1817","End",8,108,1817,"combat","MATT","he can burn a grit to get advantage on a shot, if he wants to.",12356.827,12359.49,2.66300000000047,16,360.495681562085,2,"combat","MATT",0,0,0,1
"1818","End",8,108,1818,"combat","TALIESIN","yeah, i can do a lot of things with it, but he's so big, this is my best shot, because his ac is so fucking high. that's 31 to hit.",12359.49,12370.16,10.6700000000001,33,185.567010309277,2,"combat","TALIESIN",1,0,0,0
"1819","End",8,108,1819,"combat","MATT","that hits.",12370.16,12371.29,1.13000000000102,3,159.292035398087,2,"combat","MATT",0,0,0,1
"1820","End",8,108,1820,"combat","MARISHA","did you have disadvantage on it?",12371.29,12373.747,2.45699999999852,7,170.940170940274,2,"combat","MARISHA",1,0,0,0
"1821","End",8,108,1821,"combat","TALIESIN","and that's 16 points of damage and one point of psychic damage.",12373.747,12379.403,5.65600000000086,14,148.514851485126,2,"combat","TALIESIN",1,0,0,0
"1822","End",8,108,1822,"combat","MATT","all right, so those are your shots.",12379.403,12381.433,2.03000000000065,8,236.453201970367,2,"combat","MATT",0,0,0,1
"1823","End",8,108,1823,"combat","TALIESIN","and i'm running towards that fire pit, straight back.",12381.433,12384.953,3.51999999999862,11,187.500000000074,2,"combat","TALIESIN",1,0,0,0
"1824","End",8,108,1824,"combat","MATT","this way. you're going to have to leap over lava.",12384.953,12388.393,3.44000000000051,12,209.302325581364,2,"combat","MATT",0,0,0,1
"1825","End",8,108,1825,"combat","TALIESIN","i can't whirl around it?",12388.393,12390.216,1.82300000000032,7,230.389467909998,2,"combat","TALIESIN",1,0,0,0
"1826","End",8,108,1826,"combat","MATT","if you want to go around it, you can go.",12390.216,12394.723,4.50699999999961,11,146.438872864446,2,"combat","MATT",0,0,0,1
"1827","End",8,108,1827,"combat","TALIESIN","that'll do.",12394.723,12395.837,1.11399999999958,4,215.439856373511,2,"combat","TALIESIN",1,0,0,0
"1828","End",8,108,1828,"combat","MATT","all right, there you go. all right, that ends percival's turn. death saving throw, with advantage.",12395.837,12402.337,6.5,18,166.153846153846,2,"combat","MATT",0,0,0,1
"1829","End",8,108,1829,"combat","LIAM","good, natural 20.",12402.337,12403.775,1.4380000000001,4,166.898470097346,2,"combat","LIAM",1,0,0,0
"1830","End",8,108,1830,"combat","MATT","you're fine. actually, you stabilize. you're fine. end of your turn. it's now the forge guardian's turn.",12403.775,12410.93,7.15500000000065,22,184.486373165602,2,"combat","MATT",0,0,0,1
"1831","End",8,108,1831,"combat","TALIESIN","is he blind? is he still blind?",12410.93,12412.525,1.59499999999935,8,300.940438871597,2,"combat","TALIESIN",1,0,0,0
"1832","End",8,108,1832,"combat","MATT","well, he's not conscious, and currently you are still blind, yeah.",12412.525,12416.528,4.00300000000061,13,194.853859605266,2,"combat","MATT",0,0,0,1
"1833","End",8,108,1833,"combat","LIAM","am i at zero hit points and stable, or one hit point and stable?",12416.528,12420.429,3.90099999999984,15,230.710074339922,2,"combat","LIAM",1,0,0,0
"1834","End",8,108,1834,"combat","MATT","zero hit points and stable.",12420.429,12421.668,1.23899999999958,6,290.556900726491,2,"combat","MATT",0,0,0,1
"1835","End",8,108,1835,"combat","LIAM","love it.",12421.668,12423.044,1.3760000000002,3,130.813953488353,2,"combat","LIAM",1,0,0,0
"1836","End",8,108,1836,"combat","TRAVIS","one hit point. zero is unconscious.",12423.044,12428.651,5.60699999999997,7,74.9063670411989,2,"combat","TRAVIS",1,0,0,0
"1837","End",8,108,1837,"combat","MATT","you don't have to make the death saving throws anymore.",12428.651,12431.142,2.49099999999999,12,289.040545965477,2,"combat","MATT",0,0,0,1
"1838","End",8,108,1838,"combat","LAURA","oh, but you're still unconscious.",12431.142,12433.384,2.24200000000019,7,187.332738626211,2,"combat","LAURA",1,0,0,0
"1839","End",8,108,1839,"combat","MATT","no, you regain one hit point if you roll a 20! you're right!",12433.384,12440.813,7.42900000000009,15,121.1468569121,2,"combat","MATT",0,0,0,1
"1840","End",8,108,1840,"combat","LIAM","but we're not at the top of the round, right? we're still mid-round, correct?",12440.813,12443.652,2.83899999999994,18,380.415639309624,2,"combat","LIAM",1,0,0,0
"1841","End",8,108,1841,"combat","MATT","correct. so you're conscious now, though your vision, you open your eyes, and there's still darkness, but you're conscious. all right. the forge guardian does not regain his blade storm. he's going to make two melee attacks against you, grog, since you've given him the option. actually, he's going to go ahead and leap a little bit, to land here, not enough to give you an attack of opportunity. it's going to make one strike at you, grog, and another kick attack at scanlan.",12443.652,12479.392,35.7399999999998,92,154.448796866257,2,"combat","MATT",0,0,0,1
"1842","End",8,108,1842,"combat","LIAM","kick a gnome?",12479.392,12481.333,1.94100000000071,4,123.647604327621,2,"combat","LIAM",1,0,0,0
"1843","End",8,108,1843,"combat","TALIESIN","gnome-kicking is a time-honored tradition.",12481.333,12484.439,3.10599999999977,8,154.53960077271,2,"combat","TALIESIN",1,0,0,0
"1844","End",8,108,1844,"combat","MATT","31, grog?",12484.439,12488.288,3.84900000000016,3,46.7653936087276,2,"combat","MATT",0,0,0,1
"1845","End",8,108,1845,"combat","TRAVIS","yeah, that hits. i'll take the retaliation after, as well.",12488.288,12491.524,3.23599999999897,12,222.496909765213,2,"combat","TRAVIS",1,0,0,0
"1846","End",8,108,1846,"combat","MATT","34 points of slashing damage. down to 17. and scanlan, that is 28 to hit.",12491.524,12515.836,24.3119999999999,16,39.486673247779,2,"combat","MATT",0,0,0,1
"1847","End",8,108,1847,"combat","SAM","that hits.",12515.836,12517.532,1.69599999999991,3,106.132075471704,2,"combat","SAM",1,0,0,0
"1848","End",8,108,1848,"combat","MATT","you take 24 points of bludgeoning damage.",12517.532,12521.506,3.97400000000016,8,120.785103170604,2,"combat","MATT",0,0,0,1
"1849","End",8,108,1849,"combat","SAM","i will reduce that with cutting words.",12521.506,12524.756,3.25,8,147.692307692308,2,"combat","SAM",1,0,0,0
"1850","End",8,108,1850,"combat","MARISHA","he's about to go down, isn't he?",12524.756,12526.985,2.22900000000118,10,269.179004037543,2,"combat","MARISHA",1,0,0,0
"1851","End",8,108,1851,"combat","MATT","all right, so reduced, so roll a d12. this is your last bardic inspiration, so you're done with this now.",12526.985,12532.906,5.92100000000028,22,222.935314980567,2,"combat","MATT",0,0,0,1
"1852","End",8,108,1852,"combat","SAM","d12. six.",12532.906,12537.356,4.44999999999891,3,40.4494382022571,2,"combat","SAM",1,0,0,0
"1853","End",8,108,1853,"combat","MATT","okay. so take six damage off of that.",12537.356,12541.524,4.16799999999967,9,129.558541266805,2,"combat","MATT",0,0,0,1
"1854","End",8,108,1854,"combat","SAM","what was the damage? i don't think you said.",12541.524,12548.899,7.375,11,89.4915254237288,2,"combat","SAM",1,0,0,0
"1855","End",8,108,1855,"combat","MATT","i thought i did, but i don't remember.",12548.899,12550.698,1.79900000000089,10,333.5186214562,2,"combat","MATT",0,0,0,1
"1856","End",8,108,1856,"combat","SAM","you rolled a 20-something to hit, but i don't think you said damage.",12550.698,12555.767,5.06899999999951,16,189.386466758748,2,"combat","SAM",1,0,0,0
"1857","End",8,108,1857,"combat","MATT","that's fine. i can't remember. okay. 25 points, reduced, so you take 19 points of bludgeoning damage as it kicks you, and you are pushed 15 feet back.",12555.767,12567.027,11.2600000000002,31,165.186500888096,2,"combat","MATT",0,0,0,1
"1858","End",8,108,1858,"combat","LIAM AND MARISHA","past the lava!",12567.027,12569.523,2.49599999999919,4,96.1538461538776,2,"combat","LIAM AND MARISHA",1,0,0,0
"1859","End",8,108,1859,"combat","TRAVIS","skipping across!",12569.523,12574.964,5.44100000000071,3,33.0821540158016,2,"combat","TRAVIS",1,0,0,0
"1860","End",8,108,1860,"combat","MARISHA","please tell me you're not unconscious.",12574.964,12579.161,4.19700000000012,8,114.367405289489,2,"combat","MARISHA",1,0,0,0
"1861","End",8,108,1861,"combat","MATT","so scanlan, you immediately are kicked back into the molten rock and iron. that is 61 points of fire damage.",12579.161,12605.933,26.7720000000008,21,47.0640968175691,2,"combat","MATT",0,0,0,1
"1862","End",8,108,1862,"combat","LAURA","did he go under? tell me you're not unconscious.",12605.933,12608.672,2.73899999999958,11,240.963855421724,2,"combat","LAURA",1,0,0,0
"1863","End",8,108,1863,"combat","SAM","i'm unconscious.",12608.672,12611.287,2.61499999999978,4,91.7782026768719,2,"combat","SAM",1,0,0,0
"1864","End",8,108,1864,"combat","MATT","scanlan is now on fire, and he's t-800-ing.",12611.287,12619.48,8.1929999999993,12,87.8798974734604,2,"combat","MATT",0,0,0,1
"1865","End",8,108,1865,"combat","TRAVIS","can i take my retaliation attack?",12619.48,12621.437,1.95700000000033,7,214.614205416417,2,"combat","TRAVIS",1,0,0,0
"1866","End",8,108,1866,"combat","MATT","you can.",12621.437,12622.641,1.20399999999972,3,149.501661129602,2,"combat","MATT",0,0,0,1
"1867","End",8,108,1867,"combat","TRAVIS","reckless, great weapon master.",12622.641,12623.974,1.33300000000054,5,225.056264065926,2,"combat","TRAVIS",1,0,0,0
"1868","End",8,108,1868,"combat","LAURA","i think i can get him out.",12623.974,12630.697,6.72299999999996,8,71.3966979027225,2,"combat","LAURA",1,0,0,0
"1869","End",8,108,1869,"combat","TRAVIS","34 minus five. 29.",12630.697,12632.922,2.22500000000036,5,134.831460674135,2,"combat","TRAVIS",1,0,0,0
"1870","End",8,108,1870,"combat","MATT","that hits. roll damage on that.",12632.922,12634.442,1.51999999999862,7,276.315789473936,2,"combat","MATT",0,0,0,1
"1871","End",8,108,1871,"combat","TRAVIS","23, 33.",12634.442,12639.022,4.58000000000175,3,39.3013100436531,2,"combat","TRAVIS",1,0,0,0
"1872","End",8,108,1872,"combat","MATT","33 damage. by the way, at the top of its turn, it also took 17 points of damage from your hemorrhaging shot. it's looking rough now. it's looking pretty rough. all right, so that finishes that turn. end of his turn, vex, you're up.",12639.022,12660.222,21.1999999999989,48,135.849056603781,2,"combat","MATT",0,0,0,1
"1873","End",8,108,1873,"combat","LAURA","yeah. okay. all right, can i get to scanlan from my position on the map?",12660.222,12666.481,6.25900000000001,16,153.379134046972,2,"combat","LAURA",1,0,0,0
"1874","End",8,108,1874,"combat","LIAM","movement, dash, action to grab him.",12666.481,12669.64,3.15899999999965,7,132.953466286814,2,"combat","LIAM",1,0,0,0
"1875","End",8,108,1875,"combat","LAURA","all right, then i'm going to pick him up.",12669.64,12674.042,4.40200000000004,11,149.931849159471,2,"combat","LAURA",1,0,0,0
"1876","End",8,108,1876,"combat","MATT","all right, so you glide down and you grab his body, and you lift him up, and you get him out of the lava but that's as much movement as you've got.",12674.042,12680.687,6.64500000000044,35,316.027088036097,2,"combat","MATT",0,0,0,1
"1877","End",8,108,1877,"combat","LAURA","can i use my action to",12680.687,12682.567,1.8799999999992,6,191.489361702209,2,"combat","LAURA",1,0,0,0
"1878","End",8,108,1878,"combat","MATT","it's your action to grab and pull him out.",12682.567,12684.469,1.90200000000004,11,347.003154574125,2,"combat","MATT",0,0,0,1
"1879","End",8,108,1879,"combat","LAURA","can i use my bonus action to dash away?",12684.469,12688.611,4.14200000000164,10,144.857556735819,2,"combat","LAURA",1,0,0,0
"1880","End",8,108,1880,"combat","MATT","you can. i'll say you move half speed because you're having to bring him with you.",12688.611,12691.09,2.47899999999936,19,459.862847922668,2,"combat","MATT",0,0,0,1
"1881","End",8,108,1881,"combat","LAURA","okay, i'm going to back up.",12691.09,12692.641,1.55099999999948,8,309.477756286371,2,"combat","LAURA",1,0,0,0
"1882","End",8,108,1882,"combat","MATT","so you can get both of you guys back up to wherever you want to go.",12692.641,12695.49,2.84900000000016,17,358.020358020338,2,"combat","MATT",0,0,0,1
"1883","End",8,108,1883,"combat","LAURA","into the corner.",12695.49,12696.615,1.125,4,213.333333333333,2,"combat","LAURA",1,0,0,0
"1884","End",8,108,1884,"combat","MATT","into the corner? so you get about there.",12696.615,12702.975,6.36000000000058,9,84.9056603773507,2,"combat","MATT",0,0,0,1
"1885","End",8,108,1885,"combat","LAURA","at least i got him out of the lava.",12702.975,12705.279,2.30400000000009,10,260.416666666657,2,"combat","LAURA",1,0,0,0
"1886","End",8,108,1886,"combat","LIAM","i have had a jackrabbit knee under the table for ten minutes.",12705.279,12708.471,3.1919999999991,13,244.360902255708,2,"combat","LIAM",1,0,0,0
"1887","End",8,108,1887,"combat","LAURA","but that's it? that's everything.",12708.471,12710.905,2.43400000000111,8,197.206244864331,2,"combat","LAURA",1,0,0,0
"1888","End",8,108,1888,"combat","MATT","all right, so that ends vex's turn. top of the round, scanlan, you immediately take fire damage because you're still on fire, so you immediately fail a death saving throw.",12710.905,12722.938,12.0329999999994,33,164.547494390434,2,"combat","MATT",0,0,0,1
"1889","End",8,108,1889,"combat","SAM","but i have some sort of death ward on me.",12722.938,12725.377,2.43900000000031,11,270.602706027026,2,"combat","SAM",1,0,0,0
"1890","End",8,108,1890,"combat","MATT","you do have death ward on you! so as you go and reach and grab him and pull him up, the death ward flickers on and he comes back to one hit point. you pull him off to the side. as soon as his turn comes up, he takes seven points of fire damage and <i>now</i> goes to zero.",12725.377,12743.034,17.6569999999992,62,210.681316191888,2,"combat","MATT",0,0,0,1
"1891","End",8,108,1891,"combat","MARISHA","he didn't fail a death saving throw.",12743.034,12746.124,3.09000000000015,9,174.75728155339,2,"combat","MARISHA",1,0,0,0
"1892","End",8,108,1892,"combat","MATT","the death ward has expired.",12746.124,12748.39,2.26599999999962,6,158.870255957661,2,"combat","MATT",0,0,0,1
"1893","End",8,108,1893,"combat","LIAM","point of clarification. we're at the top of the round, so i just went from one hit point to two hit points.",12748.39,12751.655,3.26500000000124,24,441.041347626173,2,"combat","LIAM",1,0,0,0
"1894","End",8,108,1894,"combat","MATT","yeah, i think so, actually. well, it's the top of your turn, so yeah. let me double check on that.",12751.655,12763.701,12.0459999999985,22,109.57994354974,2,"combat","MATT",0,0,0,1
"1895","End",8,108,1895,"combat","LIAM","safe at two. no one can touch me.",12763.701,12765.506,1.80500000000029,9,299.168975069204,2,"combat","LIAM",1,0,0,0
"1896","End",8,108,1896,"combat","TRAVIS","yeah, you're all good.",12765.506,12766.8,1.29399999999987,6,278.207109737277,2,"combat","TRAVIS",1,0,0,0
"1897","End",8,108,1897,"combat","MATT","all righty, so that brings us from scanlan's turn to the elemental's turn. the elemental is going to go ahead and.",12766.8,12781.853,15.0529999999999,24,95.6619942868539,2,"combat","MATT",0,0,0,1
"1898","End",8,108,1898,"combat","SAM","this overlay thing's pretty cool.",12781.853,12783.871,2.01800000000003,7,208.126858275517,2,"combat","SAM",1,0,0,0
"1899","End",8,108,1899,"combat","LIAM","yeah, right? it makes remote play not quite as removed.",12783.871,12789.938,6.06700000000092,11,108.785231580666,2,"combat","LIAM",1,0,0,0
"1900","End",8,108,1900,"combat","SAM","can we have a hologram version of that in front of us all the time?",12789.938,12794.423,4.48500000000058,16,214.046822742447,2,"combat","SAM",1,0,0,0
"1901","End",8,108,1901,"combat","TRAVIS","yeah, right here.",12794.423,12795.624,1.20099999999911,4,199.833472106726,2,"combat","TRAVIS",1,0,0,0
"1902","End",8,108,1902,"combat","MARISHA","yeah, counting our hit points for us?",12795.624,12797.6,1.97600000000057,8,242.914979757015,2,"combat","MARISHA",1,0,0,0
"1903","End",8,108,1903,"combat","SAM","that we can see, i mean.",12797.6,12798.954,1.35399999999936,7,310.192023633825,2,"combat","SAM",1,0,0,0
"1904","End",8,108,1904,"combat","MATT","that is 13 against your armor class. does not hit. and 14 does not hit. it has the blindness on the elemental, still.",12798.954,12808.327,9.37299999999959,24,153.632774992005,2,"combat","MATT",0,0,0,1
"1905","End",8,108,1905,"combat","TRAVIS","super cute elemental, chasing me like a puppy.",12808.327,12810.886,2.55900000000111,9,211.019929659932,2,"combat","TRAVIS",1,0,0,0
"1906","End",8,108,1906,"combat","MATT","ending that elemental's turn. it is now grog and keyleth's turn.",12810.886,12816.016,5.1299999999992,14,163.742690058505,2,"combat","MATT",0,0,0,1
"1907","End",8,108,1907,"combat","TRAVIS","i'll go. turn straight at him, reckless, great weapon master.",12816.016,12825.288,9.27200000000084,12,77.6531492666021,2,"combat","TRAVIS",1,0,0,0
"1908","End",8,108,1908,"combat","MATT","all righty.",12825.288,12826.807,1.51900000000023,3,118.499012508211,2,"combat","MATT",0,0,0,1
"1909","End",8,108,1909,"combat","TRAVIS","that's going to be enough. come on, crit. no. okay.",12826.807,12830.679,3.87199999999939,12,185.95041322317,2,"combat","TRAVIS",1,0,0,0
"1910","End",8,108,1910,"combat","MATT","technically, sorry, before we get to that, at the end of its turn, at the end of the elemental's turn, it's going to go ahead and strike you with its blade.",12830.679,12839.981,9.30199999999968,34,219.307675768659,2,"combat","MATT",0,0,0,1
"1911","End",8,108,1911,"combat","TRAVIS","okay. i'm going to keep that roll just in case something happens.",12839.981,12843.254,3.27300000000105,14,256.645279559955,2,"combat","TRAVIS",1,0,0,0
"1912","End",8,108,1912,"combat","MATT","no worries. that's a 27 to hit.",12843.254,12847.195,3.94099999999889,9,137.021060644545,2,"combat","MATT",0,0,0,1
"1913","End",8,108,1913,"combat","TRAVIS","which it does.",12847.195,12848.5,1.30500000000029,4,183.90804597697,2,"combat","TRAVIS",1,0,0,0
"1914","End",8,108,1914,"combat","MATT","36 points of slashing damage, reduced to half, so that's 18. and make a constitution saving throw, please.",12848.5,12866.182,17.6820000000007,20,67.8656260603977,2,"combat","MATT",0,0,0,1
"1915","End",8,108,1915,"combat","MARISHA","i have four as my planetar, so i've got two more of those that i just did, in terms of myself. i'm trying to keep tabs.",12866.182,12879.249,13.0669999999991,29,133.159868370714,2,"combat","MARISHA",1,0,0,0
"1916","End",8,108,1916,"combat","TRAVIS","24.",12879.249,12880.497,1.24799999999959,2,96.1538461538776,2,"combat","TRAVIS",1,0,0,0
"1917","End",8,108,1917,"combat","MATT","24? yeah, you resist the blindness. so your turn, unabated as you were before.",12880.497,12886.156,5.65900000000147,15,159.038699416817,2,"combat","MATT",0,0,0,1
"1918","End",8,108,1918,"combat","TRAVIS","right. minus five, is 31 to hit.",12886.156,12888.762,2.60599999999977,8,184.190330007691,2,"combat","TRAVIS",1,0,0,0
"1919","End",8,108,1919,"combat","MATT","yeah, that hits.",12888.762,12889.858,1.09599999999955,4,218.978102189871,2,"combat","MATT",0,0,0,1
"1920","End",8,108,1920,"combat","TRAVIS","it was a great roll. and the second one is pretty big. 34 minus five is 29.",12889.858,12900.84,10.982,18,98.3427426698236,2,"combat","TRAVIS",1,0,0,0
"1921","End",8,108,1921,"combat","MATT","that hits, yeah. both do damage.",12900.84,12902.903,2.0630000000001,7,203.587009209878,2,"combat","MATT",0,0,0,1
"1922","End",8,108,1922,"combat","LIAM","let me do a little roleplay here. oh, baby!",12902.903,12906.105,3.20199999999932,10,187.38288569648,2,"combat","LIAM",1,0,0,0
"1923","End",8,108,1923,"combat","TRAVIS","17 plus ten is 27 for the first one. oh, nope. i'm sorry! that was a one, so i'm going to re-roll it. five, 21, 31 for the first one. second one. three, 29, and my fucking necrotic dice. two, four more.",12906.105,12932.508,26.4030000000002,46,104.53357573003,2,"combat","TRAVIS",1,0,0,0
"1924","End",8,108,1924,"combat","MATT","all right, that ends your turn, grog?",12932.508,12937.39,4.88199999999961,8,98.3203605079964,2,"combat","MATT",0,0,0,1
"1925","End",8,108,1925,"combat","TRAVIS","that does. actually, can i move? i'm going to stay in melee, but i want to come over here in case he decides to golf-swing me into the fucking lava river.",12937.39,12949.24,11.8500000000004,34,172.151898734172,2,"combat","TRAVIS",1,0,0,0
"1926","End",8,108,1926,"combat","MATT","sure. it's going to use its second legendary action to attack you, as soon as you move around, it's going to sweep low and attempt to try and cleave you in half. with the advantage against you, natural 20.",12949.24,12959.452,10.2119999999995,42,246.768507638084,2,"combat","MATT",0,0,0,1
"1927","End",8,108,1927,"combat","TALIESIN","knock it off!",12961.568,12962.701,1.13299999999981,4,211.827007943548,2,"combat","TALIESIN",1,0,0,0
"1928","End",8,108,1928,"combat","MATT","that reckless attack, man. he gets advantage on all his attacks against him.",12962.701,12965.051,2.35000000000036,14,357.446808510583,2,"combat","MATT",0,0,0,1
"1929","End",8,108,1929,"combat","TRAVIS","that's the reason i roll so high most of the time.",12965.051,12968.821,3.77000000000044,13,206.896551724114,2,"combat","TRAVIS",1,0,0,0
"1930","End",8,108,1930,"combat","MARISHA","yeah, you kill them before they can retaliate.",12968.821,12972.929,4.10800000000017,9,131.450827653354,2,"combat","MARISHA",1,0,0,0
"1931","End",8,108,1931,"combat","MATT","73 points of slashing damage. on 3d12, it was a ten, eight, and a 12.",12972.929,12981.626,8.69700000000012,16,110.382890651947,2,"combat","MATT",0,0,0,1
"1932","End",8,108,1932,"combat","MARISHA","what was it, 76?",12981.626,12983.163,1.53700000000026,5,195.185426154814,2,"combat","MARISHA",1,0,0,0
"1933","End",8,108,1933,"combat","TRAVIS","so that's 37?",12983.163,12985.967,2.80400000000009,5,106.990014265332,2,"combat","TRAVIS",1,0,0,0
"1934","End",8,108,1934,"combat","MATT","it's 20, 30, times two, 60, plus 13. so 73. so half of that would be 36, we'll say. 36 points of slashing damage, and make a constitution saving throw.",12985.967,12999.569,13.601999999999,33,145.566828407598,2,"combat","MATT",0,0,0,1
"1935","End",8,108,1935,"combat","TALIESIN","god fucking damn it.",12999.569,13001.532,1.96299999999974,5,152.827305145206,2,"combat","TALIESIN",1,0,0,0
"1936","End",8,108,1936,"combat","TRAVIS","yeah, 24.",13001.532,13007.026,5.4940000000006,3,32.7630141973026,2,"combat","TRAVIS",1,0,0,0
"1937","End",8,108,1937,"combat","MATT","24, okay. resisting it still.",13007.026,13010.086,3.05999999999949,6,117.647058823549,2,"combat","MATT",0,0,0,1
"1938","End",8,108,1938,"combat","TRAVIS","i can still see?",13010.086,13013.238,3.15200000000004,5,95.177664974618,2,"combat","TRAVIS",1,0,0,0
"1939","End",8,108,1939,"combat","MATT","yeah, you can still see. all right, keyleth.",13013.238,13016.11,2.87200000000121,9,188.022284122484,2,"combat","MATT",0,0,0,1
"1940","End",8,108,1940,"combat","MARISHA","okay. you can still see? everyone's good? you're up? everyone's up?",13016.11,13021.241,5.1309999999994,15,175.404404599514,2,"combat","MARISHA",1,0,0,0
"1941","End",8,108,1941,"combat","LAURA","scanlan's dead. unconscious.",13021.241,13024.317,3.07599999999911,5,97.5292587776614,2,"combat","LAURA",1,0,0,0
"1942","End",8,108,1942,"combat","MARISHA","you're with him. he's fine. i'm going to fly over. 120 feet. i've got a five-foot reach range. i'm going to do my multiattack as my planetar. so two hits, with plus two. i'm going to do gil.",13024.317,13049.064,24.7470000000012,46,111.52867014183,2,"combat","MARISHA",1,0,0,0
"1943","End",8,108,1943,"combat","LIAM","come on, captain planet!",13049.064,13051.25,2.18599999999969,5,137.236962488583,2,"combat","LIAM",1,0,0,0
"1944","End",8,108,1944,"combat","TRAVIS","we just had three fights in the same day.",13051.25,13053.537,2.28700000000026,10,262.352426759917,2,"combat","TRAVIS",1,0,0,0
"1945","End",8,108,1945,"combat","MARISHA","goddamn. that's a natural 19 on one, and a natural 16 on the other! plus 12 for both of those.",13053.537,13060.751,7.21399999999994,22,182.977543665097,2,"combat","MARISHA",1,0,0,0
"1946","End",8,108,1946,"combat","MATT","yeah, those both hit.",13060.751,13063.48,2.72899999999936,5,109.930377427655,2,"combat","MATT",0,0,0,1
"1947","End",8,108,1947,"combat","MARISHA","okay, and then for both of those, 4d6 plus seven, and an additional 5d8 radiant damage.",13063.48,13071.698,8.21800000000076,17,124.117790216586,2,"combat","MARISHA",1,0,0,0
"1948","End",8,108,1948,"combat","MATT","correct.",13071.698,13072.902,1.20399999999972,2,99.6677740864016,2,"combat","MATT",0,0,0,1
"1949","End",8,108,1949,"combat","LIAM","kiki, it's yours.",13072.902,13074.059,1.15699999999924,5,259.291270527395,2,"combat","LIAM",1,0,0,0
"1950","End",8,108,1950,"combat","LAURA","kill it!",13074.059,13075.996,1.9369999999999,3,92.9272070211716,2,"combat","LAURA",1,0,0,0
"1951","End",8,108,1951,"combat","MARISHA","okay, for the d6s alone. okay, that's six plus four, that's ten plus another five, 15, plus three is 18.",13075.996,13087.06,11.0640000000003,23,124.728850325376,2,"combat","MARISHA",1,0,0,0
"1952","End",8,108,1952,"combat","MATT","18 plus seven. 25?",13087.06,13090.116,3.05600000000049,5,98.1675392669998,2,"combat","MATT",0,0,0,1
