"","arc","arc_no","episode","turn_number","segment","actor","text","start_turn","end_turn","time_in_sec","word_count","words_per_minute","encounter_count","rp_combat","actor_guest","vox_machina","guest","staff","matt"
"516","End",8,108,516,"first_half_rp","TRAVIS","and i will do it the old fashioned way.",3351.636,3353.357,1.721,10,348.634514816966,NA,"role_play","TRAVIS",1,0,0,0
"517","End",8,108,517,"first_half_rp","MATT","so make a strength check, please.",3353.357,3354.675,1.31800000000021,7,318.664643399038,NA,"role_play","MATT",0,0,0,1
"518","End",8,108,518,"first_half_rp","LIAM","27.",3354.675,3356.594,1.91899999999987,2,62.5325690463826,NA,"role_play","LIAM",1,0,0,0
"519","End",8,108,519,"first_half_rp","MATT","like most of its armored pieces, the arms detach, but the head is a solid jointed portion to the torso.",3356.594,3366.28,9.68600000000015,21,130.084658269666,NA,"role_play","MATT",0,0,0,1
"520","End",8,108,520,"first_half_rp","TRAVIS","22.",3366.28,3367.49,1.20999999999958,2,99.1735537190426,NA,"role_play","TRAVIS",1,0,0,0
"521","End",8,108,521,"first_half_rp","MATT","22. and as you're inspecting this, you hear this horrible sound in the distance as you see grog with his foot up on the center of the armored clavicle piece, yanks the head off of it, tearing, causing the metal to bend back and spring for a moment in the air.",3367.49,3383.187,15.6970000000001,53,202.586481493277,NA,"role_play","MATT",0,0,0,1
"522","End",8,108,522,"first_half_rp","TRAVIS","look, it's just like the one above the coals!",3383.187,3386.633,3.44599999999991,11,191.526407428908,NA,"role_play","TRAVIS",1,0,0,0
"523","End",8,108,523,"first_half_rp","LIAM","oh, that's how you do it.",3386.633,3388.065,1.43200000000024,8,335.1955307262,NA,"role_play","LIAM",1,0,0,0
"524","End",8,108,524,"first_half_rp","LAURA","good job, grog.",3388.065,3389.957,1.89199999999983,4,126.849894291766,NA,"role_play","LAURA",1,0,0,0
"525","End",8,108,525,"first_half_rp","TALIESIN","we've got to do all three heads.",3389.957,3392.66,2.70299999999997,9,199.778024417316,NA,"role_play","TALIESIN",1,0,0,0
"526","End",8,108,526,"first_half_rp","TRAVIS","that's an interesting phrase.",3392.66,3394.941,2.28099999999995,6,157.825515124949,NA,"role_play","TRAVIS",1,0,0,0
"527","End",8,108,527,"first_half_rp","LAURA","see if you can smelt some platinum into that thing, grog. should it be platinum? should probably be platinum, yeah?",3394.941,3403.173,8.23199999999997,21,153.061224489796,NA,"role_play","LAURA",1,0,0,0
"528","End",8,108,528,"first_half_rp","TALIESIN","we have the platinum. let's see what happens. let's smelt the platinum into the heads.",3403.173,3407.293,4.12000000000035,18,262.135922330075,NA,"role_play","TALIESIN",1,0,0,0
"529","End",8,108,529,"first_half_rp","LAURA","you know how to do it, because you're a blacksmith now.",3407.293,3412.362,5.06899999999996,13,153.876504241469,NA,"role_play","LAURA",1,0,0,0
"530","End",8,108,530,"first_half_rp","TRAVIS","we're not supposed to like, kissy-face the heads to make some sort of a 3d shape?",3412.362,3418.133,5.77099999999973,19,197.539421244161,NA,"role_play","TRAVIS",1,0,0,0
"531","End",8,108,531,"first_half_rp","LAURA","no, it's already got a pyramid in it.",3418.133,3420.602,2.46900000000005,10,243.01336573511,NA,"role_play","LAURA",1,0,0,0
"532","End",8,108,532,"first_half_rp","TRAVIS","good deal.",3420.602,3421.79,1.1880000000001,3,151.515151515139,NA,"role_play","TRAVIS",1,0,0,0
"533","End",8,108,533,"first_half_rp","TALIESIN","i think we're going to put all three into the one.",3421.79,3424.649,2.85899999999992,13,272.822665267583,NA,"role_play","TALIESIN",1,0,0,0
"534","End",8,108,534,"first_half_rp","TRAVIS","sounds like a plan. can i go over and archaically remove the other two noggins?",3424.649,3430.491,5.8420000000001,16,164.327285176307,NA,"role_play","TRAVIS",1,0,0,0
"535","End",8,108,535,"first_half_rp","MATT","sure.",3430.491,3431.596,1.10500000000002,2,108.597285067872,NA,"role_play","MATT",0,0,0,1
"536","End",8,108,536,"first_half_rp","SAM","may i assist by holding the bodies with bigby's hand while you pull the heads?",3431.596,3436.732,5.13599999999997,17,198.598130841123,NA,"role_play","SAM",1,0,0,0
"537","End",8,108,537,"first_half_rp","MATT","yes, actually. make a strength check with advantage, grog.",3436.732,3439.587,2.85500000000002,10,210.157618213659,NA,"role_play","MATT",0,0,0,1
"538","End",8,108,538,"first_half_rp","TRAVIS","23.",3439.587,3443.448,3.86099999999988,2,31.0800310800321,NA,"role_play","TRAVIS",1,0,0,0
"539","End",8,108,539,"first_half_rp","MATT","yeah, so with bigby's hand wrapping around the body, clutching it like an action figure, you very easily pop the head off, and you now have two disembodied heads.",3443.448,3453.007,9.5590000000002,31,194.581023119569,NA,"role_play","MATT",0,0,0,1
"540","End",8,108,540,"first_half_rp","TRAVIS","one more. do you want to help me with this one, too? yeah! what's wrong with your voice? 18.",3453.007,3462.972,9.96500000000015,21,126.442548921222,NA,"role_play","TRAVIS",1,0,0,0
"541","End",8,108,541,"first_half_rp","MATT","18. it takes a little while, and it pulls off, but it's mildly deformed from being pulled off. it seems like the hole in the face is intact. it took so hard a try.",3462.972,3476.354,13.3819999999996,36,161.410850396059,NA,"role_play","MATT",0,0,0,1
"542","End",8,108,542,"first_half_rp","TRAVIS","we got the ashtrays.",3476.354,3478.384,2.0300000000002,5,147.783251231513,NA,"role_play","TRAVIS",1,0,0,0
"543","End",8,108,543,"first_half_rp","TALIESIN","that'll do. let's try this.",3478.384,3482.383,3.9989999999998,8,120.030007501882,NA,"role_play","TALIESIN",1,0,0,0
"544","End",8,108,544,"first_half_rp","TRAVIS","all right. we head over to the smelting apparati.",3482.383,3486.75,4.36700000000019,10,137.394092054036,NA,"role_play","TRAVIS",1,0,0,0
"545","End",8,108,545,"first_half_rp","MATT","okay. so you walk on over, and it's a small furnace built in there with extremely hot coals, and it seems to be an influx of perpetual heat, but there's a large bellows next to it that you can use to try and increase the heat there for a temporary, short time, and you once again, strangely, you look over to it and you know exactly how this works, like you've always worked with it before. so the flames that were a burning orange-red, extremely hot, begin to flare into bright yellow and white in places. and the heat emanating from it is enough that it causes a lot of you to get uncomfortable in the presence and you have to take a step back, grog enduring it.",3486.75,3527.697,40.9470000000001,133,194.886072239724,NA,"role_play","MATT",0,0,0,1
"546","End",8,108,546,"first_half_rp","MARISHA","i'm still a fire hydrant. keyleth is on fire marshal duty. i do some misting, like at six flags to cool off vex.",3527.697,3542.56,14.8629999999998,25,100.921752001616,NA,"role_play","MARISHA",1,0,0,0
"547","End",8,108,547,"first_half_rp","TRAVIS","you can't just run through you, like universal city walk or something?",3542.56,3545.351,2.79100000000017,14,300.967395198835,NA,"role_play","TRAVIS",1,0,0,0
"548","End",8,108,548,"first_half_rp","MARISHA","yeah. mainly just to make vex sexy. that's really all i'm going for. i turned into an elemental. i've got to do something with it.",3545.351,3558.029,12.6779999999999,29,137.245622337909,NA,"role_play","MARISHA",1,0,0,0
"549","End",8,108,549,"first_half_rp","MATT","make a check with your blacksmithing tools, which is your proficiency modifier, and we'll say for this, because it is more of a dextrous use of this skill, add your dexterity modifier.",3558.029,3570.344,12.3150000000001,34,165.651644336175,NA,"role_play","MATT",0,0,0,1
"550","End",8,108,550,"first_half_rp","TRAVIS","okay. 24.",3570.384,3575.444,5.05999999999995,3,35.5731225296446,NA,"role_play","TRAVIS",1,0,0,0
"551","End",8,108,551,"first_half_rp","MATT","24. so in setting up preparation, you take each one of the heads, and to fill each one of their i want to say concave, but it's an interior pyramid space. convex is outward. it will be about 100 platinum pieces or so to fill each face void. so you take the platinum, you melt it down into the smelter, get it to where it's in the gripped, tong-held metallic reservoir, until it eventually melts down. you then pour it into each of the heads, so 300 platinum utilized to do this. it fills to the very edge. some of it spills over, but you can easily snip that off. as you wait for it to cool, which you can probably help with, actually, as there is no basin for quenching the metal at the moment, so the steam rises up all around, and you turn the heads over, and each one leaves these heavy metallic pyramid pieces that are smooth and perfect on three of the sides, and one of them appears to be almost like a broken crystal on the inside. it's a shattered, messed-up section.",3575.444,3654.527,79.0830000000001,194,147.187132506354,NA,"role_play","MATT",0,0,0,1
"552","End",8,108,552,"first_half_rp","LAURA","puzzle piece! got to fit them together!",3654.527,3656.434,1.90700000000015,8,251.704247509157,NA,"role_play","LAURA",1,0,0,0
"553","End",8,108,553,"first_half_rp","TALIESIN","okay, so if we fit these together",3656.434,3658.136,1.70199999999977,7,246.768507638106,NA,"role_play","TALIESIN",1,0,0,0
"554","End",8,108,554,"first_half_rp","MATT","they seem to fit together very well; you figured it out very quickly, they fit and hold together.",3658.136,3663.5,5.36400000000003,19,212.527964205815,NA,"role_play","MATT",0,0,0,1
"555","End",8,108,555,"first_half_rp","LAURA","with the jaggedy ends, or with the smooth ends?",3663.5,3665.574,2.07400000000007,10,289.296046287358,NA,"role_play","LAURA",1,0,0,0
"556","End",8,108,556,"first_half_rp","MATT","the jaggedy ends all fit together.",3665.574,3667.574,2,7,210,NA,"role_play","MATT",0,0,0,1
"557","End",8,108,557,"first_half_rp","TALIESIN","does this now make another concave piece?",3667.574,3670.052,2.47800000000007,8,193.704600484256,NA,"role_play","TALIESIN",1,0,0,0
"558","End",8,108,558,"first_half_rp","MATT","all together, it makes a pyramid that comes to a central point.",3670.052,3675.002,4.94999999999982,13,157.575757575763,NA,"role_play","MATT",0,0,0,1
"559","End",8,108,559,"first_half_rp","LAURA","let's put it in the big thing!",3675.002,3676.879,1.87699999999995,9,287.693127330854,NA,"role_play","LAURA",1,0,0,0
"560","End",8,108,560,"first_half_rp","TALIESIN","so i've still got some spider climb, so i'm going to grab one and lift up. all the fliers?",3676.879,3683.518,6.63900000000012,22,198.825124265699,NA,"role_play","TALIESIN",1,0,0,0
"561","End",8,108,561,"first_half_rp","LAURA","yep. let's go.",3683.518,3684.817,1.29899999999998,5,230.946882217094,NA,"role_play","LAURA",1,0,0,0
"562","End",8,108,562,"first_half_rp","MATT","okay. so the three of you make it up, fit it together, push it in. it fits in perfectly. slips in. you all back up... nothing.",3684.817,3703.471,18.654,27,86.8446445802509,NA,"role_play","MATT",0,0,0,1
"563","End",8,108,563,"first_half_rp","LAURA","we push it in harder.",3703.471,3705.231,1.76000000000022,6,204.545454545429,NA,"role_play","LAURA",1,0,0,0
"564","End",8,108,564,"first_half_rp","MATT","all right, make a strength check.",3705.231,3706.721,1.48999999999978,7,281.879194630914,NA,"role_play","MATT",0,0,0,1
"565","End",8,108,565,"first_half_rp","LAURA","this is definitely going to be really good.",3706.721,3712.336,5.61499999999978,9,96.1709706144294,NA,"role_play","LAURA",1,0,0,0
"566","End",8,108,566,"first_half_rp","LIAM","i push on my sister's shoulder blades.",3712.336,3714.048,1.71199999999999,9,315.420560747666,NA,"role_play","LIAM",1,0,0,0
"567","End",8,108,567,"first_half_rp","LAURA","15.",3714.048,3715.13,1.08200000000033,2,110.905730129356,NA,"role_play","LAURA",1,0,0,0
"568","End",8,108,568,"first_half_rp","MATT","right, you guys get behind and shove, push. nothing.",3717.403,3722.046,4.64300000000003,10,129.226793021752,NA,"role_play","MATT",0,0,0,1
"569","End",8,108,569,"first_half_rp","TRAVIS","can i try?",3722.046,3723.033,0.98700000000008,4,243.161094224904,NA,"role_play","TRAVIS",1,0,0,0
"570","End",8,108,570,"first_half_rp","LAURA","yeah. grog, you try.",3723.033,3724.334,1.30099999999993,5,230.591852421227,NA,"role_play","LAURA",1,0,0,0
"571","End",8,108,571,"first_half_rp","TRAVIS","i run across the coal pits and superman punch the pyramid.",3724.334,3728.877,4.54300000000012,12,158.485582214392,NA,"role_play","TRAVIS",1,0,0,0
"572","End",8,108,572,"first_half_rp","LIAM","i barrel-roll out of the way.",3728.877,3730.96,2.08300000000008,8,230.436869899175,NA,"role_play","LIAM",1,0,0,0
"573","End",8,108,573,"first_half_rp","TRAVIS","i rage before i do this.",3730.96,3735.12,4.15999999999985,7,100.961538461542,NA,"role_play","TRAVIS",1,0,0,0
"574","End",8,108,574,"first_half_rp","LAURA","oh jesus. there's a dent in it now.",3735.12,3737.376,2.25600000000031,10,265.957446808474,NA,"role_play","LAURA",1,0,0,0
"575","End",8,108,575,"first_half_rp","MATT","you get advantage on this, then.",3737.376,3739.67,2.29399999999987,7,183.086312118581,NA,"role_play","MATT",0,0,0,1
"576","End",8,108,576,"first_half_rp","TRAVIS","that's what i was hoping for. 21.",3739.67,3743.024,3.35399999999981,9,161.001788908775,NA,"role_play","TRAVIS",1,0,0,0
"577","End",8,108,577,"first_half_rp","MATT","the impact on this causes the whole room to shake almost, from the blast. you hear the echo right up the stairs in the hallway that you emerged from, you can hear continuing as it slowly dissipates in the distance. you land, and you can see there's actually a knuckle mark in the platinum from the impact. no effect.",3743.024,3763.786,20.7620000000002,61,176.283595029379,NA,"role_play","MATT",0,0,0,1
"578","End",8,108,578,"first_half_rp","LAURA","hey, i've got an idea. what if we take this thing off of the cross beams, right? and stick it in the coals, or something. because why are the coals here, right underneath it?",3763.786,3775.855,12.069,36,178.970917225951,NA,"role_play","LAURA",1,0,0,0
"579","End",8,108,579,"first_half_rp","MARISHA","i drop water elemental form. you think it needs to be hot first?",3775.855,3780.692,4.83699999999999,14,173.661360347323,NA,"role_play","MARISHA",1,0,0,0
"580","End",8,108,580,"first_half_rp","LAURA","i don't know.",3780.692,3782.239,1.54700000000003,5,193.923723335485,NA,"role_play","LAURA",1,0,0,0
"581","End",8,108,581,"first_half_rp","MARISHA","i look up, i line up the apparatus and look across the room, does it feel like there's any other indiana jones",3782.239,3793.504,11.2649999999999,23,122.503328894808,NA,"role_play","MARISHA",1,0,0,0
"582","End",8,108,582,"first_half_rp","MATT","the stairway is in the way. because the stairway doesn't come all the way to the top of the ceiling, and then back here it blocks this passage between the two of them, but as you go and look, all it is is the reddish, rust colored cross-beams that are bolted against the wall, and in the center there's the round golden crest with the triangle shape which is now filled with the platinum key that you've made.",3793.504,3818.084,24.5799999999999,83,202.603742880391,NA,"role_play","MATT",0,0,0,1
"583","End",8,108,583,"first_half_rp","TALIESIN","are the coals hot or are the coals cold?",3818.084,3819.895,1.81100000000015,10,331.308669243485,NA,"role_play","TALIESIN",1,0,0,0
"584","End",8,108,584,"first_half_rp","MATT","the coals are currently now cold.",3819.895,3821.486,1.59099999999989,7,263.984915147723,NA,"role_play","MATT",0,0,0,1
"585","End",8,108,585,"first_half_rp","TRAVIS","should we try turning it?",3821.486,3824.443,2.95700000000033,6,121.745011836307,NA,"role_play","TRAVIS",1,0,0,0
"586","End",8,108,586,"first_half_rp","LAURA","oh yeah, good idea! but we should reignite these coals, because i think it's bad that they've burned down right now.",3824.443,3830.074,5.63099999999986,24,255.727224294093,NA,"role_play","LAURA",1,0,0,0
"587","End",8,108,587,"first_half_rp","MARISHA","i think so, too. just to test, yeah, i'm going to do burning hands. how quickly do they catch?",3830.074,3837.447,7.37300000000005,21,170.893801708937,NA,"role_play","MARISHA",1,0,0,0
"588","End",8,108,588,"first_half_rp","MATT","pretty quickly. and you get the sense that they were slowly catching, anyway; there's something about them, the heat that the general room perpetually emanates maintains the fires within. but your flame with the burning hands very quickly elevates and quickens that process, and you watch as the coals now glow to a bright orange-red hue, and you can feel the heat emanating from them.",3837.447,3859.472,22.0250000000001,68,185.244040862655,NA,"role_play","MATT",0,0,0,1
"589","End",8,108,589,"first_half_rp","LAURA","can we turn the circle? does it move?",3859.472,3861.74,2.26799999999957,9,238.095238095283,NA,"role_play","LAURA",1,0,0,0
"590","End",8,108,590,"first_half_rp","MATT","so you go up to the edge and you grab the edge of the golden crest and tug! and it's not moving.",3861.74,3867.775,6.03500000000031,24,238.608119304047,NA,"role_play","MATT",0,0,0,1
"591","End",8,108,591,"first_half_rp","LAURA","gosh darn it! what are we supposed to do?",3867.775,3869.492,1.7170000000001,10,349.4467093768,NA,"role_play","LAURA",1,0,0,0
"592","End",8,108,592,"first_half_rp","MARISHA","are there any inlays?",3869.492,3871.506,2.01399999999967,5,148.957298907671,NA,"role_play","MARISHA",1,0,0,0
"593","End",8,108,593,"first_half_rp","MATT","make an investigation check.",3871.506,3873.784,2.27800000000025,5,131.694468832295,NA,"role_play","MATT",0,0,0,1
"594","End",8,108,594,"first_half_rp","MARISHA","okay. it's not my strong point. goddamn it, that's like the fourth three i've rolled today.",3873.784,3881.345,7.56099999999969,20,158.709165454311,NA,"role_play","MARISHA",1,0,0,0
"595","End",8,108,595,"first_half_rp","SAM","hey, you're inspired.",3881.345,3882.642,1.29700000000003,5,231.303006939086,NA,"role_play","SAM",1,0,0,0
"596","End",8,108,596,"first_half_rp","MATT","you are inspired. up to you.",3882.642,3887.791,5.14900000000034,7,81.5692367449936,NA,"role_play","MATT",0,0,0,1
"597","End",8,108,597,"first_half_rp","MARISHA","better. 12.",3887.791,3892.126,4.33500000000004,3,41.5224913494806,NA,"role_play","MARISHA",1,0,0,0
"598","End",8,108,598,"first_half_rp","MATT","12. it's smooth gold, there's no signs or runes or anything on the side.",3892.126,3897.668,5.54199999999992,17,184.049079754604,NA,"role_play","MATT",0,0,0,1
"599","End",8,108,599,"first_half_rp","TALIESIN","i want to see if there's anything in the holes that were left by the soldiers who left.",3897.668,3901.583,3.91499999999996,20,306.513409961689,NA,"role_play","TALIESIN",1,0,0,0
"600","End",8,108,600,"first_half_rp","MATT","what was that?",3901.583,3902.85,1.26699999999983,4,189.423835832702,NA,"role_play","MATT",0,0,0,1
"601","End",8,108,601,"first_half_rp","TALIESIN","the three suits of armor came out of the wall, so there's now a wall that we haven't seen behind them.",3902.85,3907.948,5.09799999999996,24,282.46371125932,NA,"role_play","TALIESIN",1,0,0,0
"602","End",8,108,602,"first_half_rp","LAURA","maybe it's supposed to be gold.",3907.948,3910.57,2.6220000000003,8,183.066361556043,NA,"role_play","LAURA",1,0,0,0
"603","End",8,108,603,"first_half_rp","MARISHA","platinum is for the trammels.",3910.57,3914.693,4.12300000000005,6,87.3150618481678,NA,"role_play","MARISHA",1,0,0,0
"604","End",8,108,604,"first_half_rp","MATT","okay. so you go ahead and look inside which one?",3914.693,3918.46,3.76699999999983,11,175.205734005848,NA,"role_play","MATT",0,0,0,1
"605","End",8,108,605,"first_half_rp","TALIESIN","i'm going to do all three, but i'll start on the one on the left.",3918.46,3921.34,2.88000000000011,18,374.999999999986,NA,"role_play","TALIESIN",1,0,0,0
"606","End",8,108,606,"first_half_rp","MATT","okay, roll an investigation check.",3921.34,3924.951,3.61099999999988,6,99.6953752423186,NA,"role_play","MATT",0,0,0,1
"607","End",8,108,607,"first_half_rp","TALIESIN","that's investigation check. what did you do? six.",3924.951,3932.522,7.57099999999991,10,79.2497688548418,NA,"role_play","TALIESIN",1,0,0,0
"608","End",8,108,608,"first_half_rp","MARISHA","is that also a three?",3932.522,3933.822,1.30000000000018,6,276.923076923038,NA,"role_play","MARISHA",1,0,0,0
"609","End",8,108,609,"first_half_rp","TALIESIN","yeah, it's also a three.",3933.822,3935.071,1.2489999999998,7,336.269015212225,NA,"role_play","TALIESIN",1,0,0,0
"610","End",8,108,610,"first_half_rp","MATT","you look around inside and the shape is a perfect indentation of the physical form of the three metal warriors. you don't see any signs of anything beyond enough of a cavity to fit them snugly when they're dormant.",3935.071,3946.51,11.4390000000003,42,220.298977183314,NA,"role_play","MATT",0,0,0,1
"611","End",8,108,611,"first_half_rp","LIAM","hey scanlan? you want to use your dragon fisting friend to put that pyramid in the coals and heat it up and then shove it back in?",3946.51,3955.291,8.78099999999995,28,191.32217287325,NA,"role_play","LIAM",1,0,0,0
"612","End",8,108,612,"first_half_rp","SAM","wait, what?",3955.291,3956.799,1.50799999999981,3,119.363395225479,NA,"role_play","SAM",1,0,0,0
"613","End",8,108,613,"first_half_rp","LIAM","do you want to use bigby's hand to take that pyramid, shove it in the coals, heat it up, and see if that makes a difference, shove it back in hot?",3956.799,3965.312,8.51299999999992,33,232.585457535536,NA,"role_play","LIAM",1,0,0,0
"614","End",8,108,614,"first_half_rp","SAM","so you want me to heat the platinum and then shove into the guy's face?",3965.312,3970.177,4.86500000000024,17,209.660842754358,NA,"role_play","SAM",1,0,0,0
"615","End",8,108,615,"first_half_rp","MATT","bigby's hand, by the way, at this time has faded. it only lasts for a minute with concentration. the spell has faded.",3970.177,3977.237,7.05999999999995,24,203.966005665724,NA,"role_play","MATT",0,0,0,1
"616","End",8,108,616,"first_half_rp","LIAM","well, maybe the pyramid heated up could make a difference.",3977.237,3980.101,2.86400000000003,11,230.446927374299,NA,"role_play","LIAM",1,0,0,0
"617","End",8,108,617,"first_half_rp","TRAVIS","all right, i walk up into the coals, take the platinum pyramid out, and i'll drop it down into the coals.",3980.101,3988.852,8.75099999999975,23,157.696263284201,NA,"role_play","TRAVIS",1,0,0,0
"618","End",8,108,618,"first_half_rp","MATT","okay, it's about 15 feet up off the ground.",3988.852,3990.803,1.95100000000002,11,338.288057406454,NA,"role_play","MATT",0,0,0,1
"619","End",8,108,619,"first_half_rp","TRAVIS","shit. can i jump, boots of feral leaping?",3990.803,3994.095,3.29199999999992,9,164.034021871207,NA,"role_play","TRAVIS",1,0,0,0
"620","End",8,108,620,"first_half_rp","MATT","you can. i'd say you leap up and grab the edges of the seal with your giant strength, and wedge your fingers in the side and pull it out and land on the coals. you do take four points of fire damage as the coals begin to burn into your feet and the proximity of the heat. but you back up out of the coal based center now holding the key.",3994.095,4020.571,26.4760000000001,73,165.43284484061,NA,"role_play","MATT",0,0,0,1
"621","End",8,108,621,"first_half_rp","TRAVIS","i drop it in the coals.",4020.571,4021.847,1.27600000000029,7,329.153605015598,NA,"role_play","TRAVIS",1,0,0,0
"622","End",8,108,622,"first_half_rp","MATT","okay, the three pieces come apart as soon as you pull it from the section, so you have the three different pieces right there in your arms.",4021.892,4027.596,5.70400000000018,28,294.530154277691,NA,"role_play","MATT",0,0,0,1
"623","End",8,108,623,"first_half_rp","TALIESIN","so when three pieces go together the part that goes towards the wall",4027.596,4031.534,3.9380000000001,13,198.070086338238,NA,"role_play","TALIESIN",1,0,0,0
"624","End",8,108,624,"first_half_rp","MATT","it's another point. it's like a four-sided pyramid.",4031.534,4034.591,3.05699999999979,12,235.525024533873,NA,"role_play","MATT",0,0,0,1
"625","End",8,108,625,"first_half_rp","TALIESIN","all right, it is a pyramid, so the whole pyramid goes in the wall.",4034.591,4037.106,2.51500000000033,15,357.852882703731,NA,"role_play","TALIESIN",1,0,0,0
"626","End",8,108,626,"first_half_rp","MATT","yeah, it's a flat seal on the outside.",4037.106,4039.439,2.33299999999963,10,257.179597085339,NA,"role_play","MATT",0,0,0,1
"627","End",8,108,627,"first_half_rp","LAURA","i think this needs to be gold, dear.",4039.483,4042.212,2.72899999999981,9,197.874679369746,NA,"role_play","LAURA",1,0,0,0
"628","End",8,108,628,"first_half_rp","TALIESIN","why would it be gold?",4042.212,4043.752,1.53999999999996,6,233.766233766239,NA,"role_play","TALIESIN",1,0,0,0
"629","End",8,108,629,"first_half_rp","LAURA","well, the outside is gold.",4043.752,4045.268,1.51600000000008,6,237.467018469645,NA,"role_play","LAURA",1,0,0,0
"630","End",8,108,630,"first_half_rp","TALIESIN","that's true.",4045.268,4048.353,3.08500000000004,4,77.7957860615874,NA,"role_play","TALIESIN",1,0,0,0
"631","End",8,108,631,"first_half_rp","MARISHA","maybe the platinum is only for the trammels, not the key.",4048.353,4051.512,3.15900000000011,12,227.92022792022,NA,"role_play","MARISHA",1,0,0,0
"632","End",8,108,632,"first_half_rp","LAURA","we can try it. we have gold.",4051.512,4054.249,2.73699999999963,8,175.374497625161,NA,"role_play","LAURA",1,0,0,0
"633","End",8,108,633,"first_half_rp","LIAM","finish my stupid idea, and then we'll move onto the next stupid one.",4054.249,4057.382,3.13300000000027,15,287.264602617275,NA,"role_play","LIAM",1,0,0,0
"634","End",8,108,634,"first_half_rp","LAURA","good call.",4057.382,4058.873,1.49099999999999,3,120.72434607646,NA,"role_play","LAURA",1,0,0,0
"635","End",8,108,635,"first_half_rp","TRAVIS","has the platinum pyramid started to heat up yet?",4058.873,4062.724,3.85100000000011,10,155.803687353929,NA,"role_play","TRAVIS",1,0,0,0
