"","arc","arc_no","episode","turn_number","segment","actor","text","start_turn","end_turn","time_in_sec","word_count","words_per_minute","encounter_count","rp_combat","actor_guest","vox_machina","guest","staff","matt"
"907","End",8,109,907,"second_half_rp","SAM","why would <i>you</i> feel any pressure that way?",9859.344,9864.248,4.90400000000045,11,134.584013050559,NA,"role_play","SAM",1,0,0,0
"908","End",8,109,908,"second_half_rp","LIAM","we've got a long road of history, you and i.",9864.248,9868.393,4.14500000000044,12,173.703256936049,NA,"role_play","LIAM",1,0,0,0
"909","End",8,109,909,"second_half_rp","SAM","we're best buds!",9868.393,9869.925,1.53199999999924,5,195.822454308191,NA,"role_play","SAM",1,0,0,0
"910","End",8,109,910,"second_half_rp","LIAM","best buds! best buds, met at big apple anime fest in new york city all those years ago.",9869.925,9876.404,6.47900000000118,19,175.953079178854,NA,"role_play","LIAM",1,0,0,0
"911","End",8,109,911,"second_half_rp","OFFSCREEN","aww.",9876.404,9880.189,3.78499999999985,2,31.7040951122866,NA,"role_play","OFFSCREEN",0,0,1,0
"912","End",8,109,912,"second_half_rp","SAM","all right, i'll take two.",9880.189,9889.397,9.20800000000054,7,45.612510860119,NA,"role_play","SAM",1,0,0,0
"913","End",8,109,913,"second_half_rp","LAURA","yeah. okay.",9889.397,9890.733,1.33599999999933,3,134.730538922223,NA,"role_play","LAURA",1,0,0,0
"914","End",8,109,914,"second_half_rp","SAM","in marquesian i say, thank you, j'mon sa ord.",9890.733,9892.736,2.00300000000061,11,329.505741387818,NA,"role_play","SAM",1,0,0,0
"915","End",8,109,915,"second_half_rp","MATT","""""be pleased.""""",9892.736,9895.753,3.01699999999983,4,79.5492210805482,NA,"role_play","MATT",0,0,0,1
"916","End",8,109,916,"second_half_rp","LAURA","we are. very.",9895.753,9899.307,3.55400000000009,4,67.5295441755752,NA,"role_play","LAURA",1,0,0,0
"917","End",8,109,917,"second_half_rp","SAM","also, if you don't like the meat man, i can make him go away.",9899.307,9912.393,13.0859999999993,16,73.3608436497057,NA,"role_play","SAM",1,0,0,0
"918","End",8,109,918,"second_half_rp","MATT","""""their business has not encroached upon the order that we maintain. yet.""""",9912.393,9920.642,8.2489999999998,14,101.830524912113,NA,"role_play","MATT",0,0,0,1
"919","End",8,109,919,"second_half_rp","MATT","""""you'd know if it did.""""",9923.46,9925.601,2.14100000000144,8,224.194301728014,NA,"role_play","MATT",0,0,0,1
"920","End",8,109,920,"second_half_rp","LIAM","they know!",9925.601,9927.899,2.29799999999886,3,78.3289817232763,NA,"role_play","LIAM",1,0,0,0
"921","End",8,109,921,"second_half_rp","MATT","the smoldering pupils that they contain within their darkened eyes stare back at you with a curling smile.",9927.899,9940.629,12.7300000000014,19,89.5522388059604,NA,"role_play","MATT",0,0,0,1
"922","End",8,109,922,"second_half_rp","SAM","thank you. let's go. we've got to get through this druidy thing, right?",9940.629,9946.898,6.26899999999841,16,153.134471207568,NA,"role_play","SAM",1,0,0,0
"923","End",8,109,923,"second_half_rp","MATT","ophera backs up and, putting her staff to one side, makes a large oval shape with her fingers as she mutters beneath her breath. you watch as one of the heavy, thick trunks of the nearest tree begins to tear and crack and pull inward. and there you see in a similar fashion to keyleth's casting, though a little more visceral, an opening reveals itself and a doorway is opened, and she goes, """"quick! now!""""",9946.898,9971.405,24.5070000000014,77,188.517566409586,NA,"role_play","MATT",0,0,0,1
"924","End",8,109,924,"second_half_rp","MARISHA","i like your technique!",9971.405,9974.237,2.83199999999852,5,105.932203389886,NA,"role_play","MARISHA",1,0,0,0
"925","End",8,109,925,"second_half_rp","MATT","you all rush through, one after another, flanked at the end by j'mon. and as you all approach the opposite side of this portal, you emerge in a somewhat crowded forest of pine trees. immediately, the northern air is colder, and you see drifting bits of snowfall softly coming through bits of the tree line above you. you turn around just in time to see the doorway close, and in the distance you see other doorways opening around you in different trees, and you watch as dozens upon dozens of wyvern riders and armored soldiers begin to emerge, one cluster after the next.",9974.237,10015.34,41.103000000001,105,153.273483687318,NA,"role_play","MATT",0,0,0,1
"926","End",8,109,926,"second_half_rp","MARISHA","fucking druids are badass!",10015.34,10017.58,2.23999999999978,5,133.928571428584,NA,"role_play","MARISHA",1,0,0,0
"927","End",8,109,927,"second_half_rp","TALIESIN","let's do this.",10017.58,10023.958,6.37800000000061,5,47.0366886171168,NA,"role_play","TALIESIN",1,0,0,0
"928","End",8,109,928,"second_half_rp","MATT","you glance up and can briefly see the top northern crest of where the zenwick mountain pass is. just past the canopy of the forest you're in, because you were sent to the very slim base of the zenwick mountains. you're within a forest. what do you want to do?",10023.958,10047.499,23.5409999999993,53,135.083471390344,NA,"role_play","MATT",0,0,0,1
"929","End",8,109,929,"second_half_rp","LIAM","what does my vec-dar tell me?",10047.499,10050.039,2.54000000000087,8,188.976377952691,NA,"role_play","LIAM",1,0,0,0
"930","End",8,109,930,"second_half_rp","MATT","interestingly enough, southeast of where you are.",10050.039,10055.708,5.66899999999987,8,84.6710178161953,NA,"role_play","MATT",0,0,0,1
"931","End",8,109,931,"second_half_rp","LIAM","shit.",10055.708,10057.155,1.44700000000012,2,82.9302004146443,NA,"role_play","LIAM",1,0,0,0
"932","End",8,109,932,"second_half_rp","LAURA","how close?",10057.155,10059.142,1.98699999999917,3,90.5888273779945,NA,"role_play","LAURA",1,0,0,0
"933","End",8,109,933,"second_half_rp","MATT","i'd say it's probably close to four miles from where you are.",10059.142,10064.708,5.56600000000071,15,161.696011498362,NA,"role_play","MATT",0,0,0,1
"934","End",8,109,934,"second_half_rp","LAURA","oh shit.",10064.708,10072.152,7.44399999999951,3,24.180548092425,NA,"role_play","LAURA",1,0,0,0
"935","End",8,109,935,"second_half_rp","MATT","and slowly moving away.",10072.152,10075.816,3.66400000000067,5,81.877729257627,NA,"role_play","MATT",0,0,0,1
"936","End",8,109,936,"second_half_rp","LIAM","we guessed wrong?",10075.816,10080.457,4.64099999999962,4,51.7129928894677,NA,"role_play","LIAM",1,0,0,0
"937","End",8,109,937,"second_half_rp","MARISHA","four miles.",10080.457,10082.03,1.57300000000032,3,114.431023521909,NA,"role_play","MARISHA",1,0,0,0
"938","End",8,109,938,"second_half_rp","TALIESIN","did we guess wrong?",10082.03,10085.484,3.45399999999972,5,86.8558193399027,NA,"role_play","TALIESIN",1,0,0,0
"939","End",8,109,939,"second_half_rp","LIAM","well, we don't know where this shit is that we're looking for.",10085.484,10089.102,3.61800000000039,15,248.756218905446,NA,"role_play","LIAM",1,0,0,0
"940","End",8,109,940,"second_half_rp","SAM","do we know where these things are?",10089.102,10090.77,1.66799999999967,8,287.76978417272,NA,"role_play","SAM",1,0,0,0
"941","End",8,109,941,"second_half_rp","MATT","they're both northwest of where you are, in the mountain range.",10090.77,10094.274,3.503999999999,13,222.602739726091,NA,"role_play","MATT",0,0,0,1
"942","End",8,109,942,"second_half_rp","MARISHA","he's passed them.",10094.274,10095.89,1.61599999999999,5,185.643564356437,NA,"role_play","MARISHA",1,0,0,0
"943","End",8,109,943,"second_half_rp","LIAM","passed over.",10095.89,10096.871,0.980999999999767,3,183.486238532154,NA,"role_play","LIAM",1,0,0,0
"944","End",8,109,944,"second_half_rp","MATT","he's passed over, it seems.",10096.871,10098.341,1.47000000000116,7,285.714285714059,NA,"role_play","MATT",0,0,0,1
"945","End",8,109,945,"second_half_rp","LIAM","fuck.",10098.341,10099.348,1.00699999999961,2,119.165839126164,NA,"role_play","LIAM",1,0,0,0
"946","End",8,109,946,"second_half_rp","SAM","what do we do?",10099.348,10102.635,3.28700000000026,5,91.2686340127703,NA,"role_play","SAM",1,0,0,0
"947","End",8,109,947,"second_half_rp","MARISHA","if we get a little bit closer, i can do a commune with nature spell and try and figure out some stuff. it's all i've got. i can scry!",10102.635,10112.934,10.2989999999991,32,186.425866589006,NA,"role_play","MARISHA",1,0,0,0
"948","End",8,109,948,"second_half_rp","LAURA","i mean, if he's already passed by the crypts, is there any reason to go there? i don't understand.",10112.934,10120.163,7.22900000000118,22,182.59786969149,NA,"role_play","LAURA",1,0,0,0
"949","End",8,109,949,"second_half_rp","TRAVIS","what direction is vasselheim from us now?",10120.163,10122.95,2.78700000000026,8,172.228202368122,NA,"role_play","TRAVIS",1,0,0,0
"950","End",8,109,950,"second_half_rp","MATT","southeast.",10122.95,10124.349,1.39899999999943,2,85.7755539671542,NA,"role_play","MATT",0,0,0,1
"951","End",8,109,951,"second_half_rp","MARISHA","the way they're heading.",10124.349,10125.798,1.44900000000052,6,248.447204968854,NA,"role_play","MARISHA",1,0,0,0
"952","End",8,109,952,"second_half_rp","TRAVIS","anybody else think we should fucking hop on a big-ass brass dragon and try and catch him before he gets there? what are we going to do here? there's nothing to do here!",10125.798,10140.906,15.1080000000002,36,142.970611596504,NA,"role_play","TRAVIS",1,0,0,0
"953","End",8,109,953,"second_half_rp","LAURA","you want us to go fight vecna right now?",10140.906,10142.845,1.93899999999849,10,309.43785456445,NA,"role_play","LAURA",1,0,0,0
"954","End",8,109,954,"second_half_rp","TRAVIS","either that, or he goes and sacks the city and we're like, """"what does this tree tell me about """"this area?""""",10142.845,10147.969,5.1239999999998,23,269.320843091346,NA,"role_play","TRAVIS",1,0,0,0
"955","End",8,109,955,"second_half_rp","LIAM","quickly, please, someone come up with an argument that counteracts that.",10157.957,10161.949,3.99200000000019,12,180.360721442877,NA,"role_play","LIAM",1,0,0,0
"956","End",8,109,956,"second_half_rp","TALIESIN","we should scry on the dwarven city if we can, really quickly.",10161.949,10164.769,2.81999999999971,13,276.59574468088,NA,"role_play","TALIESIN",1,0,0,0
"957","End",8,109,957,"second_half_rp","SAM","how? we don't know much about it.",10164.769,10166.969,2.19999999999891,9,245.454545454667,NA,"role_play","SAM",1,0,0,0
"958","End",8,109,958,"second_half_rp","TALIESIN","do we know enough to scry?",10166.969,10168.615,1.64600000000064,7,255.164034021772,NA,"role_play","TALIESIN",1,0,0,0
"959","End",8,109,959,"second_half_rp","MARISHA","i can scry on lady briarwood.",10168.615,10174.9,6.28499999999985,7,66.8257756563261,NA,"role_play","MARISHA",1,0,0,0
"960","End",8,109,960,"second_half_rp","LAURA","do it. do it right now.",10174.9,10178.383,3.48300000000017,7,120.585701981045,NA,"role_play","LAURA",1,0,0,0
"961","End",8,109,961,"second_half_rp","MARISHA AND TALIESIN","ooh!",10178.383,10180.779,2.39600000000064,2,50.0834724540768,NA,"role_play","MARISHA AND TALIESIN",1,0,0,0
"962","End",8,109,962,"second_half_rp","MARISHA","yeah, i bet she's with him.",10180.779,10183.471,2.6919999999991,8,178.306092124874,NA,"role_play","MARISHA",1,0,0,0
"963","End",8,109,963,"second_half_rp","TALIESIN","or she's not.",10183.471,10185.542,2.07099999999991,5,144.857556735882,NA,"role_play","TALIESIN",1,0,0,0
"964","End",8,109,964,"second_half_rp","LIAM","we'll learn something.",10185.542,10188.153,2.61100000000079,5,114.898506319383,NA,"role_play","LIAM",1,0,0,0
"965","End",8,109,965,"second_half_rp","LAURA","are you zoning in on the city, or are you zoning in on vecna?",10188.153,10191.154,3.0010000000002,15,299.900033322206,NA,"role_play","LAURA",1,0,0,0
"966","End",8,109,966,"second_half_rp","TALIESIN","we know where vecna is. we just need to see where lady briarwood is.",10191.154,10195.593,4.43900000000031,15,202.748366749254,NA,"role_play","TALIESIN",1,0,0,0
"967","End",8,109,967,"second_half_rp","MARISHA","all right, scrying on briarwood. oh, she rolls.",10195.593,10197.74,2.14699999999903,9,251.513740102583,NA,"role_play","MARISHA",1,0,0,0
"968","End",8,109,968,"second_half_rp","MATT","she rolls. to make a saving roll. spell dc is?",10197.74,10200.031,2.29100000000108,11,288.083806198031,NA,"role_play","MATT",0,0,0,1
"969","End",8,109,969,"second_half_rp","MARISHA","21!",10200.031,10201.858,1.82699999999932,2,65.6814449918144,NA,"role_play","MARISHA",1,0,0,0
"970","End",8,109,970,"second_half_rp","MATT","and that is a 22.",10201.858,10204.384,2.52599999999984,6,142.51781472685,NA,"role_play","MATT",0,0,0,1
"971","End",8,109,971,"second_half_rp","MATT","sorry. as you try and focus, the incantation completes and as your vision begins to extend it is blocked by darkness and sent back into your form. and you realize the scry has failed, the will is too strong.",10208.529,10219.514,10.9849999999988,40,218.479745106989,NA,"role_play","MATT",0,0,0,1
"972","End",8,109,972,"second_half_rp","LAURA","can you scry on that death knight guy that was next to her?",10219.514,10222.479,2.96500000000015,14,283.305227655973,NA,"role_play","LAURA",1,0,0,0
"973","End",8,109,973,"second_half_rp","MARISHA","is he still with her, though?",10222.479,10227.341,4.86200000000099,7,86.3842040312453,NA,"role_play","MARISHA",1,0,0,0
"974","End",8,109,974,"second_half_rp","LAURA","we didn't kill him. we did not kill him. we did not hit him! we did not!",10227.341,10232.726,5.38500000000022,19,211.699164345395,NA,"role_play","LAURA",1,0,0,0
"975","End",8,109,975,"second_half_rp","MARISHA","oh, hi vex. all right. i'll scry on undead douchey.",10236.763,10245.75,8.98699999999917,12,80.1157227105894,NA,"role_play","MARISHA",1,0,0,0
"976","End",8,109,976,"second_half_rp","MATT","as your vision extends from you, it races through the darkness. you see dark clouds ahead. as it fires down, you look instantly within the streets of thar amphala. you see the cobblestone roads now cracked and broken, you see buildings appear to have sustained structural damage. you see roofs are partially collapsed. and walking down the street, strolling with a number of undead soldiers at its back, the black knight you battled before. as it struts through you watch as the towers and buildings shake. and shake again. and your vision returns.",10245.75,10292.831,47.0810000000001,94,119.793547290839,NA,"role_play","MATT",0,0,0,1
"977","End",8,109,977,"second_half_rp","TALIESIN","oh shit.",10292.831,10294.581,1.75,3,102.857142857143,NA,"role_play","TALIESIN",1,0,0,0
"978","End",8,109,978,"second_half_rp","MARISHA","it was shaking oh, is it on the back of some giant turtle or something?",10294.581,10302.501,7.92000000000007,16,121.21212121212,NA,"role_play","MARISHA",1,0,0,0
"979","End",8,109,979,"second_half_rp","TALIESIN","we should stop that from happening.",10305.488,10308.647,3.15900000000147,7,132.953466286738,NA,"role_play","TALIESIN",1,0,0,0
"980","End",8,109,980,"second_half_rp","TRAVIS","yeah, we're super lucky and it's just a turtle.",10308.647,10312.362,3.71499999999833,12,193.808882907221,NA,"role_play","TRAVIS",1,0,0,0
"981","End",8,109,981,"second_half_rp","TRAVIS","how lucky for us!",10320.735,10323.222,2.48699999999917,5,120.627261761198,NA,"role_play","TRAVIS",1,0,0,0
"982","End",8,109,982,"second_half_rp","MARISHA","it'd be so cute.",10323.222,10325.258,2.03600000000006,6,176.817288801567,NA,"role_play","MARISHA",1,0,0,0
"983","End",8,109,983,"second_half_rp","MATT","""""then there is no time to waste."""" you watch as j'mon sa ord's form shifts and giant brass wings extend in a flash of reddish-orange energy. the nearby trees bend and break at the sheer force of the dragon's magnitude, their form expanding to fill the recent vicinity of the forest, and with a large guttural roar, you see before you the brass dragon.",10325.258,10355.897,30.639000000001,70,137.080191912264,NA,"role_play","MATT",0,0,0,1
"984","End",8,109,984,"second_half_rp","SAM","shotgun!",10355.897,10359.33,3.43299999999908,2,34.9548499854448,NA,"role_play","SAM",1,0,0,0
"985","End",8,109,985,"second_half_rp","LAURA","hey, keyleth? while we're flying through the air, is it possible for you to give us a nice inspiring speech?",10359.33,10367.754,8.42400000000089,22,156.69515669514,NA,"role_play","LAURA",1,0,0,0
"986","End",8,109,986,"second_half_rp","MARISHA","oh!",10367.754,10370.554,2.79999999999927,2,42.857142857154,NA,"role_play","MARISHA",1,0,0,0
"987","End",8,109,987,"second_half_rp","LIAM","it's all right. it's just our small group here. no one's watching. you know us.",10374.315,10381.45,7.13500000000022,19,159.775753328657,NA,"role_play","LIAM",1,0,0,0
"988","End",8,109,988,"second_half_rp","MARISHA","yeah. man, inspiring speech. so we're on a brass dragon?",10381.45,10391.913,10.4629999999997,12,68.813915702955,NA,"role_play","MARISHA",1,0,0,0
"989","End",8,109,989,"second_half_rp","MATT","you can do it while you're all climbing on the back. they're waiting patiently for you all to jump onto the back of the dragon form.",10391.913,10401.364,9.45099999999911,29,184.107501851673,NA,"role_play","MATT",0,0,0,1
"990","End",8,109,990,"second_half_rp","SAM","if you need a second to think about it, it's okay. we can start off first and then come back to you.",10401.364,10407.973,6.60900000000038,24,217.884702678154,NA,"role_play","SAM",1,0,0,0
"991","End",8,109,991,"second_half_rp","MARISHA","wait, what?",10407.973,10409.775,1.80199999999968,3,99.8890122086748,NA,"role_play","MARISHA",1,0,0,0
"992","End",8,109,992,"second_half_rp","SAM","do you need a second to compose yourself?",10409.775,10412.08,2.30500000000029,9,234.273318871988,NA,"role_play","SAM",1,0,0,0
"993","End",8,109,993,"second_half_rp","MARISHA","you know, scanlan.",10412.08,10415.677,3.59699999999975,4,66.7222685571355,NA,"role_play","MARISHA",1,0,0,0
"994","End",8,109,994,"second_half_rp","MARISHA","it's funny you should mention that, because i do need a second. i have to think about my words deeply and a long time, and even still, they come out wrong, and you're so witty and quick! and you can come up with things like speeches and songs on the fly in front of thousands of people way quicker than i can. it is not my strength, but i do know my strength, and i know each of your strengths. but not as well of each of you know your strengths as well as you do.",10422.734,10467.092,44.3580000000002,99,133.910455836602,NA,"role_play","MARISHA",1,0,0,0
"995","End",8,109,995,"second_half_rp","SAM","sing it, sister.",10467.092,10473.832,6.73999999999978,4,35.6083086053424,NA,"role_play","SAM",1,0,0,0
"996","End",8,109,996,"second_half_rp","MARISHA","what i'm saying is, you should believe in yourselves the way that i believe in you, scanlan. and the way that you believe in everyone else, scanlan! because you're all strong and unique. and we're probably going to die.",10473.832,10493.826,19.9939999999988,43,129.038711613492,NA,"role_play","MARISHA",1,0,0,0
"997","End",8,109,997,"second_half_rp","MARISHA","okay, let's fly! ahoy!",10498.865,10504.036,5.17100000000028,6,69.6190292013113,NA,"role_play","MARISHA",1,0,0,0
"998","End",8,109,998,"second_half_rp","MATT","with a slow, metallic, crinkling sound of brass dragon scales curling, the large head of j'mon sa ord's dragon form spins around to look you dead in the face, keyleth. the same dark eyes with the smoldering, burning cores for pupils, the mouth opens and you can smell immediately the breath that has a very earthy, singed, burnt-wood scent to it.",10504.036,10546.602,42.5660000000007,65,91.6224216510815,NA,"role_play","MATT",0,0,0,1
"999","End",8,109,999,"second_half_rp","MARISHA","ooh, cedar!",10546.602,10550.638,4.03600000000006,3,44.5986124876109,NA,"role_play","MARISHA",1,0,0,0
"1000","End",8,109,1000,"second_half_rp","MATT","and the voice goes forth. """"very good, keyleth. i found that quite inspiring.""""",10550.638,10560.925,10.2869999999984,14,81.6564596092279,NA,"role_play","MATT",0,0,0,1
"1001","End",8,109,1001,"second_half_rp","MATT","and with that, you guys can all take your 18 temporary hit points.",10572.745,10576.294,3.54899999999907,14,236.686390532606,NA,"role_play","MATT",0,0,0,1
"1002","End",8,109,1002,"second_half_rp","TRAVIS","how much is it?",10576.294,10578.587,2.29299999999967,5,130.832969908436,NA,"role_play","TRAVIS",1,0,0,0
"1003","End",8,109,1003,"second_half_rp","TALIESIN","18 temporary hit points?",10578.587,10580.695,2.10800000000017,5,142.314990512322,NA,"role_play","TALIESIN",1,0,0,0
"1004","End",8,109,1004,"second_half_rp","MATT","and with that note, with one large push of their strong dragon wings, j'mon sa ord raises beyond the treeline up into the sky above, where you can see the clusters of wyvern riders have now also gathered to survey the territory. the first thing you notice, the southward wall, the tall, rocky landscape surrounding the fields of ice, dust, and grasses that fill this pass, you can see the mountain range seems to have suffered an immense amount of damage. a gargantuan fresh rockslide nearly a mile wide, now resting at the base of the northern mountain, you can see swallowing and burying some of the forest land. and as you glance southward into the tordusk pass, you can see mammoth holes in the ground, large craters of broken dirt and rock forced into dunes of mud and shale surrounding their outsides. the scars, pockmarks 200 feet across, carved into the terrain. i'd like everyone to make an intelligence check, please.",10580.695,10654.085,73.3899999999994,165,134.895762365446,NA,"role_play","MATT",0,0,0,1
"1005","End",8,109,1005,"second_half_rp","LAURA","we're making a what, an intelligence check?",10654.085,10658.48,4.39500000000044,9,122.86689419794,NA,"role_play","LAURA",1,0,0,0
"1006","End",8,109,1006,"second_half_rp","MARISHA","can i do a nature check?",10658.48,10660.739,2.25900000000001,7,185.922974767595,NA,"role_play","MARISHA",1,0,0,0
"1007","End",8,109,1007,"second_half_rp","MATT","sure.",10660.739,10661.718,0.979000000001179,2,122.574055158177,NA,"role_play","MATT",0,0,0,1
"1008","End",8,109,1008,"second_half_rp","MARISHA","yeah?",10661.718,10662.641,0.922999999998865,2,130.010834236346,NA,"role_play","MARISHA",1,0,0,0
"1009","End",8,109,1009,"second_half_rp","MATT","vex'ahlia?",10681.496,10683.123,1.62700000000041,3,110.633066994441,NA,"role_play","MATT",0,0,0,1
"1010","End",8,109,1010,"second_half_rp","LAURA","is this an intelligence?",10683.179,10684.711,1.53199999999924,5,195.822454308191,NA,"role_play","LAURA",1,0,0,0
"1011","End",8,109,1011,"second_half_rp","MATT","yes. this is your intelligence modifier.",10684.711,10686.177,1.46600000000035,7,286.493860845771,NA,"role_play","MATT",0,0,0,1
"1012","End",8,109,1012,"second_half_rp","LAURA","21.",10686.177,10687.076,0.898999999999432,2,133.481646273722,NA,"role_play","LAURA",1,0,0,0
"1013","End",8,109,1013,"second_half_rp","MATT","21, good. vax?",10687.076,10688.777,1.70100000000093,4,141.09347442673,NA,"role_play","MATT",0,0,0,1
"1014","End",8,109,1014,"second_half_rp","LIAM","oh, man. eight.",10688.777,10691.166,2.38899999999921,4,100.460443700326,NA,"role_play","LIAM",1,0,0,0
"1015","End",8,109,1015,"second_half_rp","MATT","keyleth?",10691.166,10693.355,2.18900000000031,2,54.8195523069818,NA,"role_play","MATT",0,0,0,1
"1016","End",8,109,1016,"second_half_rp","MARISHA","i am doing a nature check.",10693.355,10695.471,2.11599999999999,7,198.487712665408,NA,"role_play","MARISHA",1,0,0,0
"1017","End",8,109,1017,"second_half_rp","MATT","right, to find out?",10695.471,10696.688,1.21700000000055,5,246.507806080414,NA,"role_play","MATT",0,0,0,1
"1018","End",8,109,1018,"second_half_rp","MARISHA","if it looks like a path has been bore through in a straight line, like it looks like it's going through. 24.",10696.688,10705.71,9.02199999999903,24,159.609842606978,NA,"role_play","MARISHA",1,0,0,0
"1019","End",8,109,1019,"second_half_rp","MATT","24? what you can tell from a nature check is that these are not natural formations in the ground. these are blunt trauma to the ground that has caused these large craters.",10705.71,10719.058,13.3480000000018,33,148.336829487544,NA,"role_play","MATT",0,0,0,1
"1020","End",8,109,1020,"second_half_rp","LAURA","does it look like a walking path? a very large walking path?",10719.058,10722.84,3.78199999999924,13,206.240084611358,NA,"role_play","LAURA",1,0,0,0
"1021","End",8,109,1021,"second_half_rp","MATT","percival?",10722.84,10724.493,1.65300000000025,2,72.5952813067042,NA,"role_play","MATT",0,0,0,1
"1022","End",8,109,1022,"second_half_rp","TALIESIN","natural 20, for 25.",10724.493,10726.232,1.73899999999958,5,172.512938470427,NA,"role_play","TALIESIN",1,0,0,0
"1023","End",8,109,1023,"second_half_rp","MATT","scanlan?",10726.232,10730.33,4.09799999999996,2,29.2825768667646,NA,"role_play","MATT",0,0,0,1
"1024","End",8,109,1024,"second_half_rp","SAM","19 total.",10730.33,10731.454,1.1239999999998,3,160.142348754477,NA,"role_play","SAM",1,0,0,0
"1025","End",8,109,1025,"second_half_rp","MATT","okay. percival. and keyleth. and perc'ahlia. not you grog, sorry.",10731.454,10737.704,6.25,12,115.2,NA,"role_play","MATT",0,0,0,1
"1026","End",8,109,1026,"second_half_rp","TRAVIS","holes!",10737.704,10740.725,3.02100000000064,2,39.721946375364,NA,"role_play","TRAVIS",1,0,0,0
"1027","End",8,109,1027,"second_half_rp","MATT","you do notice, upon immediate view, that these large holes are patterned, staggered about every 350-400 feet. and they do almost present the gait of a walking creature.",10740.725,10764.672,23.9470000000001,30,75.165991564705,NA,"role_play","MATT",0,0,0,1
"1028","End",8,109,1028,"second_half_rp","TRAVIS","hey! you got that big fucking turtle you wanted!",10767.637,10770.045,2.40799999999945,10,249.169435216004,NA,"role_play","TRAVIS",1,0,0,0
"1029","End",8,109,1029,"second_half_rp","MARISHA","it is a giant turtle!",10770.045,10774.776,4.73099999999977,6,76.0938490805364,NA,"role_play","MARISHA",1,0,0,0
