"","arc","arc_no","episode","turn_number","segment","actor","text","start_turn","end_turn","time_in_sec","word_count","words_per_minute","encounter_count","rp_combat","actor_guest","vox_machina","guest","staff","matt"
"1130","End",8,108,1130,"combat","TRAVIS","23 misses?",8654.942,8657.086,2.14400000000023,3,83.9552238805879,2,"combat","TRAVIS",1,0,0,0
"1131","End",8,108,1131,"combat","MATT","yeah. you strike the armor on the side of its body, and the arrow disintegrates on impact. you see bits of it catch flame from the nearby heat.",8657.086,8664.925,7.83899999999994,29,221.967087638731,2,"combat","MATT",0,0,0,1
"1132","End",8,108,1132,"combat","LAURA","oh lord. okay. i thought because he was big, maybe. is he covered head to toe in armor?",8664.925,8673.657,8.73199999999997,19,130.554283096656,2,"combat","LAURA",1,0,0,0
"1133","End",8,108,1133,"combat","MATT","it's made of solid stone with pieces of metal armor around the body.",8673.657,8678.101,4.44400000000132,15,202.520252025142,2,"combat","MATT",0,0,0,1
"1134","End",8,108,1134,"combat","LAURA","great. okay, so i'm going to attack him again but in his neck. oh, that's good. that probably hits. 18 plus 14.",8678.101,8689.297,11.1959999999999,25,133.976420150055,2,"combat","LAURA",1,0,0,0
"1135","End",8,108,1135,"combat","MATT","that'll hit, yeah.",8689.297,8690.454,1.15699999999924,5,259.291270527395,2,"combat","MATT",0,0,0,1
"1136","End",8,108,1136,"combat","LAURA","okay, i didn't want to do the math. do i get sneak attack?",8690.454,8700.635,10.1810000000005,15,88.3999607111243,2,"combat","LAURA",1,0,0,0
"1137","End",8,108,1137,"combat","MATT","he is in base to base with your brother, so yes.",8700.635,8703.224,2.58899999999994,12,278.099652375441,2,"combat","MATT",0,0,0,1
"1138","End",8,108,1138,"combat","LAURA","wait, that's lightning. one extra lightning damage and then nine sneak attack.",8703.224,8712.721,9.49699999999939,14,88.4489838896551,2,"combat","LAURA",1,0,0,0
"1139","End",8,108,1139,"combat","MATT","okay, so the total on that is?",8712.721,8714.398,1.67699999999968,8,286.225402504527,2,"combat","MATT",0,0,0,1
"1140","End",8,108,1140,"combat","LAURA","17 plus nine is 27.",8714.398,8717.95,3.5520000000015,6,101.351351351309,2,"combat","LAURA",1,0,0,0
"1141","End",8,108,1141,"combat","MATT","26, yeah.",8717.95,8721.111,3.16100000000006,3,56.9440050616883,2,"combat","MATT",0,0,0,1
"1142","End",8,108,1142,"combat","LAURA","plus one lightning damage, so it's 27.",8721.111,8723.541,2.42999999999847,9,222.222222222362,2,"combat","LAURA",1,0,0,0
"1143","End",8,108,1143,"combat","MATT","right, there you go. all right, cool. the first arrow shatters, the second one you manage to strike and it embeds itself in the stone, and sticking out. it's hard to see if it had made much of an impact. that ends your turn, and that brings us to scanlan.",8723.541,8736.904,13.3630000000012,52,233.480505874409,2,"combat","MATT",0,0,0,1
"1144","End",8,108,1144,"combat","SAM","me? oh jesus. this thing's big and scary.",8736.904,8740.766,3.86199999999917,10,155.359917141411,2,"combat","SAM",1,0,0,0
"1145","End",8,108,1145,"combat","MATT","you're on the top of the staircase next to the water elemental and grog, who's currently on the ground screaming that he's blind. the entity is about 15 feet away from you. you're just out of range of its blade, and it's an intimidating thing to have that close to you.",8740.766,8754.378,13.612000000001,57,251.248898031131,2,"combat","MATT",0,0,0,1
"1146","End",8,108,1146,"combat","SAM","yeah! of course it is! i'm not dumb. super intimidating! so how far is he from me?",8754.378,8764.092,9.71399999999994,19,117.356392835084,2,"combat","SAM",1,0,0,0
"1147","End",8,108,1147,"combat","MATT","he's about 16 feet from you. you're just out of range of the blade. well, no. actually, because it did hit you, so on the edge of there, you are within 15 feet of him, yeah.",8764.092,8777.157,13.0649999999987,39,179.104477611958,2,"combat","MATT",0,0,0,1
"1148","End",8,108,1148,"combat","SAM","okay, not knowing what to do, i will. i'm looking at my spells; i've got nothing. i will blast him with a lightning bolt, a level three lightning bolt.",8777.157,8792.102,14.9450000000015,32,128.471060555357,2,"combat","SAM",1,0,0,0
"1149","End",8,108,1149,"combat","MATT","level three lightning bolt. okay, so roll 8d6 points of damage.",8792.102,8795.614,3.51199999999881,12,205.01138952171,2,"combat","MATT",0,0,0,1
"1150","End",8,108,1150,"combat","SAM","you know what, i'll do level four, so 9d6, i suppose.",8795.614,8799.775,4.16100000000006,13,187.454938716652,2,"combat","SAM",1,0,0,0
"1151","End",8,108,1151,"combat","MATT","all righty, so that is a natural 20. so that's advantage on the saving throw. however, its dexterity bonus is nothing. it's a straight 20. your spell dc?",8799.775,8813.986,14.2110000000011,31,130.884526071343,2,"combat","MATT",0,0,0,1
"1152","End",8,108,1152,"combat","SAM","22.",8813.986,8815.289,1.30299999999988,2,92.0951650038455,2,"combat","SAM",1,0,0,0
"1153","End",8,108,1153,"combat","MATT","22, so it does not make the save.",8815.289,8816.957,1.66799999999967,9,323.74100719431,2,"combat","MATT",0,0,0,1
"1154","End",8,108,1154,"combat","SAM","so it's 34 points of damage.",8816.957,8819.776,2.81899999999951,8,170.273146505883,2,"combat","SAM",1,0,0,0
"1155","End",8,108,1155,"combat","MATT","34 points of lightning damage to it. the bolt hits it and seems to arc through, and its faceless head slowly shifts to face you.",8819.776,8831.713,11.9369999999999,26,130.686102035688,2,"combat","MATT",0,0,0,1
"1156","End",8,108,1156,"combat","SAM","jesus. i'm within melee range of him, so if i move i will get hit, yes?",8831.713,8839.778,8.06500000000051,18,133.911965282075,2,"combat","SAM",1,0,0,0
"1157","End",8,108,1157,"combat","MATT","if you move out of his melee range, you will, yes.",8839.778,8841.688,1.90999999999985,12,376.963350785369,2,"combat","MATT",0,0,0,1
"1158","End",8,108,1158,"combat","SAM","okay.",8841.688,8842.714,1.02599999999984,2,116.959064327504,2,"combat","SAM",1,0,0,0
"1159","End",8,108,1159,"combat","MATT","you'll get attacked. doesn't mean you'll get hit.",8842.714,8845.448,2.73400000000038,12,263.350402340856,2,"combat","MATT",0,0,0,1
"1160","End",8,108,1160,"combat","SAM","grog, you're okay, right?",8845.448,8849.124,3.67599999999948,6,97.9325353645406,2,"combat","SAM",1,0,0,0
"1161","End",8,108,1161,"combat","TRAVIS","i'm blind! it's very hot!",8849.124,8857.128,8.00400000000081,8,59.9700149924976,2,"combat","TRAVIS",1,0,0,0
"1162","End",8,108,1162,"combat","SAM","what?",8857.128,8858.174,1.04600000000028,2,114.72275334605,2,"combat","SAM",1,0,0,0
"1163","End",8,108,1163,"combat","TRAVIS","it's very hot! on the ground, and i'm blind!",8858.174,8860.947,2.77299999999923,12,259.64659213855,2,"combat","TRAVIS",1,0,0,0
"1164","End",8,108,1164,"combat","SAM","i don't know what to do about you, i'm sorry! i'll inspire you, i guess, right? because you don't need health?",8860.947,8869.262,8.31500000000051,26,187.612748045689,2,"combat","SAM",1,0,0,0
"1165","End",8,108,1165,"combat","TRAVIS","yeah, great, thanks!",8869.262,8870.818,1.55599999999868,4,154.241645244347,2,"combat","TRAVIS",1,0,0,0
"1166","End",8,108,1166,"combat","SAM","sorry! all right, i'll inspire him, i suppose.",8870.818,8877.72,6.90200000000004,10,86.9313242538389,2,"combat","SAM",1,0,0,0
"1167","End",8,108,1167,"combat","MATT","okay.",8877.72,8878.868,1.14800000000105,2,104.529616724643,2,"combat","MATT",0,0,0,1
"1168","End",8,108,1168,"combat","SAM","sorry, grog.",8878.868,8881.776,2.90799999999945,3,61.8982118294478,2,"combat","SAM",1,0,0,0
"1169","End",8,108,1169,"combat","TRAVIS","what do you sing?",8881.776,8883.686,1.90999999999985,5,157.068062827237,2,"combat","TRAVIS",1,0,0,0
"1170","End",8,108,1170,"combat","SAM","oh, sorry. i will pick up my flute and i will sing: you like it when my flute goes, baby make your booty glow, scanlan know you want to show my song, song, song, song, song.",8883.686,8898.156,14.4700000000012,37,153.420870767092,2,"combat","SAM",1,0,0,0
"1171","End",8,108,1171,"combat","TRAVIS","is that sisq?!",8898.156,8900.028,1.87199999999939,4,128.20512820517,2,"combat","TRAVIS",1,0,0,0
"1172","End",8,108,1172,"combat","MATT","take your d12. all righty. that's your bonus, your action, and are you going to stay where you are or are you going to move?",8900.028,8908.941,8.91300000000047,27,181.756984180401,2,"combat","MATT",0,0,0,1
"1173","End",8,108,1173,"combat","SAM","yeah, i'm going to stay where i am.",8908.941,8910.381,1.43999999999869,10,416.666666667046,2,"combat","SAM",1,0,0,0
"1174","End",8,108,1174,"combat","MATT","okay. ending that turn, it comes to the elemental. actually, no. at the end of scanlan's turn, it's going to go ahead and use a legendary action to make a rune blade strike against vax, who's right in front of him. that is a 22 to hit.",8910.381,8925.284,14.9030000000002,51,205.327786351738,2,"combat","MATT",0,0,0,1
"1175","End",8,108,1175,"combat","LIAM","and this is a straight-up attack. yeah, i believe that hits. yes, it does.",8925.284,8929.049,3.76500000000124,16,254.980079681191,2,"combat","LIAM",1,0,0,0
"1176","End",8,108,1176,"combat","MATT","okay.",8929.049,8930.142,1.09299999999894,2,109.789569990958,2,"combat","MATT",0,0,0,1
"1177","End",8,108,1177,"combat","LIAM","wait. i'll use my last luck of the day on him, and he has to reroll.",8930.142,8935.979,5.83699999999953,18,185.026554737037,2,"combat","LIAM",1,0,0,0
"1178","End",8,108,1178,"combat","MATT","okay.",8935.979,8936.935,0.956000000000131,2,125.523012552284,2,"combat","MATT",0,0,0,1
"1179","End",8,108,1179,"combat","MARISHA","wait.",8936.935,8937.82,0.885000000000218,2,135.59322033895,2,"combat","MARISHA",1,0,0,0
"1180","End",8,108,1180,"combat","LIAM","wait.",8937.82,8938.836,1.01599999999962,2,118.110236220516,2,"combat","LIAM",1,0,0,0
"1181","End",8,108,1181,"combat","MATT","that is a 19.",8938.836,8941.674,2.83800000000156,5,105.708245243071,2,"combat","MATT",0,0,0,1
"1182","End",8,108,1182,"combat","LIAM AND MATT","no.",8941.674,8942.848,1.17399999999907,2,102.214650766691,2,"combat","LIAM AND MATT",1,0,0,0
"1183","End",8,108,1183,"combat","TRAVIS","well done!",8944.781,8946.298,1.51699999999983,3,118.655240606474,2,"combat","TRAVIS",1,0,0,0
"1184","End",8,108,1184,"combat","MATT","so as the blade arcs overhead towards you, you barely duck out of the way. it slams on the ground, sending shards of stone and metal up in the air around you. you feel it rain over your shoulder and the back of your head as you slowly pull away from it. all righty, now it is the elemental's turn.",8946.298,8964.68,18.3819999999996,62,202.371885540207,2,"combat","MATT",0,0,0,1
"1185","End",8,108,1185,"combat","MARISHA","okay, it's going to move over to him. and he's bigger than large, so he's going to do a multiattack. he's going to do two slam attacks. plus seven to hit. one's a natural one; the other's a natural 18. so one hits. 2d8 plus four bludgeoning damage.",8964.68,8994.059,29.378999999999,55,112.325130195041,2,"combat","MARISHA",1,0,0,0
"1186","End",8,108,1186,"combat","MATT","what's the attack? 18 plus?",8994.059,8995.894,1.83500000000095,7,228.882833787348,2,"combat","MATT",0,0,0,1
"1187","End",8,108,1187,"combat","MARISHA","18 plus seven.",8995.894,8998.159,2.26499999999942,4,105.960264900689,2,"combat","MARISHA",1,0,0,0
"1188","End",8,108,1188,"combat","MATT","okay, so it would be 25? that hits. are the creature's attacks considered magical?",8998.159,9004.411,6.25200000000041,16,153.550863723598,2,"combat","MATT",0,0,0,1
"1189","End",8,108,1189,"combat","MARISHA","they're two bludgeoning attacks.",9004.411,9008.675,4.26399999999921,6,84.4277673546122,2,"combat","MARISHA",1,0,0,0
"1190","End",8,108,1190,"combat","MATT","nowhere on there does it say it does magical damage?",9008.675,9012.27,3.59500000000116,11,183.588317107034,2,"combat","MATT",0,0,0,1
"1191","End",8,108,1191,"combat","MARISHA","it just says bludgeoning damage.",9012.27,9016.227,3.95700000000033,6,90.9780136466944,2,"combat","MARISHA",1,0,0,0
"1192","End",8,108,1192,"combat","MATT","okay. so as the elemental swings out both fists against it, no effect. none of its attacks seem to have any effect or impact on the creature. it's like bludgeoning the side of a mountain.",9016.227,9029.283,13.0559999999987,37,170.0367647059,2,"combat","MATT",0,0,0,1
"1193","End",8,108,1193,"combat","TALIESIN","okay. good to know.",9029.283,9031.688,2.40500000000065,5,124.740124740091,2,"combat","TALIESIN",1,0,0,0
"1194","End",8,108,1194,"combat","MARISHA","and he doesn't seem to be distracted or give two shits about him.",9031.688,9035.077,3.38899999999921,15,265.565063440604,2,"combat","MARISHA",1,0,0,0
"1195","End",8,108,1195,"combat","MATT","not at the moment, no.",9035.077,9036.255,1.17799999999988,6,305.602716468621,2,"combat","MATT",0,0,0,1
"1196","End",8,108,1196,"combat","MARISHA","okay. cool.",9036.255,9040.354,4.09900000000016,3,43.9131495486687,2,"combat","MARISHA",1,0,0,0
"1197","End",8,108,1197,"combat","TALIESIN","there's a lot of fires to put out, i guess.",9040.354,9042.047,1.69300000000112,12,425.280567040475,2,"combat","TALIESIN",1,0,0,0
"1198","End",8,108,1198,"combat","MARISHA","yeah. you know, i'll keep him on standby in case people catch on fire.",9042.047,9045.497,3.44999999999891,16,278.260869565305,2,"combat","MARISHA",1,0,0,0
"1199","End",8,108,1199,"combat","MATT","okay. that ends the elemental's turn, then? grog and keyleth, you're up.",9045.497,9051.715,6.21800000000076,15,144.741074300401,2,"combat","MATT",0,0,0,1
"1200","End",8,108,1200,"combat","MARISHA","what did you find out?",9051.715,9055.532,3.8169999999991,6,94.3149069950446,2,"combat","MARISHA",1,0,0,0
"1201","End",8,108,1201,"combat","TRAVIS","how about you go first?",9055.532,9057.671,2.13900000000103,6,168.302945301462,2,"combat","TRAVIS",1,0,0,0
"1202","End",8,108,1202,"combat","MARISHA","okay. i'm going to do 9th-level shapechange and take a cue from scanlan and turn into a planetar.",9057.671,9068.421,10.75,21,117.209302325581,2,"combat","MARISHA",1,0,0,0
"1203","End",8,108,1203,"combat","LIAM","ooh! do you have a big dick, too?",9068.421,9072.102,3.68100000000049,9,146.699266503648,2,"combat","LIAM",1,0,0,0
"1204","End",8,108,1204,"combat","SAM","you can do that?",9072.102,9073.486,1.38400000000001,5,216.763005780345,2,"combat","SAM",1,0,0,0
"1205","End",8,108,1205,"combat","MARISHA","yes i can. with shapechange. right? it is a challenge rating that i can do, right? planetars?",9073.486,9081.851,8.36499999999978,18,129.109384339513,2,"combat","MARISHA",1,0,0,0
"1206","End",8,108,1206,"combat","MATT","yeah, you can.",9081.851,9083.651,1.79999999999927,4,133.333333333387,2,"combat","MATT",0,0,0,1
"1207","End",8,108,1207,"combat","MARISHA","okay.",9083.651,9084.699,1.04800000000068,2,114.503816793818,2,"combat","MARISHA",1,0,0,0
"1208","End",8,108,1208,"combat","MATT","you lose concentration on the elemental.",9084.699,9086.285,1.58599999999933,7,264.817150063163,2,"combat","MATT",0,0,0,1
"1209","End",8,108,1209,"combat","MARISHA","that's fine.",9086.285,9087.166,0.880999999999403,4,272.417707151149,2,"combat","MARISHA",1,0,0,0
"1210","End",8,108,1210,"combat","TALIESIN","not like he was really",9087.166,9088.751,1.58500000000095,5,189.274447949414,2,"combat","TALIESIN",1,0,0,0
"1211","End",8,108,1211,"combat","MARISHA","doing much.",9088.751,9089.952,1.20099999999911,3,149.875104080044,2,"combat","MARISHA",1,0,0,0
"1212","End",8,108,1212,"combat","MATT","but the elemental stays and is now hostile to you.",9089.952,9091.881,1.92900000000009,11,342.146189735599,2,"combat","MATT",0,0,0,1
"1213","End",8,108,1213,"combat","MARISHA","right. can't dissipate him or anything?",9091.881,9097.881,6,8,80,2,"combat","MARISHA",1,0,0,0
"1214","End",8,108,1214,"combat","MATT","i forgot your figure again! i'm the worst!",9097.881,9102.242,4.36100000000079,10,137.58312313687,2,"combat","MATT",0,0,0,1
"1215","End",8,108,1215,"combat","TALIESIN","i was going to say, can you dissipate it?",9102.242,9110.596,8.35399999999936,10,71.8218817333069,2,"combat","TALIESIN",1,0,0,0
"1216","End",8,108,1216,"combat","MARISHA","not really.",9110.596,9111.832,1.23600000000079,3,145.631067961072,2,"combat","MARISHA",1,0,0,0
"1217","End",8,108,1217,"combat","TALIESIN","oh. that's okay.",9111.832,9112.852,1.02000000000044,5,294.117647058698,2,"combat","TALIESIN",1,0,0,0
"1218","End",8,108,1218,"combat","MATT","so the planetar size is large. we'll say for the purposes once again of this week, we'll use doty as the planetar, so there you are.",9112.852,9122.743,9.89099999999962,29,175.917500758272,2,"combat","MATT",0,0,0,1
"1219","End",8,108,1219,"combat","LAURA","but he says it in swedish.",9122.743,9124.924,2.18100000000049,7,192.572214580424,2,"combat","LAURA",1,0,0,0
"1220","End",8,108,1220,"combat","MARISHA AND TALIESIN","dooty.",9124.924,9128.836,3.91199999999844,2,30.6748466257791,2,"combat","MARISHA AND TALIESIN",1,0,0,0
"1221","End",8,108,1221,"combat","MATT","your wings extend. you are now in the planetar form.",9128.836,9131.922,3.08600000000115,11,213.869086195643,2,"combat","MATT",0,0,0,1
"1222","End",8,108,1222,"combat","MARISHA","okay. i'm going to go up to grog and do healing",9131.922,9138.254,6.33200000000033,12,113.708149084012,2,"combat","MARISHA",1,0,0,0
"1223","End",8,108,1223,"combat","MATT","well, your action is to cast the spell.",9138.254,9142.073,3.81899999999951,9,141.398271798919,2,"combat","MATT",0,0,0,1
"1224","End",8,108,1224,"combat","MARISHA","so i can't do anything else?",9142.073,9145.752,3.67900000000009,8,130.470236477301,2,"combat","MARISHA",1,0,0,0
"1225","End",8,108,1225,"combat","MATT","no, shapechange takes an action to make the transformation. next turn you can take your action.",9145.752,9151.301,5.54899999999907,17,183.816903946688,2,"combat","MATT",0,0,0,1
"1226","End",8,108,1226,"combat","LAURA","it's okay. that's great. grog definitely won't fall in the lava on his turn.",9151.301,9156.32,5.01900000000023,18,215.182307232506,2,"combat","LAURA",1,0,0,0
"1227","End",8,108,1227,"combat","MARISHA","i was going to say, can i at least go up to him and grab onto grog's loincloth to make sure his ass doesn't tumble into the lava?",9156.32,9163.806,7.48600000000079,31,248.463799091612,2,"combat","MARISHA",1,0,0,0
"1228","End",8,108,1228,"combat","MATT","you could certainly try.",9163.806,9165.208,1.40200000000004,5,213.980028530664,2,"combat","MATT",0,0,0,1
"1229","End",8,108,1229,"combat","TALIESIN","you could kind of do that.",9165.208,9167.744,2.53600000000006,7,165.615141955832,2,"combat","TALIESIN",1,0,0,0
"1230","End",8,108,1230,"combat","SAM","loin-grab.",9167.744,9169.105,1.36099999999897,3,132.255694342496,2,"combat","SAM",1,0,0,0
"1231","End",8,108,1231,"combat","MATT","so we'll say for the purposes of this, you glide over, and you're now flying up next to grog on the edge of the platform. there you go.",9169.105,9179.437,10.3320000000003,31,180.023228803711,2,"combat","MATT",0,0,0,1
"1232","End",8,108,1232,"combat","LAURA","to keep him from wandering off.",9179.437,9183.796,4.35900000000038,7,96.3523743977893,2,"combat","LAURA",1,0,0,0
"1233","End",8,108,1233,"combat","MARISHA","yeah.",9183.796,9184.814,1.01800000000003,2,117.878192534378,2,"combat","MARISHA",1,0,0,0
"1234","End",8,108,1234,"combat","MATT","okay. that ends your turn. grog?",9184.814,9187.438,2.6239999999998,7,160.060975609769,2,"combat","MATT",0,0,0,1
"1235","End",8,108,1235,"combat","TRAVIS","cool. can i use my action to get up from being prone? half my movement, sorry. onto one knee. in my mind, because i can't see! and can i hold my action until i can see again or until it's my turn?",9187.438,9206.147,18.7090000000007,45,144.315570046496,2,"combat","TRAVIS",1,0,0,0
"1236","End",8,108,1236,"combat","MATT","it's your turn.",9206.147,9207.421,1.27399999999943,5,235.478806907483,2,"combat","MATT",0,0,0,1
"1237","End",8,108,1237,"combat","TRAVIS","until i can see again.",9207.421,9209.449,2.02800000000025,6,177.514792899387,2,"combat","TRAVIS",1,0,0,0
"1238","End",8,108,1238,"combat","TALIESIN","you don't get to save against this, does he?",9209.449,9214.001,4.55199999999968,11,144.991212653789,2,"combat","TALIESIN",1,0,0,0
"1239","End",8,108,1239,"combat","MATT","no. nope. all right. so that ends grog's turn, holding his action.",9214.001,9218.241,4.23999999999978,14,198.11320754718,2,"combat","MATT",0,0,0,1
"1240","End",8,108,1240,"combat","TRAVIS","crouched, so both hands are on the ground.",9218.241,9221.167,2.92599999999948,9,184.552289815481,2,"combat","TRAVIS",1,0,0,0
"1241","End",8,108,1241,"combat","MATT","okay. at the end of your turn, it's going to use another legendary action to take another swing at the slippery little rogue paladin on the ground that it can't seem to hit. natural one. jesus christ. okay. that'll be the end of that luck.",9221.167,9240.075,18.9080000000013,49,155.48973979267,2,"combat","MATT",0,0,0,1
"1242","End",8,108,1242,"combat","LIAM","that demigod does not exist in this universe.",9240.075,9242.905,2.82999999999993,9,190.812720848061,2,"combat","LIAM",1,0,0,0
"1243","End",8,108,1243,"combat","MATT","percival, your turn.",9242.905,9244.395,1.48999999999978,4,161.073825503379,2,"combat","MATT",0,0,0,1
"1244","End",8,108,1244,"combat","TALIESIN","so first thing i'm going to do is get a quick little heal bonus going, because why not. let's do a heal. so that's 14 points up, so i'm 156. a little bit better, and that's my heal. i'm noticing that this thing's only taking magic damage. the hammer it dropped is underneath the planetar right now, right?",9244.395,9277.156,32.7610000000004,66,120.875431152894,2,"combat","TALIESIN",1,0,0,0
"1245","End",8,108,1245,"combat","MATT","it is currently dangling off the side, along with other series of tools: tongs and other smaller blacksmithing accoutrements.",9277.156,9285.658,8.50199999999859,20,141.143260409339,2,"combat","MATT",0,0,0,1
"1246","End",8,108,1246,"combat","TALIESIN","i'm going to run in that direction.",9285.658,9288.445,2.78700000000026,9,193.756727664137,2,"combat","TALIESIN",1,0,0,0
"1247","End",8,108,1247,"combat","MATT","okay. five, ten, 15, 20. another step, and you're starting to hit the molten metal and rock.",9288.445,9298.253,9.8080000000009,19,116.231647634573,2,"combat","MATT",0,0,0,1
"1248","End",8,108,1248,"combat","TALIESIN","molten metal and rock? i can't jump that, can i?",9298.253,9301.441,3.1880000000001,12,225.846925972389,2,"combat","TALIESIN",1,0,0,0
"1249","End",8,108,1249,"combat","MATT","you can try, yeah. make an athletics check.",9301.441,9303.34,1.89899999999943,9,284.360189573545,2,"combat","MATT",0,0,0,1
"1250","End",8,108,1250,"combat","TALIESIN","not an acrobatics check, i take it?",9303.34,9308.703,5.36299999999937,8,89.5021443222182,2,"combat","TALIESIN",1,0,0,0
"1251","End",8,108,1251,"combat","MATT","not for the leap.",9308.703,9309.937,1.23400000000038,5,243.111831442389,2,"combat","MATT",0,0,0,1
"1252","End",8,108,1252,"combat","TALIESIN","but there are chains that i can reach there?",9309.937,9314.66,4.72299999999996,10,127.03789964006,2,"combat","TALIESIN",1,0,0,0
"1253","End",8,108,1253,"combat","MATT","if you're leaping towards the chains, you can attempt to grab it, yeah.",9314.66,9320.223,5.5630000000001,15,161.78321049793,2,"combat","MATT",0,0,0,1
"1254","End",8,108,1254,"combat","TALIESIN","well, i'm going to attempt to grab the hammer.",9320.223,9325.341,5.11800000000039,11,128.956623681116,2,"combat","TALIESIN",1,0,0,0
"1255","End",8,108,1255,"combat","MATT","okay. are you using it to swing, or are you just trying to grab and hold on?",9325.341,9328.533,3.1919999999991,18,338.34586466175,2,"combat","MATT",0,0,0,1
"1256","End",8,108,1256,"combat","TALIESIN","if it's available for a swing, i'll try for a swing.",9328.533,9331.084,2.5510000000013,14,329.282634260907,2,"combat","TALIESIN",1,0,0,0
"1257","End",8,108,1257,"combat","MATT","okay, i'll give you advantage if you're going for the chain, then, as you're swinging across it. go for it.",9331.084,9336.02,4.93599999999969,24,291.734197730974,2,"combat","MATT",0,0,0,1
"1258","End",8,108,1258,"combat","TALIESIN","roll with advantage? athletics?",9336.02,9339.109,3.08899999999994,5,97.1188086759487,2,"combat","TALIESIN",1,0,0,0
"1259","End",8,108,1259,"combat","MATT","athletics.",9339.109,9340.121,1.01199999999881,2,118.577075098954,2,"combat","MATT",0,0,0,1
"1260","End",8,108,1260,"combat","MARISHA","please don't fucking fall in lava.",9340.121,9342.302,2.18100000000049,8,220.082530949056,2,"combat","MARISHA",1,0,0,0
"1261","End",8,108,1261,"combat","TALIESIN","natural 20.",9342.302,9343.587,1.28499999999985,3,140.077821011689,2,"combat","TALIESIN",1,0,0,0
"1262","End",8,108,1262,"combat","MATT","percival runs, swings across, and i'll move this a bit.",9346.031,9349.112,3.08099999999831,12,233.690360272767,2,"combat","MATT",0,0,0,1
"1263","End",8,108,1263,"combat","LIAM","oh, the golem is dead.",9349.112,9351.181,2.06900000000132,6,173.997100048221,2,"combat","LIAM",1,0,0,0
"1264","End",8,108,1264,"combat","MATT","percival barely makes it across. if you let go of the chain, you'll land. if you hold onto it you'll dangle and swing in the center.",9351.181,9362.597,11.4159999999993,29,152.417659425378,2,"combat","MATT",0,0,0,1
"1265","End",8,108,1265,"combat","TALIESIN","this is the hammer chain?",9362.597,9363.912,1.31500000000051,6,273.764258555027,2,"combat","TALIESIN",1,0,0,0
"1266","End",8,108,1266,"combat","MATT","yeah.",9363.912,9364.882,0.969999999999345,2,123.711340206269,2,"combat","MATT",0,0,0,1
"1267","End",8,108,1267,"combat","TALIESIN","so am i touching the hammer right now? but it's not a magic hammer, it's just a really nice hammer.",9364.882,9369.827,4.94499999999971,23,279.069767441877,2,"combat","TALIESIN",1,0,0,0
