"","arc","arc_no","episode","turn_number","segment","actor","text","start_turn","end_turn","time_in_sec","word_count","words_per_minute","encounter_count","rp_combat","actor_guest","vox_machina","guest","staff","matt"
"1327","Briarwoods",3,26,1327,"combat","MATT","you manage to just, you tumble backward a little bit. you grab a couple of feathers and get yourself just on the side underneath where the wing meets part of the upper torso, where the wind resistance is the least amount, and you manage to hold on. you are now clutching the back of this giant bird. that's your turn.",10512.22,10529.521,17.3010000000013,62,215.016473036225,1,"combat","MATT",0,0,0,1
"1328","Briarwoods",3,26,1328,"combat","SAM","okay. as my bonus action, i will inspire keyleth. right? she's right next to me?",10529.521,10535.85,6.32899999999972,17,161.162900932224,1,"combat","SAM",1,0,0,0
"1329","Briarwoods",3,26,1329,"combat","MARISHA","scanlan? what the shit?",10535.85,10538.994,3.14400000000023,5,95.4198473282372,1,"combat","MARISHA",1,0,0,0
"1330","Briarwoods",3,26,1330,"combat","SAM","the way you kick so much ass like nobody else. the way you do animal things gets me overwhelmed. you don't know. you don't know you're powerful. oh. that's what makes you powerful.",10538.994,10557.093,18.0990000000002,38,125.973810707773,1,"combat","SAM",1,0,0,0
"1331","Briarwoods",3,26,1331,"combat","MATT","due to the wind, you don't hear the last line. it's too loud around it. however, you can take a d10 inspiration dice.",10557.093,10563.647,6.55400000000009,26,238.022581629536,1,"combat","MATT",0,0,0,1
"1332","Briarwoods",3,26,1332,"combat","LAURA AND MARISHA","yay!",10563.647,10565.203,1.55599999999868,2,77.1208226221736,1,"combat","LAURA AND MARISHA",1,0,0,0
"1333","Briarwoods",3,26,1333,"combat","LIAM","what a heroic move! amazing!",10565.203,10568.631,3.42799999999988,6,105.017502917156,1,"combat","LIAM",1,0,0,0
"1334","Briarwoods",3,26,1334,"combat","MATT","which for the record, this currently right now looks like you see the cow clutched below, and currently there is a cow holding onto this giant bird.",10568.631,10578.969,10.3379999999997,28,162.507254788164,1,"combat","MATT",0,0,0,1
"1335","Briarwoods",3,26,1335,"combat","SAM","it lasts eight hours.",10578.969,10580.544,1.57500000000073,5,190.476190476102,1,"combat","SAM",1,0,0,0
"1336","Briarwoods",3,26,1336,"combat","MATT","this singing tiny cow. you artists out there, have fun with this scene.",10580.544,10588.438,7.89400000000023,14,106.409931593612,1,"combat","MATT",0,0,0,1
"1337","Briarwoods",3,26,1337,"combat","MATT","all right. that ends your turn. tiberius.",10588.438,10591.109,2.67100000000028,8,179.707974541352,1,"combat","MATT",0,0,0,1
"1338","Briarwoods",3,26,1338,"combat","ORION","good. i drop stoneskin. at 5th-level, i go myself, one, two, three i cast fly on all of us. fly, you fools! and go right after them.",10591.109,10605.346,14.2369999999992,29,122.216759148704,1,"combat","ORION",1,0,0,0
"1339","Briarwoods",3,26,1339,"combat","MATT","all right. all of you guys, at that point you see tiberius and you all take off after him.",10605.346,10609.433,4.08700000000135,20,293.613897724395,1,"combat","MATT",0,0,0,1
"1340","Briarwoods",3,26,1340,"combat","LIAM","the cows take off into the night sky.",10609.433,10613.845,4.41199999999844,9,122.393472348185,1,"combat","LIAM",1,0,0,0
"1341","Briarwoods",3,26,1341,"combat","ORION","fly, vox machina! moo!",10613.845,10618.274,4.42900000000009,5,67.7353804470522,1,"combat","ORION",1,0,0,0
"1342","Briarwoods",3,26,1342,"combat","MARISHA","vox ""moo-china!""",10618.274,10624.128,5.85400000000118,4,40.9976084728308,1,"combat","MARISHA",1,0,0,0
"1343","Briarwoods",3,26,1343,"combat","MATT","a squadron of weirdly-sized, flying cows lit by moonlight, chasing after a giant bird. i love dungeons and dragons.",10624.128,10636.104,11.9759999999987,21,105.210420841694,1,"combat","MATT",0,0,0,1
"1344","Briarwoods",3,26,1344,"combat","TRAVIS","what is this?",10636.104,10637.693,1.58899999999994,4,151.038388923857,1,"combat","TRAVIS",1,0,0,0
"1345","Briarwoods",3,26,1345,"combat","MATT","what's the flying speed on fly?",10637.693,10639.626,1.9330000000009,8,248.318675633614,1,"combat","MATT",0,0,0,1
"1346","Briarwoods",3,26,1346,"combat","ORION","60 feet.",10639.626,10640.904,1.27800000000025,3,140.845070422508,1,"combat","ORION",1,0,0,0
"1347","Briarwoods",3,26,1347,"combat","MATT","60 feet. cool.",10640.904,10642.073,1.16899999999987,4,205.303678357594,1,"combat","MATT",0,0,0,1
"1348","Briarwoods",3,26,1348,"combat","ORION","i'm going to dash. on that.",10642.073,10644.105,2.03199999999924,8,236.220472441033,1,"combat","ORION",1,0,0,0
"1349","Briarwoods",3,26,1349,"combat","MATT","yep. you guys can go 120 feet every turn. it can go 240. two rounds pass before you guys realize there is no way you're going to catch up with this thing or get even close to it.",10644.105,10653.968,9.86300000000119,40,243.333671296736,1,"combat","MATT",0,0,0,1
"1350","Briarwoods",3,26,1350,"combat","LIAM","i've got haste!",10653.968,10655.561,1.59299999999894,5,188.323917137602,1,"combat","LIAM",1,0,0,0
"1351","Briarwoods",3,26,1351,"combat","LAURA","i've got hunter's mark on it, so i can track it.",10655.561,10658.163,2.60200000000077,14,322.828593389605,1,"combat","LAURA",1,0,0,0
"1352","Briarwoods",3,26,1352,"combat","LIAM","double me, yo! i got haste.",10658.163,10660.223,2.05999999999949,7,203.883495145681,1,"combat","LIAM",1,0,0,0
"1353","Briarwoods",3,26,1353,"combat","MATT","your haste speed your physical body doesn't affect the fly spell, unfortunately. you're only at the speed that the arcane nature of the spell can take you. i'm just saying. your metabolism's real fast. your heartbeat's hummingbirding it. but you're still only going 120 feet. so as you guys follow behind, you can see now, after a while on the edge of the shoreline, not too far from emon maybe what would normally be from horseback or a brisk walk, a half day's travel you eventually come upon the there it is! you come upon the coastal mountains known as the shoreline summit. it's a series of unusually steep mountain bluffs that hug the coastline, northwest of emon. as you get closer, and at this point you've lost sight of the bird. scanlan, i want you to go ahead and roll an athletics check.",10660.223,10719.817,59.5939999999991,154,155.049166023427,1,"combat","MATT",0,0,0,1
"1354","Briarwoods",3,26,1354,"combat","SAM","athletics? well, that doesn't count. that's not good. athletics? 16.",10719.817,10730.654,10.8370000000014,13,71.9756390144784,1,"combat","SAM",1,0,0,0
"1355","Briarwoods",3,26,1355,"combat","MATT","16? okay. you still manage to keep hold for the portion of the length of the journey. as it moves and shifts and the wind itself is still blowing in your face, though minimized by your current positioning. it's a trial to hold onto this large creature as it makes its wings beat and just the sheer force of its movement. all right. so as you get closer to these mountaintops",10730.654,10754.253,23.5990000000002,72,183.058604178142,1,"combat","MATT",0,0,0,1
"1356","Briarwoods",3,26,1356,"combat","MARISHA","do i have a turn yet?",10754.253,10756.029,1.77599999999984,7,236.486486486508,1,"combat","MARISHA",1,0,0,0
"1357","Briarwoods",3,26,1357,"combat","MATT","you can go ahead and take your turn now too, yes.",10756.029,10757.896,1.86700000000019,12,385.645420460593,1,"combat","MATT",0,0,0,1
"1358","Briarwoods",3,26,1358,"combat","MARISHA","yeah? i cast polymorph on it. you're on it.",10757.896,10766.572,8.67599999999948,11,76.0719225449562,1,"combat","MARISHA",1,0,0,0
"1359","Briarwoods",3,26,1359,"combat","SAM","don't worry about me!",10766.572,10768.101,1.52900000000045,6,235.448005232108,1,"combat","SAM",1,0,0,0
"1360","Briarwoods",3,26,1360,"combat","MARISHA","really?",10768.101,10770.516,2.41499999999905,2,49.6894409938083,1,"combat","MARISHA",1,0,0,0
"1361","Briarwoods",3,26,1361,"combat","SAM","i'm fine! you never need to worry about me. haven't you guys learned that by now? i'm fine!",10770.516,10777.814,7.29800000000068,22,180.871471636048,1,"combat","SAM",1,0,0,0
"1362","Briarwoods",3,26,1362,"combat","MARISHA","out of thematic reasons, i also turn him into a cow.",10777.814,10786.76,8.94599999999991,12,80.4828973843066,1,"combat","MARISHA",1,0,0,0
"1363","Briarwoods",3,26,1363,"combat","SAM","that's amazing!",10786.76,10789.354,2.59399999999914,4,92.5212027756667,1,"combat","SAM",1,0,0,0
"1364","Briarwoods",3,26,1364,"combat","LIAM","is what she cries out heroically.",10789.354,10792.044,2.69000000000051,7,156.133828996253,1,"combat","LIAM",1,0,0,0
"1365","Briarwoods",3,26,1365,"combat","MATT","okay. what's the dc on this?",10792.044,10795.944,3.89999999999964,8,123.076923076935,1,"combat","MATT",0,0,0,1
"1366","Briarwoods",3,26,1366,"combat","MARISHA","my spell dc? 18.",10795.944,10802.24,6.29600000000028,5,47.6493011435811,1,"combat","MARISHA",1,0,0,0
"1367","Briarwoods",3,26,1367,"combat","MATT","rolled a one.",10802.24,10807.138,4.89800000000105,4,48.9995916700589,1,"combat","MATT",0,0,0,1
"1368","Briarwoods",3,26,1368,"combat","SAM","i'm a cow on a cow with a cow!",10807.138,10809.418,2.27999999999884,11,289.473684210674,1,"combat","SAM",1,0,0,0
"1369","Briarwoods",3,26,1369,"combat","MATT","so this giant flying bird moo! and just begins to plummet at an extremely fast speed. you both immediately are released from its grasp. scanlan and keyleth both are just falling. you guys don't see this. it's too far away from you now. at this point, you're probably close to about 500 feet in the air.",10809.418,10836.459,27.0410000000011,60,133.131171184492,1,"combat","MATT",0,0,0,1
"1370","Briarwoods",3,26,1370,"combat","LIAM","yo, i heard you liked cows, so i gave you some cows with your cow.",10836.459,10839.957,3.49799999999959,16,274.442538593514,1,"combat","LIAM",1,0,0,0
"1371","Briarwoods",3,26,1371,"combat","MATT","i hope this inspires the next diablo cow level, guys. you really need to look into this. all right. so you guys are now both plummeting and falling at a really, really rapid speed.",10839.957,10854.195,14.2379999999994,35,147.492625368738,1,"combat","MATT",0,0,0,1
"1372","Briarwoods",3,26,1372,"combat","MARISHA","i go eagle form.",10854.195,10856.315,2.1200000000008,5,141.509433962211,1,"combat","MARISHA",1,0,0,0
"1373","Briarwoods",3,26,1373,"combat","MATT","flailing cows. you go eagle form. you're fine. so you go into eagle form. that's your action this turn. that's your bonus action, because you can do that as a",10856.315,10863.443,7.12799999999879,33,277.777777777825,1,"combat","MATT",0,0,0,1
"1374","Briarwoods",3,26,1374,"combat","MARISHA","as a bonus action!",10863.443,10864.869,1.4260000000013,5,210.378681626737,1,"combat","MARISHA",1,0,0,0
"1375","Briarwoods",3,26,1375,"combat","MATT","eagle form. scanlan, you plummet full speed on this one. you probably have another two rounds before you impact with something very painful.",10864.869,10878.223,13.3539999999994,24,107.832859068449,1,"combat","MATT",0,0,0,1
"1376","Briarwoods",3,26,1376,"combat","LIAM","but he's as heavy as a dust mote, so he just goes like this all the way down. right?",10878.223,10881.98,3.75699999999961,21,335.373968591997,1,"combat","LIAM",1,0,0,0
"1377","Briarwoods",3,26,1377,"combat","MARISHA","i don't think that's how it works.",10881.98,10883.943,1.96299999999974,10,305.654610290413,1,"combat","MARISHA",1,0,0,0
"1378","Briarwoods",3,26,1378,"combat","ORION","no, he's a little pebble.",10883.943,10885.746,1.80299999999988,7,232.945091514158,1,"combat","ORION",1,0,0,0
"1379","Briarwoods",3,26,1379,"combat","MARISHA","i can catch him, if you need catched.",10885.746,10888.935,3.18900000000031,9,169.332079021621,1,"combat","MARISHA",1,0,0,0
"1380","Briarwoods",3,26,1380,"combat","MATT","you guys still continue to give chase. eventually, you see this giant thing just go and vanish from sight. it's just gone. it just disappeared.",10888.935,10895.724,6.78900000000067,27,238.621299160383,1,"combat","MATT",0,0,0,1
"1381","Briarwoods",3,26,1381,"combat","ORION","i go full gandalf.",10895.724,10897.409,1.68499999999949,5,178.04154302676,1,"combat","ORION",1,0,0,0
"1382","Briarwoods",3,26,1382,"combat","MATT","all right.",10897.409,10899.086,1.67699999999968,3,107.334525939198,1,"combat","MATT",0,0,0,1
"1383","Briarwoods",3,26,1383,"combat","LIAM","never go full gandalf.",10899.086,10900.676,1.59000000000015,5,188.679245283002,1,"combat","LIAM",1,0,0,0
"1384","Briarwoods",3,26,1384,"combat","MATT","you guys are pushing forward. so it's now the next round for you guys to react. what are you doing?",10900.676,10908.087,7.41100000000006,22,178.113614896774,1,"combat","MATT",0,0,0,1
"1385","Briarwoods",3,26,1385,"combat","SAM","i will become a pterodactyl.",10908.087,10910.054,1.96700000000055,6,183.01982714789,1,"combat","SAM",1,0,0,0
"1386","Briarwoods",3,26,1386,"combat","MATT","so you're casting?",10910.054,10911.336,1.28199999999924,5,234.009360374553,1,"combat","MATT",0,0,0,1
"1387","Briarwoods",3,26,1387,"combat","SAM","polymorph on myself?",10911.336,10912.786,1.45000000000073,4,165.517241379227,1,"combat","SAM",1,0,0,0
"1388","Briarwoods",3,26,1388,"combat","MATT","okay. because you are falling and this is a lot of wind, i'm going to have to ask you to make a concentration check to complete the spell.",10912.786,10922.09,9.30400000000009,30,193.46517626827,1,"combat","MATT",0,0,0,1
"1389","Briarwoods",3,26,1389,"combat","LAURA","come on, scanlan!",10922.09,10923.847,1.75699999999961,4,136.596471257856,1,"combat","LAURA",1,0,0,0
"1390","Briarwoods",3,26,1390,"combat","MATT","so go ahead and roll a d20.",10923.847,10925.391,1.54399999999987,8,310.88082901557,1,"combat","MATT",0,0,0,1
"1391","Briarwoods",3,26,1391,"combat","SAM","this is a concentration not on holding a spell, but on casting it?",10925.391,10929.401,4.01000000000022,14,209.476309226921,1,"combat","SAM",1,0,0,0
"1392","Briarwoods",3,26,1392,"combat","MATT","correct. because as part of the components of it and maintaining your attention to the spell",10929.401,10934.579,5.17799999999988,16,185.399768250294,1,"combat","MATT",0,0,0,1
"1393","Briarwoods",3,26,1393,"combat","MARISHA","what does he add? his spell attack bonus?",10934.579,10937.006,2.42699999999968,9,222.496909765171,1,"combat","MARISHA",1,0,0,0
"1394","Briarwoods",3,26,1394,"combat","MATT","this? no, this is a d20 and let me make sure, yeah it's a d20 and then you add your plus five from your charisma.",10937.006,10948.481,11.4750000000004,27,141.176470588231,1,"combat","MATT",0,0,0,1
"1395","Briarwoods",3,26,1395,"combat","SAM","charisma? that's a natural 20.",10948.481,10954.565,6.08400000000074,7,69.0335305719837,1,"combat","SAM",1,0,0,0
"1396","Briarwoods",3,26,1396,"combat","MATT","with that pterodactyl.",10954.565,10960.773,6.20799999999872,4,38.659793814441,1,"combat","MATT",0,0,0,1
"1397","Briarwoods",3,26,1397,"combat","LIAM","tables have turned, motherfucker! tables have turned!",10960.773,10966.762,5.9890000000014,8,80.1469360494052,1,"combat","LIAM",1,0,0,0
"1398","Briarwoods",3,26,1398,"combat","ORION","you're both flying cows!",10966.762,10968.529,1.76699999999983,6,203.735144312414,1,"combat","ORION",1,0,0,0
"1399","Briarwoods",3,26,1399,"combat","LAURA","wait! was seeming a concentration?",10968.529,10972.795,4.26599999999962,6,84.3881856540159,1,"combat","LAURA",1,0,0,0
"1400","Briarwoods",3,26,1400,"combat","ORION","i think it lasts for like eight hours.",10972.795,10975.289,2.4940000000006,9,216.519647153116,1,"combat","ORION",1,0,0,0
"1401","Briarwoods",3,26,1401,"combat","LAURA","did it drop? are we no longer cows?",10975.289,10977.363,2.0739999999987,9,260.366441658793,1,"combat","LAURA",1,0,0,0
"1402","Briarwoods",3,26,1402,"combat","SAM","i think so. i'll check.",10977.363,10980.06,2.69700000000012,7,155.728587319237,1,"combat","SAM",1,0,0,0
"1403","Briarwoods",3,26,1403,"combat","LIAM","hey! you're not a cow anymore!",10980.06,10981.312,1.25200000000041,8,383.386581469524,1,"combat","LIAM",1,0,0,0
"1404","Briarwoods",3,26,1404,"combat","LAURA","oh my god, you're not a cow anymore!",10981.312,10982.901,1.58899999999994,10,377.595972309643,1,"combat","LAURA",1,0,0,0
"1405","Briarwoods",3,26,1405,"combat","LIAM","oh! awesome!",10982.901,10984.18,1.27900000000045,3,140.734949178996,1,"combat","LIAM",1,0,0,0
"1406","Briarwoods",3,26,1406,"combat","MATT","you guys keep flying. you guys catch yourselves.",10984.18,10988.163,3.98300000000017,9,135.576198845086,1,"combat","MATT",0,0,0,1
"1407","Briarwoods",3,26,1407,"combat","SAM","nope, not concentration. it just lasts for eight hours.",10988.163,10991.019,2.85599999999977,10,210.084033613463,1,"combat","SAM",1,0,0,0
"1408","Briarwoods",3,26,1408,"combat","MATT","you guys are all still flying cows. you're all still just a squadron of flying, illusory cows, which you guys are both now transformed into an eagle and a pterodactyl, but you still look like cows.",10991.019,11007.508,16.4889999999996,38,138.274000849054,1,"combat","MATT",0,0,0,1
"1409","Briarwoods",3,26,1409,"combat","LIAM","as the twins are flying, i say, hey, did you notice we have the same pattern? twins!",11007.508,11014.763,7.25500000000102,18,148.862853204666,1,"combat","LIAM",1,0,0,0
"1410","Briarwoods",3,26,1410,"combat","MATT","about this time, you hear a loud, impactful boom. and there's a cloud of dust partway into the side of this first bit of mountain range that you come upon, a little bit distant from you guys.",11014.763,11032.862,18.0989999999983,39,129.288910989569,1,"combat","MATT",0,0,0,1
"1411","Briarwoods",3,26,1411,"combat","LAURA","can i fly down towards it?",11032.862,11034.189,1.32700000000114,7,316.503391107491,1,"combat","LAURA",1,0,0,0
"1412","Briarwoods",3,26,1412,"combat","MATT","you start heading in that direction. because of the speed it was traveling at and the way it was carrying at the speed it was going, it's still ahead of you guys. and you see the impact. you hear this loud screeching sound and you see now where there was a little poof of cloud, these wings unfold and make its way back up.",11034.189,11053.737,19.5479999999989,66,202.578268876623,1,"combat","MATT",0,0,0,1
"1413","Briarwoods",3,26,1413,"combat","ORION","how far away from it are we?",11053.737,11055.829,2.09200000000055,8,229.4455066921,1,"combat","ORION",1,0,0,0
"1414","Briarwoods",3,26,1414,"combat","MATT","you guys right now at the close to six minutes you've been traveling",11055.829,11061.485,5.65600000000086,14,148.514851485126,1,"combat","MATT",0,0,0,1
"1415","Briarwoods",3,26,1415,"combat","MARISHA","did it not drop the cow to 0 hit points?",11061.485,11063.729,2.24399999999878,11,294.117647058984,1,"combat","MARISHA",1,0,0,0
"1416","Briarwoods",3,26,1416,"combat","MATT","all the damage carries over.",11063.729,11067.697,3.96800000000076,6,90.7258064515956,1,"combat","MATT",0,0,0,1
"1417","Briarwoods",3,26,1417,"combat","LIAM","the remainder of that damage went into its hit points.",11067.697,11072.842,5.14500000000044,11,128.279883381913,1,"combat","LIAM",1,0,0,0
"1418","Briarwoods",3,26,1418,"combat","MATT","you don't know. it looks hurt. it looks like it wasn't happy about it. it continues back up. from you tiberius, it's probably close to 700 to 800 feet away from you. it's because of the speed it was traveling and the speed you guys were following. it was gaining on you every single turn.",11072.842,11085.738,12.8959999999988,60,279.15632754345,1,"combat","MATT",0,0,0,1
"1419","Briarwoods",3,26,1419,"combat","LAURA","is it flying away from us now?",11085.738,11086.874,1.13600000000042,8,422.535211267449,1,"combat","LAURA",1,0,0,0
"1420","Briarwoods",3,26,1420,"combat","MATT","it's heading up into the mountain range.",11086.874,11088.683,1.80900000000111,9,298.507462686385,1,"combat","MATT",0,0,0,1
"1421","Briarwoods",3,26,1421,"combat","LIAM","fly after that motherfucker!",11088.683,11092.02,3.33699999999953,5,89.9011087803542,1,"combat","LIAM",1,0,0,0
"1422","Briarwoods",3,26,1422,"second_half_rp","LAURA","should we still track it? it's still nighttime, right?",11092.02,11094.544,2.52399999999943,11,261.489698890709,NA,"role_play","LAURA",1,0,0,0
"1423","Briarwoods",3,26,1423,"second_half_rp","MATT","it's still nighttime, yeah.",11094.544,11096.061,1.51699999999983,6,237.310481212948,NA,"role_play","MATT",0,0,0,1
"1424","Briarwoods",3,26,1424,"second_half_rp","ORION","it's only 500 feet away from me right now?",11096.061,11097.692,1.6309999999994,11,404.659717964587,NA,"role_play","ORION",1,0,0,0
"1425","Briarwoods",3,26,1425,"second_half_rp","MATT","600 to 500 feet.",11097.692,11099.074,1.38200000000143,5,217.076700433929,NA,"role_play","MATT",0,0,0,1
"1426","Briarwoods",3,26,1426,"second_half_rp","ORION","okay, cool. well i'm going for it, still.",11099.074,11100.793,1.71899999999914,10,349.04013961623,NA,"role_play","ORION",1,0,0,0
"1427","Briarwoods",3,26,1427,"second_half_rp","MATT","what are you doing?",11100.793,11102.183,1.39000000000124,5,215.827338129304,NA,"role_play","MATT",0,0,0,1
"1428","Briarwoods",3,26,1428,"second_half_rp","LAURA","we're all following it.",11102.183,11103.668,1.48499999999876,6,242.424242424444,NA,"role_play","LAURA",1,0,0,0
"1429","Briarwoods",3,26,1429,"second_half_rp","ORION","where am i? it's taking off right now and i'm over here?",11103.668,11107.281,3.61300000000119,15,249.100470523029,NA,"role_play","ORION",1,0,0,0
"1430","Briarwoods",3,26,1430,"second_half_rp","MATT","you're back here. it's now starting to take off and head up towards the top of this mountain range that you're just starting to come upon.",11107.281,11114.341,7.05999999999949,30,254.957507082171,NA,"role_play","MATT",0,0,0,1
"1431","Briarwoods",3,26,1431,"second_half_rp","ORION","okay. if it's doing that, then i'll fucking go higher and try to meet it where it's going.",11114.341,11123.296,8.95499999999993,22,147.403685092128,NA,"role_play","ORION",1,0,0,0
"1432","Briarwoods",3,26,1432,"second_half_rp","MATT","okay. cool. the rest of you guys continue to give chase. now that it's returned to its form, it travels an additional double dash: 240 feet. as this progresses, it's far beyond any of you guys in a matter of seconds.",11123.296,11142.635,19.3389999999999,44,136.511712084389,NA,"role_play","MATT",0,0,0,1
"1433","Briarwoods",3,26,1433,"second_half_rp","LAURA","is the mountain range really far away?",11142.635,11144.233,1.59799999999996,8,300.375469336679,NA,"role_play","LAURA",1,0,0,0
"1434","Briarwoods",3,26,1434,"second_half_rp","MATT","no, you've just hit the outskirts of the mountain range. it got there first. you guys just catch up to where it starts and you see it's like now it's dodging through the mountains and is currently no longer in sight. there is a little bit of low cloud cover in this area. a couple drift by and cover a couple of the mountains. but this little cluster of seaside cliffs and mountains, as you get closer, you can see it's dotted with high altitude trees. there's precariously perched goats that are sleeping on elements of the sides of this mountain.",11144.233,11169.812,25.5789999999997,107,250.98713788655,NA,"role_play","MATT",0,0,0,1
"1435","Briarwoods",3,26,1435,"second_half_rp","LIAM","can you track it?",11169.812,11171.644,1.83200000000033,5,163.755458515254,NA,"role_play","LIAM",1,0,0,0
"1436","Briarwoods",3,26,1436,"second_half_rp","LAURA","i can track it! of course.",11171.644,11173.975,2.33100000000013,7,180.18018018017,NA,"role_play","LAURA",1,0,0,0
"1437","Briarwoods",3,26,1437,"second_half_rp","MATT","so you're keeping your attention on it?",11173.975,11175.766,1.79099999999926,9,301.507537688567,NA,"role_play","MATT",0,0,0,1
"1438","Briarwoods",3,26,1438,"second_half_rp","LAURA","yes.",11175.766,11176.938,1.17200000000048,2,102.389078498252,NA,"role_play","LAURA",1,0,0,0
"1439","Briarwoods",3,26,1439,"second_half_rp","MATT","the winds also are pretty strong as you get close to the mountains. as you coast around each, you start actually diving into this middle valley area.",11176.938,11185.322,8.38400000000001,28,200.381679389313,NA,"role_play","MATT",0,0,0,1
"1440","Briarwoods",3,26,1440,"second_half_rp","LAURA","i'm going to cast pass without a trace on all of us.",11185.322,11187.253,1.93100000000049,14,435.007767995746,NA,"role_play","LAURA",1,0,0,0
"1441","Briarwoods",3,26,1441,"second_half_rp","MATT","okay.",11187.253,11188.668,1.41499999999905,2,84.805653710304,NA,"role_play","MATT",0,0,0,1
"1442","Briarwoods",3,26,1442,"second_half_rp","SAM","does that affect any spells?",11188.668,11190.729,2.06099999999969,6,174.672489082995,NA,"role_play","SAM",1,0,0,0
"1443","Briarwoods",3,26,1443,"second_half_rp","LAURA","no, it just makes us stealth easier.",11190.729,11192.524,1.79500000000007,8,267.409470752078,NA,"role_play","LAURA",1,0,0,0
"1444","Briarwoods",3,26,1444,"second_half_rp","SAM","it doesn't drop hunter's mark?",11192.524,11193.777,1.25300000000061,8,383.080606544107,NA,"role_play","SAM",1,0,0,0
"1445","Briarwoods",3,26,1445,"second_half_rp","MATT","is it concentration?",11193.777,11194.929,1.15200000000004,4,208.333333333325,NA,"role_play","MATT",0,0,0,1
"1446","Briarwoods",3,26,1446,"second_half_rp","LAURA","no, it's not concentration; it's an action. oh wait. i don't know if i can tell.",11194.929,11198.513,3.58400000000074,20,334.821428571359,NA,"role_play","LAURA",1,0,0,0
"1447","Briarwoods",3,26,1447,"second_half_rp","MATT","is pass without a trace concentration?",11198.513,11200.388,1.875,7,224,NA,"role_play","MATT",0,0,0,1
"1448","Briarwoods",3,26,1448,"second_half_rp","LAURA","where does it say it?",11200.388,11201.963,1.57499999999891,6,228.571428571587,NA,"role_play","LAURA",1,0,0,0
"1449","Briarwoods",3,26,1449,"second_half_rp","SAM","there's a c next to it somewhere.",11201.963,11204.333,2.3700000000008,9,227.848101265746,NA,"role_play","SAM",1,0,0,0
