"","arc","arc_no","episode","turn_number","segment","actor","text","start_turn","end_turn","time_in_sec","word_count","words_per_minute","encounter_count","rp_combat","actor_guest","vox_machina","guest","staff","matt"
"391","Briarwoods",3,26,391,"first_half_rp","LIAM","keep an eye out for it. 100 gold to any chap who finds it and holds onto it for me.",3670.516,3676.918,6.40200000000004,21,196.813495782567,NA,"role_play","LIAM",1,0,0,0
"392","Briarwoods",3,26,392,"first_half_rp","MATT","two of them stop in their step for a second and then keep walking.",3676.918,3682.219,5.30099999999993,15,169.779286926997,NA,"role_play","MATT",0,0,0,1
"393","Briarwoods",3,26,393,"first_half_rp","LIAM","i'm a nice guy!",3682.219,3685.501,3.28200000000015,6,109.689213893962,NA,"role_play","LIAM",1,0,0,0
"394","Briarwoods",3,26,394,"first_half_rp","MATT","go ahead and make a persuasion roll.",3685.501,3687.204,1.70299999999997,8,281.855549031126,NA,"role_play","MATT",0,0,0,1
"395","Briarwoods",3,26,395,"first_half_rp","TRAVIS","you're going to get six belts thrown at you.",3687.204,3689.387,2.18299999999999,11,302.336234539625,NA,"role_play","TRAVIS",1,0,0,0
"396","Briarwoods",3,26,396,"first_half_rp","LIAM","that's terrible. six.",3689.387,3691.118,1.73099999999977,5,173.310225303316,NA,"role_play","LIAM",1,0,0,0
"397","Briarwoods",3,26,397,"first_half_rp","MATT","it was a brief pause. but also. a brief pause.",3691.118,3696.53,5.41200000000026,11,121.951219512189,NA,"role_play","MATT",0,0,0,1
"398","Briarwoods",3,26,398,"first_half_rp","LAURA","you have a two in persuasion? oh wow.",3696.53,3700.615,4.08499999999958,9,132.190942472474,NA,"role_play","LAURA",1,0,0,0
"399","Briarwoods",3,26,399,"first_half_rp","SAM","we'll break in tonight and find it.",3700.615,3704.383,3.76800000000003,9,143.312101910827,NA,"role_play","SAM",1,0,0,0
"400","Briarwoods",3,26,400,"first_half_rp","TRAVIS","could we wait outside for allura?",3704.383,3706.329,1.94600000000037,7,215.827338129456,NA,"role_play","TRAVIS",1,0,0,0
"401","Briarwoods",3,26,401,"first_half_rp","LIAM","i'll risk it all.",3706.329,3708.161,1.83199999999988,6,196.506550218353,NA,"role_play","LIAM",1,0,0,0
"402","Briarwoods",3,26,402,"first_half_rp","MATT","all right. so you are now currently there in the cobblestone street of the cloudtop district, removed from the council of tal'dorei and left in this interesting circumstance.",3708.161,3722.052,13.8910000000001,30,129.580303793823,NA,"role_play","MATT",0,0,0,1
"403","Briarwoods",3,26,403,"first_half_rp","SAM","keyleth, what happened? your magic didn't work?",3722.052,3724.469,2.41699999999992,9,223.417459660744,NA,"role_play","SAM",1,0,0,0
"404","Briarwoods",3,26,404,"first_half_rp","MARISHA","no, it worked.",3724.469,3726.189,1.7199999999998,4,139.534883720946,NA,"role_play","MARISHA",1,0,0,0
"405","Briarwoods",3,26,405,"first_half_rp","LAURA","what happened?",3726.189,3727.49,1.30099999999993,3,138.355111452736,NA,"role_play","LAURA",1,0,0,0
"406","Briarwoods",3,26,406,"first_half_rp","SAM","but asum lied.",3727.49,3730.395,2.9050000000002,4,82.6161790017155,NA,"role_play","SAM",1,0,0,0
"407","Briarwoods",3,26,407,"first_half_rp","ORION","he gave her a magic winky face.",3730.395,3732.328,1.93299999999999,8,248.318675633731,NA,"role_play","ORION",1,0,0,0
"408","Briarwoods",3,26,408,"first_half_rp","MARISHA","yeah, essentially. yeah. he gave me like a",3732.328,3734.811,2.48300000000017,8,193.314538864264,NA,"role_play","MARISHA",1,0,0,0
"409","Briarwoods",3,26,409,"first_half_rp","LAURA","what does that mean? does that mean uriel's under their control? i don't understand.",3734.811,3740.697,5.88599999999997,17,173.292558613661,NA,"role_play","LAURA",1,0,0,0
"410","Briarwoods",3,26,410,"first_half_rp","LIAM","is he playing some sort of long game here?",3740.697,3742.978,2.28099999999995,10,263.042525208248,NA,"role_play","LIAM",1,0,0,0
"411","Briarwoods",3,26,411,"first_half_rp","SAM","it must mean that we have something to fear from uriel. or someone else close.",3742.978,3748.272,5.29399999999987,16,181.337363052517,NA,"role_play","SAM",1,0,0,0
"412","Briarwoods",3,26,412,"first_half_rp","MARISHA","i don't know who to trust anymore, to be totally honest.",3748.272,3752.493,4.221,13,184.790334044065,NA,"role_play","MARISHA",1,0,0,0
"413","Briarwoods",3,26,413,"first_half_rp","TRAVIS","really?",3752.493,3753.811,1.31800000000021,2,91.0470409711539,NA,"role_play","TRAVIS",1,0,0,0
"414","Briarwoods",3,26,414,"first_half_rp","MARISHA","it worked. i could feel it break. it worked, and he's got some sort of long game. i don't know if it's because he doesn't want uriel to know, for whatever reason. i don't know if it's because he has some deeper, ulterior motive.",3753.811,3772.178,18.3669999999997,51,166.603146948334,NA,"role_play","MARISHA",1,0,0,0
"415","Briarwoods",3,26,415,"first_half_rp","LAURA","do you think he was faking that he was healed, and maybe he wasn't?",3772.178,3775.467,3.28900000000021,16,291.882031012447,NA,"role_play","LAURA",1,0,0,0
"416","Briarwoods",3,26,416,"first_half_rp","TRAVIS","or maybe we have to bring proof of their vampirism back?",3775.467,3778.599,3.13200000000006,12,229.88505747126,NA,"role_play","TRAVIS",1,0,0,0
"417","Briarwoods",3,26,417,"first_half_rp","MARISHA","no.",3778.599,3779.627,1.02799999999979,2,116.731517509751,NA,"role_play","MARISHA",1,0,0,0
"418","Briarwoods",3,26,418,"first_half_rp","TRAVIS","oh.",3779.627,3780.969,1.3420000000001,2,89.4187779433616,NA,"role_play","TRAVIS",1,0,0,0
"419","Briarwoods",3,26,419,"first_half_rp","MARISHA","wait. no to vex. what was your question?",3780.969,3787.577,6.60800000000017,9,81.7191283292957,NA,"role_play","MARISHA",1,0,0,0
"420","Briarwoods",3,26,420,"first_half_rp","TRAVIS","to bring back proof of them being vampires.",3787.577,3790.812,3.23499999999967,9,166.924265842366,NA,"role_play","TRAVIS",1,0,0,0
"421","Briarwoods",3,26,421,"first_half_rp","SAM","proof would help. hey! don't we have a prisoner? can't we question the prisoner?",3790.812,3797.686,6.87400000000025,17,148.38521966831,NA,"role_play","SAM",1,0,0,0
"422","Briarwoods",3,26,422,"first_half_rp","LAURA","is he bleeding out? what if he's dead? we're so screwed!",3797.686,3800.738,3.05199999999968,14,275.229357798194,NA,"role_play","LAURA",1,0,0,0
"423","Briarwoods",3,26,423,"first_half_rp","MARISHA","i made sure.",3800.738,3802.673,1.93499999999995,4,124.031007751941,NA,"role_play","MARISHA",1,0,0,0
"424","Briarwoods",3,26,424,"first_half_rp","LAURA","yeah, the guy that percy shot the hand off of.",3802.673,3807.119,4.44600000000037,11,148.448043184873,NA,"role_play","LAURA",1,0,0,0
"425","Briarwoods",3,26,425,"first_half_rp","MARISHA","i cauterized his wounds, remember?",3807.119,3809.173,2.05399999999963,6,175.26777020451,NA,"role_play","MARISHA",1,0,0,0
"426","Briarwoods",3,26,426,"first_half_rp","SAM","we should question him. he could have proof.",3809.173,3811.541,2.36800000000039,9,228.040540540503,NA,"role_play","SAM",1,0,0,0
"427","Briarwoods",3,26,427,"first_half_rp","LAURA","oh shit! i hope everything's okay.",3811.541,3815.457,3.91599999999971,8,122.574055158334,NA,"role_play","LAURA",1,0,0,0
"428","Briarwoods",3,26,428,"first_half_rp","ORION","wait a minute! i really need to go to allura. she's our best interest right now.",3815.457,3827.702,12.2450000000003,18,88.1992650061225,NA,"role_play","ORION",1,0,0,0
"429","Briarwoods",3,26,429,"first_half_rp","SAM","we get it! you want her body. now's not the time.",3827.702,3831.521,3.81899999999996,13,204.241948153969,NA,"role_play","SAM",1,0,0,0
"430","Briarwoods",3,26,430,"first_half_rp","ORION","it is beyond that. there are several reasons to go. we need to get the earring of telescription. i need her to enchant something for me, too. as well as the fact i fear that our keep may be in danger. i would like to ask her if she may be able to set up a warding spell for",3831.521,3850.033,18.5119999999997,59,191.227312013832,NA,"role_play","ORION",1,0,0,0
"431","Briarwoods",3,26,431,"first_half_rp","LAURA","can you go get her and bring her to the keep? i need to find out if this boy is all right.",3850.033,3857.339,7.30600000000004,23,188.885847248836,NA,"role_play","LAURA",1,0,0,0
"432","Briarwoods",3,26,432,"first_half_rp","MARISHA","well, we can split up. i can go with you.",3857.339,3860.32,2.98100000000022,11,221.402214022124,NA,"role_play","MARISHA",1,0,0,0
"433","Briarwoods",3,26,433,"first_half_rp","MATT","as you guys are having this discussion, the palace doors open and you hear the quick footsteps of allura, rushing from the palace now, running towards you guys.",3860.32,3870.975,10.6549999999997,29,163.30361332708,NA,"role_play","MATT",0,0,0,1
"434","Briarwoods",3,26,434,"first_half_rp","LAURA","saving the day. again.",3870.975,3873.044,2.06899999999996,5,144.997583373613,NA,"role_play","LAURA",1,0,0,0
"435","Briarwoods",3,26,435,"first_half_rp","MARISHA","wait, she's coming out of the palace?",3873.044,3875.052,2.00800000000027,9,268.924302788809,NA,"role_play","MARISHA",1,0,0,0
"436","Briarwoods",3,26,436,"first_half_rp","MATT","she's coming out of the palace, behind you guys. like after the council had just closed. the meeting had finished. she basically gave chase to you guys and is now catching up to you on the street.",3875.052,3882.711,7.65899999999965,39,305.52291421858,NA,"role_play","MATT",0,0,0,1
"437","Briarwoods",3,26,437,"first_half_rp","SAM","what the shit happened in there?",3882.711,3884.793,2.08200000000033,7,201.72910662821,NA,"role_play","SAM",1,0,0,0
"438","Briarwoods",3,26,438,"first_half_rp","MARISHA","we were just talking about you!",3884.793,3886.929,2.13599999999997,7,196.629213483149,NA,"role_play","MARISHA",1,0,0,0
"439","Briarwoods",3,26,439,"first_half_rp","MATT","""everyone i don't fully know what happened last night, and"" she looks to you, tiberius, and says, ""you didn't, did you? please tell me you did not kill that woman.""",3886.929,3907.775,20.846,34,97.8605008155042,NA,"role_play","MATT",0,0,0,1
"440","Briarwoods",3,26,440,"first_half_rp","ORION","oh, i absolutely did!",3907.775,3909.295,1.51999999999998,5,197.368421052634,NA,"role_play","ORION",1,0,0,0
"441","Briarwoods",3,26,441,"first_half_rp","LAURA","but she was attacking us.",3909.295,3912.356,3.06100000000015,6,117.608624632467,NA,"role_play","LAURA",1,0,0,0
"442","Briarwoods",3,26,442,"first_half_rp","SAM","it looks bad, but she was a threat.",3912.356,3915.305,2.94899999999961,9,183.112919633798,NA,"role_play","SAM",1,0,0,0
"443","Briarwoods",3,26,443,"first_half_rp","ORION","her and another one with this what was he, a tiefling? named the broker attacked us. and that's why i killed her.",3915.305,3925.088,9.78300000000036,24,147.194112235505,NA,"role_play","ORION",1,0,0,0
"444","Briarwoods",3,26,444,"first_half_rp","MATT","""brom's divination is very clear. and he divined that the woman was currently filled with ""fear, attempting to flee, and unconscious when she was murdered.""",3925.088,3940.956,15.8679999999999,28,105.8734560121,NA,"role_play","MATT",0,0,0,1
"445","Briarwoods",3,26,445,"first_half_rp","LIAM","how did she flee when she was unconscious?",3940.956,3943.652,2.69599999999991,9,200.296735905051,NA,"role_play","LIAM",1,0,0,0
"446","Briarwoods",3,26,446,"first_half_rp","TRAVIS","she fled, went unconscious, then we butchered her.",3943.652,3947.522,3.86999999999989,9,139.534883720934,NA,"role_play","TRAVIS",1,0,0,0
"447","Briarwoods",3,26,447,"first_half_rp","MARISHA","just accept it for what it is, guys.",3947.522,3951.495,3.97299999999996,9,135.917442738486,NA,"role_play","MARISHA",1,0,0,0
"448","Briarwoods",3,26,448,"first_half_rp","MATT","""i just worry. i know not what happened here, and i heard what you said, and i honestly do ""not trust the briarwoods myself either. there was something about that meal and the conversation, ""and their presence that put me off entirely. it was strange. and what you say makes a lot of ""sense. vampirism is a bit beyond what i was expecting. i did sense some powerful masqueraded ""arcane essence from lady briarwood. look, i would recommend for this to do your best to be thorough ""in this. bring back any and all information you can. from the words i hear, you probably have at ""best a few weeks before this comes to a close. and if you don't have enough evidence to support your ""argument well, i don't know.""",3951.495,4008.399,56.904,135,142.345002108815,NA,"role_play","MATT",0,0,0,1
"449","Briarwoods",3,26,449,"first_half_rp","LIAM","allura, all i know how to do is break locks, but i've seen these people do things with magic that have defied expectations. why can no one look into my memory? you have looked across miles. cannot anyone look into my mind and see?",4008.399,4024.751,16.3520000000003,46,168.786692759292,NA,"role_play","LIAM",1,0,0,0
"450","Briarwoods",3,26,450,"first_half_rp","LAURA","they're going to do it!",4024.751,4026.918,2.16699999999992,7,193.816335948323,NA,"role_play","LAURA",1,0,0,0
"451","Briarwoods",3,26,451,"first_half_rp","SAM","yes, but that might not be proof enough for them. someone could have corrupted your mind.",4026.918,4030.988,4.06999999999971,17,250.614250614269,NA,"role_play","SAM",1,0,0,0
"452","Briarwoods",3,26,452,"first_half_rp","MATT","""you have to understand. not all arcane works that way. there are magics that can dabble ""in that realm, but none that specialize that here in emon. divination, yes there are elements of ""that. we can see the physical. we can see certain events. but to look into one's mind is a different ""magic entirely.""",4030.988,4050.877,19.8890000000001,58,174.971089546985,NA,"role_play","MATT",0,0,0,1
"453","Briarwoods",3,26,453,"first_half_rp","LIAM","are there no spells that can divine if someone's speaking true?",4050.877,4054.35,3.47299999999996,13,224.589691909015,NA,"role_play","LIAM",1,0,0,0
"454","Briarwoods",3,26,454,"first_half_rp","MATT","""that was attempted during that council, but after you left, brom notified uriel and the ""council that many of you were resistant to the spell, and as such, it could not be verified.""",4054.35,4069.114,14.7640000000001,35,142.237875914385,NA,"role_play","MATT",0,0,0,1
"455","Briarwoods",3,26,455,"first_half_rp","LAURA","we should have rolled low! just tell us you're doing it, we won't resist it! what the shit? doesn't even trust us to tell the truth.",4069.114,4083.459,14.3449999999998,30,125.479261066575,NA,"role_play","LAURA",1,0,0,0
"456","Briarwoods",3,26,456,"first_half_rp","TRAVIS","if we came back with proof?",4083.459,4085.613,2.154,7,194.986072423399,NA,"role_play","TRAVIS",1,0,0,0
"457","Briarwoods",3,26,457,"first_half_rp","SAM","what sort of proof do you think they would accept? the head of lady briarwood?",4085.613,4088.931,3.31800000000021,16,289.330922242296,NA,"role_play","SAM",1,0,0,0
"458","Briarwoods",3,26,458,"first_half_rp","LAURA","no, because it'll disappear the minute we kill her or something. they're vampires, i don't know what they do.",4088.931,4094.349,5.41800000000012,23,254.706533776296,NA,"role_play","LAURA",1,0,0,0
"459","Briarwoods",3,26,459,"first_half_rp","MATT","she gives a thought to that. she goes, ""interestingly enough, if an artifact or an item ""brought forth from them could be divined, that should tell all.""",4094.349,4104.714,10.3649999999998,28,162.083936324171,NA,"role_play","MATT",0,0,0,1
"460","Briarwoods",3,26,460,"first_half_rp","MARISHA","is there still the remaining wreckage of their carriage? is that still there?",4104.714,4108.964,4.25,14,197.647058823529,NA,"role_play","MARISHA",1,0,0,0
"461","Briarwoods",3,26,461,"first_half_rp","MATT","""the carriage has been disposed. it's been picked over, and there were remnants within the ""rubble of some sort of a 'siggle' of teleportation. but that is no a sigil, if you will.""",4108.964,4124.406,15.442,36,139.878254112162,NA,"role_play","MATT",0,0,0,1
"462","Briarwoods",3,26,462,"first_half_rp","TRAVIS","what sort of artifact? like, a brooch? a handbag?",4124.406,4127.9,3.49399999999969,10,171.722953634818,NA,"role_play","TRAVIS",1,0,0,0
"463","Briarwoods",3,26,463,"first_half_rp","LIAM","are we talking about that motherfucker's teeth?",4127.9,4130.219,2.31900000000041,9,232.858990944331,NA,"role_play","LIAM",1,0,0,0
"464","Briarwoods",3,26,464,"first_half_rp","ORION","i need to see that sigil.",4130.219,4131.513,1.29399999999987,7,324.574961360157,NA,"role_play","ORION",1,0,0,0
"465","Briarwoods",3,26,465,"first_half_rp","MATT","""sigil. we're all learning together. that, i believe, has all been investigated and kept under ""lock and key with asum. you would have to speak with him. i would like to help. i cannot come with ""you. i'm working on something else at the moment. ah!"" and she reaches into her pocket and brings out your earring of transcription.",4131.513,4164.6,33.0870000000004,63,114.24426511923,NA,"role_play","MATT",0,0,0,1
"466","Briarwoods",3,26,466,"first_half_rp","ORION","thank you so much, lady allura!",4164.6,4167.187,2.58699999999953,7,162.350212601498,NA,"role_play","ORION",1,0,0,0
"467","Briarwoods",3,26,467,"first_half_rp","MATT","as she hands it to you, she gives you a really, really concerned look. and just gives it to you and hands it back. and it's a look of and it hits you: it's a look of disappointment with a hint of heartbreak.",4167.187,4185.133,17.9459999999999,46,153.794717485791,NA,"role_play","MATT",0,0,0,1
"468","Briarwoods",3,26,468,"first_half_rp","TRAVIS","oh, that's the worst! i'm not angry, i'm just disappointed. ugh!",4185.133,4188.715,3.58200000000033,15,251.256281407012,NA,"role_play","TRAVIS",1,0,0,0
"469","Briarwoods",3,26,469,"first_half_rp","LIAM","i feel like i've failed you.",4188.715,4190.722,2.00699999999961,8,239.162929745936,NA,"role_play","LIAM",1,0,0,0
"470","Briarwoods",3,26,470,"first_half_rp","TRAVIS","yeah.",4190.722,4191.977,1.25500000000011,2,95.6175298804698,NA,"role_play","TRAVIS",1,0,0,0
"471","Briarwoods",3,26,471,"first_half_rp","MATT","she looks back to you as you take it and goes, ""do your best to clear your name.""",4191.977,4198.174,6.19700000000012,19,183.959980635788,NA,"role_play","MATT",0,0,0,1
"472","Briarwoods",3,26,472,"first_half_rp","ORION","i shall.",4198.174,4199.718,1.54399999999987,3,116.580310880839,NA,"role_play","ORION",1,0,0,0
"473","Briarwoods",3,26,473,"first_half_rp","MATT","""i know you come of noble blood, and many of you stand to inspire many others of noble blood. ""as celebrated heroes of this city, there is a lot more on the line here besides just your ""well-being. there's a lot of people in this town that look up to you. nevertheless, i've already ""said more than i should. good luck.""",4199.718,4223.968,24.25,66,163.298969072165,NA,"role_play","MATT",0,0,0,1
"474","Briarwoods",3,26,474,"first_half_rp","LAURA","thank you, allura.",4223.968,4226.572,2.60400000000027,4,92.165898617502,NA,"role_play","LAURA",1,0,0,0
"475","Briarwoods",3,26,475,"first_half_rp","MATT","she looks behind and you can see she takes this small hood of the same material of her robe that she's wearing and puts it up over her head and rushes off towards her white tower towards the edge of the cloudtop district.",4226.572,4239.736,13.1639999999998,45,205.104831358254,NA,"role_play","MATT",0,0,0,1
"476","Briarwoods",3,26,476,"first_half_rp","LIAM","fucking politics.",4239.736,4241.517,1.78099999999995,3,101.066816395286,NA,"role_play","LIAM",1,0,0,0
"477","Briarwoods",3,26,477,"first_half_rp","SAM","no one insight checked her.",4241.517,4243.487,1.97000000000025,6,182.741116751245,NA,"role_play","SAM",1,0,0,0
"478","Briarwoods",3,26,478,"first_half_rp","TRAVIS","she's telling the truth. let's go make sure the prisoner isn't dead.",4243.487,4249.038,5.55099999999948,16,172.941812286091,NA,"role_play","TRAVIS",1,0,0,0
"479","Briarwoods",3,26,479,"first_half_rp","SAM","all right. so wait. what are our avenues? we're going to have to columbo this. what are our avenues of finding proof?",4249.038,4255.811,6.77300000000014,24,212.608888232684,NA,"role_play","SAM",1,0,0,0
"480","Briarwoods",3,26,480,"first_half_rp","LAURA","we say as we're walking back to the keep.",4255.811,4258.096,2.28499999999985,11,288.840262582075,NA,"role_play","LAURA",1,0,0,0
"481","Briarwoods",3,26,481,"first_half_rp","SAM","we have a prisoner we can question. who knows if that will yield anything. and then, we might have to go gather evidence, which means leaving town against his word.",4258.096,4268.745,10.6490000000003,31,174.664287726541,NA,"role_play","SAM",1,0,0,0
"482","Briarwoods",3,26,482,"first_half_rp","LAURA","well, we're allowed to leave town.",4268.745,4270.09,1.34500000000025,8,356.877323420007,NA,"role_play","LAURA",1,0,0,0
"483","Briarwoods",3,26,483,"first_half_rp","LIAM AND SAM","no!",4270.09,4271.506,1.41600000000017,2,84.7457627118544,NA,"role_play","LIAM AND SAM",1,0,0,0
"484","Briarwoods",3,26,484,"first_half_rp","LAURA","yeah! no! he said we're allowed to leave. we just can't look like we're fleeing, so we tell them where we're going. they can even fucking follow us. i don't care.",4271.506,4278.447,6.9409999999998,37,319.838639965432,NA,"role_play","LAURA",1,0,0,0
"485","Briarwoods",3,26,485,"first_half_rp","LIAM","so we tell them that we're going to their political the people that they're trying to create a political relationship with? we're just going off to invade your political allies.",4278.447,4290.24,11.7929999999997,34,172.983973543632,NA,"role_play","LIAM",1,0,0,0
"486","Briarwoods",3,26,486,"first_half_rp","TRAVIS","oh come on! you half-elves. i swear to god! have you never heard of lying before? yeah! we don't tell them where we're going. we're going on a field trip. we're going to pick berries. fuck all, but we go there.",4290.24,4302.166,11.9260000000004,47,236.45815864497,NA,"role_play","TRAVIS",1,0,0,0
"487","Briarwoods",3,26,487,"first_half_rp","ORION","the only way we can go there is telling them.",4302.166,4304.985,2.81899999999951,11,234.125576445589,NA,"role_play","ORION",1,0,0,0
"488","Briarwoods",3,26,488,"first_half_rp","TRAVIS","what? and we're going there, what for?",4304.985,4307.191,2.20600000000013,9,244.786944696268,NA,"role_play","TRAVIS",1,0,0,0
"489","Briarwoods",3,26,489,"first_half_rp","ORION","when i talk to asum and get that sigil to that damn briarwood keep. that's how we get there.",4307.191,4312.765,5.57400000000052,21,226.04951560816,NA,"role_play","ORION",1,0,0,0
"490","Briarwoods",3,26,490,"first_half_rp","TRAVIS","why don't we say we're taking a picnic oh, we took a wrong turn. hey, it's the briarwoods!",4312.765,4316.716,3.95100000000002,22,334.092634776004,NA,"role_play","TRAVIS",1,0,0,0
"491","Briarwoods",3,26,491,"first_half_rp","ORION","we don't have to lie to them. we tell them where we're going, and we can just go there.",4316.716,4321.334,4.61799999999948,22,285.838025119131,NA,"role_play","ORION",1,0,0,0
"492","Briarwoods",3,26,492,"first_half_rp","TRAVIS","we don't have to if we don't want to.",4321.334,4323.283,1.94900000000052,12,369.420215495026,NA,"role_play","TRAVIS",1,0,0,0
"493","Briarwoods",3,26,493,"first_half_rp","LIAM","you're pretty.",4323.283,4324.739,1.45599999999922,4,164.835164835253,NA,"role_play","LIAM",1,0,0,0
"494","Briarwoods",3,26,494,"first_half_rp","LAURA","especially that beardy side, grog.",4324.739,4327.75,3.01100000000042,6,119.561607439372,NA,"role_play","LAURA",1,0,0,0
"495","Briarwoods",3,26,495,"first_half_rp","TRAVIS","it's a full beard right now.",4327.75,4330.254,2.50399999999991,8,191.693290734832,NA,"role_play","TRAVIS",1,0,0,0
"496","Briarwoods",3,26,496,"first_half_rp","MATT","what you do know is the sigil that a teleportation circle is attached to is known when you cast or create the circle. the circle does not necessarily indicate or maintain the sigil it's attached to.",4330.254,4346.534,16.2799999999997,38,140.049140049142,NA,"role_play","MATT",0,0,0,1
"497","Briarwoods",3,26,497,"first_half_rp","ORION","it's just a piece of it?",4346.534,4347.802,1.26800000000003,8,378.548895899045,NA,"role_play","ORION",1,0,0,0
"498","Briarwoods",3,26,498,"first_half_rp","MATT","meaning, there are two parts to it. there is the sigil that it sends to, and there is the actual ritual circle that is created. the circle that attaches to it is not the same as the destination. there are elements of it that connect it, but you would not be able to ascertain a sigil to whitestone immediately from looking at the initial circle.",4347.802,4370.444,22.6420000000007,66,174.896210582098,NA,"role_play","MATT",0,0,0,1
"499","Briarwoods",3,26,499,"first_half_rp","LIAM","thanks for the cups, guys! the cup.",4370.444,4373.78,3.33599999999933,8,143.88489208636,NA,"role_play","LIAM",1,0,0,0
"500","Briarwoods",3,26,500,"first_half_rp","TRAVIS","i just noticed that!",4373.78,4376.494,2.71399999999994,5,110.537951363304,NA,"role_play","TRAVIS",1,0,0,0
"501","Briarwoods",3,26,501,"first_half_rp","LIAM","well, let's go check on this poor little shit in the dungeon.",4376.494,4382.894,6.40000000000055,14,131.249999999989,NA,"role_play","LIAM",1,0,0,0
"502","Briarwoods",3,26,502,"first_half_rp","SAM","and then the next step will be to seek out seeker asum?",4382.894,4386.846,3.95199999999932,13,197.368421052666,NA,"role_play","SAM",1,0,0,0
"503","Briarwoods",3,26,503,"first_half_rp","ORION","i'd like to stop by the temple real quick to pick up my decanter.",4386.846,4391.243,4.39700000000084,16,218.330680009055,NA,"role_play","ORION",1,0,0,0
"504","Briarwoods",3,26,504,"first_half_rp","SAM","how many errands do you have to run?",4391.243,4393.491,2.24799999999959,9,240.213523131716,NA,"role_play","SAM",1,0,0,0
"505","Briarwoods",3,26,505,"first_half_rp","LAURA","endless errands.",4393.491,4395.128,1.63699999999972,3,109.957238851577,NA,"role_play","LAURA",1,0,0,0
