"","arc","arc_no","episode","turn_number","segment","actor","text","start_turn","end_turn","time_in_sec","word_count","words_per_minute","encounter_count","rp_combat","actor_guest","vox_machina","guest","staff","matt"
"1264","Briarwoods",3,37,1264,"second_half_rp","MARISHA","what's his name?",8753.791,8755.318,1.52700000000004,5,196.463654223963,NA,"role_play","MARISHA",1,0,0,0
"1265","Briarwoods",3,37,1265,"second_half_rp","MATT","""don't know the name. but i know where he lives. we've looked at the place, cased it if you ""will. there could be a few ways in. unfortunately, we've become a little higher profile during our ""stay here than we expected and i don't know if we're quite as skilled in the realm of shadow-walking.""",8755.318,8780.909,25.5910000000003,63,147.708178656557,NA,"role_play","MATT",0,0,0,1
"1266","Briarwoods",3,37,1266,"second_half_rp","LAURA","doctor, we're quite skilled but we have a bit of a name for ourselves as well. i'm afraid we may not be able to help you out.",8780.909,8789.416,8.50699999999961,30,211.590454919488,NA,"role_play","LAURA",1,0,0,0
"1267","Briarwoods",3,37,1267,"second_half_rp","MATT","""right, very well.""",8789.416,8790.35,0.934000000001106,5,321.19914346857,NA,"role_play","MATT",0,0,0,1
"1268","Briarwoods",3,37,1268,"second_half_rp","TALIESIN","we're quite the opposite of low profile.",8790.35,8792.003,1.65300000000025,9,326.678765880169,NA,"role_play","TALIESIN",1,0,0,0
"1269","Briarwoods",3,37,1269,"second_half_rp","MATT","""well, not to worry. figured i'd pass it your way.""",8792.003,8794.992,2.98899999999958,13,260.956841753132,NA,"role_play","MATT",0,0,0,1
"1270","Briarwoods",3,37,1270,"second_half_rp","SAM","if we were to pursue it, what would your take be?",8794.992,8798.988,3.99599999999919,12,180.180180180217,NA,"role_play","SAM",1,0,0,0
"1271","Briarwoods",3,37,1271,"second_half_rp","MATT","""well, based on a finder's fee, and based on the relationship we've had all these years, our ""troupe would be happy to take a 40% cut.""",8798.988,8809.243,10.255000000001,30,175.524134568486,NA,"role_play","MATT",0,0,0,1
"1272","Briarwoods",3,37,1272,"second_half_rp","SAM","and this is a vast sum of money we might find?",8809.243,8814.685,5.4419999999991,12,132.304299889768,NA,"role_play","SAM",1,0,0,0
"1273","Briarwoods",3,37,1273,"second_half_rp","MATT","""from what i've heard, sizeable enough for me to want to include someone the likes of you. ""you know i don't like to include outsiders so regularly.""",8814.685,8825.45,10.7650000000012,31,172.782164421717,NA,"role_play","MATT",0,0,0,1
"1274","Briarwoods",3,37,1274,"second_half_rp","SAM","well, i'm not quite an outsider. yes, them. well, we could investigate, if you give us an address or description.",8825.45,8835.887,10.4369999999999,22,126.473124461053,NA,"role_play","SAM",1,0,0,0
"1275","Briarwoods",3,37,1275,"second_half_rp","MATT","""all right, all right.""",8835.887,8838.395,2.50799999999981,6,143.54066985647,NA,"role_play","MATT",0,0,0,1
"1276","Briarwoods",3,37,1276,"second_half_rp","LIAM","i haven't been paying close attention, but who is this mark?",8838.395,8842.168,3.77299999999923,13,206.73204346678,NA,"role_play","LIAM",1,0,0,0
"1277","Briarwoods",3,37,1277,"second_half_rp","LAURA","he didn't say his name.",8842.168,8844.009,1.84100000000035,7,228.136882129234,NA,"role_play","LAURA",1,0,0,0
"1278","Briarwoods",3,37,1278,"second_half_rp","LIAM","don't know his name, he's just a dickhead. that's all you know?",8844.009,8848.749,4.73999999999978,16,202.53164556963,NA,"role_play","LIAM",1,0,0,0
"1279","Briarwoods",3,37,1279,"second_half_rp","LAURA","what district does he live in?",8848.749,8850.69,1.94100000000071,7,216.383307573336,NA,"role_play","LAURA",1,0,0,0
"1280","Briarwoods",3,37,1280,"second_half_rp","TRAVIS","no, no, no. the old man wants to redistribute his wealth and we would be the vessel by which he would do that.",8850.69,8856.444,5.753999999999,24,250.260688216936,NA,"role_play","TRAVIS",1,0,0,0
"1281","Briarwoods",3,37,1281,"second_half_rp","MATT","""you've got a smart bodyguard on your hands, too! what's your name?""",8856.444,8865.149,8.70499999999993,16,110.281447443999,NA,"role_play","MATT",0,0,0,1
"1282","Briarwoods",3,37,1282,"second_half_rp","TRAVIS","grog.",8865.149,8866.914,1.76500000000124,2,67.9886685551931,NA,"role_play","TRAVIS",1,0,0,0
"1283","Briarwoods",3,37,1283,"second_half_rp","MATT","""that's a good name. yeah. speaks of intelligence.""",8866.914,8870.365,3.45099999999911,11,191.248913358496,NA,"role_play","MATT",0,0,0,1
"1284","Briarwoods",3,37,1284,"second_half_rp","MARISHA","insight check?",8870.365,8871.94,1.57500000000073,3,114.285714285661,NA,"role_play","MARISHA",1,0,0,0
"1285","Briarwoods",3,37,1285,"second_half_rp","MATT","sure.",8871.94,8872.997,1.05699999999888,2,113.52885525083,NA,"role_play","MATT",0,0,0,1
"1286","Briarwoods",3,37,1286,"second_half_rp","MARISHA","29.",8872.997,8876.652,3.65500000000065,2,32.8317373460953,NA,"role_play","MARISHA",1,0,0,0
"1287","Briarwoods",3,37,1287,"second_half_rp","LAURA","wow, that's a good insight check.",8876.652,8879.565,2.91300000000047,8,164.778578784732,NA,"role_play","LAURA",1,0,0,0
"1288","Briarwoods",3,37,1288,"second_half_rp","MARISHA","i rolled a 19.",8879.565,8881.098,1.53299999999945,5,195.694716242732,NA,"role_play","MARISHA",1,0,0,0
"1289","Briarwoods",3,37,1289,"second_half_rp","LAURA","secrets, secrets.",8881.098,8883.022,1.92400000000089,3,93.5550935550504,NA,"role_play","LAURA",1,0,0,0
"1290","Briarwoods",3,37,1290,"second_half_rp","MARISHA","i get secrets!",8883.022,8884.898,1.87599999999838,4,127.931769722925,NA,"role_play","MARISHA",1,0,0,0
"1291","Briarwoods",3,37,1291,"second_half_rp","SAM","pike, thank you for being my wingman back there.",8884.898,8902.722,17.8240000000005,10,33.6624775583473,NA,"role_play","SAM",1,0,0,0
"1292","Briarwoods",3,37,1292,"second_half_rp","ASHLEY","you're welcome, but how come you never told us about dr. dranzel? did you forget about him?",8902.722,8908.645,5.92300000000068,19,192.470032078316,NA,"role_play","ASHLEY",1,0,0,0
"1293","Briarwoods",3,37,1293,"second_half_rp","SAM","i told you",8908.645,8909.955,1.30999999999949,3,137.404580152725,NA,"role_play","SAM",1,0,0,0
"1294","Briarwoods",3,37,1294,"second_half_rp","ASHLEY","did you forget about dr. dranzel?",8909.955,8912.721,2.76599999999962,7,151.843817787439,NA,"role_play","ASHLEY",1,0,0,0
"1295","Briarwoods",3,37,1295,"second_half_rp","TRAVIS","you forgot about dranzel. those motherfuckers act like they forgot about dranzel.",8912.721,8923.908,11.1869999999999,13,69.7237865379465,NA,"role_play","TRAVIS",1,0,0,0
"1296","Briarwoods",3,37,1296,"second_half_rp","TALIESIN","this is my favorite thing ever.",8926.045,8927.622,1.57699999999932,7,266.32847178198,NA,"role_play","TALIESIN",1,0,0,0
"1297","Briarwoods",3,37,1297,"second_half_rp","MATT","""but no worries.""",8927.622,8928.757,1.13500000000022,5,264.317180616689,NA,"role_play","MATT",0,0,0,1
"1298","Briarwoods",3,37,1298,"second_half_rp","MARISHA","so you're just, out of the good of your heart, wanting to redistribute a little bit of funds to help out a few less fortunate people, that's all you have in this?",8928.757,8942.591,13.8340000000007,35,151.799913257184,NA,"role_play","MARISHA",1,0,0,0
"1299","Briarwoods",3,37,1299,"second_half_rp","MATT","""yeah!""",8942.591,8944.169,1.57799999999952,3,114.068441064673,NA,"role_play","MATT",0,0,0,1
"1300","Briarwoods",3,37,1300,"second_half_rp","MARISHA","really?",8944.169,8945.296,1.12700000000041,2,106.47737355808,NA,"role_play","MARISHA",1,0,0,0
"1301","Briarwoods",3,37,1301,"second_half_rp","MATT","""we're all rather less fortunate than this dickhead, and i don't see why a little off his ""table wouldn't even be noticed, probably.""",8945.296,8955.149,9.85299999999916,28,170.506444737658,NA,"role_play","MATT",0,0,0,1
"1302","Briarwoods",3,37,1302,"second_half_rp","MARISHA","and where exactly did you find this information? on this dickhead?",8955.149,8960.393,5.2440000000006,12,137.299771167032,NA,"role_play","MARISHA",1,0,0,0
"1303","Briarwoods",3,37,1303,"second_half_rp","TRAVIS","i think he said he asked him.",8960.393,8962.201,1.80799999999908,8,265.486725663851,NA,"role_play","TRAVIS",1,0,0,0
"1304","Briarwoods",3,37,1304,"second_half_rp","MARISHA","you asked him? what?",8962.201,8965.294,3.09300000000076,5,96.993210475243,NA,"role_play","MARISHA",1,0,0,0
"1305","Briarwoods",3,37,1305,"second_half_rp","TRAVIS","no, no the old man asked him: oh, i need to redistribute.",8965.294,8967.526,2.23199999999997,13,349.462365591402,NA,"role_play","TRAVIS",1,0,0,0
"1306","Briarwoods",3,37,1306,"second_half_rp","MATT","i have my reasons, my connections, my friends here, and i've been told that his estate has been abandoned for some time, actually.",8967.526,8975.887,8.36100000000079,25,179.404377466793,NA,"role_play","MATT",0,0,0,1
"1307","Briarwoods",3,37,1307,"second_half_rp","SAM","keyleth, this is an old friend of mine, who i trust very much. he saved me when i was troubled and taught me much about the ways of performing and charming. he has my full trust.",8975.887,8992.157,16.2699999999986,37,136.447449293189,NA,"role_play","SAM",1,0,0,0
"1308","Briarwoods",3,37,1308,"second_half_rp","MARISHA","well, if i know anything about your skills, scanlan, i think it says a lot about dr. dranzel. so",8992.157,8998.303,6.14600000000064,19,185.486495281465,NA,"role_play","MARISHA",1,0,0,0
"1309","Briarwoods",3,37,1309,"second_half_rp","SAM","i'll take that as a compliment.",8998.303,8999.75,1.44700000000012,8,331.720801658577,NA,"role_play","SAM",1,0,0,0
"1310","Briarwoods",3,37,1310,"second_half_rp","MARISHA","you're welcome. forgive me if i'm",8999.75,9002.093,2.34300000000076,8,204.865556978167,NA,"role_play","MARISHA",1,0,0,0
"1311","Briarwoods",3,37,1311,"second_half_rp","TALIESIN","i think we obviously any friend of scanlan is a friend of ours and i think if dr. dranzel here may i call you dr. dranzel?",9002.093,9009.507,7.41399999999885,27,218.505530078264,NA,"role_play","TALIESIN",1,0,0,0
"1312","Briarwoods",3,37,1312,"second_half_rp","MATT","""you may.""",9009.507,9011.021,1.51400000000103,4,158.520475561319,NA,"role_play","MATT",0,0,0,1
"1313","Briarwoods",3,37,1313,"second_half_rp","ASHLEY","can i call you dr. dra?",9011.021,9013.834,2.8130000000001,7,149.306789904012,NA,"role_play","ASHLEY",1,0,0,0
"1314","Briarwoods",3,37,1314,"second_half_rp","TALIESIN","that has a really nice ring to it.",9013.834,9017.699,3.86499999999978,9,139.715394566631,NA,"role_play","TALIESIN",1,0,0,0
"1315","Briarwoods",3,37,1315,"second_half_rp","MATT","""sounds to me unfinished and rather sloppy. just doctor is fine.""",9017.699,9021.634,3.93499999999949,13,198.221092757332,NA,"role_play","MATT",0,0,0,1
"1316","Briarwoods",3,37,1316,"second_half_rp","ASHLEY","all right. sorry.",9021.634,9023.054,1.42000000000007,4,169.014084507034,NA,"role_play","ASHLEY",1,0,0,0
"1317","Briarwoods",3,37,1317,"second_half_rp","TALIESIN","professor dranzel.",9023.054,9024.522,1.46800000000076,3,122.615803814651,NA,"role_play","TALIESIN",1,0,0,0
"1318","Briarwoods",3,37,1318,"second_half_rp","MATT","""yes? doctor. doctor.""",9024.522,9026.061,1.53899999999885,5,194.931773879288,NA,"role_play","MATT",0,0,0,1
"1319","Briarwoods",3,37,1319,"second_half_rp","TALIESIN","dr. dranzel, and i want to know if you're really a doctor later, but i think, perhaps, maybe there's a little tidbit of information about this that you're holding back with because i would understand. we're new. we don't really know each other. we're not really on that friendship level yet, but my point is, we could be friends like that. we could be i'm trying to see if this works.",9026.061,9056.418,30.357,79,156.141911256053,NA,"role_play","TALIESIN",1,0,0,0
"1320","Briarwoods",3,37,1320,"second_half_rp","MATT","make a persuasion check.",9056.418,9059.198,2.78000000000065,5,107.913669064723,NA,"role_play","MATT",0,0,0,1
"1321","Briarwoods",3,37,1321,"second_half_rp","TALIESIN","you know what i'm doing. i'm attempting friends.",9059.198,9063.637,4.43900000000031,11,148.68213561612,NA,"role_play","TALIESIN",1,0,0,0
"1322","Briarwoods",3,37,1322,"second_half_rp","MATT","oh, interesting.",9063.637,9064.981,1.34399999999914,3,133.928571428657,NA,"role_play","MATT",0,0,0,1
"1323","Briarwoods",3,37,1323,"second_half_rp","TALIESIN","i'm attempting.",9064.981,9066.118,1.13700000000063,4,211.081794195135,NA,"role_play","TALIESIN",1,0,0,0
"1324","Briarwoods",3,37,1324,"second_half_rp","MATT","okay, okay. good to know this. all right, then. what saving throw does he get for that one?",9066.118,9072.689,6.57099999999991,19,173.489575407094,NA,"role_play","MATT",0,0,0,1
"1325","Briarwoods",3,37,1325,"second_half_rp","TALIESIN","i get advantage on charisma rolls.",9072.689,9074.969,2.27999999999884,7,184.210526315884,NA,"role_play","TALIESIN",1,0,0,0
"1326","Briarwoods",3,37,1326,"second_half_rp","MATT","oh, right, right. okay, okay. yep, go for it.",9074.969,9083.034,8.06500000000051,10,74.3955362678192,NA,"role_play","MATT",0,0,0,1
"1327","Briarwoods",3,37,1327,"second_half_rp","TALIESIN","am i just rolling charisma?",9083.034,9085.456,2.42200000000048,6,148.637489677923,NA,"role_play","TALIESIN",1,0,0,0
"1328","Briarwoods",3,37,1328,"second_half_rp","MATT","you're rolling a persuasion with advantage.",9085.456,9087.634,2.17799999999988,8,220.385674931141,NA,"role_play","MATT",0,0,0,1
"1329","Briarwoods",3,37,1329,"second_half_rp","TALIESIN","oh, persuasion roll with advantage. oh, that's nice. 23.",9087.634,9096.706,9.07200000000012,11,72.7513227513218,NA,"role_play","TALIESIN",1,0,0,0
"1330","Briarwoods",3,37,1330,"second_half_rp","MATT","okay. he looks to you and goes, ""we don't know who it is. we've been told it's in the ""cloudtop district. it's a red brick building. it's been abandoned for over a year and apparently it's ""been well boarded up. but from what i've been told, quite a lot of wealth is down there. but ""it's a bit dangerous of an entry. we have no way of getting into the cloudtop, but these myths keep ""finding our ears.""",9096.706,9127.053,30.3469999999998,87,172.010412890897,NA,"role_play","MATT",0,0,0,1
"1331","Briarwoods",3,37,1331,"second_half_rp","TALIESIN","if it's the house that i think it is, it's already been",9127.053,9132.771,5.71800000000076,14,146.904512067137,NA,"role_play","TALIESIN",1,0,0,0
"1332","Briarwoods",3,37,1332,"second_half_rp","LAURA","pillaged?",9132.771,9134.292,1.52099999999882,2,78.8954635109093,NA,"role_play","LAURA",1,0,0,0
"1333","Briarwoods",3,37,1333,"second_half_rp","TALIESIN","pillaged. pillaged is a good word. the rumors were not incorrect but",9134.292,9141.766,7.47400000000016,12,96.3339577200943,NA,"role_play","TALIESIN",1,0,0,0
"1334","Briarwoods",3,37,1334,"second_half_rp","SAM","what house is this?",9141.766,9143.653,1.88700000000063,5,158.982511923636,NA,"role_play","SAM",1,0,0,0
"1335","Briarwoods",3,37,1335,"second_half_rp","TALIESIN","do you remember with the agon-day with our utler-bay?",9143.653,9150.414,6.76100000000042,12,106.493122319177,NA,"role_play","TALIESIN",1,0,0,0
"1336","Briarwoods",3,37,1336,"second_half_rp","SAM","i don't speak latin.",9150.414,9153.194,2.77999999999884,6,129.496402877752,NA,"role_play","SAM",1,0,0,0
"1337","Briarwoods",3,37,1337,"second_half_rp","LAURA","pretty sure it's already been cleaned out.",9153.194,9156.906,3.71200000000135,9,145.474137930981,NA,"role_play","LAURA",1,0,0,0
"1338","Briarwoods",3,37,1338,"second_half_rp","MATT","""that's unfortunate.""",9156.906,9159.355,2.4489999999987,5,122.498979175238,NA,"role_play","MATT",0,0,0,1
"1339","Briarwoods",3,37,1339,"second_half_rp","LAURA","unless you're hearing things we don't know about.",9159.355,9164.405,5.05000000000109,11,130.693069306902,NA,"role_play","LAURA",1,0,0,0
"1340","Briarwoods",3,37,1340,"second_half_rp","MATT","""i know that a few individuals have tried to make their way in. came out with hefty sums of ""gold but seemed to be a bit spooked.""",9164.405,9175.578,11.1729999999989,29,155.732569587414,NA,"role_play","MATT",0,0,0,1
"1341","Briarwoods",3,37,1341,"second_half_rp","LIAM","i'm gonna pull up a chair and sit down in front of him. hi, there. my name's greg. greg. yeah, i'm scanlan's friend, craig.",9175.578,9184.355,8.77700000000004,29,198.24541415062,NA,"role_play","LIAM",1,0,0,0
"1342","Briarwoods",3,37,1342,"second_half_rp","MATT","""hello, greg. all right, craig.""",9184.355,9185.761,1.40600000000086,7,298.719772403801,NA,"role_play","MATT",0,0,0,1
"1343","Briarwoods",3,37,1343,"second_half_rp","LIAM","scanlan might be able to help you with this. i'll definitely be able to help you with this, but i'm not going to do anything unless i know something more, so if you want to go into the house, if you want me to break us into the house, which i can certainly do, i really need to know a little bit more. your chances of getting whatever you're after inside raise if you're honest with me. and i don't feel yet like you're being honest with me, so i want to help you, but i don't think i can and without me, i'm sorry, i'm sorry, but we're not getting in the house, so is there anything else you wanna tell me about?",9185.761,9217.151,31.3899999999994,135,258.043963045561,NA,"role_play","LIAM",1,0,0,0
"1344","Briarwoods",3,37,1344,"second_half_rp","MATT","""that's all i know. all i know is they've had a few other of the thieving persuasion have ""made their way in before and they came out with a decent chunk of change, given that they could only ""be in there for a short time.""",9217.151,9233.909,16.7579999999998,49,175.43859649123,NA,"role_play","MATT",0,0,0,1
"1345","Briarwoods",3,37,1345,"second_half_rp","LIAM","i'm gonna insight check. that is a 19.",9233.909,9240.183,6.27400000000125,10,95.6327701625566,NA,"role_play","LIAM",1,0,0,0
"1346","Briarwoods",3,37,1346,"second_half_rp","MATT","he's hard to read, but the best you can tell is he's been pretty clear with you. and at this point as you're looking at him, his eyes go",9240.183,9250.513,10.3299999999999,32,185.866408518878,NA,"role_play","MATT",0,0,0,1
"1347","Briarwoods",3,37,1347,"second_half_rp","TALIESIN","and this is the point where i buy you a beer. and i put the coin down.",9250.513,9255.857,5.34399999999914,18,202.095808383266,NA,"role_play","TALIESIN",1,0,0,0
"1348","Briarwoods",3,37,1348,"second_half_rp","MATT","""you're a tricky one. all right, you've got yourself some talented compadres.""",9255.857,9265.097,9.23999999999978,16,103.896103896106,NA,"role_play","MATT",0,0,0,1
"1349","Briarwoods",3,37,1349,"second_half_rp","SAM","well, they can't play as well as you, but they're pretty good.",9265.097,9268.311,3.21399999999994,15,280.024891101436,NA,"role_play","SAM",1,0,0,0
"1350","Briarwoods",3,37,1350,"second_half_rp","MATT","he takes the coin. takes the drink. ""well, you know where it is. you know what it looks like. ""if you're interested in finding your way in and come out with anything, we'll be here about ""another week.""",9268.311,9283.802,15.491,41,158.801884965464,NA,"role_play","MATT",0,0,0,1
"1351","Briarwoods",3,37,1351,"second_half_rp","LAURA","all right. how long have you been here?",9283.802,9285.896,2.09400000000096,9,257.87965616034,NA,"role_play","LAURA",1,0,0,0
"1352","Briarwoods",3,37,1352,"second_half_rp","MATT","""probably been here about two weeks now. two and a half weeks.""",9285.896,9289.44,3.54399999999987,14,237.020316027097,NA,"role_play","MATT",0,0,0,1
"1353","Briarwoods",3,37,1353,"second_half_rp","LAURA","hmm. have you noticed i'm sure you've seen many people come in and out, but an older gentleman dressed much nicer than he should be in an establishment like this?",9289.44,9300.347,10.9069999999992,33,181.534794168895,NA,"role_play","LAURA",1,0,0,0
"1354","Briarwoods",3,37,1354,"second_half_rp","MATT","you describe riskel to him? riskel's elven. thin features, older. has some battle scars, but long-ish hair kept behind his ears. and as you describe it, he goes, ""yes, yes actually. we had a gentleman like that who came in here a couple of times about a week ""ago, and last saw a few days ago.""",9300.347,9324.892,24.5450000000001,59,144.224893053575,NA,"role_play","MATT",0,0,0,1
"1355","Briarwoods",3,37,1355,"second_half_rp","LAURA","a few days ago?",9324.892,9325.964,1.07200000000012,5,279.850746268626,NA,"role_play","LAURA",1,0,0,0
"1356","Briarwoods",3,37,1356,"second_half_rp","MATT","""yeah! he came in and watched one of our performances. tipped us rather well!""",9325.964,9328.786,2.82200000000012,16,340.184266477661,NA,"role_play","MATT",0,0,0,1
"1357","Briarwoods",3,37,1357,"second_half_rp","LAURA","did he?",9328.786,9330.059,1.27299999999923,3,141.398271798986,NA,"role_play","LAURA",1,0,0,0
"1358","Briarwoods",3,37,1358,"second_half_rp","MATT","""seemed a bit hurried.""",9330.059,9331.909,1.85000000000036,6,194.594594594556,NA,"role_play","MATT",0,0,0,1
"1359","Briarwoods",3,37,1359,"second_half_rp","LAURA","yes. did you see where he went?",9331.909,9334.039,2.13000000000102,8,225.352112675949,NA,"role_play","LAURA",1,0,0,0
"1360","Briarwoods",3,37,1360,"second_half_rp","MATT","""no, i assumed he was staying here at the tavern.""",9334.039,9337.3,3.2609999999986,12,220.79116835336,NA,"role_play","MATT",0,0,0,1
"1361","Briarwoods",3,37,1361,"second_half_rp","LAURA","really? are there rooms here?",9337.3,9340.954,3.65400000000045,6,98.5221674876726,NA,"role_play","LAURA",1,0,0,0
"1362","Briarwoods",3,37,1362,"second_half_rp","MATT","""yeah. just upstairs, they have rooms here.""",9340.954,9343.255,2.30099999999948,9,234.680573663678,NA,"role_play","MATT",0,0,0,1
"1363","Briarwoods",3,37,1363,"second_half_rp","TALIESIN","you should see if there's rooms downstairs.",9343.255,9345.628,2.37300000000141,9,227.560050568765,NA,"role_play","TALIESIN",1,0,0,0
"1364","Briarwoods",3,37,1364,"second_half_rp","LAURA","yeah. i get up and leave the table and go talk to the barkeep.",9345.628,9348.574,2.94599999999991,15,305.49898167007,NA,"role_play","LAURA",1,0,0,0
"1365","Briarwoods",3,37,1365,"second_half_rp","SAM","do you guys want us to create some sort of distraction while you go search the place?",9348.574,9353.104,4.52999999999884,18,238.410596026551,NA,"role_play","SAM",1,0,0,0
"1366","Briarwoods",3,37,1366,"second_half_rp","LAURA","i'm going to talk to the barkeep and talk about rooms, potentially, first.",9353.104,9356.6,3.496000000001,15,257.437070938141,NA,"role_play","LAURA",1,0,0,0
"1367","Briarwoods",3,37,1367,"second_half_rp","SAM","for us?",9356.6,9357.999,1.39899999999943,3,128.663330950731,NA,"role_play","SAM",1,0,0,0
"1368","Briarwoods",3,37,1368,"second_half_rp","LAURA","just seeing what they have available, and what's being rented right now.",9357.999,9361.667,3.66799999999967,14,229.007633587807,NA,"role_play","LAURA",1,0,0,0
"1369","Briarwoods",3,37,1369,"second_half_rp","SAM","because we know he's downstairs.",9361.667,9363.271,1.60400000000118,7,261.845386533473,NA,"role_play","SAM",1,0,0,0
"1370","Briarwoods",3,37,1370,"second_half_rp","MARISHA","yeah, i was going to say, he was going to go downstairs. i'll go with team downstairs.",9363.271,9370.294,7.02299999999923,19,162.323793250765,NA,"role_play","MARISHA",1,0,0,0
"1371","Briarwoods",3,37,1371,"second_half_rp","TALIESIN","team downstairs it is.",9370.294,9373.257,2.96299999999974,5,101.248734390829,NA,"role_play","TALIESIN",1,0,0,0
"1372","Briarwoods",3,37,1372,"second_half_rp","ASHLEY","team downstairs.",9373.257,9374.526,1.26900000000023,3,141.84397163118,NA,"role_play","ASHLEY",1,0,0,0
"1373","Briarwoods",3,37,1373,"second_half_rp","MATT","as you head to the barkeep, you see a dwarven woman wearing a simple blouse, but pulled up past the elbows. she's currently wiping down part of the front you can see her hair is pulled up to a ponytail that drifts past her shoulders down to the center of her chest. she glances up to you as you approach. ""hi, so what can i get you, dear?""",9374.526,9397.032,22.5059999999994,70,186.616902159429,NA,"role_play","MATT",0,0,0,1
"1374","Briarwoods",3,37,1374,"second_half_rp","LAURA","hi. you have rooms, yes?",9397.032,9400.892,3.86000000000058,6,93.2642487046491,NA,"role_play","LAURA",1,0,0,0
"1375","Briarwoods",3,37,1375,"second_half_rp","MATT","""we have rooms, aye. we only got one currently not occupied.""",9400.892,9408.705,7.8130000000001,13,99.8336106489172,NA,"role_play","MATT",0,0,0,1
"1376","Briarwoods",3,37,1376,"second_half_rp","LAURA","do you have an older gentleman? elven, battle scars i describe him staying here right now?",9408.705,9413.105,4.39999999999964,17,231.818181818201,NA,"role_play","LAURA",1,0,0,0
"1377","Briarwoods",3,37,1377,"second_half_rp","MATT","""no? no, i haven't seen someone like that.""",9413.105,9419.048,5.94300000000112,11,111.055022715779,NA,"role_play","MATT",0,0,0,1
"1378","Briarwoods",3,37,1378,"second_half_rp","LAURA","insight-check her?",9419.048,9420.353,1.30499999999847,4,183.908045977227,NA,"role_play","LAURA",1,0,0,0
"1379","Briarwoods",3,37,1379,"second_half_rp","MATT","make an insight check.",9420.353,9421.997,1.64400000000023,5,182.481751824792,NA,"role_play","MATT",0,0,0,1
"1380","Briarwoods",3,37,1380,"second_half_rp","LAURA","that's okay. 23?",9421.997,9426.799,4.8020000000015,5,62.473969179489,NA,"role_play","LAURA",1,0,0,0
"1381","Briarwoods",3,37,1381,"second_half_rp","MATT","23? her demeanor has changed, and she has gotten guarded. ""nope, haven't seen anyone like ""that here. sorry! no. a lot of patrons coming through.""",9426.799,9444.02,17.2209999999995,27,94.0711921491227,NA,"role_play","MATT",0,0,0,1
