"","arc","arc_no","episode","turn_number","segment","actor","text","start_turn","end_turn","time_in_sec","word_count","words_per_minute","encounter_count","rp_combat","actor_guest","vox_machina","guest","staff","matt"
"690","Briarwoods",3,37,690,"first_half_rp","MATT","he leans forward and puts his hand out. ""please, anything""",4286.97,4291.777,4.80699999999979,11,137.299771167054,NA,"role_play","MATT",0,0,0,1
"691","Briarwoods",3,37,691,"first_half_rp","SAM","of course, we gathered this from the palace in whitestone.",4291.777,4296.204,4.42699999999968,11,149.085159250067,NA,"role_play","SAM",1,0,0,0
"692","Briarwoods",3,37,692,"first_half_rp","MATT","thumbing through the paperwork. ""it's not asum."" he hands it over and asum takes a moment of quiet to himself to thumb through, and he's very carefully inspecting and looking about the edges.",4296.204,4317.712,21.5080000000007,36,100.427747814763,NA,"role_play","MATT",0,0,0,1
"693","Briarwoods",3,37,693,"first_half_rp","LAURA","are you looking for something specific?",4317.712,4320.003,2.29099999999926,7,183.326058489802,NA,"role_play","LAURA",1,0,0,0
"694","Briarwoods",3,37,694,"first_half_rp","MATT","""i'm currently confirming handwriting. one that i deal with quite often.""",4320.003,4327.456,7.45300000000043,14,112.706292768006,NA,"role_play","MATT",0,0,0,1
"695","Briarwoods",3,37,695,"first_half_rp","LAURA","oh, yes, actually, that is something we discovered on our own.",4327.456,4334.971,7.51499999999942,12,95.8083832335404,NA,"role_play","LAURA",1,0,0,0
"696","Briarwoods",3,37,696,"first_half_rp","MATT","""my liege, these papers do appear to be genuine, and that does indeed appear to be the ""handwriting of riskel daxio.""",4334.971,4344.127,9.15600000000086,23,150.720838794219,NA,"role_play","MATT",0,0,0,1
"697","Briarwoods",3,37,697,"first_half_rp","MARISHA","yeah, sorry.",4344.127,4347.411,3.28399999999965,3,54.8112058465344,NA,"role_play","MARISHA",1,0,0,0
"698","Briarwoods",3,37,698,"first_half_rp","MATT","uriel takes the papers back and, ""it's not he's been at my side since i was young. his ""father, mikael, helms our forces at fort daxio. guards! find and seize riskel daxio at once."" the guards immediately go to action, bringing their weapons and scattering outside of the throne room. you can hear the clanging of footsteps, heavy footfalls, and weapons and shields banging as they start just scattering about the entire palace around you.",4347.411,4381.323,33.9120000000003,78,138.0042462845,NA,"role_play","MATT",0,0,0,1
"699","Briarwoods",3,37,699,"first_half_rp","TRAVIS","hate to be him right now.",4381.323,4382.886,1.5630000000001,7,268.714011516297,NA,"role_play","TRAVIS",1,0,0,0
"700","Briarwoods",3,37,700,"first_half_rp","SAM","did you just say that there's a fort somewhere?",4382.886,4384.905,2.01899999999932,11,326.894502228936,NA,"role_play","SAM",1,0,0,0
"701","Briarwoods",3,37,701,"first_half_rp","MARISHA","fort daxio?",4384.905,4385.974,1.06900000000041,3,168.381665107512,NA,"role_play","MARISHA",1,0,0,0
"702","Briarwoods",3,37,702,"first_half_rp","MATT","""fort daxio. it's our northern military post. it's by the cliffkeep mountains. lots of ""very dangerous things reside up there, giant creatures, and he holds the border. he's the ""adopted father of riskel, not his actual""",4385.974,4400.571,14.5969999999998,41,168.527779680759,NA,"role_play","MATT",0,0,0,1
"703","Briarwoods",3,37,703,"first_half_rp","SAM","but any connection to this traitor may it may be dangerous for him to be in command up there. this whole place could be a risk.",4400.571,4410.551,9.98000000000047,27,162.324649298589,NA,"role_play","SAM",1,0,0,0
"704","Briarwoods",3,37,704,"first_half_rp","MATT","""i shall look into it. they haven't spoken in quite a long time, and as far as i know there ""wasn't a lot of love between the two. besides, mikael is not at the fort right now, mikael is ""down in syngorn on a diplomatic military mission.""",4410.551,4423.041,12.4899999999998,51,244.995996797442,NA,"role_play","MATT",0,0,0,1
"705","Briarwoods",3,37,705,"first_half_rp","TALIESIN","your majesty, i know well the betrayal you feel, and i urge caution.",4423.041,4429.828,6.78700000000026,14,123.766023279795,NA,"role_play","TALIESIN",1,0,0,0
"706","Briarwoods",3,37,706,"first_half_rp","MATT","""caution it is.""",4429.828,4432.856,3.02799999999934,5,99.0752972259133,NA,"role_play","MATT",0,0,0,1
"707","Briarwoods",3,37,707,"first_half_rp","TRAVIS","don't forget about kibble.",4432.856,4434.982,2.1260000000002,6,169.332079021621,NA,"role_play","TRAVIS",1,0,0,0
"708","Briarwoods",3,37,708,"first_half_rp","LAURA","oh, that's right, i guess we don't need him to testify",4434.982,4438.495,3.51299999999992,13,222.032450896675,NA,"role_play","LAURA",1,0,0,0
"709","Briarwoods",3,37,709,"first_half_rp","SAM","well we should bring him out just to, just 'cause otherwise he just sat around for nothing.",4438.495,4445.398,6.90300000000025,18,156.453715775744,NA,"role_play","SAM",1,0,0,0
"710","Briarwoods",3,37,710,"first_half_rp","MATT","you look behind and desmond is standing behind you all, wide-eyed and so confused and overwhelmed by everything that's happening, and just eagerly awaiting for you to fill him in",4445.398,4452.158,6.76000000000022,32,284.023668639044,NA,"role_play","MATT",0,0,0,1
"711","Briarwoods",3,37,711,"first_half_rp","TALIESIN","this young man was an unfortunate victim of my wrath when the briarwoods visited. he is a citizen of whitestone, and",4452.158,4460.174,8.01599999999962,21,157.185628742522,NA,"role_play","TALIESIN",1,0,0,0
"712","Briarwoods",3,37,712,"first_half_rp","MATT","""yes, yes i was told of this, the carriage-man that you had attacked.""",4460.174,4463.865,3.6909999999998,16,260.092115957749,NA,"role_play","MATT",0,0,0,1
"713","Briarwoods",3,37,713,"first_half_rp","TALIESIN","i would like to have him be the official letter carrier for any the first set of correspondence to the new rulers of whitecastle, so since he",4463.865,4472.168,8.30299999999988,27,195.110201132124,NA,"role_play","TALIESIN",1,0,0,0
"714","Briarwoods",3,37,714,"first_half_rp","SAM","stone.",4472.168,4473.481,1.3130000000001,2,91.3937547600843,NA,"role_play","SAM",1,0,0,0
"715","Briarwoods",3,37,715,"first_half_rp","TALIESIN","whitestone. my god, i'm hungry.",4473.481,4475.353,1.8720000000003,7,224.358974358939,NA,"role_play","TALIESIN",1,0,0,0
"716","Briarwoods",3,37,716,"first_half_rp","LIAM","oh no! so if you could send an order of sliders",4475.353,4478.399,3.04600000000028,11,216.677609980282,NA,"role_play","LIAM",1,0,0,0
"717","Briarwoods",3,37,717,"first_half_rp","TALIESIN","about 12.",4478.399,4479.55,1.15099999999984,3,156.385751520439,NA,"role_play","TALIESIN",1,0,0,0
"718","Briarwoods",3,37,718,"first_half_rp","MARISHA","don't forget the mustard.",4479.55,4481.721,2.17099999999937,6,165.822201750394,NA,"role_play","MARISHA",1,0,0,0
"719","Briarwoods",3,37,719,"first_half_rp","TALIESIN","i'm coming up with this shit. it's not easy.",4481.721,4483.836,2.11500000000069,12,340.425531914782,NA,"role_play","TALIESIN",1,0,0,0
"720","Briarwoods",3,37,720,"first_half_rp","TRAVIS","might need some gut healing after those.",4483.836,4486.511,2.67500000000018,8,179.439252336436,NA,"role_play","TRAVIS",1,0,0,0
"721","Briarwoods",3,37,721,"first_half_rp","TALIESIN","i know. constitution roll.",4486.511,4489.411,2.89999999999964,5,103.448275862082,NA,"role_play","TALIESIN",1,0,0,0
"722","Briarwoods",3,37,722,"first_half_rp","TALIESIN","would it be reasonable to appoint him as our first correspondence messenger, since he must return home at the very least?",4491.101,4501.697,10.5960000000005,22,124.575311438273,NA,"role_play","TALIESIN",1,0,0,0
"723","Briarwoods",3,37,723,"first_half_rp","MATT","""yes. i would still wish to send him with a few of our trusted soldiers to keep him safe. the ""roads are not safe between here and whitestone in general, and i mean no offense to you, young sir, ""but you don't look able with a weapon.""",4501.697,4513.761,12.0640000000003,50,248.673740053044,NA,"role_play","MATT",0,0,0,1
"724","Briarwoods",3,37,724,"first_half_rp","LAURA","especially not against harpies.",4513.761,4516.517,2.7559999999994,5,108.853410740227,NA,"role_play","LAURA",1,0,0,0
"725","Briarwoods",3,37,725,"first_half_rp","TALIESIN","i should also mention that my lineage has now been restored to me, and i am now of royal descent once again. and so, again, with my companions' permission, and we will discuss this in the future, but i would like to put forward the beginnings of the proper paperwork to perhaps have greyskull keep designated as an embassy, with all the privileges and rights that that presumes.",4516.517,4545.179,28.6620000000003,69,144.442118484403,NA,"role_play","TALIESIN",1,0,0,0
"726","Briarwoods",3,37,726,"first_half_rp","ASHLEY","what does that mean?",4545.179,4547.233,2.05400000000009,5,146.056475170393,NA,"role_play","ASHLEY",1,0,0,0
"727","Briarwoods",3,37,727,"first_half_rp","MATT","""that could, no, that will be arranged.""",4547.233,4550.546,3.3130000000001,9,162.994265016596,NA,"role_play","MATT",0,0,0,1
"728","Briarwoods",3,37,728,"first_half_rp","TALIESIN","i will confer with my peers.",4550.546,4553.568,3.02199999999993,7,138.980807412313,NA,"role_play","TALIESIN",1,0,0,0
"729","Briarwoods",3,37,729,"first_half_rp","LIAM","you're on whitestone soil.",4553.568,4555.437,1.86899999999969,6,192.616372391686,NA,"role_play","LIAM",1,0,0,0
"730","Briarwoods",3,37,730,"first_half_rp","SAM","before we give desmond his appointment as a royal messenger, which i guess he is, would the kingdom he risked much to keep himself alive and possibly to testify on our behalf would the kingdom be willing to give him a quick little reward for his time spent in captivity?",4555.437,4580.628,25.1909999999998,51,121.471954269383,NA,"role_play","SAM",1,0,0,0
"731","Briarwoods",3,37,731,"first_half_rp","MATT","make a persuasion roll.",4580.628,4582.723,2.09500000000025,5,143.198090692107,NA,"role_play","MATT",0,0,0,1
"732","Briarwoods",3,37,732,"first_half_rp","SAM","not great. 24.",4582.723,4590.507,7.78399999999965,4,30.8324768756437,NA,"role_play","SAM",1,0,0,0
"733","Briarwoods",3,37,733,"first_half_rp","MATT","not great.",4590.507,4592.222,1.71500000000015,3,104.956268221565,NA,"role_play","MATT",0,0,0,1
"734","Briarwoods",3,37,734,"first_half_rp","TRAVIS","yeah, come on.",4592.222,4594.188,1.96600000000035,4,122.075279755828,NA,"role_play","TRAVIS",1,0,0,0
"735","Briarwoods",3,37,735,"first_half_rp","MATT","he gives a nod and looks to desmond. ""certainly. it's only fair. you've travelled this ""far and undergone much personal difficulty in aiding us and relieving this darkness in our ""territory, and yours as well. i would like to grant upon him by my estate as sovereign uriel a ""granted gift of 1,000 gold pieces to be sent on his way.""",4594.188,4618.706,24.518,65,159.066808059385,NA,"role_play","MATT",0,0,0,1
"736","Briarwoods",3,37,736,"first_half_rp","SAM","that's more than what we would've done by far!",4618.706,4620.869,2.16299999999956,12,332.871012482731,NA,"role_play","SAM",1,0,0,0
"737","Briarwoods",3,37,737,"first_half_rp","MATT","desmond's like: ""i-i""",4620.869,4624.932,4.0630000000001,6,88.604479448681,NA,"role_play","MATT",0,0,0,1
"738","Briarwoods",3,37,738,"first_half_rp","SAM","don't faint!",4624.932,4627.14,2.20800000000054,4,108.695652173887,NA,"role_play","SAM",1,0,0,0
"739","Briarwoods",3,37,739,"first_half_rp","MARISHA","don't spend it all in one place, bruh.",4627.14,4629.227,2.08699999999953,10,287.494010541511,NA,"role_play","MARISHA",1,0,0,0
"740","Briarwoods",3,37,740,"first_half_rp","TALIESIN","desmond? the debt that i owe you is larger than coin, and is",4629.227,4636.459,7.23199999999997,13,107.853982300885,NA,"role_play","TALIESIN",1,0,0,0
"741","Briarwoods",3,37,741,"first_half_rp","MATT","""that's a lot of coins, huh?""",4636.459,4638.195,1.73599999999988,9,311.059907834124,NA,"role_play","MATT",0,0,0,1
"742","Briarwoods",3,37,742,"first_half_rp","TALIESIN","and it's ongoing, so if you can think of how what sort of trade you would like to spend your next years of life pursuing, whether it be in",4638.195,4648.261,10.0660000000007,30,178.819789390013,NA,"role_play","TALIESIN",1,0,0,0
"743","Briarwoods",3,37,743,"first_half_rp","LAURA","probably not lute-playing, i'm gonna just throw that out there.",4648.261,4651.312,3.05099999999948,13,255.653883972512,NA,"role_play","LAURA",1,0,0,0
"744","Briarwoods",3,37,744,"first_half_rp","TRAVIS","wow. fucking cold.",4651.312,4654.133,2.82099999999991,4,85.0762141084748,NA,"role_play","TRAVIS",1,0,0,0
"745","Briarwoods",3,37,745,"first_half_rp","TALIESIN","drums it is! drums it is.",4654.133,4656.05,1.91700000000037,7,219.092331768346,NA,"role_play","TALIESIN",1,0,0,0
"746","Briarwoods",3,37,746,"first_half_rp","TRAVIS","holy shit.",4656.05,4657.612,1.5619999999999,3,115.236875800264,NA,"role_play","TRAVIS",1,0,0,0
"747","Briarwoods",3,37,747,"first_half_rp","TALIESIN","you are a terrible person. i'm a terrible person, but you're the worst.",4657.612,4662.113,4.5010000000002,16,213.285936458555,NA,"role_play","TALIESIN",1,0,0,0
"748","Briarwoods",3,37,748,"first_half_rp","TRAVIS","even i am taken aback. my jaw is just open like:.",4662.113,4667.381,5.26800000000003,12,136.674259681093,NA,"role_play","TRAVIS",1,0,0,0
"749","Briarwoods",3,37,749,"first_half_rp","MATT","there's an awkward tense pause for a moment as everyone looks over to vex, including uriel. seeker asum stifles a chuckle.",4667.381,4677.725,10.3440000000001,23,133.410672853828,NA,"role_play","MATT",0,0,0,1
"750","Briarwoods",3,37,750,"first_half_rp","LIAM","do you know what's amazing, sovereign, is that vex'ahlia and percival were just talking earlier today and they promised each other to match whatever you offered this boy, and i am amazed at their generosity and kindness",4677.725,4695.566,17.8409999999994,39,131.158567344884,NA,"role_play","LIAM",1,0,0,0
"751","Briarwoods",3,37,751,"first_half_rp","LAURA","i walk rocks hand him, on the back of his arm, just like that.",4695.566,4699.53,3.96399999999994,15,227.043390514635,NA,"role_play","LAURA",1,0,0,0
"752","Briarwoods",3,37,752,"first_half_rp","MATT","uriel nods, ""that is generous."" at which point, two",4699.53,4707.517,7.98700000000008,9,67.6098660323018,NA,"role_play","MATT",0,0,0,1
"753","Briarwoods",3,37,753,"first_half_rp","TALIESIN","whatever work you would wish, desmond, is available to you.",4707.517,4710.312,2.79500000000007,11,236.135957066183,NA,"role_play","TALIESIN",1,0,0,0
"754","Briarwoods",3,37,754,"first_half_rp","MATT","two guards rush in at this point, and whisper something into his ear, which, vex, you see their lips moving, as that's what you can do. the verbiage comes across as actually, no.",4710.312,4722.494,12.1819999999998,35,172.385486783782,NA,"role_play","MATT",0,0,0,1
"755","Briarwoods",3,37,755,"first_half_rp","SAM","oh! oh oh! the first whisper of 2016!",4722.494,4725.96,3.46600000000035,9,155.799192152321,NA,"role_play","SAM",1,0,0,0
"756","Briarwoods",3,37,756,"first_half_rp","TALIESIN","breaking in the new year!",4725.96,4729.73,3.76999999999953,6,95.4907161803833,NA,"role_play","TALIESIN",1,0,0,0
"757","Briarwoods",3,37,757,"first_half_rp","MARISHA","watch the flask.",4729.73,4732.643,2.91300000000047,4,82.3892893923658,NA,"role_play","MARISHA",1,0,0,0
"758","Briarwoods",3,37,758,"first_half_rp","LIAM","""i'm making this up as i go! i don't know what i'm doing.""",4732.643,4736.068,3.42500000000018,18,315.328467153268,NA,"role_play","LIAM",1,0,0,0
"759","Briarwoods",3,37,759,"first_half_rp","TALIESIN","""look surprised!""",4736.068,4738.057,1.98899999999958,4,120.66365007544,NA,"role_play","TALIESIN",1,0,0,0
"760","Briarwoods",3,37,760,"first_half_rp","SAM","""i'm a fraud!""",4738.057,4739.492,1.4350000000004,6,250.871080139303,NA,"role_play","SAM",1,0,0,0
"761","Briarwoods",3,37,761,"first_half_rp","TALIESIN","""i've got a reddit page open behind my dm screen.""",4739.492,4748.254,8.76199999999972,13,89.020771513356,NA,"role_play","TALIESIN",1,0,0,0
"762","Briarwoods",3,37,762,"first_half_rp","MATT","okay! climbing over a camera. so uriel's eyes go wide for a moment, nods. ""all right."" the guards rush back off, and, ""well, if there's anything else, i believe this concludes our ""business.""",4748.254,4763.63,15.3760000000002,36,140.478668054108,NA,"role_play","MATT",0,0,0,1
"763","Briarwoods",3,37,763,"first_half_rp","LAURA","of course.",4763.63,4765.369,1.73899999999958,3,103.507763082256,NA,"role_play","LAURA",1,0,0,0
"764","Briarwoods",3,37,764,"first_half_rp","SAM","is there anything else we need or require?",4765.369,4767.642,2.27300000000014,9,237.571491421015,NA,"role_play","SAM",1,0,0,0
"765","Briarwoods",3,37,765,"first_half_rp","TALIESIN","i think we're perfectly well-suited for now.",4767.642,4769.644,2.00200000000041,10,299.700299700239,NA,"role_play","TALIESIN",1,0,0,0
"766","Briarwoods",3,37,766,"first_half_rp","LIAM","is desmond off to whitestone?",4769.644,4771.639,1.99499999999989,6,180.451127819559,NA,"role_play","LIAM",1,0,0,0
"767","Briarwoods",3,37,767,"first_half_rp","MATT","desmond nods. ""i imagine so.""",4771.639,4774.984,3.34500000000025,6,107.623318385642,NA,"role_play","MATT",0,0,0,1
"768","Briarwoods",3,37,768,"first_half_rp","LIAM","oh, vex'ahlia, you'd best give him that 1,000 gold now",4774.984,4777.214,2.22999999999956,13,349.775784753432,NA,"role_play","LIAM",1,0,0,0
"769","Briarwoods",3,37,769,"first_half_rp","LAURA","i would right now, but i don't have any on me, how crazy is that?",4777.214,4780.319,3.10500000000047,17,328.502415458887,NA,"role_play","LAURA",1,0,0,0
"770","Briarwoods",3,37,770,"first_half_rp","TRAVIS","oh that is such a shame, i know, i almost thought about reminding you to bring your extra",4780.319,4783.653,3.33399999999983,18,323.935212957425,NA,"role_play","TRAVIS",1,0,0,0
"771","Briarwoods",3,37,771,"first_half_rp","TALIESIN","since i am also gold-poor, i'm writing it into the letter to my sister that we owe money, that they are to employ him in any way he sees fit.",4783.653,4795.871,12.2179999999998,33,162.055982975939,NA,"role_play","TALIESIN",1,0,0,0
"772","Briarwoods",3,37,772,"first_half_rp","MATT","an individual of the court has just come up and handed him a sack of gold coins and he hasn't even he's not listening to you.",4795.871,4801.993,6.1220000000003,29,284.220842861796,NA,"role_play","MATT",0,0,0,1
"773","Briarwoods",3,37,773,"first_half_rp","LAURA","hide it around. put some in your shorts, put some in your shoes",4801.993,4804.826,2.83299999999963,13,275.326509001095,NA,"role_play","LAURA",1,0,0,0
"774","Briarwoods",3,37,774,"first_half_rp","TRAVIS","yeah, tuck it down by your nuts, eh?",4804.826,4806.292,1.46600000000035,9,368.349249658848,NA,"role_play","TRAVIS",1,0,0,0
"775","Briarwoods",3,37,775,"first_half_rp","MATT","he puts some down the front of his pants and pulls his little belt tight. ""i-i, um""",4806.292,4812.125,5.83299999999963,19,195.439739413693,NA,"role_play","MATT",0,0,0,1
"776","Briarwoods",3,37,776,"first_half_rp","TRAVIS","keeps it safe, makes a lady take a double look.",4812.125,4814.705,2.57999999999993,11,255.813953488379,NA,"role_play","TRAVIS",1,0,0,0
"777","Briarwoods",3,37,777,"first_half_rp","TALIESIN","i also made sure in the letter that they know that he is returning to whitestone with this money, so that if he, somehow if it's mismanaged by any of the guards or otherwise that it will be taken care of.",4814.705,4827.536,12.8310000000001,43,201.075520224454,NA,"role_play","TALIESIN",1,0,0,0
"778","Briarwoods",3,37,778,"first_half_rp","MATT","he is escorted by two of the guards to his temporary chambers here at the palace.",4827.536,4831.364,3.82799999999952,17,266.457680250817,NA,"role_play","MATT",0,0,0,1
"779","Briarwoods",3,37,779,"first_half_rp","LAURA","uriel, we'll leave you to your business, but if you need any help finding anyone, we're here for you.",4831.364,4841.861,10.4970000000003,22,125.750214346953,NA,"role_play","LAURA",1,0,0,0
"780","Briarwoods",3,37,780,"first_half_rp","MATT","thinks for a minute. ""i know you just returned. you've already done so much. but it has ""come to my attention that riskel daxio apparently has fled the palace, or at least has not been seen ""for a number of days. i've set the guards on it, and seeker asum, you as well, see if you can ""gather as much information as you can but if you find it within your capabilities to seek any ""information regarding his whereabouts and possibly bring him to justice, i would be very grateful and ""happy to reward for the destruction of this traitor.""",4841.861,4886.35,44.4890000000005,103,138.910741981162,NA,"role_play","MATT",0,0,0,1
"781","Briarwoods",3,37,781,"first_half_rp","TRAVIS","yeah.",4886.35,4888.688,2.33799999999974,2,51.3259195893984,NA,"role_play","TRAVIS",1,0,0,0
"782","Briarwoods",3,37,782,"first_half_rp","LAURA","of course.",4888.688,4890.608,1.92000000000007,3,93.7499999999964,NA,"role_play","LAURA",1,0,0,0
"783","Briarwoods",3,37,783,"first_half_rp","SAM","do you have any intelligence that he's still within the city walls, or?",4890.608,4893.566,2.95799999999963,15,304.259634888476,NA,"role_play","SAM",1,0,0,0
"784","Briarwoods",3,37,784,"first_half_rp","MATT","""it's only been a few days, so, i haven't, no""",4893.566,4897.332,3.76600000000053,14,223.048327137515,NA,"role_play","MATT",0,0,0,1
"785","Briarwoods",3,37,785,"first_half_rp","SAM","could be anywhere.",4897.332,4899.235,1.90299999999934,4,126.116657908609,NA,"role_play","SAM",1,0,0,0
"786","Briarwoods",3,37,786,"first_half_rp","MATT","""we're trying to find out now. you may move swifter than my guard, if previous experience has ""taught me anything."" he looks over to some of his guards who are like, what?",4899.235,4907.838,8.60300000000007,35,244.100895036613,NA,"role_play","MATT",0,0,0,1
"787","Briarwoods",3,37,787,"first_half_rp","TRAVIS","""ah sir, we're standing right here!""",4907.838,4911.658,3.82000000000062,9,141.36125654448,NA,"role_play","TRAVIS",1,0,0,0
"788","Briarwoods",3,37,788,"first_half_rp","TALIESIN","you guys are doing a great job, you're great, you look great, you're doing great, you're great, thank you.",4911.658,4916.926,5.26800000000003,23,261.958997722094,NA,"role_play","TALIESIN",1,0,0,0
"789","Briarwoods",3,37,789,"first_half_rp","LIAM","""man, we ain't found shit.""",4916.926,4918.886,1.96000000000004,8,244.897959183669,NA,"role_play","LIAM",1,0,0,0
"790","Briarwoods",3,37,790,"first_half_rp","MATT","at this point, guardian tofor reaches over and says, ""my liege, if i might also be excused to ""do my own search, i would appreciate that."" ""but of course, guardian, please, go on your way."" and she scatters off. the rest of the council looks about, and glances at the rest of you. uriel stands up from his throne, ""very well. thank you, and you're all dismissed from this council ""meeting."" and he stands up and begins walking off with seeker asum at his side, quickly talking up to him and they're both having this heated discussion as they leave out to the western side of the throne room.",4918.886,4954.787,35.9009999999998,112,187.181415559456,NA,"role_play","MATT",0,0,0,1
"791","Briarwoods",3,37,791,"first_half_rp","TRAVIS","are there any other guards in the room as we leave?",4954.787,4957.893,3.10599999999977,12,231.809401159064,NA,"role_play","TRAVIS",1,0,0,0
"792","Briarwoods",3,37,792,"first_half_rp","MATT","there are four other guards, two appointed to the front door and there are two at the sides of the central throne.",4957.893,4964.447,6.55400000000009,23,210.558437595359,NA,"role_play","MATT",0,0,0,1
"793","Briarwoods",3,37,793,"first_half_rp","TRAVIS","i look at the guards at the door and i go, told ya!",4964.447,4970.027,5.57999999999993,14,150.537634408604,NA,"role_play","TRAVIS",1,0,0,0
"794","Briarwoods",3,37,794,"first_half_rp","MATT","they both step back for a minute from the booming voice out of nowhere, and, ""yeah.""",4970.027,4977.746,7.71900000000005,17,132.141469102214,NA,"role_play","MATT",0,0,0,1
"795","Briarwoods",3,37,795,"first_half_rp","SAM","all right, so we're free.",4980.82,4984.026,3.20600000000013,7,131.004366812222,NA,"role_play","SAM",1,0,0,0
"796","Briarwoods",3,37,796,"first_half_rp","TALIESIN","that went well.",4984.026,4986.593,2.56700000000001,4,93.494351382937,NA,"role_play","TALIESIN",1,0,0,0
"797","Briarwoods",3,37,797,"first_half_rp","LAURA","better than i expected, to be sure.",4986.593,4990.557,3.96399999999994,8,121.089808274472,NA,"role_play","LAURA",1,0,0,0
"798","Briarwoods",3,37,798,"first_half_rp","TRAVIS","i wasn't worried. who are we tracking down?",4990.557,4993.267,2.71000000000004,10,221.402214022137,NA,"role_play","TRAVIS",1,0,0,0
"799","Briarwoods",3,37,799,"first_half_rp","LAURA","the dickhead that built our frigging keep!",4993.267,4997.366,4.09900000000016,8,117.101732129783,NA,"role_play","LAURA",1,0,0,0
"800","Briarwoods",3,37,800,"first_half_rp","MARISHA","yeah, you know, i'm wondering: if i was a sneaky bastard",4997.366,5002.716,5.35000000000036,12,134.579439252327,NA,"role_play","MARISHA",1,0,0,0
"801","Briarwoods",3,37,801,"first_half_rp","SAM","you're not, don't say that about yourself.",5002.716,5005.092,2.37599999999929,10,252.525252525328,NA,"role_play","SAM",1,0,0,0
"802","Briarwoods",3,37,802,"first_half_rp","MARISHA","thank you so much. i sometimes get concerned.",5005.092,5008.117,3.02500000000055,9,178.512396694183,NA,"role_play","MARISHA",1,0,0,0
"803","Briarwoods",3,37,803,"first_half_rp","TALIESIN","i know where you're going with this, you should finish the thought.",5008.117,5009.968,1.85099999999966,14,453.808752026016,NA,"role_play","TALIESIN",1,0,0,0
