"","arc","arc_no","episode","turn_number","segment","actor","text","start_turn","end_turn","time_in_sec","word_count","words_per_minute","encounter_count","rp_combat","actor_guest","vox_machina","guest","staff","matt"
"565","Vestiges",5,57,565,"first_half_rp","MATT","""okay. don't touch the door, please!""",2632,2635,3,9,180,NA,"role_play","MATT",0,0,0,1
"566","Vestiges",5,57,566,"first_half_rp","TALIESIN","yes. no. just. we'll be back. bye!",2635,2640.43,5.42999999999984,9,99.4475138121577,NA,"role_play","TALIESIN",1,0,0,0
"567","Vestiges",5,57,567,"first_half_rp","TALIESIN","i'm going to go find a workshop to work on something.",2640.43,2644.06,3.63000000000011,13,214.876033057845,NA,"role_play","TALIESIN",1,0,0,0
"568","Vestiges",5,57,568,"first_half_rp","TRAVIS","i like you. we'll see you later.",2644.06,2647,2.94000000000005,9,183.673469387752,NA,"role_play","TRAVIS",1,0,0,0
"569","Vestiges",5,57,569,"first_half_rp","MATT",""" he’s big.""",2647,2649,2,5,150,NA,"role_play","MATT",0,0,0,1
"570","Vestiges",5,57,570,"first_half_rp","TALIESIN","and i'm just right. it's... a thing.",2651,2654,3,10,200,NA,"role_play","TALIESIN",1,0,0,0
"571","Vestiges",5,57,571,"first_half_rp","MATT","""i'm undecided about you.""",2654,2657,3,7,140,NA,"role_play","MATT",0,0,0,1
"572","Vestiges",5,57,572,"first_half_rp","TALIESIN","you're not alone. i'm going to go see if the slayer's take has",2657,2662,5,16,192,NA,"role_play","TALIESIN",1,0,0,0
"573","Vestiges",5,57,573,"first_half_rp","SAM","we're going to leave.",2662,2663.44,1.44000000000005,6,249.999999999991,NA,"role_play","SAM",1,0,0,0
"574","Vestiges",5,57,574,"first_half_rp","TALIESIN","i cannot handle any more of that. that was brutal.",2663.44,2666.93,3.48999999999978,11,189.111747851015,NA,"role_play","TALIESIN",1,0,0,0
"575","Vestiges",5,57,575,"first_half_rp","SAM","too good.",2666.93,2668,1.07000000000016,3,168.224299065395,NA,"role_play","SAM",1,0,0,0
"576","Vestiges",5,57,576,"first_half_rp","TRAVIS","i feel like you’re just on a higher level.",2668,2671.22,3.2199999999998,11,204.968944099392,NA,"role_play","TRAVIS",1,0,0,0
"577","Vestiges",5,57,577,"first_half_rp","ASHLEY","right?",2671.22,2673,1.7800000000002,2,67.4157303370711,NA,"role_play","ASHLEY",1,0,0,0
"578","Vestiges",5,57,578,"first_half_rp","LAURA","i just thought you were going to make him not there so you didn't have to do it.",2673,2676.5,3.5,20,342.857142857143,NA,"role_play","LAURA",1,0,0,0
"579","Vestiges",5,57,579,"first_half_rp","MATT","no no no.",2676.5,2678,1.5,4,160,NA,"role_play","MATT",0,0,0,1
"580","Vestiges",5,57,580,"first_half_rp","MARISHA","yeah, yeah yeah. he's just not home. sorry, guys.",2678,2681.31,3.30999999999995,11,199.395770392753,NA,"role_play","MARISHA",1,0,0,0
"581","Vestiges",5,57,581,"first_half_rp","ASHLEY","oh, i love him.",2681.31,2683,1.69000000000005,5,177.514792899403,NA,"role_play","ASHLEY",1,0,0,0
"582","Vestiges",5,57,582,"first_half_rp","MARISHA","victor's on vacation.",2683,2684.5,1.5,5,200,NA,"role_play","MARISHA",1,0,0,0
"583","Vestiges",5,57,583,"first_half_rp","TALIESIN","so, i'm going to go see if there's if there's not a blacksmithing, if there's not somewhere i can do a bit of basic smithing work and technical work, then i'm going to go find that blacksmith from last time.",2684.5,2694.56,10.0599999999999,46,274.353876739564,NA,"role_play","TALIESIN",1,0,0,0
"584","Vestiges",5,57,584,"first_half_rp","MATT","there's basic materials to do essentially weapon repairs, armor repairs, minor armor construction within the slayer's take. if you want something that's going to be a little more to the level of what you're doing, you may have to actually rent out a facility.",2694.56,2709,14.4400000000001,49,203.60110803324,NA,"role_play","MATT",0,0,0,1
"585","Vestiges",5,57,585,"first_half_rp","TALIESIN","well, i'm going to go find that young chap from before.",2709,2712,3,13,260,NA,"role_play","TALIESIN",1,0,0,0
"586","Vestiges",5,57,586,"first_half_rp","MATT","okay. yeah, easy enough to do. if you want to rent the forge for the day to craft whatever it is you're looking to craft, he's charging you 50 gold for the day.",2712,2721.53,9.5300000000002,36,226.652675760751,NA,"role_play","MATT",0,0,0,1
"587","Vestiges",5,57,587,"first_half_rp","TALIESIN","50 gold for the day? can i use all of his tools and just my own materials?",2721.53,2726,4.4699999999998,18,241.610738255044,NA,"role_play","TALIESIN",1,0,0,0
"588","Vestiges",5,57,588,"first_half_rp","MATT","you have to supply your own material, but he'll let you rent.",2726,2728,2,14,420,NA,"role_play","MATT",0,0,0,1
"589","Vestiges",5,57,589,"first_half_rp","TALIESIN","i'm going to run and find vax, get my stuff, and go to work.",2728,2731,3,16,320,NA,"role_play","TALIESIN",1,0,0,0
"590","Vestiges",5,57,590,"first_half_rp","MATT","okay. you guys. you four make your way over towards the duskmeadow.",2731,2740.65,9.65000000000009,13,80.8290155440407,NA,"role_play","MATT",0,0,0,1
"591","Vestiges",5,57,591,"first_half_rp","LAURA","trinket's out.",2740.65,2742,1.34999999999991,4,177.77777777779,NA,"role_play","LAURA",1,0,0,0
"592","Vestiges",5,57,592,"first_half_rp","MATT","trinket's out?",2742,2744,2,4,120,NA,"role_play","MATT",0,0,0,1
"593","Vestiges",5,57,593,"first_half_rp","LAURA","come on, trinket.",2745.81,2747,1.19000000000005,4,201.680672268898,NA,"role_play","LAURA",1,0,0,0
"594","Vestiges",5,57,594,"first_half_rp","MATT","he rolls his head against you, licks the side of your face, happy to be out of that stuffy little necklace. you make your way towards the duskmeadow, which you've seen before. it's a very comparatively... glum-looking area of the town, hence the name that accompanies it, but this is the area of the city that contains the raven's crest, the amaranthine oubliette. it also contains the entire town's catacombs. this is where, since this town's existence, all of the dead are interred perpetually deeper and deeper and deeper beneath this part of the city. also one of the oldest libraries of the city is kept here as well. as you approach the outskirts and you can see a very fine line between this area and the birth heart, which is the melora section of the city. there is a very, very wide river divide between the two of them and it's like night and day, back and back. very, very, very directly between the two of them. you can see on melora's side there's just stalks and stalks of corn and other vegetation that's being grown for food. there's almost like a lush forest that curls around the outside of it that doesn't match the rest of the indigenous trees you've seen in this area of othanzia. the entire birth heart area, where this temple to melora is, is just this plucked-out-of-nowhere section placed into it. and then you move over to the duskmeadow and it's just... like the color has left the vicinity. and there you see in the center of this part of the town, this large, looming, ominous obsidian and gold structure. it's like a giant black stone aerie. it has no intricacies from this distance that you can see. it's almost like a giant square building that is just devoid of light, with little glimmers of gold when the light catches it at moments. it's hard to miss and definitely stands as a centerpiece to this section of vasselheim.",2747,2886.71,139.71,355,152.458664376208,NA,"role_play","MATT",0,0,0,1
"595","Vestiges",5,57,595,"first_half_rp","LIAM","the whole walk over, i've been talking a lot, mostly to trinket. you know, scratching him behind the ears, saying, ""buddy, you've been trapped in there a while. ""it's good to see you out.""",2886.71,2899.71,13,38,175.384615384615,NA,"role_play","LIAM",1,0,0,0
"596","Vestiges",5,57,596,"first_half_rp","MATT","""""",2899.71,2901,1.28999999999996,2,93.0232558139561,NA,"role_play","MATT",0,0,0,1
"597","Vestiges",5,57,597,"first_half_rp","LIAM","come hug your uncle. come.",2901,2903.55,2.55000000000018,6,141.176470588225,NA,"role_play","LIAM",1,0,0,0
"598","Vestiges",5,57,598,"first_half_rp","LIAM","i'm sure he doesn't. i'm just happy to see him.",2903.55,2906,2.44999999999982,14,342.857142857168,NA,"role_play","LIAM",1,0,0,0
"599","Vestiges",5,57,599,"first_half_rp","MATT","he presses his nose under yours and lifts your chin up and you bite your lip a little from the sudden impact from this very large bear, but it's all with love.",2906,2914,8,34,255,NA,"role_play","MATT",0,0,0,1
"600","Vestiges",5,57,600,"first_half_rp","LIAM","yeah. it's cold. you're sure you don't want to go back in? nah, you don't want to go back in. i know.",2914,2919.91,5.90999999999985,27,274.11167512691,NA,"role_play","LIAM",1,0,0,0
"601","Vestiges",5,57,601,"first_half_rp","MARISHA","hey, pike.",2919.91,2921,1.09000000000015,3,165.137614678877,NA,"role_play","MARISHA",1,0,0,0
"602","Vestiges",5,57,602,"first_half_rp","LIAM","just nervous talking the whole way there.",2921,2923,2,8,240,NA,"role_play","LIAM",1,0,0,0
"603","Vestiges",5,57,603,"first_half_rp","MARISHA","i think vax is talking to himself.",2923,2925,2,8,240,NA,"role_play","MARISHA",1,0,0,0
"604","Vestiges",5,57,604,"first_half_rp","ASHLEY","he's very nervous right now.",2925,2927,2,7,210,NA,"role_play","ASHLEY",1,0,0,0
"605","Vestiges",5,57,605,"first_half_rp","ASHLEY","this is a big deal.",2927,2928.71,1.71000000000004,6,210.526315789469,NA,"role_play","ASHLEY",1,0,0,0
"606","Vestiges",5,57,606,"first_half_rp","ASHLEY","this temple is very... it's lovely.",2928.71,2935,6.28999999999996,8,76.3116057233709,NA,"role_play","ASHLEY",1,0,0,0
"607","Vestiges",5,57,607,"first_half_rp","MARISHA","it's gorgeous. it's very intimidating. do you know anything about this? you've lived here for a while, pike.",2935,2943.02,8.01999999999998,22,164.588528678305,NA,"role_play","MARISHA",1,0,0,0
"608","Vestiges",5,57,608,"first_half_rp","ASHLEY","i've never been by.",2943.02,2945,1.98000000000002,6,181.81818181818,NA,"role_play","ASHLEY",1,0,0,0
"609","Vestiges",5,57,609,"first_half_rp","MARISHA","never been in?",2945,2947,2,4,120,NA,"role_play","MARISHA",1,0,0,0
"610","Vestiges",5,57,610,"first_half_rp","MATT","you do know from your time here and what little you've heard that part of the purpose of this vicinity is not just to inter the dead within part of these catacombs. the library here is kind of a loose partnership between the people worshipers of her and those who follow ioun. it is a center for knowledge and history kept within the city. but you'll see throughout the town and the landscaped outer wall that surrounds this entire portion of vasselheim, there are repetitive glyphs that line this entire area. and from what you've heard, at the very least, most of these glyphs, which you see across the corners of roadways, and many of which surround the entrance to the catacombs, it is a perpetual enchantment that is to seal any sort of possible undeath. there once was a terrible scourge of undeath in this part of the landscape, long ago, that corresponded with a battle hundreds of years ago, and since then, the reinforcement has been put in place to prevent that from happening again. so the downside is that the power of these glyphs that prevent undeath also prevent any actual vegetation from existing in this area as well. so all the ground that you've come across: no grass, no natural vegetation. it's just dirt and ash and dust.",2947,3033,86,228,159.06976744186,NA,"role_play","MATT",0,0,0,1
"611","Vestiges",5,57,611,"first_half_rp","MARISHA","can we recognize the language in which the runes come from?",3033,3036.97,3.9699999999998,12,181.360201511344,NA,"role_play","MARISHA",1,0,0,0
"612","Vestiges",5,57,612,"first_half_rp","MATT","the magic itself is divine in nature, but it's based in the same very, very base draconic glyphs that a lot of arcane magic is based on. it's very it's <i>old</i> magic.",3036.97,3050.16,13.1900000000001,38,172.858225928733,NA,"role_play","MATT",0,0,0,1
"613","Vestiges",5,57,613,"first_half_rp","ASHLEY","it's old.",3050.16,3053.1,2.94000000000005,4,81.632653061223,NA,"role_play","ASHLEY",1,0,0,0
"614","Vestiges",5,57,614,"first_half_rp","MATT","yeah. it's based in some sort of divine ritual.",3053.1,3058.01,4.91000000000031,11,134.419551934818,NA,"role_play","MATT",0,0,0,1
"615","Vestiges",5,57,615,"first_half_rp","MARISHA","what did you say the name was of the raven queen's temple, again?",3058.01,3062,3.98999999999978,15,225.563909774448,NA,"role_play","MARISHA",1,0,0,0
"616","Vestiges",5,57,616,"first_half_rp","MATT","the temple itself is referred to as raven's crest.",3062,3065,3,11,220,NA,"role_play","MATT",0,0,0,1
"617","Vestiges",5,57,617,"first_half_rp","MARISHA","raven's crest?",3065,3066.34,1.34000000000015,4,179.104477611921,NA,"role_play","MARISHA",1,0,0,0
"618","Vestiges",5,57,618,"first_half_rp","MATT","raven's crest, yes.",3066.34,3067.5,1.15999999999985,5,258.620689655205,NA,"role_play","MATT",0,0,0,1
"619","Vestiges",5,57,619,"first_half_rp","MARISHA","okay.",3067.5,3068.96,1.46000000000004,2,82.1917808219158,NA,"role_play","MARISHA",1,0,0,0
"620","Vestiges",5,57,620,"first_half_rp","ASHLEY","how are you feeling, vax?",3068.96,3071.33,2.36999999999989,6,151.898734177222,NA,"role_play","ASHLEY",1,0,0,0
"621","Vestiges",5,57,621,"first_half_rp","LIAM","i'm all right. i'm just going to talk to my sister for a minute.",3071.33,3076.88,5.55000000000018,17,183.783783783778,NA,"role_play","LIAM",1,0,0,0
"622","Vestiges",5,57,622,"first_half_rp","ASHLEY","okay.",3076.88,3078,1.11999999999989,2,107.142857142868,NA,"role_play","ASHLEY",1,0,0,0
"623","Vestiges",5,57,623,"first_half_rp","LIAM","you know, i know you want to i know you. i know you want to be here.",3081.52,3087,5.48000000000002,18,197.080291970802,NA,"role_play","LIAM",1,0,0,0
"624","Vestiges",5,57,624,"first_half_rp","LAURA","i know you don't want me to come.",3087,3089,2,10,300,NA,"role_play","LAURA",1,0,0,0
"625","Vestiges",5,57,625,"first_half_rp","LIAM","i don't. i really don't.",3089,3091,2,8,240,NA,"role_play","LIAM",1,0,0,0
"626","Vestiges",5,57,626,"first_half_rp","LAURA","i know. and i won't, if you're sure. i put you in this place and i feel terrible about it and i know you're extremely nervous. trinket can sense it, too. he's very in tune with those emotions. and i just",3091,3106.65,15.6500000000001,45,172.523961661341,NA,"role_play","LAURA",1,0,0,0
"627","Vestiges",5,57,627,"first_half_rp","LIAM","listen to me. you did not put me in this place. no one put me in this place.",3106.65,3115.5,8.84999999999991,19,128.813559322035,NA,"role_play","LIAM",1,0,0,0
"628","Vestiges",5,57,628,"first_half_rp","LIAM","and everything's going to be fine.",3115.5,3118.04,2.53999999999996,8,188.976377952759,NA,"role_play","LIAM",1,0,0,0
"629","Vestiges",5,57,629,"first_half_rp","LIAM","and i tug her sleeves and make them a little more orderly and i move a bit of hair out of her face and i do a button that's not done.",3118.04,3127.58,9.53999999999996,33,207.547169811322,NA,"role_play","LIAM",1,0,0,0
"630","Vestiges",5,57,630,"first_half_rp","LIAM","everything's going to be fine.",3129,3132.73,3.73000000000002,7,112.600536193029,NA,"role_play","LIAM",1,0,0,0
"631","Vestiges",5,57,631,"first_half_rp","LIAM","that's all right. just wait here i'll be out in a bit, all right?",3132.73,3136.02,3.28999999999996,17,310.030395136782,NA,"role_play","LIAM",1,0,0,0
"632","Vestiges",5,57,632,"first_half_rp","LAURA","yes.",3136.02,3138,1.98000000000002,2,60.6060606060601,NA,"role_play","LAURA",1,0,0,0
"633","Vestiges",5,57,633,"first_half_rp","LAURA","i know. everything's fine.",3138,3140.02,2.01999999999998,6,178.21782178218,NA,"role_play","LAURA",1,0,0,0
"634","Vestiges",5,57,634,"first_half_rp","LAURA","you don't need to be nervous, either.",3140.02,3142,1.98000000000002,9,272.72727272727,NA,"role_play","LAURA",1,0,0,0
"635","Vestiges",5,57,635,"first_half_rp","LIAM","i'm not.",3142,3143.5,1.5,4,160,NA,"role_play","LIAM",1,0,0,0
"636","Vestiges",5,57,636,"first_half_rp","LAURA","i will be here waiting for you when you come out.",3143.5,3148,4.5,12,160,NA,"role_play","LAURA",1,0,0,0
"637","Vestiges",5,57,637,"first_half_rp","LIAM","i know. i'll see you",3148,3150,2,6,180,NA,"role_play","LIAM",1,0,0,0
"638","Vestiges",5,57,638,"first_half_rp","LAURA","i love you.",3150,3152,2,4,120,NA,"role_play","LAURA",1,0,0,0
"639","Vestiges",5,57,639,"first_half_rp","LIAM","you know i love you, too.",3152,3154,2,7,210,NA,"role_play","LIAM",1,0,0,0
"640","Vestiges",5,57,640,"first_half_rp","LAURA","i'm proud of you, you know. she's just going to love you so much. and who knows, you might have a new girlfriend when you come out. i've heard other people have dated gods before. i've heard it's done. that cashew guy. anyway.",3154,3169,15,49,196,NA,"role_play","LAURA",1,0,0,0
"641","Vestiges",5,57,641,"first_half_rp","LIAM","you're going to wait here for me, right?",3169,3170.5,1.5,10,400,NA,"role_play","LIAM",1,0,0,0
"642","Vestiges",5,57,642,"first_half_rp","LAURA","i'll be right here.",3170.5,3173.5,3,6,120,NA,"role_play","LAURA",1,0,0,0
"643","Vestiges",5,57,643,"first_half_rp","LIAM","and then i drop the smile as i walk off towards the other two.",3173.5,3176,2.5,15,360,NA,"role_play","LIAM",1,0,0,0
"644","Vestiges",5,57,644,"first_half_rp","MATT","okay. which, as you turn and look, when you originally approached the stairs that lead up to the entrance of this large structure, it was just empty, doors closed. there was no guard post on the outside. it was just these two looming, almost dark glass-type doors about 12 feet tall and about 8 feet wide on each side that are just locked shut. as soon as you turn to walk towards them, the doors open and you see a figure standing there at the door, just looking directly at you. or at least you assume is looking right at you. it's hard to see. this individual, somewhat lithe in physicality, is wearing long, dark robes and their face is shrouded in opaque black cloth, like a death shroud that just blocks the entire face. you can see the hint of a jawline, a nose. it looks to be a person of some background in there, but they're just standing there, watching you. and as soon as you react to their appearance, the hand just beckons quietly.",3176,3232.88,56.8800000000001,181,190.928270042194,NA,"role_play","MATT",0,0,0,1
"645","Vestiges",5,57,645,"first_half_rp","LIAM","were you expecting me? all right. i've brought a couple of friends. is that permissible here? they'll keep quiet.",3234,3251.31,17.3099999999999,22,76.2564991334491,NA,"role_play","LIAM",1,0,0,0
"646","Vestiges",5,57,646,"first_half_rp","MARISHA","i turn to vex.",3252,3254.55,2.55000000000018,5,117.647058823521,NA,"role_play","MARISHA",1,0,0,0
"647","Vestiges",5,57,647,"first_half_rp","LAURA","keep him safe.",3254.55,3256,1.44999999999982,4,165.517241379331,NA,"role_play","LAURA",1,0,0,0
"648","Vestiges",5,57,648,"first_half_rp","MARISHA","i swear to you. we're all coming out of here alive.",3256,3261.84,5.84000000000015,13,133.561643835613,NA,"role_play","MARISHA",1,0,0,0
"649","Vestiges",5,57,649,"first_half_rp","LAURA","i know.",3261.84,3263.44,1.59999999999991,3,112.500000000006,NA,"role_play","LAURA",1,0,0,0
"650","Vestiges",5,57,650,"first_half_rp","MARISHA","but if like an hour passes and we don't, maybe come in? but we're all coming out of here alive, so don't worry about it. it's fine.",3263.44,3273.64,10.1999999999998,32,188.23529411765,NA,"role_play","MARISHA",1,0,0,0
"651","Vestiges",5,57,651,"first_half_rp","ASHLEY","and i squeeze her hand. i'll make sure he gets out okay. i promise.",3273.64,3278,4.36000000000013,16,220.183486238526,NA,"role_play","ASHLEY",1,0,0,0
"652","Vestiges",5,57,652,"first_half_rp","LAURA","i'll just be right here. waiting here with trinket.",3282.63,3285.47,2.83999999999969,11,232.394366197208,NA,"role_play","LAURA",1,0,0,0
"653","Vestiges",5,57,653,"first_half_rp","ASHLEY","okay.",3285.47,3286.5,1.0300000000002,2,116.504854368909,NA,"role_play","ASHLEY",1,0,0,0
"654","Vestiges",5,57,654,"first_half_rp","LAURA","just calmly leaning against a wall. no big deal.",3286.5,3289.03,2.5300000000002,10,237.15415019761,NA,"role_play","LAURA",1,0,0,0
"655","Vestiges",5,57,655,"first_half_rp","ASHLEY","okay.",3289.03,3290,0.9699999999998,2,123.711340206211,NA,"role_play","ASHLEY",1,0,0,0
"656","Vestiges",5,57,656,"first_half_rp","MARISHA","we've faced way more terrifying things than a few albeit creepy men in robes.",3290,3298,8,16,120,NA,"role_play","MARISHA",1,0,0,0
"657","Vestiges",5,57,657,"first_half_rp","LAURA","i don't even think she's that bad. she's not going to be bad.",3298,3301.159,3.15900000000011,17,322.886989553645,NA,"role_play","LAURA",1,0,0,0
"658","Vestiges",5,57,658,"first_half_rp","LIAM","guys.",3301.159,3302.237,1.07799999999997,2,111.3172541744,NA,"role_play","LIAM",1,0,0,0
"659","Vestiges",5,57,659,"first_half_rp","ASHLEY","okay. we'll go. we'll go in with you.",3302.237,3304.25,2.01299999999992,11,327.868852459029,NA,"role_play","ASHLEY",1,0,0,0
"660","Vestiges",5,57,660,"first_half_rp","MATT","all right. as you step up to the stairs, the figure leads you all inside, and as you step into the main center of this initial walkway chamber, the figure doesn't enter with you. it just closes the door behind you. you can feel the hint of vibration of impact as the doors close shut.",3304.25,3323,18.75,57,182.4,NA,"role_play","MATT",0,0,0,1
"661","Vestiges",5,57,661,"first_half_rp","MARISHA","it's dark?",3323,3324,1,4,240,NA,"role_play","MARISHA",1,0,0,0
"662","Vestiges",5,57,662,"first_half_rp","MATT","it's lowly-lit on the inside, and it's interesting. from the outside, it looks like a black, solid, impossible-to-see-through building. from the inside, you can actually look out and the entire building is made of this glass, this somewhat-warped, dark glass. and you can see almost the entirety of the outside from your position. the doors are held aloft into it. it's like a one-way type enchantment, or the construct, the material itself, is somewhat translucent from this side.",3324,3353.3,29.3000000000002,88,180.204778156995,NA,"role_play","MATT",0,0,0,1
"663","Vestiges",5,57,663,"first_half_rp","MARISHA","like an interrogation room? like one-way mirror type of thing?",3353.3,3357.67,4.36999999999989,12,164.759725400462,NA,"role_play","MARISHA",1,0,0,0
"664","Vestiges",5,57,664,"first_half_rp","MATT","kind of. or like a very, very dark pair of sunglasses, but made of naturally-formed rock, almost.",3357.67,3365,7.32999999999993,19,155.525238744886,NA,"role_play","MATT",0,0,0,1
"665","Vestiges",5,57,665,"first_half_rp","LIAM","noticing that, i turn and just sort of look at my sister for 5 or 10 more seconds.",3365,3371.89,6.88999999999987,19,165.457184325112,NA,"role_play","LIAM",1,0,0,0
"666","Vestiges",5,57,666,"first_half_rp","MATT","she doesn't see you and she just stands there quietly, looking around, inspecting the vicinity. pets trinket a little.",3371.89,3382,10.1100000000001,21,124.629080118693,NA,"role_play","MATT",0,0,0,1
"667","Vestiges",5,57,667,"first_half_rp","LIAM","let's do this.",3382,3386,4,5,75,NA,"role_play","LIAM",1,0,0,0
"668","Vestiges",5,57,668,"first_half_rp","ASHLEY","do i feel anything, being in here?",3387.69,3391,3.30999999999995,8,145.015105740184,NA,"role_play","ASHLEY",1,0,0,0
"669","Vestiges",5,57,669,"first_half_rp","MATT","you just feel a natural tremble stepping into a place of powerful divine influence that is not the warm comfort of sarenrae, which has protected you before. now, you understand the way many deities work in these lands, and your place in it, and sarenrae's place in it, and you know enough about the raven queen to know that this is not an unwelcome place, per se. go ahead and roll a religion check.",3391,3415,24,76,190,NA,"role_play","MATT",0,0,0,1
"670","Vestiges",5,57,670,"first_half_rp","ASHLEY","23.",3425,3426,1,2,120,NA,"role_play","ASHLEY",1,0,0,0
"671","Vestiges",5,57,671,"first_half_rp","MATT","23. you understand the raven queen has also not always been the one who holds sway over the domain of death, the domain of winter, the domain of fate. once mortal, the raven queen ascended as, essentially, a follower and a partner to the previous god of death, which his name has been erased from the books. this mortal ascended many, many years ago, pre-second spark, and has since taken what was once a tyrannical position of death and afterlife and souls and took it instead as the natural transition that it is. however, due to a lack of respect, or at least, a lack of, for lack of a better term, belief or trust from the other gods, she only gained dominion over the actual moment of transition, not of the actual souls of the afterlife. that influence was given to others. but the raven queen represents one of the most feared elements of life, which is the end of it, but you also know that that is a natural thing. your personal belief is up to you. the sense you get here is that... being an individual that worships life, that worships redemption, that worships second chances, you can't help but swallow a little hard at the idea of a god that's purpose is to make sure that if you're destined to have once chance, it stays one chance.",3426,3536.51,110.51,236,128.133200615329,NA,"role_play","MATT",0,0,0,1
"672","Vestiges",5,57,672,"first_half_rp","ASHLEY","okay.",3536.51,3538.23,1.7199999999998,2,69.7674418604732,NA,"role_play","ASHLEY",1,0,0,0
"673","Vestiges",5,57,673,"first_half_rp","MATT","as you begin to walk down this hall, ever so slow as it is, each footfall deafening in the clack. the hallway leads on for another hundred feet or so before the glass, somewhat translucent material shifts into the next chamber, into an almost deep gray and ivory ice-like interior. the dark, coal-black exterior you've seen now transitions into what feels like a very finely-carved piece of architecture from ice and bone.",3538.23,3573.63,35.4000000000001,77,130.508474576271,NA,"role_play","MATT",0,0,0,1
