"","arc","arc_no","episode","turn_number","segment","actor","text","start_turn","end_turn","time_in_sec","word_count","words_per_minute","encounter_count","rp_combat","actor_guest","vox_machina","guest","staff","matt"
"1065","Vestiges",5,57,1065,"first_half_rp","TALIESIN","victor.",6410.5,6412,1.5,2,80,NA,"role_play","TALIESIN",1,0,0,0
"1066","Vestiges",5,57,1066,"first_half_rp","MATT","""it can put hair on your balls.""",6414,6416,2,9,270,NA,"role_play","MATT",0,0,0,1
"1067","Vestiges",5,57,1067,"first_half_rp","TALIESIN","ohhh, probably. has a woman been by to buy black powder? has a woman been by?",6416,6429,13,17,78.4615384615385,NA,"role_play","TALIESIN",1,0,0,0
"1068","Vestiges",5,57,1068,"first_half_rp","MATT","""not in, uh, weeks, maybe.""",6429,6432.5,3.5,7,120,NA,"role_play","MATT",0,0,0,1
"1069","Vestiges",5,57,1069,"first_half_rp","TALIESIN","weeks?",6432.5,6434,1.5,2,80,NA,"role_play","TALIESIN",1,0,0,0
"1070","Vestiges",5,57,1070,"first_half_rp","MATT","""did you make her hand, too?""",6434,6435.5,1.5,8,320,NA,"role_play","MATT",0,0,0,1
"1071","Vestiges",5,57,1071,"first_half_rp","TALIESIN","i did not. do you know where she goes?",6435.5,6440,4.5,10,133.333333333333,NA,"role_play","TALIESIN",1,0,0,0
"1072","Vestiges",5,57,1072,"first_half_rp","MATT","""no. she paid well, though.""",6440,6442.47,2.47000000000025,7,170.040485829942,NA,"role_play","MATT",0,0,0,1
"1073","Vestiges",5,57,1073,"first_half_rp","TALIESIN","did she? what did she pay?",6442.47,6444,1.52999999999975,7,274.509803921614,NA,"role_play","TALIESIN",1,0,0,0
"1074","Vestiges",5,57,1074,"first_half_rp","MATT","""are you guys in a club now? how many people want black powder? ""tell me! tell them! bring them more. ""i could use money.""",6444,6450.5,6.5,26,240,NA,"role_play","MATT",0,0,0,1
"1075","Vestiges",5,57,1075,"first_half_rp","TALIESIN","how much black powder did she buy, victor?",6458,6464,6,9,90,NA,"role_play","TALIESIN",1,0,0,0
"1076","Vestiges",5,57,1076,"first_half_rp","MATT","""uh...""",6464,6470,6,3,30,NA,"role_play","MATT",0,0,0,1
"1077","Vestiges",5,57,1077,"first_half_rp","TALIESIN","only counts to two. i'm so sorry.",6470,6472,2,9,270,NA,"role_play","TALIESIN",1,0,0,0
"1078","Vestiges",5,57,1078,"first_half_rp","MATT","""maybe... 12 hogsheads worth?""",6475,6480.97,5.97000000000025,6,60.3015075376859,NA,"role_play","MATT",0,0,0,1
"1079","Vestiges",5,57,1079,"first_half_rp","TALIESIN","really? and how often does she come by?",6482.78,6487,4.22000000000025,9,127.962085308049,NA,"role_play","TALIESIN",1,0,0,0
"1080","Vestiges",5,57,1080,"first_half_rp","MATT","""she only come by once.""",6487,6489,2,7,210,NA,"role_play","MATT",0,0,0,1
"1081","Vestiges",5,57,1081,"first_half_rp","TALIESIN","okay. thank you. i'm so pleased. i may stop by one last time before i leave town, just to say goodbye. thank you.",6489,6502,13,25,115.384615384615,NA,"role_play","TALIESIN",1,0,0,0
"1082","Vestiges",5,57,1082,"first_half_rp","MATT","""please do! i have more tea. ""many different flavors. this is, i call, dark roast.""",6502,6510,8,17,127.5,NA,"role_play","MATT",0,0,0,1
"1083","Vestiges",5,57,1083,"first_half_rp","TALIESIN","it... certainly scalded something. thank you. that was very lovely and that was very charming and i unfortunately have business in the",6510,6520,10,22,132,NA,"role_play","TALIESIN",1,0,0,0
"1084","Vestiges",5,57,1084,"first_half_rp","MATT","""i want to try the other one before you go.""",6520,6522,2,12,360,NA,"role_play","MATT",0,0,0,1
"1085","Vestiges",5,57,1085,"first_half_rp","TALIESIN","one more and then i must go, thank you.",6522,6524,2,10,300,NA,"role_play","TALIESIN",1,0,0,0
"1086","Vestiges",5,57,1086,"first_half_rp","MATT",""" come on, need this, too.""",6524,6527,3,7,140,NA,"role_play","MATT",0,0,0,1
"1087","Vestiges",5,57,1087,"first_half_rp","MATT","he sticks it into the wooden stool and the table. kind of breaks the wood and snaps it. ""oh.""",6535,6546,11,20,109.090909090909,NA,"role_play","MATT",0,0,0,1
"1088","Vestiges",5,57,1088,"first_half_rp","TALIESIN","remember that it's attached to bone. you can still break your arm, so be gentle.",6546,6552,6,17,170,NA,"role_play","TALIESIN",1,0,0,0
"1089","Vestiges",5,57,1089,"first_half_rp","MATT","""yes. thank you!""",6552,6553.5,1.5,5,200,NA,"role_play","MATT",0,0,0,1
"1090","Vestiges",5,57,1090,"first_half_rp","TALIESIN","thank you. good night! have a lovely evening.",6553.5,6555,1.5,9,360,NA,"role_play","TALIESIN",1,0,0,0
"1091","Vestiges",5,57,1091,"first_half_rp","TALIESIN","good night. aah. pleasure, as always. thank you.",6556.26,6562,5.73999999999978,9,94.0766550522684,NA,"role_play","TALIESIN",1,0,0,0
"1092","Vestiges",5,57,1092,"first_half_rp","MATT","""""",6562,6563,1,2,120,NA,"role_play","MATT",0,0,0,1
"1093","Vestiges",5,57,1093,"first_half_rp","TALIESIN","i leave in a little bit of a panic.",6563,6565.5,2.5,10,240,NA,"role_play","TALIESIN",1,0,0,0
"1094","Vestiges",5,57,1094,"first_half_rp","MATT","you leave and he's just sitting there staring at this long chisel point, going, """"",6565.5,6573,7.5,16,128,NA,"role_play","MATT",0,0,0,1
"1095","Vestiges",5,57,1095,"first_half_rp","MATT","the door slowly closes behind you.",6574.68,6578,3.31999999999971,7,126.506024096397,NA,"role_play","MATT",0,0,0,1
"1096","Vestiges",5,57,1096,"first_half_rp","TALIESIN","yeah.",6578,6579.5,1.5,2,80,NA,"role_play","TALIESIN",1,0,0,0
"1097","Vestiges",5,57,1097,"first_half_rp","MARISHA","yes, yeah, just give him an anime weapon.",6579.5,6581.56,2.0600000000004,9,262.135922330046,NA,"role_play","MARISHA",1,0,0,0
"1098","Vestiges",5,57,1098,"first_half_rp","TALIESIN","yeah, okay. we're sticking around for a day?",6581.56,6585,3.4399999999996,10,174.418604651183,NA,"role_play","TALIESIN",1,0,0,0
"1099","Vestiges",5,57,1099,"first_half_rp","SAM","i assume so. i don't know. we're going to spend the night, at least.",6586,6589,3,17,340,NA,"role_play","SAM",1,0,0,0
"1100","Vestiges",5,57,1100,"first_half_rp","TALIESIN","i'm going to take a long walk before i come back and i'm going to walk by the raven queen temple and just... peek inside.",6589,6598,9,28,186.666666666667,NA,"role_play","TALIESIN",1,0,0,0
"1101","Vestiges",5,57,1101,"first_half_rp","MATT","okay. you make your way past the quad roads. at this point at night the whole clientele has shifted. most people coming here you hear laughter, you hear music. the quad roads is the new orleans of the town, comparatively. it's still nowhere near as rambunctious as many places you've been, but for what seems during the day to be a rather dour and serious business type city, the quad roads is where the celebration of humanity hits when the evening hours hit. so you come by and there's some taverns that are open. you see, to a certain extent, what even appears to be an adult entertainment district.",6598,6638,40,113,169.5,NA,"role_play","MATT",0,0,0,1
"1102","Vestiges",5,57,1102,"first_half_rp","MATT","you make your way beyond",6640,6641.5,1.5,5,200,NA,"role_play","MATT",0,0,0,1
"1103","Vestiges",5,57,1103,"first_half_rp","LIAM","ring-a-ding-ding.",6641.5,6643.4,1.89999999999964,5,157.894736842136,NA,"role_play","LIAM",1,0,0,0
"1104","Vestiges",5,57,1104,"first_half_rp","MATT","it's the oldest profession. you make your way all the way to the outskirts of the duskmeadow, and there, amongst the just barely peeking through the cloudline starlight, the looming dark structure that is raven's crest.",6643.4,6660,16.6000000000004,39,140.963855421684,NA,"role_play","MATT",0,0,0,1
"1105","Vestiges",5,57,1105,"first_half_rp","TALIESIN","i'm just going to gently open the door and peek inside and see if anybody's inside.",6660,6665.47,5.47000000000025,19,208.409506398528,NA,"role_play","TALIESIN",1,0,0,0
"1106","Vestiges",5,57,1106,"first_half_rp","MATT","okay. you go ahead and push the door open. doesn't appear to be anybody there.",6665.47,6674.24,8.76999999999953,17,116.305587229197,NA,"role_play","MATT",0,0,0,1
"1107","Vestiges",5,57,1107,"first_half_rp","TALIESIN","i walk in just for a moment and take a look around.",6680,6684,4,13,195,NA,"role_play","TALIESIN",1,0,0,0
"1108","Vestiges",5,57,1108,"first_half_rp","MATT","okay. you walk in. at this dark hour, looking around, the obsidian-type walls are translucent glass on the other side, though you can barely make out through the material the details of the outside world, due to the lack of light across the cityscape. especially here in duskmeadow, in which the magical lantern light that illuminates the city streets are relatively sparse on this side of vasselheim. you take a few more steps in, footsteps echoing across the long, thin, dark material of the floors.",6684,6720,36,87,145,NA,"role_play","MATT",0,0,0,1
"1109","Vestiges",5,57,1109,"first_half_rp","TRAVIS","what would why would you do this?",6725,6728,3,8,160,NA,"role_play","TRAVIS",1,0,0,0
"1110","Vestiges",5,57,1110,"first_half_rp","LIAM","said the t. rex.",6728,6731,3,5,100,NA,"role_play","LIAM",1,0,0,0
"1111","Vestiges",5,57,1111,"first_half_rp","TALIESIN","i'm going to gently look around and slowly back up and see if i can see anyone.",6731,6738,7,19,162.857142857143,NA,"role_play","TALIESIN",1,0,0,0
"1112","Vestiges",5,57,1112,"first_half_rp","TALIESIN","hello? hello?",6738,6744,6,3,30,NA,"role_play","TALIESIN",1,0,0,0
"1113","Vestiges",5,57,1113,"first_half_rp","MATT","hello... hello... hello.",6744,6748,4,4,60,NA,"role_play","MATT",0,0,0,1
"1114","Vestiges",5,57,1114,"first_half_rp","TALIESIN","what do i have to pay to fix this?",6760,6762,2,10,300,NA,"role_play","TALIESIN",1,0,0,0
"1115","Vestiges",5,57,1115,"first_half_rp","MATT","this... this... this... this.",6762,6766.213,4.21299999999974,5,71.2081652029477,NA,"role_play","MATT",0,0,0,1
"1116","Vestiges",5,57,1116,"first_half_rp","TALIESIN","i leave.",6772.453,6773.786,1.33299999999963,3,135.033758439647,NA,"role_play","TALIESIN",1,0,0,0
"1117","Vestiges",5,57,1117,"first_half_rp","MATT","you hear the sound of some sort of low, distant hit and a rumble, and you see a distant light appear in a chamber just beyond the walkway, just faint enough to illuminate and give the presence of some sort of life or movement about a hundred or so feet ahead of you.",6773.786,6790,16.2139999999999,54,199.827309732331,NA,"role_play","MATT",0,0,0,1
"1118","Vestiges",5,57,1118,"first_half_rp","TALIESIN","i walk briskly towards it.",6796,6798,2,6,180,NA,"role_play","TALIESIN",1,0,0,0
"1119","Vestiges",5,57,1119,"first_half_rp","MATT","you enter the next chamber, where you see the interior of this structure is ivory-white bone and glass, with a blue hint, very much resembling the interior of a very naturally, beautifully-carved ice cavern. there is a stairway that ascends, as well as other hallways that lead out from the central nerve center of the lower floor of the main structure. as you walk into this central chamber, you see, ever so faintly, at the very top of the stairs, a pair of feet walk and disappear up the stairs.",6798,6833,35,93,159.428571428571,NA,"role_play","MATT",0,0,0,1
"1120","Vestiges",5,57,1120,"first_half_rp","TALIESIN","i'm going to charge after them.",6833,6835,2,8,240,NA,"role_play","TALIESIN",1,0,0,0
"1121","Vestiges",5,57,1121,"first_half_rp","MATT","okay. you go running up the stairway. you get to the top, and you can see at the very top of the stairs a dark wooden door with a dark iron rim and what appears to be a large hanger or handle or knocker bolted to it and it just closes as you come underneath the top of the archway and up the stairs.",6835,6857,22,65,177.272727272727,NA,"role_play","MATT",0,0,0,1
"1122","Vestiges",5,57,1122,"first_half_rp","TALIESIN","i knock.",6863.78,6865,1.22000000000025,3,147.540983606527,NA,"role_play","TALIESIN",1,0,0,0
"1123","Vestiges",5,57,1123,"first_half_rp","MATT","once?",6865,6869,4,2,30,NA,"role_play","MATT",0,0,0,1
"1124","Vestiges",5,57,1124,"first_half_rp","TALIESIN","three times.",6869,6871,2,3,90,NA,"role_play","TALIESIN",1,0,0,0
"1125","Vestiges",5,57,1125,"first_half_rp","MATT","with each hit, you can hear the reverberation of the echo of the knock through a much larger chamber beyond. as soon as you release the actual door knocker, the door just creaks open ever so slightly into a very, very dark chamber. you can see very, very little in here, other than the basic outline of what looks to be a little bit of floor, some sort of a smooth, glassy surface that refracts just a little bit of light that makes it through what looks to be some sort of broken-up glass dome-type structure above you. you can't make out much beyond that. it's very dark in here.",6871,6917.85,46.8500000000004,115,147.27854855923,NA,"role_play","MATT",0,0,0,1
"1126","Vestiges",5,57,1126,"first_half_rp","TALIESIN","hello? please. something terrible has happened. i don't understand how these games work. i need help to fix something. something terrible has happened! you obviously care little for this world. i start to back out.",6919.89,6956,36.1099999999997,37,61.4788147327616,NA,"role_play","TALIESIN",1,0,0,0
"1127","Vestiges",5,57,1127,"first_half_rp","MATT","as you step out of the room, you hear a whisper come from beyond the chamber, within the darkness. it says, ""is it yourself you wish to fix or something more?""",6956,6967,11,32,174.545454545455,NA,"role_play","MATT",0,0,0,1
"1128","Vestiges",5,57,1128,"first_half_rp","TALIESIN","i don't think i can be fixed. there is something broken in the world.",6970.38,6976,5.61999999999989,16,170.818505338082,NA,"role_play","TALIESIN",1,0,0,0
"1129","Vestiges",5,57,1129,"first_half_rp","MATT","""then come. let us talk.""",6978,6980,2,7,210,NA,"role_play","MATT",0,0,0,1
"1130","Vestiges",5,57,1130,"first_half_rp","TALIESIN","...i don't understand how these things work. i'm so sorry. where do you wish me to go?",6985,6993,8,21,157.5,NA,"role_play","TALIESIN",1,0,0,0
"1131","Vestiges",5,57,1131,"first_half_rp","MATT","""have faith.""",6994,6995.5,1.5,4,160,NA,"role_play","MATT",0,0,0,1
"1132","Vestiges",5,57,1132,"first_half_rp","MATT","""step in. join me.""",6997,7000,3,6,120,NA,"role_play","MATT",0,0,0,1
"1133","Vestiges",5,57,1133,"first_half_rp","TALIESIN","...i strip.",7001,7007,6,4,40,NA,"role_play","TALIESIN",1,0,0,0
"1134","Vestiges",5,57,1134,"first_half_rp","TALIESIN","and put it aside.",7009,7011,2,5,150,NA,"role_play","TALIESIN",1,0,0,0
"1135","Vestiges",5,57,1135,"first_half_rp","SAM","put ""it"" aside?",7011,7012,1,4,240,NA,"role_play","SAM",1,0,0,0
"1136","Vestiges",5,57,1136,"first_half_rp","TALIESIN","put my clothes in the corner.",7012,7013.5,1.5,7,280,NA,"role_play","TALIESIN",1,0,0,0
"1137","Vestiges",5,57,1137,"first_half_rp","SAM","oh. you're gonna jump her, eh?",7013.5,7015,1.5,8,320,NA,"role_play","SAM",1,0,0,0
"1138","Vestiges",5,57,1138,"first_half_rp","TALIESIN","you're filthy. and i go into the pool.",7015,7020,5,10,120,NA,"role_play","TALIESIN",1,0,0,0
"1139","Vestiges",5,57,1139,"first_half_rp","MATT","all right. as you step into the chamber, freezing cold as your toes",7020,7026.5,6.5,13,120,NA,"role_play","MATT",0,0,0,1
"1140","Vestiges",5,57,1140,"first_half_rp","TALIESIN","we're cold people.",7026.5,7028,1.5,5,200,NA,"role_play","TALIESIN",1,0,0,0
"1141","Vestiges",5,57,1141,"first_half_rp","MATT","your legs, your whole body eventually finds itself stepping into this thick, freezing liquid. you hear the whisper in your ears just as your head reaches the level of the blood, that says, ""come. come to me with your questions."" just as your head goes beneath the surface.",7028,7056,28,49,105,NA,"role_play","MATT",0,0,0,1
"1142","Vestiges",5,57,1142,"first_half_rp","TALIESIN","we're doing this.",7056,7059,3,5,100,NA,"role_play","TALIESIN",1,0,0,0
"1143","Vestiges",5,57,1143,"first_half_rp","MATT","you're underneath and in darkness, feeling around the thick material, kind of just swishing your fingers around, but amongst the liquid, you still hear the whisper again in your ear: ""come. bring your questions.""",7061,7079,18,36,120,NA,"role_play","MATT",0,0,0,1
"1144","Vestiges",5,57,1144,"first_half_rp","TALIESIN","and i swim down until it's uncomfortable.",7079,7084,5,9,108,NA,"role_play","TALIESIN",1,0,0,0
"1145","Vestiges",5,57,1145,"first_half_rp","MATT","you swim downward and you touch the bottom of the pool. you reach a somewhat concave, smooth floor to the pool.",7084,7096.63,12.6300000000001,22,104.513064133016,NA,"role_play","MATT",0,0,0,1
"1146","Vestiges",5,57,1146,"first_half_rp","TALIESIN","i'm going to head to the surface. i don't know what's...",7100,7103.5,3.5,15,257.142857142857,NA,"role_play","TALIESIN",1,0,0,0
"1147","Vestiges",5,57,1147,"first_half_rp","MATT","you head to the surface. there's no surface. it just keeps going.",7103.5,7108,4.5,14,186.666666666667,NA,"role_play","MATT",0,0,0,1
"1148","Vestiges",5,57,1148,"first_half_rp","TALIESIN","i do not do well with this.",7108,7112,4,8,120,NA,"role_play","TALIESIN",1,0,0,0
"1149","Vestiges",5,57,1149,"first_half_rp","MATT","you do not. you begin to panic.",7112,7115,3,8,160,NA,"role_play","MATT",0,0,0,1
"1150","Vestiges",5,57,1150,"first_half_rp","TALIESIN","yes, i do.",7115,7116.5,1.5,4,160,NA,"role_play","TALIESIN",1,0,0,0
"1151","Vestiges",5,57,1151,"first_half_rp","MATT","you begin to reach around and try to swim up and find the surface, but it just keeps going. the liquid's thick and it's hard to pull through, and you can't open your eyes, and you can't see anything, and the iron-like flavor is starting to find its way to the inside of your mouth as it's seeping through your nose and your ears. you begin to panic even further as the cold is starting to take and you feel your muscles beginning to shake and seize from the onset of hypothermia. you begin to head to the bottom of the pool again, and this time, you crack your head on the bottom in the middle of your stupor, and you reach up and scream in pain. as you do, the blood fills your lungs and you begin to feel yourself drown. you begin to shake and convulse as you begin to try to find a way to force it out of your body and you can't. and at that moment, where all of a sudden you realize that this is it. this is the end. this is how the tale of percival comes to an end. the sensation goes warm again. and it's like all that cold energy goes away, and you're now swimming in water, then air, and the pain subsides, and you're breathing normally. but you still stand in darkness, and you hear these distant footsteps. sourceless. no light, just shadow. and you look around over your shoulder and then right behind you, you see immediately a white porcelain face, the head is just standing there amongst the shadow.",7116.5,7204,87.5,283,194.057142857143,NA,"role_play","MATT",0,0,0,1
"1152","Vestiges",5,57,1152,"first_half_rp","TALIESIN","do you know what i've done?",7207,7209,2,8,240,NA,"role_play","TALIESIN",1,0,0,0
"1153","Vestiges",5,57,1153,"first_half_rp","MATT","""i've watched.""",7209,7212,3,5,100,NA,"role_play","MATT",0,0,0,1
"1154","Vestiges",5,57,1154,"first_half_rp","TALIESIN","i have questions.",7217,7220,3,4,80,NA,"role_play","TALIESIN",1,0,0,0
"1155","Vestiges",5,57,1155,"first_half_rp","MATT","""then ask them.""",7220,7222,2,5,150,NA,"role_play","MATT",0,0,0,1
"1156","Vestiges",5,57,1156,"first_half_rp","TALIESIN","first is, can we stop it? can we stop what's been released? is there something i can do?",7225,7237,12,20,100,NA,"role_play","TALIESIN",1,0,0,0
"1157","Vestiges",5,57,1157,"first_half_rp","MATT","""many things are released in this world. ""many terrible, many wonderful. many things. ""ask the right questions.""",7237,7248,11,19,103.636363636364,NA,"role_play","MATT",0,0,0,1
"1158","Vestiges",5,57,1158,"first_half_rp","TALIESIN","did it choose me because i was broken, or did it break me?",7255,7258.98,3.97999999999956,14,211.055276381933,NA,"role_play","TALIESIN",1,0,0,0
"1159","Vestiges",5,57,1159,"first_half_rp","MATT","the mask, which has not shown any expression at this point, pulls back a little bit from you and almost seems to grow in size. it's strange; the proportion seems to stay the same, but suddenly your vision shifts and you realize, no, it's farther away from you and is just suddenly immense, like your visual focus just changes and your whole perspective suddenly causes you to lose sense of scale and balance. the voice comes in, this time louder: ""you were always broken, percival. ""and you were preyed upon, just as it preys upon others, ""and will continue to do so until finally destroyed.""",7261,7303,42,108,154.285714285714,NA,"role_play","MATT",0,0,0,1
"1160","Vestiges",5,57,1160,"first_half_rp","TALIESIN","can it be fixed?",7307,7310,3,5,100,NA,"role_play","TALIESIN",1,0,0,0
"1161","Vestiges",5,57,1161,"first_half_rp","MATT","""perhaps. ""your deeds will guide your path to salvation or damnation. ""the choice is yours. you skirt that line still.""",7310,7321,11,22,120,NA,"role_play","MATT",0,0,0,1
"1162","Vestiges",5,57,1162,"first_half_rp","TALIESIN","but the first deed is so... there's so much, and i don't think any of them see it. i want it to die before anybody sees it. can you help?",7321,7341,20,33,99,NA,"role_play","TALIESIN",1,0,0,0
"1163","Vestiges",5,57,1163,"first_half_rp","MATT","""i've already helped, percival. ""do not think the path that you and your allies walk ""goes unseen. ""there are many of those in this world that represent the will of us, ""just as there are those who represent the will ""of those that combat us and always have. ""there are a great many deeds ahead of you. ""it's your choice to take them. ""just know: should you not watch yourself, ""you may not find yourself on our side.""",7341,7383,42,82,117.142857142857,NA,"role_play","MATT",0,0,0,1
"1164","Vestiges",5,57,1164,"first_half_rp","TALIESIN","i know. there is nowhere i can look for healing? other than deeds? i like to fix things.",7383,7403.56,20.5600000000004,19,55.4474708171195,NA,"role_play","TALIESIN",1,0,0,0
"1165","Vestiges",5,57,1165,"first_half_rp","MATT","""all life is inherently broken from the start, percival. ""take solace in that. ""there is no perfection in life. ""otherwise, what would be the purpose of death? ""it's to try to find ways to better yourself before the end ""that gives us purpose. ""you are all broken, but also understand,"" at this point, her voice gets very deep and very resonant. ""mortals can achieve great things. ""i did."" and the mask pulls back into the shadows and suddenly you begin coughing, finding your way to the surface, pouring blood out of your mouth and coughing and eventually you find your way over, breathing heavily, to the side of the pool and pull yourself onto the side. cough the rest of it up. a little bit of moonlight peeks through, and you can see the beams refracting through the purples and reds and blues and just hints of specks of light that just shimmer across the surface of this dark, glass-like floor.",7406.58,7473.45,66.8699999999999,165,148.048452220727,NA,"role_play","MATT",0,0,0,1
"1166","Vestiges",5,57,1166,"first_half_rp","TALIESIN","i'm going to take my sword and i'm going to very carefully scrape my body clean of the blood, as much as i can, and i'm going to take the back of my shirt and clean my hair off as much as i can. i'm going to take a vial of the blood in the pool. one tiny bit.",7479,7503,24,64,160,NA,"role_play","TALIESIN",1,0,0,0
"1167","Vestiges",5,57,1167,"first_half_rp","MATT","you do so.",7503,7504.44,1.4399999999996,4,166.666666666713,NA,"role_play","MATT",0,0,0,1
"1168","Vestiges",5,57,1168,"first_half_rp","TALIESIN","i'm going to put my clothes back on... and i'm going to cast hex on myself for my walk home and banish it before i come in the door.",7504.44,7519,14.5600000000004,32,131.868131868128,NA,"role_play","TALIESIN",1,0,0,0
"1169","Vestiges",5,57,1169,"first_half_rp","MATT","okay. all righty. so, as percival finally wanders in, is there anything else anyone wants to achieve before the evening's done?",7519,7531,12,23,115,NA,"role_play","MATT",0,0,0,1
"1170","Vestiges",5,57,1170,"first_half_rp","SAM","i'd like to go to the raven queen.",7531,7532.5,1.5,10,400,NA,"role_play","SAM",1,0,0,0
"1171","Vestiges",5,57,1171,"first_half_rp","SAM","no.",7537,7538,1,2,120,NA,"role_play","SAM",1,0,0,0
"1172","Vestiges",5,57,1172,"first_half_rp","LIAM","are we next morning, or we're still evening, at this point?",7538,7540.5,2.5,13,312,NA,"role_play","LIAM",1,0,0,0
"1173","Vestiges",5,57,1173,"first_half_rp","MATT","we're still evening at the moment, if there's anything else you wish to achieve. otherwise",7540.5,7543.5,3,17,340,NA,"role_play","MATT",0,0,0,1
"1174","Vestiges",5,57,1174,"first_half_rp","LAURA","i've been slowly heating water and giving it to vax to put in his bath.",7543.5,7546,2.5,17,408,NA,"role_play","LAURA",1,0,0,0
"1175","Vestiges",5,57,1175,"first_half_rp","MATT","you do manage to draw a comfortable bath for your brother and wash him clean.",7546,7550.22,4.22000000000025,16,227.488151658754,NA,"role_play","MATT",0,0,0,1
"1176","Vestiges",5,57,1176,"first_half_rp","LAURA","i don't wash him! i just give him the fucking water.",7550.22,7554,3.77999999999975,13,206.34920634922,NA,"role_play","LAURA",1,0,0,0
"1177","Vestiges",5,57,1177,"first_half_rp","MATT","you aid him in washing himself clean. so you specify.",7554,7555.5,1.5,11,440,NA,"role_play","MATT",0,0,0,1
"1178","Vestiges",5,57,1178,"first_half_rp","LIAM","thanks, man.",7555.5,7559,3.5,3,51.4285714285714,NA,"role_play","LIAM",1,0,0,0
"1179","Vestiges",5,57,1179,"first_half_rp","TRAVIS","do we see percy when he comes in?",7559,7561.5,2.5,9,216,NA,"role_play","TRAVIS",1,0,0,0
"1180","Vestiges",5,57,1180,"first_half_rp","MATT","it's going to be late.",7561.5,7563,1.5,7,280,NA,"role_play","MATT",0,0,0,1
"1181","Vestiges",5,57,1181,"first_half_rp","TALIESIN","i'm going to walk quiet and late and go tinker on a little thing for a minute until i pass out.",7563,7568,5,23,276,NA,"role_play","TALIESIN",1,0,0,0
