"","arc","arc_no","episode","turn_number","segment","actor","text","start_turn","end_turn","time_in_sec","word_count","words_per_minute","encounter_count","rp_combat","actor_guest","vox_machina","guest","staff","matt"
"504","Vestiges",5,61,504,"first_half_rp","SAM","all right, i put down my book and hop off of grog and go up there.",2662.661,2667.456,4.79500000000007,17,212.721584984355,NA,"role_play","SAM",1,0,0,0
"505","Vestiges",5,61,505,"first_half_rp","MARISHA","i sit down with percy.",2667.456,2668.998,1.54199999999992,6,233.463035019468,NA,"role_play","MARISHA",1,0,0,0
"506","Vestiges",5,61,506,"first_half_rp","LAURA","add ten to it because of pass without a trace.",2668.998,2670.959,1.96099999999979,11,336.562978072449,NA,"role_play","LAURA",1,0,0,0
"507","Vestiges",5,61,507,"first_half_rp","SAM","i don't think you cast it on me, did you?",2670.959,2672.509,1.55000000000018,12,464.516129032204,NA,"role_play","SAM",1,0,0,0
"508","Vestiges",5,61,508,"first_half_rp","LAURA","i cast it on everybody that's within 30 feet of me.",2672.509,2674.52,2.01099999999997,13,387.866732968679,NA,"role_play","LAURA",1,0,0,0
"509","Vestiges",5,61,509,"first_half_rp","SAM","am i there yet? i'm exhausted.",2674.52,2680.878,6.35800000000017,8,75.495438817236,NA,"role_play","SAM",1,0,0,0
"510","Vestiges",5,61,510,"first_half_rp","MATT","yeah, it's at disadvantage.",2680.878,2682.767,1.88899999999967,6,190.577024880923,NA,"role_play","MATT",0,0,0,1
"511","Vestiges",5,61,511,"first_half_rp","SAM","same. what is it?",2682.767,2686.948,4.18100000000004,5,71.7531690983012,NA,"role_play","SAM",1,0,0,0
"512","Vestiges",5,61,512,"first_half_rp","TALIESIN","stealth. plus ten.",2686.948,2688.716,1.76800000000003,4,135.746606334839,NA,"role_play","TALIESIN",1,0,0,0
"513","Vestiges",5,61,513,"first_half_rp","SAM","oh! hey, that's 18! that's not bad.",2688.716,2691.666,2.95000000000027,10,203.389830508456,NA,"role_play","SAM",1,0,0,0
"514","Vestiges",5,61,514,"first_half_rp","LAURA","would have been eight?! jesus.",2691.666,2695.583,3.91699999999992,6,91.9070717385774,NA,"role_play","LAURA",1,0,0,0
"515","Vestiges",5,61,515,"first_half_rp","MARISHA","i sit down with percy and i say: six gold that after 200 seconds, they run out screaming again.",2695.583,2708.219,12.636,20,94.9667616334285,NA,"role_play","MARISHA",1,0,0,0
"516","Vestiges",5,61,516,"first_half_rp","SAM","can i be doing countercharm? can i hum a little tune? is that how it works? i don't know how it works!",2708.219,2716.098,7.87899999999991,24,182.764310191651,NA,"role_play","SAM",1,0,0,0
"517","Vestiges",5,61,517,"first_half_rp","MATT","well, it's time for you to learn how one of your abilities works here, sam. for countercharm: as an action, you set up a performance that lasts until the end of your next turn. during that time, you and any friendly creature",2716.098,2730.892,14.7939999999999,43,174.395025010141,NA,"role_play","MATT",0,0,0,1
"518","Vestiges",5,61,518,"first_half_rp","SAM","it lasts six seconds?!",2730.892,2732.321,1.42900000000009,5,209.937018894319,NA,"role_play","SAM",1,0,0,0
"519","Vestiges",5,61,519,"first_half_rp","MATT","hold on. you can keep doing it every round if you want to. it doesn't say there's a limit to it.",2732.321,2742.42,10.0990000000002,24,142.58837508664,NA,"role_play","MATT",0,0,0,1
"520","Vestiges",5,61,520,"first_half_rp","SAM","all right. i'll keep humming.",2742.42,2746.493,4.07299999999987,7,103.118094770443,NA,"role_play","SAM",1,0,0,0
"521","Vestiges",5,61,521,"first_half_rp","MATT","they have to hear you to be affected by it. it has to be loud enough for them to hear you.",2746.493,2752.027,5.53400000000011,22,238.525478857964,NA,"role_play","MATT",0,0,0,1
"522","Vestiges",5,61,522,"first_half_rp","SAM","sure. i'll hum loudly.",2752.027,2754.092,2.06500000000005,6,174.334140435831,NA,"role_play","SAM",1,0,0,0
"523","Vestiges",5,61,523,"first_half_rp","LIAM","you want to break our stealth?",2754.092,2755.642,1.54999999999973,7,270.967741935532,NA,"role_play","LIAM",1,0,0,0
"524","Vestiges",5,61,524,"first_half_rp","MATT","it's going to happen.",2755.642,2756.562,0.920000000000073,6,391.304347826056,NA,"role_play","MATT",0,0,0,1
"525","Vestiges",5,61,525,"first_half_rp","SAM","shit.",2756.562,2757.616,1.05400000000009,2,113.851992409858,NA,"role_play","SAM",1,0,0,0
"526","Vestiges",5,61,526,"first_half_rp","MATT","yeah, one way or the other. you've got countercharm or keeping stealthed.",2757.616,2760.503,2.88700000000017,14,290.959473501888,NA,"role_play","MATT",0,0,0,1
"527","Vestiges",5,61,527,"first_half_rp","LAURA","aw, fuck.",2760.503,2762.328,1.82499999999982,3,98.6301369863112,NA,"role_play","LAURA",1,0,0,0
"528","Vestiges",5,61,528,"first_half_rp","SAM","we'll stealth, and if it starts to feel icky, then i'll do it.",2762.328,2767.223,4.89499999999998,16,196.11848825332,NA,"role_play","SAM",1,0,0,0
"529","Vestiges",5,61,529,"first_half_rp","LAURA","okay. all right. i basically just want to see what the fuck is laughing. i want to see what it is.",2767.223,2773.846,6.62300000000005,22,199.305450702097,NA,"role_play","LAURA",1,0,0,0
"530","Vestiges",5,61,530,"first_half_rp","LIAM","if i do not see a mummer's show from this, there will be hell to pay. now let's go.",2773.846,2778.36,4.51400000000012,22,292.423571112088,NA,"role_play","LIAM",1,0,0,0
"531","Vestiges",5,61,531,"first_half_rp","MATT","so the three of you and garmelie, who's invisible at this point in time, you approach what looks to be a clearing ahead of you now. the trees actually disperse a bit. you can see what appears to be a small campfire that's crackling in the center of this clearing. and the music is actually quite loud now. you see figures jaunting around this fire and holding hands and swirling for a second and then separating. then dancing a little ways around it again.",2778.36,2806.874,28.5139999999997,87,183.067966612894,NA,"role_play","MATT",0,0,0,1
"532","Vestiges",5,61,532,"first_half_rp","LAURA","what kind of figures?",2806.874,2810.13,3.25600000000031,5,92.1375921375833,NA,"role_play","LAURA",1,0,0,0
"533","Vestiges",5,61,533,"first_half_rp","MATT","you have to get closer.",2810.13,2811.582,1.45199999999977,6,247.93388429756,NA,"role_play","MATT",0,0,0,1
"534","Vestiges",5,61,534,"first_half_rp","LAURA","fuck! fuck this. fuck it. i'm not doing it.",2811.582,2814.373,2.79100000000017,11,236.474381941942,NA,"role_play","LAURA",1,0,0,0
"535","Vestiges",5,61,535,"first_half_rp","LIAM","i will go closer.",2814.373,2816.239,1.86599999999999,5,160.771704180066,NA,"role_play","LIAM",1,0,0,0
"536","Vestiges",5,61,536,"first_half_rp","LAURA","no. don't fucking go closer. i get a really bad feeling. all of a sudden, i get a really bad feeling about this.",2816.239,2821.531,5.29199999999992,25,283.446712018145,NA,"role_play","LAURA",1,0,0,0
"537","Vestiges",5,61,537,"first_half_rp","LIAM","39 stealth.",2821.531,2826.415,4.88400000000001,3,36.8550368550368,NA,"role_play","LIAM",1,0,0,0
"538","Vestiges",5,61,538,"first_half_rp","LAURA","i'm behind a tree.",2826.415,2828.998,2.58300000000008,6,139.372822299647,NA,"role_play","LAURA",1,0,0,0
"539","Vestiges",5,61,539,"first_half_rp","MATT","you're behind a tree. garmelie is staying with you. what are you doing?",2828.998,2832.438,3.44000000000005,15,261.62790697674,NA,"role_play","MATT",0,0,0,1
"540","Vestiges",5,61,540,"first_half_rp","SAM","can i sing to him through the earring? no, we talked about that before.",2832.438,2839.735,7.29700000000003,15,123.338358229409,NA,"role_play","SAM",1,0,0,0
"541","Vestiges",5,61,541,"first_half_rp","MATT","no, the effect has to be within hearing, so either you go up with him or you stay behind.",2839.735,2843.596,3.86099999999988,20,310.800310800321,NA,"role_play","MATT",0,0,0,1
"542","Vestiges",5,61,542,"first_half_rp","SAM","i'm going to stay behind.",2843.596,2845.963,2.36700000000019,7,177.439797211646,NA,"role_play","SAM",1,0,0,0
"543","Vestiges",5,61,543,"first_half_rp","MATT","okay. so vax, you come up to the very edge of the clearing. you vanish. you come to the very edge of the clearing. you see before you where the laughter's coming from. there is an elf, in full verdant guard armor of syngorn, who is skipping and laughing around the fire, dancing alongside what appears to be a bipedal humanoid creature covered in fur with claws, a longer snout. and they are both smiling and holding each other's hands and spinning and twirling each other. and dancing around.",2845.963,2882.757,36.7939999999999,92,150.024460509866,NA,"role_play","MATT",0,0,0,1
"544","Vestiges",5,61,544,"first_half_rp","LAURA","they're totally charmed.",2882.757,2885.706,2.94900000000007,5,101.729399796539,NA,"role_play","LAURA",1,0,0,0
"545","Vestiges",5,61,545,"first_half_rp","MATT","you see the music is actually coming from a floating spectral violin, flute and drum, unmanned by any creature; just slowly drifting around the clearing, around the entities that are dancing. i also need you to make a wisdom saving throw.",2885.706,2902.592,16.886,42,149.236053535473,NA,"role_play","MATT",0,0,0,1
"546","Vestiges",5,61,546,"first_half_rp","MARISHA","ah, there it is!",2902.592,2904.09,1.49800000000005,5,200.267022696923,NA,"role_play","MARISHA",1,0,0,0
"547","Vestiges",5,61,547,"first_half_rp","LAURA","oh, jeez! is it a charm effect?",2904.09,2905.642,1.55199999999968,8,309.278350515528,NA,"role_play","LAURA",1,0,0,0
"548","Vestiges",5,61,548,"first_half_rp","LIAM","yeah, is it? because i have advantage if it's a charm effect.",2905.642,2908.015,2.37300000000005,14,353.982300884949,NA,"role_play","LIAM",1,0,0,0
"549","Vestiges",5,61,549,"first_half_rp","MATT","you do.",2908.015,2909.173,1.1579999999999,3,155.440414507785,NA,"role_play","MATT",0,0,0,1
"550","Vestiges",5,61,550,"first_half_rp","LIAM","and i'll use one luck for the day. first luck. all right. 17.",2909.173,2919.893,10.7200000000003,15,83.955223880595,NA,"role_play","LIAM",1,0,0,0
"551","Vestiges",5,61,551,"first_half_rp","MATT","17. okay. looking forward, you find a tapping on the side of your hip as the beat finds you. and you begin to drift out of the shadows into the center of this clearing. you look over and see as the guard extends his hand and takes yours. the beat kicks into you, a smile creeps across your face",2919.893,2945.139,25.2460000000001,59,140.220232908183,NA,"role_play","MATT",0,0,0,1
"552","Vestiges",5,61,552,"first_half_rp","LAURA","i take my broom out and i start flying up and i grab scanlan's hand and take him on the broom with me.",2945.139,2948.569,3.42999999999984,25,437.317784256581,NA,"role_play","LAURA",1,0,0,0
"553","Vestiges",5,61,553,"first_half_rp","SAM","where we going?",2948.569,2949.535,0.965999999999894,4,248.447204968971,NA,"role_play","SAM",1,0,0,0
"554","Vestiges",5,61,554,"first_half_rp","LAURA","we're going to fucking get vax out of there.",2949.535,2950.935,1.40000000000009,11,471.428571428541,NA,"role_play","LAURA",1,0,0,0
"555","Vestiges",5,61,555,"first_half_rp","SAM","i start singing.",2950.935,2952.076,1.14100000000008,4,210.341805433816,NA,"role_play","SAM",1,0,0,0
"556","Vestiges",5,61,556,"first_half_rp","MATT","okay.",2952.076,2953.399,1.32299999999987,2,90.7029478458142,NA,"role_play","MATT",0,0,0,1
"557","Vestiges",5,61,557,"first_half_rp","SAM","countercharm.",2953.399,2956.327,2.92800000000034,2,40.9836065573723,NA,"role_play","SAM",1,0,0,0
"558","Vestiges",5,61,558,"first_half_rp","MATT","the gentle sounds of careless whisper keeping any possible invasion of your mind at bay, hopefully. you just hear garmelie behind you going ""no! what are you doing?!"" echoing through the trees as you guys dart in towards the center of this camp. you",2956.327,2976.132,19.8049999999998,44,133.299671800052,NA,"role_play","MATT",0,0,0,1
"559","Vestiges",5,61,559,"first_half_rp","LIAM","i'm on, man. i'm lit.",2976.132,2979.466,3.33399999999983,8,143.971205758855,NA,"role_play","LIAM",1,0,0,0
"560","Vestiges",5,61,560,"first_half_rp","MATT","you are totally on. this is an amazing experience. you feel the color and the music surging through you, and all through this endless surge of energy inside as you begin to now join into this other dancing trio.",2979.466,2991.646,12.1800000000003,40,197.044334975365,NA,"role_play","MATT",0,0,0,1
"561","Vestiges",5,61,561,"first_half_rp","LIAM","fucking werewolf guy look good.",2991.646,2993.442,1.79599999999982,6,200.445434298461,NA,"role_play","LIAM",1,0,0,0
"562","Vestiges",5,61,562,"first_half_rp","MATT","yeah. you guys dart into the center of this, hearing the music, hearing the laughter, watching your brother with a joker-like smile on his face, the sheer joy pulling his expression into one of a very disturbing joy. i need both of you guys to make wisdom saving throws with advantage.",2993.442,3013.157,19.7150000000001,53,161.298503677402,NA,"role_play","MATT",0,0,0,1
"563","Vestiges",5,61,563,"first_half_rp","LIAM","oh dear.",3013.157,3018.478,5.32099999999991,3,33.8282277767343,NA,"role_play","LIAM",1,0,0,0
"564","Vestiges",5,61,564,"first_half_rp","TALIESIN","advantage versus magic.",3018.478,3022.713,4.23500000000013,4,56.6706021251459,NA,"role_play","TALIESIN",1,0,0,0
"565","Vestiges",5,61,565,"first_half_rp","SAM","yeah, i already had advantage.",3022.713,3024.816,2.10299999999961,6,171.184022824568,NA,"role_play","SAM",1,0,0,0
"566","Vestiges",5,61,566,"first_half_rp","TALIESIN","well, there you go.",3024.816,3026.294,1.47800000000007,5,202.976995940451,NA,"role_play","TALIESIN",1,0,0,0
"567","Vestiges",5,61,567,"first_half_rp","SAM","13.",3026.294,3027.404,1.11000000000013,2,108.108108108096,NA,"role_play","SAM",1,0,0,0
"568","Vestiges",5,61,568,"first_half_rp","LAURA","23.",3027.404,3029.519,2.11499999999978,2,56.7375886524881,NA,"role_play","LAURA",1,0,0,0
"569","Vestiges",5,61,569,"first_half_rp","MATT","23? all right. you sweep in at this point, and find that scanlan jumps off the broom.",3029.519,3040.439,10.9200000000001,18,98.9010989010982,NA,"role_play","MATT",0,0,0,1
"570","Vestiges",5,61,570,"first_half_rp","LAURA","no! don't jump off the broom!",3040.439,3042.083,1.64400000000023,8,291.970802919667,NA,"role_play","LAURA",1,0,0,0
"571","Vestiges",5,61,571,"first_half_rp","MATT","you tumble down. make an athletics check. acrobatics.",3042.083,3045.616,3.5329999999999,9,152.844607981889,NA,"role_play","MATT",0,0,0,1
"572","Vestiges",5,61,572,"first_half_rp","SAM","save? check? ten. check or save?",3045.616,3050.562,4.94599999999991,7,84.9171047310973,NA,"role_play","SAM",1,0,0,0
"573","Vestiges",5,61,573,"first_half_rp","MATT","check.",3050.562,3051.749,1.1869999999999,2,101.095197978105,NA,"role_play","MATT",0,0,0,1
"574","Vestiges",5,61,574,"first_half_rp","SAM","ten.",3051.749,3053.957,2.20800000000008,2,54.3478260869545,NA,"role_play","SAM",1,0,0,0
"575","Vestiges",5,61,575,"first_half_rp","MATT","okay. you catch yourself. it wasn't a large fall. you land on your feet down on the ground with a crunch. a number of things crunch and break beneath your feet as you stand up and you look up and see as vax, this elvish warrior knight, and a straight-up wolfman all lead you into the dance, and the four of you now begin to take each other's hands and laugh and skip around in a circle.",3053.957,3080.865,26.9079999999999,81,180.615430355285,NA,"role_play","MATT",0,0,0,1
"576","Vestiges",5,61,576,"first_half_rp","LAURA","i'm going to try to pokéball vax into my necklace.",3080.865,3083.316,2.45100000000002,12,293.757649938798,NA,"role_play","LAURA",1,0,0,0
"577","Vestiges",5,61,577,"first_half_rp","MATT","okay.",3083.316,3085.015,1.69900000000007,2,70.6297822248353,NA,"role_play","MATT",0,0,0,1
"578","Vestiges",5,61,578,"first_half_rp","LAURA","okay, i'm going to try to do that.",3085.015,3086.798,1.7829999999999,10,336.511497476182,NA,"role_play","LAURA",1,0,0,0
"579","Vestiges",5,61,579,"first_half_rp","TALIESIN","i'm hearing this cacophony, and i'm slowly getting up with a sigh and moving in the direction of the campsite.",3086.798,3092.432,5.63400000000001,23,244.941427050053,NA,"role_play","TALIESIN",1,0,0,0
"580","Vestiges",5,61,580,"first_half_rp","MARISHA","you might have won this bet this time, percy.",3092.432,3094.379,1.94700000000012,10,308.166409861307,NA,"role_play","MARISHA",1,0,0,0
"581","Vestiges",5,61,581,"first_half_rp","LAURA","not yet!",3094.379,3095.481,1.10200000000032,3,163.339382940062,NA,"role_play","LAURA",1,0,0,0
"582","Vestiges",5,61,582,"first_half_rp","TALIESIN","slow walk. you've got time.",3095.481,3097.21,1.72899999999981,7,242.914979757111,NA,"role_play","TALIESIN",1,0,0,0
"583","Vestiges",5,61,583,"first_half_rp","MARISHA","i'm holding onto my six gold.",3097.21,3099.914,2.70400000000018,8,177.514792899397,NA,"role_play","MARISHA",1,0,0,0
"584","Vestiges",5,61,584,"first_half_rp","LAURA","you have to make a wisdom saving throw against me.",3099.914,3103.489,3.57499999999982,11,184.615384615394,NA,"role_play","LAURA",1,0,0,0
"585","Vestiges",5,61,585,"first_half_rp","LIAM","okay.",3103.489,3105.001,1.51200000000017,2,79.3650793650704,NA,"role_play","LIAM",1,0,0,0
"586","Vestiges",5,61,586,"first_half_rp","LAURA","why'd you roll twice?",3105.001,3111.638,6.63699999999972,6,54.2413741148132,NA,"role_play","LAURA",1,0,0,0
"587","Vestiges",5,61,587,"first_half_rp","LIAM","because i have advantage against charm.",3111.638,3113.977,2.33899999999994,7,179.56391620351,NA,"role_play","LIAM",1,0,0,0
"588","Vestiges",5,61,588,"first_half_rp","LAURA","it's not charm! it was just wisdom.",3113.977,3115.668,1.69100000000026,9,319.337670017692,NA,"role_play","LAURA",1,0,0,0
"589","Vestiges",5,61,589,"first_half_rp","LIAM","oh, then i rolled shit. it's just a five.",3115.668,3117.029,1.36099999999988,11,484.93754592216,NA,"role_play","LIAM",1,0,0,0
"590","Vestiges",5,61,590,"first_half_rp","LAURA","then he goes in the pokéball!",3117.029,3118.566,1.53699999999981,7,273.25959661682,NA,"role_play","LAURA",1,0,0,0
"591","Vestiges",5,61,591,"first_half_rp","MATT","you are pulled into the necklace. i'm really going to push to refer to it as a necklace.",3118.566,3125.556,6.99000000000024,20,171.673819742483,NA,"role_play","MATT",0,0,0,1
"592","Vestiges",5,61,592,"first_half_rp","LAURA","sorry, necklace. the raven's slumber necklace.",3125.556,3130.343,4.78699999999981,8,100.271568832258,NA,"role_play","LAURA",1,0,0,0
"593","Vestiges",5,61,593,"first_half_rp","MATT","i'm going to really push to have it be called a necklace. vax, all of a sudden you're pulled out of this dance, and your head is clouded for a second as you find yourself in a singular darkened stone room. four walls, a single stone throne in the center of it facing out towards a glass window the size of the other walls. it shows an image of the perspective of the necklace.",3130.343,3155.744,25.4010000000003,77,181.882603047122,NA,"role_play","MATT",0,0,0,1
"594","Vestiges",5,61,594,"first_half_rp","LIAM","first conscious person to go in here.",3155.744,3157.741,1.99699999999984,8,240.360540811236,NA,"role_play","LIAM",1,0,0,0
"595","Vestiges",5,61,595,"first_half_rp","MATT","second, technically.",3157.741,3159.567,1.82600000000002,3,98.576122672507,NA,"role_play","MATT",0,0,0,1
"596","Vestiges",5,61,596,"first_half_rp","MARISHA","second to grog.",3159.567,3161.158,1.59099999999989,4,150.848522941556,NA,"role_play","MARISHA",1,0,0,0
"597","Vestiges",5,61,597,"first_half_rp","LIAM","grog was unconscious.",3161.158,3162.58,1.42200000000003,4,168.776371308014,NA,"role_play","LIAM",1,0,0,0
"598","Vestiges",5,61,598,"first_half_rp","TRAVIS","no, i wasn't.",3162.58,3163.773,1.19300000000021,5,251.466890192747,NA,"role_play","TRAVIS",1,0,0,0
"599","Vestiges",5,61,599,"first_half_rp","SAM","he was very close to death.",3163.773,3165.485,1.71199999999999,7,245.32710280374,NA,"role_play","SAM",1,0,0,0
"600","Vestiges",5,61,600,"first_half_rp","LAURA","can i grab scanlan?",3165.485,3168.264,2.779,5,107.952500899604,NA,"role_play","LAURA",1,0,0,0
"601","Vestiges",5,61,601,"first_half_rp","MATT","you can.",3168.264,3170.203,1.93899999999985,3,92.8313563692696,NA,"role_play","MATT",0,0,0,1
"602","Vestiges",5,61,602,"first_half_rp","SAM","i'm doing the russian bottle dance from fiddler on the roof right now.",3170.203,3173.554,3.35100000000011,15,268.576544315121,NA,"role_play","SAM",1,0,0,0
"603","Vestiges",5,61,603,"first_half_rp","MATT","it's fantastic.",3173.554,3174.881,1.32699999999977,4,180.859080633038,NA,"role_play","MATT",0,0,0,1
"604","Vestiges",5,61,604,"first_half_rp","LAURA","i want to fly down and get him around the waist and pull him out.",3174.881,3177.671,2.78999999999996,16,344.086021505381,NA,"role_play","LAURA",1,0,0,0
"605","Vestiges",5,61,605,"first_half_rp","MATT","make an athletics check. i need you to make an acrobatics check.",3177.671,3182.057,4.38599999999997,13,177.838577291383,NA,"role_play","MATT",0,0,0,1
"606","Vestiges",5,61,606,"first_half_rp","SAM","check?",3182.057,3184.464,2.40700000000015,2,49.8545907768975,NA,"role_play","SAM",1,0,0,0
"607","Vestiges",5,61,607,"first_half_rp","MATT","yes, so roll and add your acrobatics with disadvantage.",3184.464,3187.207,2.74299999999994,10,218.738607364205,NA,"role_play","MATT",0,0,0,1
"608","Vestiges",5,61,608,"first_half_rp","SAM","11.",3187.207,3190.612,3.4050000000002,2,35.2422907488966,NA,"role_play","SAM",1,0,0,0
"609","Vestiges",5,61,609,"first_half_rp","LAURA","athletics?",3190.612,3191.997,1.38499999999976,2,86.6425992779931,NA,"role_play","LAURA",1,0,0,0
"610","Vestiges",5,61,610,"first_half_rp","MATT","yes.",3191.997,3193.16,1.16300000000001,2,103.181427343077,NA,"role_play","MATT",0,0,0,1
"611","Vestiges",5,61,611,"first_half_rp","LAURA","oh, that's strength, isn't it? oh, sorry. 17.",3193.16,3200.894,7.73399999999992,11,85.3374709076812,NA,"role_play","LAURA",1,0,0,0
"612","Vestiges",5,61,612,"first_half_rp","MATT","17. you manage to grab scanlan, pull him onto the broom with you. the two other dancers immediately reach up and grab him and try to pull him back down into it. at this point, you look into their faces and you can see, while they have smiles on them, their eyes are fearful and desperate, their bodies are emaciated and exhausted. they both look like their physical bodies are on the edge of collapse from nonstop dancing for god knows how long. you glance down at the ground around you, and you can see numerous piles of broken bones and discarded armor. all order of other creatures that have befallen this spot amongst the forest and never left. they're pulling against you. we're making opposed strength checks. go ahead and roll.",3200.894,3256.359,55.4650000000001,135,146.038042008473,NA,"role_play","MATT",0,0,0,1
"613","Vestiges",5,61,613,"first_half_rp","MARISHA","come on, vex.",3256.359,3258.797,2.4380000000001,4,98.4413453650492,NA,"role_play","MARISHA",1,0,0,0
"614","Vestiges",5,61,614,"first_half_rp","LAURA","fuck. i'm so weak, you guys.",3258.797,3260.672,1.875,8,256,NA,"role_play","LAURA",1,0,0,0
"615","Vestiges",5,61,615,"first_half_rp","MATT","so are they right now, though. they're heavily emaciated.",3260.672,3264.018,3.346,11,197.250448296473,NA,"role_play","MATT",0,0,0,1
"616","Vestiges",5,61,616,"first_half_rp","LAURA","just a regular strength check? it's not a saving throw?",3264.018,3270.255,6.23700000000008,12,115.440115440114,NA,"role_play","LAURA",1,0,0,0
"617","Vestiges",5,61,617,"first_half_rp","MATT","nope.",3270.255,3271.617,1.36200000000008,2,88.1057268722415,NA,"role_play","MATT",0,0,0,1
"618","Vestiges",5,61,618,"first_half_rp","LAURA","11.",3271.617,3272.936,1.31899999999996,2,90.9780136467048,NA,"role_play","LAURA",1,0,0,0
"619","Vestiges",5,61,619,"first_half_rp","MATT","11. you feel as scanlan, who was shoving off of you instinctually and both of these bodies grabbing his legs and pulling him down off the broom, he is pulled from your grasp, hits the ground, and the three of them continue their dance, completely nonchalant. not even paying attention to your presence at this point.",3272.936,3291.006,18.0699999999997,57,189.263973436638,NA,"role_play","MATT",0,0,0,1
"620","Vestiges",5,61,620,"first_half_rp","LAURA","i fly away. minor problem. it was really a very bad idea to go towards the music. however, scanlan's enchanted, and we should probably save him because it looks like a lot of people have also been enchanted and are stuck there forever. if you're going to come and try to save him, plug your fucking ears, because i have a feeling this music is cursed. and i start shoving shit in my ears.",3291.006,3316.93,25.924,77,178.213238697732,NA,"role_play","LAURA",1,0,0,0
"621","Vestiges",5,61,621,"first_half_rp","TALIESIN","keyleth, can you druidcraft some cotton?",3316.93,3319.59,2.66000000000031,7,157.894736842087,NA,"role_play","TALIESIN",1,0,0,0
"622","Vestiges",5,61,622,"first_half_rp","MARISHA","sure. you owe me six gold.",3319.59,3322.107,2.51699999999983,7,166.865315852217,NA,"role_play","MARISHA",1,0,0,0
"623","Vestiges",5,61,623,"first_half_rp","TALIESIN","no, we're going to save them. you owe me six gold.",3322.107,3324.518,2.41100000000006,13,323.517212774774,NA,"role_play","TALIESIN",1,0,0,0
"624","Vestiges",5,61,624,"first_half_rp","MARISHA","but she's running back out screaming! three and three, we split the gold three-three. it was a draw.",3324.518,3331.856,7.33800000000019,21,171.708912510216,NA,"role_play","MARISHA",1,0,0,0
"625","Vestiges",5,61,625,"first_half_rp","TALIESIN","vex, could you go fetch a pail of water?",3331.856,3335.427,3.57099999999991,10,168.020162419494,NA,"role_play","TALIESIN",1,0,0,0
"626","Vestiges",5,61,626,"first_half_rp","MARISHA","wait, hang on. how about this, you guys... i believe, as an elemental, i'm immune to charm effects.",3335.427,3357.015,21.5879999999997,20,55.5864369093948,NA,"role_play","MARISHA",1,0,0,0
