"","arc","arc_no","episode","turn_number","segment","actor","text","start_turn","end_turn","time_in_sec","word_count","words_per_minute","encounter_count","rp_combat","actor_guest","vox_machina","guest","staff","matt"
"1","Vestiges",5,61,1,"prologue","MATT","welcome, everyone, to tonight's episode of critical role, where a bunch of us nerdy-ass voice actors sit around, roll dice, and play dungeons and dragons. we are back after a week hiatus in which we were at san diego comic-con!",0,14.214,14.214,44,185.732376530182,NA,"role_play","MATT",0,0,0,1
"2","Vestiges",5,61,2,"prologue","MATT","we are recovering, some more than others, from comic-con. but we had a great time. fantastic turnout. it was great to meet all those wonderful critters that got out there, you guys were awesome. the panels were sufficiently ridiculous. and yeah, it was a good time had by all. if you weren't there, i know geek and sundry put up the panels, the videos from the panels up on the website, geekandsundry.com, so you can check them out there. speaking of cool events, we're actually going to be at gencon next week.",14.214,45.121,30.907,97,188.306856052027,NA,"role_play","MATT",0,0,0,1
"3","Vestiges",5,61,3,"prologue","SAM","what?",45.121,46.349,1.22799999999999,2,97.7198697068408,NA,"role_play","SAM",1,0,0,0
"4","Vestiges",5,61,4,"prologue","MATT","i know, it's crazy! i am at a series of panels all throughout the weekend, many of them voiceover-related.",46.349,53.831,7.48200000000001,22,176.423416198877,NA,"role_play","MATT",0,0,0,1
"5","Vestiges",5,61,5,"prologue","LAURA","because you're special.",53.831,55.946,2.11499999999999,5,141.843971631206,NA,"role_play","LAURA",1,0,0,0
"6","Vestiges",5,61,6,"prologue","MATT","because my manager got to them first.",55.946,61.772,5.826,8,82.389289392379,NA,"role_play","MATT",0,0,0,1
"7","Vestiges",5,61,7,"prologue","MATT","we're going to have signings i believe on friday, or is it friday or saturday?",61.772,66.172,4.4,17,231.818181818182,NA,"role_play","MATT",0,0,0,1
"8","Vestiges",5,61,8,"prologue","LAURA","saturday.",66.172,67.111,0.939000000000007,2,127.795527156549,NA,"role_play","LAURA",1,0,0,0
"9","Vestiges",5,61,9,"prologue","MATT","saturday, we'll have signings",67.111,68.817,1.70599999999999,5,175.849941383354,NA,"role_play","MATT",0,0,0,1
"10","Vestiges",5,61,10,"prologue","MARISHA","in which we have a new poster.",68.817,71.256,2.43900000000001,8,196.80196801968,NA,"role_play","MARISHA",1,0,0,0
"11","Vestiges",5,61,11,"prologue","LAURA","it is exclusive to gencon, the same way we did our exclusive for new york comic-con poster last year.",71.256,80.324,9.068,21,138.95015438906,NA,"role_play","LAURA",1,0,0,0
"12","Vestiges",5,61,12,"prologue","MARISHA","also designed by joma, aka @forgingmeanings on twitter. so yeah, it's our next iteration of our box art poster.",80.324,91.609,11.285,21,111.6526362428,NA,"role_play","MARISHA",1,0,0,0
"13","Vestiges",5,61,13,"prologue","TRAVIS","whoa! it is sexy!",91.609,93.512,1.90300000000001,5,157.645822385706,NA,"role_play","TRAVIS",1,0,0,0
"14","Vestiges",5,61,14,"prologue","MARISHA","the advanced edition, y'all.",93.512,95.583,2.071,6,173.829068083052,NA,"role_play","MARISHA",1,0,0,0
"15","Vestiges",5,61,15,"prologue","MATT","yeah. i will say that the last poster was based heavily on the underdark arc and the coming battle with k'varn. this one has to do with a later arc in the story. so there's that coming up, we're excited about that, and then we have our critical role live show that saturday at 8pm eastern time.",95.583,113.668,18.085,61,202.377661045065,NA,"role_play","MATT",0,0,0,1
"16","Vestiges",5,61,16,"prologue","SAM","tickets are still available online, post the link right now in the chat, someone, please.",113.668,123.021,9.35299999999999,16,102.640863893938,NA,"role_play","SAM",1,0,0,0
"17","Vestiges",5,61,17,"prologue","TRAVIS","that's going to be some insane audience.",123.021,124.534,1.51300000000001,9,356.906807666886,NA,"role_play","TRAVIS",1,0,0,0
"18","Vestiges",5,61,18,"prologue","MATT","we'd love to see you guys. partially because we don't get out to the middle eastern side of the us as often as we'd like, and this is our first time at gencon, which has been my gaming mecca for so long. should be a fun way to roll it in. so come check in the next chapter that'll continue after tonight's episode, at gencon, and hope to see you there. we have our sponsor tonight for this episode of critical role, returning favorite in backblaze, who previously popped in to say hello. sam, if you want to say a few words.",124.534,156.037,31.503,108,205.694695743263,NA,"role_play","MATT",0,0,0,1
"19","Vestiges",5,61,19,"prologue","SAM","backblaze is back, everybody. i've already composed a song about it. it goes like this: everybody, yeah. backup your data, yeah. upload your local files to an encrypted cloud-based backup storage system, yeah. backblaze back, all right! that was good!",156.037,182.861,26.824,43,96.1825231136296,NA,"role_play","SAM",1,0,0,0
"20","Vestiges",5,61,20,"prologue","MATT","that was a thing that happened.",182.861,187.55,4.68900000000002,7,89.5713371721045,NA,"role_play","MATT",0,0,0,1
"21","Vestiges",5,61,21,"prologue","SAM","backblaze is unlimited cloud backup for macs, pcs, for just $5 a month. you can back up your fanart there, your fanfiction, the dirty stuff, photos, videos, drawings, documents, it's everything. i actually use this service. my stuff is continually uploading to the cloud and i always know it's there for when my hard drive crashes, they'll send you a new one in the mail",187.55,213.93,26.38,68,154.662623199393,NA,"role_play","SAM",1,0,0,0
"22","Vestiges",5,61,22,"prologue","TRAVIS","they'll mail you one?",213.93,215.223,1.29300000000001,6,278.422273781901,NA,"role_play","TRAVIS",1,0,0,0
"23","Vestiges",5,61,23,"prologue","SAM","they can mail you one. it's all kinds of crazy options.",215.223,217.718,2.49499999999998,13,312.625250501005,NA,"role_play","SAM",1,0,0,0
"24","Vestiges",5,61,24,"prologue","LIAM","think of the gigs of erotica that could just exist out there.",217.718,221.314,3.596,13,216.907675194661,NA,"role_play","LIAM",1,0,0,0
"25","Vestiges",5,61,25,"prologue","SAM","and critters get a fully-featured 15-day free trial at backblaze.com/criticalrole. so go check it out, keep that song in the back of your mind when you do.",221.314,234.571,13.257,32,144.829146865807,NA,"role_play","SAM",1,0,0,0
"26","Vestiges",5,61,26,"prologue","SAM","and they also made a little commercial for us.",234.571,236.354,1.78300000000002,10,336.511497476161,NA,"role_play","SAM",1,0,0,0
"27","Vestiges",5,61,27,"prologue","LAURA","oh yeah, i just love them so much.",236.354,238.876,2.52199999999999,9,214.115781126091,NA,"role_play","LAURA",1,0,0,0
"28","Vestiges",5,61,28,"prologue","MARISHA","i know, it's so great.",238.876,240.41,1.53399999999999,7,273.794002607563,NA,"role_play","MARISHA",1,0,0,0
"29","Vestiges",5,61,29,"prologue","MATT","well cool, thank you very much, sam.",240.41,242.382,1.97200000000001,8,243.407707910749,NA,"role_play","MATT",0,0,0,1
"30","Vestiges",5,61,30,"prologue","SAM","do you want to hear the song again?",242.382,245.674,3.292,9,164.034021871203,NA,"role_play","SAM",1,0,0,0
"31","Vestiges",5,61,31,"prologue","TRAVIS","can we please? i'll give you some of my beef and broccoli.",245.674,248.036,2.36199999999999,14,355.63082133785,NA,"role_play","TRAVIS",1,0,0,0
"32","Vestiges",5,61,32,"prologue","LAURA","it smells really good.",248.036,250.72,2.684,5,111.77347242921,NA,"role_play","LAURA",1,0,0,0
"33","Vestiges",5,61,33,"prologue","MATT","next item: for anyone who wants any of the information about our gencon panels events and signings and such, you can go to geekandsundry.com/crlivegencon16.",250.72,263.003,12.283,27,131.889603517056,NA,"role_play","MATT",0,0,0,1
"34","Vestiges",5,61,34,"prologue","LAURA","that's long. it should be in the chat room.",263.003,265.07,2.06700000000001,11,319.303338171262,NA,"role_play","LAURA",1,0,0,0
"35","Vestiges",5,61,35,"prologue","MATT","should be in the chat room, check it out, definitely go there. and tonight is the last night for you guys to pre-order the critter-designed t-shirt, the chroma conclave shirt that you guys voted for that won our design contest.",265.07,281.552,16.482,44,160.174736075719,NA,"role_play","MATT",0,0,0,1
"36","Vestiges",5,61,36,"prologue","SAM","twice. it won it twice.",281.552,283.414,1.86199999999997,6,193.340494092377,NA,"role_play","SAM",1,0,0,0
"37","Vestiges",5,61,37,"prologue","LAURA","it's beautiful.",283.414,285.019,1.60500000000002,4,149.532710280372,NA,"role_play","LAURA",1,0,0,0
"38","Vestiges",5,61,38,"prologue","MATT","so if you're interested in grabbing that, tonight's your last night, and you should just do it now. soon. do we have anything else we wish to announce, anything else creeping up?",285.019,294.773,9.75400000000002,35,215.296288702071,NA,"role_play","MATT",0,0,0,1
"39","Vestiges",5,61,39,"prologue","LAURA","travis and i are seeing hamilton this weekend. what?",294.773,299.764,4.99099999999999,10,120.216389501102,NA,"role_play","LAURA",1,0,0,0
"40","Vestiges",5,61,40,"prologue","TRAVIS","it is an announcement. we're seeing hamilton on saturday.",299.764,304.344,4.57999999999998,11,144.10480349345,NA,"role_play","TRAVIS",1,0,0,0
"41","Vestiges",5,61,41,"prologue","LIAM","is there any other shitty bragging anyone else would like to do?",304.344,307.178,2.834,13,275.229357798165,NA,"role_play","LIAM",1,0,0,0
"42","Vestiges",5,61,42,"prologue","TRAVIS","javier muńoz and i are going to be best friends, and then i'm going to go to dinner with george washington. i'm going to shave his head. it's going to be awesome.",307.178,314.004,6.82600000000002,36,316.43715206563,NA,"role_play","TRAVIS",1,0,0,0
"43","Vestiges",5,61,43,"prologue","MATT","you have this all planned out.",314.004,316.055,2.05099999999999,7,204.778156996588,NA,"role_play","MATT",0,0,0,1
"44","Vestiges",5,61,44,"prologue","LAURA","yeah, we really do. he's written some fanfiction about it. you just wait.",316.055,320.475,4.42000000000002,15,203.619909502262,NA,"role_play","LAURA",1,0,0,0
"45","Vestiges",5,61,45,"prologue","MATT","which you can save on your backblaze account.",320.475,324.131,3.65599999999995,9,147.70240700219,NA,"role_play","MATT",0,0,0,1
"46","Vestiges",5,61,46,"prologue","TRAVIS","it's there!",324.131,325.436,1.30500000000001,4,183.908045977011,NA,"role_play","TRAVIS",1,0,0,0
"47","Vestiges",5,61,47,"prologue","MATT","indeed. all right then, that being the case, let us dive into the insanity of the feywild in tonight's episode of critical role. [dramatic music]",325.436,424.179,98.743,27,16.4062262641402,NA,"role_play","MATT",0,0,0,1
"48","Vestiges",5,61,48,"prologue","MATT","welcome back, everybody. so. getting us into the story for this evening, the backstory of the current episode. vox machina, in attempting to find ways to topple and destroy the chroma conclave, have found their way around the world seeking items called the vestiges of divergence, artifacts of great power that should aid them in their attempt to take down thordak the cinder king, the red dragon who now sits lording over the central town of emon at the center of tal'dorei. their recent journey has brought them into the feywild, a pseudo-parallel plane of fey magic, chaos, and all sorts of goodness in between. they've wandered through, met an old friend in nala, the nymph of the lake. discovered a fantastically artistically talented satyr by the name of garmelie, and had a trip to the city of syngorn, the elven city from tal'dorei which had phased into this realm for safety when the dragons of the conclave attacked. after a fateful re-meeting with the parents of vex and vax, discussions were had, hats were attempted to be stolen by the leader of the city and successfully done so. the other half of agreements were pseudo-achieved.",424.179,508.802,84.623,203,143.932500620399,NA,"role_play","MATT",0,0,0,1
"49","Vestiges",5,61,49,"first_half_rp","TALIESIN","read your contract.",508.802,510.591,1.78899999999999,4,134.153158188933,NA,"role_play","TALIESIN",1,0,0,0
"50","Vestiges",5,61,50,"first_half_rp","MATT","and they made their way northward through the ever-shifting grasses to the outskirts of the moonbrush, a heavy, heavy, forested wood that will lead them to their destination after that, which is the gilded run, a series of rivers that wrap around their final destination, the shademirk bog, where apparently this vestige exists. so. diving in where we were. the last time, you guys had managed to wander a few hours into the southern portion of the forest of the moonbrush. coming through, you realize that, as opposed to the rest of the feywild you've encountered so far, which exists in a perpetual dusk, there is an actual starry sky and moonlight poking through of a full moon at portions of the canopy of this forest. cruising ever forward, you stumbled upon what looked like some sort of a cave or cavern with a series of small stone and wooden trinkets and gifts that were left outside, as well as carved bones and rotting fruits, and you came to realize that these were probably left for the spiritual entity that lived and existed within this cavern. upon some of these gifts being disturbed, the bear attacked, and vex'ahlia summoned forth trinket, her faithful companion bear. a battle took place, putting trinket in a difficult position, but upon a brief discussion with this spirit bear, had proven himself a worthy entity, and was bestowed a boon, further solidifying the bond between vex'ahlia and her faithful companion, trinket. and that was where we left off.",510.591,614.401,103.81,258,149.118582024853,NA,"role_play","MATT",0,0,0,1
"51","Vestiges",5,61,51,"first_half_rp","SAM","didn't you just get some card or something right at the end of",614.401,617.528,3.12700000000007,14,268.628078030055,NA,"role_play","SAM",1,0,0,0
"52","Vestiges",5,61,52,"first_half_rp","LAURA","yeah, i did.",617.528,619.028,1.5,4,160,NA,"role_play","LAURA",1,0,0,0
"53","Vestiges",5,61,53,"first_half_rp","SAM","did we know what it was?",619.028,620.443,1.41499999999996,7,296.819787985873,NA,"role_play","SAM",1,0,0,0
"54","Vestiges",5,61,54,"first_half_rp","LAURA","yeah, i did.",620.443,621.935,1.49199999999996,4,160.857908847189,NA,"role_play","LAURA",1,0,0,0
"55","Vestiges",5,61,55,"first_half_rp","TALIESIN","it was a free $50 coupon for lyft.",621.935,623.939,2.00400000000002,9,269.461077844309,NA,"role_play","TALIESIN",1,0,0,0
"56","Vestiges",5,61,56,"first_half_rp","LAURA","what i'm really excited about is that card was at the live show, and it is not in my stuff right now, but i did.",623.939,632.598,8.65899999999999,27,187.088578357778,NA,"role_play","LAURA",1,0,0,0
"57","Vestiges",5,61,57,"first_half_rp","MATT","she reaches for the necklace around her neck, which is suddenly not there.",632.598,634.958,2.36000000000001,14,355.932203389828,NA,"role_play","MATT",0,0,0,1
"58","Vestiges",5,61,58,"first_half_rp","LAURA","no! i do, however, still have my title.",634.958,639.296,4.33800000000008,9,124.481327800828,NA,"role_play","LAURA",1,0,0,0
"59","Vestiges",5,61,59,"first_half_rp","TRAVIS","you guys are still by yourselves, right? you two?",639.296,644.431,5.13499999999999,10,116.84518013632,NA,"role_play","TRAVIS",1,0,0,0
"60","Vestiges",5,61,60,"first_half_rp","MARISHA","are vex and i still separated?",644.431,646.558,2.12699999999995,7,197.461212976027,NA,"role_play","MARISHA",1,0,0,0
"61","Vestiges",5,61,61,"first_half_rp","MATT","no, the trees have relaxed, the canopy has reopened above the small clearing, and the rest of the party, you can now see vex on her back on the ground, trinket standing over her towards the cavern, and keyleth pulled back, looking a bit shocked and confused.",646.558,665.515,18.957,48,151.9227725906,NA,"role_play","MATT",0,0,0,1
"62","Vestiges",5,61,62,"first_half_rp","MARISHA","and is oralan still there? is that his name?",665.515,668.946,3.43100000000004,10,174.876129408334,NA,"role_play","MARISHA",1,0,0,0
"63","Vestiges",5,61,63,"first_half_rp","MATT","the bear spirit? the bear spirit, upon passing through vex and trinket, then dissipated into a spark of naturalized druidic magic and vanished.",668.946,679.751,10.8049999999999,24,133.271633503008,NA,"role_play","MATT",0,0,0,1
"64","Vestiges",5,61,64,"first_half_rp","MARISHA","so we're alone?",679.751,681.394,1.64300000000003,5,182.592818015821,NA,"role_play","MARISHA",1,0,0,0
"65","Vestiges",5,61,65,"first_half_rp","MATT","you are now alone in the center of that clearing.",681.394,685.444,4.04999999999995,11,162.962962962965,NA,"role_play","MATT",0,0,0,1
"66","Vestiges",5,61,66,"first_half_rp","SAM","oh my gods, what just happened?",685.444,691.028,5.58400000000006,7,75.2148997134662,NA,"role_play","SAM",1,0,0,0
"67","Vestiges",5,61,67,"first_half_rp","LAURA","everything's under control. we're alive.",691.028,695.708,4.67999999999995,8,102.564102564104,NA,"role_play","LAURA",1,0,0,0
"68","Vestiges",5,61,68,"first_half_rp","SAM","i heard growling. did the bear try to kill you? i mean trinket.",695.708,700.266,4.55799999999999,14,184.291355857833,NA,"role_play","SAM",1,0,0,0
"69","Vestiges",5,61,69,"first_half_rp","LAURA","no, yeah, trinket tried to kill me, but don't worry, everything's fine.",700.266,703.946,3.68000000000006,15,244.5652173913,NA,"role_play","LAURA",1,0,0,0
"70","Vestiges",5,61,70,"first_half_rp","MARISHA","really glad you learned how to speak with animals.",703.946,706.734,2.78800000000001,10,215.208034433285,NA,"role_play","MARISHA",1,0,0,0
"71","Vestiges",5,61,71,"first_half_rp","LAURA","me too! keyleth, can you open up the trees so our friends can get in?",706.734,711.03,4.29599999999994,16,223.463687150841,NA,"role_play","LAURA",1,0,0,0
"72","Vestiges",5,61,72,"first_half_rp","MARISHA","who? our what? who?",711.03,713.284,2.25400000000002,5,133.096716947648,NA,"role_play","MARISHA",1,0,0,0
"73","Vestiges",5,61,73,"first_half_rp","LAURA","aren't we blocked off?",713.284,714.567,1.28300000000002,6,280.592361652374,NA,"role_play","LAURA",1,0,0,0
"74","Vestiges",5,61,74,"first_half_rp","MATT","the trees have laxed and reopened.",714.567,716.603,2.03599999999994,7,206.286836935173,NA,"role_play","MATT",0,0,0,1
"75","Vestiges",5,61,75,"first_half_rp","LAURA","i was busy looking for my card. and i found it. hi guys, my name is vex'ahlia. cool, yes, we're good. can i search for that tea set that i tried to give him?",716.603,731.972,15.369,37,144.446613312512,NA,"role_play","LAURA",1,0,0,0
"76","Vestiges",5,61,76,"first_half_rp","SAM","tea set? what just happened?",731.972,733.647,1.67500000000007,6,214.92537313432,NA,"role_play","SAM",1,0,0,0
"77","Vestiges",5,61,77,"first_half_rp","MATT","make an investigation check.",733.647,735.191,1.54399999999998,5,194.300518134717,NA,"role_play","MATT",0,0,0,1
"78","Vestiges",5,61,78,"first_half_rp","LAURA","cool. balls. off to a good start.",735.191,741.263,6.072,8,79.0513833992095,NA,"role_play","LAURA",1,0,0,0
"79","Vestiges",5,61,79,"first_half_rp","TALIESIN","i'd like to take a look in the cave as well a little bit.",741.263,743.415,2.15199999999993,16,446.096654275107,NA,"role_play","TALIESIN",1,0,0,0
"80","Vestiges",5,61,80,"first_half_rp","MATT","okay.",743.415,746.899,3.48400000000004,2,34.4431687715266,NA,"role_play","MATT",0,0,0,1
"81","Vestiges",5,61,81,"first_half_rp","LAURA","ten.",746.899,748.369,1.47000000000003,2,81.632653061223,NA,"role_play","LAURA",1,0,0,0
"82","Vestiges",5,61,82,"first_half_rp","MATT","okay, yeah, it takes you a little bit, about ten minutes or so. parts of it got scattered and lost amongst the rest of the objects left around, but you manage to reassemble your collection of tea accessories.",748.369,760.24,11.871,39,197.119029567855,NA,"role_play","MATT",0,0,0,1
"83","Vestiges",5,61,83,"first_half_rp","LAURA","yeah, cool, it was a golden cursed tea set.",760.24,763.234,2.99400000000003,10,200.400801603205,NA,"role_play","LAURA",1,0,0,0
"84","Vestiges",5,61,84,"first_half_rp","TRAVIS","nobody else is concerned about the commotion that happened behind the trees, and we're all just like ""hi."" what happened?",763.234,769.095,5.86099999999999,22,225.217539668999,NA,"role_play","TRAVIS",1,0,0,0
"85","Vestiges",5,61,85,"first_half_rp","LAURA","there was a big fucking bear. you might actually not want to look in that cave, because it came out of there and it was rather angry when it did.",769.095,776.756,7.66099999999994,31,242.788147761391,NA,"role_play","LAURA",1,0,0,0
"86","Vestiges",5,61,86,"first_half_rp","LIAM","what it? what came out?",776.756,778.47,1.71400000000006,6,210.035005834299,NA,"role_play","LIAM",1,0,0,0
"87","Vestiges",5,61,87,"first_half_rp","LAURA","a guardian spirit of the forest.",778.47,780.533,2.06299999999999,7,203.58700920989,NA,"role_play","LAURA",1,0,0,0
"88","Vestiges",5,61,88,"first_half_rp","TALIESIN","just observing the entrance to see if there's anything written, any type of language on any of the entrances or otherwise.",780.533,786.458,5.92499999999995,23,232.911392405065,NA,"role_play","TALIESIN",1,0,0,0
"89","Vestiges",5,61,89,"first_half_rp","MATT","make an investigation check.",786.458,788.641,2.18299999999999,5,137.425561154375,NA,"role_play","MATT",0,0,0,1
"90","Vestiges",5,61,90,"first_half_rp","MARISHA","as a druid would i know about guardian animal spirits?",788.641,793.748,5.10700000000008,11,129.234384178576,NA,"role_play","MARISHA",1,0,0,0
"91","Vestiges",5,61,91,"first_half_rp","LAURA","yeah, would we have heard anything about this in our studies?",793.748,796.307,2.55899999999997,12,281.359906213368,NA,"role_play","LAURA",1,0,0,0
"92","Vestiges",5,61,92,"first_half_rp","MATT","in your studies? no. you, make a history check.",796.307,801.631,5.32399999999996,10,112.697220135238,NA,"role_play","MATT",0,0,0,1
"93","Vestiges",5,61,93,"first_half_rp","MARISHA","that's not my strong suit, man.",801.631,804.453,2.822,8,170.092133238838,NA,"role_play","MARISHA",1,0,0,0
"94","Vestiges",5,61,94,"first_half_rp","MATT","we'll go with nature.",804.453,806.393,1.94000000000005,6,185.567010309273,NA,"role_play","MATT",0,0,0,1
"95","Vestiges",5,61,95,"first_half_rp","MARISHA","oh that's better, okay. 23.",806.393,808.634,2.24099999999999,7,187.416331994646,NA,"role_play","MARISHA",1,0,0,0
"96","Vestiges",5,61,96,"first_half_rp","TALIESIN","21.",808.634,810.42,1.78599999999994,2,67.1892497200469,NA,"role_play","TALIESIN",1,0,0,0
"97","Vestiges",5,61,97,"first_half_rp","MATT","there are no markings that currently are visible around the entrance or exit of the cavern itself. it is carved, however, meaning that this cavern, whether it be natural or not, this entrance has been touched by humanoid hands and has been refined. you, keyleth, do know that occasionally on the material plane there are entities, spiritual energies, that gather based on worshipping specific fey spirits and these creatures over time, these spiritual energies, begin to take the form that their worshipers give them. it takes a long time for this transition to happen, and essentially these guardian spirits, usually guarding some sort of a powerful fane, or a magical core or center, they become protector spirits of that region.",810.42,871.418,60.998,121,119.020295747401,NA,"role_play","MATT",0,0,0,1
"98","Vestiges",5,61,98,"first_half_rp","MARISHA","so because people just manifested the god as a bear, it slowly turned into a bear?",871.418,877.408,5.99000000000001,17,170.283806343906,NA,"role_play","MARISHA",1,0,0,0
"99","Vestiges",5,61,99,"first_half_rp","MATT","it turned into a bear. and they're not gods per se, but they're powerful entities that guard that element.",877.408,883.9,6.49199999999996,22,203.327171903883,NA,"role_play","MATT",0,0,0,1
"100","Vestiges",5,61,100,"first_half_rp","MARISHA","spirit guardians. okay.",883.9,885.677,1.77700000000004,4,135.05908835115,NA,"role_play","MARISHA",1,0,0,0
"101","Vestiges",5,61,101,"first_half_rp","TRAVIS","what's in the cave?",885.677,888.017,2.34000000000003,6,153.846153846152,NA,"role_play","TRAVIS",1,0,0,0
"102","Vestiges",5,61,102,"first_half_rp","LAURA","what's in the cave, keyleth?",888.017,891.209,3.19199999999989,7,131.578947368425,NA,"role_play","LAURA",1,0,0,0
"103","Vestiges",5,61,103,"first_half_rp","MARISHA","nothing now, i don't think.",891.209,893.704,2.495,7,168.336673346693,NA,"role_play","MARISHA",1,0,0,0
"104","Vestiges",5,61,104,"first_half_rp","LAURA","there was a spirit bear in there.",893.704,895.9,2.19600000000003,8,218.579234972675,NA,"role_play","LAURA",1,0,0,0
"105","Vestiges",5,61,105,"first_half_rp","LIAM","it was a bear?",895.9,897.705,1.80500000000006,5,166.204986149579,NA,"role_play","LIAM",1,0,0,0
"106","Vestiges",5,61,106,"first_half_rp","LAURA","it was a big fucking bear, yeah.",897.705,899.255,1.54999999999995,8,309.677419354848,NA,"role_play","LAURA",1,0,0,0
"107","Vestiges",5,61,107,"first_half_rp","MARISHA","it was made out of stars and space stuff.",899.255,903.598,4.34299999999996,10,138.153350218744,NA,"role_play","MARISHA",1,0,0,0
"108","Vestiges",5,61,108,"first_half_rp","TRAVIS","are you sure you haven't been eating mushrooms or something?",903.598,905.597,1.99900000000002,12,360.180090045018,NA,"role_play","TRAVIS",1,0,0,0
"109","Vestiges",5,61,109,"first_half_rp","LAURA","trinket popped out and he saved us. <i>trinket</i> fucking saved us, scanlan!",905.597,911.672,6.07500000000005,15,148.148148148147,NA,"role_play","LAURA",1,0,0,0
"110","Vestiges",5,61,110,"first_half_rp","SAM","pics or it didn't happen.",911.672,915.5,3.82799999999997,7,109.717868338559,NA,"role_play","SAM",1,0,0,0
"111","Vestiges",5,61,111,"first_half_rp","TRAVIS","that's exactly what i was thinking.",915.5,917.852,2.35199999999998,8,204.081632653063,NA,"role_play","TRAVIS",1,0,0,0
