"","arc","arc_no","episode","turn_number","segment","actor","text","start_turn","end_turn","time_in_sec","word_count","words_per_minute","encounter_count","rp_combat","actor_guest","vox_machina","guest","staff","matt"
"1107","Vestiges",5,61,1107,"second_half_rp","LIAM","just to give us a day's head start.",7392.689,7395.886,3.19700000000012,10,187.675946199555,NA,"role_play","LIAM",1,0,0,0
"1108","Vestiges",5,61,1108,"second_half_rp","SAM","what we could do, grog and i could run back, i could cut him over the eye, and say: it was horrible. it was quite a fight, but we won.",7395.886,7406.932,11.0459999999994,31,168.386746333524,NA,"role_play","SAM",1,0,0,0
"1109","Vestiges",5,61,1109,"second_half_rp","LAURA","do we need to let the pixies know that we're going to do this?",7406.932,7411.504,4.57200000000012,16,209.973753280835,NA,"role_play","LAURA",1,0,0,0
"1110","Vestiges",5,61,1110,"second_half_rp","MARISHA","maybe scanlan, do you have something that could i don't want to waste a spell and then find out that they have some sort of magical barrier enchantment that it can't stay up there.",7411.504,7424.506,13.0020000000004,37,170.74296262113,NA,"role_play","MARISHA",1,0,0,0
"1111","Vestiges",5,61,1111,"second_half_rp","TRAVIS","what, you'd waste hallucinatory terrain?",7424.506,7427.135,2.62899999999991,7,159.756561430207,NA,"role_play","TRAVIS",1,0,0,0
"1112","Vestiges",5,61,1112,"second_half_rp","MARISHA","yeah.",7427.135,7428.464,1.32899999999972,2,90.2934537246237,NA,"role_play","MARISHA",1,0,0,0
"1113","Vestiges",5,61,1113,"second_half_rp","TRAVIS","when else are you going to use that?",7428.464,7430.01,1.54600000000028,9,349.288486416496,NA,"role_play","TRAVIS",1,0,0,0
"1114","Vestiges",5,61,1114,"second_half_rp","MARISHA","well, i'm burning a spell slot.",7430.01,7432.588,2.57799999999952,8,186.190845616792,NA,"role_play","MARISHA",1,0,0,0
"1115","Vestiges",5,61,1115,"second_half_rp","SAM","if they block it with their magical little crystals all over the place, then they'll also know we're here and they will attack us.",7432.588,7441.068,8.48000000000047,27,191.037735849046,NA,"role_play","SAM",1,0,0,0
"1116","Vestiges",5,61,1116,"second_half_rp","MARISHA","yes, 24 hours for a 150-foot cube, i make a terrain look, sound, and smell like some sort of other terrain.",7441.068,7452.136,11.0680000000002,23,124.68377303939,NA,"role_play","MARISHA",1,0,0,0
"1117","Vestiges",5,61,1117,"second_half_rp","LAURA","i'm just worried that if you do it then the lycans are going to bust it, and then they just go to battle amongst themselves.",7452.136,7457.533,5.39699999999993,27,300.166759310732,NA,"role_play","LAURA",1,0,0,0
"1118","Vestiges",5,61,1118,"second_half_rp","TALIESIN","isn't that brilliant?",7457.533,7458.888,1.35499999999956,5,221.402214022212,NA,"role_play","TALIESIN",1,0,0,0
"1119","Vestiges",5,61,1119,"second_half_rp","LAURA","this is actually really smart.",7458.888,7460.321,1.43299999999999,6,251.22121423587,NA,"role_play","LAURA",1,0,0,0
"1120","Vestiges",5,61,1120,"second_half_rp","SAM","wait, can you still tree-bamf us out of harm's way if we needed to?",7460.321,7465.314,4.99300000000039,17,204.286000400545,NA,"role_play","SAM",1,0,0,0
"1121","Vestiges",5,61,1121,"second_half_rp","LAURA","you've got the mansion.",7465.314,7467.774,2.46000000000004,6,146.341463414632,NA,"role_play","LAURA",1,0,0,0
"1122","Vestiges",5,61,1122,"second_half_rp","SAM","i don't have the mansion.",7467.774,7469.521,1.74699999999939,7,240.412135088808,NA,"role_play","SAM",1,0,0,0
"1123","Vestiges",5,61,1123,"second_half_rp","TALIESIN","he's already burned the mansion.",7469.521,7471.831,2.3100000000004,7,181.81818181815,NA,"role_play","TALIESIN",1,0,0,0
"1124","Vestiges",5,61,1124,"second_half_rp","SAM","i haven't slept in days.",7471.831,7473.5,1.66899999999987,7,251.647693229498,NA,"role_play","SAM",1,0,0,0
"1125","Vestiges",5,61,1125,"second_half_rp","MARISHA","the only thing i have that can get us out fast is plane shift, which will get us out of the feywild, but i brought that just in case.",7473.5,7485.304,11.8040000000001,30,152.490681125041,NA,"role_play","MARISHA",1,0,0,0
"1126","Vestiges",5,61,1126,"second_half_rp","TRAVIS","third option, we say fuck the lycans, fuck the pixies, and we just keep going.",7485.304,7490.923,5.61899999999969,16,170.848905499209,NA,"role_play","TRAVIS",1,0,0,0
"1127","Vestiges",5,61,1127,"second_half_rp","LAURA","what if you do the hallucinatory terrain, and we just leave?",7490.923,7495.508,4.58500000000004,12,157.033805888766,NA,"role_play","LAURA",1,0,0,0
"1128","Vestiges",5,61,1128,"second_half_rp","MARISHA","yeah, we could do the hallucinatory terrain, and if it fails, then i guess we won't be in any worse situation.",7495.508,7500.635,5.12700000000041,23,269.163253364519,NA,"role_play","MARISHA",1,0,0,0
"1129","Vestiges",5,61,1129,"second_half_rp","TALIESIN","i'm a big fan of hallucinatory terrain.",7500.635,7502.671,2.03600000000006,9,265.22593320235,NA,"role_play","TALIESIN",1,0,0,0
"1130","Vestiges",5,61,1130,"second_half_rp","SAM","if we do hallucinatory terrain and it fails, the pixies will straight-up attack us.",7502.671,7507.185,4.51400000000012,16,212.671688081518,NA,"role_play","SAM",1,0,0,0
"1131","Vestiges",5,61,1131,"second_half_rp","LAURA","how do you know?",7507.185,7508.651,1.46599999999944,5,204.63847203282,NA,"role_play","LAURA",1,0,0,0
"1132","Vestiges",5,61,1132,"second_half_rp","MARISHA","well, it won't hurt them. it just makes it look different.",7508.651,7511.058,2.40700000000015,13,324.054840049834,NA,"role_play","MARISHA",1,0,0,0
"1133","Vestiges",5,61,1133,"second_half_rp","SAM","everything here has attacked us.",7511.058,7513.194,2.13600000000042,6,168.539325842663,NA,"role_play","SAM",1,0,0,0
"1134","Vestiges",5,61,1134,"second_half_rp","TRAVIS","all in favor of hallucinatory terrain, raise your hand.",7513.194,7518.586,5.39199999999983,10,111.275964391695,NA,"role_play","TRAVIS",1,0,0,0
"1135","Vestiges",5,61,1135,"second_half_rp","SAM","we have to get the animal men here to see it, or else it isn't worth it.",7518.586,7525.814,7.22800000000007,19,157.719977863861,NA,"role_play","SAM",1,0,0,0
"1136","Vestiges",5,61,1136,"second_half_rp","LAURA","we cast it and we create a ruckus",7525.814,7529.021,3.20699999999943,8,149.672591206762,NA,"role_play","LAURA",1,0,0,0
"1137","Vestiges",5,61,1137,"second_half_rp","SAM","i will buy into this idea if we have a plan for when the pixies are about to literally attack us five minutes from now.",7529.021,7536.73,7.70899999999983,26,202.360876897138,NA,"role_play","SAM",1,0,0,0
"1138","Vestiges",5,61,1138,"second_half_rp","MARISHA","well, we can do hallucinatory terrain, and if we run into the lycans, all we have to do is say we did it.",7536.73,7543.489,6.75900000000001,24,213.049267643142,NA,"role_play","MARISHA",1,0,0,0
"1139","Vestiges",5,61,1139,"second_half_rp","LAURA","do hallucinatory terrain. garmelie, which direction should we run if we're running towards where we're supposed to be going?",7543.489,7552.258,8.76900000000023,22,150.530277112552,NA,"role_play","LAURA",1,0,0,0
"1140","Vestiges",5,61,1140,"second_half_rp","MATT","garmelie has watched this thing with eyes wide, and he's like, ""that way.""",7552.258,7561.148,8.89000000000033,15,101.23734533183,NA,"role_play","MATT",0,0,0,1
"1141","Vestiges",5,61,1141,"second_half_rp","LAURA","all right.",7561.148,7562.337,1.18900000000031,3,151.387720773721,NA,"role_play","LAURA",1,0,0,0
"1142","Vestiges",5,61,1142,"second_half_rp","TRAVIS","weren't you dropping little green rocks?",7562.337,7564.73,2.39299999999912,8,200.585039699196,NA,"role_play","TRAVIS",1,0,0,0
"1143","Vestiges",5,61,1143,"second_half_rp","MARISHA","i was dropping little green rocks.",7564.73,7567.192,2.46200000000044,7,170.59301380988,NA,"role_play","MARISHA",1,0,0,0
"1144","Vestiges",5,61,1144,"second_half_rp","TRAVIS","so we can find our way back to the lycans, right?",7567.192,7569.1,1.90800000000036,12,377.358490565967,NA,"role_play","TRAVIS",1,0,0,0
"1145","Vestiges",5,61,1145,"second_half_rp","MARISHA","yeah.",7569.1,7570.627,1.52700000000004,2,78.5854616895852,NA,"role_play","MARISHA",1,0,0,0
"1146","Vestiges",5,61,1146,"second_half_rp","TALIESIN","that's of course assuming that the little green rocks work here.",7570.627,7574.08,3.45299999999952,13,225.890529973967,NA,"role_play","TALIESIN",1,0,0,0
"1147","Vestiges",5,61,1147,"second_half_rp","MARISHA","they were red. they were red rocks.",7574.08,7576.314,2.23400000000038,8,214.861235452067,NA,"role_play","MARISHA",1,0,0,0
"1148","Vestiges",5,61,1148,"second_half_rp","TALIESIN","there's an awful lot of reasons why the little red rocks wouldn't work.",7576.314,7579.944,3.63000000000011,16,264.462809917347,NA,"role_play","TALIESIN",1,0,0,0
"1149","Vestiges",5,61,1149,"second_half_rp","TRAVIS","okay. let's do it.",7579.944,7582.034,2.08999999999924,6,172.248803827814,NA,"role_play","TRAVIS",1,0,0,0
"1150","Vestiges",5,61,1150,"second_half_rp","LAURA","we take off running",7582.034,7583.722,1.6880000000001,4,142.180094786721,NA,"role_play","LAURA",1,0,0,0
"1151","Vestiges",5,61,1151,"second_half_rp","SAM","wait, where are we running?",7583.722,7585.621,1.89900000000034,6,189.573459715606,NA,"role_play","SAM",1,0,0,0
"1152","Vestiges",5,61,1152,"second_half_rp","LAURA","towards the bog.",7585.621,7587.249,1.6279999999997,4,147.420147420174,NA,"role_play","LAURA",1,0,0,0
"1153","Vestiges",5,61,1153,"second_half_rp","SAM","towards the what?",7587.249,7588.705,1.45600000000013,4,164.83516483515,NA,"role_play","SAM",1,0,0,0
"1154","Vestiges",5,61,1154,"second_half_rp","LIAM","we think towards the bog.",7588.705,7590.125,1.42000000000007,6,253.52112676055,NA,"role_play","LIAM",1,0,0,0
"1155","Vestiges",5,61,1155,"second_half_rp","SAM","we're leaving kiki and just running?",7590.125,7592.957,2.83200000000033,8,169.491525423709,NA,"role_play","SAM",1,0,0,0
"1156","Vestiges",5,61,1156,"second_half_rp","MARISHA","no, i can do this at a range of 300 feet, so let's back up 300 feet.",7592.957,7599.201,6.24399999999969,19,182.57527226138,NA,"role_play","MARISHA",1,0,0,0
"1157","Vestiges",5,61,1157,"second_half_rp","LAURA","you do it, we act like we did something, we start running.",7599.201,7603.531,4.32999999999993,13,180.138568129333,NA,"role_play","LAURA",1,0,0,0
"1158","Vestiges",5,61,1158,"second_half_rp","MARISHA","hallucinatory terrain, are we doing this? are we ready? are we doing this? i did it, bamf.",7603.531,7609.249,5.71799999999985,18,188.877229800635,NA,"role_play","MARISHA",1,0,0,0
"1159","Vestiges",5,61,1159,"second_half_rp","MATT","so you stand back a bit at the outskirts. what kind of hallucinatory terrain are you creating?",7609.249,7617.948,8.69900000000052,18,124.152201402453,NA,"role_play","MATT",0,0,0,1
"1160","Vestiges",5,61,1160,"second_half_rp","MARISHA","i want it to look like the fairy terrain, but their little huts are on fire like they've been raided, and i want the circle of rocks to be obliterated, and all their statues to be knocked over and it smells like fire and shit and pixie blood. like grog said.",7617.948,7643.933,25.9849999999997,53,122.378295170292,NA,"role_play","MARISHA",1,0,0,0
"1161","Vestiges",5,61,1161,"second_half_rp","MATT","grasping at what you imagine pixie blood would smell like.",7643.933,7648.545,4.61200000000008,11,143.104943625323,NA,"role_play","MATT",0,0,0,1
"1162","Vestiges",5,61,1162,"second_half_rp","MARISHA","yeah, i'm sure it smells delightful. herbal.",7648.545,7654.21,5.66499999999996,9,95.3221535745814,NA,"role_play","MARISHA",1,0,0,0
"1163","Vestiges",5,61,1163,"second_half_rp","MATT","so as keyleth, you finish concentrating, you guys watch as there's a shimmer of magical energy, and now you see where once the beautiful glowing fairy light of the pixie abodes now look burnt to a cinder. you can see embers slowly rising off of them as the stone structures are now broken across the ground.",7654.21,7676.487,22.277,58,156.214930197064,NA,"role_play","MATT",0,0,0,1
"1164","Vestiges",5,61,1164,"second_half_rp","LIAM","the horror, the horror.",7676.487,7679.026,2.53899999999976,5,118.156754627817,NA,"role_play","LIAM",1,0,0,0
"1165","Vestiges",5,61,1165,"second_half_rp","SAM","the pixies see it too, though.",7679.026,7681.911,2.88500000000022,7,145.580589254755,NA,"role_play","SAM",1,0,0,0
"1166","Vestiges",5,61,1166,"second_half_rp","MARISHA","they can see it, but they can also be like: oh, this isn't real.",7681.911,7685.32,3.40899999999965,16,281.607509533616,NA,"role_play","MARISHA",1,0,0,0
"1167","Vestiges",5,61,1167,"second_half_rp","LIAM","i grab keyleth by the wrist and start running away from the village.",7685.32,7690.648,5.32800000000043,14,157.657657657645,NA,"role_play","LIAM",1,0,0,0
"1168","Vestiges",5,61,1168,"second_half_rp","TRAVIS","are we running back to the lycans or to the shademirk?",7690.648,7692.938,2.28999999999996,12,314.41048034935,NA,"role_play","TRAVIS",1,0,0,0
"1169","Vestiges",5,61,1169,"second_half_rp","LAURA","towards the shademirk.",7692.938,7694.567,1.62899999999991,4,147.32965009209,NA,"role_play","LAURA",1,0,0,0
"1170","Vestiges",5,61,1170,"second_half_rp","TRAVIS","i've got garmelie.",7694.567,7697.283,2.71600000000035,5,110.456553755509,NA,"role_play","TRAVIS",1,0,0,0
"1171","Vestiges",5,61,1171,"second_half_rp","LIAM","go, run faun, run.",7697.283,7700.634,3.35099999999966,5,89.5255147717191,NA,"role_play","LIAM",1,0,0,0
"1172","Vestiges",5,61,1172,"second_half_rp","LAURA","but keep on the lookout for mandrakes.",7700.634,7702.94,2.30599999999959,8,208.152645273238,NA,"role_play","LAURA",1,0,0,0
"1173","Vestiges",5,61,1173,"second_half_rp","MARISHA","and werewolves.",7702.94,7704.799,1.85900000000038,3,96.8262506723848,NA,"role_play","MARISHA",1,0,0,0
"1174","Vestiges",5,61,1174,"second_half_rp","MATT","okay, so i want everyone to make a perception check.",7704.799,7710.06,5.26100000000042,11,125.451435088376,NA,"role_play","MATT",0,0,0,1
"1175","Vestiges",5,61,1175,"second_half_rp","SAM","strong eight.",7710.06,7715.384,5.32399999999961,3,33.8091660405735,NA,"role_play","SAM",1,0,0,0
"1176","Vestiges",5,61,1176,"second_half_rp","TALIESIN","natural one.",7715.384,7717.909,2.52499999999964,3,71.2871287128816,NA,"role_play","TALIESIN",1,0,0,0
"1177","Vestiges",5,61,1177,"second_half_rp","LIAM","natural one.",7717.909,7719.305,1.39600000000064,3,128.93982808017,NA,"role_play","LIAM",1,0,0,0
"1178","Vestiges",5,61,1178,"second_half_rp","TALIESIN","no!",7719.305,7722.272,2.96699999999964,2,40.4448938321585,NA,"role_play","TALIESIN",1,0,0,0
"1179","Vestiges",5,61,1179,"second_half_rp","MARISHA","22.",7722.272,7724.49,2.21799999999985,2,54.1027953110948,NA,"role_play","MARISHA",1,0,0,0
"1180","Vestiges",5,61,1180,"second_half_rp","LAURA","no! 31.",7724.49,7727.53,3.03999999999996,3,59.2105263157902,NA,"role_play","LAURA",1,0,0,0
"1181","Vestiges",5,61,1181,"second_half_rp","TRAVIS","natural 19.",7727.53,7729.057,1.52700000000004,3,117.878192534378,NA,"role_play","TRAVIS",1,0,0,0
"1182","Vestiges",5,61,1182,"second_half_rp","MATT","what are you looking out for? which direction are you looking?",7729.057,7731.502,2.44500000000062,12,294.478527607288,NA,"role_play","MATT",0,0,0,1
"1183","Vestiges",5,61,1183,"second_half_rp","LAURA","i'm looking towards where we're going.",7731.502,7734.133,2.6309999999994,9,205.245153933912,NA,"role_play","LAURA",1,0,0,0
"1184","Vestiges",5,61,1184,"second_half_rp","MATT","okay, so you're going with garmelie, heading in the direction duskward. where are you looking, keyleth?",7734.133,7738.599,4.46600000000035,18,241.827138378844,NA,"role_play","MATT",0,0,0,1
"1185","Vestiges",5,61,1185,"second_half_rp","MARISHA","i'm looking out for werewolves, for lycans.",7738.599,7741.192,2.59299999999985,9,208.252988816055,NA,"role_play","MARISHA",1,0,0,0
"1186","Vestiges",5,61,1186,"second_half_rp","MATT","okay. where are you looking?",7741.192,7743.321,2.12899999999991,6,169.093471113206,NA,"role_play","MATT",0,0,0,1
"1187","Vestiges",5,61,1187,"second_half_rp","TRAVIS","i'm looking for lycans, too. i'm just being honest!",7743.321,7746.937,3.61599999999999,12,199.115044247788,NA,"role_play","TRAVIS",1,0,0,0
"1188","Vestiges",5,61,1188,"second_half_rp","MATT","all right, so you guys continue pushing forward",7746.937,7749.271,2.33399999999983,8,205.655526992303,NA,"role_play","MATT",0,0,0,1
"1189","Vestiges",5,61,1189,"second_half_rp","LIAM","i'm shouting: the way is clear!",7749.271,7751.4,2.12899999999991,8,225.457961484275,NA,"role_play","LIAM",1,0,0,0
"1190","Vestiges",5,61,1190,"second_half_rp","MATT","all right, you guys run, and run, and run, and you're pushing through brush and pushing over elements and heavy hard portions of the floor. i need everyone to roll this is going to be an athletics check for the keeping up the endurance and the speed. this is not easy terrain you continue to push through.",7751.4,7783.02,31.6200000000008,59,111.954459203033,NA,"role_play","MATT",0,0,0,1
"1191","Vestiges",5,61,1191,"second_half_rp","MARISHA","athletics?",7783.02,7784.209,1.1889999999994,2,100.925147182558,NA,"role_play","MARISHA",1,0,0,0
"1192","Vestiges",5,61,1192,"second_half_rp","LAURA","i've got land stride, so i don't get slowed by any hard terrain.",7784.209,7787.448,3.23900000000049,16,296.387774004278,NA,"role_play","LAURA",1,0,0,0
"1193","Vestiges",5,61,1193,"second_half_rp","MATT","you're fine. you don't need to roll.",7787.448,7789.163,1.71499999999924,10,349.854227405404,NA,"role_play","MATT",0,0,0,1
"1194","Vestiges",5,61,1194,"second_half_rp","TRAVIS","24.",7789.163,7790.498,1.33500000000004,2,89.8876404494358,NA,"role_play","TRAVIS",1,0,0,0
"1195","Vestiges",5,61,1195,"second_half_rp","MARISHA","24.",7790.498,7791.883,1.38500000000022,2,86.6425992779647,NA,"role_play","MARISHA",1,0,0,0
"1196","Vestiges",5,61,1196,"second_half_rp","TALIESIN","11.",7791.883,7793.044,1.16100000000006,2,103.35917312661,NA,"role_play","TALIESIN",1,0,0,0
"1197","Vestiges",5,61,1197,"second_half_rp","SAM","i rolled twice, because of disadvantage. both were ones.",7793.044,7798.872,5.82800000000043,10,102.951269732319,NA,"role_play","SAM",1,0,0,0
"1198","Vestiges",5,61,1198,"second_half_rp","MATT","you've hit the spectrum today.",7798.872,7803.492,4.61999999999989,7,90.9090909090931,NA,"role_play","MATT",0,0,0,1
"1199","Vestiges",5,61,1199,"second_half_rp","LIAM","well, i rolled a one, but then i used luck and i rolled a 20.",7803.492,7807.555,4.0630000000001,16,236.278611863149,NA,"role_play","LIAM",1,0,0,0
"1200","Vestiges",5,61,1200,"second_half_rp","MATT","you guys, calm down on the extremes! there are other numbers between those two, you realize, on the dice.",7807.555,7816.898,9.34299999999985,20,128.438403082524,NA,"role_play","MATT",0,0,0,1
"1201","Vestiges",5,61,1201,"second_half_rp","SAM","i'm tired from reading.",7816.898,7819.364,2.46599999999944,6,145.985401459887,NA,"role_play","SAM",1,0,0,0
"1202","Vestiges",5,61,1202,"second_half_rp","MATT","you're not reading during this run. but as you guys are charging forward, scanlan goes face-first over a heavy root into the ground. you guys have to double back, grab him, keep going. you push on, and you push on, and you push on for what seems like another 30 minutes to an hour. your pace starts to slow due to general exhaustion and you're unable to keep that speed and that level of physical exertion for that long. most of you can't. grog is happy to go forever. constitution of 20; he's good to go.",7819.364,7857.484,38.1200000000008,102,160.545645330532,NA,"role_play","MATT",0,0,0,1
"1203","Vestiges",5,61,1203,"second_half_rp","LIAM","he's basically good against anything except one of the ancient dragons.",7857.484,7861.328,3.84400000000005,13,202.913631633712,NA,"role_play","LIAM",1,0,0,0
"1204","Vestiges",5,61,1204,"second_half_rp","MATT","there's a few things he's not good against. tiny brain with arms and legs, not so good.",7861.328,7867.262,5.93399999999929,20,202.224469160793,NA,"role_play","MATT",0,0,0,1
"1205","Vestiges",5,61,1205,"second_half_rp","TRAVIS","fuck that little bastard.",7867.262,7869.459,2.19700000000012,5,136.549840691845,NA,"role_play","TRAVIS",1,0,0,0
"1206","Vestiges",5,61,1206,"second_half_rp","MATT","that was fun. eventually, you begin to see a thinning of the trees, like the forest is coming to an end. you're beginning to hit the edge of the duskward side of the moonbrush.",7869.459,7882.832,13.3730000000005,36,161.519479548338,NA,"role_play","MATT",0,0,0,1
"1207","Vestiges",5,61,1207,"second_half_rp","LAURA","are we going the right direction, garmelie?",7882.832,7884.93,2.09799999999996,8,228.789323164924,NA,"role_play","LAURA",1,0,0,0
"1208","Vestiges",5,61,1208,"second_half_rp","MATT","""as far as i know! yes, we're going the right way!""",7884.93,7888.982,4.05199999999968,14,207.305034550855,NA,"role_play","MATT",0,0,0,1
"1209","Vestiges",5,61,1209,"second_half_rp","MARISHA","you're taking us through the bog?",7888.982,7891.509,2.52700000000004,8,189.948555599522,NA,"role_play","MARISHA",1,0,0,0
"1210","Vestiges",5,61,1210,"second_half_rp","MATT","""through the moonbrush. that's what we're going through.""",7891.509,7894.668,3.15899999999965,12,227.920227920253,NA,"role_play","MATT",0,0,0,1
"1211","Vestiges",5,61,1211,"second_half_rp","MARISHA","still to the bog.",7894.668,7896.03,1.36200000000008,5,220.264317180604,NA,"role_play","MARISHA",1,0,0,0
"1212","Vestiges",5,61,1212,"second_half_rp","MATT","""of course! where else would i want to go?!"" he's holding his hat and rushing along.",7896.03,7900.121,4.09100000000035,19,278.66047421166,NA,"role_play","MATT",0,0,0,1
"1213","Vestiges",5,61,1213,"second_half_rp","LIAM","you want to go to the theater.",7900.121,7901.818,1.69700000000012,8,282.85209192691,NA,"role_play","LIAM",1,0,0,0
"1214","Vestiges",5,61,1214,"second_half_rp","MATT","""no theater!""",7901.818,7903.632,1.8139999999994,4,132.30429988979,NA,"role_play","MATT",0,0,0,1
"1215","Vestiges",5,61,1215,"second_half_rp","LIAM","what's your problem with the arts, man?",7903.632,7906.843,3.21100000000024,9,168.171909062585,NA,"role_play","LIAM",1,0,0,0
"1216","Vestiges",5,61,1216,"second_half_rp","MATT","you guys, at this point in time, come to the final tree line, vex and vax and garmelie helming at the front of the pace before all three of you slam into something extremely hard.",7906.843,7927.384,20.5410000000002,36,105.155542573389,NA,"role_play","MATT",0,0,0,1
"1217","Vestiges",5,61,1217,"second_half_rp","MARISHA","oh fuck.",7927.384,7930.536,3.15200000000004,3,57.1065989847708,NA,"role_play","MARISHA",1,0,0,0
"1218","Vestiges",5,61,1218,"second_half_rp","LAURA","what is it?",7930.536,7932.016,1.47999999999956,4,162.16216216221,NA,"role_play","LAURA",1,0,0,0
"1219","Vestiges",5,61,1219,"second_half_rp","LIAM","did it feel like a theater?",7932.016,7933.518,1.50200000000041,7,279.627163781549,NA,"role_play","LIAM",1,0,0,0
"1220","Vestiges",5,61,1220,"second_half_rp","MATT","no, it felt like a wall.",7933.518,7935.377,1.85900000000038,7,225.927918235565,NA,"role_play","MATT",0,0,0,1
"1221","Vestiges",5,61,1221,"second_half_rp","LIAM","the wall of a theater?",7935.377,7936.976,1.59899999999925,6,225.140712945697,NA,"role_play","LIAM",1,0,0,0
"1222","Vestiges",5,61,1222,"second_half_rp","LAURA","seriously. a wall?",7936.976,7939.471,2.49499999999989,4,96.1923847695433,NA,"role_play","LAURA",1,0,0,0
"1223","Vestiges",5,61,1223,"second_half_rp","MATT","you stand back up and you guys catch up, and same thing: you come up to the edge between where the trees that hit the perimeter of the forest are, and there's a barrier, an invisible barrier right there that's preventing you from crossing.",7939.471,7956.418,16.9470000000001,47,166.401132943883,NA,"role_play","MATT",0,0,0,1
"1224","Vestiges",5,61,1224,"second_half_rp","LIAM","what is this thing, garmelie?",7956.418,7958.864,2.44599999999991,6,147.179067865909,NA,"role_play","LIAM",1,0,0,0
"1225","Vestiges",5,61,1225,"second_half_rp","MATT","""i don't know! i haven't encountered this.""",7958.864,7960.639,1.77500000000055,11,371.830985915379,NA,"role_play","MATT",0,0,0,1
"1226","Vestiges",5,61,1226,"second_half_rp","LIAM","never ever?",7960.639,7961.775,1.13599999999951,3,158.45070422542,NA,"role_play","LIAM",1,0,0,0
"1227","Vestiges",5,61,1227,"second_half_rp","MATT","""i don't walk into the middle of dangerous forests for fun!""",7961.775,7964.015,2.24000000000069,14,374.999999999884,NA,"role_play","MATT",0,0,0,1
"1228","Vestiges",5,61,1228,"second_half_rp","TALIESIN","i don't think we can leave until we take care of this.",7964.015,7969.176,5.16100000000006,14,162.759155202478,NA,"role_play","TALIESIN",1,0,0,0
"1229","Vestiges",5,61,1229,"second_half_rp","TRAVIS","wait. you can go invisible. is it magic? can you tell?",7969.176,7972.818,3.64199999999983,12,197.693574958823,NA,"role_play","TRAVIS",1,0,0,0
"1230","Vestiges",5,61,1230,"second_half_rp","MATT","""i can have a look at it.""",7972.818,7976.044,3.22599999999966,9,167.389956602622,NA,"role_play","MATT",0,0,0,1
"1231","Vestiges",5,61,1231,"second_half_rp","TRAVIS","yeah, have a look.",7976.044,7977.94,1.89599999999973,5,158.227848101288,NA,"role_play","TRAVIS",1,0,0,0
"1232","Vestiges",5,61,1232,"second_half_rp","MATT","he comes up and looks over it for a bit. ""to be honest, this is a large-scale enchantment. this ""is some sort of this is very powerful, very old magic.""",7977.94,7989.382,11.442,32,167.802831672784,NA,"role_play","MATT",0,0,0,1
"1233","Vestiges",5,61,1233,"second_half_rp","MARISHA","fucking old magic.",7989.439,7991.311,1.87199999999939,4,128.20512820517,NA,"role_play","MARISHA",1,0,0,0
"1234","Vestiges",5,61,1234,"second_half_rp","MATT","he turns around, looking at you guys. ""hi.""",7991.311,7999.702,8.39100000000053,9,64.3546657132601,NA,"role_play","MATT",0,0,0,1
