"","arc","arc_no","episode","turn_number","segment","actor","text","start_turn","end_turn","time_in_sec","word_count","words_per_minute","encounter_count","rp_combat","actor_guest","vox_machina","guest","staff","matt"
"1740","Vestiges",5,61,1740,"combat","TALIESIN","all right, deadeye sharpshooter. thank god. this is just sucking. oh my fucking god. i miss.",10959.609,10969.484,9.875,17,103.291139240506,1,"combat","TALIESIN",1,0,0,0
"1741","Vestiges",5,61,1741,"combat","MATT","okay. you don't misfire. all right, so after the second shot hits, you fire, trying to compensate a third time, but the pixie actually stays in position and your fire goes wide once more.",10969.484,10983.07,13.5859999999993,36,158.987192698374,1,"combat","MATT",0,0,0,1
"1742","Vestiges",5,61,1742,"combat","TALIESIN","all right. now i'm diving behind that tree. bottom right. heading that way, yeah.",10983.07,10990.388,7.31800000000112,16,131.183383438078,1,"combat","TALIESIN",1,0,0,0
"1743","Vestiges",5,61,1743,"combat","MATT","cool, that ends your turn. the purple pixie leader, the mystic you mentioned before, now angrily comes fluttering forward, as you both have vanished. seeing this little circumstance, is going to, from this position, look towards you at the very front, vax.",10990.388,11016.933,26.5450000000001,43,97.1934450932376,1,"combat","MATT",0,0,0,1
"1744","Vestiges",5,61,1744,"combat","LIAM","shit.",11016.933,11018.769,1.83599999999933,2,65.3594771242068,1,"combat","LIAM",1,0,0,0
"1745","Vestiges",5,61,1745,"combat","MATT","it begins reciting under its breath.",11018.769,11031.746,12.976999999999,7,32.3649533790579,1,"combat","MATT",0,0,0,1
"1746","Vestiges",5,61,1746,"combat","SAM","i'll do counterspell at level six.",11031.746,11035.794,4.04800000000068,8,118.577075098794,1,"combat","SAM",1,0,0,0
"1747","Vestiges",5,61,1747,"combat","MARISHA","oh snapricot.",11035.794,11037.368,1.57400000000052,3,114.358322744562,1,"combat","MARISHA",1,0,0,0
"1748","Vestiges",5,61,1748,"combat","TALIESIN","did you just say ""snapricot?""",11037.368,11039.934,2.56599999999889,6,140.296180826249,1,"combat","TALIESIN",1,0,0,0
"1749","Vestiges",5,61,1749,"combat","MARISHA","i'm a fucking hipster.",11039.934,11047.103,7.16899999999987,6,50.2162086762459,1,"combat","MARISHA",1,0,0,0
"1750","Vestiges",5,61,1750,"combat","TALIESIN","this is going so poorly.",11047.103,11058.451,11.348,6,31.723651744801,1,"combat","TALIESIN",1,0,0,0
"1751","Vestiges",5,61,1751,"combat","LIAM","nasty.",11058.451,11064.699,6.24800000000141,2,19.206145966705,1,"combat","LIAM",1,0,0,0
"1752","Vestiges",5,61,1752,"combat","MATT","as you cast your counterspell, mark off your 6th-level spell. it finishes the incantation, as it does, a bit of arcane energy sprays forth from its fingertips and dissipates around it.",11064.699,11078.941,14.2420000000002,33,139.0254177784,1,"combat","MATT",0,0,0,1
"1753","Vestiges",5,61,1753,"combat","LIAM","aw, that's sad.",11078.941,11082.162,3.22099999999955,5,93.1387767774114,1,"combat","LIAM",1,0,0,0
"1754","Vestiges",5,61,1754,"combat","MATT","darts backwards.",11082.162,11085.345,3.18299999999908,3,56.5504241281972,1,"combat","MATT",0,0,0,1
"1755","Vestiges",5,61,1755,"combat","LAURA","out of camera view.",11085.345,11088.471,3.1260000000002,5,95.969289827249,1,"combat","LAURA",1,0,0,0
"1756","Vestiges",5,61,1756,"combat","MATT","all right, scanlan you're up.",11088.471,11092.542,4.07099999999991,7,103.16875460575,1,"combat","MATT",0,0,0,1
"1757","Vestiges",5,61,1757,"combat","SAM","they're so far, and i don't know what they can do. probably a lot. i'll step towards that tree in front of me, in front of the bear and the girl.",11092.542,11110.101,17.5590000000011,35,119.596787971973,1,"combat","SAM",1,0,0,0
"1758","Vestiges",5,61,1758,"combat","MATT","that's far as you can get.",11110.101,11112.38,2.27899999999863,8,210.618692409078,1,"combat","MATT",0,0,0,1
"1759","Vestiges",5,61,1759,"combat","SAM","that cluster of the pixies over there? i'll see if i can get three of them in a fireball.",11112.38,11122.395,10.0150000000012,21,125.811283075371,1,"combat","SAM",1,0,0,0
"1760","Vestiges",5,61,1760,"combat","MATT","okay.",11122.395,11123.944,1.54899999999907,2,77.4693350549207,1,"combat","MATT",0,0,0,1
"1761","Vestiges",5,61,1761,"combat","SAM","if i can, the leader and the ones closest to the leader. but i don't know if i'm within range.",11123.944,11132.626,8.6820000000007,23,158.949550794735,1,"combat","SAM",1,0,0,0
"1762","Vestiges",5,61,1762,"combat","MATT","okay, you just using a single charge for it?",11132.626,11136.665,4.03900000000067,10,148.551621688512,1,"combat","MATT",0,0,0,1
"1763","Vestiges",5,61,1763,"combat","SAM","oh yeah, i have lots of charges, don't i?",11136.665,11138.832,2.16699999999946,11,304.568527918857,1,"combat","SAM",1,0,0,0
"1764","Vestiges",5,61,1764,"combat","MATT","how many came back? you have to roll for the last couple of times you've gotten a full rest.",11138.832,11142.335,3.50299999999879,21,359.691692834837,1,"combat","MATT",0,0,0,1
"1765","Vestiges",5,61,1765,"combat","SAM","i haven't used them in a long time.",11142.335,11143.947,1.61200000000099,10,372.208436724337,1,"combat","SAM",1,0,0,0
"1766","Vestiges",5,61,1766,"combat","MATT","yeah that's true, actually.",11143.947,11145.155,1.20800000000054,6,298.01324503298,1,"combat","MATT",0,0,0,1
"1767","Vestiges",5,61,1767,"combat","SAM","i'll use two. a 4th-level spell, right?",11145.155,11152.392,7.23699999999917,10,82.9072820229472,1,"combat","SAM",1,0,0,0
"1768","Vestiges",5,61,1768,"combat","MATT","4th-level fireball.",11152.392,11153.521,1.12900000000081,4,212.577502214196,1,"combat","MATT",0,0,0,1
"1769","Vestiges",5,61,1769,"combat","SAM","so it's 9d6.",11153.521,11154.863,1.34199999999873,5,223.546944858631,1,"combat","SAM",1,0,0,0
"1770","Vestiges",5,61,1770,"combat","MATT","okay.",11154.863,11156.197,1.33400000000074,2,89.9550224887056,1,"combat","MATT",0,0,0,1
"1771","Vestiges",5,61,1771,"combat","SAM","range is 150 feet. radius is 20 feet.",11156.197,11163.221,7.02399999999943,9,76.8792710706212,1,"combat","SAM",1,0,0,0
"1772","Vestiges",5,61,1772,"combat","MATT","all right. as you pull out the wand and release it, one of the nearby pixies it has no effect.",11163.221,11174.799,11.5780000000013,21,108.827085852466,1,"combat","MATT",0,0,0,1
"1773","Vestiges",5,61,1773,"combat","TALIESIN","assholes.",11174.799,11175.666,0.86699999999837,2,138.40830449853,1,"combat","TALIESIN",1,0,0,0
"1774","Vestiges",5,61,1774,"combat","SAM","wait, they can do that, too?",11175.666,11177.347,1.68100000000049,7,249.851279000521,1,"combat","SAM",1,0,0,0
"1775","Vestiges",5,61,1775,"combat","MATT","oh my god, other people can counter.",11177.347,11179.323,1.97600000000057,8,242.914979757015,1,"combat","MATT",0,0,0,1
"1776","Vestiges",5,61,1776,"combat","LIAM","passive-aggressive dungeon master! oh, that's so sad. oh.",11179.323,11190.394,11.0709999999999,11,59.6152109113906,1,"combat","LIAM",1,0,0,0
"1777","Vestiges",5,61,1777,"combat","MATT","so the wand once again sputters out, as well.",11190.394,11193.061,2.66699999999946,10,224.971878515231,1,"combat","MATT",0,0,0,1
"1778","Vestiges",5,61,1778,"combat","SAM","it's dead? or it still might work after that?",11193.061,11199.01,5.94900000000052,11,110.94301563287,1,"combat","SAM",1,0,0,0
"1779","Vestiges",5,61,1779,"combat","MATT","well, it might still work after that.",11199.01,11200.905,1.89500000000044,8,253.298153034242,1,"combat","MATT",0,0,0,1
"1780","Vestiges",5,61,1780,"combat","SAM","that one use, okay. can i move any more, or am i all moved out?",11200.905,11208.539,7.63400000000001,16,125.753209326696,1,"combat","SAM",1,0,0,0
"1781","Vestiges",5,61,1781,"combat","MATT","that's the end of your movement.",11208.539,11209.832,1.29299999999967,8,371.229698375966,1,"combat","MATT",0,0,0,1
"1782","Vestiges",5,61,1782,"combat","SAM","i'll inspire keyleth. i'll turn to her and say: it's been a hard fey's night, and you've got to unfreeze grog. it's been a hard fey's night, because we've been fighting like a dog.",11209.832,11226.939,17.107,43,150.815455661425,1,"combat","SAM",1,0,0,0
"1783","Vestiges",5,61,1783,"combat","MARISHA","okay, i can do that.",11226.939,11230.552,3.61299999999937,6,99.6401882092617,1,"combat","MARISHA",1,0,0,0
"1784","Vestiges",5,61,1784,"combat","MATT","that the end of scanlan's turn? all right. it's now the pixies' turn.",11230.552,11235.014,4.46199999999953,16,215.150156880345,1,"combat","MATT",0,0,0,1
"1785","Vestiges",5,61,1785,"combat","LIAM","damn it, bobby.",11235.014,11237.516,2.50200000000041,4,95.9232613908717,1,"combat","LIAM",1,0,0,0
"1786","Vestiges",5,61,1786,"combat","LAURA","they're all super magic, super-duper magic.",11237.516,11243.09,5.57400000000052,9,96.8783638320684,1,"combat","LAURA",1,0,0,0
"1787","Vestiges",5,61,1787,"combat","MATT","actually, it's going to stay here, and before it moves... that will be in range. if i could have keyleth make a wisdom saving throw.",11243.09,11258.981,15.8909999999996,27,101.944496885032,1,"combat","MATT",0,0,0,1
"1788","Vestiges",5,61,1788,"combat","MARISHA","this is my bailiwick, yo.",11258.981,11260.554,1.57300000000032,6,228.862047043819,1,"combat","MARISHA",1,0,0,0
"1789","Vestiges",5,61,1789,"combat","TALIESIN","you also have an inspiration die.",11260.554,11263.008,2.45399999999972,7,171.149144254298,1,"combat","TALIESIN",1,0,0,0
"1790","Vestiges",5,61,1790,"combat","MARISHA","i have an inspiration die. ooh, i don't think i'll need it, though. 28.",11263.008,11270.157,7.14899999999943,17,142.677297524141,1,"combat","MARISHA",1,0,0,0
"1791","Vestiges",5,61,1791,"combat","MATT","28, yeah. no effect on you whatsoever.",11270.157,11273.676,3.51900000000023,8,136.402387041764,1,"combat","MATT",0,0,0,1
"1792","Vestiges",5,61,1792,"combat","MARISHA","you even lift, bro? come at me, bro. got the john cena going on.",11273.676,11281.8,8.1239999999998,15,110.782865583459,1,"combat","MARISHA",1,0,0,0
"1793","Vestiges",5,61,1793,"combat","MATT","this one over here, as it flutters by after seeing you attempt to cast the spell, scanlan, i need you to go ahead and make a wisdom saving throw.",11281.8,11297.539,15.7390000000014,30,114.365588665089,1,"combat","MATT",0,0,0,1
"1794","Vestiges",5,61,1794,"combat","SAM","oh, boy. advantage against magic.",11297.539,11301.701,4.16199999999844,6,86.4968765017142,1,"combat","SAM",1,0,0,0
"1795","Vestiges",5,61,1795,"combat","MATT","that's magic in general?",11301.701,11305.039,3.33800000000156,6,107.849011384012,1,"combat","MATT",0,0,0,1
"1796","Vestiges",5,61,1796,"combat","TALIESIN","yeah. i'm looking at it. yeah, advantage versus magic on his saving throw.",11305.039,11310.818,5.77899999999863,15,155.736286554804,1,"combat","TALIESIN",1,0,0,0
"1797","Vestiges",5,61,1797,"combat","MATT","from what, though?",11310.818,11312.35,1.53200000000106,4,156.657963446367,1,"combat","MATT",0,0,0,1
"1798","Vestiges",5,61,1798,"combat","SAM","i don't know, bard shit.",11312.35,11315.104,2.753999999999,7,152.505446623149,1,"combat","SAM",1,0,0,0
"1799","Vestiges",5,61,1799,"combat","MARISHA","is it because war caster?",11315.104,11317.185,2.08100000000013,6,172.993753003353,1,"combat","MARISHA",1,0,0,0
"1800","Vestiges",5,61,1800,"combat","MATT","no, war caster is advantage on concentration checks to maintain.",11317.185,11320.143,2.95800000000054,11,223.123732251481,1,"combat","MATT",0,0,0,1
"1801","Vestiges",5,61,1801,"combat","SAM","no it's not war caster. it's something else.",11320.143,11322.267,2.1239999999998,11,310.734463276866,1,"combat","SAM",1,0,0,0
"1802","Vestiges",5,61,1802,"combat","TALIESIN","it's on his sheet, which means he found it somewhere.",11322.267,11325.818,3.55099999999948,12,202.759785975811,1,"combat","TALIESIN",1,0,0,0
"1803","Vestiges",5,61,1803,"combat","MARISHA","and it's typed. it's typed up; it's not written in.",11325.818,11328.522,2.70400000000154,14,310.650887573787,1,"combat","MARISHA",1,0,0,0
"1804","Vestiges",5,61,1804,"combat","SAM","i probably didn't get it anyway, actually. both rolls were shitty, and i only rolled a total of five on the better one.",11328.522,11335.664,7.14199999999983,25,210.025203024368,1,"combat","SAM",1,0,0,0
"1805","Vestiges",5,61,1805,"combat","MATT","so as the pixie darts to the side, it mutters something underneath it and raises its hands up. scanlan, all of a sudden your body shimmers for a second, and you guys watch as the already small gnome becomes even smaller.",11335.664,11349.962,14.2979999999989,42,176.24842635335,1,"combat","MATT",0,0,0,1
"1806","Vestiges",5,61,1806,"combat","LAURA","we're going to die.",11349.962,11351.242,1.28000000000065,6,281.249999999856,1,"combat","LAURA",1,0,0,0
"1807","Vestiges",5,61,1807,"combat","MATT","he is now a badger.",11351.242,11352.392,1.14999999999964,6,313.043478260969,1,"combat","MATT",0,0,0,1
"1808","Vestiges",5,61,1808,"combat","SAM","i'm a what? i'm a badger?!",11352.392,11355.512,3.1200000000008,9,173.076923076879,1,"combat","SAM",1,0,0,0
"1809","Vestiges",5,61,1809,"combat","MATT","it then continues its movement over here by the side of the tree.",11355.512,11361.766,6.253999999999,14,134.314039015052,1,"combat","MATT",0,0,0,1
"1810","Vestiges",5,61,1810,"combat","SAM","gnome cunning, matt.",11361.766,11367.14,5.3739999999998,4,44.6594715295886,1,"combat","SAM",1,0,0,0
"1811","Vestiges",5,61,1811,"combat","TRAVIS","i tried to be diplomatic.",11367.14,11368.706,1.56600000000071,6,229.88505747116,1,"combat","TRAVIS",1,0,0,0
"1812","Vestiges",5,61,1812,"combat","TALIESIN","a lot of good it did you.",11368.706,11372.174,3.46800000000076,8,138.40830449824,1,"combat","TALIESIN",1,0,0,0
"1813","Vestiges",5,61,1813,"combat","LAURA","why'd you do that?",11372.174,11373.534,1.35999999999876,6,264.705882353182,1,"combat","LAURA",1,0,0,0
"1814","Vestiges",5,61,1814,"combat","LIAM","that's scanlan's bag, man.",11373.534,11375.086,1.55199999999968,7,270.618556701087,1,"combat","LIAM",1,0,0,0
"1815","Vestiges",5,61,1815,"combat","TRAVIS","yeah, but i thought we were all never mind.",11375.086,11376.985,1.89900000000125,10,315.955766192525,1,"combat","TRAVIS",1,0,0,0
"1816","Vestiges",5,61,1816,"combat","TALIESIN","we would be getting our asses kicked by a group of werewolves right now.",11376.985,11381.053,4.0679999999993,15,221.238938053135,1,"combat","TALIESIN",1,0,0,0
"1817","Vestiges",5,61,1817,"combat","TRAVIS","people were preparing tea, you were being cordial. i was trying to be disarming. next time, everything dies.",11381.053,11390.941,9.88800000000083,19,115.291262135913,1,"combat","TRAVIS",1,0,0,0
"1818","Vestiges",5,61,1818,"combat","SAM","this is our punishment for",11390.941,11392.599,1.65799999999945,5,180.940892641797,1,"combat","SAM",1,0,0,0
"1819","Vestiges",5,61,1819,"combat","TALIESIN","trying to settle this amicably.",11392.599,11395.591,2.99200000000019,6,120.320855614966,1,"combat","TALIESIN",1,0,0,0
"1820","Vestiges",5,61,1820,"combat","MATT","for intelligence, wisdom or charisma",11395.591,11397.495,1.90400000000045,5,157.563025210047,1,"combat","MATT",0,0,0,1
"1821","Vestiges",5,61,1821,"combat","SAM","yeah, that was a wisdom.",11397.495,11399.054,1.55899999999929,6,230.917254650523,1,"combat","SAM",1,0,0,0
"1822","Vestiges",5,61,1822,"combat","MATT","yeah, so you're fine. universal, so strength saves, it doesn't help for any of those.",11399.054,11403.17,4.11599999999999,18,262.390670553937,1,"combat","MATT",0,0,0,1
"1823","Vestiges",5,61,1823,"combat","SAM","it's just saves against magic for those three things.",11403.17,11406.494,3.32400000000052,11,198.555956678669,1,"combat","SAM",1,0,0,0
"1824","Vestiges",5,61,1824,"combat","MATT","this other one here, glancing over and seeing you there, is going to look towards you. i need you to make a wisdom saving throw.",11406.494,11421.407,14.9129999999986,26,104.606718970036,1,"combat","MATT",0,0,0,1
"1825","Vestiges",5,61,1825,"combat","LIAM","i've got advantage. good, i got a 19.",11421.407,11426.027,4.6200000000008,10,129.870129870107,1,"combat","LIAM",1,0,0,0
"1826","Vestiges",5,61,1826,"combat","MATT","19. you have advantage from?",11426.027,11427.847,1.81999999999971,6,197.802197802229,1,"combat","MATT",0,0,0,1
"1827","Vestiges",5,61,1827,"combat","LIAM","being a half-elf. oh, it's not charm, is it? then the first one was shitty. ten or 11, somewhere around there.",11427.847,11439.16,11.3130000000001,24,127.287191726331,1,"combat","LIAM",1,0,0,0
"1828","Vestiges",5,61,1828,"combat","MATT","you are a kitty cat.",11439.16,11441.309,2.14899999999943,6,167.519776640342,1,"combat","MATT",0,0,0,1
"1829","Vestiges",5,61,1829,"combat","LIAM","can i use luck to take my second roll? i have luck left?",11441.309,11446.561,5.25200000000041,14,159.939070830148,1,"combat","LIAM",1,0,0,0
"1830","Vestiges",5,61,1830,"combat","MATT","you have one luck left?",11446.561,11448.163,1.60200000000077,6,224.719101123487,1,"combat","MATT",0,0,0,1
"1831","Vestiges",5,61,1831,"combat","LIAM","i have two luck left, after sleeping.",11448.163,11450.119,1.95600000000013,8,245.398773006119,1,"combat","LIAM",1,0,0,0
"1832","Vestiges",5,61,1832,"combat","MATT","yeah, technically.",11450.119,11451.631,1.51199999999881,3,119.047619047713,1,"combat","MATT",0,0,0,1
"1833","Vestiges",5,61,1833,"combat","LIAM","okay, so the second was a 17. plus two, would've been a 19.",11451.631,11457.224,5.59300000000076,15,160.915430001766,1,"combat","LIAM",1,0,0,0
"1834","Vestiges",5,61,1834,"combat","LAURA","so you're not a kitty cat?",11457.224,11459.054,1.82999999999993,8,262.295081967224,1,"combat","LAURA",1,0,0,0
"1835","Vestiges",5,61,1835,"combat","LIAM","no, i really would like to be a kitty cat.",11459.054,11461.336,2.28199999999924,11,289.219982471612,1,"combat","LIAM",1,0,0,0
"1836","Vestiges",5,61,1836,"combat","SAM","what happened?",11461.336,11462.545,1.20900000000074,3,148.883374689735,1,"combat","SAM",1,0,0,0
"1837","Vestiges",5,61,1837,"combat","LIAM","i asked if i could use one of my lucks instead.",11462.545,11464.671,2.1260000000002,12,338.664158043241,1,"combat","LIAM",1,0,0,0
"1838","Vestiges",5,61,1838,"combat","SAM","so wait, he's not a kitty cat?",11464.671,11467.593,2.92200000000048,9,184.804928131386,1,"combat","SAM",1,0,0,0
"1839","Vestiges",5,61,1839,"combat","LIAM","in my heart, i am a kitty cat.",11467.593,11470.913,3.31999999999971,9,162.650602409653,1,"combat","LIAM",1,0,0,0
"1840","Vestiges",5,61,1840,"combat","LAURA","grog is stone.",11470.913,11476.317,5.40399999999863,4,44.4115470022318,1,"combat","LAURA",1,0,0,0
"1841","Vestiges",5,61,1841,"combat","LIAM","there's worse things than being a kitten, right?",11476.317,11479.499,3.1820000000007,10,188.560653676891,1,"combat","LIAM",1,0,0,0
"1842","Vestiges",5,61,1842,"combat","MATT","this one over here leans towards you, keyleth. i need you to make another wisdom saving throw.",11479.499,11487.594,8.09499999999935,18,133.415688696737,1,"combat","MATT",0,0,0,1
"1843","Vestiges",5,61,1843,"combat","MARISHA","already? come on. come at me, bro.",11487.594,11490.06,2.46600000000035,8,194.647201946444,1,"combat","MARISHA",1,0,0,0
"1844","Vestiges",5,61,1844,"combat","LIAM","we should have all been pixies from the beginning.",11490.06,11494.925,4.86499999999978,10,123.329907502575,1,"combat","LIAM",1,0,0,0
"1845","Vestiges",5,61,1845,"combat","MARISHA","okay, 27.",11494.925,11505.03,10.1050000000014,3,17.8129638792653,1,"combat","MARISHA",1,0,0,0
"1846","Vestiges",5,61,1846,"combat","MATT","27. you never roll low on those wisdom saving throws. it's really frustrating.",11505.03,11508.869,3.83899999999994,15,234.436051054966,1,"combat","MATT",0,0,0,1
"1847","Vestiges",5,61,1847,"combat","MARISHA","wise as fuck.",11508.869,11512.067,3.1979999999985,4,75.0469043152322,1,"combat","MARISHA",1,0,0,0
"1848","Vestiges",5,61,1848,"combat","MATT","all righty, now comes to vax.",11512.067,11522.505,10.4380000000001,7,40.2375934086986,1,"combat","MATT",0,0,0,1
"1849","Vestiges",5,61,1849,"combat","LIAM","click go the boots. i'm going to run 12 squares and squat down just north of grog. i'm not going to shit on you. i think i can make it all the way around to the other side of grog, and i'm going to dagger, dagger, dagger at queen of the pixies there.",11522.505,11538.507,16.0020000000004,57,213.723284589421,1,"combat","LIAM",1,0,0,0
"1850","Vestiges",5,61,1850,"combat","MATT","right there? okay, go for it.",11538.507,11540.236,1.72900000000118,7,242.914979756919,1,"combat","MATT",0,0,0,1
"1851","Vestiges",5,61,1851,"combat","LIAM","okay, first is shit, second is a natural 20. third is an 18.",11540.236,11550.22,9.98399999999856,14,84.1346153846275,1,"combat","LIAM",1,0,0,0
"1852","Vestiges",5,61,1852,"combat","MATT","okay, second two hit.",11550.22,11552.004,1.78400000000147,5,168.16143497744,1,"combat","MATT",0,0,0,1
"1853","Vestiges",5,61,1853,"combat","LIAM","all right. yeah, but it's not anything fancy. that's the weakness of the rogue. where's my pyramid? there it is. so the first one which was the critical is big 11 for the first one on a critical. and the second one, i'll put poison on it, as well. seven for the damage, and it's a dc of 15, for poison.",11552.004,11577.236,25.232,67,159.321496512365,1,"combat","LIAM",1,0,0,0
"1854","Vestiges",5,61,1854,"combat","MATT","for poison, it does not succeed. it is poisoned.",11577.236,11580.573,3.33699999999953,10,179.802217560708,1,"combat","MATT",0,0,0,1
"1855","Vestiges",5,61,1855,"combat","LIAM","that's 2d10. 14 with poison.",11580.573,11587.193,6.61999999999898,7,63.4441087613391,1,"combat","LIAM",1,0,0,0
"1856","Vestiges",5,61,1856,"combat","MATT","nice. all right, so now the mystic, the central pixie is fluttering, but it's not looking amazing. all right, so that ends your turn? all righty. that brings us to keyleth.",11587.193,11609.363,22.1700000000001,33,89.3098782138021,1,"combat","MATT",0,0,0,1
"1857","Vestiges",5,61,1857,"combat","SAM","shouldn't have gone in that cave, man.",11609.363,11612.857,3.4940000000006,9,154.550658271296,1,"combat","SAM",1,0,0,0
"1858","Vestiges",5,61,1858,"combat","MARISHA","can i dash and go a little bit further and still do an action and lose a bonus action? no, it's either like run or nothing?",11612.857,11622.695,9.83799999999974,28,170.766415938203,1,"combat","MARISHA",1,0,0,0
"1859","Vestiges",5,61,1859,"combat","MATT","a dash is an action, meaning you move and then your dash, to move more, is your action.",11622.695,11629.088,6.39300000000003,19,178.32003754106,1,"combat","MATT",0,0,0,1
"1860","Vestiges",5,61,1860,"combat","MARISHA","okay. here's what i'm going to do, i'm going to try and start making my way towards grog, i'm going to do the 30 feet towards him.",11629.088,11638.316,9.22800000000097,32,208.062418725596,1,"combat","MARISHA",1,0,0,0
"1861","Vestiges",5,61,1861,"combat","MATT","okay.",11638.316,11639.668,1.35199999999895,2,88.7573964497729,1,"combat","MATT",0,0,0,1
"1862","Vestiges",5,61,1862,"combat","MARISHA","do i see the fairy leader?",11639.668,11645.439,5.77100000000064,7,72.7776815109952,1,"combat","MARISHA",1,0,0,0
"1863","Vestiges",5,61,1863,"combat","MATT","you see her with a little bit of cover.",11645.439,11649.4,3.96099999999933,10,151.47689977281,1,"combat","MATT",0,0,0,1
"1864","Vestiges",5,61,1864,"combat","MARISHA","i'm going to blow my 6th-level spell. i'm going to cast sunbeam, and sunbeam her in the face.",11649.4,11659.351,9.95100000000093,22,132.649984926126,1,"combat","MARISHA",1,0,0,0
"1865","Vestiges",5,61,1865,"combat","TALIESIN","does that go through her? there's one on the other side of her.",11659.351,11663.451,4.09999999999854,15,219.512195122029,1,"combat","TALIESIN",1,0,0,0
"1866","Vestiges",5,61,1866,"combat","MARISHA","oh! does it go through to the one on the other side behind her?",11663.451,11666.662,3.21100000000115,15,280.286515104228,1,"combat","MARISHA",1,0,0,0
"1867","Vestiges",5,61,1867,"combat","MATT","no, it would go in this direction. she's right here.",11666.662,11668.987,2.32499999999891,12,309.677419354984,1,"combat","MATT",0,0,0,1
"1868","Vestiges",5,61,1868,"combat","MARISHA","i was looking at the red one, closer to me. i don't have the fucking pointer!",11668.987,11680.541,11.5540000000001,18,93.4741215163573,1,"combat","MARISHA",1,0,0,0
"1869","Vestiges",5,61,1869,"combat","SAM","that's grog, the red thing near you is grog.",11680.541,11683.418,2.87700000000041,11,229.405630865452,1,"combat","SAM",1,0,0,0
"1870","Vestiges",5,61,1870,"combat","MARISHA","no, not that fucking red this one. yes, that one. jesus. and the one behind it.",11683.418,11694.01,10.5920000000006,17,96.2990936555841,1,"combat","MARISHA",1,0,0,0
"1871","Vestiges",5,61,1871,"combat","MATT","all right, so. as you muster your sunbeam, the leader, who has not used her reaction yet, is going to attempt to counter that.",11694.01,11702.569,8.55899999999929,25,175.254118471799,1,"combat","MATT",0,0,0,1
"1872","Vestiges",5,61,1872,"combat","MARISHA","no!",11702.569,11703.746,1.17699999999968,2,101.954120645737,1,"combat","MARISHA",1,0,0,0
"1873","Vestiges",5,61,1873,"combat","MATT","6th-level, though, so it isn't an auto-counter. she has to roll for it.",11703.746,11707.544,3.79800000000068,17,268.562401263775,1,"combat","MATT",0,0,0,1
"1874","Vestiges",5,61,1874,"combat","SAM","it's a contested thing.",11707.544,11709.332,1.78800000000047,6,201.342281879142,1,"combat","SAM",1,0,0,0
"1875","Vestiges",5,61,1875,"combat","MARISHA","fucking bitch. i said <i>bitch</i>! i was trying to be nice to you fairies!",11709.332,11718.404,9.07200000000012,17,112.433862433861,1,"combat","MARISHA",1,0,0,0
"1876","Vestiges",5,61,1876,"combat","MATT","counterspell, so that dc is 16. that is a 19.",11718.404,11725.038,6.63400000000001,11,99.4874886946033,1,"combat","MATT",0,0,0,1
"1877","Vestiges",5,61,1877,"combat","MARISHA","no, it's not!",11725.038,11726.417,1.378999999999,5,217.548948513574,1,"combat","MARISHA",1,0,0,0
