"","arc","arc_no","episode","turn_number","segment","actor","text","start_turn","end_turn","time_in_sec","word_count","words_per_minute","encounter_count","rp_combat","actor_guest","vox_machina","guest","staff","matt"
"1303","Fall_Conclave",6,73,1303,"second_half_rp","MATT","as you're talking, you feel a tug on your right arm. and you look over and you see cassandra, who has come over to your side and is pulling on your sleeve with a very intense look in her eye. she goes, ""percival. i can watch whitestone. i can get the people fed. i can keep ""the people armed. i can organize the day to day. i can't keep it safe from that.""",9416.651,9451.524,34.8729999999996,76,130.760186964129,NA,"role_play","MATT",0,0,0,1
"1304","Fall_Conclave",6,73,1304,"second_half_rp","TALIESIN","which is why i would ask everyone to please not antagonize it.",9451.524,9454.517,2.99300000000039,13,260.608085532876,NA,"role_play","TALIESIN",1,0,0,0
"1305","Fall_Conclave",6,73,1305,"second_half_rp","MATT","""percival. percival! i don't know what you dragged us into in this, but i need you to pull us ""out of it. i can't do this.""",9454.517,9466.389,11.8719999999994,30,151.617250673862,NA,"role_play","MATT",0,0,0,1
"1306","Fall_Conclave",6,73,1306,"second_half_rp","TALIESIN","i've moved the battle. that is the best that i know how.",9466.389,9472.339,5.95000000000073,14,141.176470588218,NA,"role_play","TALIESIN",1,0,0,0
"1307","Fall_Conclave",6,73,1307,"second_half_rp","MATT","""how long have you known?""",9472.339,9474.296,1.95700000000033,7,214.614205416417,NA,"role_play","MATT",0,0,0,1
"1308","Fall_Conclave",6,73,1308,"second_half_rp","TALIESIN","two days.",9474.296,9475.882,1.58599999999933,3,113.493064312784,NA,"role_play","TALIESIN",1,0,0,0
"1309","Fall_Conclave",6,73,1309,"second_half_rp","LAURA","not long, cassandra.",9475.882,9477.324,1.44200000000092,4,166.435506241226,NA,"role_play","LAURA",1,0,0,0
"1310","Fall_Conclave",6,73,1310,"second_half_rp","TALIESIN","two days.",9477.324,9478.507,1.18299999999908,3,152.155536771039,NA,"role_play","TALIESIN",1,0,0,0
"1311","Fall_Conclave",6,73,1311,"second_half_rp","SAM","maybe three.",9478.507,9479.859,1.35200000000077,3,133.13609467448,NA,"role_play","SAM",1,0,0,0
"1312","Fall_Conclave",6,73,1312,"second_half_rp","MARISHA","we were forced.",9479.859,9481.663,1.80400000000009,4,133.037694013297,NA,"role_play","MARISHA",1,0,0,0
"1313","Fall_Conclave",6,73,1313,"second_half_rp","TALIESIN","the day before we left to kill the white dragon.",9481.663,9484.309,2.64599999999882,11,249.433106576075,NA,"role_play","TALIESIN",1,0,0,0
"1314","Fall_Conclave",6,73,1314,"second_half_rp","SAM","there's a time difference.",9484.309,9486.447,2.13800000000083,6,168.381665107512,NA,"role_play","SAM",1,0,0,0
"1315","Fall_Conclave",6,73,1315,"second_half_rp","LAURA","and if we had told any of you, your life would have been in danger.",9486.447,9489.685,3.23799999999937,16,296.479308215005,NA,"role_play","LAURA",1,0,0,0
"1316","Fall_Conclave",6,73,1316,"second_half_rp","TALIESIN","this was the best way i knew to keep her from destroying this city outright. this was the best way that kept her from telling the red dragon where we are. and the longer that we can keep her a tenuous ally, the longer whitestone will stand.",9489.685,9506.855,17.1700000000001,48,167.734420500873,NA,"role_play","TALIESIN",1,0,0,0
"1317","Fall_Conclave",6,73,1317,"second_half_rp","SAM","when she does come back with asum, this plan that we started in on it's a good one?",9506.855,9516.233,9.37800000000061,20,127.959053102999,NA,"role_play","SAM",1,0,0,0
"1318","Fall_Conclave",6,73,1318,"second_half_rp","TALIESIN","i think so.",9516.233,9517.93,1.69700000000012,4,141.426045963455,NA,"role_play","TALIESIN",1,0,0,0
"1319","Fall_Conclave",6,73,1319,"second_half_rp","SAM","well, we have raishan convince thordak that we're amassing forces in kymal or something. thordak sends raishan to get us. we ""kill"" raishan.",9517.93,9533.211,15.280999999999,25,98.1611151102738,NA,"role_play","SAM",1,0,0,0
"1320","Fall_Conclave",6,73,1320,"second_half_rp","LAURA","mm-hmm.",9533.211,9534.525,1.31400000000031,3,136.986301369831,NA,"role_play","LAURA",1,0,0,0
"1321","Fall_Conclave",6,73,1321,"second_half_rp","SAM","and then thordak comes to check on our dead bodies?",9534.525,9538.486,3.96100000000115,11,166.624589750015,NA,"role_play","SAM",1,0,0,0
"1322","Fall_Conclave",6,73,1322,"second_half_rp","TALIESIN","we send word of a dead dragon.",9538.486,9541.629,3.14300000000003,8,152.720330894049,NA,"role_play","TALIESIN",1,0,0,0
"1323","Fall_Conclave",6,73,1323,"second_half_rp","SAM","how can that plan fail?",9541.629,9544.319,2.68999999999869,6,133.828996282593,NA,"role_play","SAM",1,0,0,0
"1324","Fall_Conclave",6,73,1324,"second_half_rp","LIAM","i mean, i'm not the only one who thinks she's more dangerous than he is at this point.",9544.319,9549.422,5.10300000000097,21,246.913580246866,NA,"role_play","LIAM",1,0,0,0
"1325","Fall_Conclave",6,73,1325,"second_half_rp","LAURA","oh yes. i think if we give her access to thordak's body afterwards, we're asking for a lot of trouble.",9549.468,9555.803,6.33499999999913,23,217.837411207607,NA,"role_play","LAURA",1,0,0,0
"1326","Fall_Conclave",6,73,1326,"second_half_rp","TALIESIN","which is why if keyleth can figure out a way to cure her of this disease, it takes a big card off the table.",9555.803,9561.432,5.62900000000081,25,266.477171788912,NA,"role_play","TALIESIN",1,0,0,0
"1327","Fall_Conclave",6,73,1327,"second_half_rp","LIAM","we've got 24 hours.",9561.432,9562.805,1.37299999999959,6,262.199563000806,NA,"role_play","LIAM",1,0,0,0
"1328","Fall_Conclave",6,73,1328,"second_half_rp","MARISHA","i have ideas.",9562.805,9564.048,1.24300000000039,4,193.081255028097,NA,"role_play","MARISHA",1,0,0,0
"1329","Fall_Conclave",6,73,1329,"second_half_rp","TALIESIN","we have more than that, because it's going to take quite a while. that's how long we have to make a plan.",9564.048,9568.274,4.22599999999875,25,354.945575011937,NA,"role_play","TALIESIN",1,0,0,0
"1330","Fall_Conclave",6,73,1330,"second_half_rp","LAURA","question. what if we do actually just kill her?",9568.274,9572.527,4.25300000000061,10,141.076886903342,NA,"role_play","LAURA",1,0,0,0
"1331","Fall_Conclave",6,73,1331,"second_half_rp","SAM","raishan?",9572.527,9574.211,1.68399999999929,2,71.2589073634506,NA,"role_play","SAM",1,0,0,0
"1332","Fall_Conclave",6,73,1332,"second_half_rp","LAURA","when we fake that we're killing her, what if we kill her?",9574.211,9578.572,4.36100000000079,14,192.616372391619,NA,"role_play","LAURA",1,0,0,0
"1333","Fall_Conclave",6,73,1333,"second_half_rp","MARISHA","just actually kill her?",9578.572,9579.85,1.27800000000025,5,234.741784037513,NA,"role_play","MARISHA",1,0,0,0
"1334","Fall_Conclave",6,73,1334,"second_half_rp","TALIESIN","she's going to be expecting that, and it will not work.",9579.85,9582.865,3.01499999999942,13,258.706467661741,NA,"role_play","TALIESIN",1,0,0,0
"1335","Fall_Conclave",6,73,1335,"second_half_rp","TRAVIS","and she's super slippery. she just totally like evaded percy's sneak stabby-stab.",9582.865,9587.954,5.08899999999994,16,188.64216938495,NA,"role_play","TRAVIS",1,0,0,0
"1336","Fall_Conclave",6,73,1336,"second_half_rp","LIAM","is there anyone around right now?",9587.954,9590.092,2.13800000000083,7,196.445275958764,NA,"role_play","LIAM",1,0,0,0
"1337","Fall_Conclave",6,73,1337,"second_half_rp","MATT","oh yeah, no. allura, drake",9590.092,9594.369,4.27700000000004,5,70.142623334112,NA,"role_play","MATT",0,0,0,1
"1338","Fall_Conclave",6,73,1338,"second_half_rp","LIAM","20, natural 20! for perception.",9594.369,9596.575,2.20600000000013,6,163.191296464179,NA,"role_play","LIAM",1,0,0,0
"1339","Fall_Conclave",6,73,1339,"second_half_rp","MATT","for perception?",9596.575,9598.199,1.6239999999998,3,110.837438423659,NA,"role_play","MATT",0,0,0,1
"1340","Fall_Conclave",6,73,1340,"second_half_rp","LIAM","yeah. i said, ""is anyone around?"" and i rolled a 20.",9598.199,9600.402,2.20299999999952,12,326.82705401732,NA,"role_play","LIAM",1,0,0,0
"1341","Fall_Conclave",6,73,1341,"second_half_rp","MATT","you guys are still in the war room.",9600.402,9602,1.59799999999996,9,337.922403003764,NA,"role_play","MATT",0,0,0,1
"1342","Fall_Conclave",6,73,1342,"second_half_rp","LIAM","i know, but you know what i'm talking about. you know what i'm talking about.",9602,9605.445,3.44499999999971,18,313.497822931812,NA,"role_play","LIAM",1,0,0,0
"1343","Fall_Conclave",6,73,1343,"second_half_rp","MATT","oh!",9605.445,9606.561,1.11599999999999,2,107.526881720432,NA,"role_play","MATT",0,0,0,1
"1344","Fall_Conclave",6,73,1344,"second_half_rp","LIAM","there it is, it's right there. invisible fucking larkin dwarf dragon.",9606.561,9610.29,3.72900000000118,13,209.171359613771,NA,"role_play","LIAM",1,0,0,0
"1345","Fall_Conclave",6,73,1345,"second_half_rp","MATT","you don't see anybody else around.",9610.29,9611.899,1.60899999999856,8,298.321939092871,NA,"role_play","MATT",0,0,0,1
"1346","Fall_Conclave",6,73,1346,"second_half_rp","LIAM","all right. that's a 20.",9611.899,9613.081,1.1820000000007,7,355.329949238369,NA,"role_play","LIAM",1,0,0,0
"1347","Fall_Conclave",6,73,1347,"second_half_rp","LAURA","should we continue this conversation downstairs?",9613.081,9616.485,3.40400000000045,7,123.38425381902,NA,"role_play","LAURA",1,0,0,0
"1348","Fall_Conclave",6,73,1348,"second_half_rp","TALIESIN","first, is everybody who they say they are? please, if you would be so kind.",9616.485,9619.883,3.39799999999923,16,282.519128899417,NA,"role_play","TALIESIN",1,0,0,0
"1349","Fall_Conclave",6,73,1349,"second_half_rp","TRAVIS","oh yeah, allura. can we light your sage real quick, make sure everybody's on the up and up?",9619.883,9623.944,4.06099999999969,20,295.493720758456,NA,"role_play","TRAVIS",1,0,0,0
"1350","Fall_Conclave",6,73,1350,"second_half_rp","MATT","allura sits up and says, ""well, i mean, it makes sense. asum is the one that requested we not ""move the war room down to the""",9623.944,9633.803,9.85900000000038,27,164.316867836488,NA,"role_play","MATT",0,0,0,1
"1351","Fall_Conclave",6,73,1351,"second_half_rp","TALIESIN","so why don't we move the war room now?",9633.803,9636.373,2.56999999999971,11,256.80933852143,NA,"role_play","TALIESIN",1,0,0,0
"1352","Fall_Conclave",6,73,1352,"second_half_rp","MATT","""i think that would be the best, yes. let us all adjourn to the new space at the ziggurat. that ""should at least keep things honest.""",9636.373,9645.196,8.82300000000032,28,190.411424685474,NA,"role_play","MATT",0,0,0,1
"1353","Fall_Conclave",6,73,1353,"second_half_rp","TRAVIS","yeah.",9645.196,9646.376,1.18000000000029,2,101.694915254212,NA,"role_play","TRAVIS",1,0,0,0
"1354","Fall_Conclave",6,73,1354,"second_half_rp","MATT","allura picks her robes up and",9646.376,9649.392,3.01599999999962,6,119.363395225479,NA,"role_play","MATT",0,0,0,1
"1355","Fall_Conclave",6,73,1355,"second_half_rp","SAM","grog, your beard might go away.",9649.392,9651.547,2.15500000000065,7,194.895591647273,NA,"role_play","SAM",1,0,0,0
"1356","Fall_Conclave",6,73,1356,"second_half_rp","LAURA","no!",9651.547,9653.648,2.10099999999875,2,57.1156592099341,NA,"role_play","LAURA",1,0,0,0
"1357","Fall_Conclave",6,73,1357,"second_half_rp","TRAVIS","no, it's in there.",9653.648,9655.281,1.63300000000163,6,220.453153704618,NA,"role_play","TRAVIS",1,0,0,0
"1358","Fall_Conclave",6,73,1358,"second_half_rp","TALIESIN","it just won't grow while he's down there.",9655.281,9657.574,2.29299999999967,11,287.832533798559,NA,"role_play","TALIESIN",1,0,0,0
"1359","Fall_Conclave",6,73,1359,"second_half_rp","LIAM","i mean for science, right? let's go. you look really good without a beard, grog. i've always thought so.",9657.574,9665.119,7.54500000000007,22,174.950298210734,NA,"role_play","LIAM",1,0,0,0
"1360","Fall_Conclave",6,73,1360,"second_half_rp","TRAVIS","you shut up, you.",9665.119,9666.425,1.30599999999868,5,229.709035222285,NA,"role_play","TRAVIS",1,0,0,0
"1361","Fall_Conclave",6,73,1361,"second_half_rp","TRAVIS","we can go down there, i don't care.",9668.379,9672.249,3.86999999999898,10,155.038759689963,NA,"role_play","TRAVIS",1,0,0,0
"1362","Fall_Conclave",6,73,1362,"second_half_rp","TALIESIN","all right.",9672.249,9674.314,2.06500000000051,3,87.1670702178962,NA,"role_play","TALIESIN",1,0,0,0
"1363","Fall_Conclave",6,73,1363,"second_half_rp","MATT","okay. you guys make your way down to the ziggurat. the guards come and start carrying chairs and other elements of the war room. eventually, you're all led down through the tunnels, which have been a little more refined and given an actual more comfortable path past the now-defunct whitestone refinery that the briarwoods had originally established. you enter the ziggurat room. it has more lighting to it than it previously did. a number of torches now line the walls, the sconces that are lit as the guards progress upward. you can see the reflection to the green glass-like whitestone material that permeates the outside of the ziggurat. and not right by it, but partially upward there's a small wooden platform that's been where the main base of operations for research and study is here. you see a number of desks set out. it's been built alongside of the large pyramid-type structure. and eventually, you all adjourn up into that space. as you go up there, you all feel a significant drop in enchantment. all of your magical items, all of everything, gradually fades in this space. so, grog, you actually feel your musculature the titanstone gauntlets themselves, the effect begins to completely fade back to your classic, grog-like strength.",9674.314,9760.441,86.1270000000004,219,152.565397610505,NA,"role_play","MATT",0,0,0,1
"1364","Fall_Conclave",6,73,1364,"second_half_rp","TRAVIS","i feel totally fine.",9760.441,9762.401,1.95999999999913,5,153.061224489864,NA,"role_play","TRAVIS",1,0,0,0
"1365","Fall_Conclave",6,73,1365,"second_half_rp","LAURA","are the walls still like people?",9762.401,9765.914,3.51300000000083,7,119.555935098178,NA,"role_play","LAURA",1,0,0,0
"1366","Fall_Conclave",6,73,1366,"second_half_rp","MATT","oh, do you want to go to the top of the ziggurat and check?",9765.914,9768.627,2.71299999999974,15,331.736085514223,NA,"role_play","MATT",0,0,0,1
"1367","Fall_Conclave",6,73,1367,"second_half_rp","MARISHA","oh.",9768.627,9771.126,2.4989999999998,2,48.0192076830771,NA,"role_play","MARISHA",1,0,0,0
"1368","Fall_Conclave",6,73,1368,"second_half_rp","TALIESIN","not yet. after the meeting.",9771.126,9773.426,2.29999999999927,6,156.521739130484,NA,"role_play","TALIESIN",1,0,0,0
"1369","Fall_Conclave",6,73,1369,"second_half_rp","MARISHA","did they have like a clean-up crew down there?",9773.426,9776.734,3.3080000000009,11,199.516324062823,NA,"role_play","MARISHA",1,0,0,0
"1370","Fall_Conclave",6,73,1370,"second_half_rp","TALIESIN","it's a guy on a scaffold with a scrub brush going, ""ew. ew.""",9776.734,9782.608,5.8739999999998,15,153.217568947911,NA,"role_play","TALIESIN",1,0,0,0
"1371","Fall_Conclave",6,73,1371,"second_half_rp","LAURA","they're really clean naked bodies now.",9782.608,9784.965,2.35699999999997,8,203.648705982183,NA,"role_play","LAURA",1,0,0,0
"1372","Fall_Conclave",6,73,1372,"second_half_rp","LIAM","brush cleaning out the fingernails.",9784.965,9786.563,1.59799999999996,6,225.281602002509,NA,"role_play","LIAM",1,0,0,0
"1373","Fall_Conclave",6,73,1373,"second_half_rp","MATT","at this point, they're looking around. everyone who's journeyed with you towards this new meeting place, the ziggurat, is of the same physicality they were at the meeting room. any illusions that would have been cast aside or dispelled at this point seem to not be present. so everyone is, by all intents and purposes, who they say they are.",9786.563,9806.521,19.9580000000005,63,189.397735244007,NA,"role_play","MATT",0,0,0,1
"1374","Fall_Conclave",6,73,1374,"second_half_rp","SAM","okay.",9806.521,9808.045,1.52399999999943,2,78.7401574803443,NA,"role_play","SAM",1,0,0,0
"1375","Fall_Conclave",6,73,1375,"second_half_rp","TALIESIN","and this also means it would probably be impossible to scry in this room.",9808.045,9812.491,4.44599999999991,15,202.429149797575,NA,"role_play","TALIESIN",1,0,0,0
"1376","Fall_Conclave",6,73,1376,"second_half_rp","MARISHA","yes.",9812.525,9814.108,1.58300000000054,2,75.8054327226527,NA,"role_play","MARISHA",1,0,0,0
"1377","Fall_Conclave",6,73,1377,"second_half_rp","MATT","allura nods. ""yes, actually. yes.""",9814.108,9817.156,3.04800000000068,6,118.110236220446,NA,"role_play","MATT",0,0,0,1
"1378","Fall_Conclave",6,73,1378,"second_half_rp","TALIESIN","excellent. this is where all talk must happen now.",9817.156,9823.36,6.20399999999972,10,96.7117988394627,NA,"role_play","TALIESIN",1,0,0,0
"1379","Fall_Conclave",6,73,1379,"second_half_rp","LAURA","where it should have been happening.",9823.36,9825.737,2.37699999999859,7,176.693310896192,NA,"role_play","LAURA",1,0,0,0
"1380","Fall_Conclave",6,73,1380,"second_half_rp","TALIESIN","so now you know what we've been dealing with for the past 72 hours. she did help with the death of that dragon. in fact, i doubt we would have survived without her aid. she could have very easily left us there to die.",9825.737,9840.457,14.7200000000012,46,187.499999999985,NA,"role_play","TALIESIN",1,0,0,0
"1381","Fall_Conclave",6,73,1381,"second_half_rp","LAURA","it's true. she actually revealed her entire form during the battle. which is quite diseased.",9840.457,9850.288,9.83100000000013,17,103.753433018003,NA,"role_play","LAURA",1,0,0,0
"1382","Fall_Conclave",6,73,1382,"second_half_rp","TALIESIN","at least it appeared diseased.",9850.288,9853.561,3.27299999999923,6,109.990834097184,NA,"role_play","TALIESIN",1,0,0,0
"1383","Fall_Conclave",6,73,1383,"second_half_rp","MARISHA","she's definitely not as strong as the others, but far more clever.",9853.561,9857.977,4.41600000000108,14,190.217391304301,NA,"role_play","MARISHA",1,0,0,0
"1384","Fall_Conclave",6,73,1384,"second_half_rp","TALIESIN","and she knows where we are. and what our plans are. and every inch of this place. including this thing.",9857.977,9869.767,11.7899999999991,21,106.870229007642,NA,"role_play","TALIESIN",1,0,0,0
"1385","Fall_Conclave",6,73,1385,"second_half_rp","MATT","""well then, what do you presume we do?""",9869.767,9877.21,7.4429999999993,10,80.6126561870289,NA,"role_play","MATT",0,0,0,1
"1386","Fall_Conclave",6,73,1386,"second_half_rp","SAM","we don't really have a choice, we have to work with her to some extent. we can make it hard for her, and we can be assholes to her, and go tell her to get asum for us. but other than that, we have to work with her.",9877.21,9891.323,14.1130000000012,50,212.569970948753,NA,"role_play","SAM",1,0,0,0
"1387","Fall_Conclave",6,73,1387,"second_half_rp","LIAM","what's the benefit of working with her?",9891.323,9894.147,2.82400000000052,9,191.218130311579,NA,"role_play","LIAM",1,0,0,0
"1388","Fall_Conclave",6,73,1388,"second_half_rp","SAM","because if we don't, she can destroy whitestone whenever she feels like it.",9894.147,9898.054,3.90699999999924,15,230.35577169188,NA,"role_play","SAM",1,0,0,0
"1389","Fall_Conclave",6,73,1389,"second_half_rp","LIAM","what if we tell her we're going to fake her death, and then we kill her for real?",9898.054,9901.731,3.67699999999968,20,326.353005167284,NA,"role_play","LIAM",1,0,0,0
"1390","Fall_Conclave",6,73,1390,"second_half_rp","SAM","that's fine, if she ever gets close enough for us to kill her.",9901.731,9905.037,3.30600000000049,15,272.232304900141,NA,"role_play","SAM",1,0,0,0
"1391","Fall_Conclave",6,73,1391,"second_half_rp","TALIESIN","she's not going to.",9905.037,9906.422,1.38500000000022,6,259.927797833894,NA,"role_play","TALIESIN",1,0,0,0
"1392","Fall_Conclave",6,73,1392,"second_half_rp","TRAVIS","she evaded it really easy.",9906.422,9908.593,2.17100000000028,6,165.822201750324,NA,"role_play","TRAVIS",1,0,0,0
"1393","Fall_Conclave",6,73,1393,"second_half_rp","SAM","why would she need to come face to face with us in that plan, ever? she could say, ""i'm going ""to go meet them in kymal. oh, i died!""",9908.593,9916.995,8.40200000000004,31,221.375862889787,NA,"role_play","SAM",1,0,0,0
"1394","Fall_Conclave",6,73,1394,"second_half_rp","TALIESIN","our best bet is maybe hopefully enough of us still have our strength. maybe at the end if she has been ravaged by the red dragon.",9916.995,9925.778,8.78299999999945,27,184.447227598782,NA,"role_play","TALIESIN",1,0,0,0
"1395","Fall_Conclave",6,73,1395,"second_half_rp","TRAVIS","i agree.",9925.778,9928.122,2.34399999999914,3,76.7918088737483,NA,"role_play","TRAVIS",1,0,0,0
"1396","Fall_Conclave",6,73,1396,"second_half_rp","LAURA","and then we try to defeat her after that?",9928.122,9930.495,2.37300000000141,10,252.844500631961,NA,"role_play","LAURA",1,0,0,0
"1397","Fall_Conclave",6,73,1397,"second_half_rp","TRAVIS","i agree. our play is the finish line. that's it. not a moment before.",9930.495,9934.614,4.11899999999878,16,233.066278222939,NA,"role_play","TRAVIS",1,0,0,0
"1398","Fall_Conclave",6,73,1398,"second_half_rp","LAURA","but we have to beat her to it. if she gets a hold of that stone",9934.614,9937.428,2.81400000000031,16,341.151385927468,NA,"role_play","LAURA",1,0,0,0
"1399","Fall_Conclave",6,73,1399,"second_half_rp","MARISHA","it's what she wants.",9937.428,9939.773,2.34499999999935,6,153.51812366742,NA,"role_play","MARISHA",1,0,0,0
"1400","Fall_Conclave",6,73,1400,"second_half_rp","LAURA","yes.",9939.773,9940.74,0.967000000000553,2,124.095139606961,NA,"role_play","LAURA",1,0,0,0
"1401","Fall_Conclave",6,73,1401,"second_half_rp","TALIESIN","our hope is to break the stone.",9940.74,9942.006,1.26599999999962,8,379.146919431393,NA,"role_play","TALIESIN",1,0,0,0
"1402","Fall_Conclave",6,73,1402,"second_half_rp","MARISHA","we can't break the stone.",9942.006,9943.447,1.44100000000071,7,291.464260929766,NA,"role_play","MARISHA",1,0,0,0
"1403","Fall_Conclave",6,73,1403,"second_half_rp","TALIESIN","only because no one has.",9943.447,9945.425,1.97799999999916,6,182.002022244769,NA,"role_play","TALIESIN",1,0,0,0
"1404","Fall_Conclave",6,73,1404,"second_half_rp","SAM","if we draw thordak to us, at least we control the battlefield. she could still be lying in wait to pounce on his body the second we kill him.",9945.425,9952.747,7.32200000000012,30,245.834471455882,NA,"role_play","SAM",1,0,0,0
"1405","Fall_Conclave",6,73,1405,"second_half_rp","LIAM","if. we have to hope that she's actually going to fight with us. she's done it once. we don't know that she's going to do it again. we don't know.",9952.747,9963.927,11.1800000000003,36,193.202146690514,NA,"role_play","LIAM",1,0,0,0
"1406","Fall_Conclave",6,73,1406,"second_half_rp","MARISHA","they mentioned moving the stone that shouldn't have been able to have been moved. correct? they moved it inside of thordak, and then thordak left with the stone in him, right?",9963.927,9978.296,14.3690000000006,33,137.7966455564,NA,"role_play","MARISHA",1,0,0,0
"1407","Fall_Conclave",6,73,1407,"second_half_rp","TALIESIN","yes, which i don't think should have been possible.",9978.296,9981.067,2.77099999999882,11,238.181162035468,NA,"role_play","TALIESIN",1,0,0,0
"1408","Fall_Conclave",6,73,1408,"second_half_rp","MARISHA","right. so how did they do it? because i'm also looking at another thing that is supposedly immovable.",9981.067,9990.857,9.79000000000087,20,122.574055158314,NA,"role_play","MARISHA",1,0,0,0
"1409","Fall_Conclave",6,73,1409,"second_half_rp","TALIESIN","laura, marisha, and supposedly.",9990.857,9994.767,3.90999999999985,5,76.7263427110003,NA,"role_play","TALIESIN",1,0,0,0
"1410","Fall_Conclave",6,73,1410,"second_half_rp","TALIESIN","oh, it's possible. nothing is impossible.",9994.767,9997.873,3.10599999999977,8,154.53960077271,NA,"role_play","TALIESIN",1,0,0,0
"1411","Fall_Conclave",6,73,1411,"second_half_rp","LAURA","are you suggesting we put the vortex of doom inside one of us?",9997.873,10001.089,3.21600000000035,14,261.194029850718,NA,"role_play","LAURA",1,0,0,0
"1412","Fall_Conclave",6,73,1412,"second_half_rp","MARISHA","kind of, yeah. that's what i was",10001.089,10003.272,2.1830000000009,8,219.880897846909,NA,"role_play","MARISHA",1,0,0,0
"1413","Fall_Conclave",6,73,1413,"second_half_rp","MATT","allura immediately puts her hands up and goes, ""no! no. no. no.""",10003.272,10009.322,6.04999999999927,13,128.925619834726,NA,"role_play","MATT",0,0,0,1
"1414","Fall_Conclave",6,73,1414,"second_half_rp","MARISHA","there's got to be a way to move it.",10009.322,10010.977,1.65500000000065,11,398.791540785341,NA,"role_play","MARISHA",1,0,0,0
"1415","Fall_Conclave",6,73,1415,"second_half_rp","SAM","to do what, though?",10010.977,10012.329,1.35199999999895,5,221.893491124432,NA,"role_play","SAM",1,0,0,0
"1416","Fall_Conclave",6,73,1416,"second_half_rp","MATT","""this is an absence of magic. it is a void of magic. it is a maw that devours magic. the ""enchantment that we put within thordak is pure magic.""",10012.329,10019.612,7.28299999999945,31,255.389262666503,NA,"role_play","MATT",0,0,0,1
"1417","Fall_Conclave",6,73,1417,"second_half_rp","LIAM","and you've been working on it for months, and you are smarter than us.",10019.612,10022.716,3.10400000000118,16,309.278350515346,NA,"role_play","LIAM",1,0,0,0
"1418","Fall_Conclave",6,73,1418,"second_half_rp","MATT","""well.""",10022.716,10024.151,1.43499999999949,3,125.435540069731,NA,"role_play","MATT",0,0,0,1
"1419","Fall_Conclave",6,73,1419,"second_half_rp","LAURA","right. no way to transport it? none at all?",10024.151,10027.483,3.33200000000033,10,180.072028811507,NA,"role_play","LAURA",1,0,0,0
"1420","Fall_Conclave",6,73,1420,"second_half_rp","MARISHA","it could be the only thing that could break the stone!",10027.483,10030.273,2.78999999999905,12,258.06451612912,NA,"role_play","MARISHA",1,0,0,0
