"","arc","arc_no","episode","turn_number","segment","actor","text","start_turn","end_turn","time_in_sec","word_count","words_per_minute","encounter_count","rp_combat","actor_guest","vox_machina","guest","staff","matt"
"971","Fall_Conclave",6,73,971,"first_half_rp","TRAVIS","this is true. we have the herd, we can go get the werewolves.",5742.879,5747.665,4.78600000000006,14,175.51190973673,NA,"role_play","TRAVIS",1,0,0,0
"972","Fall_Conclave",6,73,972,"first_half_rp","SAM","the ravenites would help.",5747.665,5752.411,4.74600000000009,5,63.2111251580266,NA,"role_play","SAM",1,0,0,0
"973","Fall_Conclave",6,73,973,"first_half_rp","MARISHA","everyone who we ask, everyone who we send in there, we're sending in to their death.",5752.411,5756.445,4.03399999999965,18,267.724343083811,NA,"role_play","MARISHA",1,0,0,0
"974","Fall_Conclave",6,73,974,"first_half_rp","TALIESIN","this is war.",5756.445,5758.681,2.23599999999988,4,107.334525939183,NA,"role_play","TALIESIN",1,0,0,0
"975","Fall_Conclave",6,73,975,"first_half_rp","TRAVIS","yeah, but it's either death now or death a little later.",5758.681,5763.489,4.80799999999999,13,162.229617304493,NA,"role_play","TRAVIS",1,0,0,0
"976","Fall_Conclave",6,73,976,"first_half_rp","LAURA","we're sending ourselves as well.",5763.489,5765.334,1.84500000000025,7,227.642276422733,NA,"role_play","LAURA",1,0,0,0
"977","Fall_Conclave",6,73,977,"first_half_rp","LIAM","so, are we talking about sending everyone we know and everything we have to the outskirts of town",5765.334,5770.212,4.87800000000061,18,221.402214022113,NA,"role_play","LIAM",1,0,0,0
"978","Fall_Conclave",6,73,978,"first_half_rp","SAM","for a full frontal attack. while we bamf into the dragon's lair.",5770.212,5774.314,4.10199999999986,14,204.778156996594,NA,"role_play","SAM",1,0,0,0
"979","Fall_Conclave",6,73,979,"first_half_rp","LIAM","yeah. we create a massive fucking clusterfuck on the edge of his periphery and we go for the center.",5774.314,5782.616,8.30199999999968,20,144.543483497958,NA,"role_play","LIAM",1,0,0,0
"980","Fall_Conclave",6,73,980,"first_half_rp","LAURA","how long did it take you, allura, to create that heart?",5782.616,5787.696,5.07999999999993,12,141.732283464569,NA,"role_play","LAURA",1,0,0,0
"981","Fall_Conclave",6,73,981,"first_half_rp","MATT","""well. the design and the development and enchantment of it are powerful enough to anchor ""itself to the soul of a dragon of thordak's strength. better part of six months.""",5787.696,5801.605,13.9089999999997,33,142.353871593936,NA,"role_play","MATT",0,0,0,1
"982","Fall_Conclave",6,73,982,"first_half_rp","LAURA AND LIAM","six months.",5801.605,5803.773,2.16800000000057,3,83.0258302582806,NA,"role_play","LAURA AND LIAM",1,0,0,0
"983","Fall_Conclave",6,73,983,"first_half_rp","LIAM","we've probably got a week or two.",5803.773,5805.315,1.54199999999946,9,350.194552529305,NA,"role_play","LIAM",1,0,0,0
"984","Fall_Conclave",6,73,984,"first_half_rp","MATT","""and that was with a dozen other hands helping me. most of the arcana pansophical was at ""my side for that and we don't have that kind of time.""",5805.315,5816.892,11.5770000000002,32,165.846074112461,NA,"role_play","MATT",0,0,0,1
"985","Fall_Conclave",6,73,985,"first_half_rp","LIAM","well, we take a day or two and we amass every heavy fucking hitter we have, and we do this. what other choice do we have?",5816.892,5825.883,8.99099999999999,27,180.18018018018,NA,"role_play","LIAM",1,0,0,0
"986","Fall_Conclave",6,73,986,"first_half_rp","MARISHA","i keep thinking back to emon where we watched half of our friends die in a second.",5825.883,5829.802,3.91899999999987,18,275.580505230935,NA,"role_play","MARISHA",1,0,0,0
"987","Fall_Conclave",6,73,987,"first_half_rp","LIAM","a lot of us are going to die.",5829.802,5833.084,3.28200000000015,9,164.533820840943,NA,"role_play","LIAM",1,0,0,0
"988","Fall_Conclave",6,73,988,"first_half_rp","MATT","cassandra sits up a little bit in her seat and goes, ""if we are smart about this, we can ""minimize the casualties far more now than they would be a week, two weeks, a month, a year from now.""",5833.084,5845.901,12.817,40,187.251306858079,NA,"role_play","MATT",0,0,0,1
"989","Fall_Conclave",6,73,989,"first_half_rp","TRAVIS","i agree.",5845.901,5847.461,1.5600000000004,3,115.384615384586,NA,"role_play","TRAVIS",1,0,0,0
"990","Fall_Conclave",6,73,990,"first_half_rp","TALIESIN","what of whitestone? we put the city at great risk. how much risk are we willing to take?",5847.461,5856.79,9.32899999999972,19,122.199592668028,NA,"role_play","TALIESIN",1,0,0,0
"991","Fall_Conclave",6,73,991,"first_half_rp","LIAM","percy, everywhere is at great risk right now.",5856.79,5860.127,3.33700000000044,9,161.821995804593,NA,"role_play","LIAM",1,0,0,0
"992","Fall_Conclave",6,73,992,"first_half_rp","MARISHA","it's true.",5860.127,5861.483,1.35599999999977,4,176.991150442508,NA,"role_play","MARISHA",1,0,0,0
"993","Fall_Conclave",6,73,993,"first_half_rp","TRAVIS","we should leave whitestone.",5861.483,5863.824,2.34099999999944,5,128.150363092726,NA,"role_play","TRAVIS",1,0,0,0
"994","Fall_Conclave",6,73,994,"first_half_rp","SAM","but even getting to emon, aren't we exposing ourselves to detection and attack?",5863.824,5874.476,10.652,15,84.4911753661281,NA,"role_play","SAM",1,0,0,0
"995","Fall_Conclave",6,73,995,"first_half_rp","TRAVIS","we are if we wait.",5874.476,5876.015,1.53900000000067,6,233.918128654869,NA,"role_play","TRAVIS",1,0,0,0
"996","Fall_Conclave",6,73,996,"first_half_rp","SAM","we're going to march several armies across the entire continent to get there? it'll take days.",5876.015,5880.12,4.10499999999956,19,277.710109622441,NA,"role_play","SAM",1,0,0,0
"997","Fall_Conclave",6,73,997,"first_half_rp","LAURA","how do we get armies there?",5880.12,5881.726,1.60599999999977,7,261.519302615231,NA,"role_play","LAURA",1,0,0,0
"998","Fall_Conclave",6,73,998,"first_half_rp","LIAM","we're going to take a day or two. we're going to figure out how to get who we have to where we need. we're not doing this tomorrow. in a couple of days. three days. four days at the most. it's not ideal, but it's what we have to do.",5881.726,5896.698,14.9720000000007,56,224.418915308566,NA,"role_play","LIAM",1,0,0,0
"999","Fall_Conclave",6,73,999,"first_half_rp","SAM","we can at least move people to, you know. where's that town that was established?",5896.698,5903.692,6.99399999999969,17,145.83929082071,NA,"role_play","SAM",1,0,0,0
"1000","Fall_Conclave",6,73,1000,"first_half_rp","TRAVIS","outside of westruun?",5903.692,5906.4,2.70799999999963,4,88.6262924667773,NA,"role_play","TRAVIS",1,0,0,0
"1001","Fall_Conclave",6,73,1001,"first_half_rp","MATT","there's westruun, kymal were the two that you moved",5906.4,5908.973,2.57300000000032,10,233.19082782741,NA,"role_play","MATT",0,0,0,1
"1002","Fall_Conclave",6,73,1002,"first_half_rp","SAM","westruun is close-ish, right, to emon?",5908.973,5911.133,2.15999999999985,8,222.222222222237,NA,"role_play","SAM",1,0,0,0
"1003","Fall_Conclave",6,73,1003,"first_half_rp","MATT","westruun's a little bit further than kymal is. kymal is where you sent a lot of the westruun refugees.",5911.133,5921.166,10.0330000000004,21,125.585567626827,NA,"role_play","MATT",0,0,0,1
"1004","Fall_Conclave",6,73,1004,"first_half_rp","TRAVIS","right.",5921.166,5922.082,0.916000000000167,2,131.004366812203,NA,"role_play","TRAVIS",1,0,0,0
"1005","Fall_Conclave",6,73,1005,"first_half_rp","LAURA","but they're just townsfolk.",5922.082,5923.4,1.3179999999993,6,273.14112291365,NA,"role_play","LAURA",1,0,0,0
"1006","Fall_Conclave",6,73,1006,"first_half_rp","SAM","but we can at least assemble there, from all the different territories, and then meet up, form a plan, and then march from there.",5923.4,5932.982,9.58200000000033,25,156.543519098304,NA,"role_play","SAM",1,0,0,0
"1007","Fall_Conclave",6,73,1007,"first_half_rp","LAURA","march on emon? if we gather our forces, thordak will notice.",5932.982,5940.772,7.78999999999996,12,92.4261874197694,NA,"role_play","LAURA",1,0,0,0
"1008","Fall_Conclave",6,73,1008,"first_half_rp","TRAVIS","yeah, we've got to do a lot of recon before then. but i think he's got a good point, right? we've got to have like a staging point.",5940.772,5947.981,7.20899999999983,32,266.333749479823,NA,"role_play","TRAVIS",1,0,0,0
"1009","Fall_Conclave",6,73,1009,"first_half_rp","MATT","cassandra turns, looks over to asum and goes, ""recon, actually. anything else, asum, you ""may have in regards to what we can expect there?"" asum is still slowly walking around the peripheral of the meeting table. ""i can tell you that most of the city's wealth and resources, as well as ""caches, sealed arcane relics, and weaponry, long held by the lyceum or the arms of emon, have been ""stolen and thrown atop the victory hoard of thordak. most who are part of this rebellion ""within the city are doing so with scraps. that is why the clasp has been so instrumental in the ""removal of many of the oppressed folk within the city. also, the fire that marks thordak's presence ""that have drawn fire and molten rock across the city, as well as the outskirts of the city walls, ""scar the landscape and fill the sky with sulfurous clouds and black smoke. the good news is that ""smoke can be utilized, should someone have some control over the elements, to be a screen. ""however, where the cloudtop district once stood, there is now but a heated cauldron of glowing ""stone and flame. hundreds of gifts and statues left in thordak's image litter the outer area, ""while a massive cavern dives beneath the central region of the district. now this cavern, as we've ""watched it, we believe it to be the location of thordak's treasure vault. as well as the ""occasional sleeping place of the massive drake we speak of. thordak is also showing rather intense ""signs of physical change since being released from his prison. and his size still remains enormous by ""comparison. his eyes now burn with a searing white light. burning stars in the sky. his jaw ever ""dribbles with burning liquid that blackens the ground it touches. the gaps between scales appear ""to flare bright with each breath, like a star engine beneath the scales.""",5947.981,6081.737,133.756,325,145.787852507551,NA,"role_play","MATT",0,0,0,1
"1010","Fall_Conclave",6,73,1010,"first_half_rp","MARISHA","sorry.",6081.737,6085.21,3.47299999999996,2,34.5522602936946,NA,"role_play","MARISHA",1,0,0,0
"1011","Fall_Conclave",6,73,1011,"first_half_rp","LAURA","bless you.",6085.21,6086.405,1.19499999999971,3,150.627615062798,NA,"role_play","LAURA",1,0,0,0
"1012","Fall_Conclave",6,73,1012,"first_half_rp","MARISHA","yeah. sorry.",6086.405,6088.177,1.77199999999993,3,101.580135440184,NA,"role_play","MARISHA",1,0,0,0
"1013","Fall_Conclave",6,73,1013,"first_half_rp","LAURA","do you think it's overtaking him?",6088.177,6090.284,2.10699999999997,8,227.812055054583,NA,"role_play","LAURA",1,0,0,0
"1014","Fall_Conclave",6,73,1014,"first_half_rp","MATT","""i've no idea. allura?"" and allura goes, ""well, if the anchor was indeed removed from the ""fire elemental plane, then thordak would have had his soul torn from his body. that is how the ""anchor worked.""",6090.284,6114.931,24.6469999999999,39,94.9405607173289,NA,"role_play","MATT",0,0,0,1
"1015","Fall_Conclave",6,73,1015,"first_half_rp","MARISHA","so you don't think he actually even fully separated from the plane, he brought the plane with him.",6114.931,6120.093,5.16200000000026,20,232.468035645087,NA,"role_play","MARISHA",1,0,0,0
"1016","Fall_Conclave",6,73,1016,"first_half_rp","MATT","""or at least, maybe a piece. i wasn't there, i don't know the ritual that brought him over.""",6120.093,6125.373,5.27999999999975,22,250.000000000012,NA,"role_play","MATT",0,0,0,1
"1017","Fall_Conclave",6,73,1017,"first_half_rp","MARISHA","maybe then we're looking at this the wrong way. maybe we go at this through the fire plane. maybe there's something still there.",6125.373,6132.033,6.66000000000076,26,234.234234234207,NA,"role_play","MARISHA",1,0,0,0
"1018","Fall_Conclave",6,73,1018,"first_half_rp","TALIESIN","a way to sever his connection to the fire plane, maybe.",6132.033,6134.286,2.2529999999997,12,319.573901464756,NA,"role_play","TALIESIN",1,0,0,0
"1019","Fall_Conclave",6,73,1019,"first_half_rp","MARISHA","yeah.",6134.286,6135.864,1.57799999999952,2,76.045627376449,NA,"role_play","MARISHA",1,0,0,0
"1020","Fall_Conclave",6,73,1020,"first_half_rp","MATT","allura thinks for a second.",6135.864,6137.675,1.8110000000006,6,198.785201546041,NA,"role_play","MATT",0,0,0,1
"1021","Fall_Conclave",6,73,1021,"first_half_rp","MARISHA","we've got an easy door in.",6137.675,6141.473,3.79799999999977,8,126.382306477101,NA,"role_play","MARISHA",1,0,0,0
"1022","Fall_Conclave",6,73,1022,"first_half_rp","MATT","""i could try. but the enchantment itself we don't have enough information. it wasn't bound ""to a specific place in the plane, it was bound to the plane itself. i don't know how you'd sever it ""from the other side.""",6141.473,6159.192,17.7190000000001,46,155.764998024719,NA,"role_play","MATT",0,0,0,1
"1023","Fall_Conclave",6,73,1023,"first_half_rp","TRAVIS","from the other side, we'd have to go there.",6159.192,6164.161,4.96900000000005,11,132.823505735559,NA,"role_play","TRAVIS",1,0,0,0
"1024","Fall_Conclave",6,73,1024,"first_half_rp","SAM","yeah.",6164.161,6165.124,0.962999999999738,2,124.610591900345,NA,"role_play","SAM",1,0,0,0
"1025","Fall_Conclave",6,73,1025,"first_half_rp","TRAVIS","that's called thinking outside the circle.",6165.124,6166.955,1.83100000000013,8,262.151829601292,NA,"role_play","TRAVIS",1,0,0,0
"1026","Fall_Conclave",6,73,1026,"first_half_rp","SAM","but then once we're there, what do we do?",6166.955,6169.22,2.26500000000033,11,291.390728476779,NA,"role_play","SAM",1,0,0,0
"1027","Fall_Conclave",6,73,1027,"first_half_rp","MARISHA","and we don't even know where to look. i mean, we could at least talk to the ashari there. they might",6169.22,6175.637,6.41699999999946,22,205.703599813014,NA,"role_play","MARISHA",1,0,0,0
"1028","Fall_Conclave",6,73,1028,"first_half_rp","TALIESIN","another ally.",6175.637,6176.848,1.21100000000024,3,148.637489677923,NA,"role_play","TALIESIN",1,0,0,0
"1029","Fall_Conclave",6,73,1029,"first_half_rp","TRAVIS","is there like nothing friendly in the fire plane?",6176.848,6179.908,3.0600000000004,10,196.078431372523,NA,"role_play","TRAVIS",1,0,0,0
"1030","Fall_Conclave",6,73,1030,"first_half_rp","LIAM","it's at least as big as tal'dorei. i mean, it's another dimension.",6179.908,6182.812,2.90399999999954,16,330.578512396746,NA,"role_play","LIAM",1,0,0,0
"1031","Fall_Conclave",6,73,1031,"first_half_rp","LAURA","it's huge.",6182.812,6183.956,1.14400000000023,4,209.790209790167,NA,"role_play","LAURA",1,0,0,0
"1032","Fall_Conclave",6,73,1032,"first_half_rp","MARISHA","it's huge, but not many people know the whereabouts. there's still locations and destinations within the fire plane. it's navigable.",6183.956,6192.317,8.36099999999988,24,172.22820236814,NA,"role_play","MARISHA",1,0,0,0
"1033","Fall_Conclave",6,73,1033,"first_half_rp","LAURA","maybe all the evil things in the fire plane are gone right now and they're with thordak.",6192.317,6196.817,4.5,19,253.333333333333,NA,"role_play","LAURA",1,0,0,0
"1034","Fall_Conclave",6,73,1034,"first_half_rp","MATT","asum steps forward to the table, and puts his little halfling hands on the edge and goes, ""well, it's a shame that we don't have any information about this ritual that freed him from ""the plane.""",6196.817,6210.922,14.1049999999996,39,165.898617511526,NA,"role_play","MATT",0,0,0,1
"1035","Fall_Conclave",6,73,1035,"first_half_rp","LAURA","that is a shame. a real shame.",6210.922,6216.004,5.08200000000033,8,94.4510035419064,NA,"role_play","LAURA",1,0,0,0
"1036","Fall_Conclave",6,73,1036,"first_half_rp","MATT","""i'll see if my compatriots can gather information, but in the meantime we'll do the best ""we can to gather similar information.""",6216.004,6225.253,9.2489999999998,26,168.666882906264,NA,"role_play","MATT",0,0,0,1
"1037","Fall_Conclave",6,73,1037,"first_half_rp","LIAM","well, we know we don't have a lot of time, but do we maybe want to table this and think on it?",6225.253,6231.399,6.14600000000064,24,234.29873088185,NA,"role_play","LIAM",1,0,0,0
"1038","Fall_Conclave",6,73,1038,"first_half_rp","SAM","at the very least, should we send out some letters, alerting our allies that",6231.399,6236.434,5.03499999999985,14,166.832174776569,NA,"role_play","SAM",1,0,0,0
"1039","Fall_Conclave",6,73,1039,"first_half_rp","LAURA","shit's going down.",6236.434,6237.819,1.38500000000022,5,216.606498194912,NA,"role_play","LAURA",1,0,0,0
"1040","Fall_Conclave",6,73,1040,"first_half_rp","SAM","it's time to start stocking up and getting ready to move?",6237.819,6242.83,5.01099999999951,13,155.657553382574,NA,"role_play","SAM",1,0,0,0
"1041","Fall_Conclave",6,73,1041,"first_half_rp","MATT","drake steps forward and goes, ""i think that's a fine plan of action. reach out to all ""those you brought in. hopefully we can get a few of our friends in this as well.""",6242.83,6250.388,7.55799999999999,36,285.78989150569,NA,"role_play","MATT",0,0,0,1
"1042","Fall_Conclave",6,73,1042,"first_half_rp","LAURA","did an airship ever arrive?",6250.388,6254.356,3.96799999999985,6,90.7258064516164,NA,"role_play","LAURA",1,0,0,0
"1043","Fall_Conclave",6,73,1043,"first_half_rp","MATT","they all look at each other, a bit confused. ""no.""",6254.356,6260.221,5.86499999999978,11,112.531969309467,NA,"role_play","MATT",0,0,0,1
"1044","Fall_Conclave",6,73,1044,"first_half_rp","LAURA","an airship? did anyone see an airship flying around?",6260.221,6263.264,3.04300000000057,10,197.173841603643,NA,"role_play","LAURA",1,0,0,0
"1045","Fall_Conclave",6,73,1045,"first_half_rp","MATT","""i didn't see one."" and cassandra goes, ""no. there hasn't been an airship here, no. are we ""expecting one?""",6263.264,6268.238,4.97400000000016,23,277.442702050655,NA,"role_play","MATT",0,0,0,1
"1046","Fall_Conclave",6,73,1046,"first_half_rp","LAURA","mm-hmm.",6268.238,6269.6,1.36200000000008,3,132.158590308362,NA,"role_play","LAURA",1,0,0,0
"1047","Fall_Conclave",6,73,1047,"first_half_rp","MATT","""good to know.""",6269.6,6270.747,1.14699999999993,5,261.551874455115,NA,"role_play","MATT",0,0,0,1
"1048","Fall_Conclave",6,73,1048,"first_half_rp","SAM","the city is invisible.",6270.747,6272.527,1.77999999999975,5,168.539325842721,NA,"role_play","SAM",1,0,0,0
"1049","Fall_Conclave",6,73,1049,"first_half_rp","MATT","""yes, so they won't see us if they come. if we see an airship, do you wish us to flag it down?""",6272.527,6276.822,4.29500000000007,25,349.243306169959,NA,"role_play","MATT",0,0,0,1
"1050","Fall_Conclave",6,73,1050,"first_half_rp","LAURA","that would be good.",6276.822,6277.851,1.02899999999954,5,291.545189504503,NA,"role_play","LAURA",1,0,0,0
"1051","Fall_Conclave",6,73,1051,"first_half_rp","MATT","""you trust it?""",6277.851,6278.842,0.990999999999985,5,302.72452068618,NA,"role_play","MATT",0,0,0,1
"1052","Fall_Conclave",6,73,1052,"first_half_rp","LAURA","yes.",6278.842,6279.796,0.954000000000633,2,125.786163521929,NA,"role_play","LAURA",1,0,0,0
"1053","Fall_Conclave",6,73,1053,"first_half_rp","LIAM","they are a rarity.",6279.796,6281.227,1.43099999999959,5,209.643605870082,NA,"role_play","LIAM",1,0,0,0
"1054","Fall_Conclave",6,73,1054,"first_half_rp","MATT","""all right.""",6281.227,6282.588,1.36099999999988,4,176.340925789876,NA,"role_play","MATT",0,0,0,1
"1055","Fall_Conclave",6,73,1055,"first_half_rp","SAM","maybe come up with a landing point as well.",6282.588,6285.384,2.79600000000028,10,214.59227467809,NA,"role_play","SAM",1,0,0,0
"1056","Fall_Conclave",6,73,1056,"first_half_rp","MATT","""now?""",6285.384,6287.753,2.36899999999969,3,75.981426762357,NA,"role_play","MATT",0,0,0,1
"1057","Fall_Conclave",6,73,1057,"first_half_rp","SAM","well, soon.",6287.753,6291.992,4.23900000000049,3,42.4628450106108,NA,"role_play","SAM",1,0,0,0
"1058","Fall_Conclave",6,73,1058,"first_half_rp","TALIESIN","we have one other possible option in front of us. show them the medal.",6291.992,6299.317,7.32499999999982,15,122.866894197955,NA,"role_play","TALIESIN",1,0,0,0
"1059","Fall_Conclave",6,73,1059,"first_half_rp","SAM","no, thank you.",6299.317,6302.8,3.48300000000017,4,68.9061154177399,NA,"role_play","SAM",1,0,0,0
"1060","Fall_Conclave",6,73,1060,"first_half_rp","TALIESIN","you're not going to show them the medal? not that, no! no, not that. please don't whip that out, no one wants to see that.",6302.8,6308.559,5.75900000000001,28,291.717312033338,NA,"role_play","TALIESIN",1,0,0,0
"1061","Fall_Conclave",6,73,1061,"first_half_rp","SAM","no, not the cube.",6308.559,6309.727,1.16799999999967,5,256.849315068567,NA,"role_play","SAM",1,0,0,0
"1062","Fall_Conclave",6,73,1062,"first_half_rp","TALIESIN","we have another ally that we have spoken of.",6309.727,6313.836,4.10900000000038,10,146.020929666572,NA,"role_play","TALIESIN",1,0,0,0
"1063","Fall_Conclave",6,73,1063,"first_half_rp","SAM","it's a tenuous ally at best. maybe we shouldn't discuss it until we're 100% sure about it.",6313.836,6320.453,6.61700000000019,21,190.418618709379,NA,"role_play","SAM",1,0,0,0
"1064","Fall_Conclave",6,73,1064,"first_half_rp","LIAM","yeah, that's a big maybe. that's a big maybe. yeah.",6320.453,6326.922,6.46899999999914,13,120.57505023962,NA,"role_play","LIAM",1,0,0,0
"1065","Fall_Conclave",6,73,1065,"first_half_rp","MARISHA","yeah, they're very busy though.",6326.922,6331.979,5.0570000000007,7,83.0531935930279,NA,"role_play","MARISHA",1,0,0,0
"1066","Fall_Conclave",6,73,1066,"first_half_rp","LAURA","yeah, it's really far away and, then as we were leaving, the people that we talked to about it",6331.979,6339.727,7.74799999999959,20,154.878678368619,NA,"role_play","LAURA",1,0,0,0
"1067","Fall_Conclave",6,73,1067,"first_half_rp","MATT","""it's fine, i get it! reach out to your people on one end.""",6339.727,6343.988,4.26100000000042,16,225.29922553389,NA,"role_play","MATT",0,0,0,1
"1068","Fall_Conclave",6,73,1068,"first_half_rp","TALIESIN","i slowly walk around the table, thinking hard about it. and i stab seeker asum three times in the back with my sword.",6343.988,6357.18,13.192,24,109.157064887811,NA,"role_play","TALIESIN",1,0,0,0
"1069","Fall_Conclave",6,73,1069,"first_half_rp","MARISHA","let's fucking do this shit! let's do it! let's do it!",6357.18,6362.269,5.08899999999994,15,176.852033798391,NA,"role_play","MARISHA",1,0,0,0
"1070","Fall_Conclave",6,73,1070,"first_half_rp","LAURA","but we need to know the ritual!",6362.269,6365.249,2.97999999999956,8,161.073825503379,NA,"role_play","LAURA",1,0,0,0
"1071","Fall_Conclave",6,73,1071,"first_half_rp","LIAM","it's too late, he did it.",6365.249,6367.089,1.84000000000015,8,260.869565217371,NA,"role_play","LIAM",1,0,0,0
"1072","Fall_Conclave",6,73,1072,"first_half_rp","MARISHA","yeah!",6367.089,6368.768,1.67900000000009,2,71.4711137581857,NA,"role_play","MARISHA",1,0,0,0
"1073","Fall_Conclave",6,73,1073,"first_half_rp","SAM","oh percy, no.",6368.768,6370.276,1.50799999999981,4,159.151193633972,NA,"role_play","SAM",1,0,0,0
"1074","Fall_Conclave",6,73,1074,"first_half_rp","MATT","go ahead and roll",6370.276,6372.48,2.20399999999972,4,108.892921960086,NA,"role_play","MATT",0,0,0,1
"1075","Fall_Conclave",6,73,1075,"first_half_rp","TALIESIN","that's a surprise attack.",6372.48,6374.242,1.76200000000063,6,204.313280363151,NA,"role_play","TALIESIN",1,0,0,0
"1076","Fall_Conclave",6,73,1076,"first_half_rp","MATT","i know it is.",6374.242,6375.403,1.16100000000006,5,258.397932816525,NA,"role_play","MATT",0,0,0,1
"1077","Fall_Conclave",6,73,1077,"first_half_rp","SAM","oh god, why? we're in crazy costumes.",6375.403,6380.788,5.38499999999931,9,100.278551532046,NA,"role_play","SAM",1,0,0,0
"1078","Fall_Conclave",6,73,1078,"first_half_rp","LIAM","check out the brain on brad.",6380.788,6382.126,1.33800000000065,7,313.901345291328,NA,"role_play","LIAM",1,0,0,0
"1079","Fall_Conclave",6,73,1079,"first_half_rp","LAURA","we've got allura and gilmore, and drake.",6382.126,6386.592,4.46599999999944,9,120.913569189446,NA,"role_play","LAURA",1,0,0,0
"1080","Fall_Conclave",6,73,1080,"first_half_rp","TALIESIN","we have a lot of people in the room.",6386.592,6388.892,2.30000000000018,10,260.869565217371,NA,"role_play","TALIESIN",1,0,0,0
"1081","Fall_Conclave",6,73,1081,"first_half_rp","SAM","oh god.",6388.892,6390.298,1.40599999999995,3,128.022759601712,NA,"role_play","SAM",1,0,0,0
"1082","Fall_Conclave",6,73,1082,"first_half_rp","MATT","go ahead and roll. roll the first attack. with advantage.",6390.298,6396.116,5.81800000000021,11,113.441045032653,NA,"role_play","MATT",0,0,0,1
"1083","Fall_Conclave",6,73,1083,"first_half_rp","TRAVIS","we're in a room.",6396.116,6397.773,1.65700000000015,6,217.260108630034,NA,"role_play","TRAVIS",1,0,0,0
"1084","Fall_Conclave",6,73,1084,"first_half_rp","LAURA","whitestone's about to be destroyed.",6397.773,6400.485,2.71199999999953,7,154.867256637195,NA,"role_play","LAURA",1,0,0,0
"1085","Fall_Conclave",6,73,1085,"first_half_rp","SAM","and raishan's about to leave.",6400.485,6402.535,2.05000000000018,7,204.87804878047,NA,"role_play","SAM",1,0,0,0
"1086","Fall_Conclave",6,73,1086,"first_half_rp","LIAM","oh man, he's not making you roll stealth, motherfucker.",6402.535,6404.631,2.09600000000046,11,314.885496183137,NA,"role_play","LIAM",1,0,0,0
"1087","Fall_Conclave",6,73,1087,"first_half_rp","LAURA","why would he? he doesn't",6404.631,6406.143,1.51199999999972,6,238.095238095283,NA,"role_play","LAURA",1,0,0,0
"1088","Fall_Conclave",6,73,1088,"first_half_rp","LIAM","because i would. and hotis did on me.",6406.143,6408.867,2.72400000000016,9,198.237885462543,NA,"role_play","LIAM",1,0,0,0
"1089","Fall_Conclave",6,73,1089,"first_half_rp","LAURA","that's different.",6408.867,6410.923,2.05599999999959,4,116.731517509751,NA,"role_play","LAURA",1,0,0,0
