"","arc","arc_no","episode","turn_number","segment","actor","text","start_turn","end_turn","time_in_sec","word_count","words_per_ms","encounter_count","rp_combat","actor_guest","vox_machina","guest","staff","matt"
"2251","Kraghammer",1,10,2251,"epilog","MARISHA","oh, that's amazing.",13005.627,13006.422,0.795000000000073,5,0.00628930817610005,NA,NA,"MARISHA",1,0,0,0
"2252","Kraghammer",1,10,2252,"epilog","TALIESIN","malcavian all the way. it was magical.",13006.422,13008.941,2.51900000000023,8,0.00317586343787188,NA,NA,"TALIESIN",1,0,0,0
"2253","Kraghammer",1,10,2253,"epilog","MARISHA","that's awesome.",13008.941,13010.167,1.22599999999875,4,0.00326264274062323,NA,NA,"MARISHA",1,0,0,0
"2254","Kraghammer",1,10,2254,"epilog","LIAM","i want to know the answer to one someone asked. ""how did travis and laura meet?""",13010.167,13012.952,2.78499999999985,17,0.00610412926391414,NA,NA,"LIAM",1,0,0,0
"2255","Kraghammer",1,10,2255,"epilog","MATT","aww.",13012.952,13015.781,2.82900000000154,2,0.000706963591374659,NA,NA,"MATT",0,0,0,1
"2256","Kraghammer",1,10,2256,"epilog","TRAVIS","oh, back in dallas. like, right out of high school, we were in the same talent agency.",13015.781,13020.741,4.95999999999913,18,0.00362903225806516,NA,NA,"TRAVIS",1,0,0,0
"2257","Kraghammer",1,10,2257,"epilog","LAURA","we did a job as extras together on a set.",13020.741,13024.185,3.44399999999951,11,0.00319396051103414,NA,NA,"LAURA",1,0,0,0
"2258","Kraghammer",1,10,2258,"epilog","TRAVIS","with the silent extra talk. [no audio]",13024.185,13027.14,2.95499999999993,8,0.00270727580372257,NA,NA,"TRAVIS",1,0,0,0
"2259","Kraghammer",1,10,2259,"epilog","LIAM","were you good?",13027.14,13028.493,1.35300000000097,4,0.00295639320029351,NA,NA,"LIAM",1,0,0,0
"2260","Kraghammer",1,10,2260,"epilog","MARISHA","oh, did you guys do that on camera? that's so cute.",13028.493,13030.333,1.84000000000015,13,0.00706521739130379,NA,NA,"MARISHA",1,0,0,0
"2261","Kraghammer",1,10,2261,"epilog","LAURA","we sat for 8 hours at the same table, and we couldn't talk to each other because we weren't allowed to make noise.",13030.333,13034.738,4.40499999999884,26,0.00590238365493913,NA,NA,"LAURA",1,0,0,0
"2262","Kraghammer",1,10,2262,"epilog","TRAVIS","we thought we were superstars.",13034.738,13038.471,3.73300000000017,6,0.00160728636485393,NA,NA,"TRAVIS",1,0,0,0
"2263","Kraghammer",1,10,2263,"epilog","TRAVIS","""this is the greatest job ever"".",13038.471,13040.366,1.89500000000044,8,0.00422163588390404,NA,NA,"TRAVIS",1,0,0,0
"2264","Kraghammer",1,10,2264,"epilog","LAURA","and then just started hanging out in the same circles, and that was that.",13040.366,13044.254,3.88800000000083,15,0.0038580246913572,NA,NA,"LAURA",1,0,0,0
"2265","Kraghammer",1,10,2265,"epilog","ASHLEY","the rest is history?",13044.254,13045.007,0.752999999998792,5,0.00664010624171052,NA,NA,"ASHLEY",1,0,0,0
"2266","Kraghammer",1,10,2266,"epilog","TRAVIS","she totally fell for me.",13045.007,13048.496,3.48899999999958,6,0.00171969045571818,NA,NA,"TRAVIS",1,0,0,0
"2267","Kraghammer",1,10,2267,"epilog","ORION","that's adorable.",13048.496,13050.754,2.25800000000163,4,0.0017714791851183,NA,NA,"ORION",1,0,0,0
"2268","Kraghammer",1,10,2268,"epilog","SAM","someone asked many questions. ""when did pike and scanlan start flirting?"" or, ""when did scanlan start flirting with pike?"" right from the beginning.",13050.754,13060.146,9.39199999999983,24,0.00255536626916529,NA,NA,"SAM",1,0,0,0
"2269","Kraghammer",1,10,2269,"epilog","TRAVIS","yeah, no joke.",13060.146,13061.165,1.01900000000023,4,0.00392541707556338,NA,NA,"TRAVIS",1,0,0,0
"2270","Kraghammer",1,10,2270,"epilog","LAURA","yes, like literally the moment pike was in the game.",13061.165,13065.499,4.33399999999892,11,0.00253807106599048,NA,NA,"LAURA",1,0,0,0
"2271","Kraghammer",1,10,2271,"epilog","SAM","donatello's my favorite ninja turtle.",13065.499,13067.029,1.53000000000065,7,0.00457516339869085,NA,NA,"SAM",1,0,0,0
"2272","Kraghammer",1,10,2272,"epilog","LIAM","sam is my favorite ninja turtle.",13067.029,13070.045,3.01599999999962,7,0.0023209549071621,NA,NA,"LIAM",1,0,0,0
"2273","Kraghammer",1,10,2273,"epilog","LAURA","donatello is my favorite ninja turtle.",13070.045,13072.94,2.89500000000044,7,0.00241796200345387,NA,NA,"LAURA",1,0,0,0
"2274","Kraghammer",1,10,2274,"epilog","SAM","advice for bards is sing loud, and sing proud. or play your flute or whatever.",13072.94,13078.472,5.53199999999924,16,0.00289226319595123,NA,NA,"SAM",1,0,0,0
"2275","Kraghammer",1,10,2275,"epilog","LIAM","that's more commonly known as ""rock out with your cock out.""",13078.472,13081.664,3.19200000000092,13,0.00407268170425948,NA,NA,"LIAM",1,0,0,0
"2276","Kraghammer",1,10,2276,"epilog","TALIESIN","someone now asked how you two met, now, too.",13081.664,13082.819,1.15499999999884,10,0.00865800865801739,NA,NA,"TALIESIN",1,0,0,0
"2277","Kraghammer",1,10,2277,"epilog","MARISHA","people are now asking how we met.",13082.819,13084.323,1.50400000000081,8,0.00531914893616733,NA,NA,"MARISHA",1,0,0,0
"2278","Kraghammer",1,10,2278,"epilog","SAM","bard out with your heart out.",13084.323,13084.844,0.520999999998821,7,0.0134357005758461,NA,NA,"SAM",1,0,0,0
"2279","Kraghammer",1,10,2279,"epilog","ORION","bard out with your heart out.",13084.844,13085.864,1.02000000000044,7,0.00686274509803628,NA,NA,"ORION",1,0,0,0
"2280","Kraghammer",1,10,2280,"epilog","MATT","me and marisha met a mutual friend of ours was putting together a sketch-writing group this was years ago.",13085.864,13091.935,6.07099999999991,21,0.00345906769889644,NA,NA,"MATT",0,0,0,1
"2281","Kraghammer",1,10,2281,"epilog","MARISHA","it was supposed to be snl, but geeky, nerdy stuff where we were going to write and perform our own sketches.",13091.935,13099.375,7.44000000000051,22,0.00295698924731163,NA,NA,"MARISHA",1,0,0,0
"2282","Kraghammer",1,10,2282,"epilog","MATT","those never pan out.",13099.375,13100.751,1.3760000000002,5,0.00363372093023202,NA,NA,"MATT",0,0,0,1
"2283","Kraghammer",1,10,2283,"epilog","MARISHA","that never happened.",13100.751,13101.316,0.565000000000509,4,0.00707964601769273,NA,NA,"MARISHA",1,0,0,0
"2284","Kraghammer",1,10,2284,"epilog","MATT","not in l.a.",13101.316,13102.305,0.988999999999578,5,0.00505561172902137,NA,NA,"MATT",0,0,0,1
"2285","Kraghammer",1,10,2285,"epilog","MATT","but we met there, we harbored secret crushes for about a year, and then when we reconnected a little over a year later, i was out of a relationship, and she was just getting out of one, and we both started talking again. and then eventually we were like, ""hey, this is cool. we should do this.""",13103.311,13117.679,14.3680000000004,58,0.00403674832962127,NA,NA,"MATT",0,0,0,1
"2286","Kraghammer",1,10,2286,"epilog","MARISHA","you got me an audition for resident evil.",13117.679,13120.042,2.36299999999937,9,0.003808717731698,NA,NA,"MARISHA",1,0,0,0
"2287","Kraghammer",1,10,2287,"epilog","MATT","yeah.",13120.042,13120.482,0.440000000000509,2,0.00454545454544928,NA,NA,"MATT",0,0,0,1
"2288","Kraghammer",1,10,2288,"epilog","MARISHA","and then i was like, ""i owe you a drink.""",13120.482,13122.535,2.05299999999988,11,0.00535801266439387,NA,NA,"MARISHA",1,0,0,0
"2289","Kraghammer",1,10,2289,"epilog","LAURA","is that the resident evil we worked on together?",13122.535,13125.214,2.67900000000009,10,0.00373273609555792,NA,NA,"LAURA",1,0,0,0
"2290","Kraghammer",1,10,2290,"epilog","TALIESIN","he was adorable. it was so adorable watching him. oh, god.",13125.214,13128.289,3.07500000000073,12,0.00390243902438932,NA,NA,"TALIESIN",1,0,0,0
"2291","Kraghammer",1,10,2291,"epilog","MATT","it was for damnation, the cg movie.",13128.289,13128.985,0.695999999999913,8,0.0114942528735647,NA,NA,"MATT",0,0,0,1
"2292","Kraghammer",1,10,2292,"epilog","LAURA","oh, okay. i did that, too.",13128.985,13131.23,2.24499999999898,7,0.00311804008908827,NA,NA,"LAURA",1,0,0,0
"2293","Kraghammer",1,10,2293,"epilog","MARISHA","yeah.",13131.23,13132.429,1.19900000000052,2,0.00166805671392754,NA,NA,"MARISHA",1,0,0,0
"2294","Kraghammer",1,10,2294,"epilog","TALIESIN","back when we had a karaoke bar that we went to. i miss our karaoke bar.",13132.429,13137.711,5.28199999999924,17,0.00321847784929997,NA,NA,"TALIESIN",1,0,0,0
"2295","Kraghammer",1,10,2295,"epilog","TRAVIS","do you ever want to be a player and not a dm?",13137.711,13142.084,4.37300000000141,13,0.00297278756002648,NA,NA,"TRAVIS",1,0,0,0
"2296","Kraghammer",1,10,2296,"epilog","MATT","i do. it doesn't happen often. at all. but that's okay.",13142.084,13145.687,3.60299999999916,14,0.0038856508465177,NA,NA,"MATT",0,0,0,1
"2297","Kraghammer",1,10,2297,"epilog","TALIESIN","he's so good!",13145.687,13146.767,1.07999999999993,5,0.00462962962962994,NA,NA,"TALIESIN",1,0,0,0
"2298","Kraghammer",1,10,2298,"epilog","MATT","i'll have the opportunity.",13146.767,13148.354,1.58699999999953,6,0.00378071833648504,NA,NA,"MATT",0,0,0,1
"2299","Kraghammer",1,10,2299,"epilog","LIAM","""will critical role continue after the boss?"" yes.",13148.354,13151.298,2.94400000000132,10,0.00339673913043325,NA,NA,"LIAM",1,0,0,0
"2300","Kraghammer",1,10,2300,"epilog","LAURA","yeah!",13151.298,13152.75,1.45199999999932,2,0.00137741046832021,NA,NA,"LAURA",1,0,0,0
"2301","Kraghammer",1,10,2301,"epilog","SAM","no! we're all going to die!",13152.75,13153.73,0.979999999999563,8,0.00816326530612609,NA,NA,"SAM",1,0,0,0
"2302","Kraghammer",1,10,2302,"epilog","TRAVIS","""zac, what was the most recent picture you shared with the community?"" somebody is asking to see it. or asking me to ask you to see it.",13155.868,13161.239,5.37099999999919,29,0.00539936697076976,NA,NA,"TRAVIS",1,0,0,0
"2303","Kraghammer",1,10,2303,"epilog","ZAC","oh, i'll show you later. it's inappropriate.",13161.239,13165.061,3.82200000000012,10,0.00261643118785968,NA,NA,"ZAC",0,0,1,0
"2304","Kraghammer",1,10,2304,"epilog","SAM","oh, yes, guys, by the way. ashley and i are dating in real life.",13165.061,13168.936,3.875,15,0.00387096774193548,NA,NA,"SAM",1,0,0,0
"2305","Kraghammer",1,10,2305,"epilog","ORION","do they ship you?",13168.936,13170.891,1.95499999999993,5,0.00255754475703334,NA,NA,"ORION",1,0,0,0
"2306","Kraghammer",1,10,2306,"epilog","SAM","yeah, no, we've been together for a couple of years now.",13170.891,13174.422,3.53100000000086,13,0.00368167657887195,NA,NA,"SAM",1,0,0,0
"2307","Kraghammer",1,10,2307,"epilog","TRAVIS","yeah, like, 40 years.",13174.422,13178.45,4.02800000000025,5,0.00124131082423031,NA,NA,"TRAVIS",1,0,0,0
"2308","Kraghammer",1,10,2308,"epilog","TALIESIN","on and off.",13178.45,13180.017,1.5669999999991,4,0.00255264837268813,NA,NA,"TALIESIN",1,0,0,0
"2309","Kraghammer",1,10,2309,"epilog","TALIESIN","on and off.",13180.017,13183.068,3.05099999999948,4,0.00131104555883339,NA,NA,"TALIESIN",1,0,0,0
"2310","Kraghammer",1,10,2310,"epilog","TALIESIN","drama. just drama.",13183.068,13184.836,1.76800000000003,4,0.00226244343891399,NA,NA,"TALIESIN",1,0,0,0
"2311","Kraghammer",1,10,2311,"epilog","ASHLEY","it's a long time. you lose track",13184.836,13185.451,0.614999999999782,8,0.0130081300813054,NA,NA,"ASHLEY",1,0,0,0
"2312","Kraghammer",1,10,2312,"epilog","LIAM","if you replace ashley with liam, it's true.",13185.451,13186.893,1.44200000000092,10,0.00693481276005107,NA,NA,"LIAM",1,0,0,0
"2313","Kraghammer",1,10,2313,"epilog","TRAVIS","""pike, does scanlan have a shot?""",13186.893,13189.225,2.33200000000033,8,0.00343053173241803,NA,NA,"TRAVIS",1,0,0,0
"2314","Kraghammer",1,10,2314,"epilog","ASHLEY","i don't know; we'll see.",13189.225,13189.828,0.602999999999156,8,0.0132669983416438,NA,NA,"ASHLEY",1,0,0,0
"2315","Kraghammer",1,10,2315,"epilog","MATT","""do you guys have backup characters rolled ""for when you get tpk'd?""",13189.828,13192.136,2.3080000000009,15,0.00649913344887094,NA,NA,"MATT",0,0,0,1
"2316","Kraghammer",1,10,2316,"epilog","SAM","""we'll see?"" come on, give me a hint!",13192.136,13193.058,0.92200000000048,11,0.011930585683291,NA,NA,"SAM",1,0,0,0
"2317","Kraghammer",1,10,2317,"epilog","LIAM","i've got an idea.",13193.058,13193.696,0.63799999999901,6,0.00940438871474813,NA,NA,"LIAM",1,0,0,0
"2318","Kraghammer",1,10,2318,"epilog","LAURA","aw, i saw, how did me and trinket become friends?",13193.696,13195.454,1.75799999999981,11,0.00625711035267417,NA,NA,"LAURA",1,0,0,0
"2319","Kraghammer",1,10,2319,"epilog","TALIESIN","that's dark, people! that's really dark!",13195.454,13196.827,1.37299999999959,9,0.00655498907502015,NA,NA,"TALIESIN",1,0,0,0
"2320","Kraghammer",1,10,2320,"epilog","LIAM","that's a good one!",13196.827,13197.885,1.0580000000009,6,0.00567107750472106,NA,NA,"LIAM",1,0,0,0
"2321","Kraghammer",1,10,2321,"epilog","TRAVIS","how did you and trinket become friends?",13197.885,13200.683,2.79800000000068,8,0.00285918513223661,NA,NA,"TRAVIS",1,0,0,0
"2322","Kraghammer",1,10,2322,"epilog","LAURA","okay, it's kind of a long story.",13200.683,13202.76,2.07699999999932,9,0.0043331728454516,NA,NA,"LAURA",1,0,0,0
"2323","Kraghammer",1,10,2323,"epilog","MARISHA","wait, you and trinket?",13202.76,13205.103,2.34299999999894,5,0.00213401621852423,NA,NA,"MARISHA",1,0,0,0
"2324","Kraghammer",1,10,2324,"epilog","MARISHA","yeah, i want to hear it.",13205.103,13206.54,1.43700000000172,7,0.00487125956853976,NA,NA,"MARISHA",1,0,0,0
"2325","Kraghammer",1,10,2325,"epilog","LAURA","i sent this short story to matt what was it, a year ago? i just wanted him to know why trinket was so special to me. it's such a dorky thing.",13206.54,13217.368,10.8279999999995,33,0.00304765422977479,NA,NA,"LAURA",1,0,0,0
"2326","Kraghammer",1,10,2326,"epilog","LIAM","it really is a short story and not a blurb. it was long.",13217.368,13220.794,3.42599999999948,14,0.00408639813193291,NA,NA,"LIAM",1,0,0,0
"2327","Kraghammer",1,10,2327,"epilog","LAURA","it was a long thing. and it was all about, shortly after me and my brother left our family of the elves and we were setting off on our own and he was off in the city and i was making camp outside of town, these people came into the camp and basically i trusted them too much, they kidnapped me and brought me back to their camp. and they were poachers on the black market. and i was in a cage and i could hear a large creature in pain, and through my own wiles i got out of the cage, took out the two hunters, and i went to see what animal it was, and it was a giant bear in a lot of pain. unfortunately, it had been cut open from the middle, they had been harvesting the bear but they hadn't killed it, and it was really sad, so i felt terrible for it, and i put it out of its misery and felt really bad about it. and then i heard off to the side, a small animal make noise, and i realized it was its cub.",13220.794,13283.241,62.4470000000001,194,0.00310663442599324,NA,NA,"LAURA",1,0,0,0
"2328","Kraghammer",1,10,2328,"epilog","MATT","no!",13283.241,13286.416,3.17499999999927,2,0.000629921259842664,NA,NA,"MATT",0,0,0,1
"2329","Kraghammer",1,10,2329,"epilog","LAURA","so i took the cub and i felt really horrible, and that was also my first time i'd ever killed any people, as well, so trinket was very special to me because i wanted to protect him and not let him experience that again.",13286.416,13301.411,14.9950000000008,46,0.00306768922974308,NA,NA,"LAURA",1,0,0,0
"2330","Kraghammer",1,10,2330,"epilog","ASHLEY","trinket.",13301.411,13302.11,0.699000000000524,2,0.00286123032903934,NA,NA,"ASHLEY",1,0,0,0
"2331","Kraghammer",1,10,2331,"epilog","TRAVIS","did you eat the cub?",13302.11,13302.467,0.356999999999971,6,0.016806722689077,NA,NA,"TRAVIS",1,0,0,0
"2332","Kraghammer",1,10,2332,"epilog","LAURA","i didn't eat the cub! i saved the cub!",13302.467,13304.203,1.73599999999897,11,0.00633640552995769,NA,NA,"LAURA",1,0,0,0
"2333","Kraghammer",1,10,2333,"epilog","TRAVIS","oh, the cub is trinket.",13304.203,13305.462,1.25900000000001,6,0.00476568705321678,NA,NA,"TRAVIS",1,0,0,0
"2334","Kraghammer",1,10,2334,"epilog","LAURA","and i have never even told anybody about that. i never told vax about that, or anything. so trinket was mine.",13305.462,13312.573,7.11100000000079,22,0.00309379834059873,NA,NA,"LAURA",1,0,0,0
"2335","Kraghammer",1,10,2335,"epilog","MATT","aw.",13312.573,13314.323,1.75,2,0.00114285714285714,NA,NA,"MATT",0,0,0,1
"2336","Kraghammer",1,10,2336,"epilog","MARISHA","trinket.",13314.323,13315.591,1.26800000000003,2,0.00157728706624602,NA,NA,"MARISHA",1,0,0,0
"2337","Kraghammer",1,10,2337,"epilog","TALIESIN","bear love.",13315.591,13317.841,2.25,3,0.00133333333333333,NA,NA,"TALIESIN",1,0,0,0
"2338","Kraghammer",1,10,2338,"epilog","ASHLEY","trinket!",13317.841,13318.86,1.01900000000023,2,0.00196270853778169,NA,NA,"ASHLEY",1,0,0,0
"2339","Kraghammer",1,10,2339,"epilog","TALIESIN","someone mentioned we should bring jennifer hale on the show as a guest.",13318.86,13322.951,4.09099999999853,14,0.00342214617453068,NA,NA,"TALIESIN",1,0,0,0
"2340","Kraghammer",1,10,2340,"epilog","LAURA","ooh, she'd be pretty great.",13322.951,13324.742,1.79100000000108,7,0.00390843104410709,NA,NA,"LAURA",1,0,0,0
"2341","Kraghammer",1,10,2341,"epilog","MATT","that would be interesting.",13324.742,13326.202,1.45999999999913,5,0.00342465753424862,NA,NA,"MATT",0,0,0,1
"2342","Kraghammer",1,10,2342,"epilog","LIAM","there's a short list for guests, and a long lists for guests, for down the road.",13326.202,13329.835,3.63299999999981,18,0.00495458298926533,NA,NA,"LIAM",1,0,0,0
"2343","Kraghammer",1,10,2343,"epilog","MATT","yeah, we're going to have some fun people jumping in for a few weeks here and there.",13329.835,13332.056,2.22100000000137,19,0.00855470508779302,NA,NA,"MATT",0,0,0,1
"2344","Kraghammer",1,10,2344,"epilog","SAM","george clooney, anybody?",13332.056,13335.041,2.98499999999876,4,0.00134003350083808,NA,NA,"SAM",1,0,0,0
"2345","Kraghammer",1,10,2345,"epilog","LAURA AND SAM","carrot top, anybody?",13335.041,13339.042,4.0010000000002,4,0.000999750062484328,NA,NA,"LAURA AND SAM",1,0,0,0
"2346","Kraghammer",1,10,2346,"epilog","ASHLEY","why do i have food in my hair?",13339.042,13342.334,3.29200000000128,9,0.00273390036451898,NA,NA,"ASHLEY",1,0,0,0
"2347","Kraghammer",1,10,2347,"epilog","MATT","because you're doing it right!",13342.334,13344.86,2.52599999999984,7,0.00277117973079986,NA,NA,"MATT",0,0,0,1
"2348","Kraghammer",1,10,2348,"epilog","ASHLEY","anyway, who would you guys like to see play d&d with us?",13344.86,13347.449,2.58899999999994,14,0.00540749324063357,NA,NA,"ASHLEY",1,0,0,0
"2349","Kraghammer",1,10,2349,"epilog","LAURA","oh, yeah.",13347.449,13348.667,1.21799999999894,3,0.00246305418719427,NA,NA,"LAURA",1,0,0,0
"2350","Kraghammer",1,10,2350,"epilog","TRAVIS","there we go, watch this thing light up.",13348.667,13350.738,2.07099999999991,9,0.00434572670207647,NA,NA,"TRAVIS",1,0,0,0
"2351","Kraghammer",1,10,2351,"epilog","TALIESIN","yeah, that's a good question.",13350.738,13351.863,1.125,7,0.00622222222222222,NA,NA,"TALIESIN",1,0,0,0
"2352","Kraghammer",1,10,2352,"epilog","LAURA","i'm seeing that ""expect a crochet trinket."" i appreciate that. thank you.",13351.863,13354.588,2.72500000000036,14,0.0051376146788984,NA,NA,"LAURA",1,0,0,0
"2353","Kraghammer",1,10,2353,"epilog","SAM","let's wait two minutes until the feed catches up.",13354.588,13355.414,0.826000000000931,11,0.013317191283278,NA,NA,"SAM",1,0,0,0
"2354","Kraghammer",1,10,2354,"epilog","TALIESIN","ashly burch.",13355.414,13357.751,2.33699999999953,3,0.00128369704749705,NA,NA,"TALIESIN",1,0,0,0
"2355","Kraghammer",1,10,2355,"epilog","LAURA","barack obama!",13357.751,13360.499,2.74799999999959,3,0.00109170305676872,NA,NA,"LAURA",1,0,0,0
"2356","Kraghammer",1,10,2356,"epilog","ASHLEY","i don't know if we can get barack obama, you guys.",13360.499,13363.868,3.3690000000006,13,0.00385871178391146,NA,NA,"ASHLEY",1,0,0,0
"2357","Kraghammer",1,10,2357,"epilog","TALIESIN","i don't know if we can get ashly burch. that's tough.",13363.868,13365.858,1.98999999999978,14,0.00703517587939776,NA,NA,"TALIESIN",1,0,0,0
"2358","Kraghammer",1,10,2358,"epilog","SAM","oh, not the president barack obama, some other guy.",13365.858,13366.938,1.07999999999993,10,0.00925925925925988,NA,NA,"SAM",1,0,0,0
"2359","Kraghammer",1,10,2359,"epilog","TALIESIN","george takei!",13366.938,13368.738,1.79999999999927,3,0.00166666666666734,NA,NA,"TALIESIN",1,0,0,0
"2360","Kraghammer",1,10,2360,"epilog","TALIESIN","steve blum, troy baker. laura: tom hiddleston.",13368.738,13371.449,2.71100000000115,8,0.00295094061231893,NA,NA,"TALIESIN",1,0,0,0
"2361","Kraghammer",1,10,2361,"epilog","LIAM","tim burton?",13371.449,13373.057,1.60800000000017,3,0.00186567164179084,NA,NA,"LIAM",1,0,0,0
"2362","Kraghammer",1,10,2362,"epilog","ORION","tim burton?",13373.057,13375,1.9429999999993,3,0.00154400411734487,NA,NA,"ORION",1,0,0,0
"2363","Kraghammer",1,10,2363,"epilog","MARISHA","hardwick. vin diesel!",13375,13378.286,3.28600000000006,4,0.00121728545343881,NA,NA,"MARISHA",1,0,0,0
"2364","Kraghammer",1,10,2364,"epilog","LIAM","my eyes are bleeding!",13378.286,13380.524,2.23799999999937,5,0.00223413762287819,NA,NA,"LIAM",1,0,0,0
"2365","Kraghammer",1,10,2365,"epilog","LAURA","so many!",13380.524,13382.954,2.43000000000029,3,0.00123456790123442,NA,NA,"LAURA",1,0,0,0
"2366","Kraghammer",1,10,2366,"epilog","LIAM","eliza dushku.",13382.954,13384.46,1.5059999999994,3,0.00199203187251075,NA,NA,"LIAM",1,0,0,0
"2367","Kraghammer",1,10,2367,"epilog","LIAM","elijah wood.",13384.46,13386.585,2.125,3,0.00141176470588235,NA,NA,"LIAM",1,0,0,0
"2368","Kraghammer",1,10,2368,"epilog","MATT","a lot of the people you guys have mentioned, we're actually talking to. i'm going to talk to nathan, i'm going to talk to chris",13386.585,13391.667,5.08200000000033,28,0.00550964187327787,NA,NA,"MATT",0,0,0,1
"2369","Kraghammer",1,10,2369,"epilog","LAURA","we're talking to vin diesel.",13391.667,13393.158,1.49099999999999,7,0.00469483568075122,NA,NA,"LAURA",1,0,0,0
"2370","Kraghammer",1,10,2370,"epilog","SAM","garfunkel and oates, yeah.",13393.158,13394.448,1.29000000000087,5,0.00387596899224544,NA,NA,"SAM",1,0,0,0
"2371","Kraghammer",1,10,2371,"epilog","MATT","we don't know if they're available.",13394.448,13395.589,1.14099999999962,9,0.00788781770377124,NA,NA,"MATT",0,0,0,1
"2372","Kraghammer",1,10,2372,"epilog","TALIESIN","garfunkel and oates would be amazing.",13395.589,13396.982,1.39300000000003,7,0.0050251256281406,NA,NA,"TALIESIN",1,0,0,0
"2373","Kraghammer",1,10,2373,"epilog","MARISHA","that would be hilarious.",13396.982,13398.306,1.32400000000052,5,0.00377643504531573,NA,NA,"MARISHA",1,0,0,0
"2374","Kraghammer",1,10,2374,"epilog","SAM","bards. they could be bards!",13398.306,13399.524,1.21799999999894,6,0.00492610837438853,NA,NA,"SAM",1,0,0,0
"2375","Kraghammer",1,10,2375,"epilog","MATT","dame judy dench? yeah.",13399.524,13401.479,1.95499999999993,5,0.00255754475703334,NA,NA,"MATT",0,0,0,1
"2376","Kraghammer",1,10,2376,"epilog","MARISHA","steve blum. sam: troy baker? i don't know.",13401.479,13404.703,3.22400000000016,10,0.00310173697270456,NA,NA,"MARISHA",1,0,0,0
"2377","Kraghammer",1,10,2377,"epilog","LAURA","who is that?",13404.703,13406.176,1.47299999999996,4,0.00271554650373396,NA,NA,"LAURA",1,0,0,0
"2378","Kraghammer",1,10,2378,"epilog","LIAM","pfft.",13406.176,13408.845,2.66899999999987,2,0.000749344323716785,NA,NA,"LIAM",1,0,0,0
"2379","Kraghammer",1,10,2379,"epilog","ASHLEY","sasha gray?",13408.845,13409.685,0.840000000000146,3,0.00357142857142795,NA,NA,"ASHLEY",1,0,0,0
"2380","Kraghammer",1,10,2380,"epilog","TALIESIN","i'd play with them. that'd be awesome.",13409.685,13410.205,0.520000000000437,10,0.0192307692307531,NA,NA,"TALIESIN",1,0,0,0
"2381","Kraghammer",1,10,2381,"epilog","ASHLEY","sasha gray is a...?",13410.205,13411.21,1.0049999999992,5,0.00497512437811341,NA,NA,"ASHLEY",1,0,0,0
"2382","Kraghammer",1,10,2382,"epilog","LIAM","troy didn't know what to make of this when we first started it.",13411.21,13413.821,2.61100000000079,15,0.00574492531596916,NA,NA,"LIAM",1,0,0,0
"2383","Kraghammer",1,10,2383,"epilog","MATT","yeah. i think he still doesn't to know what to make of it.",13413.821,13414.853,1.03199999999924,15,0.0145348837209409,NA,NA,"MATT",0,0,0,1
"2384","Kraghammer",1,10,2384,"epilog","LAURA","actually, no, you know what, i've had conversations with troy about it",13414.853,13417.628,2.77500000000146,13,0.00468468468468223,NA,NA,"LAURA",1,0,0,0
"2385","Kraghammer",1,10,2385,"epilog","TALIESIN","peter dinklage.",13417.628,13418.913,1.28499999999985,3,0.00233463035019482,NA,NA,"TALIESIN",1,0,0,0
"2386","Kraghammer",1,10,2386,"epilog","ASHLEY","peter dinklage is on my hall pass list.",13418.913,13419.814,0.90099999999984,9,0.00998890122086748,NA,NA,"ASHLEY",1,0,0,0
"2387","Kraghammer",1,10,2387,"epilog","LAURA","i don't think he'd be opposed to joining the game.",13419.814,13421.405,1.59100000000035,13,0.00817096165933196,NA,NA,"LAURA",1,0,0,0
"2388","Kraghammer",1,10,2388,"epilog","MATT","really?",13421.405,13422.828,1.42299999999886,2,0.00140548137737287,NA,NA,"MATT",0,0,0,1
"2389","Kraghammer",1,10,2389,"epilog","LAURA","yeah, he seemed very interested when he brought it up.",13422.828,13424.66,1.83200000000033,11,0.00600436681222598,NA,NA,"LAURA",1,0,0,0
"2390","Kraghammer",1,10,2390,"epilog","TALIESIN","sir ian mckellen.",13424.66,13425.955,1.29500000000007,4,0.00308880308880292,NA,NA,"TALIESIN",1,0,0,0
"2391","Kraghammer",1,10,2391,"epilog","MATT","because my first conversation with him about it was very brief and very much like, ""cool."" i was like, ""okay...""",13425.955,13432.253,6.29800000000068,21,0.0033343918704347,NA,NA,"MATT",0,0,0,1
"2392","Kraghammer",1,10,2392,"epilog","LAURA","i think because me and travis were so excited about it",13432.253,13433.324,1.07099999999991,11,0.0102707749766582,NA,NA,"LAURA",1,0,0,0
"2393","Kraghammer",1,10,2393,"epilog","MATT","probably.",13433.324,13435.019,1.69499999999971,2,0.00117994100295006,NA,NA,"MATT",0,0,0,1
"2394","Kraghammer",1,10,2394,"epilog","MATT","yeah, we'll drag him in it sometime.",13435.019,13437.512,2.49300000000039,9,0.00361010830324853,NA,NA,"MATT",0,0,0,1
