"","arc","arc_no","episode","turn_number","segment","actor","text","start_turn","end_turn","time_in_sec","word_count","words_per_ms","encounter_count","rp_combat","actor_guest","vox_machina","guest","staff","matt"
"1382","Kraghammer",1,10,1382,"second_half_rp","MARISHA","and i want to meditate specifically on the horn, and i want to use pike and see if i can channel her vision, focusing on the horn, since that's what we really know. it's pretty much the only thing we know what it looks like.",8484.319,8500.966,16.6470000000008,48,0.00288340241484938,NA,"role_play","MARISHA",1,0,0,0
"1383","Kraghammer",1,10,1383,"second_half_rp","MATT","okay. so, as you draw the circle across the portion of the gravel and stonework actually, this is further in the cave, so the gravel has given in to more solid stonework. you begin to carve across the ground with a small piece of charcoal that you use for your ritual drawings, this giant, runic circle. you draw points for you to sit and a point for pike to sit as well, to help you focus in this vision. once you've taken the ten minutes to establish all the various material components and littered it with pieces of dried animal matter, some herbs, and lit a small bowl of incense on the side to help you in this spell, you sit down, take your place. pike, you take your place. and you begin to concentrate. you draw the essence of the nature energies around you and begin to project your vision towards the description of this dark horn, pushing what you can best ascertain is the direction of the temple from where this ritual is being conducted. all right, so. given the circumstances... bonus from that, let's make a will save. all right. so. you feel your vision project beyond you. it's a sort of out-of-body experience as the energy that makes up keyleth is no longer given physical form, it's just adrift in the darkness. you feel yourself drawn, pulled almost, like there's an energy that draws you as if poison from a wound. it pulls you upward, and you're looking down over the top of this entire cavern, suddenly. the darkness tends to fade for a moment, and you can make out the general outline of this island. once again, your vision zooms in and shifts. you can look over the city. you can see yug'voril over top. you can see the glowing aspects of the forest surrounding the outskirts of it. and you can see in the center of this ruined city that has been reconstructed in the image of the temple that stands. this giant pseudo-pyramid with a flattened top. you can now see it from the overhead view of this temple. it is actually open, and that strange glowing source of green energy you can see is slowly emanating from the top. your vision is pulled forward again. you feel yourself drawn towards it, and as you come towards the top, you can see: the open portion of this temple's roof is a crossbeam made of gold or brass, and there is some sort of structure hanging from it that falls deeper into the temple. you then move past this into what is the topmost chamber of this temple. it's darker at first, and as your essence tends to coalesce and find some sort of visual here, you can see now, this brass cross-beam that is held aloft in the center of this temple chamber drips down into a spiral of metal, this strange, arcane contraption that does not match any of the construct of this temple previously. it almost seems like it's been a new addition or is taking the place of something else that was a central focus of this chamber. you follow this strange arcane structure. about 15 to 20 feet it comes from the top of the temple chamber to the center, where held aloft underneath it by another 15-foot drop, you see in this dark room a pool of a dull, bluish purple liquid. and it's pulsing with life, and with energy. you now look down, your eyes focus, and in this pool, this ten, 15-foot-wide round pool, you can see this pulse, almost a heartbeat of purplish energy, what look like small purple stones. but they're not stones, they're minds. they're brains. they're essences. and they're all working together, interconnected. you're looking upon the elder brain of yug'voril, the center of the entire illithid colony that resides in the center of this chamber. you can see now this green energy that's being brought down from this metallic structure at the top of this temple is being funneled down over, and is acting as an arcane prison for, the elder brain. it's sealing and controlling, essentially, and what you had gathered from your previous discussions with clarota, this is what has taken the minds of the mind flayers and bent them to k'varn's will. your focus shifts now from the elder brain, and you look around the room, and in the dark shadows of this room, you can see there are cages. there are metal bars. you're unable to really ascertain what the material is, but in each one of these small cages you see some creature. some of this realm, some not. horrible forms: mutated, torn, some missing limbs, some in the process of slowly dying because they're unable to keep a physical form intact. it's a collection, a horrible collection of malformed entities that are being experimented on. pulled apart, put together. this also serves as, seemingly, a laboratory for k'varn. and you feel a presence in the room, suddenly. your essence shifts around and you look in the darkness and you see, slowly drifting out of the shadow, a single gnarled black horn. underneath that horn, you can see now the physical form that it adorns: dark brown leathery skin with slightly pointed edges, almost like scales that form out of portions of this flesh. you see below this horn one large, piercing, sky-blue eye that glances up and meets your gaze. as it does, from beneath that eye, you see a toothy maw tear into a wide grin. and around the outskirts of the singular eye, numerous other eyes shift around. coming into the light, you see now a fleshy ball that is drifting in the air itself under its own physical form. this aberration, this horrible entity is now floating forward. you can see metal plates that are grafted to the physical body of this creature.",8500.966,8859.008,358.041999999999,1026,0.00286558560168919,NA,"role_play","MATT",0,0,0,1
"1384","Kraghammer",1,10,1384,"second_half_rp","MARISHA","oh, come on!",8859.008,8861.063,2.05500000000029,4,0.00194647201946444,NA,"role_play","MARISHA",1,0,0,0
"1385","Kraghammer",1,10,1385,"second_half_rp","MATT","apparently k'varn has experimented on itself. these eyes are attached to strange finger-like stalks that twist out of its body. these eyes, darting around the room, looking at different directions, and then they all singularly shift on you at once. as it does, you can feel, all of a sudden, your presence, which has been drifting through the scrying spell, locked in place. and for a second, you feel like you can't breathe. as k'varn presses towards you, this fleshy sphere of eyestalks and teeth, this small chuckle billows up deep within its mouth. "" so, guest. ""do you like my home? ""you're welcome any time."" at which point, the horn seems to glow with this creepy greenish energy, and you feel this piercing pain blast into your head. you try and scream, but you can't. there's no breath. go ahead and make a wisdom saving throw.",8861.063,8919.644,58.5810000000001,154,0.00262883870196821,NA,"role_play","MATT",0,0,0,1
"1386","Kraghammer",1,10,1386,"second_half_rp","LAURA","oh no!",8919.644,8922.244,2.60000000000036,3,0.00115384615384599,NA,"role_play","LAURA",1,0,0,0
"1387","Kraghammer",1,10,1387,"second_half_rp","MARISHA","do i still have my enhance ability up?",8922.244,8926.957,4.71299999999974,9,0.00190961171228527,NA,"role_play","MARISHA",1,0,0,0
"1388","Kraghammer",1,10,1388,"second_half_rp","MATT","no, because that's a concentration spell.",8926.957,8928.732,1.77499999999964,8,0.00450704225352205,NA,"role_play","MATT",0,0,0,1
"1389","Kraghammer",1,10,1389,"second_half_rp","LIAM","what does keyleth look like to us right now?",8928.732,8930.887,2.15500000000065,10,0.00464037122969697,NA,"role_play","LIAM",1,0,0,0
"1390","Kraghammer",1,10,1390,"second_half_rp","MATT","keyleth is sweating profusely, and you can see she's flinching.",8930.887,8934.066,3.17900000000009,12,0.0037747719408618,NA,"role_play","MATT",0,0,0,1
"1391","Kraghammer",1,10,1391,"second_half_rp","LIAM","i'm walking up to keyleth and i'm grabbing her by the shirt and i'm going to slap her across the face.",8934.066,8938.195,4.128999999999,25,0.00605473480261712,NA,"role_play","LIAM",1,0,0,0
"1392","Kraghammer",1,10,1392,"second_half_rp","MATT","all right. so?",8938.195,8939.068,0.872999999999593,4,0.00458190148912012,NA,"role_play","MATT",0,0,0,1
"1393","Kraghammer",1,10,1393,"second_half_rp","MARISHA","27.",8939.068,8941.542,2.47400000000016,2,0.000808407437348371,NA,"role_play","MARISHA",1,0,0,0
"1394","Kraghammer",1,10,1394,"second_half_rp","MATT","27. all right. good. you take 11 points of psychic damage and are thrust out of the scry spell. your vision is pulled out of the top of the temple and suddenly you're back in your form as a sharp pain hits you across the side of the head.",8941.542,8957.372,15.8299999999999,51,0.00322173089071385,NA,"role_play","MATT",0,0,0,1
"1395","Kraghammer",1,10,1395,"second_half_rp","MARISHA","ow!",8957.372,8959.213,1.84100000000035,2,0.00108636610537731,NA,"role_play","MARISHA",1,0,0,0
"1396","Kraghammer",1,10,1396,"second_half_rp","MATT","vax is holding you.",8959.213,8960.63,1.41699999999946,5,0.00352858151023423,NA,"role_play","MATT",0,0,0,1
"1397","Kraghammer",1,10,1397,"second_half_rp","MARISHA","christ! what why?!",8960.63,8963.127,2.49700000000121,4,0.00160192230676735,NA,"role_play","MARISHA",1,0,0,0
"1398","Kraghammer",1,10,1398,"second_half_rp","LIAM","you were in pain. are you all right? are you all right?",8963.127,8967.088,3.96099999999933,13,0.00328199949507756,NA,"role_play","LIAM",1,0,0,0
"1399","Kraghammer",1,10,1399,"second_half_rp","MARISHA","""you were in pain, ""so i thought i'd fucking slap you across the face?"" gee!",8967.088,8972.362,5.27399999999943,18,0.00341296928327682,NA,"role_play","MARISHA",1,0,0,0
"1400","Kraghammer",1,10,1400,"second_half_rp","LAURA","keyleth! language. travis: are we hitting each other now?",8972.362,8974.607,2.2450000000008,10,0.00445434298440821,NA,"role_play","LAURA",1,0,0,0
"1401","Kraghammer",1,10,1401,"second_half_rp","MARISHA","sorry. wow.",8974.607,8979.16,4.55299999999988,3,0.000658906215681985,NA,"role_play","MARISHA",1,0,0,0
"1402","Kraghammer",1,10,1402,"second_half_rp","LAURA AND ORION","what did you see?",8979.16,8983.082,3.92200000000048,5,0.00127485976542565,NA,"role_play","LAURA AND ORION",1,0,0,0
"1403","Kraghammer",1,10,1403,"second_half_rp","ORION","so she tells us, right?",8983.082,8985.211,2.128999999999,6,0.00281822451855464,NA,"role_play","ORION",1,0,0,0
"1404","Kraghammer",1,10,1404,"second_half_rp","MARISHA","k'varn's a beholder.",8985.211,8987.822,2.61100000000079,6,0.00229797012638767,NA,"role_play","MARISHA",1,0,0,0
"1405","Kraghammer",1,10,1405,"second_half_rp","ORION","it is really not a thing we want to fight. it is awful. it is wretched. it will kill all of us if we don't find out a way to kill it oh my god.",8990.276,8998.974,8.69800000000032,37,0.00425385146010561,NA,"role_play","ORION",1,0,0,0
"1406","Kraghammer",1,10,1406,"second_half_rp","MARISHA","not only is k'varn a beholder, k'varn has been experimenting on himself and so he has armor grafted onto him, and the horn the horn which i don't know.",8998.974,9016.355,17.3809999999994,33,0.00189862493527422,NA,"role_play","MARISHA",1,0,0,0
"1407","Kraghammer",1,10,1407,"second_half_rp","LAURA","you said there is something caging the elder brain right?",9016.355,9020.052,3.69700000000012,11,0.00297538544766017,NA,"role_play","LAURA",1,0,0,0
"1408","Kraghammer",1,10,1408,"second_half_rp","MARISHA","yes. that big green light. can, we can see it? is it like the luxor in vegas? can we see the green light?",9020.052,9027.636,7.58400000000074,24,0.00316455696202501,NA,"role_play","MARISHA",1,0,0,0
"1409","Kraghammer",1,10,1409,"second_half_rp","MATT","it's not a beam, but you do see a slight green glow at the top of the temple in the distance. you saw it when you first entered, and it's been this dull beacon as you traveled around this island.",9027.636,9036.005,8.36899999999878,43,0.00513800932011068,NA,"role_play","MATT",0,0,0,1
"1410","Kraghammer",1,10,1410,"second_half_rp","LAURA","so there's something connected to the top of the temple that's caging the elder brain?",9036.005,9040.563,4.5580000000009,18,0.00394910048266706,NA,"role_play","LAURA",1,0,0,0
"1411","Kraghammer",1,10,1411,"second_half_rp","MARISHA","it's like an arcane prison around all of the elder brain.",9040.563,9044.629,4.06600000000071,13,0.00319724545007322,NA,"role_play","MARISHA",1,0,0,0
"1412","Kraghammer",1,10,1412,"second_half_rp","LAURA","is it possible to maybe collapse the top of the temple from far away, and release the elder brain from its cage and then clarota, your brethren could fight the beholder instead of us?",9044.629,9060.755,16.1259999999984,35,0.00217040803671112,NA,"role_play","LAURA",1,0,0,0
"1413","Kraghammer",1,10,1413,"second_half_rp","MARISHA","clarota, do you know how we could possibly break this prison?",9060.755,9064.194,3.43900000000031,12,0.00348938644954898,NA,"role_play","MARISHA",1,0,0,0
"1414","Kraghammer",1,10,1414,"second_half_rp","TRAVIS","could you tell me what a beholder is first? because i don't know.",9064.194,9067.966,3.77200000000084,15,0.00397667020148373,NA,"role_play","TRAVIS",1,0,0,0
"1415","Kraghammer",1,10,1415,"second_half_rp","SAM","big bad scary thing.",9067.966,9069.939,1.97299999999996,5,0.00253421186011156,NA,"role_play","SAM",1,0,0,0
"1416","Kraghammer",1,10,1416,"second_half_rp","TRAVIS","with finger eyes?",9069.939,9072.915,2.97600000000057,4,0.00134408602150512,NA,"role_play","TRAVIS",1,0,0,0
"1417","Kraghammer",1,10,1417,"second_half_rp","ORION","dm, i write a detailed",9072.915,9075.552,2.63699999999881,5,0.00189609404626555,NA,"role_play","ORION",1,0,0,0
"1418","Kraghammer",1,10,1418,"second_half_rp","SAM","just hold on. wait. patience.",9075.552,9078.149,2.59699999999975,6,0.00231035810550657,NA,"role_play","SAM",1,0,0,0
"1419","Kraghammer",1,10,1419,"second_half_rp","MATT","that's a beholder.",9078.149,9079.455,1.30600000000049,5,0.00382848392036608,NA,"role_play","MATT",0,0,0,1
"1420","Kraghammer",1,10,1420,"second_half_rp","LAURA","oh, the thing on the front of the monster manual.",9079.455,9082.603,3.14799999999923,11,0.00349428208386363,NA,"role_play","LAURA",1,0,0,0
"1421","Kraghammer",1,10,1421,"second_half_rp","ASHLEY","it's on the cover of a book.",9082.603,9084.697,2.09400000000096,9,0.004297994269339,NA,"role_play","ASHLEY",1,0,0,0
"1422","Kraghammer",1,10,1422,"second_half_rp","TRAVIS","worst possible scenario imaginable.",9084.697,9086.612,1.91499999999905,5,0.00261096605744254,NA,"role_play","TRAVIS",1,0,0,0
"1423","Kraghammer",1,10,1423,"second_half_rp","LAURA","that's all you could have said.",9086.612,9090.161,3.54900000000089,8,0.00225415610030938,NA,"role_play","LAURA",1,0,0,0
"1424","Kraghammer",1,10,1424,"second_half_rp","TALIESIN","it's on the cover of dungeons and dragons monthly right now. it is the cover model.",9090.161,9095.2,5.03900000000067,18,0.00357213732883461,NA,"role_play","TALIESIN",1,0,0,0
"1425","Kraghammer",1,10,1425,"second_half_rp","LIAM","there's dragon, then beholder.",9095.2,9098.348,3.14799999999923,6,0.0019059720457438,NA,"role_play","LIAM",1,0,0,0
"1426","Kraghammer",1,10,1426,"second_half_rp","LAURA","i mean, we've killed a dragon.",9098.348,9099.55,1.20199999999932,8,0.00665557404326502,NA,"role_play","LAURA",1,0,0,0
"1427","Kraghammer",1,10,1427,"second_half_rp","TRAVIS","yeah he's got lots of teeth. let's brush 'em.",9099.55,9101.881,2.33100000000013,12,0.00514800514800486,NA,"role_play","TRAVIS",1,0,0,0
"1428","Kraghammer",1,10,1428,"second_half_rp","MARISHA","each eye tends to have a beam that has a different ability.",9101.881,9108.427,6.54600000000028,13,0.00198594561564306,NA,"role_play","MARISHA",1,0,0,0
"1429","Kraghammer",1,10,1429,"second_half_rp","SAM","yes.",9108.427,9109.677,1.25,2,0.0016,NA,"role_play","SAM",1,0,0,0
"1430","Kraghammer",1,10,1430,"second_half_rp","LIAM","it's a magic fun bag.",9109.677,9111.974,2.29700000000048,7,0.00304745319982522,NA,"role_play","LIAM",1,0,0,0
"1431","Kraghammer",1,10,1431,"second_half_rp","MARISHA","it's a magic fun bag. it's probably got everything from silence and dispel magic to petrify to a disintegration ray.",9111.974,9121.884,9.90999999999985,23,0.00232088799192738,NA,"role_play","MARISHA",1,0,0,0
"1432","Kraghammer",1,10,1432,"second_half_rp","TALIESIN","you're thinking about this wrong, though. you're thinking about this in the wrong direction. beholder is not that's not the goal.",9121.884,9131.877,9.99300000000039,25,0.002501751225858,NA,"role_play","TALIESIN",1,0,0,0
"1433","Kraghammer",1,10,1433,"second_half_rp","LAURA","the horn is the goal.",9131.877,9133.791,1.91399999999885,6,0.0031347962382464,NA,"role_play","LAURA",1,0,0,0
"1434","Kraghammer",1,10,1434,"second_half_rp","TALIESIN","even more than that, it's the hundreds of allies we could have.",9133.791,9137.864,4.07300000000032,14,0.00343726982568105,NA,"role_play","TALIESIN",1,0,0,0
"1435","Kraghammer",1,10,1435,"second_half_rp","LAURA","exactly! we free the elder brain, they attack it.",9137.864,9140.73,2.86599999999999,10,0.00348918353105375,NA,"role_play","LAURA",1,0,0,0
"1436","Kraghammer",1,10,1436,"second_half_rp","TALIESIN","prison is the target.",9140.73,9142.745,2.01500000000124,5,0.00248138957816225,NA,"role_play","TALIESIN",1,0,0,0
"1437","Kraghammer",1,10,1437,"second_half_rp","TRAVIS","not the beholder?",9142.745,9144.238,1.49299999999857,4,0.00267916945747074,NA,"role_play","TRAVIS",1,0,0,0
"1438","Kraghammer",1,10,1438,"second_half_rp","TALIESIN","not the beholder. if we can free the elder brain",9144.238,9148.978,4.73999999999978,10,0.00210970464135031,NA,"role_play","TALIESIN",1,0,0,0
"1439","Kraghammer",1,10,1439,"second_half_rp","LAURA","we don't have to fight it ourselves.",9148.978,9150.773,1.79500000000007,9,0.00501392757660147,NA,"role_play","LAURA",1,0,0,0
"1440","Kraghammer",1,10,1440,"second_half_rp","TALIESIN","then we're not alone. now, what was creating this green light? where was it emanating from?",9150.773,9157.01,6.23700000000099,18,0.00288600288600243,NA,"role_play","TALIESIN",1,0,0,0
"1441","Kraghammer",1,10,1441,"second_half_rp","MARISHA","it seemed to be emanating from the top opening of this pyramid that was the main temple of the center of town.",9157.01,9164.906,7.89600000000064,23,0.00291286727456917,NA,"role_play","MARISHA",1,0,0,0
"1442","Kraghammer",1,10,1442,"second_half_rp","TALIESIN","can you describe the top of the pyramid?",9164.906,9167.516,2.60999999999876,9,0.0034482758620706,NA,"role_play","TALIESIN",1,0,0,0
"1443","Kraghammer",1,10,1443,"second_half_rp","MATT","i'll give you a detailed description. essentially, this pyramid comes to a top and then flattens up at the very top. where you would expect there to be a flat surface is instead, essentially, a windowed opening. you don't think it's purely open like you could just jump through. there is some sort of glass that coats it, but there is a brass cross-beam at the very top, and then part of this cross-beam holds aloft this strange series of metallic wires that spiral and intertwine that serves as a conical focus piece. you can't see the interior of it.",9167.516,9195.734,28.2180000000008,107,0.00379190587568209,NA,"role_play","MATT",0,0,0,1
"1444","Kraghammer",1,10,1444,"second_half_rp","LAURA","so if we take out the beams",9195.734,9197.084,1.35000000000036,7,0.00518518518518379,NA,"role_play","LAURA",1,0,0,0
"1445","Kraghammer",1,10,1445,"second_half_rp","MARISHA","it was almost like a beehive.",9197.084,9199.073,1.98899999999958,7,0.00351935646053368,NA,"role_play","MARISHA",1,0,0,0
"1446","Kraghammer",1,10,1446,"second_half_rp","MATT","essentially a slow beehive.",9199.073,9200.546,1.47299999999996,5,0.00339443312966745,NA,"role_play","MATT",0,0,0,1
"1447","Kraghammer",1,10,1447,"second_half_rp","MARISHA","it was focusing the energy.",9200.546,9203.443,2.89699999999903,6,0.0020711080428036,NA,"role_play","MARISHA",1,0,0,0
"1448","Kraghammer",1,10,1448,"second_half_rp","TALIESIN","we have something very important. we have a vial of yellow liquid.",9203.443,9209.329,5.88600000000042,13,0.00220863064899746,NA,"role_play","TALIESIN",1,0,0,0
"1449","Kraghammer",1,10,1449,"second_half_rp","SAM","what does it do?",9209.329,9210.455,1.1260000000002,5,0.0044404973357008,NA,"role_play","SAM",1,0,0,0
"1450","Kraghammer",1,10,1450,"second_half_rp","LAURA","it might age you.",9210.455,9211.932,1.47700000000077,5,0.00338524035206323,NA,"role_play","LAURA",1,0,0,0
"1451","Kraghammer",1,10,1451,"second_half_rp","MARISHA","we don't know.",9211.932,9213.709,1.77700000000004,5,0.00281373100731563,NA,"role_play","MARISHA",1,0,0,0
"1452","Kraghammer",1,10,1452,"second_half_rp","TALIESIN","it seems to be very acidic.",9213.709,9215.221,1.51199999999881,7,0.00462962962963328,NA,"role_play","TALIESIN",1,0,0,0
"1453","Kraghammer",1,10,1453,"second_half_rp","SAM","so it could burn the metal?",9215.221,9217.679,2.45800000000054,7,0.00284784377542655,NA,"role_play","SAM",1,0,0,0
"1454","Kraghammer",1,10,1454,"second_half_rp","TALIESIN","i could melt the metal and we could actually bring that entire structure crashing down.",9217.679,9222.001,4.32200000000012,16,0.0037019898195279,NA,"role_play","TALIESIN",1,0,0,0
"1455","Kraghammer",1,10,1455,"second_half_rp","LAURA","but does anybody have an aging spell? something that causes things to disintegrate things? maybe we could rust the metal as well?",9222.001,9229.141,7.13999999999942,23,0.00322128851540643,NA,"role_play","LAURA",1,0,0,0
"1456","Kraghammer",1,10,1456,"second_half_rp","TALIESIN","we have that yellow goop, and that would definitely help.",9229.141,9232.511,3.3700000000008,11,0.00326409495548884,NA,"role_play","TALIESIN",1,0,0,0
"1457","Kraghammer",1,10,1457,"second_half_rp","LIAM","we know that it's acid?",9232.511,9234.071,1.55999999999949,7,0.00448717948718095,NA,"role_play","LIAM",1,0,0,0
"1458","Kraghammer",1,10,1458,"second_half_rp","TALIESIN","we suspect it.",9234.071,9236.13,2.05899999999929,4,0.0019426906265184,NA,"role_play","TALIESIN",1,0,0,0
"1459","Kraghammer",1,10,1459,"second_half_rp","LAURA","it might be a form changer, because the king swallowed a vial and it made him strong.",9236.13,9242.026,5.89600000000064,18,0.00305291723202138,NA,"role_play","LAURA",1,0,0,0
"1460","Kraghammer",1,10,1460,"second_half_rp","MARISHA","actually, i can learn heat metal and i can heat the beam and make it beam.",9242.026,9249.974,7.94800000000032,17,0.00213890286864611,NA,"role_play","MARISHA",1,0,0,0
"1461","Kraghammer",1,10,1461,"second_half_rp","LAURA","he's got vials of acid in his bag of holding.",9249.974,9252.534,2.55999999999949,12,0.00468750000000093,NA,"role_play","LAURA",1,0,0,0
"1462","Kraghammer",1,10,1462,"second_half_rp","ASHLEY","excellent.",9252.534,9254.386,1.85200000000077,2,0.001079913606911,NA,"role_play","ASHLEY",1,0,0,0
"1463","Kraghammer",1,10,1463,"second_half_rp","TALIESIN","we're going to break the temple.",9254.386,9256.405,2.01900000000023,8,0.00396235760277319,NA,"role_play","TALIESIN",1,0,0,0
"1464","Kraghammer",1,10,1464,"second_half_rp","LAURA","let's break the temple. clarota?",9256.405,9258.37,1.96500000000015,7,0.00356234096692086,NA,"role_play","LAURA",1,0,0,0
"1465","Kraghammer",1,10,1465,"second_half_rp","MATT","at this point, as you guys look over at clarota, you see clarota, for the first time in a while, looks visually disturbed. has withdrawn from the group and is leaning against the side of the beach cavern wall and the tentacles that normally slowly twirl are all tensed and pulled up into a knot.",9258.37,9276.575,18.2049999999999,56,0.00307607800054931,NA,"role_play","MATT",0,0,0,1
"1466","Kraghammer",1,10,1466,"second_half_rp","LAURA","clarota, you're going to cramp your face if you do that.",9276.575,9279.728,3.15299999999843,13,0.00412305740564747,NA,"role_play","LAURA",1,0,0,0
"1467","Kraghammer",1,10,1467,"second_half_rp","TALIESIN","if you have something to say, we would appreciate it.",9279.728,9282.063,2.33500000000095,11,0.00471092077087604,NA,"role_play","TALIESIN",1,0,0,0
"1468","Kraghammer",1,10,1468,"second_half_rp","LIAM","if you keep making that face, it'll freeze that way.",9282.063,9285.238,3.17499999999927,12,0.00377952755905598,NA,"role_play","LIAM",1,0,0,0
"1469","Kraghammer",1,10,1469,"second_half_rp","MATT","""that k'varn is ""of this new creature, a beholder, ""and carries this horn that lady kima has spoken of. ""it's a great danger. also, keep in mind ""the temple is not made of average stolen metals. ""this is the center of the elder brain. we reinforce it with magical protection. ""it's the center of our entire species' knowledge. ""every brain in there is our elders'. as we pass to the next generation, ""our mind is brought and introduced to the elder brain. ""we have that room protected from simple acids. ""we must make sure we are ready.""",9285.238,9341.257,56.0190000000002,102,0.00182081079633695,NA,"role_play","MATT",0,0,0,1
"1470","Kraghammer",1,10,1470,"second_half_rp","LIAM","clarota, keyleth has scried the top of the building right now. it didn't look like it was part of the original structure. is she mistaken? is the top something that was built by your people?",9341.257,9353.964,12.7070000000003,37,0.00291178090816078,NA,"role_play","LIAM",1,0,0,0
"1471","Kraghammer",1,10,1471,"second_half_rp","MATT","""no. it was open before. ""there seems to be some sort of new focus k'varn has constructed.""",9353.964,9361.968,8.00400000000081,20,0.0024987506246874,NA,"role_play","MATT",0,0,0,1
