"","Episode","startTime","endTime","Actor","Text","vox_machina","guest","staff","Matt","Arc","Arc_no","timeDiffInSecs","wordCount","WordsPerMillisec","segment","encounter_count","rp_combat","turn_number","CR_GUEST"
"2091",118,10108.016,10114.65,"TALIESIN","""after the last game? that's the last thing you""",1,0,0,0,"End",8,6.63400000000001,12,0.00180886343081097,"extra",NA,"role_play",2091,"TALIESIN"
"2092",118,10114.65,10120.068,"LAURA","max, what happened? how long has it been?",1,0,0,0,"End",8,5.41799999999967,9,0.00166112956810641,"extra",NA,"role_play",2092,"LAURA"
"2093",118,10120.068,10121.821,"TALIESIN","""it's been a long week.""",1,0,0,0,"End",8,1.75300000000061,8,0.00456360524814444,"extra",NA,"role_play",2093,"TALIESIN"
"2094",118,10121.821,10123.786,"LAURA","it's been a whole week?",1,0,0,0,"End",8,1.96500000000015,7,0.00356234096692086,"extra",NA,"role_play",2094,"LAURA"
"2095",118,10123.786,10125.527,"SAM","is it thursday again?",1,0,0,0,"End",8,1.74099999999999,5,0.00287191269385413,"extra",NA,"role_play",2095,"SAM"
"2096",118,10125.527,10134.495,"TALIESIN","""i haven't seen the sun in three days, four days? i don't know what no one knows what's ""going on. things have gotten very weird, but you've got to get us out of here.""",1,0,0,0,"End",8,8.96800000000076,40,0.00446030330062407,"extra",NA,"role_play",2096,"TALIESIN"
"2097",118,10138.424,10140.341,"LAURA","do people in the outside world know what's happening?",1,0,0,0,"End",8,1.91699999999946,11,0.00573813249869749,"extra",NA,"role_play",2097,"LAURA"
"2098",118,10140.341,10143.547,"TRAVIS","when i look at ivan, does he look disappointed or pleased with the outcome of this card pull?",1,0,0,0,"End",8,3.20600000000013,19,0.00592638802245765,"extra",NA,"role_play",2098,"TRAVIS"
"2099",118,10144.568,10147.555,"TALIESIN","he's waiting for another player.",1,0,0,0,"End",8,2.98700000000099,7,0.00234348844994901,"extra",NA,"role_play",2099,"TALIESIN"
"2100",118,10147.555,10150.956,"TRAVIS","all right, max, come with us.",1,0,0,0,"End",8,3.40099999999984,7,0.00205821817112624,"extra",NA,"role_play",2100,"TRAVIS"
"2101",118,10150.956,10152.6,"TALIESIN","""i can't get up.""",1,0,0,0,"End",8,1.64400000000023,7,0.00425790754257847,"extra",NA,"role_play",2101,"TALIESIN"
"2102",118,10152.6,10160.555,"TRAVIS","i thought that might be happening. yeah. i'll tell you what, max, sit tight. we'll be back for you. ivan, we'll try and find you another player.",1,0,0,0,"End",8,7.95499999999993,31,0.00389692017598998,"extra",NA,"role_play",2102,"TRAVIS"
"2103",118,10163.934,10169.874,"TALIESIN","""i, and i'll say, if you wanted to see if you can figure out a little bit more about ""what's happening, can't win if you don't play.""",1,0,0,0,"End",8,5.94000000000051,33,0.00555555555555508,"extra",NA,"role_play",2103,"TALIESIN"
"2104",118,10173.054,10175.974,"TRAVIS","i mean, he has a good point.",1,0,0,0,"End",8,2.92000000000007,8,0.00273972602739719,"extra",NA,"role_play",2104,"TRAVIS"
"2105",118,10175.974,10176.894,"SAM","yeah.",1,0,0,0,"End",8,0.920000000000073,2,0.00217391304347809,"extra",NA,"role_play",2105,"SAM"
"2106",118,10176.894,10178.173,"LAURA","that's true.",1,0,0,0,"End",8,1.27900000000045,4,0.00312744331508881,"extra",NA,"role_play",2106,"LAURA"
"2107",118,10178.173,10183.877,"TALIESIN","""max, you want to pick another card?""",1,0,0,0,"End",8,5.70399999999972,9,0.00157784011220204,"extra",NA,"role_play",2107,"TALIESIN"
"2108",118,10183.877,10187.604,"TRAVIS","tell him to pick another card.",1,0,0,0,"End",8,3.72699999999895,7,0.00187818620874751,"extra",NA,"role_play",2108,"TRAVIS"
"2109",118,10187.604,10190.095,"SAM","make max do it? no, we need to do it, so we know.",1,0,0,0,"End",8,2.49099999999999,14,0.00562023283821762,"extra",NA,"role_play",2109,"SAM"
"2110",118,10190.095,10192.855,"TRAVIS","you're right. you're right, sam.",1,0,0,0,"End",8,2.76000000000022,8,0.00289855072463745,"extra",NA,"role_play",2110,"TRAVIS"
"2111",118,10192.855,10194.339,"SAM","you want me to do it?",1,0,0,0,"End",8,1.48400000000038,7,0.00471698113207427,"extra",NA,"role_play",2111,"SAM"
"2112",118,10194.339,10197.118,"TRAVIS","i mean, you had the inspiration. one of us should pick a card.",1,0,0,0,"End",8,2.77900000000045,14,0.00503778337531404,"extra",NA,"role_play",2112,"TRAVIS"
"2113",118,10197.118,10199.114,"LAURA","you should do it.",1,0,0,0,"End",8,1.99599999999919,5,0.0025050100200411,"extra",NA,"role_play",2113,"LAURA"
"2114",118,10199.114,10200.345,"TRAVIS","it's you.",1,0,0,0,"End",8,1.23099999999977,4,0.00324939073923701,"extra",NA,"role_play",2114,"TRAVIS"
"2115",118,10200.345,10202.044,"LIAM","you're certainly the most clever person at the table.",1,0,0,0,"End",8,1.69900000000052,11,0.0064743967039415,"extra",NA,"role_play",2115,"LIAM"
"2116",118,10202.044,10203.629,"LAURA","yeah, you'll be able to solve it.",1,0,0,0,"End",8,1.58500000000095,9,0.00567823343848242,"extra",NA,"role_play",2116,"LAURA"
"2117",118,10203.629,10206.02,"SAM","if i sit down though, will i be able to get up again?",1,0,0,0,"End",8,2.39099999999962,14,0.00585529067335935,"extra",NA,"role_play",2117,"SAM"
"2118",118,10206.02,10207.505,"TRAVIS","yeah, as long as max is at the table.",1,0,0,0,"End",8,1.48499999999876,10,0.00673400673401234,"extra",NA,"role_play",2118,"TRAVIS"
"2119",118,10207.505,10209.337,"TALIESIN","as long as max doesn't get up.",1,0,0,0,"End",8,1.83200000000033,9,0.00491266375545762,"extra",NA,"role_play",2119,"TALIESIN"
"2120",118,10209.337,10211.551,"SAM","all right. i'll draw a card.",1,0,0,0,"End",8,2.21399999999994,8,0.0036133694670281,"extra",NA,"role_play",2120,"SAM"
"2121",118,10211.551,10213.28,"TALIESIN","sit down. draw a card.",1,0,0,0,"End",8,1.72900000000118,6,0.00347021399652742,"extra",NA,"role_play",2121,"TALIESIN"
"2122",118,10213.28,10215.879,"SAM","what could possibly go wrong?",1,0,0,0,"End",8,2.59900000000016,6,0.00230858022316261,"extra",NA,"role_play",2122,"SAM"
"2123",118,10215.879,10217.746,"LIAM","it can only go right.",1,0,0,0,"End",8,1.86699999999837,6,0.00321371183717474,"extra",NA,"role_play",2123,"LIAM"
"2124",118,10217.746,10221.145,"LAURA","what'd you get, what'd you get?",1,0,0,0,"End",8,3.39900000000125,9,0.00264783759929294,"extra",NA,"role_play",2124,"LAURA"
"2125",118,10221.145,10226.148,"SAM","the three of swords. more blood?",1,0,0,0,"End",8,5.00299999999879,7,0.00139916050369812,"extra",NA,"role_play",2125,"SAM"
"2126",118,10226.148,10228.259,"LAURA","three bloods?",1,0,0,0,"End",8,2.11100000000079,3,0.00142112742775883,"extra",NA,"role_play",2126,"LAURA"
"2127",118,10228.259,10229.713,"TALIESIN","yeah, what are you at?",1,0,0,0,"End",8,1.45399999999972,6,0.00412654745529652,"extra",NA,"role_play",2127,"TALIESIN"
"2128",118,10229.713,10231.431,"SAM","i'm at three.",1,0,0,0,"End",8,1.71800000000076,5,0.00291036088474843,"extra",NA,"role_play",2128,"SAM"
"2129",118,10231.431,10233.257,"LAURA","you have three bloods already?",1,0,0,0,"End",8,1.82599999999911,6,0.00328587075575187,"extra",NA,"role_play",2129,"LAURA"
"2130",118,10233.257,10235.837,"LIAM","uh-oh. spaghetti-oh.",1,0,0,0,"End",8,2.57999999999993,5,0.00193798449612409,"extra",NA,"role_play",2130,"LIAM"
"2131",118,10235.837,10240.477,"LAURA","oh no. you've maxed out your hunger.",1,0,0,0,"End",8,4.64000000000124,9,0.00193965517241328,"extra",NA,"role_play",2131,"LAURA"
"2132",118,10240.477,10250.618,"TALIESIN","you stand up. actually, i'm not even going to bother with this. ooh. yeah, that's okay. you, at a speed that no one can even grasp, you stand up, there's a blur, and before anyone can notice, you are at zero health. you are fine. give me all your blood dice. your blood is at zero.",1,0,0,0,"End",8,10.1409999999996,60,0.00591657627452936,"extra",NA,"role_play",2132,"TALIESIN"
"2133",118,10273.821,10275.351,"LIAM","you're not hungry any more.",1,0,0,0,"End",8,1.53000000000065,7,0.00457516339869085,"extra",NA,"role_play",2133,"LIAM"
"2134",118,10275.351,10276.698,"TALIESIN","you're not hungry at all.",1,0,0,0,"End",8,1.34699999999975,7,0.00519673348181239,"extra",NA,"role_play",2134,"TALIESIN"
"2135",118,10276.698,10277.719,"LIAM","at all?",1,0,0,0,"End",8,1.02099999999882,3,0.0029382957884461,"extra",NA,"role_play",2135,"LIAM"
"2136",118,10277.719,10278.744,"SAM","what happened?",1,0,0,0,"End",8,1.02500000000146,3,0.00292682926828853,"extra",NA,"role_play",2136,"SAM"
"2137",118,10278.744,10279.901,"TALIESIN","you're not hungry.",1,0,0,0,"End",8,1.15699999999924,5,0.00432152117545659,"extra",NA,"role_play",2137,"TALIESIN"
"2138",118,10279.901,10281.901,"TRAVIS","how does max look?",1,0,0,0,"End",8,2,5,0.0025,"extra",NA,"role_play",2138,"TRAVIS"
"2139",118,10281.901,10284.726,"TALIESIN","max is very pale, and he's not moving.",1,0,0,0,"End",8,2.82500000000073,10,0.00353982300884865,"extra",NA,"role_play",2139,"TALIESIN"
"2140",118,10284.726,10286.499,"LAURA","you killed max.",1,0,0,0,"End",8,1.77299999999923,4,0.00225606316976973,"extra",NA,"role_play",2140,"LAURA"
"2141",118,10286.499,10287.672,"TRAVIS","you're fast as shit.",1,0,0,0,"End",8,1.17300000000068,6,0.00511508951406351,"extra",NA,"role_play",2141,"TRAVIS"
"2142",118,10287.672,10289.441,"LAURA","sam, you killed max!",1,0,0,0,"End",8,1.76900000000023,5,0.00282645562464632,"extra",NA,"role_play",2142,"LAURA"
"2143",118,10289.441,10292.76,"TRAVIS","can i run over to max and check his pulse with my fingers on his carotid?",1,0,0,0,"End",8,3.31899999999951,17,0.00512202470623758,"extra",NA,"role_play",2143,"TRAVIS"
"2144",118,10292.76,10297.767,"TALIESIN","the only reason max isn't slumping over is he's still glued to the seat.",1,0,0,0,"End",8,5.00699999999961,17,0.00339524665468371,"extra",NA,"role_play",2144,"TALIESIN"
"2145",118,10297.767,10302.922,"SAM","i don't know what came over me.",1,0,0,0,"End",8,5.15500000000065,9,0.00174587778855458,"extra",NA,"role_play",2145,"SAM"
"2146",118,10302.922,10305.004,"TALIESIN","max is dead.",1,0,0,0,"End",8,2.08200000000033,4,0.00192122958693533,"extra",NA,"role_play",2146,"TALIESIN"
"2147",118,10305.004,10307.897,"LAURA","i'm going to take my dagger and try to stab ivan while he's distracted with all of that.",1,0,0,0,"End",8,2.89300000000003,21,0.00725890079502239,"extra",NA,"role_play",2147,"LAURA"
"2148",118,10307.897,10312.379,"SAM","it's on! wait, i get a question, i get a question first!",1,0,0,0,"End",8,4.48199999999997,14,0.00312360553324411,"extra",NA,"role_play",2148,"SAM"
"2149",118,10312.379,10316.224,"TRAVIS","we were going to get fucking knowledge first! we were supposed to get knowledge!",1,0,0,0,"End",8,3.84499999999935,15,0.003901170351106,"extra",NA,"role_play",2149,"TRAVIS"
"2150",118,10316.224,10318.413,"TALIESIN","you go in and try and stab ivan?",1,0,0,0,"End",8,2.18900000000031,9,0.00411146642302364,"extra",NA,"role_play",2150,"TALIESIN"
"2151",118,10318.413,10319.734,"LAURA","i'm going to try to stab ivan!",1,0,0,0,"End",8,1.32099999999991,9,0.00681302043906177,"extra",NA,"role_play",2151,"LAURA"
"2152",118,10319.734,10321.608,"TALIESIN","all right. let's do dex plus",1,0,0,0,"End",8,1.8739999999998,7,0.00373532550693744,"extra",NA,"role_play",2152,"TALIESIN"
"2153",118,10321.608,10323.671,"TRAVIS","max died for nothing!",1,0,0,0,"End",8,2.0630000000001,5,0.00242365487154617,"extra",NA,"role_play",2153,"TRAVIS"
"2154",118,10323.671,10325.702,"LAURA","he would have let you die! he wouldn't let you leave!",1,0,0,0,"End",8,2.03099999999904,13,0.0064007877892694,"extra",NA,"role_play",2154,"LAURA"
"2155",118,10325.702,10327.317,"SAM","what?",1,0,0,0,"End",8,1.61499999999978,2,0.00123839009287942,"extra",NA,"role_play",2155,"SAM"
"2156",118,10327.317,10328.609,"LAURA","you would have been stuck here forever!",1,0,0,0,"End",8,1.29200000000128,8,0.00619195046439015,"extra",NA,"role_play",2156,"LAURA"
"2157",118,10328.609,10330.375,"LIAM","but we could have used him and gotten an answer.",1,0,0,0,"End",8,1.76599999999962,11,0.00622876557191526,"extra",NA,"role_play",2157,"LIAM"
"2158",118,10330.375,10332.057,"TRAVIS","he was already up out of the chair.",1,0,0,0,"End",8,1.6820000000007,9,0.00535077288941514,"extra",NA,"role_play",2158,"TRAVIS"
"2159",118,10332.057,10334.608,"TALIESIN","you still get a question. we'll see how it goes. dex plus melee.",1,0,0,0,"End",8,2.55099999999948,15,0.00588004704037753,"extra",NA,"role_play",2159,"TALIESIN"
"2160",118,10334.608,10335.838,"LAURA","dex plus melee?",1,0,0,0,"End",8,1.22999999999956,4,0.00325203252032636,"extra",NA,"role_play",2160,"LAURA"
"2161",118,10335.838,10336.807,"TALIESIN","yeah.",1,0,0,0,"End",8,0.96900000000096,2,0.00206398348813005,"extra",NA,"role_play",2161,"TALIESIN"
"2162",118,10336.807,10337.957,"LAURA","melee, not brawl?",1,0,0,0,"End",8,1.14999999999964,4,0.00347826086956632,"extra",NA,"role_play",2162,"LAURA"
"2163",118,10337.957,10339.401,"TALIESIN","no, you have a weapon.",1,0,0,0,"End",8,1.44399999999951,6,0.00415512465374104,"extra",NA,"role_play",2163,"TALIESIN"
"2164",118,10339.401,10340.442,"TRAVIS","you do.",1,0,0,0,"End",8,1.04099999999926,3,0.00288184438040551,"extra",NA,"role_play",2164,"TRAVIS"
"2165",118,10340.442,10342.679,"LAURA","oh, really? that's so dumb.",1,0,0,0,"End",8,2.23700000000099,7,0.00312919088064234,"extra",NA,"role_play",2165,"LAURA"
"2166",118,10342.679,10344.538,"TALIESIN","yeah, take it.",1,0,0,0,"End",8,1.85900000000038,4,0.00215169445938633,"extra",NA,"role_play",2166,"TALIESIN"
"2167",118,10344.538,10346.313,"LAURA","i didn't know that's what it meant.",1,0,0,0,"End",8,1.77499999999964,10,0.00563380281690256,"extra",NA,"role_play",2167,"LAURA"
"2168",118,10346.313,10350.146,"TALIESIN","i'll tell you what. what's your level two power?",1,0,0,0,"End",8,3.83300000000054,12,0.00313070701800113,"extra",NA,"role_play",2168,"TALIESIN"
"2169",118,10350.146,10352.514,"LAURA","obfuscate. unseen presence.",1,0,0,0,"End",8,2.36799999999857,4,0.00168918918919021,"extra",NA,"role_play",2169,"LAURA"
"2170",118,10352.514,10354.143,"TALIESIN","oh, that's right. you're obfuscate. never mind.",1,0,0,0,"End",8,1.62900000000081,10,0.00613873542050031,"extra",NA,"role_play",2170,"TALIESIN"
"2171",118,10354.143,10355.964,"LAURA","i could have done it before he realized what i was doing.",1,0,0,0,"End",8,1.82099999999991,13,0.00713893465129084,"extra",NA,"role_play",2171,"LAURA"
"2172",118,10355.964,10359.675,"TALIESIN","no. you can take a stab. see how it goes.",1,0,0,0,"End",8,3.71099999999933,11,0.00296416060361142,"extra",NA,"role_play",2172,"TALIESIN"
"2173",118,10359.675,10362.319,"LAURA","cool. what? strength plus melee?",1,0,0,0,"End",8,2.64400000000023,6,0.00226928895612688,"extra",NA,"role_play",2173,"LAURA"
"2174",118,10362.319,10363.852,"TALIESIN","i'm letting you do dex melee.",1,0,0,0,"End",8,1.53300000000127,8,0.00521852576646666,"extra",NA,"role_play",2174,"TALIESIN"
"2175",118,10363.852,10365.937,"TRAVIS","i like the impulse to violence.",1,0,0,0,"End",8,2.08499999999913,7,0.00335731414868246,"extra",NA,"role_play",2175,"TRAVIS"
"2176",118,10365.937,10367.082,"TALIESIN","i love it.",1,0,0,0,"End",8,1.14500000000044,4,0.00349344978165806,"extra",NA,"role_play",2176,"TALIESIN"
"2177",118,10367.082,10371.188,"SAM","but you know why she's doing this? it's because we made a pact to stick together. she's protecting me.",1,0,0,0,"End",8,4.10599999999977,23,0.0056015586945936,"extra",NA,"role_play",2177,"SAM"
"2178",118,10372.353,10378.266,"LAURA","that's definitely why i'm doing it, sam. ooh! three successes and a crit! well, just one ten. not technically a crit, but all three were successes.",1,0,0,0,"End",8,5.91300000000047,29,0.00490444782682187,"extra",NA,"role_play",2178,"LAURA"
"2179",118,10381.91,10387.001,"LIAM","shot to the heart, and you're too late.",1,0,0,0,"End",8,5.09100000000035,10,0.00196425063838132,"extra",NA,"role_play",2179,"LIAM"
"2180",118,10387.001,10388.918,"LAURA","god! that's so many dice.",1,0,0,0,"End",8,1.91699999999946,7,0.00365153886280749,"extra",NA,"role_play",2180,"LAURA"
"2181",118,10388.918,10395.656,"TALIESIN","three successes and crit? two successes and a crit. okay. so i'm going to give you success with point. you pin him with the blade to the table.",1,0,0,0,"End",8,6.73800000000119,30,0.00445235975066707,"extra",NA,"role_play",2181,"TALIESIN"
"2182",118,10403.949,10405.442,"LAURA","oh, shit!",1,0,0,0,"End",8,1.49299999999857,3,0.00200937709310306,"extra",NA,"role_play",2182,"LAURA"
"2183",118,10405.442,10410.079,"TALIESIN","""that's uncalled for.""",1,0,0,0,"End",8,4.63700000000063,6,0.00129394004744429,"extra",NA,"role_play",2183,"TALIESIN"
"2184",118,10410.079,10414.688,"LAURA","well, you just seemed like you were probably kind of mean.",1,0,0,0,"End",8,4.60900000000038,12,0.0026036016489475,"extra",NA,"role_play",2184,"LAURA"
"2185",118,10414.688,10419.639,"TALIESIN","""this is really this is a lot. this is a lot.""",1,0,0,0,"End",8,4.95099999999911,13,0.00262573217531859,"extra",NA,"role_play",2185,"TALIESIN"
"2186",118,10419.639,10422.249,"LAURA","i don't know what's going on, ivan. i'm sorry.",1,0,0,0,"End",8,2.61000000000058,13,0.00498084291187628,"extra",NA,"role_play",2186,"LAURA"
"2187",118,10422.249,10423.647,"TRAVIS","is he bleeding profusely?",1,0,0,0,"End",8,1.39800000000105,5,0.00357653791129918,"extra",NA,"role_play",2187,"TRAVIS"
"2188",118,10423.647,10424.727,"TALIESIN","no.",1,0,0,0,"End",8,1.07999999999993,2,0.00185185185185198,"extra",NA,"role_play",2188,"TALIESIN"
"2189",118,10424.727,10426.825,"LIAM","is he bleeding at all?",1,0,0,0,"End",8,2.09799999999996,6,0.00285986653956155,"extra",NA,"role_play",2189,"LIAM"
"2190",118,10426.825,10427.905,"TALIESIN","no.",1,0,0,0,"End",8,1.07999999999993,2,0.00185185185185198,"extra",NA,"role_play",2190,"TALIESIN"
"2191",118,10427.905,10430.144,"TRAVIS","you know what they say about shit that doesn't bleed.",1,0,0,0,"End",8,2.23899999999958,12,0.00535953550692374,"extra",NA,"role_play",2191,"TRAVIS"
"2192",118,10430.144,10432.949,"TALIESIN","he's stuck to the chair, though.",1,0,0,0,"End",8,2.80500000000029,8,0.00285204991087314,"extra",NA,"role_play",2192,"TALIESIN"
"2193",118,10432.949,10435.655,"LAURA","yeah, well, at least maybe, sam, ask your question.",1,0,0,0,"End",8,2.70600000000013,10,0.00369549150036937,"extra",NA,"role_play",2193,"LAURA"
"2194",118,10435.655,10439.929,"TALIESIN","""i feel like there's things that need to be addressed before we get to a question. i want ""to play the game as much as anybody, but""",1,0,0,0,"End",8,4.27399999999943,30,0.0070191857744511,"extra",NA,"role_play",2194,"TALIESIN"
"2195",118,10441.441,10445.477,"LAURA","i mean, i'm just saying. the game is still going on. i totally interrupted the game. you know, we should just i just try to hold him on to the chair. i'm just going to keep holding on.",1,0,0,0,"End",8,4.03600000000006,41,0.0101585728444003,"extra",NA,"role_play",2195,"LAURA"
"2196",118,10448.419,10450.735,"TALIESIN","""no, can you help with this? this is a lot.""",1,0,0,0,"End",8,2.31600000000071,12,0.00518134715025747,"extra",NA,"role_play",2196,"TALIESIN"
"2197",118,10450.735,10453.635,"LAURA","yeah, no, i'm trying to let you go, but i'm definitely trying to keep him in the chair. i'm trying to let it you're not coming off of it.",1,0,0,0,"End",8,2.89999999999964,34,0.011724137931036,"extra",NA,"role_play",2197,"LAURA"
"2198",118,10456.949,10459.038,"TALIESIN","""these prop replicas are really well made. this is not""",1,0,0,0,"End",8,2.08899999999994,12,0.00574437529918637,"extra",NA,"role_play",2198,"TALIESIN"
"2199",118,10459.038,10461.815,"SAM","can i get off the chair that i'm on or no?",1,0,0,0,"End",8,2.77700000000004,13,0.00468131076701469,"extra",NA,"role_play",2199,"SAM"
"2200",118,10461.815,10464.888,"TALIESIN","weirdly, the corpse is making it possible at the moment.",1,0,0,0,"End",8,3.07300000000032,11,0.00357956394402826,"extra",NA,"role_play",2200,"TALIESIN"
"2201",118,10464.888,10470.818,"SAM","oh, okay. i'll stay there so we can ask our questions or whatever.",1,0,0,0,"End",8,5.92999999999847,15,0.00252951096121482,"extra",NA,"role_play",2201,"SAM"
"2202",118,10470.818,10472.218,"LAURA","ask your question, quick.",1,0,0,0,"End",8,1.40000000000146,5,0.00357142857142486,"extra",NA,"role_play",2202,"LAURA"
"2203",118,10472.218,10474.882,"SAM","oh, yes, my question! can we",1,0,0,0,"End",8,2.66399999999885,6,0.00225225225225322,"extra",NA,"role_play",2203,"SAM"
"2204",118,10474.882,10478.08,"TRAVIS","ivan, my wife is very careful about these things.",1,0,0,0,"End",8,3.19800000000032,10,0.00312695434646623,"extra",NA,"role_play",2204,"TRAVIS"
"2205",118,10478.08,10483.186,"TALIESIN","""i understand this has been a very stressful time for everybody, but let's""",1,0,0,0,"End",8,5.10599999999977,16,0.0031335683509598,"extra",NA,"role_play",2205,"TALIESIN"
"2206",118,10483.186,10484.639,"SAM","i just killed max.",1,0,0,0,"End",8,1.45299999999952,5,0.00344115622849391,"extra",NA,"role_play",2206,"SAM"
"2207",118,10484.639,10486.015,"TALIESIN","""yeah, you did.""",1,0,0,0,"End",8,1.3760000000002,5,0.00363372093023202,"extra",NA,"role_play",2207,"TALIESIN"
"2208",118,10486.015,10487.782,"SAM","it's super stressful.",1,0,0,0,"End",8,1.76699999999983,5,0.00282965478211686,"extra",NA,"role_play",2208,"SAM"
"2209",118,10487.782,10489.104,"TALIESIN","""that wasn't cool.""",1,0,0,0,"End",8,1.32200000000012,6,0.00453857791225376,"extra",NA,"role_play",2209,"TALIESIN"
"2210",118,10489.104,10490.083,"SAM","sorry.",1,0,0,0,"End",8,0.979000000001179,2,0.00204290091930295,"extra",NA,"role_play",2210,"SAM"
"2211",118,10490.083,10494.422,"TALIESIN","""that was really uncalled for. like, it's all fun and games, sure, and we poke you a ""little bit here. i'm going to poke you, but come on! jeez.""",1,0,0,0,"End",8,4.33899999999994,33,0.00760543904125385,"extra",NA,"role_play",2211,"TALIESIN"
"2212",118,10500.362,10504.416,"LIAM","i'm going to come up behind laura and press into her elbow and i'll press the blade in and use awe again and say: ivan, i mean it's really all about leverage, right? we need some information and i feel like we've earned it.",1,0,0,0,"End",8,4.05400000000009,49,0.0120868278243707,"extra",NA,"role_play",2212,"LIAM"
"2213",118,10513.507,10515.361,"TALIESIN","what's the roll for that?",1,0,0,0,"End",8,1.85400000000118,7,0.00377562028047225,"extra",NA,"role_play",2213,"TALIESIN"
"2214",118,10515.361,10516.859,"LIAM","charisma plus persuasion.",1,0,0,0,"End",8,1.49799999999959,4,0.00267022696929312,"extra",NA,"role_play",2214,"LIAM"
"2215",118,10516.859,10518.746,"TALIESIN","this is going to be interesting. is it versus anything?",1,0,0,0,"End",8,1.88699999999881,11,0.00582935877053893,"extra",NA,"role_play",2215,"TALIESIN"
"2216",118,10518.746,10519.898,"LIAM","no.",1,0,0,0,"End",8,1.15200000000004,2,0.00173611111111105,"extra",NA,"role_play",2216,"LIAM"
"2217",118,10519.898,10521.475,"TALIESIN","okay, charisma persuasion.",1,0,0,0,"End",8,1.57700000000114,4,0.00253646163601593,"extra",NA,"role_play",2217,"TALIESIN"
"2218",118,10521.475,10525.929,"LAURA","doesn't he have to take a hunger dice for it?",1,0,0,0,"End",8,4.45399999999972,12,0.00269420745397412,"extra",NA,"role_play",2218,"LAURA"
"2219",118,10525.929,10527.303,"TALIESIN","oh yeah, he's going to take a hunger die.",1,0,0,0,"End",8,1.3739999999998,11,0.00800582241630395,"extra",NA,"role_play",2219,"TALIESIN"
"2220",118,10527.303,10528.955,"TRAVIS","you try to screw over your",1,0,0,0,"End",8,1.65200000000004,6,0.00363196125907981,"extra",NA,"role_play",2220,"TRAVIS"
"2221",118,10528.955,10530.873,"LAURA","i know, i'm sorry.",1,0,0,0,"End",8,1.91799999999967,6,0.0031282586027117,"extra",NA,"role_play",2221,"LAURA"
"2222",118,10530.873,10533.144,"TALIESIN","old habits, man.",1,0,0,0,"End",8,2.27100000000064,4,0.00176133861734869,"extra",NA,"role_play",2222,"TALIESIN"
"2223",118,10533.144,10535.384,"LAURA","i'm really bad.",1,0,0,0,"End",8,2.23999999999978,5,0.00223214285714307,"extra",NA,"role_play",2223,"LAURA"
"2224",118,10535.384,10540.87,"LIAM","charisma plus persuasion and one hunger die. all right, what do we got here? nice.",1,0,0,0,"End",8,5.48600000000079,16,0.00291651476485558,"extra",NA,"role_play",2224,"LIAM"
"2225",118,10540.87,10544.684,"LAURA","you just got to kill someone in order to",1,0,0,0,"End",8,3.81399999999849,9,0.00235972732039947,"extra",NA,"role_play",2225,"LAURA"
"2226",118,10544.684,10546.864,"LIAM","i've got two successes.",1,0,0,0,"End",8,2.18000000000029,6,0.00275229357798128,"extra",NA,"role_play",2226,"LIAM"
"2227",118,10546.864,10551.082,"TALIESIN","oh. yeah, he critted against you.",1,0,0,0,"End",8,4.21800000000076,7,0.00165955429113294,"extra",NA,"role_play",2227,"TALIESIN"
"2228",118,10551.082,10552.866,"LIAM","oh, that didn't work.",1,0,0,0,"End",8,1.78399999999965,6,0.00336322869955223,"extra",NA,"role_play",2228,"LIAM"
"2229",118,10552.866,10555.097,"TALIESIN","that didn't work, but you're still going to take your hunger die.",1,0,0,0,"End",8,2.23099999999977,15,0.00672344240251079,"extra",NA,"role_play",2229,"TALIESIN"
"2230",118,10555.097,10556.777,"LIAM","yeah, all right.",1,0,0,0,"End",8,1.68000000000029,4,0.00238095238095197,"extra",NA,"role_play",2230,"LIAM"
"2231",118,10556.777,10567.661,"TALIESIN","""come on, that's just not necessary. what do you need to know?""",1,0,0,0,"End",8,10.884,15,0.00137816979051819,"extra",NA,"role_play",2231,"TALIESIN"
"2232",118,10567.661,10569.427,"LAURA","what do you need to know?",1,0,0,0,"End",8,1.76599999999962,7,0.00396375990940062,"extra",NA,"role_play",2232,"LAURA"
"2233",118,10569.427,10572.117,"TALIESIN","""let's just deal with this.""",1,0,0,0,"End",8,2.69000000000051,8,0.00297397769516672,"extra",NA,"role_play",2233,"TALIESIN"
"2234",118,10572.117,10578.785,"SAM","what did we find out so far?",1,0,0,0,"End",8,6.66799999999967,8,0.00119976004799046,"extra",NA,"role_play",2234,"SAM"
