"","Episode","startTime","endTime","Actor","Text","vox_machina","guest","staff","Matt","Arc","Arc_no","timeDiffInSecs","wordCount","WordsPerMillisec","segment","encounter_count","rp_combat","turn_number","CR_GUEST"
"1403",118,7213.405,7217.952,"TALIESIN","especially if you want to burn a little blood, you can see really well if you're looking for something in particular, but it's the prop closet. it's a ruined, dishevelled mess of ephemera, toys, prop weapons, costumes. it's exactly the way you remember it.",1,0,0,0,"End",8,4.54700000000048,49,0.0107763360457433,"extra",NA,"role_play",1403,"TALIESIN"
"1404",118,7235.738,7238.045,"TRAVIS","do i smell anything coming from this room?",1,0,0,0,"End",8,2.30699999999979,9,0.00390117035110569,"extra",NA,"role_play",1404,"TRAVIS"
"1405",118,7238.045,7241.272,"TALIESIN","yes, but it is the same smell it's always had, which has been very iffy.",1,0,0,0,"End",8,3.22699999999986,17,0.00526805082119638,"extra",NA,"role_play",1405,"TALIESIN"
"1406",118,7241.272,7246.193,"TRAVIS","nothing tasty or spicy or interesting? i mean, spicy is the wrong word. it's always spicy in there.",1,0,0,0,"End",8,4.92100000000028,20,0.00406421459053015,"extra",NA,"role_play",1406,"TRAVIS"
"1407",118,7247.153,7249.568,"TALIESIN","i don't know. it's whatever you really imagine, the wonderful",1,0,0,0,"End",8,2.41499999999996,12,0.00496894409937896,"extra",NA,"role_play",1407,"TALIESIN"
"1408",118,7249.568,7251.993,"TRAVIS","does it smell delicious?",1,0,0,0,"End",8,2.42500000000018,5,0.00206185567010294,"extra",NA,"role_play",1408,"TRAVIS"
"1409",118,7251.993,7255.343,"TALIESIN","there's obviously some rats living in here, if you went diving for them.",1,0,0,0,"End",8,3.34999999999945,15,0.00447761194029924,"extra",NA,"role_play",1409,"TALIESIN"
"1410",118,7255.343,7261.333,"LAURA","can we look for rats? i need a rat. i want to eat a rat again. it was really good.",1,0,0,0,"End",8,5.98999999999978,21,0.00350584307178644,"extra",NA,"role_play",1410,"LAURA"
"1411",118,7261.333,7262.925,"TALIESIN","it was pretty good.",1,0,0,0,"End",8,1.59200000000055,5,0.00314070351758685,"extra",NA,"role_play",1411,"TALIESIN"
"1412",118,7262.925,7264.719,"LAURA","i'm serious.",1,0,0,0,"End",8,1.79399999999987,4,0.00222965440356761,"extra",NA,"role_play",1412,"LAURA"
"1413",118,7264.719,7266.16,"SAM","all right. i'll try to look for a rat with her.",1,0,0,0,"End",8,1.4409999999998,13,0.00902151283830796,"extra",NA,"role_play",1413,"SAM"
"1414",118,7266.16,7269.238,"TALIESIN","all right. do a perception investigation.",1,0,0,0,"End",8,3.07800000000043,7,0.00227420402858968,"extra",NA,"role_play",1414,"TALIESIN"
"1415",118,7269.238,7275.527,"LIAM","can i go back? i forgot something that i wanted to do. back at the office, inside the bullpen.",1,0,0,0,"End",8,6.28899999999976,20,0.00318015582763568,"extra",NA,"role_play",1415,"LIAM"
"1416",118,7276.68,7278.644,"TRAVIS","you guys are okay here looking for rats, right? i'm going to go with liam.",1,0,0,0,"End",8,1.96399999999994,17,0.00865580448065199,"extra",NA,"role_play",1416,"TRAVIS"
"1417",118,7278.644,7280.157,"TALIESIN","you can take a look.",1,0,0,0,"End",8,1.51299999999992,6,0.00396563119629895,"extra",NA,"role_play",1417,"TALIESIN"
"1418",118,7280.157,7282.433,"SAM","only one success and one failure with the red dice.",1,0,0,0,"End",8,2.27599999999984,11,0.00483304042179296,"extra",NA,"role_play",1418,"SAM"
"1419",118,7282.433,7285.852,"TALIESIN","you find a rubber rat and you bite it.",1,0,0,0,"End",8,3.41899999999987,10,0.00292483182217034,"extra",NA,"role_play",1419,"TALIESIN"
"1420",118,7285.852,7288.187,"LAURA","three successes for me.",1,0,0,0,"End",8,2.33500000000004,5,0.00214132762312631,"extra",NA,"role_play",1420,"LAURA"
"1421",118,7288.187,7293.637,"TALIESIN","i'm personally a fan of the taste of rubber rats. i think it's nice and the texture's pretty positive but your tooth gets a little weird. it doesn't feel right.",1,0,0,0,"End",8,5.44999999999982,35,0.00642201834862407,"extra",NA,"role_play",1421,"TALIESIN"
"1422",118,7299.097,7300.685,"LAURA","three successes.",1,0,0,0,"End",8,1.58800000000065,3,0.0018891687657423,"extra",NA,"role_play",1422,"LAURA"
"1423",118,7300.685,7308.92,"TALIESIN","three successes? ooh, that's pretty solid. you do in fact find a rat hiding behind one of the costume bins and if you want to tear for it, you got to give me a dex melee or dex brawl. roll for it.",1,0,0,0,"End",8,8.23499999999967,44,0.005343047965999,"extra",NA,"role_play",1423,"TALIESIN"
"1424",118,7318.22,7319.489,"LAURA","i'll do a dex brawl.",1,0,0,0,"End",8,1.26899999999932,7,0.00551615445232761,"extra",NA,"role_play",1424,"LAURA"
"1425",118,7319.489,7324.224,"TALIESIN","all right. punch that rat. where are you guys going?",1,0,0,0,"End",8,4.73500000000058,11,0.00232312565997859,"extra",NA,"role_play",1425,"TALIESIN"
"1426",118,7324.224,7328.948,"LIAM","i'm back at the office, outside the bullpen where the door was shut. who all's wearing these signs? it was arcade",1,0,0,0,"End",8,4.72400000000016,23,0.00486875529212515,"extra",NA,"role_play",1426,"LIAM"
"1427",118,7331.173,7333.342,"TALIESIN AND TRAVIS","chris, arcade.",1,0,0,0,"End",8,2.16899999999987,3,0.00138312586445375,"extra",NA,"role_play",1427,"TALIESIN AND TRAVIS"
"1428",118,7333.342,7336.283,"TALIESIN","audrey was there. max was there. a couple of people.",1,0,0,0,"End",8,2.94100000000071,11,0.0037402244134639,"extra",NA,"role_play",1428,"TALIESIN"
"1429",118,7336.283,7337.554,"LAURA","just one success.",1,0,0,0,"End",8,1.27099999999973,4,0.00314712824547667,"extra",NA,"role_play",1429,"LAURA"
"1430",118,7337.554,7340.228,"TALIESIN","it's a rat. i'll let you have it for one.",1,0,0,0,"End",8,2.67399999999998,13,0.00486163051608082,"extra",NA,"role_play",1430,"TALIESIN"
"1431",118,7340.228,7343.139,"LAURA","can i share it with sam, though?",1,0,0,0,"End",8,2.91100000000006,8,0.00274819649604941,"extra",NA,"role_play",1431,"LAURA"
"1432",118,7343.139,7344.751,"TALIESIN","no.",1,0,0,0,"End",8,1.61200000000008,2,0.00124069478908182,"extra",NA,"role_play",1432,"TALIESIN"
"1433",118,7344.751,7347.429,"LAURA","i have to eat the rat all myself? okay, i eat the rat.",1,0,0,0,"End",8,2.67799999999988,14,0.00522778192681128,"extra",NA,"role_play",1433,"LAURA"
"1434",118,7347.429,7348.876,"TALIESIN","how many red dice do you have?",1,0,0,0,"End",8,1.44700000000012,8,0.00552868002764295,"extra",NA,"role_play",1434,"TALIESIN"
"1435",118,7348.876,7349.955,"LAURA","just one.",1,0,0,0,"End",8,1.07899999999972,3,0.00278035217794325,"extra",NA,"role_play",1435,"LAURA"
"1436",118,7349.955,7351.013,"TALIESIN","it doesn't go away.",1,0,0,0,"End",8,1.05799999999999,6,0.00567107750472594,"extra",NA,"role_play",1436,"TALIESIN"
"1437",118,7351.013,7352.706,"LIAM","and the sign says what again?",1,0,0,0,"End",8,1.69300000000021,7,0.00413467217956239,"extra",NA,"role_play",1437,"LIAM"
"1438",118,7352.706,7354.308,"TALIESIN","drink me.",1,0,0,0,"End",8,1.60199999999986,3,0.00187265917603012,"extra",NA,"role_play",1438,"TALIESIN"
"1439",118,7354.308,7358.707,"LAURA","i tried, i wanted to but it's such a little rat.",1,0,0,0,"End",8,4.39900000000034,13,0.00295521709479404,"extra",NA,"role_play",1439,"LAURA"
"1440",118,7358.707,7362.731,"SAM","i'd say you're dead to me, but",1,0,0,0,"End",8,4.02399999999943,9,0.00223658051689892,"extra",NA,"role_play",1440,"SAM"
"1441",118,7362.731,7366.12,"LIAM","don't judge. i bite arcade's neck.",1,0,0,0,"End",8,3.38900000000012,9,0.00265565063440533,"extra",NA,"role_play",1441,"LIAM"
"1442",118,7367.934,7369.625,"TALIESIN","he's going to try and fight you off.",1,0,0,0,"End",8,1.6909999999998,10,0.00591366055588478,"extra",NA,"role_play",1442,"TALIESIN"
"1443",118,7369.625,7372.464,"LAURA","you're going to suck arcade's blood?",1,0,0,0,"End",8,2.83899999999994,9,0.0031701303275802,"extra",NA,"role_play",1443,"LAURA"
"1444",118,7372.464,7373.786,"LIAM","i am.",1,0,0,0,"End",8,1.32200000000012,3,0.00226928895612688,"extra",NA,"role_play",1444,"LIAM"
"1445",118,7373.786,7377.958,"TALIESIN","he starts to panic and as it is happening, he's going to fight you off.",1,0,0,0,"End",8,4.17199999999957,17,0.00407478427612698,"extra",NA,"role_play",1445,"TALIESIN"
"1446",118,7377.958,7382.688,"LIAM","i use dread gaze and inspire unbearable immobility.",1,0,0,0,"End",8,4.73000000000047,9,0.00190274841437613,"extra",NA,"role_play",1446,"LIAM"
"1447",118,7382.688,7385.208,"TALIESIN","what's the roll on that?",1,0,0,0,"End",8,2.51999999999953,7,0.0027777777777783,"extra",NA,"role_play",1447,"TALIESIN"
"1448",118,7385.208,7389.954,"LIAM","charisma plus intimidation versus charisma and willpower.",1,0,0,0,"End",8,4.74600000000009,8,0.00168563000421404,"extra",NA,"role_play",1448,"LIAM"
"1449",118,7389.954,7400.051,"TALIESIN","all right. give me charisma intimidation. and my charisma willpower for my humans. there we are.",1,0,0,0,"End",8,10.0970000000007,17,0.00168366841636119,"extra",NA,"role_play",1449,"TALIESIN"
"1450",118,7401.587,7411.084,"LIAM","and failure is a one. so one success. no failures.",1,0,0,0,"End",8,9.49699999999939,11,0.00115826050331691,"extra",NA,"role_play",1450,"LIAM"
"1451",118,7411.084,7414.259,"TALIESIN","he's not frozen. he's hiding in the corner.",1,0,0,0,"End",8,3.17500000000018,11,0.00346456692913366,"extra",NA,"role_play",1451,"TALIESIN"
"1452",118,7414.259,7418.209,"LIAM","okay. i grab a couple of t-shirts and i push",1,0,0,0,"End",8,3.94999999999982,11,0.00278481012658241,"extra",NA,"role_play",1452,"LIAM"
"1453",118,7418.209,7419.457,"TALIESIN","which t-shirts?",1,0,0,0,"End",8,1.2480000000005,4,0.00320512820512692,"extra",NA,"role_play",1453,"TALIESIN"
"1454",118,7419.457,7422.645,"LIAM","the stayturnt t-shirt and the dungeon master t-shirt.",1,0,0,0,"End",8,3.1880000000001,11,0.00345043914680039,"extra",NA,"role_play",1454,"LIAM"
"1455",118,7422.645,7423.914,"TALIESIN","thank you for being respectful.",1,0,0,0,"End",8,1.26899999999932,6,0.00472813238770938,"extra",NA,"role_play",1455,"TALIESIN"
"1456",118,7423.914,7430.766,"LIAM","and i cover his hands up and i say: can you just give into it? you know, this is terrible for both of us.",1,0,0,0,"End",8,6.85199999999986,25,0.0036485697606539,"extra",NA,"role_play",1456,"LIAM"
"1457",118,7431.85,7433.623,"TALIESIN","there's a single tear.",1,0,0,0,"End",8,1.77299999999923,6,0.0033840947546546,"extra",NA,"role_play",1457,"TALIESIN"
"1458",118,7433.623,7435.495,"LIAM","i know. but it will all be over soon.",1,0,0,0,"End",8,1.8720000000003,10,0.00534188034187949,"extra",NA,"role_play",1458,"LIAM"
"1459",118,7435.495,7438.914,"TRAVIS","i'm standing behind liam, holding the prop knife to the rest of the room. is there anybody moving towards liam?",1,0,0,0,"End",8,3.41899999999987,22,0.00643463000877474,"extra",NA,"role_play",1459,"TRAVIS"
"1460",118,7440.082,7445.341,"TALIESIN","no. i get the distinct impression this has already happened. they know what's going down.",1,0,0,0,"End",8,5.25900000000001,17,0.00323255371743677,"extra",NA,"role_play",1460,"TALIESIN"
"1461",118,7445.341,7448.999,"LIAM","i mean, we're through the looking glass here, arcade. i'm really sorry, but i'm going to try to bite him again.",1,0,0,0,"End",8,3.65799999999945,25,0.00683433570257074,"extra",NA,"role_play",1461,"LIAM"
"1462",118,7450.229,7452.851,"TALIESIN","are you going to go for a bite?",1,0,0,0,"End",8,2.62199999999939,9,0.003432494279177,"extra",NA,"role_play",1462,"TALIESIN"
"1463",118,7452.851,7453.678,"LIAM","yes, please.",1,0,0,0,"End",8,0.827000000000226,3,0.00362756952841497,"extra",NA,"role_play",1463,"LIAM"
"1464",118,7453.678,7468.395,"TALIESIN","give me a strength brawl. let me double-check. hold on. actually, strength brawl plus two.",1,0,0,0,"End",8,14.7170000000006,17,0.00115512672419646,"extra",NA,"role_play",1464,"TALIESIN"
"1465",118,7469.731,7477.597,"LIAM","strength brawl? brawl's nothing. so strength brawl plus two. okay, it's not good. i got a fail!",1,0,0,0,"End",8,7.86599999999999,20,0.00254258835494534,"extra",NA,"role_play",1465,"LIAM"
"1466",118,7477.597,7479.375,"LAURA","you got two fails, yo!",1,0,0,0,"End",8,1.77800000000025,6,0.00337457817772731,"extra",NA,"role_play",1466,"LAURA"
"1467",118,7479.375,7481.575,"LIAM","two fails! one on the red.",1,0,0,0,"End",8,2.19999999999982,7,0.00318181818181844,"extra",NA,"role_play",1467,"LIAM"
"1468",118,7481.575,7489.839,"TALIESIN","one on the red. he manages to just barely fight you off. he's hidden under the desk now. he's trying to crawl away.",1,0,0,0,"End",8,8.26400000000012,26,0.00314617618586636,"extra",NA,"role_play",1468,"TALIESIN"
"1469",118,7491.183,7492.219,"TRAVIS","what are you doing?",1,0,0,0,"End",8,1.03600000000006,5,0.00482625482625455,"extra",NA,"role_play",1469,"TRAVIS"
"1470",118,7492.219,7493.642,"LIAM","fuck it. i whip around and turn on chris.",1,0,0,0,"End",8,1.42299999999977,10,0.00702740688685986,"extra",NA,"role_play",1470,"LIAM"
"1471",118,7493.642,7499.246,"TALIESIN","give me a strength brawl plus two.",1,0,0,0,"End",8,5.60400000000027,8,0.00142755174875082,"extra",NA,"role_play",1471,"TALIESIN"
"1472",118,7499.246,7500.887,"TRAVIS","are we eating people? what's happening?",1,0,0,0,"End",8,1.64099999999962,8,0.00487507617306633,"extra",NA,"role_play",1472,"TRAVIS"
"1473",118,7500.887,7503.076,"LAURA","he's giving in to it.",1,0,0,0,"End",8,2.18900000000031,7,0.00319780721790727,"extra",NA,"role_play",1473,"LAURA"
"1474",118,7503.076,7505.667,"LIAM","that's better. that's two successes.",1,0,0,0,"End",8,2.59100000000035,8,0.0030876109610185,"extra",NA,"role_play",1474,"LIAM"
"1475",118,7505.667,7516.87,"TALIESIN","all right. you get one point back. you lose one. do you want to go any further? keep drinking or do you want to",1,0,0,0,"End",8,11.2029999999995,24,0.00214228331696876,"extra",NA,"role_play",1475,"TALIESIN"
"1476",118,7518.361,7520.167,"LIAM","yeah.",1,0,0,0,"End",8,1.80600000000049,2,0.00110741971207057,"extra",NA,"role_play",1476,"LIAM"
"1477",118,7520.167,7522.778,"LAURA","you can't get rid of your other one!",1,0,0,0,"End",8,2.61099999999988,10,0.00382995021064744,"extra",NA,"role_play",1477,"LAURA"
"1478",118,7522.778,7524.098,"LIAM","you can't get rid of the other one?",1,0,0,0,"End",8,1.31999999999971,10,0.00757575757575925,"extra",NA,"role_play",1478,"LIAM"
"1479",118,7524.098,7526.128,"TALIESIN","i'm sure there's a way to do it.",1,0,0,0,"End",8,2.02999999999975,11,0.00541871921182334,"extra",NA,"role_play",1479,"TALIESIN"
"1480",118,7526.128,7533.432,"LIAM","so you always keep one? if i'm okay-ish, i'll hold off. i'll see you later, though.",1,0,0,0,"End",8,7.30400000000009,21,0.00287513691128146,"extra",NA,"role_play",1480,"LIAM"
"1481",118,7533.432,7540.584,"TALIESIN","he's now bleeding from the neck. as he goes back to his not pouring, but bleeding.",1,0,0,0,"End",8,7.15200000000004,18,0.00251677852348992,"extra",NA,"role_play",1481,"TALIESIN"
"1482",118,7540.584,7543.468,"TRAVIS","is there a little coagulant in liam's spit, at least?",1,0,0,0,"End",8,2.88400000000001,12,0.00416088765603327,"extra",NA,"role_play",1482,"TRAVIS"
"1483",118,7543.468,7545.149,"LIAM","but everybody likes me here, travis.",1,0,0,0,"End",8,1.68100000000049,7,0.00416418798334202,"extra",NA,"role_play",1483,"LIAM"
"1484",118,7545.149,7546.931,"TRAVIS","i know they do.",1,0,0,0,"End",8,1.78199999999924,5,0.00280583613917066,"extra",NA,"role_play",1484,"TRAVIS"
"1485",118,7546.931,7550.578,"TALIESIN","are you backing out of the room now to join the rest?",1,0,0,0,"End",8,3.64700000000084,13,0.00356457362215437,"extra",NA,"role_play",1485,"TALIESIN"
"1486",118,7550.578,7554.775,"LIAM","is there any other weapon-y stuff in the room?",1,0,0,0,"End",8,4.19699999999921,11,0.00262091970455136,"extra",NA,"role_play",1486,"LIAM"
"1487",118,7554.775,7556.501,"TALIESIN","not that you can see.",1,0,0,0,"End",8,1.72600000000057,6,0.00347624565469179,"extra",NA,"role_play",1487,"TALIESIN"
"1488",118,7556.501,7558.405,"LIAM","is there anything ridiculous like",1,0,0,0,"End",8,1.90399999999954,5,0.0026260504201687,"extra",NA,"role_play",1488,"LIAM"
"1489",118,7558.405,7560.701,"TALIESIN","you've seen that office. everything's ridiculous.",1,0,0,0,"End",8,2.29600000000028,9,0.00391986062717723,"extra",NA,"role_play",1489,"TALIESIN"
"1490",118,7560.701,7564.749,"LIAM","yeah. all right.",1,0,0,0,"End",8,4.04799999999977,4,0.000988142292490174,"extra",NA,"role_play",1490,"LIAM"
"1491",118,7564.749,7568.275,"LAURA","i'm looking for a weapon in the prop closet with the rats.",1,0,0,0,"End",8,3.52599999999984,14,0.00397050482132746,"extra",NA,"role_play",1491,"LAURA"
"1492",118,7568.275,7571.535,"SAM","i'm helping her and while we're looking i'm telling her",1,0,0,0,"End",8,3.26000000000022,13,0.00398773006134943,"extra",NA,"role_play",1492,"SAM"
"1493",118,7571.535,7575.515,"TALIESIN","perception investigation. you can combine your roll if you like.",1,0,0,0,"End",8,3.98000000000047,11,0.00276381909547706,"extra",NA,"role_play",1493,"TALIESIN"
"1494",118,7575.515,7578.268,"LIAM","i swing past the office supplies and grab a fistful of pencils.",1,0,0,0,"End",8,2.7529999999997,13,0.00472212132219448,"extra",NA,"role_play",1494,"LIAM"
"1495",118,7578.268,7585.11,"TALIESIN","good call. perception investigation. as you walk by, you see dani come walking through the office. she smiles, walks by. you see her go into the office and she says, ""chris, we need you to ""help update the server. come on."" and then she walks by, carrying the bleeding chris over to the server room.",1,0,0,0,"End",8,6.84199999999964,56,0.00818474130371279,"extra",NA,"role_play",1495,"TALIESIN"
"1496",118,7601.088,7602.241,"LAURA","what were you going to say, sam?",1,0,0,0,"End",8,1.15300000000025,8,0.00693842150910519,"extra",NA,"role_play",1496,"LAURA"
"1497",118,7602.241,7609.25,"SAM","i'm was going to say, i'm feeling very vulnerable. why don't we form an alliance and if anything goes down, we kick liam down and we'll run away as fast as we can.",1,0,0,0,"End",8,7.00900000000001,38,0.00542160079897274,"extra",NA,"role_play",1497,"SAM"
"1498",118,7617.79,7619.912,"LAURA","but we'll also make sure",1,0,0,0,"End",8,2.1220000000003,6,0.00282752120640865,"extra",NA,"role_play",1498,"LAURA"
"1499",118,7619.912,7622.559,"TALIESIN","sam, do you no. i'm just waving this.",1,0,0,0,"End",8,2.64699999999993,10,0.00377786173026077,"extra",NA,"role_play",1499,"TALIESIN"
"1500",118,7622.559,7624.562,"LIAM","you also have no idea that i just drained chris' neck.",1,0,0,0,"End",8,2.0029999999997,12,0.00599101347978122,"extra",NA,"role_play",1500,"LIAM"
"1501",118,7624.562,7626.51,"LAURA","we'll make sure travis is okay.",1,0,0,0,"End",8,1.94800000000032,8,0.00410677618069748,"extra",NA,"role_play",1501,"LAURA"
"1502",118,7626.51,7631.129,"SAM","of course. yes. but liam's a goner.",1,0,0,0,"End",8,4.61899999999969,9,0.00194847369560524,"extra",NA,"role_play",1502,"SAM"
"1503",118,7631.129,7643.64,"LAURA","i mean, he's a pretty fast runner. i'm probably the slowest out of all of us. i got two tens.",1,0,0,0,"End",8,12.5110000000004,23,0.00183838222364313,"extra",NA,"role_play",1503,"LAURA"
"1504",118,7643.64,7652.074,"TALIESIN","two tens. that's a critical. that is a critical. you have found some world of warcraft prop swords. see, i did know where they were. i did. there were right here. i know you're not watching, marisha. i knew where they were. you found some prop stakes, but to be fair, a prop stake is still a piece of wood. that's still stake-y.",1,0,0,0,"End",8,8.43399999999929,68,0.00806260374674007,"extra",NA,"role_play",1504,"TALIESIN"
"1505",118,7668.15,7669.356,"LAURA","how many stakes?",1,0,0,0,"End",8,1.20600000000013,4,0.00331674958540594,"extra",NA,"role_play",1505,"LAURA"
"1506",118,7669.356,7676.493,"TALIESIN","you found two stakes and you found a very weird silver chalice. it's interesting-looking. could be something. could be nothing. no idea.",1,0,0,0,"End",8,7.13700000000063,25,0.00350287235533106,"extra",NA,"role_play",1506,"TALIESIN"
"1507",118,7679.96,7683.508,"LAURA","i stick that in my belt like i would at a ren faire.",1,0,0,0,"End",8,3.54799999999977,14,0.00394588500563723,"extra",NA,"role_play",1507,"LAURA"
"1508",118,7683.508,7685.63,"TALIESIN","ren-faire style.",1,0,0,0,"End",8,2.1220000000003,4,0.00188501413760577,"extra",NA,"role_play",1508,"TALIESIN"
"1509",118,7685.63,7690.654,"LAURA","yeah. did i find a world of warcraft weapon too?",1,0,0,0,"End",8,5.02400000000034,11,0.00218949044585972,"extra",NA,"role_play",1509,"LAURA"
"1510",118,7690.654,7693.469,"TALIESIN","yeah. it's a big ridiculous sword that would hang on a wall.",1,0,0,0,"End",8,2.8149999999996,14,0.0049733570159865,"extra",NA,"role_play",1510,"TALIESIN"
"1511",118,7693.469,7695.565,"LAURA","whoa. is it made of metal?",1,0,0,0,"End",8,2.09599999999955,7,0.00333969465648927,"extra",NA,"role_play",1511,"LAURA"
"1512",118,7695.565,7696.941,"TALIESIN","it's made out of a metal.",1,0,0,0,"End",8,1.3760000000002,8,0.00581395348837123,"extra",NA,"role_play",1512,"TALIESIN"
"1513",118,7696.941,7698.682,"LAURA","this is way too heavy for me.",1,0,0,0,"End",8,1.74099999999999,8,0.00459506031016661,"extra",NA,"role_play",1513,"LAURA"
"1514",118,7698.682,7702.499,"TALIESIN","actually, what's your strength?",1,0,0,0,"End",8,3.81700000000001,6,0.0015719151165837,"extra",NA,"role_play",1514,"TALIESIN"
"1515",118,7702.499,7704.365,"LAURA","two.",1,0,0,0,"End",8,1.86599999999999,2,0.00107181136120044,"extra",NA,"role_play",1515,"LAURA"
"1516",118,7704.365,7711.383,"TALIESIN","that's pretty good. that's a 110 pound that's a normal human. you're not quite supernatural, but you could be fine with it.",1,0,0,0,"End",8,7.01800000000003,27,0.00384724992875461,"extra",NA,"role_play",1516,"TALIESIN"
"1517",118,7715.339,7716.709,"LAURA","yeah?",1,0,0,0,"End",8,1.36999999999989,2,0.00145985401459866,"extra",NA,"role_play",1517,"LAURA"
"1518",118,7716.709,7721.112,"TRAVIS","so liam and i make our way out. are we sharing with the others what just happened?",1,0,0,0,"End",8,4.40300000000025,18,0.00408812173518033,"extra",NA,"role_play",1518,"TRAVIS"
"1519",118,7721.112,7722.579,"LAURA AND SAM","what just happened?",1,0,0,0,"End",8,1.46699999999964,4,0.00272665303340216,"extra",NA,"role_play",1519,"LAURA AND SAM"
"1520",118,7722.579,7724,"LIAM","that's a bad idea.",1,0,0,0,"End",8,1.42100000000028,6,0.00422237860661424,"extra",NA,"role_play",1520,"LIAM"
"1521",118,7724,7725.148,"LAURA","what was it?",1,0,0,0,"End",8,1.14800000000014,4,0.00348432055749087,"extra",NA,"role_play",1521,"LAURA"
"1522",118,7725.148,7727.949,"TRAVIS","we canvassed the offices and found",1,0,0,0,"End",8,2.80099999999948,6,0.00214209210996113,"extra",NA,"role_play",1522,"TRAVIS"
"1523",118,7727.949,7730.918,"LIAM","well, we wanted to find more weapons.",1,0,0,0,"End",8,2.96900000000005,8,0.00269450993600534,"extra",NA,"role_play",1523,"LIAM"
"1524",118,7730.918,7733.372,"TRAVIS","yeah, i found this dagger! it's not super sharp, but",1,0,0,0,"End",8,2.45400000000063,11,0.00448247758761091,"extra",NA,"role_play",1524,"TRAVIS"
"1525",118,7733.372,7734.445,"SAM","i found a sword!",1,0,0,0,"End",8,1.07299999999941,5,0.0046598322460417,"extra",NA,"role_play",1525,"SAM"
"1526",118,7734.445,7735.45,"LIAM","i got a bunch of pencils.",1,0,0,0,"End",8,1.00500000000011,7,0.00696517412935248,"extra",NA,"role_play",1526,"LIAM"
"1527",118,7735.45,7739.231,"LAURA","look at this big-ass sword i found! do you want to switch me?",1,0,0,0,"End",8,3.78099999999995,15,0.00396720444326903,"extra",NA,"role_play",1527,"LAURA"
"1528",118,7739.231,7741.176,"LIAM","maybe other people are vampires like us.",1,0,0,0,"End",8,1.94500000000062,8,0.00411311053984445,"extra",NA,"role_play",1528,"LIAM"
"1529",118,7741.176,7742.684,"LAURA","i'll take the dagger and you take the giant sword?",1,0,0,0,"End",8,1.50799999999981,12,0.00795755968169861,"extra",NA,"role_play",1529,"LAURA"
"1530",118,7742.684,7743.986,"TRAVIS","yeah.",1,0,0,0,"End",8,1.30199999999968,2,0.00153609831029224,"extra",NA,"role_play",1530,"TRAVIS"
"1531",118,7743.986,7746.247,"LAURA","okay. all right.",1,0,0,0,"End",8,2.26100000000042,4,0.00176912870411289,"extra",NA,"role_play",1531,"LAURA"
"1532",118,7746.247,7750.893,"TALIESIN","it's a good dagger. it's the s-curled one, it's got the nice little",1,0,0,0,"End",8,4.64599999999973,17,0.00365906155832996,"extra",NA,"role_play",1532,"TALIESIN"
"1533",118,7750.893,7753.128,"LAURA","this is really badass.",1,0,0,0,"End",8,2.23499999999967,5,0.00223713646532471,"extra",NA,"role_play",1533,"LAURA"
"1534",118,7753.128,7756.519,"LIAM","my internal monologue right now is really pissed off that i did not get to taste arcade.",1,0,0,0,"End",8,3.39100000000053,18,0.00530816868180395,"extra",NA,"role_play",1534,"LIAM"
"1535",118,7756.519,7762.476,"TALIESIN","i know. you know, there's still time. things can still get weird. we'll see.",1,0,0,0,"End",8,5.95699999999943,17,0.00285378546248139,"extra",NA,"role_play",1535,"TALIESIN"
"1536",118,7762.476,7764.081,"TRAVIS","did you find anything out about the puzzle?",1,0,0,0,"End",8,1.60500000000047,9,0.00560747663551237,"extra",NA,"role_play",1536,"TRAVIS"
"1537",118,7764.081,7767.239,"LAURA","oh shit. i forgot we were trying to solve a puzzle.",1,0,0,0,"End",8,3.15799999999945,12,0.00379987333755608,"extra",NA,"role_play",1537,"LAURA"
"1538",118,7767.239,7773.15,"SAM","why don't we all look for puzzle clues? or should we try to do more to the that circle on the ground, taliesin. how big is it?",1,0,0,0,"End",8,5.91100000000006,29,0.00490610725765517,"extra",NA,"role_play",1538,"SAM"
"1539",118,7775.457,7778.975,"TALIESIN","it's slightly smaller than a children's four-square court.",1,0,0,0,"End",8,3.51800000000003,12,0.00341102899374642,"extra",NA,"role_play",1539,"TALIESIN"
