"","Episode","startTime","endTime","Actor","Text","vox_machina","guest","staff","Matt","Arc","Arc_no","timeDiffInSecs","wordCount","WordsPerMillisec","segment","encounter_count","rp_combat","turn_number","CR_GUEST"
"710",118,2944.096,2945.525,"TALIESIN","chris is in the bullpen.",1,0,0,0,"End",8,1.42900000000009,6,0.00419874037788638,"extra",NA,"role_play",710,"TALIESIN"
"711",118,2945.525,2947.553,"MATT","i go: chris, give me your foam sword!",0,0,0,1,"End",8,2.02799999999979,9,0.00443786982248566,"extra",NA,"role_play",711,"MATT"
"712",118,2947.553,2956.382,"TALIESIN","chris is ignoring you. chris is sitting at his desk and his eyes have sunken all the way almost into the back of his head. his mouth is very terse and he's wearing a sign and he's working on the socials. you also see that the window has been blocked and covered.",1,0,0,0,"End",8,8.82900000000018,55,0.00622947106127522,"extra",NA,"role_play",712,"TALIESIN"
"713",118,2969.53,2973.132,"LAURA","do they look like us, or do they look like?",1,0,0,0,"End",8,3.60199999999986,11,0.00305385896724054,"extra",NA,"role_play",713,"LAURA"
"714",118,2973.132,2980.205,"TALIESIN","they look like people wearing some weird makeup who are very dehydrated and they're all wearing signs around their neck and really trying hard",1,0,0,0,"End",8,7.07299999999987,25,0.00353456807578121,"extra",NA,"role_play",714,"TALIESIN"
"715",118,2983.211,2984.52,"LAURA","signs around their neck?",1,0,0,0,"End",8,1.3090000000002,5,0.00381970970206207,"extra",NA,"role_play",715,"LAURA"
"716",118,2984.52,2988.136,"TALIESIN","are you going in enough to see it?",1,0,0,0,"End",8,3.61599999999999,9,0.00248893805309736,"extra",NA,"role_play",716,"TALIESIN"
"717",118,2988.136,2991.866,"MATT","yeah! i was going to go bug him and: chris! what's wrong with you?",0,0,0,1,"End",8,3.73000000000002,16,0.00428954423592491,"extra",NA,"role_play",717,"MATT"
"718",118,2991.866,3001.517,"TALIESIN","as far as you can see so far, between chris, sax, arcade, and audrey, they are all occasionally making eye contact with you, but not really keeping it, and they're all wearing signs that say ""drink me.""",1,0,0,0,"End",8,9.65099999999984,39,0.00404103201740759,"extra",NA,"role_play",718,"TALIESIN"
"719",118,3007.056,3009.658,"LAURA AND SAM","ugh.",1,0,0,0,"End",8,2.60199999999986,2,0.000768639508070756,"extra",NA,"role_play",719,"LAURA AND SAM"
"720",118,3009.658,3017.893,"TALIESIN","they are terrified. is anybody above a hunger three right now? three or above? do you have three red dice, or is everybody at least at two?",1,0,0,0,"End",8,8.23500000000013,28,0.00340012143290827,"extra",NA,"role_play",720,"TALIESIN"
"721",118,3020.402,3021.766,"LAURA AND MATT AND TRAVIS","one.",1,0,0,0,"End",8,1.36400000000003,2,0.00146627565982401,"extra",NA,"role_play",721,"LAURA AND MATT AND TRAVIS"
"722",118,3021.766,3022.787,"MARISHA AND SAM","two.",1,0,0,0,"End",8,1.02099999999973,2,0.00195886385896232,"extra",NA,"role_play",722,"MARISHA AND SAM"
"723",118,3022.787,3038.265,"TALIESIN","they smell weirdly good. there's an almost candied sensation.",1,0,0,0,"End",8,15.4780000000001,11,0.000710686135159578,"extra",NA,"role_play",723,"TALIESIN"
"724",118,3038.265,3040.371,"LAURA","do they smell like lucky charms?",1,0,0,0,"End",8,2.10600000000022,7,0.00332383665716964,"extra",NA,"role_play",724,"LAURA"
"725",118,3040.371,3048.767,"TALIESIN","they smell like the first bowl of lucky charms you ever had in your life. they are all sitting at their desks, either working or pretending to work, it's hard to tell. dani comes bursting out of the office without a tea tray, sits down at her desk and meets your gaze.",1,0,0,0,"End",8,8.39599999999973,54,0.00643163411148186,"extra",NA,"role_play",725,"TALIESIN"
"726",118,3061.259,3064.596,"TRAVIS","who did she deliver tea to?",1,0,0,0,"End",8,3.33699999999999,7,0.00209769253820798,"extra",NA,"role_play",726,"TRAVIS"
"727",118,3064.596,3066.396,"LIAM","dani?",1,0,0,0,"End",8,1.80000000000018,2,0.001111111111111,"extra",NA,"role_play",727,"LIAM"
"728",118,3066.396,3068.018,"TALIESIN","""yeah?""",1,0,0,0,"End",8,1.62199999999984,3,0.00184956843403224,"extra",NA,"role_play",728,"TALIESIN"
"729",118,3068.018,3069.245,"LIAM","what's going on?",1,0,0,0,"End",8,1.22699999999986,5,0.00407497962510233,"extra",NA,"role_play",729,"LIAM"
"730",118,3069.245,3072.735,"TALIESIN","""oh, you're all awake! that's great.""",1,0,0,0,"End",8,3.49000000000024,10,0.00286532951289379,"extra",NA,"role_play",730,"TALIESIN"
"731",118,3072.735,3076.87,"MARISHA","dani. sean doesn't drink tea.",1,0,0,0,"End",8,4.13499999999976,7,0.00169286577992755,"extra",NA,"role_play",731,"MARISHA"
"732",118,3076.87,3080.091,"TALIESIN","""sean doesn't drink tea, that's true.""",1,0,0,0,"End",8,3.221,10,0.00310462589257994,"extra",NA,"role_play",732,"TALIESIN"
"733",118,3080.091,3081.549,"MARISHA","is sean in there?",1,0,0,0,"End",8,1.45800000000008,5,0.00342935528120694,"extra",NA,"role_play",733,"MARISHA"
"734",118,3081.549,3083.541,"TALIESIN","""no. no, sean's working on the server.""",1,0,0,0,"End",8,1.99200000000019,10,0.00502008032128466,"extra",NA,"role_play",734,"TALIESIN"
"735",118,3083.541,3088.498,"LAURA","ugh. how long were we sleeping?",1,0,0,0,"End",8,4.95699999999988,7,0.00141214444220298,"extra",NA,"role_play",735,"LAURA"
"736",118,3088.498,3096.572,"TALIESIN","""who can say? that's just a matter of opinion, that could be anything. i'd have to ask ""upstairs. i could write an email!""",1,0,0,0,"End",8,8.07400000000007,27,0.0033440673767649,"extra",NA,"role_play",736,"TALIESIN"
"737",118,3097.857,3099.51,"LIAM","do you know what's going on?",1,0,0,0,"End",8,1.65300000000025,8,0.00483968542044695,"extra",NA,"role_play",737,"LIAM"
"738",118,3099.51,3104.885,"TALIESIN","""of course! of course i know what's going on; that's my job. i know what's going on.""",1,0,0,0,"End",8,5.375,22,0.00409302325581395,"extra",NA,"role_play",738,"TALIESIN"
"739",118,3104.885,3107.393,"LAURA","why were we in the coffins?",1,0,0,0,"End",8,2.50799999999981,7,0.00279106858054248,"extra",NA,"role_play",739,"LAURA"
"740",118,3107.393,3111.857,"TALIESIN","""i don't understand the question. that's odd.""",1,0,0,0,"End",8,4.46399999999994,11,0.00246415770609322,"extra",NA,"role_play",740,"TALIESIN"
"741",118,3111.857,3113.818,"TRAVIS","who did you give the tea to?",1,0,0,0,"End",8,1.96100000000024,8,0.00407955124936207,"extra",NA,"role_play",741,"TRAVIS"
"742",118,3113.818,3115.85,"TALIESIN","""oh, they're having a creative meeting right now.""",1,0,0,0,"End",8,2.0319999999997,11,0.00541338582677246,"extra",NA,"role_play",742,"TALIESIN"
"743",118,3115.85,3117.279,"SAM","who's they?",1,0,0,0,"End",8,1.42900000000009,4,0.00279916025192425,"extra",NA,"role_play",743,"SAM"
"744",118,3117.279,3118.573,"TALIESIN","""the creative team.""",1,0,0,0,"End",8,1.29399999999987,5,0.00386398763523996,"extra",NA,"role_play",744,"TALIESIN"
"745",118,3118.573,3120.957,"MARISHA","why the fuck didn't i get an email?!",1,0,0,0,"End",8,2.38400000000001,10,0.0041946308724832,"extra",NA,"role_play",745,"MARISHA"
"746",118,3120.957,3123.442,"LAURA","you were in a coffin, dude, you might have gotten an email.",1,0,0,0,"End",8,2.48500000000013,13,0.00523138832997961,"extra",NA,"role_play",746,"LAURA"
"747",118,3123.442,3126.625,"LIAM","is this a geek and sundry thing or an ldn thing?",1,0,0,0,"End",8,3.18299999999999,12,0.00377002827521207,"extra",NA,"role_play",747,"LIAM"
"748",118,3126.625,3131.534,"TALIESIN","this is most assuredly an ldn thing.",1,0,0,0,"End",8,4.90900000000011,8,0.00162965980851494,"extra",NA,"role_play",748,"TALIESIN"
"749",118,3135.056,3141.524,"TALIESIN","""well, ask me no more questions, and i'll tell you no more lies!""",1,0,0,0,"End",8,6.46799999999985,16,0.0024737167594311,"extra",NA,"role_play",749,"TALIESIN"
"750",118,3141.524,3146.453,"TRAVIS","can i make my way out of the bullpen, back towards the server room?",1,0,0,0,"End",8,4.92900000000009,15,0.00304321363359702,"extra",NA,"role_play",750,"TRAVIS"
"751",118,3146.453,3148.158,"TALIESIN","yeah.",1,0,0,0,"End",8,1.70499999999993,2,0.00117302052785929,"extra",NA,"role_play",751,"TALIESIN"
"752",118,3148.158,3151.144,"TRAVIS","can i approach the server room window?",1,0,0,0,"End",8,2.98599999999988,8,0.0026791694574683,"extra",NA,"role_play",752,"TRAVIS"
"753",118,3151.144,3152.327,"TALIESIN","yeah.",1,0,0,0,"End",8,1.18300000000045,2,0.00169061707523182,"extra",NA,"role_play",753,"TALIESIN"
"754",118,3152.327,3154.019,"TRAVIS","can i look inside?",1,0,0,0,"End",8,1.69199999999955,5,0.00295508274231757,"extra",NA,"role_play",754,"TRAVIS"
"755",118,3154.019,3163.602,"TALIESIN","yeah. give me a perception investigation because you don't have an awareness issue.",1,0,0,0,"End",8,9.58300000000008,15,0.00156527183554209,"extra",NA,"role_play",755,"TALIESIN"
"756",118,3163.602,3169.556,"TRAVIS","oh god. three successes.",1,0,0,0,"End",8,5.95400000000018,5,0.000839771582129636,"extra",NA,"role_play",756,"TRAVIS"
"757",118,3169.556,3182.46,"TALIESIN","that thing in there is definitely meat and it's some sort of weird it's built out of a lot of different things and it seems to be interconnected to something that goes up higher into the building. it's part of some sort of machine.",1,0,0,0,"End",8,12.904,48,0.0037197768133912,"extra",NA,"role_play",757,"TALIESIN"
"758",118,3193.447,3195.749,"TRAVIS","do i smell anything?",1,0,0,0,"End",8,2.30199999999968,5,0.00217202432667276,"extra",NA,"role_play",758,"TRAVIS"
"759",118,3195.749,3200.083,"TALIESIN","it smells kind of good. not great, but it smells pretty good.",1,0,0,0,"End",8,4.33400000000029,13,0.00299953853253326,"extra",NA,"role_play",759,"TALIESIN"
"760",118,3200.083,3201.333,"TRAVIS","okay.",1,0,0,0,"End",8,1.25,2,0.0016,"extra",NA,"role_play",760,"TRAVIS"
"761",118,3201.333,3203.573,"TALIESIN","but it's locked.",1,0,0,0,"End",8,2.23999999999978,5,0.00223214285714307,"extra",NA,"role_play",761,"TALIESIN"
"762",118,3203.573,3205.489,"TRAVIS","i don't see sean anywhere?",1,0,0,0,"End",8,1.91600000000017,7,0.00365344467640887,"extra",NA,"role_play",762,"TRAVIS"
"763",118,3205.489,3212.3,"TALIESIN","not that you can tell. how well and intimately do you know sean? could you recognize him by just parts? you don't see his head anywhere, i'll go that far.",1,0,0,0,"End",8,6.81100000000015,33,0.00484510350902941,"extra",NA,"role_play",763,"TALIESIN"
"764",118,3219.514,3222.669,"LIAM","you've seen his head.",1,0,0,0,"End",8,3.15499999999975,6,0.00190174326465942,"extra",NA,"role_play",764,"LIAM"
"765",118,3222.669,3224.588,"TALIESIN","man, i warned y'all.",1,0,0,0,"End",8,1.91900000000032,6,0.00312662845231839,"extra",NA,"role_play",765,"TALIESIN"
"766",118,3224.588,3227.875,"TRAVIS","yeah, i know!",1,0,0,0,"End",8,3.28699999999981,4,0.00121691512017044,"extra",NA,"role_play",766,"TRAVIS"
"767",118,3227.875,3230.928,"MATT","is this an amalgamation of many parts, or it one giant, pulsating tetsuo type thing?",0,0,0,1,"End",8,3.05299999999988,16,0.00524074680642011,"extra",NA,"role_play",767,"MATT"
"768",118,3230.928,3234.717,"LAURA","i know, i was picturing a big flesh blob, but it's body parts?",1,0,0,0,"End",8,3.78900000000021,15,0.00395882818685647,"extra",NA,"role_play",768,"LAURA"
"769",118,3234.717,3239.945,"TALIESIN","yeah, if you look really closely you tell that there's parts that were not ground up appropriately and are definitely",1,0,0,0,"End",8,5.22800000000007,21,0.00401683244070385,"extra",NA,"role_play",769,"TALIESIN"
"770",118,3241.451,3242.508,"LAURA","ground up?!",1,0,0,0,"End",8,1.05699999999979,3,0.00283822138126831,"extra",NA,"role_play",770,"LAURA"
"771",118,3242.508,3248.892,"MATT","chris, give your sword! i shake him. give me your sword!",0,0,0,1,"End",8,6.38400000000001,12,0.0018796992481203,"extra",NA,"role_play",771,"MATT"
"772",118,3248.892,3252.947,"TALIESIN","chris is frozen with fear.",1,0,0,0,"End",8,4.05500000000029,6,0.00147965474722554,"extra",NA,"role_play",772,"TALIESIN"
"773",118,3252.947,3254.66,"MATT","i look around for the sword.",0,0,0,1,"End",8,1.71299999999974,7,0.00408639813193291,"extra",NA,"role_play",773,"MATT"
"774",118,3254.66,3256.446,"TALIESIN","there is a foam sword by his",1,0,0,0,"End",8,1.78600000000006,7,0.00391937290033582,"extra",NA,"role_play",774,"TALIESIN"
"775",118,3256.446,3258.051,"MATT","i take it!",0,0,0,1,"End",8,1.60500000000002,4,0.0024922118380062,"extra",NA,"role_play",775,"MATT"
"776",118,3258.051,3262.512,"TALIESIN","he almost tells you not to take it, and then thinks better of it when dani looks at him.",1,0,0,0,"End",8,4.46100000000024,20,0.00448329970858528,"extra",NA,"role_play",776,"TALIESIN"
"777",118,3262.512,3268.16,"LIAM","i set chun li down on dani's desk. dani, we're going to get the fuck out of here, and we're going to take you with us. you need to tell me what the fuck is going on so we can work together to get the fuck out!",1,0,0,0,"End",8,5.64799999999968,51,0.00902974504249342,"extra",NA,"role_play",777,"LIAM"
"778",118,3272.849,3276.615,"TALIESIN","""we won't know what's going on until the creative meeting is over. you would have to talk ""to them.""",1,0,0,0,"End",8,3.76599999999962,23,0.00610727562400486,"extra",NA,"role_play",778,"TALIESIN"
"779",118,3277.543,3278.768,"LIAM","you are talking like a crazy person!",1,0,0,0,"End",8,1.22499999999991,8,0.00653061224489844,"extra",NA,"role_play",779,"LIAM"
"780",118,3278.768,3280.443,"MARISHA","i'm going to go in the creative meeting.",1,0,0,0,"End",8,1.67500000000018,10,0.00597014925373069,"extra",NA,"role_play",780,"MARISHA"
"781",118,3280.443,3281.557,"TALIESIN","yay!",1,0,0,0,"End",8,1.11399999999958,2,0.00179533213644592,"extra",NA,"role_play",781,"TALIESIN"
"782",118,3281.557,3285.675,"MARISHA","they're in my office.",1,0,0,0,"End",8,4.11800000000039,6,0.00145701796988816,"extra",NA,"role_play",782,"MARISHA"
"783",118,3285.675,3287.138,"MATT","it's true.",0,0,0,1,"End",8,1.46299999999974,4,0.00273410799726638,"extra",NA,"role_play",783,"MATT"
"784",118,3287.138,3292.28,"TRAVIS","there's no writing or sign on the door that says, ""drive-thru""?",1,0,0,0,"End",8,5.14200000000028,14,0.00272267600155567,"extra",NA,"role_play",784,"TRAVIS"
"785",118,3292.28,3296.949,"TALIESIN","you go into the creative meeting?",1,0,0,0,"End",8,4.66899999999987,7,0.00149925037481264,"extra",NA,"role_play",785,"TALIESIN"
"786",118,3296.949,3298.301,"MARISHA","yeah.",1,0,0,0,"End",8,1.35199999999986,2,0.00147928994082855,"extra",NA,"role_play",786,"MARISHA"
"787",118,3298.301,3300.348,"TALIESIN","you walk in.",1,0,0,0,"End",8,2.04700000000003,4,0.00195407914020515,"extra",NA,"role_play",787,"TALIESIN"
"788",118,3300.348,3302.391,"LIAM","fuck it. i pick up chun li and i back her up.",1,0,0,0,"End",8,2.04300000000012,13,0.00636319138521744,"extra",NA,"role_play",788,"LIAM"
"789",118,3302.391,3313.176,"TALIESIN","inside are eric, and i think it's matt key. eric's sitting on the little green grass carpet. they've got the tea set out. there's a couple different tea cups and he's sitting there having a sip of tea. weirdly, whitney moore is sitting there with him.",1,0,0,0,"End",8,10.7849999999999,52,0.00482151135836817,"extra",NA,"role_play",789,"TALIESIN"
"790",118,3329.698,3333.621,"LIAM","does it look normal in here? they're not, but the room?",1,0,0,0,"End",8,3.92300000000023,13,0.00331379046647954,"extra",NA,"role_play",790,"LIAM"
"791",118,3333.621,3341.132,"TALIESIN","they look normal, except their eyes. there's large black circles around their eyes and their mouths are blackened over in this very weird gray puffy mold. it's almost like there's a mold around their mouths and eyes. in the corner is matt key, who is working on an ipad, but it's only the arm and the head of matt key. he seems to have sprouted spores. there's an old, flowering pile of gray mushrooms that still have matt key's face and hand as he's working in the corner that has crawled up and covered the window. eric and whitney see you come in and go, ""oh thank god, ""marisha, we've been waiting. it has been very weird. come down, have some tea, it's just what ""you need."" as they sit and drink tea.",1,0,0,0,"End",8,7.51099999999997,143,0.0190387431766743,"extra",NA,"role_play",791,"TALIESIN"
"792",118,3394.17,3398.386,"SAM","are there any telephones around, taliesin?",1,0,0,0,"End",8,4.21599999999989,7,0.00166034155597727,"extra",NA,"role_play",792,"SAM"
"793",118,3398.386,3400.676,"TALIESIN","have you ever seen a telephone in this place?",1,0,0,0,"End",8,2.28999999999996,10,0.0043668122270743,"extra",NA,"role_play",793,"TALIESIN"
"794",118,3400.676,3402.242,"LAURA","where's taliesin?",1,0,0,0,"End",8,1.56600000000026,4,0.00255427841634696,"extra",NA,"role_play",794,"LAURA"
"795",118,3402.242,3408.719,"TALIESIN","there was an extra hole in the ground and i was already broken open. that's all i'm going to say. they're giggling a lot and they're talking about ""dad."" ""dad's coming back any second ""now. dad has plans. have some tea. we'll explain everything.""",1,0,0,0,"End",8,6.47699999999986,51,0.00787401574803166,"extra",NA,"role_play",795,"TALIESIN"
"796",118,3425.649,3427.61,"SAM","don't have the tea.",1,0,0,0,"End",8,1.96100000000024,6,0.00305966343702155,"extra",NA,"role_play",796,"SAM"
"797",118,3427.61,3431.801,"MARISHA","is this a coup? is taliesin taking over? what did taliesin do?",1,0,0,0,"End",8,4.1909999999998,13,0.00310188499164892,"extra",NA,"role_play",797,"MARISHA"
"798",118,3431.801,3433.172,"SAM","where's taliesin?",1,0,0,0,"End",8,1.37100000000009,4,0.00291757840991957,"extra",NA,"role_play",798,"SAM"
"799",118,3433.172,3434.232,"LAURA","there was a hole.",1,0,0,0,"End",8,1.05999999999995,5,0.00471698113207571,"extra",NA,"role_play",799,"LAURA"
"800",118,3434.232,3439.305,"TALIESIN","""taliesin was here. taliesin left. he went to go deal with something. but taliesin was here.""",1,0,0,0,"End",8,5.07299999999987,18,0.00354819633353055,"extra",NA,"role_play",800,"TALIESIN"
"801",118,3439.305,3440.599,"SAM","which way did he go?",1,0,0,0,"End",8,1.29400000000032,6,0.00463678516228632,"extra",NA,"role_play",801,"SAM"
"802",118,3440.599,3441.695,"TALIESIN","""out.""",1,0,0,0,"End",8,1.096,3,0.00273722627737225,"extra",NA,"role_play",802,"TALIESIN"
"803",118,3441.695,3447.49,"LAURA","outside? should we leave? let's leave.",1,0,0,0,"End",8,5.79499999999962,8,0.00138050043140648,"extra",NA,"role_play",803,"LAURA"
"804",118,3447.49,3448.754,"SAM","yeah!",1,0,0,0,"End",8,1.26400000000012,2,0.0015822784810125,"extra",NA,"role_play",804,"SAM"
"805",118,3448.754,3449.93,"LAURA","i'm going to walk towards the front door.",1,0,0,0,"End",8,1.17599999999993,10,0.00850340136054472,"extra",NA,"role_play",805,"LAURA"
"806",118,3449.93,3451.077,"SAM","i'm joining laura.",1,0,0,0,"End",8,1.14700000000039,5,0.00435919790758353,"extra",NA,"role_play",806,"SAM"
"807",118,3451.077,3452.432,"TALIESIN","you're going to walk towards the front door?",1,0,0,0,"End",8,1.35499999999956,10,0.00738007380074039,"extra",NA,"role_play",807,"TALIESIN"
"808",118,3452.432,3453.52,"LAURA AND SAM","yeah.",1,0,0,0,"End",8,1.08800000000019,2,0.00183823529411732,"extra",NA,"role_play",808,"LAURA AND SAM"
"809",118,3453.52,3458.567,"MATT","before they do that, because i saw my lack of a reflection. is it day or night outside?",0,0,0,1,"End",8,5.04700000000003,19,0.00376461264117296,"extra",NA,"role_play",809,"MATT"
"810",118,3458.567,3461.124,"TALIESIN","you don't know. you actually haven't seen a working window yet.",1,0,0,0,"End",8,2.55699999999979,14,0.00547516621040327,"extra",NA,"role_play",810,"TALIESIN"
"811",118,3461.124,3462.438,"MATT","they're all blocked?",0,0,0,1,"End",8,1.31400000000031,5,0.00380517503805087,"extra",NA,"role_play",811,"MATT"
"812",118,3462.438,3463.771,"TALIESIN","so far!",1,0,0,0,"End",8,1.33300000000008,3,0.00225056264066002,"extra",NA,"role_play",812,"TALIESIN"
"813",118,3463.771,3472.233,"MATT","i'm going to say: hey! be careful! be slow. some of us might be sensitive to sunlight.",0,0,0,1,"End",8,8.46199999999999,19,0.00224533207279603,"extra",NA,"role_play",813,"MATT"
"814",118,3472.233,3473.781,"SAM","oh.",1,0,0,0,"End",8,1.54799999999977,2,0.00129198966408288,"extra",NA,"role_play",814,"SAM"
"815",118,3473.853,3479.223,"MATT","i point. marisha's probably still back in the office. you saw marisha's face?!",0,0,0,1,"End",8,5.36999999999989,16,0.0029795158286779,"extra",NA,"role_play",815,"MATT"
"816",118,3479.223,3485.636,"TALIESIN","eric and whitney see you do this and laugh their ass off. and then, ""key! key! put that ""in, put that in, that's great! that's great! aw, matt! matt! genius! no, we're going to use that!""",1,0,0,0,"End",8,6.41300000000001,40,0.00623733042257913,"extra",NA,"role_play",816,"TALIESIN"
"817",118,3490.816,3494.751,"MATT","i never get this kind of positive feedback, i'm actually liking this.",0,0,0,1,"End",8,3.9350000000004,14,0.00355781448538719,"extra",NA,"role_play",817,"MATT"
"818",118,3494.751,3497.286,"LAURA","yeah, right.",1,0,0,0,"End",8,2.53499999999985,3,0.00118343195266279,"extra",NA,"role_play",818,"LAURA"
"819",118,3497.286,3499.38,"LIAM","key. key, buddy. you doing all right?",1,0,0,0,"End",8,2.09400000000005,8,0.00382043935052522,"extra",NA,"role_play",819,"LIAM"
"820",118,3499.38,3505.994,"TALIESIN","key has a smile and he's writing everything down. he's just ipad-ing, ""key. key, ""buddy. you doing all right?""",1,0,0,0,"End",8,6.61400000000003,23,0.00347747202902931,"extra",NA,"role_play",820,"TALIESIN"
"821",118,3507.26,3511.191,"MARISHA","i'm going to go look over key's shoulder, look at his ipad. scroll up.",1,0,0,0,"End",8,3.93099999999959,17,0.00432459933859115,"extra",NA,"role_play",821,"MARISHA"
"822",118,3511.191,3526.814,"TALIESIN","roll a straight dexterity roll. dexterity dodge. let's get weird.",1,0,0,0,"End",8,15.623,12,0.00076809831658452,"extra",NA,"role_play",822,"TALIESIN"
"823",118,3526.814,3536.585,"MARISHA","sure! all successes except for one.",1,0,0,0,"End",8,9.77100000000019,7,0.000716405690308041,"extra",NA,"role_play",823,"MARISHA"
"824",118,3536.585,3541.773,"TALIESIN","all successes except for one? he's been writing down everything the two of them have said.",1,0,0,0,"End",8,5.1880000000001,18,0.00346954510408628,"extra",NA,"role_play",824,"TALIESIN"
"825",118,3541.773,3545.827,"MARISHA","is there anything that we have said further up in the document?",1,0,0,0,"End",8,4.05400000000009,13,0.00320670942279223,"extra",NA,"role_play",825,"MARISHA"
"826",118,3545.827,3548.412,"TALIESIN","oh yeah, it's all there. he's taken down every note of everything he can hear.",1,0,0,0,"End",8,2.58499999999958,18,0.00696324951644213,"extra",NA,"role_play",826,"TALIESIN"
"827",118,3548.412,3549.931,"MARISHA","including when we weren't in the room?",1,0,0,0,"End",8,1.51900000000023,9,0.00592495062541055,"extra",NA,"role_play",827,"MARISHA"
"828",118,3549.931,3552.202,"TALIESIN","no. it's a creative meeting.",1,0,0,0,"End",8,2.27100000000019,7,0.00308234258036082,"extra",NA,"role_play",828,"TALIESIN"
"829",118,3552.202,3553.524,"MARISHA","right.",1,0,0,0,"End",8,1.32199999999966,2,0.00151285930408511,"extra",NA,"role_play",829,"MARISHA"
"830",118,3553.524,3558.708,"LIAM","key. buddy. i voice doctor strange. you love doctor strange! key!",1,0,0,0,"End",8,5.1840000000002,12,0.00231481481481473,"extra",NA,"role_play",830,"LIAM"
"831",118,3558.708,3561.215,"TALIESIN","he writes, ""i voice doctor strange. i love doctor strange. key!""",1,0,0,0,"End",8,2.50700000000006,12,0.00478659752692449,"extra",NA,"role_play",831,"TALIESIN"
"832",118,3561.215,3565.351,"LIAM","can i poke his face a little bit?",1,0,0,0,"End",8,4.13599999999997,9,0.00217601547388783,"extra",NA,"role_play",832,"LIAM"
"833",118,3565.351,3568.122,"TALIESIN","it's gray and weird looking.",1,0,0,0,"End",8,2.77099999999973,7,0.00252616383976928,"extra",NA,"role_play",833,"TALIESIN"
"834",118,3568.122,3570.077,"LIAM","i'm going to poke it.",1,0,0,0,"End",8,1.95500000000038,7,0.00358056265984585,"extra",NA,"role_play",834,"LIAM"
"835",118,3570.077,3579.283,"TALIESIN","all right. roll stanima.",1,0,0,0,"End",8,9.20599999999968,5,0.000543124049532932,"extra",NA,"role_play",835,"TALIESIN"
"836",118,3579.283,3584.057,"LAURA AND MARISHA AND MATT","stanima?",1,0,0,0,"End",8,4.77399999999989,2,0.00041893590280688,"extra",NA,"role_play",836,"LAURA AND MARISHA AND MATT"
"837",118,3584.057,3590.805,"TALIESIN","stamina. roll stanima. what am i going to add to that? just roll stanima",1,0,0,0,"End",8,6.74800000000005,14,0.00207468879668048,"extra",NA,"role_play",837,"TALIESIN"
"838",118,3590.805,3592.296,"LIAM","oh shite.",1,0,0,0,"End",8,1.49099999999999,3,0.00201207243460767,"extra",NA,"role_play",838,"LIAM"
"839",118,3592.296,3593.846,"SAM","i think he thinks it's ""stanima""!",1,0,0,0,"End",8,1.55000000000018,8,0.00516129032258004,"extra",NA,"role_play",839,"SAM"
"840",118,3593.846,3595.596,"TALIESIN","i can't say it right, i know.",1,0,0,0,"End",8,1.75,9,0.00514285714285714,"extra",NA,"role_play",840,"TALIESIN"
"841",118,3595.596,3598.07,"LIAM","it's a lot of pressure behind that screen, man.",1,0,0,0,"End",8,2.47400000000016,11,0.00444624090541604,"extra",NA,"role_play",841,"LIAM"
"842",118,3598.07,3609.659,"LIAM","not on the red one, but the non-red is a failure two failures, and the red one is a success.",1,0,0,0,"End",8,11.5889999999999,22,0.00189835188540859,"extra",NA,"role_play",842,"LIAM"
"843",118,3610.943,3612.715,"TALIESIN","so just a failure on the one",1,0,0,0,"End",8,1.77199999999993,7,0.00395033860045161,"extra",NA,"role_play",843,"TALIESIN"
"844",118,3612.715,3614.204,"LIAM","failure on the non-reds.",1,0,0,0,"End",8,1.48900000000003,6,0.00402955003357949,"extra",NA,"role_play",844,"LIAM"
"845",118,3614.204,3621.063,"TALIESIN","okay, but a success on the reds. nothing. this is going to sound weird, roll charisma persuasion.",1,0,0,0,"End",8,6.85899999999992,18,0.00262428925499347,"extra",NA,"role_play",845,"TALIESIN"
