"","arc","arc_no","episode","turn_number","segment","actor","text","start_turn","end_turn","time_in_sec","word_count","words_per_ms","encounter_count","rp_combat","actor_guest","vox_machina","guest","staff","matt"
"1688","End",8,110,1688,"first_half","MARISHA","cincture. it's like spanx. we should call it spanx of the stone king.",8834.881,8838.509,3.62800000000061,15,0.00413450937155388,NA,"role_play","MARISHA",1,0,0,0
"1689","End",8,110,1689,"first_half","SAM","how do you know that?",8838.509,8840.434,1.92499999999927,6,0.0031168831168843,NA,"role_play","SAM",1,0,0,0
"1690","End",8,110,1690,"first_half","TALIESIN","how do you not?",8840.434,8841.796,1.36200000000099,5,0.00367107195300761,NA,"role_play","TALIESIN",1,0,0,0
"1691","End",8,110,1691,"first_half","SAM","oh, it's like, people still make these things?",8841.796,8844.565,2.76900000000023,10,0.00361141206211598,NA,"role_play","SAM",1,0,0,0
"1692","End",8,110,1692,"first_half","MARISHA","it's like a cincture. like spanx.",8844.565,8847.419,2.85399999999936,8,0.00280308339173153,NA,"role_play","MARISHA",1,0,0,0
"1693","End",8,110,1693,"first_half","SAM","oh, i've never seen that word before.",8847.419,8850.922,3.50300000000061,9,0.00256922637739036,NA,"role_play","SAM",1,0,0,0
"1694","End",8,110,1694,"first_half","LIAM","oh, freddie. get excited. i found a spyglass covered in diarrhea. would you like it?",8850.922,8855.956,5.03399999999965,16,0.00317838696861365,NA,"role_play","LIAM",1,0,0,0
"1695","End",8,110,1695,"first_half","TALIESIN","yes. clean it, please.",8855.956,8860.436,4.47999999999956,5,0.00111607142857154,NA,"role_play","TALIESIN",1,0,0,0
"1696","End",8,110,1696,"first_half","LAURA","what is this creature? do we know what this creature is?",8860.436,8863.745,3.30900000000111,12,0.00362647325475853,NA,"role_play","LAURA",1,0,0,0
"1697","End",8,110,1697,"first_half","MATT","this would be an arcana check on this one, actually.",8863.745,8867.725,3.97999999999956,11,0.00276381909547769,NA,"role_play","MATT",0,0,0,1
"1698","End",8,110,1698,"first_half","TRAVIS","because he's enjoying his belt, can i take out",8867.725,8870.664,2.93900000000031,10,0.00340251786321843,NA,"role_play","TRAVIS",1,0,0,0
"1699","End",8,110,1699,"first_half","MATT","is anyone here trained in arcana?",8870.664,8872.634,1.96999999999935,7,0.00355329949238697,NA,"role_play","MATT",0,0,0,1
"1700","End",8,110,1700,"first_half","LAURA","scanlan.",8872.634,8873.688,1.05400000000009,2,0.00189753320683096,NA,"role_play","LAURA",1,0,0,0
"1701","End",8,110,1701,"first_half","SAM","well, i'm not proficient in it, weirdly, but i am an arcanist.",8873.688,8876.971,3.28299999999945,14,0.00426439232409453,NA,"role_play","SAM",1,0,0,0
"1702","End",8,110,1702,"first_half","MATT","yeah, make a check with disadvantage.",8876.971,8880.104,3.13299999999981,7,0.00223428024257913,NA,"role_play","MATT",0,0,0,1
"1703","End",8,110,1703,"first_half","SAM","seven.",8880.104,8881.921,1.81700000000092,2,0.00110071546505173,NA,"role_play","SAM",1,0,0,0
"1704","End",8,110,1704,"first_half","LAURA","with disadvantage.",8881.921,8883.287,1.36599999999999,3,0.00219619326500734,NA,"role_play","LAURA",1,0,0,0
"1705","End",8,110,1705,"first_half","SAM","four.",8883.287,8884.389,1.10199999999895,2,0.0018148820326696,NA,"role_play","SAM",1,0,0,0
"1706","End",8,110,1706,"first_half","MATT","you're not entirely certain what this is.",8884.389,8886.688,2.29900000000089,9,0.00391474554153829,NA,"role_play","MATT",0,0,0,1
"1707","End",8,110,1707,"first_half","TALIESIN","is that with your arcana?",8886.688,8889.726,3.03800000000047,6,0.00197498354180352,NA,"role_play","TALIESIN",1,0,0,0
"1708","End",8,110,1708,"first_half","SAM","i mean, it's ten.",8889.726,8891.426,1.69999999999891,6,0.00352941176470815,NA,"role_play","SAM",1,0,0,0
"1709","End",8,110,1709,"first_half","LAURA","oh, well that's better than four.",8891.426,8894.004,2.57800000000134,8,0.00310318076027767,NA,"role_play","LAURA",1,0,0,0
"1710","End",8,110,1710,"first_half","SAM","yeah, but it's still sucky.",8894.004,8895.972,1.96799999999894,7,0.00355691056910761,NA,"role_play","SAM",1,0,0,0
"1711","End",8,110,1711,"first_half","TRAVIS","could i take out the black metallic hammer now that he's all excited about his belt and begin my attuning period?",8895.972,8901.673,5.70100000000093,23,0.00403437993334437,NA,"role_play","TRAVIS",1,0,0,0
"1712","End",8,110,1712,"first_half","MATT","okay. so you're going to attune. are you guys going to wait for him or are you going to walk with him as",8903.422,8907.015,3.59299999999894,24,0.00667965488449961,NA,"role_play","MATT",0,0,0,1
"1713","End",8,110,1713,"first_half","SAM","no we're not fucking waiting for",8908.335,8910.054,1.71900000000096,7,0.00407213496218504,NA,"role_play","SAM",1,0,0,0
"1714","End",8,110,1714,"first_half","MATT","okay, you look at the creature and leave it there in the water. you begin concentrating on the hammer. what are you unattuning from to take its place?",8910.054,8914.085,4.03099999999904,29,0.00719424460431826,NA,"role_play","MATT",0,0,0,1
"1715","End",8,110,1715,"first_half","TRAVIS","instead of the bloodaxe.",8916.599,8917.948,1.34900000000016,5,0.00370644922164522,NA,"role_play","TRAVIS",1,0,0,0
"1716","End",8,110,1716,"first_half","MATT","okay. so you set the bloodaxe away and attune to the adamantine hammer as you begin to trek further into",8917.948,8922.996,5.04799999999886,20,0.00396196513470771,NA,"role_play","MATT",0,0,0,1
"1717","End",8,110,1717,"first_half","LAURA","is there anything else interesting in this cavern? that we can see?",8924.25,8928.451,4.20099999999911,13,0.00309450130921275,NA,"role_play","LAURA",1,0,0,0
"1718","End",8,110,1718,"first_half","MATT","we'll get to that in a minute. as you begin to leave the watered pool to head further into this chasm, we're going to take a break. because it's been a while. we'll be back here in a little bit, guys. we do have this wenge dice vault for one of you guys to win from our friends over at wyrmwood. this is the same wood that i use for my dice box over here.",8928.451,8932.793,4.34200000000055,80,0.0184246890833694,NA,"role_play","MATT",0,0,0,1
"1719","End",8,110,1719,"second_half","LIAM","23 to hit.",10144.568,10145.435,0.867000000000189,4,0.00461361014994132,2,"combat","LIAM",1,0,0,0
"1720","End",8,110,1720,"second_half","MATT","that hits!",10145.435,10146.353,0.917999999999665,3,0.00326797385621034,2,"combat","MATT",0,0,0,1
"1721","End",8,110,1721,"second_half","LIAM","all right.",10146.353,10147.227,0.874000000001615,3,0.00343249427916986,2,"combat","LIAM",1,0,0,0
"1722","End",8,110,1722,"second_half","LAURA","great. good.",10147.227,10148.334,1.10699999999997,3,0.00271002710027107,2,"combat","LAURA",1,0,0,0
"1723","End",8,110,1723,"second_half","LIAM","plus the what's it called? divine strike, so three plus four is seven, plus the 2d8. that ain't a d8. that's 13. 21. to the gooch.",10148.334,10158.849,10.5149999999994,30,0.00285306704707576,2,"combat","LIAM",1,0,0,0
"1724","End",8,110,1724,"second_half","MATT","nice. she runs up and slams it with the side of the mace. as it hits, you can see there's a flash of radiant energy and it burns away some of the",10165.849,10170.682,4.83300000000054,33,0.00682805710738596,2,"combat","MATT",0,0,0,1
"1725","End",8,110,1725,"second_half","LAURA","it takes an additional 2d6 radiant because he's undead.",10172.784,10175.421,2.63700000000063,11,0.00417140690178134,2,"combat","LAURA",1,0,0,0
"1726","End",8,110,1726,"second_half","LIAM","yes! that's right. fiend or undead take extra 2d6 radiant damage.",10175.421,10184.713,9.29199999999946,13,0.00139905294877322,2,"combat","LIAM",1,0,0,0
"1727","End",8,110,1727,"second_half","LAURA","with her mace of disruption.",10184.713,10186.859,2.14600000000064,6,0.00279589934762265,2,"combat","LAURA",1,0,0,0
"1728","End",8,110,1728,"second_half","MATT","correct. what's the additional damage?",10186.859,10188.766,1.90699999999924,7,0.00367068694284362,2,"combat","MATT",0,0,0,1
"1729","End",8,110,1729,"second_half","LIAM","whatever i just told you.",10188.766,10191.555,2.78900000000067,6,0.00215130871279977,2,"combat","LIAM",1,0,0,0
"1730","End",8,110,1730,"second_half","SAM","21.",10191.555,10192.689,1.13400000000001,2,0.00176366843033507,2,"combat","SAM",1,0,0,0
"1731","End",8,110,1731,"second_half","LIAM","and now i'm going to roll for that extra",10192.689,10193.928,1.23899999999958,10,0.00807102502018031,2,"combat","LIAM",1,0,0,0
"1732","End",8,110,1732,"second_half","LAURA","i just did; it's seven.",10193.928,10195.055,1.12700000000041,7,0.00621118012422136,2,"combat","LAURA",1,0,0,0
"1733","End",8,110,1733,"second_half","MATT","what was the first damage roll you did to do 21 points of damage to her?",10195.055,10197.032,1.97699999999895,17,0.00859888720283713,2,"combat","MATT",0,0,0,1
"1734","End",8,110,1734,"second_half","LIAM","that was the mace of disruption.",10197.032,10199.073,2.04100000000108,7,0.00342969132777869,2,"combat","LIAM",1,0,0,0
"1735","End",8,110,1735,"second_half","LAURA","2d6 plus four radiant damage.",10199.073,10201.201,2.12799999999879,6,0.00281954887218205,2,"combat","LAURA",1,0,0,0
"1736","End",8,110,1736,"second_half","LIAM","plus divine strike. once on each turn, add 2d8 of weapon damage to your damage total.",10201.201,10206.483,5.28200000000106,17,0.00321847784929886,2,"combat","LIAM",1,0,0,0
"1737","End",8,110,1737,"second_half","LAURA","so that's what all he rolled, and then since it's undead, it's an additional 2d6.",10206.483,10210.671,4.1880000000001,19,0.0045367717287487,2,"combat","LAURA",1,0,0,0
"1738","End",8,110,1738,"second_half","MATT","yeah, 2d8. yeah. fuck yeah! all righty.",10210.671,10218.348,7.67699999999968,8,0.00104207372671621,2,"combat","MATT",0,0,0,1
"1739","End",8,110,1739,"second_half","LAURA","an additional seven because he's undead.",10218.348,10220.862,2.51399999999921,8,0.00318217979315931,2,"combat","LAURA",1,0,0,0
"1740","End",8,110,1740,"second_half","TRAVIS","so 28 total.",10220.862,10222.959,2.09700000000157,4,0.00190748688602623,2,"combat","TRAVIS",1,0,0,0
"1741","End",8,110,1741,"second_half","LIAM","gooch shot.",10222.959,10224.671,1.71199999999953,3,0.00175233644859861,2,"combat","LIAM",1,0,0,0
"1742","End",8,110,1742,"second_half","MATT","that is actually pretty damn nasty. worth doing cleric.",10224.671,10232.687,8.01599999999962,10,0.00124750499002002,2,"combat","MATT",0,0,0,1
"1743","End",8,110,1743,"second_half","LIAM","she needs to jump up to hit it.",10232.687,10234.649,1.96199999999953,9,0.00458715596330384,2,"combat","LIAM",1,0,0,0
"1744","End",8,110,1744,"second_half","TRAVIS","she's at 18, right?",10234.649,10235.924,1.27500000000146,6,0.00470588235293581,2,"combat","TRAVIS",1,0,0,0
"1745","End",8,110,1745,"second_half","LIAM","what's at 18?",10235.924,10239.237,3.31299999999828,5,0.00150920615756191,2,"combat","LIAM",1,0,0,0
"1746","End",8,110,1746,"second_half","TRAVIS","pike.",10239.237,10240.219,0.981999999999971,2,0.00203665987780047,2,"combat","TRAVIS",1,0,0,0
"1747","End",8,110,1747,"second_half","LIAM","we're not sure. 17 or 18. real life is hazy.",10240.219,10244.128,3.90900000000147,12,0.00306983883346009,2,"combat","LIAM",1,0,0,0
"1748","End",8,110,1748,"second_half","MATT","she can use a bonus action to hit again if she wants. that's one of her war domain abilities.",10244.128,10249.008,4.8799999999992,21,0.0043032786885253,2,"combat","MATT",0,0,0,1
"1749","End",8,110,1749,"second_half","LAURA","whoa, fuck yeah!",10249.008,10250.213,1.20499999999993,4,0.003319502074689,2,"combat","LAURA",1,0,0,0
"1750","End",8,110,1750,"second_half","LIAM","double gooch shot!",10250.213,10251.669,1.45600000000013,4,0.0027472527472525,2,"combat","LIAM",1,0,0,0
"1751","End",8,110,1751,"second_half","LAURA","one for each.",10251.669,10252.954,1.28499999999985,4,0.00311284046692642,2,"combat","LAURA",1,0,0,0
"1752","End",8,110,1752,"second_half","LIAM","keep looking at mine. same thing. 23.",10252.954,10257.305,4.35100000000057,8,0.00183865777982049,2,"combat","LIAM",1,0,0,0
"1753","End",8,110,1753,"second_half","MATT","all right, 23 hits. roll damage again.",10257.305,10259.353,2.04799999999886,8,0.00390625000000216,2,"combat","MATT",0,0,0,1
"1754","End",8,110,1754,"second_half","LIAM","12 and then the radiant damage. 2d6. so we're at 12 plus five plus no, once per turn. 17.",10259.353,10274.862,15.509,21,0.00135405248565349,2,"combat","LIAM",1,0,0,0
"1755","End",8,110,1755,"second_half","MATT","17 damage? all righty. so a second hit slams, and you could see the first one where it burst out, burned and singed the necrotic flash. the second one hits, not as impactful but still, it looks relatively hurt. that ends pike's go.",10276.26,10283.833,7.57300000000032,45,0.00594216294731257,2,"combat","MATT",0,0,0,1
"1756","End",8,110,1756,"second_half","LAURA","can't she move away from him? oh, no, because he will get an attack.",10292.123,10296.214,4.09100000000035,16,0.0039110241994619,2,"combat","LAURA",1,0,0,0
"1757","End",8,110,1757,"second_half","MATT","she could move back five, but it will get an attack of opportunity if she does that.",10296.214,10299.585,3.37099999999919,18,0.00533966182141927,2,"combat","MATT",0,0,0,1
"1758","End",8,110,1758,"second_half","LIAM","no, she's going to face him down.",10299.585,10301.014,1.42900000000009,9,0.00629811056682957,2,"combat","LIAM",1,0,0,0
"1759","End",8,110,1759,"second_half","MATT","okay. grog, you're up.",10301.014,10302.312,1.29800000000068,6,0.00462249614791744,2,"combat","MATT",0,0,0,1
"1760","End",8,110,1760,"second_half","TRAVIS","i would like to rage and run up and to this doorway. five, 10, 15, 20. can i see anything in this room?",10302.312,10311.069,8.75699999999961,24,0.00274066461116833,2,"combat","TRAVIS",1,0,0,0
"1761","End",8,110,1761,"second_half","MATT","make a perception check.",10312.455,10313.636,1.18100000000049,5,0.00423370025402024,2,"combat","MATT",0,0,0,1
"1762","End",8,110,1762,"second_half","TRAVIS","okay. five.",10313.636,10316.364,2.72799999999916,3,0.00109970674486838,2,"combat","TRAVIS",1,0,0,0
"1763","End",8,110,1763,"second_half","MATT","nope.",10316.364,10317.478,1.11399999999958,2,0.00179533213644592,2,"combat","MATT",0,0,0,1
"1764","End",8,110,1764,"second_half","TRAVIS","yep. i don't see anything. oh, do i feel anything from the black metallic hammer that i'm holding?",10317.478,10324.767,7.28900000000067,21,0.0028810536424747,2,"combat","TRAVIS",1,0,0,0
"1765","End",8,110,1765,"second_half","LAURA","oh yeah, you've been trying to attune to it.",10326.032,10327.874,1.84200000000055,11,0.00597176981541623,2,"combat","LAURA",1,0,0,0
"1766","End",8,110,1766,"second_half","MATT","i don't think you've had time yet to fully attune to it.",10327.874,10330.617,2.74300000000039,15,0.00546846518410421,2,"combat","MATT",0,0,0,1
"1767","End",8,110,1767,"second_half","TALIESIN","he started attuning to it before the break.",10330.617,10332.918,2.30099999999948,9,0.00391134289439463,2,"combat","TALIESIN",1,0,0,0
"1768","End",8,110,1768,"second_half","LIAM","it's a half hour ago, at this point.",10335.308,10336.889,1.58099999999831,10,0.00632511068944382,2,"combat","LIAM",1,0,0,0
"1769","End",8,110,1769,"second_half","SAM","the break doesn't exist.",10336.889,10339.021,2.13200000000143,6,0.002814258911818,2,"combat","SAM",1,0,0,0
"1770","End",8,110,1770,"second_half","TRAVIS","it's not really enough time. okay.",10339.021,10340.51,1.48899999999958,8,0.00537273337810763,2,"combat","TRAVIS",1,0,0,0
"1771","End",8,110,1771,"second_half","LAURA","he started attuning to it as soon as percy felt something from the belt, so if it's been long enough?",10340.51,10342.734,2.22400000000016,22,0.00989208633093454,2,"combat","LAURA",1,0,0,0
"1772","End",8,110,1772,"second_half","LIAM","you can say no.",10344.318,10345.858,1.54000000000087,5,0.00324675324675141,2,"combat","LIAM",1,0,0,0
"1773","End",8,110,1773,"second_half","TRAVIS","i'm going to keep coming in here.",10345.858,10347.282,1.42399999999907,9,0.00632022471910526,2,"combat","TRAVIS",1,0,0,0
"1774","End",8,110,1774,"second_half","MATT","sure.",10347.282,10348.126,0.84400000000096,2,0.0023696682464428,2,"combat","MATT",0,0,0,1
"1775","End",8,110,1775,"second_half","TRAVIS","really?",10348.126,10349.264,1.13799999999901,2,0.00175746924428975,2,"combat","TRAVIS",1,0,0,0
"1776","End",8,110,1776,"second_half","MATT","if you want to, i'll let you attune to it.",10349.264,10351.031,1.76700000000164,12,0.00679117147707348,2,"combat","MATT",0,0,0,1
"1777","End",8,110,1777,"second_half","TRAVIS","yeah? i'll attune to it. i want to attune to it first.",10351.031,10355.998,4.96699999999873,14,0.00281860277833774,2,"combat","TRAVIS",1,0,0,0
"1778","End",8,110,1778,"second_half","LIAM","you go blind.",10355.998,10357.469,1.47099999999955,4,0.00271923861318914,2,"combat","LIAM",1,0,0,0
"1779","End",8,110,1779,"second_half","SAM","insta-death.",10357.469,10358.639,1.17000000000007,3,0.0025641025641024,2,"combat","SAM",1,0,0,0
"1780","End",8,110,1780,"second_half","MATT","okay. go ahead.",10358.639,10360.166,1.52700000000004,4,0.00261951538965284,2,"combat","MATT",0,0,0,1
"1781","End",8,110,1781,"second_half","LAURA","are you going to attack the guy with it?",10360.166,10361.809,1.64300000000003,10,0.00608642726719405,2,"combat","LAURA",1,0,0,0
"1782","End",8,110,1782,"second_half","TRAVIS","well, i don't see anything in the room, right?",10361.809,10363.324,1.51500000000124,11,0.00726072607260133,2,"combat","TRAVIS",1,0,0,0
"1783","End",8,110,1783,"second_half","MATT","you don't see anything in the room.",10363.324,10364.798,1.47400000000016,9,0.00610583446404276,2,"combat","MATT",0,0,0,1
"1784","End",8,110,1784,"second_half","TRAVIS","can i make my way through here?",10364.798,10365.958,1.15999999999985,8,0.0068965517241388,2,"combat","TRAVIS",1,0,0,0
"1785","End",8,110,1785,"second_half","MATT","you may.",10365.958,10366.816,0.858000000000175,3,0.00349650349650278,2,"combat","MATT",0,0,0,1
"1786","End",8,110,1786,"second_half","TRAVIS","okay.",10366.816,10367.71,0.893999999998414,2,0.00223713646532835,2,"combat","TRAVIS",1,0,0,0
"1787","End",8,110,1787,"second_half","LIAM","grog, i'm so glad we're together at last.",10367.71,10369.593,1.88300000000163,11,0.0058417419012164,2,"combat","LIAM",1,0,0,0
"1788","End",8,110,1788,"second_half","MARISHA","starts talking to him <i>again</i>.",10369.593,10371.528,1.93499999999949,8,0.00413436692506569,2,"combat","MARISHA",1,0,0,0
"1789","End",8,110,1789,"second_half","TALIESIN","what if it heals him? he hits him so hard it actually puts health points back into him.",10371.528,10376.109,4.58100000000013,19,0.004147566033617,2,"combat","TALIESIN",1,0,0,0
"1790","End",8,110,1790,"second_half","MARISHA","it's craven edge. he just got a make-over.",10376.109,10378.492,2.38299999999981,11,0.00461603021401631,2,"combat","MARISHA",1,0,0,0
"1791","End",8,110,1791,"second_half","TRAVIS","can i make a reckless attack against him?",10378.492,10379.994,1.50200000000041,9,0.00599201065246176,2,"combat","TRAVIS",1,0,0,0
"1792","End",8,110,1792,"second_half","MATT","you may.",10379.994,10380.986,0.992000000000189,3,0.00302419354838652,2,"combat","MATT",0,0,0,1
"1793","End",8,110,1793,"second_half","TALIESIN","craven head.",10380.986,10382.053,1.0669999999991,3,0.00281162136832478,2,"combat","TALIESIN",1,0,0,0
"1794","End",8,110,1794,"second_half","TRAVIS","craven head. that's not great. 22.",10382.053,10386.137,4.08400000000074,8,0.00195886385896145,2,"combat","TRAVIS",1,0,0,0
"1795","End",8,110,1795,"second_half","MATT","what was the natural roll?",10386.137,10387.448,1.31099999999969,6,0.00457665903890267,2,"combat","MATT",0,0,0,1
"1796","End",8,110,1796,"second_half","TRAVIS","a six.",10387.448,10388.767,1.31899999999951,3,0.0022744503411684,2,"combat","TRAVIS",1,0,0,0
"1797","End",8,110,1797,"second_half","MATT","a six? as you swing the hammer, go ahead and roll damage.",10388.767,10393.716,4.94900000000052,13,0.00262679329157378,2,"combat","MATT",0,0,0,1
"1798","End",8,110,1798,"second_half","LAURA","oh no. this is something weird.",10393.716,10400.52,6.80400000000009,7,0.00102880658436213,2,"combat","LAURA",1,0,0,0
"1799","End",8,110,1799,"second_half","TRAVIS","23.",10400.52,10403.957,3.4369999999999,2,0.000581902822228705,2,"combat","TRAVIS",1,0,0,0
"1800","End",8,110,1800,"second_half","MATT","you suffer 23 points of bludgeoning damage as you swing and clobber yourself across the face with the hammer.",10403.957,10410.021,6.06400000000031,20,0.00329815303430063,2,"combat","MATT",0,0,0,1
"1801","End",8,110,1801,"second_half","SAM AND TALIESIN","what?",10411.304,10412.914,1.61000000000058,2,0.00124223602484427,2,"combat","SAM AND TALIESIN",1,0,0,0
"1802","End",8,110,1802,"second_half","TRAVIS","i'm drunk.",10412.914,10415.098,2.18399999999929,4,0.00183150183150243,2,"combat","TRAVIS",1,0,0,0
"1803","End",8,110,1803,"second_half","LAURA","is it like if you roll below a certain thing you hit yourself instead?",10415.098,10417.829,2.73099999999977,15,0.00549249359209128,2,"combat","LAURA",1,0,0,0
"1804","End",8,110,1804,"second_half","TRAVIS","23, so half of that is 12. 11.",10417.829,10422.469,4.63999999999942,9,0.00193965517241404,2,"combat","TRAVIS",1,0,0,0
"1805","End",8,110,1805,"second_half","MATT","so you pull back and. you're taken aback by it.",10422.469,10426.659,4.19000000000051,12,0.00286396181384213,2,"combat","MATT",0,0,0,1
"1806","End",8,110,1806,"second_half","TALIESIN","i'm so amused.",10426.659,10429.195,2.53600000000006,5,0.00197160883280753,2,"combat","TALIESIN",1,0,0,0
"1807","End",8,110,1807,"second_half","TRAVIS","i try again.",10429.195,10435.345,6.14999999999964,4,0.000650406504065079,2,"combat","TRAVIS",1,0,0,0
"1808","End",8,110,1808,"second_half","MATT","roll for an attack.",10435.345,10436.901,1.55600000000049,5,0.00321336760925348,2,"combat","MATT",0,0,0,1
"1809","End",8,110,1809,"second_half","LAURA","oh my god, roll high!",10436.901,10438.403,1.50200000000041,6,0.00399467376830784,2,"combat","LAURA",1,0,0,0
"1810","End",8,110,1810,"second_half","TRAVIS","reckless, great weapon master.",10438.403,10439.968,1.56500000000051,5,0.0031948881789127,2,"combat","TRAVIS",1,0,0,0
"1811","End",8,110,1811,"second_half","MARISHA","why do you always get the fucked-up weapon?",10439.968,10442.337,2.36899999999878,10,0.00422119037568812,2,"combat","MARISHA",1,0,0,0
"1812","End",8,110,1812,"second_half","TRAVIS","natural 20!",10442.337,10443.887,1.55000000000109,3,0.00193548387096638,2,"combat","TRAVIS",1,0,0,0
"1813","End",8,110,1813,"second_half","MATT","okay.",10443.887,10445.282,1.39499999999862,2,0.00143369175627382,2,"combat","MATT",0,0,0,1
"1814","End",8,110,1814,"second_half","MARISHA","this is going to knock him out.",10445.282,10446.965,1.6830000000009,8,0.00475341651811985,2,"combat","MARISHA",1,0,0,0
"1815","End",8,110,1815,"second_half","MATT","roll damage.",10446.965,10448.372,1.40699999999924,3,0.00213219616204805,2,"combat","MATT",0,0,0,1
"1816","End",8,110,1816,"second_half","LIAM","finally, an enemy that can kill grog.",10448.372,10451.579,3.20700000000033,8,0.00249454318677866,2,"combat","LIAM",1,0,0,0
"1817","End",8,110,1817,"second_half","TRAVIS","i've been doing a d12. is that appropriate for the hammer?",10451.579,10454.361,2.78200000000106,13,0.0046728971962599,2,"combat","TRAVIS",1,0,0,0
"1818","End",8,110,1818,"second_half","MATT","no, did you do a d12 last time?",10454.361,10456.358,1.99699999999939,9,0.00450676014021169,2,"combat","MATT",0,0,0,1
"1819","End",8,110,1819,"second_half","TRAVIS","yeah. so i'd to do a d10?",10456.358,10458.339,1.98099999999977,9,0.00454316002019236,2,"combat","TRAVIS",1,0,0,0
"1820","End",8,110,1820,"second_half","MATT","for the warhammer.",10458.339,10459.878,1.53900000000067,4,0.00259909031838743,2,"combat","MATT",0,0,0,1
"1821","End",8,110,1821,"second_half","TRAVIS","two-handed.",10459.878,10461.004,1.1260000000002,3,0.00266429840142048,2,"combat","TRAVIS",1,0,0,0
"1822","End",8,110,1822,"second_half","MATT","warhammer is 1d8, but if you're a versatile two-handed, it's a d10.",10461.004,10466.064,5.05999999999949,16,0.0031620553359687,2,"combat","MATT",0,0,0,1
"1823","End",8,110,1823,"second_half","TRAVIS","let's do that.",10466.064,10467.244,1.18000000000029,5,0.00423728813559218,2,"combat","TRAVIS",1,0,0,0
"1824","End",8,110,1824,"second_half","MATT","so. it's fine for the last one. since you took it to the face.",10467.244,10473.989,6.74499999999898,16,0.00237212750185358,2,"combat","MATT",0,0,0,1
"1825","End",8,110,1825,"second_half","TALIESIN","that'd be amazing!",10473.989,10476.143,2.15400000000045,5,0.00232126276694473,2,"combat","TALIESIN",1,0,0,0
"1826","End",8,110,1826,"second_half","LIAM","no, it wouldn't.",10476.143,10479.627,3.48400000000038,5,0.0014351320321468,2,"combat","LIAM",1,0,0,0
"1827","End",8,110,1827,"second_half","TRAVIS","22, 32. 38.",10479.627,10485.153,5.52599999999984,4,0.000723850886717357,2,"combat","TRAVIS",1,0,0,0
"1828","End",8,110,1828,"second_half","TRAVIS","39.",10487.399,10488.504,1.10500000000138,2,0.00180995475112896,2,"combat","TRAVIS",1,0,0,0
"1829","End",8,110,1829,"second_half","MATT","39?",10488.504,10489.512,1.00799999999981,2,0.00198412698412736,2,"combat","MATT",0,0,0,1
"1830","End",8,110,1830,"second_half","TRAVIS","yeah.",10489.512,10490.673,1.16100000000006,2,0.0017226528854435,2,"combat","TRAVIS",1,0,0,0
"1831","End",8,110,1831,"second_half","SAM","that's with the double?",10490.673,10491.851,1.17799999999988,6,0.00509337860781035,2,"combat","SAM",1,0,0,0
"1832","End",8,110,1832,"second_half","LAURA","wait, you forgot to add stuff?",10491.851,10493.978,2.12699999999859,7,0.00329102021626923,2,"combat","LAURA",1,0,0,0
"1833","End",8,110,1833,"second_half","TRAVIS","yeah, hold on.",10493.978,10495.174,1.19600000000173,4,0.00334448160534633,2,"combat","TRAVIS",1,0,0,0
