"","arc","arc_no","episode","turn_number","segment","actor","text","start_turn","end_turn","time_in_sec","word_count","words_per_ms","encounter_count","rp_combat","actor_guest","vox_machina","guest","staff","matt"
"466","End",8,110,466,"first_half","MATT","oh, that's going to suck!",3682.163,3685.461,3.29799999999977,7,0.0021224984839298,1,"combat","MATT",0,0,0,1
"467","End",8,110,467,"first_half","LAURA","squish him! make a building out of him! i don't know.",3685.461,3691.449,5.98800000000028,13,0.00217100868403463,1,"combat","LAURA",1,0,0,0
"468","End",8,110,468,"first_half","TRAVIS","oh! i reroll ones and twos! great. 11, that's better.",3691.449,3696.028,4.57899999999972,12,0.00262065953264921,1,"combat","TRAVIS",1,0,0,0
"469","End",8,110,469,"first_half","TALIESIN","you get all sorts of bonuses to that crit.",3696.028,3701.399,5.37100000000009,10,0.00186185067957547,1,"combat","TALIESIN",1,0,0,0
"470","End",8,110,470,"first_half","TRAVIS","36, 42",3701.399,3705.936,4.53700000000026,2,0.000440819925060587,1,"combat","TRAVIS",1,0,0,0
"471","End",8,110,471,"first_half","LAURA","now i've got david bowie in my head.",3705.936,3708.365,2.42899999999963,10,0.00411692054343413,1,"combat","LAURA",1,0,0,0
"472","End",8,110,472,"first_half","TRAVIS","48.",3708.365,3710.105,1.74000000000024,2,0.00114942528735617,1,"combat","TRAVIS",1,0,0,0
"473","End",8,110,473,"first_half","MATT","48 points of damage.",3710.105,3712.451,2.346,5,0.0021312872975277,1,"combat","MATT",0,0,0,1
"474","End",8,110,474,"first_half","TRAVIS","oh, necrotic. 52.",3712.451,3717.794,5.34299999999985,4,0.000748643084409529,1,"combat","TRAVIS",1,0,0,0
"475","End",8,110,475,"first_half","TALIESIN","is that doubled? and you doubled everything into your extra crit",3717.794,3720.895,3.10100000000011,11,0.00354724282489507,1,"combat","TALIESIN",1,0,0,0
"476","End",8,110,476,"first_half","TRAVIS","i've been practicing.",3720.895,3722.864,1.96900000000005,5,0.00253936008125946,1,"combat","TRAVIS",1,0,0,0
"477","End",8,110,477,"first_half","MATT","as it slams with both fists into you, with one giant over the head as it impacts you, you grab with one hand the back of its fist and grin, and then bring the axe straight up into its torso with one hand. it strikes and splits open part of its rock chest and you hear this which it reforms again. but still, it's taken the brunt of the impact, and it's now going to shift into the wall, which you can't attack because you already used your reaction. that ends their turn. keyleth, you're up. you're currently buried. you're blinded.",3722.864,3729.399,6.53499999999985,108,0.0165263963274679,1,"combat","MATT",0,0,0,1
"478","End",8,110,478,"first_half","MARISHA","okay. i'm going to concentrate for a second, and then go earth elemental. and now that i'm earth elemental, i have tremor sense. can i sense where these other motherfuckers are?",3758.107,3766.517,8.40999999999985,34,0.00404280618311541,1,"combat","MARISHA",1,0,0,0
"479","End",8,110,479,"first_half","MATT","you can feel where they are, yeah. you can sense them moving through the ground.",3774.041,3776.926,2.88499999999976,16,0.00554592720970583,1,"combat","MATT",0,0,0,1
"480","End",8,110,480,"first_half","SAM","oh shit. everybody dies.",3776.926,3781.425,4.49900000000025,5,0.00111135807957318,1,"combat","SAM",1,0,0,0
"481","End",8,110,481,"first_half","MARISHA","but i want to be underground. i'm there, but i'm still underground right now.",3781.425,3785.204,3.779,17,0.00449854458851548,1,"combat","MARISHA",1,0,0,0
"482","End",8,110,482,"first_half","MATT","right. i'm marking your place.",3785.204,3786.63,1.42599999999993,7,0.00490883590462857,1,"combat","MATT",0,0,0,1
"483","End",8,110,483,"first_half","MARISHA","yeah.",3786.63,3787.516,0.885999999999967,2,0.00225733634311521,1,"combat","MARISHA",1,0,0,0
"484","End",8,110,484,"first_half","TALIESIN","underground!",3787.516,3789.527,2.01099999999997,2,0.000994530084535073,1,"combat","TALIESIN",1,0,0,0
"485","End",8,110,485,"first_half","MARISHA","put on your earthglide shoes and dance! okay, i want to go right in the center of as many of them as i can hit and take a cue from scanlan and do a thunderwave underground.",3789.527,3794.689,5.16199999999981,37,0.00716776443239081,1,"combat","MARISHA",1,0,0,0
"486","End",8,110,486,"first_half","MATT","as your earth elemental? because you have",3804.837,3807.422,2.58500000000004,7,0.0027079303675048,1,"combat","MATT",0,0,0,1
"487","End",8,110,487,"first_half","MARISHA","because i can cast in wild shape now.",3807.422,3810.553,3.13099999999986,9,0.00287448099648688,1,"combat","MARISHA",1,0,0,0
"488","End",8,110,488,"first_half","SAM","he's going to the phone. he's checking his texts.",3810.553,3814.914,4.36100000000033,12,0.0027516624627377,1,"combat","SAM",1,0,0,0
"489","End",8,110,489,"first_half","TRAVIS","so if they're healing when we hit them, do we think they're healing when they go back into the wall?",3814.914,3819.061,4.14699999999993,23,0.00554617795997115,1,"combat","TRAVIS",1,0,0,0
"490","End",8,110,490,"first_half","TALIESIN","probably.",3820.216,3821.748,1.53200000000015,2,0.0013054830287205,1,"combat","TALIESIN",1,0,0,0
"491","End",8,110,491,"first_half","MATT","let me see here real fast. what are the components of thunderwave?",3821.748,3830.291,8.54300000000012,13,0.00152171368371764,1,"combat","MATT",0,0,0,1
"492","End",8,110,492,"first_half","SAM","i will look for you!",3830.291,3832.831,2.53999999999996,6,0.00236220472440948,1,"combat","SAM",1,0,0,0
"493","End",8,110,493,"first_half","MATT","thunderwave is verbal and somatic. right?",3832.831,3836.476,3.64499999999998,7,0.001920438957476,1,"combat","MATT",0,0,0,1
"494","End",8,110,494,"first_half","SAM","v, s!",3836.476,3838.365,1.88899999999967,3,0.00158814187400769,1,"combat","SAM",1,0,0,0
"495","End",8,110,495,"first_half","MATT","correct.",3838.365,3839.878,1.51300000000037,2,0.00132187706543259,1,"combat","MATT",0,0,0,1
"496","End",8,110,496,"first_half","TRAVIS","dude, that is a badass.",3839.878,3842.369,2.49099999999999,6,0.00240867121637898,1,"combat","TRAVIS",1,0,0,0
"497","End",8,110,497,"first_half","MATT","just making sure, because there is a slight limitation to druid spellcasting in beast form. you're probably still good. let me see.",3842.369,3846.6,4.23099999999977,24,0.0056724178681166,1,"combat","MATT",0,0,0,1
"498","End",8,110,498,"first_half","MARISHA","not using material components, you mean?",3848.201,3851.748,3.54700000000003,7,0.00197349873132223,1,"combat","MARISHA",1,0,0,0
"499","End",8,110,499,"first_half","LAURA","he got bigger?",3851.748,3853.483,1.73500000000013,4,0.0023054755043226,1,"combat","LAURA",1,0,0,0
"500","End",8,110,500,"first_half","MARISHA","no, that's me. that's me, baby, that's me.",3853.483,3856.765,3.2819999999997,12,0.00365630712979924,1,"combat","MARISHA",1,0,0,0
"501","End",8,110,501,"first_half","LIAM","should've seen the green.",3856.765,3858.376,1.61100000000033,6,0.00372439478584653,1,"combat","LIAM",1,0,0,0
"502","End",8,110,502,"first_half","MATT","yeah, verbal and somatic, so you can do that.",3858.376,3861.078,2.70199999999977,10,0.00370096225018536,1,"combat","MATT",0,0,0,1
"503","End",8,110,503,"first_half","TALIESIN","yeah!",3861.078,3862.574,1.49600000000009,2,0.00133689839572184,1,"combat","TALIESIN",1,0,0,0
"504","End",8,110,504,"first_half","MARISHA","i'm going to do it 3rd-level, too.",3862.574,3864.344,1.76999999999998,10,0.00564971751412435,1,"combat","MARISHA",1,0,0,0
"505","End",8,110,505,"first_half","MATT","15-foot cube, the most guys you can hit would probably be these two here, clustered together. otherwise, everyone else is just a one hit. they're too far spread out.",3864.344,3869.057,4.71299999999974,32,0.00678973053256987,1,"combat","MATT",0,0,0,1
"506","End",8,110,506,"first_half","MARISHA","it's a 15-foot radius from you.",3871.97,3874.286,2.31600000000026,9,0.00388601036269387,1,"combat","MARISHA",1,0,0,0
"507","End",8,110,507,"first_half","MATT","it's a 15-foot cube originating from you. meaning it's not a radial thing.",3874.286,3879.286,5,17,0.0034,1,"combat","MATT",0,0,0,1
"508","End",8,110,508,"first_half","MARISHA","oh, like a. oh, cool! got it. then i'll take those two dudes.",3879.286,3884.827,5.54100000000017,15,0.00270709258256624,1,"combat","MARISHA",1,0,0,0
"509","End",8,110,509,"first_half","LIAM","so that's why vax's feathers were prickling the other time.",3884.827,3888.626,3.79899999999998,13,0.00342195314556464,1,"combat","LIAM",1,0,0,0
"510","End",8,110,510,"first_half","MATT","so you shift through over here, beneath the ground.",3888.626,3892.462,3.83599999999979,10,0.00260688216892611,1,"combat","MATT",0,0,0,1
"511","End",8,110,511,"first_half","LAURA","that's so cool.",3892.462,3894.464,2.00199999999995,5,0.00249750249750256,1,"combat","LAURA",1,0,0,0
"512","End",8,110,512,"first_half","MARISHA","underground!",3894.464,3896.853,2.38900000000012,2,0.000837170364169065,1,"combat","MARISHA",1,0,0,0
"513","End",8,110,513,"first_half","LAURA","look how much bigger she is than those fucks!",3896.853,3899.088,2.23500000000013,10,0.00447427293064851,1,"combat","LAURA",1,0,0,0
"514","End",8,110,514,"first_half","MARISHA","that's not a great roll, but it'll do.",3899.088,3902.322,3.23399999999992,11,0.00340136054421777,1,"combat","MARISHA",1,0,0,0
"515","End",8,110,515,"first_half","SAM","do you get to reroll ones?",3902.322,3904.487,2.16499999999996,7,0.00323325635103932,1,"combat","SAM",1,0,0,0
"516","End",8,110,516,"first_half","MARISHA","ones and twos.",3904.487,3906.835,2.34799999999996,4,0.00170357751277686,1,"combat","MARISHA",1,0,0,0
"517","End",8,110,517,"first_half","MATT","that's a 13 and a 17. so neither of them make their save.",3906.835,3913.83,6.99499999999989,15,0.00214438884917802,1,"combat","MATT",0,0,0,1
"518","End",8,110,518,"first_half","MARISHA","so that is 16 times two, so 32 damage to both of them.",3913.83,3920.924,7.09400000000005,14,0.00197349873132223,1,"combat","MARISHA",1,0,0,0
"519","End",8,110,519,"first_half","MATT","32 points of damage to both of them.",3920.924,3923.563,2.63900000000012,9,0.00341038272072739,1,"combat","MATT",0,0,0,1
"520","End",8,110,520,"first_half","SAM","did they make saves?",3923.563,3925.2,1.63699999999972,5,0.00305436774587713,1,"combat","SAM",1,0,0,0
"521","End",8,110,521,"first_half","MARISHA","no.",3925.2,3926.437,1.23700000000008,2,0.00161681487469674,1,"combat","MARISHA",1,0,0,0
"522","End",8,110,522,"first_half","SAM","so they get pushed as well.",3926.437,3928.146,1.70900000000029,7,0.00409596255119884,1,"combat","SAM",1,0,0,0
"523","End",8,110,523,"first_half","MARISHA","and they also get pushed ten feet. yeah.",3928.146,3930.088,1.94200000000001,9,0.0046343975283213,1,"combat","MARISHA",1,0,0,0
"524","End",8,110,524,"first_half","MATT","well, they'd get pushed if they weren't in the middle of the rock. they glide on their own. they stay put.",3930.088,3933.948,3.85999999999967,24,0.00621761658031141,1,"combat","MATT",0,0,0,1
"525","End",8,110,525,"first_half","MARISHA","sure.",3935.335,3936.612,1.27700000000004,2,0.00156617071260762,1,"combat","MARISHA",1,0,0,0
"526","End",8,110,526,"first_half","MATT","all right. so as you outward, you send the shockwave, and you guys hear this loud, thunderous beneath the ground. and you watch as rock and dirt is thrown from this wall. poor trinket is spattered with rock and dirt and spins around.",3936.612,3947.592,10.98,44,0.00400728597449908,1,"combat","MATT",0,0,0,1
"527","End",8,110,527,"first_half","LAURA","aw, buddy! you're okay!",3958.071,3960.262,2.19100000000026,6,0.00273847558192574,1,"combat","LAURA",1,0,0,0
"528","End",8,110,528,"first_half","MATT","that wall is not looking very sturdy right now. the thunderwave has structurally damaged this whole portion of the cavern right now.",3960.262,3965.063,4.80099999999993,23,0.00479066861070617,1,"combat","MATT",0,0,0,1
"529","End",8,110,529,"first_half","TRAVIS","thanks, keyleth.",3966.853,3968.419,1.5659999999998,3,0.00191570881226078,1,"combat","TRAVIS",1,0,0,0
"530","End",8,110,530,"first_half","MARISHA","this whole thing was coming apart!",3968.419,3971.013,2.59400000000005,7,0.002698535080956,1,"combat","MARISHA",1,0,0,0
"531","End",8,110,531,"first_half","MATT","that ends keyleth's turn. pike's up.",3971.013,3974.879,3.86599999999999,9,0.00232798758406623,1,"combat","MATT",0,0,0,1
"532","End",8,110,532,"first_half","LIAM","what about between grog and scanlan? that way if one of them comes up by either of them, she's there.",3974.879,3980.343,5.46399999999994,22,0.00402635431918013,1,"combat","LIAM",1,0,0,0
"533","End",8,110,533,"first_half","MARISHA","get trinket away from that wall.",3981.468,3983.301,1.83300000000008,7,0.00381887615930152,1,"combat","MARISHA",1,0,0,0
"534","End",8,110,534,"first_half","LAURA","well, i would, if it was trinket's turn. pike's going to run down and stand between scanlan and grog.",3983.301,3989.804,6.50300000000016,22,0.00338305397508834,1,"combat","LAURA",1,0,0,0
"535","End",8,110,535,"first_half","MATT","all right.",3990.94,3992.279,1.33899999999994,3,0.00224047796863341,1,"combat","MATT",0,0,0,1
"536","End",8,110,536,"first_half","LAURA","""oh, grog!""",3992.279,3993.725,1.44599999999991,4,0.0027662517289075,1,"combat","LAURA",1,0,0,0
"537","End",8,110,537,"first_half","LIAM","punch the mace and light that shit up.",3993.725,3996.247,2.52199999999993,9,0.0035685963521016,1,"combat","LIAM",1,0,0,0
"538","End",8,110,538,"first_half","LAURA","yeah.",3996.247,3997.373,1.1260000000002,2,0.00177619893428032,1,"combat","LAURA",1,0,0,0
"539","End",8,110,539,"first_half","LIAM","blow hair out of her face.",3997.373,3999.314,1.9409999999998,7,0.00360638845955729,1,"combat","LIAM",1,0,0,0
"540","End",8,110,540,"first_half","MATT","yeah, so she makes this beacon of light.",3999.314,4001.415,2.10100000000011,9,0.00428367444074227,1,"combat","MATT",0,0,0,1
"541","End",8,110,541,"first_half","LAURA","and then she's going to hold her action until a thing appears.",4001.415,4004.807,3.39199999999983,14,0.00412735849056625,1,"combat","LAURA",1,0,0,0
"542","End",8,110,542,"first_half","MATT","what is she holding?",4004.807,4006.325,1.51800000000003,5,0.00329380764163367,1,"combat","MATT",0,0,0,1
"543","End",8,110,543,"first_half","LAURA","attacking.",4006.325,4007.474,1.14900000000034,2,0.00174064403829365,1,"combat","LAURA",1,0,0,0
"544","End",8,110,544,"first_half","MATT","a physical attack? so as soon as one appears, she's going to go ahead and swing. okay, good. so she's holding that. that ends pike's turn. top of the round: percival, you're up.",4007.474,4011.882,4.4079999999999,38,0.00862068965517261,1,"combat","MATT",0,0,0,1
"545","End",8,110,545,"first_half","TALIESIN","i'm going to",4014.71,4016.29,1.57999999999993,4,0.00253164556962037,1,"combat","TALIESIN",1,0,0,0
"546","End",8,110,546,"first_half","SAM","no bonus action?",4016.29,4018.221,1.93100000000004,4,0.00207146556188499,1,"combat","SAM",1,0,0,0
"547","End",8,110,547,"first_half","TALIESIN","what? well, i'm going to use my bonus action. since there's nothing to attack at the moment, i'm going to move slightly to the other end of that little precipice that i'm on, over where keyleth disappeared.",4018.221,4024.138,5.91699999999992,42,0.00709819165117468,1,"combat","TALIESIN",1,0,0,0
"548","End",8,110,548,"first_half","MATT","oh, over this side?",4031.608,4032.676,1.06799999999976,5,0.00468164794007598,1,"combat","MATT",0,0,0,1
"549","End",8,110,549,"first_half","TALIESIN","yeah, get away from things. i'm going to use my bonus action to do a heal.",4032.676,4036.404,3.72800000000007,18,0.00482832618025743,1,"combat","TALIESIN",1,0,0,0
"550","End",8,110,550,"first_half","MATT","you guys traveled this way, and this is where you saw the right and left split.",4036.404,4040.911,4.50700000000006,17,0.00377191036165959,1,"combat","MATT",0,0,0,1
"551","End",8,110,551,"first_half","LAURA","oh, right.",4040.911,4042.296,1.38499999999976,3,0.00216606498194983,1,"combat","LAURA",1,0,0,0
"552","End",8,110,552,"first_half","TALIESIN","that was embarrassing. so that's 11 points of damage. that's great. and then i'm going to hold my attack until something approaches.",4042.296,4049.747,7.45100000000002,26,0.0034894645014092,1,"combat","TALIESIN",1,0,0,0
"553","End",8,110,553,"first_half","MATT","okay. so you get your weapon ready. you're holding it for any sort of movement out of a wall. got it.",4052.989,4057.465,4.47600000000011,23,0.00513851653261828,1,"combat","MATT",0,0,0,1
"554","End",8,110,554,"first_half","TALIESIN","yeah. gun in one hand, sword in the other.",4058.569,4059.95,1.38099999999986,10,0.00724112961622087,1,"combat","TALIESIN",1,0,0,0
"555","End",8,110,555,"first_half","MATT","all right, got it. grog, you're up.",4059.95,4061.3,1.35000000000036,9,0.00666666666666487,1,"combat","MATT",0,0,0,1
"556","End",8,110,556,"first_half","SAM","why don't we just leave? there's no one here.",4061.3,4063.278,1.97799999999961,12,0.00606673407482425,1,"combat","SAM",1,0,0,0
"557","End",8,110,557,"first_half","TRAVIS","i know, that's what i'm doing. so there's no enemies in sight?",4063.278,4065.489,2.21100000000024,16,0.0072365445499766,1,"combat","TRAVIS",1,0,0,0
"558","End",8,110,558,"first_half","MATT","currently, no.",4065.489,4066.823,1.33399999999983,3,0.00224887556221917,1,"combat","MATT",0,0,0,1
"559","End",8,110,559,"first_half","TRAVIS","ah! can i run as far as i can this way?",4066.823,4071.342,4.51900000000023,12,0.00265545474662522,1,"combat","TRAVIS",1,0,0,0
"560","End",8,110,560,"first_half","MATT","yep.",4071.342,4072.509,1.16699999999992,2,0.00171379605826919,1,"combat","MATT",0,0,0,1
"561","End",8,110,561,"first_half","TRAVIS","is that like five, ten, 15, 20",4072.509,4075.141,2.63200000000006,7,0.00265957446808504,1,"combat","TRAVIS",1,0,0,0
"562","End",8,110,562,"first_half","MATT","50 is what you can get, right there.",4075.141,4083.871,8.73000000000002,9,0.00103092783505154,1,"combat","MATT",0,0,0,1
"563","End",8,110,563,"first_half","TRAVIS","i'll take it.",4083.871,4085.134,1.26299999999992,5,0.00395882818685694,1,"combat","TRAVIS",1,0,0,0
"564","End",8,110,564,"first_half","MATT","all right, so that's your movement.",4085.134,4086.434,1.30000000000018,8,0.00615384615384529,1,"combat","MATT",0,0,0,1
"565","End",8,110,565,"first_half","TRAVIS","yep. i'm going to hold my attack until something stupid shows me its face.",4086.434,4091.422,4.98799999999983,16,0.00320769847634333,1,"combat","TRAVIS",1,0,0,0
"566","End",8,110,566,"first_half","MATT","okay, good to know. that ends your turn. vex.",4091.422,4097.057,5.63499999999976,10,0.00177462289263539,1,"combat","MATT",0,0,0,1
"567","End",8,110,567,"first_half","LAURA","okay. i'm going to call trinket away from the wall, so he's going to run down next to grog.",4097.057,4104.776,7.71900000000005,22,0.0028501101178909,1,"combat","LAURA",1,0,0,0
"568","End",8,110,568,"first_half","MATT","okay.",4104.776,4106.556,1.77999999999975,2,0.00112359550561814,1,"combat","MATT",0,0,0,1
"569","End",8,110,569,"first_half","LAURA","and then i'm going to kick off and get on my broom, so i'm off the ground.",4106.556,4111.843,5.28700000000026,20,0.00378286362776603,1,"combat","LAURA",1,0,0,0
"570","End",8,110,570,"first_half","MATT","okay, so you get up, and you're now lifted up into the air a bit.",4111.843,4115.717,3.8739999999998,17,0.00438822922044422,1,"combat","MATT",0,0,0,1
"571","End",8,110,571,"first_half","MARISHA","you're still blind?",4115.717,4118.061,2.34400000000005,5,0.00213310580204774,1,"combat","MARISHA",1,0,0,0
"572","End",8,110,572,"first_half","TALIESIN","no, i can see. we've got two light sources now.",4118.061,4121.271,3.21000000000004,12,0.0037383177570093,1,"combat","TALIESIN",1,0,0,0
"573","End",8,110,573,"first_half","MARISHA","okay.",4121.271,4122.728,1.45700000000033,2,0.00137268359643071,1,"combat","MARISHA",1,0,0,0
"574","End",8,110,574,"first_half","TRAVIS","i believe i can",4122.728,4124.571,1.84299999999985,4,0.00217037438958238,1,"combat","TRAVIS",1,0,0,0
"575","End",8,110,575,"first_half","MATT","you believe you can what?",4124.571,4126.593,2.02199999999993,6,0.0029673590504452,1,"combat","MATT",0,0,0,1
"576","End",8,110,576,"first_half","TRAVIS","fly?",4126.593,4127.713,1.11999999999989,2,0.00178571428571446,1,"combat","TRAVIS",1,0,0,0
"577","End",8,110,577,"first_half","LIAM","fucking die.",4127.713,4130.011,2.29800000000068,3,0.00130548302872024,1,"combat","LIAM",1,0,0,0
"578","End",8,110,578,"first_half","TRAVIS","i believe i can touch what does he touch?",4130.011,4133.195,3.18399999999929,10,0.00314070351758864,1,"combat","TRAVIS",1,0,0,0
"579","End",8,110,579,"first_half","SAM","the sky?",4133.195,4134.458,1.26299999999992,3,0.00237529691211416,1,"combat","SAM",1,0,0,0
"580","End",8,110,580,"first_half","TRAVIS","the sky. i think about it every",4134.458,4138.56,4.10200000000077,7,0.0017064846416379,1,"combat","TRAVIS",1,0,0,0
"581","End",8,110,581,"first_half","MATT","don't hurt yourself.",4138.56,4140.861,2.30099999999948,5,0.00217296827466368,1,"combat","MATT",0,0,0,1
"582","End",8,110,582,"first_half","TRAVIS","i'm never singing in character.",4140.861,4144.343,3.48199999999997,7,0.00201033888569789,1,"combat","TRAVIS",1,0,0,0
"583","End",8,110,583,"first_half","LAURA","don't speak!",4144.343,4148.048,3.70499999999993,4,0.00107962213225373,1,"combat","LAURA",1,0,0,0
"584","End",8,110,584,"first_half","TRAVIS","i know just what you're saying!",4148.048,4150.69,2.64199999999983,8,0.00302800908402745,1,"combat","TRAVIS",1,0,0,0
"585","End",8,110,585,"first_half","LAURA","how high is the ceiling in here?",4150.69,4152.645,1.95500000000084,8,0.00409207161125145,1,"combat","LAURA",1,0,0,0
"586","End",8,110,586,"first_half","LIAM","about 20 feet.",4152.645,4155.16,2.51499999999942,4,0.0015904572564616,1,"combat","LIAM",1,0,0,0
"587","End",8,110,587,"first_half","MATT","you are right up against this ceiling. it's about 12 to 15 feet.",4155.16,4157.384,2.22400000000016,15,0.00674460431654628,1,"combat","MATT",0,0,0,1
"588","End",8,110,588,"first_half","LAURA","yeah, i'm going to want to hover right in the middle. i don't want to be high up. i want to be right between the ceiling and the floor.",4157.384,4160.411,3.02700000000004,32,0.0105715229600263,1,"combat","LAURA",1,0,0,0
"589","End",8,110,589,"first_half","MATT","okay. so you're about a head's height up.",4162.527,4164.57,2.04299999999967,11,0.00538423886441596,1,"combat","MATT",0,0,0,1
"590","End",8,110,590,"first_half","LAURA","yeah. and i'm going to hold my action until i can see one of those things.",4164.57,4170.88,6.3100000000004,18,0.00285261489698873,1,"combat","LAURA",1,0,0,0
"591","End",8,110,591,"first_half","MATT","arrow's notched, ready to fire?",4170.88,4172.355,1.47499999999945,7,0.00474576271186616,1,"combat","MATT",0,0,0,1
"592","End",8,110,592,"first_half","LAURA","uh-huh.",4172.355,4173.331,0.976000000000568,3,0.00307377049180149,1,"combat","LAURA",1,0,0,0
"593","End",8,110,593,"first_half","MATT","okay. that brings us to vax.",4173.331,4174.917,1.58600000000024,7,0.00441361916771686,1,"combat","MATT",0,0,0,1
"594","End",8,110,594,"first_half","LIAM","can i move ten feet closer to scanlan, and do the classic van damme movement and stand between stalactites in the ceiling and hide with my bonus action.",4174.917,4182.889,7.97199999999975,29,0.00363773206221788,1,"combat","LIAM",1,0,0,0
"595","End",8,110,595,"first_half","MATT","right here?",4187.348,4188.264,0.916000000000167,3,0.00327510917030508,1,"combat","MATT",0,0,0,1
"596","End",8,110,596,"first_half","LIAM","yeah, and hide in the ceiling.",4188.264,4189.74,1.47599999999966,7,0.00474254742547535,1,"combat","LIAM",1,0,0,0
"597","End",8,110,597,"first_half","MARISHA","what?",4189.74,4190.55,0.8100000000004,2,0.00246913580246792,1,"combat","MARISHA",1,0,0,0
"598","End",8,110,598,"first_half","TRAVIS","you going to time cop that shit?",4190.55,4191.785,1.23499999999967,8,0.00647773279352398,1,"combat","TRAVIS",1,0,0,0
"599","End",8,110,599,"first_half","MARISHA","that's awesome!",4191.785,4192.825,1.03999999999996,4,0.00384615384615398,1,"combat","MARISHA",1,0,0,0
"600","End",8,110,600,"first_half","SAM","are you doing the splits, right now, are your legs?",4192.825,4194.287,1.46200000000044,11,0.00752393980847925,1,"combat","SAM",1,0,0,0
"601","End",8,110,601,"first_half","LIAM","nah, i'm just using my feet for that. no, my hands are occupied. with my feet, yeah.",4194.287,4198.356,4.06899999999951,19,0.00466945195379757,1,"combat","LIAM",1,0,0,0
"602","End",8,110,602,"first_half","MATT","make a stealth check.",4198.356,4200.152,1.79600000000028,5,0.0027839643652557,1,"combat","MATT",0,0,0,1
"603","End",8,110,603,"first_half","LIAM","stealth check. yeah, baby.",4200.152,4201.777,1.625,5,0.00307692307692308,1,"combat","LIAM",1,0,0,0
"604","End",8,110,604,"first_half","TALIESIN","make a splits check.",4201.777,4203.286,1.50900000000001,5,0.00331345261762754,1,"combat","TALIESIN",1,0,0,0
"605","End",8,110,605,"first_half","LIAM","ten. do i still have sneaky sneak from you?",4203.286,4206.548,3.26199999999972,10,0.00306560392397329,1,"combat","LIAM",1,0,0,0
"606","End",8,110,606,"first_half","LAURA","pass without a trace is still oh, no. no, i hunter's marked.",4206.548,4209.186,2.63799999999992,14,0.00530705079605778,1,"combat","LAURA",1,0,0,0
"607","End",8,110,607,"first_half","LIAM","that's fine. pike, get out of the way!",4209.186,4212.1,2.91400000000067,10,0.00343170899107677,1,"combat","LIAM",1,0,0,0
"608","End",8,110,608,"first_half","TRAVIS","don't you talk to her like that!",4212.1,4214.474,2.3739999999998,9,0.00379106992417893,1,"combat","TRAVIS",1,0,0,0
"609","End",8,110,609,"first_half","LIAM","27. and i'll hold my attack action.",4214.474,4218.722,4.24799999999959,9,0.00211864406779681,1,"combat","LIAM",1,0,0,0
