"","Episode","startTime","endTime","Actor","Text","vox_machina","guest","staff","Matt","Arc","Arc_no","timeDiffInSecs","wordCount","WordsPerMillisec","segment","encounter_count","rp_combat","turn_number","CR_GUEST"
"815",26,7905.974,7916.917,"MATT","tiberius, you make your way into the cloudtop district. as you come to the front gates of the district, the guards that normally recognize you and welcome you in, recognize you and stand firm, weapons at the ready.",0,0,0,1,"Briarwoods",3,10.9430000000002,39,0.00356392214200852,"second_half",NA,"role_play",815,"MATT"
"816",26,7924.892,7926.971,"ORION","at allura's tower?",1,0,0,0,"Briarwoods",3,2.07899999999972,5,0.00240500240500272,"second_half",NA,"role_play",816,"ORION"
"817",26,7926.971,7930.248,"MATT","at the cloudtop district entirely. you guys had to get written permission to enter there when you first came to emon, anyway, since that's where the nobility and many of the important figures of emon reside. it appears that since you've been taken out of the council and you're under investigation, your access to such a sensitive location within emon has been temporarily revoked, and the guards are not letting you through.",0,0,0,1,"Briarwoods",3,3.27700000000004,76,0.023191943851083,"second_half",NA,"role_play",817,"MATT"
"818",26,7948.749,7954.682,"ORION","is that it? so i just turn around? go back?",1,0,0,0,"Briarwoods",3,5.93299999999999,11,0.00185403674363729,"second_half",NA,"role_play",818,"ORION"
"819",26,7954.682,7957.838,"MATT","it's up to you. the guards are just there, standing.",0,0,0,1,"Briarwoods",3,3.15599999999995,12,0.00380228136882135,"second_half",NA,"role_play",819,"MATT"
"820",26,7957.838,7969.348,"ORION","greeting and salutations. i'm tiberius stormwind from draconia. moreover, a member of vox machina, over at greyskull keep. it seems that you all are posturing and whatnot. it's adorable. but i'm here to see lady allura. could you let her know that i would like to speak to her, or get out of my way so i can just go over there and tell her myself?",1,0,0,0,"Briarwoods",3,11.5100000000002,70,0.00608166811468277,"second_half",NA,"role_play",820,"ORION"
"821",26,7989.48,7993.432,"MATT","""we have direct orders to not let you or any other member of vox machina into the cloudtop ""district until your investigation is complete. so no, and no.""",0,0,0,1,"Briarwoods",3,3.95200000000023,30,0.00759109311740847,"second_half",NA,"role_play",821,"MATT"
"822",26,7999.73,8007.23,"ORION","well, do the second thing. if you don't do one thing, do one of the other things.",1,0,0,0,"Briarwoods",3,7.5,19,0.00253333333333333,"second_half",NA,"role_play",822,"ORION"
"823",26,8007.23,8014.783,"MATT","""your information and wish has been processed, taken into consideration. thank you ""very much. please be on your way.""",0,0,0,1,"Briarwoods",3,7.55300000000079,21,0.00278035217794225,"second_half",NA,"role_play",823,"MATT"
"824",26,8016.565,8024.578,"ORION","oh, it has been, it has been processed! oh, that's good to know! i appreciate that. very well. i cast fly on myself and i go back to the keep.",1,0,0,0,"Briarwoods",3,8.01300000000083,32,0.00399351054536337,"second_half",NA,"role_play",824,"ORION"
"825",26,8027.487,8044.873,"MATT","okay. they both did not expect that exit. you essentially superman-ed. you're just like. little cloud of smoke in the shape of a dragonborn left behind. all right. so as you cruise over, you see in the distance, from where you're standing at the top of the keep, you see a distant bead of dark shadow that approaches and grows larger, and it is an air-cruising tiberius making his way towards the keep.",0,0,0,1,"Briarwoods",3,17.3859999999995,78,0.00448636834234454,"second_half",NA,"role_play",825,"MATT"
"826",26,8066.929,8072.852,"LIAM","i hide behind i don't want to get hit, so i'm going to crouch down a little bit, carefully behind one of the pieces of wall. yeah. rough landings, sometimes.",1,0,0,0,"Briarwoods",3,5.92299999999977,33,0.0055715009285837,"second_half",NA,"role_play",826,"LIAM"
"827",26,8078.603,8081.833,"ORION","i fly in. vox machina!",1,0,0,0,"Briarwoods",3,3.22999999999956,6,0.00185758513931914,"second_half",NA,"role_play",827,"ORION"
"828",26,8081.833,8085.191,"LIAM","easy. be careful.",1,0,0,0,"Briarwoods",3,3.35800000000017,4,0.00119118522930309,"second_half",NA,"role_play",828,"LIAM"
"829",26,8085.191,8088.905,"ORION","sorry. hi. what are you doing? are you up here thinking?",1,0,0,0,"Briarwoods",3,3.71399999999994,12,0.00323101777059779,"second_half",NA,"role_play",829,"ORION"
"830",26,8088.905,8097.475,"LIAM","why, i suppose i was. the others are downstairs interrogating that boy. where have you been?",1,0,0,0,"Briarwoods",3,8.57000000000062,17,0.00198366394399052,"second_half",NA,"role_play",830,"LIAM"
"831",26,8098.913,8106.011,"ORION","off doing things that wasn't really that productive, overall, but they don't like me anywhere, especially now.",1,0,0,0,"Briarwoods",3,7.09800000000087,20,0.00281769512538709,"second_half",NA,"role_play",831,"ORION"
"832",26,8109.487,8112.799,"LIAM","do you want to have a drink?",1,0,0,0,"Briarwoods",3,3.3119999999999,8,0.00241545893719814,"second_half",NA,"role_play",832,"LIAM"
"833",26,8112.799,8114.664,"ORION","yes, actually, i do.",1,0,0,0,"Briarwoods",3,1.86499999999978,5,0.0026809651474534,"second_half",NA,"role_play",833,"ORION"
"834",26,8114.664,8117.953,"LIAM","i've got a flask. you normally drink water. you want a shot, though?",1,0,0,0,"Briarwoods",3,3.28900000000067,15,0.00456065673456885,"second_half",NA,"role_play",834,"LIAM"
"835",26,8117.953,8122.586,"ORION","yes, i would love some alcohol. this calls for alcohol.",1,0,0,0,"Briarwoods",3,4.63299999999981,11,0.00237427153032602,"second_half",NA,"role_play",835,"ORION"
"836",26,8122.586,8129.451,"LIAM","i pull out my flask, and i'm amazed, because i've never seen this and i hand it over to him.",1,0,0,0,"Briarwoods",3,6.86499999999978,23,0.00335032774945386,"second_half",NA,"role_play",836,"LIAM"
"837",26,8129.451,8132.649,"ORION","oh yes.",1,0,0,0,"Briarwoods",3,3.19800000000032,3,0.000938086303939869,"second_half",NA,"role_play",837,"ORION"
"838",26,8132.649,8135.644,"SAM","did you eat the flask?",1,0,0,0,"Briarwoods",3,2.99499999999989,6,0.00200333889816368,"second_half",NA,"role_play",838,"SAM"
"839",26,8135.644,8138.271,"ORION","no, fire breath.",1,0,0,0,"Briarwoods",3,2.6269999999995,4,0.00152264940997364,"second_half",NA,"role_play",839,"ORION"
"840",26,8138.271,8142.865,"LIAM","do you want to pass that bad boy back? is it hot?",1,0,0,0,"Briarwoods",3,4.59400000000005,13,0.00282977797126684,"second_half",NA,"role_play",840,"LIAM"
"841",26,8142.865,8144.592,"MATT","it's empty.",0,0,0,1,"Briarwoods",3,1.72699999999986,4,0.00231615518239741,"second_half",NA,"role_play",841,"MATT"
"842",26,8144.592,8149.049,"LIAM","oh, it's empty! well, i guess that was worth it.",1,0,0,0,"Briarwoods",3,4.45700000000033,12,0.00269239398698656,"second_half",NA,"role_play",842,"LIAM"
"843",26,8149.049,8153.188,"ORION","what? what are you talking about? don't you tell me how to drink. oh, you!",1,0,0,0,"Briarwoods",3,4.13900000000012,17,0.00410727228799215,"second_half",NA,"role_play",843,"ORION"
"844",26,8153.188,8160.478,"TRAVIS","i come out from the castle into the courtyard, and i go, hey! i feel like chicken tonight! can we go hunt this big bird?",1,0,0,0,"Briarwoods",3,7.28999999999996,26,0.00356652949245544,"second_half",NA,"role_play",844,"TRAVIS"
"845",26,8163.276,8166.705,"LIAM","tiberius i just got him drunk!",1,0,0,0,"Briarwoods",3,3.42900000000009,7,0.00204141149023034,"second_half",NA,"role_play",845,"LIAM"
"846",26,8166.705,8167.863,"TRAVIS","really?",1,0,0,0,"Briarwoods",3,1.15800000000036,2,0.00172711571675249,"second_half",NA,"role_play",846,"TRAVIS"
"847",26,8167.863,8171.54,"ORION","he gave me a shot of his flask water, and it's so good.",1,0,0,0,"Briarwoods",3,3.67699999999968,15,0.00407941256459105,"second_half",NA,"role_play",847,"ORION"
"848",26,8171.54,8174.602,"TRAVIS","are you sure you didn't hit him with the blunt side of your knife again?",1,0,0,0,"Briarwoods",3,3.0619999999999,17,0.0055519268451994,"second_half",NA,"role_play",848,"TRAVIS"
"849",26,8174.602,8178.558,"LIAM","no, no, he took a shot of the old firewater, and i don't know. we might want to slap him a bit",1,0,0,0,"Briarwoods",3,3.95600000000013,23,0.0058139534883719,"second_half",NA,"role_play",849,"LIAM"
"850",26,8179.655,8184.16,"ORION","allura doesn't like me anymore because i killed that bitch who tried to kill us, and now she's fucking nobody likes us!",1,0,0,0,"Briarwoods",3,4.50500000000011,25,0.00554938956714748,"second_half",NA,"role_play",850,"ORION"
"851",26,8186.784,8188.416,"LIAM","let's find keyleth.",1,0,0,0,"Briarwoods",3,1.63200000000052,5,0.00306372549019511,"second_half",NA,"role_play",851,"LIAM"
"852",26,8188.416,8192.602,"TRAVIS","yeah. smart. keyleth!",1,0,0,0,"Briarwoods",3,4.1860000000006,4,0.000955566172957339,"second_half",NA,"role_play",852,"TRAVIS"
"853",26,8192.602,8196.521,"MARISHA","what? i was reading. what?",1,0,0,0,"Briarwoods",3,3.91899999999987,6,0.00153100280683853,"second_half",NA,"role_play",853,"MARISHA"
"854",26,8196.521,8198.622,"TRAVIS","tibs got turnt up. will you fix it?",1,0,0,0,"Briarwoods",3,2.10099999999875,9,0.00428367444074506,"second_half",NA,"role_play",854,"TRAVIS"
"855",26,8198.622,8199.995,"MARISHA","how?",1,0,0,0,"Briarwoods",3,1.37300000000141,2,0.00145666423889144,"second_half",NA,"role_play",855,"MARISHA"
"856",26,8199.995,8201.659,"ORION","vax gave me",1,0,0,0,"Briarwoods",3,1.66399999999885,3,0.00180288461538586,"second_half",NA,"role_play",856,"ORION"
"857",26,8201.659,8204.237,"MARISHA","what did you do? why are you touching me?",1,0,0,0,"Briarwoods",3,2.57799999999952,10,0.00387897595034983,"second_half",NA,"role_play",857,"MARISHA"
"858",26,8204.237,8207.397,"ORION","oh, i love protecting you, it is and lockheed is, he loves you, too",1,0,0,0,"Briarwoods",3,3.16000000000167,14,0.0044303797468331,"second_half",NA,"role_play",858,"ORION"
"859",26,8207.397,8209.131,"MARISHA","don't touch me right now!",1,0,0,0,"Briarwoods",3,1.73399999999856,7,0.00403690888120289,"second_half",NA,"role_play",859,"MARISHA"
"860",26,8209.131,8212.174,"ORION","see, i'm telling you, nobody likes me.",1,0,0,0,"Briarwoods",3,3.04300000000148,9,0.00295760762405377,"second_half",NA,"role_play",860,"ORION"
"861",26,8212.174,8216.636,"LIAM","i gave him his first drinky. i'm sorry. do you think you could pull him out of it?",1,0,0,0,"Briarwoods",3,4.46199999999953,20,0.00448229493500719,"second_half",NA,"role_play",861,"LIAM"
"862",26,8216.636,8218.044,"MARISHA","what?",1,0,0,0,"Briarwoods",3,1.40799999999945,2,0.0014204545454551,"second_half",NA,"role_play",862,"MARISHA"
"863",26,8218.044,8221.961,"LIAM","i thought he was going to say no! he didn't leave me any.",1,0,0,0,"Briarwoods",3,3.91699999999946,15,0.00382946132244117,"second_half",NA,"role_play",863,"LIAM"
"864",26,8221.961,8234.584,"ORION","it's good. hi. how are you? i'm tiberius draconia. you are princess pretty face. he likes you, too.",1,0,0,0,"Briarwoods",3,12.6230000000014,21,0.00166362988196131,"second_half",NA,"role_play",864,"ORION"
"865",26,8236.583,8243.18,"LIAM","vax walks away, off the roof. out of here. i'm gone!",1,0,0,0,"Briarwoods",3,6.59699999999975,13,0.0019705926936487,"second_half",NA,"role_play",865,"LIAM"
"866",26,8243.18,8245.117,"TRAVIS","grog is riveted.",1,0,0,0,"Briarwoods",3,1.9369999999999,4,0.00206504904491493,"second_half",NA,"role_play",866,"TRAVIS"
"867",26,8245.117,8249.479,"ORION","human kissy mouth, with you is",1,0,0,0,"Briarwoods",3,4.36199999999917,6,0.00137551581843217,"second_half",NA,"role_play",867,"ORION"
"868",26,8252.343,8256.117,"ORION","i'm good.",1,0,0,0,"Briarwoods",3,3.77399999999943,4,0.00105988341282475,"second_half",NA,"role_play",868,"ORION"
"869",26,8256.117,8258.25,"MARISHA","if you touch me one more time!",1,0,0,0,"Briarwoods",3,2.13299999999981,8,0.00375058602906737,"second_half",NA,"role_play",869,"MARISHA"
"870",26,8258.25,8260.617,"ORION","oh! sorry. did you need to go somewhere?",1,0,0,0,"Briarwoods",3,2.36700000000019,9,0.00380228136882099,"second_half",NA,"role_play",870,"ORION"
"871",26,8260.617,8267.244,"MARISHA","i am doing something else, a request that was already made previously, before ""can we fix ""drunk tiberius,"" so i'm a little busy! why don't you go sleep it off, take a nap, and i will deal with you in a second.",1,0,0,0,"Briarwoods",3,6.62700000000041,45,0.00679040289723815,"second_half",NA,"role_play",871,"MARISHA"
"872",26,8273.629,8275.024,"ORION","is it sleepy time?",1,0,0,0,"Briarwoods",3,1.39499999999862,5,0.00358422939068456,"second_half",NA,"role_play",872,"ORION"
"873",26,8275.024,8276.127,"MARISHA","for you.",1,0,0,0,"Briarwoods",3,1.10300000000097,3,0.00271985494106741,"second_half",NA,"role_play",873,"MARISHA"
"874",26,8276.127,8277.721,"ORION","should i cast fireball?",1,0,0,0,"Briarwoods",3,1.59399999999914,5,0.00313676286072942,"second_half",NA,"role_play",874,"ORION"
"875",26,8277.721,8285.266,"MARISHA","oh my god. and i shove him into the cell and put him in bed",1,0,0,0,"Briarwoods",3,7.54500000000007,15,0.00198807157057652,"second_half",NA,"role_play",875,"MARISHA"
"876",26,8285.266,8288.575,"TRAVIS","no, we're not in the prison. we're out in the courtyard.",1,0,0,0,"Briarwoods",3,3.30900000000111,14,0.00423088546388496,"second_half",NA,"role_play",876,"TRAVIS"
"877",26,8288.575,8292.184,"MARISHA","oh, i thought that you said everyone was like, keyleth!",1,0,0,0,"Briarwoods",3,3.60899999999856,11,0.00304793571626611,"second_half",NA,"role_play",877,"MARISHA"
"878",26,8292.184,8296.285,"LAURA","i'm still in the prison. everybody else is out of the prison.",1,0,0,0,"Briarwoods",3,4.10100000000057,14,0.00341380151182591,"second_half",NA,"role_play",878,"LAURA"
"879",26,8296.285,8299.366,"MATT","so where do you push him?",0,0,0,1,"Briarwoods",3,3.08100000000013,7,0.00227198961376167,"second_half",NA,"role_play",879,"MATT"
"880",26,8299.366,8302.025,"ORION","she pushed me off the roof.",1,0,0,0,"Briarwoods",3,2.65899999999965,7,0.00263256863482547,"second_half",NA,"role_play",880,"ORION"
"881",26,8302.025,8304.627,"MARISHA","no! i thought we were downstairs.",1,0,0,0,"Briarwoods",3,2.60200000000077,7,0.0026902382782467,"second_half",NA,"role_play",881,"MARISHA"
"882",26,8304.627,8308.788,"ORION","i fall off the roof. i still have fly on myself, don't i?",1,0,0,0,"Briarwoods",3,4.16100000000006,15,0.00360490266762792,"second_half",NA,"role_play",882,"ORION"
"883",26,8308.788,8314.862,"MARISHA","you don't fall off the roof. i don't know what i do with him. i let him pass out.",1,0,0,0,"Briarwoods",3,6.0739999999987,22,0.00362199539018846,"second_half",NA,"role_play",883,"MARISHA"
"884",26,8314.862,8318.005,"ORION","i'm going to get a sandwich.",1,0,0,0,"Briarwoods",3,3.14300000000003,8,0.00254533884823415,"second_half",NA,"role_play",884,"ORION"
"885",26,8318.005,8320.499,"MARISHA","i let him go get a sandwich.",1,0,0,0,"Briarwoods",3,2.4940000000006,8,0.00320769847634246,"second_half",NA,"role_play",885,"MARISHA"
"886",26,8320.499,8323.118,"SAM","i encourage sandwich!",1,0,0,0,"Briarwoods",3,2.6190000000006,4,0.00152730049637231,"second_half",NA,"role_play",886,"SAM"
"887",26,8327.211,8333.746,"MATT","that's the quote of the night. encouraged to get a sandwich, tiberius wanders off. what are you doing to prepare what you were doing?",0,0,0,1,"Briarwoods",3,6.53499999999985,26,0.00397857689364967,"second_half",NA,"role_play",887,"MATT"
"888",26,8336.196,8338.29,"MARISHA","i don't know! i got distracted!",1,0,0,0,"Briarwoods",3,2.09400000000096,8,0.00382043935052356,"second_half",NA,"role_play",888,"MARISHA"
"889",26,8338.29,8339.563,"ORION","i'm not there.",1,0,0,0,"Briarwoods",3,1.27299999999923,5,0.00392772977219405,"second_half",NA,"role_play",889,"ORION"
"890",26,8339.563,8340.692,"MARISHA","okay.",1,0,0,0,"Briarwoods",3,1.128999999999,2,0.00177147918512115,"second_half",NA,"role_play",890,"MARISHA"
"891",26,8340.692,8344.326,"MATT","well, as the day progresses, what would you guys like to do?",0,0,0,1,"Briarwoods",3,3.63400000000001,13,0.00357732526141991,"second_half",NA,"role_play",891,"MATT"
"892",26,8344.326,8352.953,"MARISHA","wait. my idea. okay. we were wanting extra fortification? we were wanting extra protection. okay? i can't necessarily cast a big spell. i could cast hallucinatory terrain. we have a few options; i'm giving them to you all. i can cast hallucinatory terrain to make this look like something else. i don't think i don't know. i don't know if that's a good idea. i don't know. i could conjure a few woodland beings for, like, extra bears. we could have some bears guarding the palace. i could also throw up a wall of thorns, to barrier the cell with the wall of thorns. you're not here?",1,0,0,0,"Briarwoods",3,8.62700000000041,116,0.0134461574127732,"second_half",NA,"role_play",892,"MARISHA"
"893",26,8389.488,8393.496,"SAM","i think everyone left. i think it's just you and me up here, and drunk tiberius.",1,0,0,0,"Briarwoods",3,4.00799999999981,18,0.00449101796407207,"second_half",NA,"role_play",893,"SAM"
"894",26,8393.496,8399.956,"MARISHA","i went downstairs, and i'm saying this to the group so i don't have to repeat myself!",1,0,0,0,"Briarwoods",3,6.46000000000095,20,0.00309597523219769,"second_half",NA,"role_play",894,"MARISHA"
"895",26,8399.956,8404.371,"ORION","oh, so then i turn around with my sandwich and am like, we have to just make allura talk to us. she can fix everything.",1,0,0,0,"Briarwoods",3,4.41499999999905,26,0.00588901472253807,"second_half",NA,"role_play",895,"ORION"
"896",26,8406.289,8413.015,"TRAVIS","i grab tiberius's mouth and i cover it. please continue.",1,0,0,0,"Briarwoods",3,6.72599999999875,12,0.00178412132025011,"second_half",NA,"role_play",896,"TRAVIS"
"897",26,8413.015,8414.742,"SAM","wall of thorns could be good.",1,0,0,0,"Briarwoods",3,1.72700000000077,7,0.00405327156919333,"second_half",NA,"role_play",897,"SAM"
"898",26,8414.742,8416.662,"LAURA","i like wall of thorns.",1,0,0,0,"Briarwoods",3,1.92000000000007,6,0.00312499999999988,"second_half",NA,"role_play",898,"LAURA"
"899",26,8416.662,8422.738,"MARISHA","the thing with wall of thorns is it's not super big. it's 60 feet.",1,0,0,0,"Briarwoods",3,6.07599999999911,17,0.00279789335088915,"second_half",NA,"role_play",899,"MARISHA"
"900",26,8422.738,8424.02,"SAM","that's pretty big!",1,0,0,0,"Briarwoods",3,1.28200000000106,5,0.00390015600623702,"second_half",NA,"role_play",900,"SAM"
"901",26,8424.02,8425.744,"LAURA","oh. that's not the whole place, though.",1,0,0,0,"Briarwoods",3,1.72400000000016,9,0.00522041763341019,"second_half",NA,"role_play",901,"LAURA"
"902",26,8425.744,8429.707,"SAM","oh, 60 feet long. i thought you meant high.",1,0,0,0,"Briarwoods",3,3.96299999999974,10,0.00252334090335621,"second_half",NA,"role_play",902,"SAM"
"903",26,8429.707,8434.468,"MARISHA","no, it's 100 feet high. it's really high. actually, i don't know how high it is. don't quote me on that. but it's not that long, but we could fortify the doors more. have bears. we could do multiple things, too.",1,0,0,0,"Briarwoods",3,4.76100000000042,47,0.00987187565637384,"second_half",NA,"role_play",903,"MARISHA"
"904",26,8443.086,8448.874,"LIAM","i think that the hallucinatory terrain wouldn't work. i felt like they could see right through me.",1,0,0,0,"Briarwoods",3,5.78800000000047,19,0.003282653766413,"second_half",NA,"role_play",904,"LIAM"
"905",26,8450.224,8451.53,"TRAVIS","i think so, too.",1,0,0,0,"Briarwoods",3,1.30600000000049,5,0.00382848392036608,"second_half",NA,"role_play",905,"TRAVIS"
"906",26,8451.53,8452.756,"MARISHA","on the briarwoods?",1,0,0,0,"Briarwoods",3,1.22599999999875,4,0.00326264274062323,"second_half",NA,"role_play",906,"MARISHA"
"907",26,8452.756,8454.835,"LAURA","yeah, they can see through illusions pretty darn well.",1,0,0,0,"Briarwoods",3,2.07899999999972,10,0.00481000481000545,"second_half",NA,"role_play",907,"LAURA"
"908",26,8454.835,8457.356,"SAM","listen, percy's here. he can defend for us.",1,0,0,0,"Briarwoods",3,2.52100000000064,10,0.00396667988893196,"second_half",NA,"role_play",908,"SAM"
"909",26,8457.356,8459.265,"ORION","no, you need a warding spell.",1,0,0,0,"Briarwoods",3,1.90899999999965,7,0.00366684127815677,"second_half",NA,"role_play",909,"ORION"
"910",26,8459.265,8462.869,"SAM","why don't we just leave someone behind?",1,0,0,0,"Briarwoods",3,3.60400000000118,9,0.00249722530521561,"second_half",NA,"role_play",910,"SAM"
"911",26,8462.869,8465.392,"MARISHA","percy's behind.",1,0,0,0,"Briarwoods",3,2.52299999999923,4,0.00158541418945748,"second_half",NA,"role_play",911,"MARISHA"
"912",26,8465.392,8471.065,"TRAVIS","percy's here and so are five? six? how many employees do we have?",1,0,0,0,"Briarwoods",3,5.67300000000068,15,0.00264410364886272,"second_half",NA,"role_play",912,"TRAVIS"
"913",26,8471.065,8473.329,"LAURA","our very capable guards.",1,0,0,0,"Briarwoods",3,2.26399999999921,5,0.00220848056537179,"second_half",NA,"role_play",913,"LAURA"
"914",26,8473.329,8477.8,"TRAVIS","why don't you make some extra bears that don't hate us?",1,0,0,0,"Briarwoods",3,4.47099999999955,14,0.00313129053902962,"second_half",NA,"role_play",914,"TRAVIS"
"915",26,8477.8,8479.325,"MARISHA","huh?",1,0,0,0,"Briarwoods",3,1.52500000000146,2,0.00131147540983481,"second_half",NA,"role_play",915,"MARISHA"
"916",26,8479.325,8481.768,"TRAVIS","why don't you make some extra bears that don't hate us?",1,0,0,0,"Briarwoods",3,2.4429999999993,14,0.0057306590257896,"second_half",NA,"role_play",916,"TRAVIS"
"917",26,8481.768,8483.518,"MARISHA","all right, i'll make some extra bears.",1,0,0,0,"Briarwoods",3,1.75,9,0.00514285714285714,"second_half",NA,"role_play",917,"MARISHA"
"918",26,8483.518,8485.971,"ORION","put some little hats on them and make them cute.",1,0,0,0,"Briarwoods",3,2.45299999999952,11,0.0044843049327363,"second_half",NA,"role_play",918,"ORION"
"919",26,8485.971,8490.065,"LIAM","do you think you could fix him? because he's a lot of firepower if we're going to go",1,0,0,0,"Briarwoods",3,4.09400000000096,20,0.0048851978505118,"second_half",NA,"role_play",919,"LIAM"
"920",26,8490.065,8494.715,"MARISHA","what gets rid of drunkenness?",1,0,0,0,"Briarwoods",3,4.64999999999964,6,0.00129032258064526,"second_half",NA,"role_play",920,"MARISHA"
"921",26,8494.715,8496.056,"LAURA","maybe restoration?",1,0,0,0,"Briarwoods",3,1.34100000000035,3,0.0022371364653238,"second_half",NA,"role_play",921,"LAURA"
"922",26,8496.056,8497.634,"MATT","restoration would probably take care of it.",0,0,0,1,"Briarwoods",3,1.57799999999952,8,0.00506970849176327,"second_half",NA,"role_play",922,"MATT"
"923",26,8497.634,8500.423,"MARISHA","i don't want to burn a restoration spell on your drunkenness.",1,0,0,0,"Briarwoods",3,2.78900000000067,13,0.00466116887773284,"second_half",NA,"role_play",923,"MARISHA"
"924",26,8500.423,8502.835,"LAURA","can you cast little restoration?",1,0,0,0,"Briarwoods",3,2.41199999999844,6,0.00248756218905633,"second_half",NA,"role_play",924,"LAURA"
"925",26,8502.835,8506.723,"MATT","you could also just give it a couple of hours. drink a lot of water.",0,0,0,1,"Briarwoods",3,3.88800000000083,16,0.00411522633744768,"second_half",NA,"role_play",925,"MATT"
"926",26,8506.723,8508.718,"TRAVIS","what time is it?",1,0,0,0,"Briarwoods",3,1.9950000000008,5,0.0025062656641594,"second_half",NA,"role_play",926,"TRAVIS"
"927",26,8508.718,8514.346,"MATT","at this point, it's probably close to 3:00 in the afternoon.",0,0,0,1,"Briarwoods",3,5.62799999999879,14,0.00248756218905526,"second_half",NA,"role_play",927,"MATT"
"928",26,8514.346,8521.504,"TRAVIS","so it's 3:00 in the afternoon. the bird doesn't even come until night. we could let him wear it off.",1,0,0,0,"Briarwoods",3,7.15800000000127,24,0.00335289186923662,"second_half",NA,"role_play",928,"TRAVIS"
"929",26,8523.706,8525.408,"MARISHA","what time is it?",1,0,0,0,"Briarwoods",3,1.70199999999932,5,0.00293772032902586,"second_half",NA,"role_play",929,"MARISHA"
"930",26,8525.408,8528.069,"SAM","3:00. we just established this. we're going to wait until night and go.",1,0,0,0,"Briarwoods",3,2.66100000000006,16,0.00601277715144669,"second_half",NA,"role_play",930,"SAM"
"931",26,8528.069,8531.746,"LAURA","she said she hated you. how did that feel?",1,0,0,0,"Briarwoods",3,3.67699999999968,10,0.00271960837639404,"second_half",NA,"role_play",931,"LAURA"
"932",26,8531.746,8538.183,"LIAM","fine. that was fine. that was the heat of the moment. she was angry. we're a team.",1,0,0,0,"Briarwoods",3,6.43700000000172,19,0.0029516855678103,"second_half",NA,"role_play",932,"LIAM"
"933",26,8538.183,8541.566,"MATT","all right. what's the plan, guys?",0,0,0,1,"Briarwoods",3,3.38299999999981,8,0.00236476500147811,"second_half",NA,"role_play",933,"MATT"
"934",26,8541.566,8545.469,"SAM","the plan is we're going to let him sober up. we're going to give him some coffee. and then we're going to set off for the north farmlands at dusk.",1,0,0,0,"Briarwoods",3,3.90299999999843,34,0.00871124775813828,"second_half",NA,"role_play",934,"SAM"
"935",26,8549.745,8555.371,"ORION","oh, we should get some corn and other harvestments at the farms.",1,0,0,0,"Briarwoods",3,5.62599999999838,13,0.00231070031994378,"second_half",NA,"role_play",935,"ORION"
"936",26,8555.371,8558.625,"MARISHA","i make an army of bears.",1,0,0,0,"Briarwoods",3,3.25400000000081,7,0.0021511985248919,"second_half",NA,"role_play",936,"MARISHA"
"937",26,8558.625,8560.683,"MATT","okay. this concentration will last an hour.",0,0,0,1,"Briarwoods",3,2.0580000000009,8,0.00388726919338994,"second_half",NA,"role_play",937,"MATT"
"938",26,8560.683,8562.091,"LAURA","oh! that's it.",1,0,0,0,"Briarwoods",3,1.40799999999945,5,0.00355113636363776,"second_half",NA,"role_play",938,"LAURA"
