"","arc","arc_no","episode","turn_number","segment","actor","text","start_turn","end_turn","time_in_sec","word_count","words_per_ms","encounter_count","rp_combat","actor_guest","vox_machina","guest","staff","matt"
"606","Attack_Conclave",4,39,606,"combat","LAURA","that is what i'm thinking, we could get them to fight.",3523.85,3525.501,1.65100000000029,13,0.00787401574803009,1,"combat","LAURA",1,0,0,0
"607","Attack_Conclave",4,39,607,"combat","MATT","36 points of cold damage to you. 36 points to the purple worm.",3525.501,3530.577,5.07600000000002,14,0.00275807722616232,1,"combat","MATT",0,0,0,1
"608","Attack_Conclave",4,39,608,"combat","SAM","that halved?",3530.577,3532.044,1.46699999999964,3,0.00204498977505162,1,"combat","SAM",1,0,0,0
"609","Attack_Conclave",4,39,609,"combat","MATT","no, it is magical damage, not blunt damage, so you just take it. especially as mist, cold is bad as mist. all right, so with that, the purple",3532.044,3539.608,7.56400000000031,28,0.0037017451084081,1,"combat","MATT",0,0,0,1
"610","Attack_Conclave",4,39,610,"combat","SAM","wait. doesn't my worm take it too?",3539.608,3541.543,1.93499999999995,9,0.00465116279069781,1,"combat","SAM",1,0,0,0
"611","Attack_Conclave",4,39,611,"combat","MATT","he did. both of them are still there.",3541.543,3543.544,2.00099999999975,9,0.00449775112443835,1,"combat","MATT",0,0,0,1
"612","Attack_Conclave",4,39,612,"combat","SAM","still alive?",3543.544,3544.795,1.2510000000002,3,0.00239808153477179,1,"combat","SAM",1,0,0,0
"613","Attack_Conclave",4,39,613,"combat","MATT","yeah. looking a little rough, but it's still alive. all right, that ends its turn. now it's keyleth's turn.",3544.795,3552.096,7.30099999999993,23,0.00315025338994661,1,"combat","MATT",0,0,0,1
"614","Attack_Conclave",4,39,614,"combat","MARISHA","okay, here's my question.",3552.096,3558.654,6.55799999999999,6,0.000914913083257092,1,"combat","MARISHA",1,0,0,0
"615","Attack_Conclave",4,39,615,"combat","MATT","yep?",3558.654,3559.901,1.24699999999984,2,0.00160384923817181,1,"combat","MATT",0,0,0,1
"616","Attack_Conclave",4,39,616,"combat","TRAVIS","probably no.",3559.901,3561.667,1.76600000000008,3,0.00169875424688554,1,"combat","TRAVIS",1,0,0,0
"617","Attack_Conclave",4,39,617,"combat","MARISHA","i know.",3561.667,3566.152,4.48500000000013,3,0.000668896321070215,1,"combat","MARISHA",1,0,0,0
"618","Attack_Conclave",4,39,618,"combat","SAM","can i juggle while i'm a mist?",3566.152,3568.097,1.94500000000016,9,0.00462724935732609,1,"combat","SAM",1,0,0,0
"619","Attack_Conclave",4,39,619,"combat","MATT","if you wanted to, because it is your spell that you cast, even though it's technically not concentration",3568.097,3575.096,6.9989999999998,19,0.00271467352478933,1,"combat","MATT",0,0,0,1
"620","Attack_Conclave",4,39,620,"combat","MARISHA","i will say, we all failed in reading it, also",3575.096,3577.916,2.82000000000016,10,0.00354609929077994,1,"combat","MARISHA",1,0,0,0
"621","Attack_Conclave",4,39,621,"combat","SAM","don't do this, don't do this!",3577.916,3579.643,1.72699999999986,9,0.00521134916039416,1,"combat","SAM",1,0,0,0
"622","Attack_Conclave",4,39,622,"combat","TALIESIN","can't win.",3579.643,3583.331,3.6880000000001,4,0.00108459869848153,1,"combat","TALIESIN",1,0,0,0
"623","Attack_Conclave",4,39,623,"combat","LAURA","it's also what? what does it say?",3583.331,3585.398,2.06700000000001,9,0.00435413642960811,1,"combat","LAURA",1,0,0,0
"624","Attack_Conclave",4,39,624,"combat","MARISHA","nothing.",3585.398,3586.504,1.10599999999977,2,0.00180831826401485,1,"combat","MARISHA",1,0,0,0
"625","Attack_Conclave",4,39,625,"combat","TALIESIN","i'll say it if it makes you feel better?",3586.504,3588.243,1.73900000000003,11,0.00632547441058067,1,"combat","TALIESIN",1,0,0,0
"626","Attack_Conclave",4,39,626,"combat","LIAM","why don't we let him say what he was going to say?",3588.243,3590.316,2.07299999999987,14,0.00675349734684077,1,"combat","LIAM",1,0,0,0
"627","Attack_Conclave",4,39,627,"combat","MATT","what were you going to say?",3590.316,3591.619,1.30300000000034,7,0.00537221795855578,1,"combat","MATT",0,0,0,1
"628","Attack_Conclave",4,39,628,"combat","MARISHA","nothing.",3591.619,3592.587,0.967999999999847,2,0.00206611570247967,1,"combat","MARISHA",1,0,0,0
"629","Attack_Conclave",4,39,629,"combat","MATT","no, what's up?",3592.587,3593.728,1.14100000000008,5,0.00438212094653783,1,"combat","MATT",0,0,0,1
"630","Attack_Conclave",4,39,630,"combat","MARISHA","i'm afraid now.",3593.728,3595.308,1.57999999999993,5,0.00316455696202546,1,"combat","MARISHA",1,0,0,0
"631","Attack_Conclave",4,39,631,"combat","TALIESIN","as you should be. you're defying god.",3595.308,3597.414,2.10600000000022,9,0.00427350427350382,1,"combat","TALIESIN",1,0,0,0
"632","Attack_Conclave",4,39,632,"combat","SAM","what were you going to say, matt?",3597.414,3599.533,2.11899999999969,8,0.00377536573855648,1,"combat","SAM",1,0,0,0
"633","Attack_Conclave",4,39,633,"combat","MARISHA","yeah, what were you going to say? i like that question.",3599.533,3602.967,3.4340000000002,12,0.003494467093768,1,"combat","MARISHA",1,0,0,0
"634","Attack_Conclave",4,39,634,"combat","LAURA","yeah, right? since you cast it, you could break your concentration?",3602.967,3607.762,4.79500000000007,12,0.00250260688216889,1,"combat","LAURA",1,0,0,0
"635","Attack_Conclave",4,39,635,"combat","MATT","i'm saying, because you cast a spell that wasn't a concentration spell, if it was a positive effect, which it technically is, and you did not want it, you could cancel the spell. i'd let you do that. if you wanted to. what did i not read?",3607.762,3618.807,11.0449999999996,51,0.00461747397012239,1,"combat","MATT",0,0,0,1
"636","Attack_Conclave",4,39,636,"combat","MARISHA","we all failed in reading it.",3618.807,3622.154,3.34700000000021,7,0.00209142515685676,1,"combat","MARISHA",1,0,0,0
"637","Attack_Conclave",4,39,637,"combat","TALIESIN","casting time.",3622.154,3624.212,2.05799999999999,3,0.00145772594752187,1,"combat","TALIESIN",1,0,0,0
"638","Attack_Conclave",4,39,638,"combat","MATT","one action.",3624.212,3625.483,1.27100000000019,3,0.00236034618410666,1,"combat","MATT",0,0,0,1
"639","Attack_Conclave",4,39,639,"combat","TALIESIN","no.",3625.483,3626.627,1.14399999999978,2,0.00174825174825209,1,"combat","TALIESIN",1,0,0,0
"640","Attack_Conclave",4,39,640,"combat","MARISHA AND TALIESIN","one minute.",3626.627,3628.47,1.84299999999985,3,0.00162778079218679,1,"combat","MARISHA AND TALIESIN",1,0,0,0
"641","Attack_Conclave",4,39,641,"combat","MATT","it says one action on my thing.",3628.47,3629.862,1.39200000000028,8,0.00574712643678045,1,"combat","MATT",0,0,0,1
"642","Attack_Conclave",4,39,642,"combat","MARISHA","it says one action on yours? it says one minute on mine.",3629.862,3632.075,2.21299999999974,13,0.00587437867148737,1,"combat","MARISHA",1,0,0,0
"643","Attack_Conclave",4,39,643,"combat","MATT","does it?",3632.075,3633.213,1.13800000000037,3,0.00263620386643147,1,"combat","MATT",0,0,0,1
"644","Attack_Conclave",4,39,644,"combat","MARISHA","yes, it does.",3633.213,3634.639,1.42599999999993,4,0.00280504908835918,1,"combat","MARISHA",1,0,0,0
"645","Attack_Conclave",4,39,645,"combat","MATT","thank you, fight club five.",3634.639,3636.734,2.0949999999998,6,0.00286396181384276,1,"combat","MATT",0,0,0,1
"646","Attack_Conclave",4,39,646,"combat","MARISHA","no, it's different. it says casting time one minute.",3636.734,3640.095,3.36099999999988,11,0.00327283546563535,1,"combat","MARISHA",1,0,0,0
"647","Attack_Conclave",4,39,647,"combat","MATT","let's see what the player's handbook says.",3640.095,3642.254,2.15900000000011,10,0.00463177396943007,1,"combat","MATT",0,0,0,1
"648","Attack_Conclave",4,39,648,"combat","TALIESIN","consult the book.",3642.254,3644.852,2.59799999999996,4,0.00153964588144729,1,"combat","TALIESIN",1,0,0,0
"649","Attack_Conclave",4,39,649,"combat","LAURA","it doesn't matter, it already happened.",3644.852,3649,4.14800000000014,8,0.00192864030858239,1,"combat","LAURA",1,0,0,0
"650","Attack_Conclave",4,39,650,"combat","MARISHA","it already happened, so it doesn't matter.",3649,3651.299,2.29899999999998,9,0.00391474554153984,1,"combat","MARISHA",1,0,0,0
"651","Attack_Conclave",4,39,651,"combat","TRAVIS","shouldn't there be an ad for gilmore's glorious goods right about now?",3651.299,3653.544,2.24499999999989,15,0.00668151447661502,1,"combat","TRAVIS",1,0,0,0
"652","Attack_Conclave",4,39,652,"combat","MARISHA","yeah, it's already happened, we're already committed.",3653.544,3657.44,3.89600000000019,10,0.00256673511293622,1,"combat","MARISHA",1,0,0,0
"653","Attack_Conclave",4,39,653,"combat","MATT","in the player's handbook, wind walk is one minute, you're right.",3657.44,3663.292,5.85199999999986,14,0.00239234449760771,1,"combat","MATT",0,0,0,1
"654","Attack_Conclave",4,39,654,"combat","MARISHA","one minute. so fight club failed.",3663.292,3665.288,1.99600000000009,7,0.00350701402805595,1,"combat","MARISHA",1,0,0,0
"655","Attack_Conclave",4,39,655,"combat","MATT","fight club five failed.",3665.288,3666.805,1.51699999999983,5,0.00329597890573538,1,"combat","MATT",0,0,0,1
"656","Attack_Conclave",4,39,656,"combat","SAM","this is a reverse ad for fight club five.",3666.805,3670.564,3.75900000000001,10,0.00266028198989092,1,"combat","SAM",1,0,0,0
"657","Attack_Conclave",4,39,657,"combat","MATT","or i have to update it. either way. no, it might have been fixed since, i've just got to update it. all right. well, anyway. in a bit of druidic inspiration, you manage to, very quickly, for the first time",3670.564,3687.399,16.835,41,0.00243540243540243,1,"combat","MATT",0,0,0,1
"658","Attack_Conclave",4,39,658,"combat","MARISHA","i mean, i'm still willing to commit to it. it's fine.",3687.399,3689.621,2.22200000000021,14,0.00630063006300571,1,"combat","MARISHA",1,0,0,0
"659","Attack_Conclave",4,39,659,"combat","MATT","being as an air ashari, this is your realm of expertise, and your first time using it, you were so excited that you managed to accelerate the casting of the spell, regardless of the situation it may have created, so, what do you want to do?",3689.621,3699.94,10.319,47,0.00455470491326681,1,"combat","MATT",0,0,0,1
"660","Attack_Conclave",4,39,660,"combat","MARISHA","so i accelerated the casting of the spell.",3699.94,3702.157,2.2170000000001,9,0.00405953991880902,1,"combat","MARISHA",1,0,0,0
"661","Attack_Conclave",4,39,661,"combat","LAURA","so you can cancel it if you feel like canceling it.",3702.157,3705.413,3.25599999999986,12,0.00368550368550385,1,"combat","LAURA",1,0,0,0
"662","Attack_Conclave",4,39,662,"combat","SAM","if you want to.",3705.413,3707.193,1.7800000000002,5,0.00280898876404463,1,"combat","SAM",1,0,0,0
"663","Attack_Conclave",4,39,663,"combat","LAURA","some people's brothers in the room are at a really low health level right now. i don't know who we're talking about, but some people's brothers",3707.193,3714.247,7.05399999999963,30,0.00425290615253779,1,"combat","LAURA",1,0,0,0
"664","Attack_Conclave",4,39,664,"combat","MARISHA","are you giving me an out because you feel bad? because if you're giving me an out",3714.247,3717.528,3.28099999999995,18,0.00548613227674498,1,"combat","MARISHA",1,0,0,0
"665","Attack_Conclave",4,39,665,"combat","MATT","no, because technically it shouldn't have happened, because it was a one-minute casting time. there are many things in that spell that were not read, by the caster, so i'm giving you the opportunity to correct the mistake, if you wish not to take it, you can.",3717.528,3731.445,13.9170000000004,51,0.0036645828842422,1,"combat","MATT",0,0,0,1
"666","Attack_Conclave",4,39,666,"combat","TALIESIN","i read the card too, i didn't see it.",3731.445,3733.213,1.76800000000003,11,0.00622171945701347,1,"combat","TALIESIN",1,0,0,0
"667","Attack_Conclave",4,39,667,"combat","MARISHA","he did read the card too, and we all thought it was a good idea.",3733.213,3735.379,2.16599999999971,16,0.00738688827331585,1,"combat","MARISHA",1,0,0,0
"668","Attack_Conclave",4,39,668,"combat","MATT","this was a very hard and valuable lesson for casters.",3735.379,3738.149,2.76999999999998,11,0.00397111913357403,1,"combat","MATT",0,0,0,1
"669","Attack_Conclave",4,39,669,"combat","LAURA","we're in the middle of a battle.",3738.149,3740.299,2.15000000000009,9,0.00418604651162773,1,"combat","LAURA",1,0,0,0
"670","Attack_Conclave",4,39,670,"combat","MARISHA","for my own shame. all right fine, i'll drop the spell 'cause i feel really bad about it. but on my way down, okay, here's my question, because i want to make these fuckers fight each other. so, is there loose rock along the edge of the wall?",3740.299,3758.148,17.8490000000002,51,0.00285730293013612,1,"combat","MARISHA",1,0,0,0
"671","Attack_Conclave",4,39,671,"combat","LAURA","i dropped stalactites on them. so yeah, there's lots of loose rock.",3758.148,3762.489,4.34099999999989,14,0.00322506334945873,1,"combat","LAURA",1,0,0,0
"672","Attack_Conclave",4,39,672,"combat","MATT","yeah. and there's rubble on the ground next to it from where the original cave-in happened",3762.489,3765.146,2.65700000000015,18,0.00677455777192283,1,"combat","MATT",0,0,0,1
"673","Attack_Conclave",4,39,673,"combat","MARISHA","okay, so as i'm dropping the spell",3765.146,3767.323,2.17699999999968,8,0.00367478180983058,1,"combat","MARISHA",1,0,0,0
"674","Attack_Conclave",4,39,674,"combat","MATT","all of you who are mist form now revert, and you fall about five to ten feet and catch yourself on the ground, no harm no foul.",3767.323,3774.782,7.45900000000029,28,0.00375385440407547,1,"combat","MATT",0,0,0,1
"675","Attack_Conclave",4,39,675,"combat","MARISHA","as i revert back can i slide down that wall to create some",3774.782,3780.86,6.07799999999997,13,0.00213886146758803,1,"combat","MARISHA",1,0,0,0
"676","Attack_Conclave",4,39,676,"combat","MATT","did you want to move first over here to do it?",3780.86,3782.492,1.63200000000006,12,0.00735294117647031,1,"combat","MATT",0,0,0,1
"677","Attack_Conclave",4,39,677,"combat","MARISHA","yeah.",3782.492,3783.452,0.960000000000036,2,0.00208333333333325,1,"combat","MARISHA",1,0,0,0
"678","Attack_Conclave",4,39,678,"combat","MATT","so you shift over, you drop the spell.",3783.452,3784.771,1.31899999999996,9,0.00682335102350286,1,"combat","MATT",0,0,0,1
"679","Attack_Conclave",4,39,679,"combat","MARISHA","uh-huh, i drop the spell, and as i drop the spell i want to grab some wall and bring it down to make a big vibration, right in between these two motherfuckers.",3784.771,3792.161,7.38999999999987,34,0.00460081190798384,1,"combat","MARISHA",1,0,0,0
"680","Attack_Conclave",4,39,680,"combat","MATT","okay. make a strength check.",3792.161,3793.756,1.5949999999998,6,0.00376175548589389,1,"combat","MATT",0,0,0,1
"681","Attack_Conclave",4,39,681,"combat","MARISHA","oh, jeez louise. oh, that's not too bad. it's not a saving throw.",3793.756,3801.623,7.86700000000019,16,0.00203381212660476,1,"combat","MARISHA",1,0,0,0
"682","Attack_Conclave",4,39,682,"combat","MATT","correct. just a strength check; add your strength modifier.",3801.623,3803.988,2.36499999999978,10,0.00422832980972555,1,"combat","MATT",0,0,0,1
"683","Attack_Conclave",4,39,683,"combat","MARISHA","18?",3803.988,3804.849,0.861000000000331,2,0.00232288037165997,1,"combat","MARISHA",1,0,0,0
"684","Attack_Conclave",4,39,684,"combat","MATT","18. all right. so, as you slide down, you grab onto some of the loose rock and they come tumbling down as you slide down. so you land here, at the base of the two worms, and rocks tumble around you at the base of the cave-in. and you get the sensation that you may have made a decent bit of racket right around your feet.",3804.849,3821.173,16.3239999999996,68,0.00416564567507974,1,"combat","MATT",0,0,0,1
"685","Attack_Conclave",4,39,685,"combat","MARISHA","uh-huh. do i have any movement?",3821.173,3823.095,1.92200000000003,8,0.00416233090530692,1,"combat","MARISHA",1,0,0,0
"686","Attack_Conclave",4,39,686,"combat","MATT","i'd say you have half your movement.",3823.095,3828.597,5.50200000000041,9,0.00163576881134121,1,"combat","MATT",0,0,0,1
"687","Attack_Conclave",4,39,687,"combat","MARISHA","oh, jesus christ. can i just tiptoe backwards towards percy? or should i you know what? i'm going to stay. i'm just going to stay right there. is that even worse of a decision?",3828.597,3844.86,16.2629999999999,37,0.00227510299452747,1,"combat","MARISHA",1,0,0,0
"688","Attack_Conclave",4,39,688,"combat","MATT","i don't know. what do you want to do?",3844.86,3846.427,1.56700000000001,11,0.00701978302488829,1,"combat","MATT",0,0,0,1
"689","Attack_Conclave",4,39,689,"combat","MARISHA","i'm just going to up against the wall. and not move.",3846.427,3849.854,3.42699999999968,13,0.00379340531076779,1,"combat","MARISHA",1,0,0,0
"690","Attack_Conclave",4,39,690,"combat","MATT","okay. you're going to doctor grant this.",3849.854,3851.479,1.625,9,0.00553846153846154,1,"combat","MATT",0,0,0,1
"691","Attack_Conclave",4,39,691,"combat","MARISHA","i'm going to doctor grant it.",3851.479,3852.718,1.23900000000003,8,0.00645682001614188,1,"combat","MARISHA",1,0,0,0
"692","Attack_Conclave",4,39,692,"combat","MATT","got it. okay. keyleth, that ends your turn, vax, you're up. you now have your physical form again.",3852.718,3857.743,5.02500000000009,20,0.00398009950248749,1,"combat","MATT",0,0,0,1
"693","Attack_Conclave",4,39,693,"combat","LIAM","okay. i look around really fast, run up to my sister, give her a giant hug, and dimension door over to where grog is.",3857.743,3870.204,12.4610000000002,25,0.00200625952973273,1,"combat","LIAM",1,0,0,0
"694","Attack_Conclave",4,39,694,"combat","SAM","you can dimension door; i keep forgetting that!",3870.204,3873.393,3.18899999999985,9,0.00282220131702741,1,"combat","SAM",1,0,0,0
"695","Attack_Conclave",4,39,695,"combat","MATT","so as you rush over and grab onto her, you both in a nightcrawler-esque poof of smoke, as it settles, you are both no longer there, as what's the range on the dimension door?",3873.393,3884.352,10.9589999999998,37,0.00337622045807104,1,"combat","MATT",0,0,0,1
"696","Attack_Conclave",4,39,696,"combat","LIAM","oh, it's so far, it's like 500 feet i believe. i'll find it.",3884.352,3887.762,3.41000000000031,17,0.00498533724340131,1,"combat","LIAM",1,0,0,0
"697","Attack_Conclave",4,39,697,"combat","MATT","i believe it is. dimension door, yeah, it's fine. 300 feet, you're fine. you guys appear over by grog now.",3887.762,3898.982,11.2199999999998,23,0.00204991087344032,1,"combat","MATT",0,0,0,1
"698","Attack_Conclave",4,39,698,"combat","LAURA","is that the edge of a cliff over on that side?",3898.982,3901.508,2.52599999999984,12,0.00475059382422833,1,"combat","LAURA",1,0,0,0
"699","Attack_Conclave",4,39,699,"combat","MATT","it goes right to the edge, right there, and this is where it would go down the side of a giant, icy mountain. you guys are at the very, very top of a very cold, cragulous part of the cliffkeep mountains.",3901.508,3913.082,11.5740000000001,42,0.00362882322446861,1,"combat","MATT",0,0,0,1
"700","Attack_Conclave",4,39,700,"combat","LAURA","got it.",3913.082,3914.19,1.10800000000017,3,0.0027075812274364,1,"combat","LAURA",1,0,0,0
"701","Attack_Conclave",4,39,701,"combat","LIAM","i'm hasted; do i have one or two attacks at this point?",3914.19,3919.038,4.84799999999996,14,0.00288778877887791,1,"combat","LIAM",1,0,0,0
"702","Attack_Conclave",4,39,702,"combat","MATT","you have one attack right now.",3919.038,3920.394,1.35599999999977,7,0.00516224188790649,1,"combat","MATT",0,0,0,1
"703","Attack_Conclave",4,39,703,"combat","LIAM","one attack? okay.",3920.394,3921.48,1.08600000000024,4,0.00368324125230121,1,"combat","LIAM",1,0,0,0
"704","Attack_Conclave",4,39,704,"combat","MATT","you went up and did your action already.",3921.48,3922.871,1.39100000000008,9,0.00647016534866967,1,"combat","MATT",0,0,0,1
"705","Attack_Conclave",4,39,705,"combat","LIAM","action. okay. well then, i'm going to throw a dagger at the back of the frost one.",3922.871,3926.655,3.78400000000011,19,0.00502114164904849,1,"combat","LIAM",1,0,0,0
"706","Attack_Conclave",4,39,706,"combat","MATT","okay. what's the range on your dagger?",3926.655,3928.405,1.75,9,0.00514285714285714,1,"combat","MATT",0,0,0,1
"707","Attack_Conclave",4,39,707,"combat","LIAM","it's 60 feet, sharpshooter, no disadvantage.",3928.405,3933.659,5.25399999999991,8,0.00152264940997338,1,"combat","LIAM",1,0,0,0
"708","Attack_Conclave",4,39,708,"combat","MATT","60 feet. just misses. you go and it just tumbles, scrapes across the ground, stops at the base of the worm, and then vanishes. all right, that ends your turn. now it is this guy's turn. at the top of his turn, scanlan, you all right.",3933.659,3954.547,20.8879999999999,48,0.00229797012638837,1,"combat","MATT",0,0,0,1
"709","Attack_Conclave",4,39,709,"combat","SAM","i'm in a nice womb.",3954.547,3956.47,1.92299999999977,7,0.00364014560582466,1,"combat","SAM",1,0,0,0
"710","Attack_Conclave",4,39,710,"combat","MATT","you take...",3956.47,3961.931,5.46100000000024,3,0.00054934993590915,1,"combat","MATT",0,0,0,1
"711","Attack_Conclave",4,39,711,"combat","TRAVIS","uh-oh.",3961.931,3965.576,3.64499999999998,3,0.000823045267489716,1,"combat","TRAVIS",1,0,0,0
"712","Attack_Conclave",4,39,712,"combat","TALIESIN","all the damage.",3965.576,3967.801,2.22499999999991,4,0.00179775280898884,1,"combat","TALIESIN",1,0,0,0
"713","Attack_Conclave",4,39,713,"combat","TRAVIS","he grimaced. still rolling.",3967.801,3970.354,2.55299999999988,5,0.00195848021934987,1,"combat","TRAVIS",1,0,0,0
"714","Attack_Conclave",4,39,714,"combat","MATT","23 points of acid damage as it begins to digest you from the inside.",3970.354,3976.242,5.88800000000037,15,0.00254755434782592,1,"combat","MATT",0,0,0,1
"715","Attack_Conclave",4,39,715,"combat","SAM","aren't i immune to acid damage?",3976.242,3978.538,2.29599999999982,8,0.00348432055749156,1,"combat","SAM",1,0,0,0
"716","Attack_Conclave",4,39,716,"combat","MATT","are you?",3978.538,3979.712,1.17399999999998,3,0.00255536626916529,1,"combat","MATT",0,0,0,1
"717","Attack_Conclave",4,39,717,"combat","SAM","because of the feast?",3979.712,3981.196,1.48399999999992,5,0.00336927223719694,1,"combat","SAM",1,0,0,0
"718","Attack_Conclave",4,39,718,"combat","MATT","no, poison.",3981.196,3982.495,1.29899999999998,3,0.00230946882217094,1,"combat","MATT",0,0,0,1
"719","Attack_Conclave",4,39,719,"combat","SAM","isn't that the same thing?",3982.495,3984.388,1.89300000000003,7,0.0036978341257263,1,"combat","SAM",1,0,0,0
"720","Attack_Conclave",4,39,720,"combat","MATT","no.",3984.388,3988.855,4.4670000000001,2,0.000447727781508833,1,"combat","MATT",0,0,0,1
"721","Attack_Conclave",4,39,721,"combat","MATT","all right. so. the",3988.855,3991.192,2.33699999999999,4,0.00171159606332906,1,"combat","MATT",0,0,0,1
"722","Attack_Conclave",4,39,722,"combat","LAURA","somebody's got something of acid resistance, though. somebody has an item.",3991.192,3995.039,3.84700000000021,13,0.00337925656355584,1,"combat","LAURA",1,0,0,0
"723","Attack_Conclave",4,39,723,"combat","LIAM","i had armor and i gave it to someone, i don't have it anymore.",3995.039,3998.453,3.41399999999976,16,0.0046865846514356,1,"combat","LIAM",1,0,0,0
"724","Attack_Conclave",4,39,724,"combat","MATT","as the frost worm and the purple worm are now clashing in this space, they both turn, hearing the sound. now, the frost damage that had impacted the purple worm last turn, let's see if it nope! it's going to retaliate for that, it's going to attempt to make a bite attack against the frost worm. that is going to be a 12, that is going to miss. however, hearing the noise, it's going to make a tail attack at the direction that keyleth is that's a natural one. as it arcs through, it right next to your head and then pulls out of the rubble. the rock to your left is now cracked and broken with a giant hole where the stinger had placed itself.",3998.453,4038.242,39.7890000000002,132,0.00331749981150567,1,"combat","MATT",0,0,0,1
"725","Attack_Conclave",4,39,725,"combat","MARISHA","i hold my breath.",4038.242,4039.903,1.6609999999996,5,0.00301023479831499,1,"combat","MARISHA",1,0,0,0
"726","Attack_Conclave",4,39,726,"combat","MATT","yeah. disadvantage on those attacks from that eyebite is really bad. so that's been very helpful from scanlan's point. by the way, scanlan, make another concentration check because of the",4039.903,4051.215,11.3120000000004,32,0.00282885431400274,1,"combat","MATT",0,0,0,1
"727","Attack_Conclave",4,39,727,"combat","SAM","concentration check. yeah. yeah, i'm okay. 18 and 19.",4051.215,4056.391,5.17599999999993,11,0.00212519319938179,1,"combat","SAM",1,0,0,0
"728","Attack_Conclave",4,39,728,"combat","MATT","yeah, you're fine. okay. that ends the purple worm's turn, it's going to stay right there. actually, no. it's going to burrow away, as currently it's made its attacks. it's going to burrow into the ground, and is currently not within anyone's visual range.",4056.391,4075.539,19.1480000000001,52,0.00271568832254019,1,"combat","MATT",0,0,0,1
"729","Attack_Conclave",4,39,729,"combat","LAURA","i have it hunter's marked, can i feel it?",4075.539,4079.04,3.50099999999975,11,0.00314195944016018,1,"combat","LAURA",1,0,0,0
"730","Attack_Conclave",4,39,730,"combat","MATT","you can sense that it's underneath the ground, somewhere in this cavern.",4079.04,4082.071,3.03099999999995,14,0.00461893764434188,1,"combat","MATT",0,0,0,1
"731","Attack_Conclave",4,39,731,"combat","LAURA","okay.",4082.071,4083.153,1.08199999999988,2,0.00184842883549004,1,"combat","LAURA",1,0,0,0
"732","Attack_Conclave",4,39,732,"combat","MATT","that brings us to scanlan.",4083.153,4086.945,3.79200000000037,6,0.0015822784810125,1,"combat","MATT",0,0,0,1
"733","Attack_Conclave",4,39,733,"combat","SAM","it's going down.",4086.945,4090.6,3.65499999999975,5,0.00136798905608765,1,"combat","SAM",1,0,0,0
