"","arc","arc_no","episode","turn_number","segment","actor","text","start_turn","end_turn","time_in_sec","word_count","words_per_ms","encounter_count","rp_combat","actor_guest","vox_machina","guest","staff","matt"
"1818","Attack_Conclave",4,39,1818,"second_half_rp","SAM","you should blame me for this. i'm sorry. i just had a really shitty day, all right? he doesn't deserve this. let him go. just take me.",10327.663,10334.96,7.29699999999866,30,0.00411127860764773,NA,"role_play","SAM",1,0,0,0
"1819","Attack_Conclave",4,39,1819,"second_half_rp","MATT","""very well. now."" and you feel the release as the manacles come away. you are escorted out of the room. you are put in shackles, brought, and thrown into the same jail cell as kaylie.",10334.96,10351.433,16.4730000000018,37,0.00224609967826116,NA,"role_play","MATT",0,0,0,1
"1820","Attack_Conclave",4,39,1820,"second_half_rp","TALIESIN","all right. how much to get both of them out?",10351.433,10355.361,3.92799999999988,11,0.00280040733197564,NA,"role_play","TALIESIN",1,0,0,0
"1821","Attack_Conclave",4,39,1821,"second_half_rp","MATT","as you're being pushed out?",10355.361,10357.306,1.94499999999971,7,0.00359897172236558,NA,"role_play","MATT",0,0,0,1
"1822","Attack_Conclave",4,39,1822,"second_half_rp","TALIESIN","yeah. i'll bring it.",10357.306,10359.217,1.91100000000006,6,0.00313971742543162,NA,"role_play","TALIESIN",1,0,0,0
"1823","Attack_Conclave",4,39,1823,"second_half_rp","MATT","there's no answer at the moment. the doors close behind you, and you're thrust off of four steps. make an acrobatics check.",10359.217,10365.797,6.57999999999993,25,0.00379939209726448,NA,"role_play","MATT",0,0,0,1
"1824","Attack_Conclave",4,39,1824,"second_half_rp","MARISHA","they were tossing your ass out.",10365.797,10369.017,3.21999999999935,7,0.0021739130434787,NA,"role_play","MARISHA",1,0,0,0
"1825","Attack_Conclave",4,39,1825,"second_half_rp","TALIESIN","23.",10369.017,10371.118,2.10100000000057,2,0.000951927653498077,NA,"role_play","TALIESIN",1,0,0,0
"1826","Attack_Conclave",4,39,1826,"second_half_rp","MATT","all right. you manage to catch yourself with a small tumble over the shoulder, land willy wonka-style, well stuck. as you're thrown, you hit the ground. you can see off in the corner of the cell, kaylie, arms crossed, sitting on the ground. she leans forward a little bit, and you can see the light hits the side of her face, and she has a bit of a welt there and a bit of a black eye, but she doesn't look too worse for wear.",10371.118,10395.163,24.0450000000001,89,0.00370139322104386,NA,"role_play","MATT",0,0,0,1
"1827","Attack_Conclave",4,39,1827,"second_half_rp","TALIESIN","now for the love of god, just wait until nightfall and dimension door out of there.",10395.163,10398.706,3.54299999999967,17,0.0047981936212254,NA,"role_play","TALIESIN",1,0,0,0
"1828","Attack_Conclave",4,39,1828,"second_half_rp","SAM","did i hear that?",10398.706,10400.622,1.91599999999926,5,0.00260960334029329,NA,"role_play","SAM",1,0,0,0
"1829","Attack_Conclave",4,39,1829,"second_half_rp","MATT","yeah, you'd hear that.",10400.622,10402.499,1.87700000000041,6,0.00319659030367538,NA,"role_play","MATT",0,0,0,1
"1830","Attack_Conclave",4,39,1830,"second_half_rp","SAM","good idea. thanks, percy, for your help.",10402.499,10405.882,3.38299999999981,8,0.00236476500147811,NA,"role_play","SAM",1,0,0,0
"1831","Attack_Conclave",4,39,1831,"second_half_rp","TALIESIN","you're welcome. wait until nightfall.",10405.882,10409.439,3.5570000000007,7,0.00196795052010082,NA,"role_play","TALIESIN",1,0,0,0
"1832","Attack_Conclave",4,39,1832,"second_half_rp","SAM","huh? oh. all right.",10409.439,10411.446,2.00699999999961,5,0.00249128051818684,NA,"role_play","SAM",1,0,0,0
"1833","Attack_Conclave",4,39,1833,"second_half_rp","MATT","as she leans forward, she goes, ""huh. like father, like daughter, aye?""",10411.446,10416.677,5.23099999999977,13,0.00248518447715553,NA,"role_play","MATT",0,0,0,1
"1834","Attack_Conclave",4,39,1834,"second_half_rp","SAM","you could say so. i heard you had quite a night last night at the bar.",10416.677,10421.529,4.85200000000077,17,0.00350370981038691,NA,"role_play","SAM",1,0,0,0
"1835","Attack_Conclave",4,39,1835,"second_half_rp","MATT","""hm. felt good. i like breaking faces.""",10421.529,10424.742,3.21299999999974,9,0.0028011204481795,NA,"role_play","MATT",0,0,0,1
"1836","Attack_Conclave",4,39,1836,"second_half_rp","SAM","apparently you're very good at it. i saw i got a glimpse of your victims over there.",10424.742,10429.563,4.82099999999991,19,0.00394109105994614,NA,"role_play","SAM",1,0,0,0
"1837","Attack_Conclave",4,39,1837,"second_half_rp","MATT","""they had it coming. don't know why, but i had a feeling somewhere in their life, ""they probably deserved it. most men do.""",10429.563,10437.301,7.73799999999937,26,0.0033600413543554,NA,"role_play","MATT",0,0,0,1
"1838","Attack_Conclave",4,39,1838,"second_half_rp","SAM","yep, you're right about that. stay away from all men. forever.",10437.301,10444.142,6.84100000000035,13,0.00190030697266472,NA,"role_play","SAM",1,0,0,0
"1839","Attack_Conclave",4,39,1839,"second_half_rp","MATT","""they were fuckwits. their faces were so punchable.""",10444.142,10448.587,4.44499999999971,10,0.002249718785152,NA,"role_play","MATT",0,0,0,1
"1840","Attack_Conclave",4,39,1840,"second_half_rp","SAM","i know that feeling. listen, i've come to get you out of here.",10448.587,10453.783,5.19599999999991,15,0.00288683602771367,NA,"role_play","SAM",1,0,0,0
"1841","Attack_Conclave",4,39,1841,"second_half_rp","MATT","""apparently you've not done that very well.""",10453.783,10456.998,3.21500000000015,10,0.00311041990668726,NA,"role_play","MATT",0,0,0,1
"1842","Attack_Conclave",4,39,1842,"second_half_rp","SAM","don't worry. i've still got some tricks up my sleeve. just wanted to make sure you're all right. did they hurt you in any way?",10456.998,10464.049,7.0510000000013,29,0.00411289178839805,NA,"role_play","SAM",1,0,0,0
"1843","Attack_Conclave",4,39,1843,"second_half_rp","MATT","""only one person's really hurt me recently.""",10464.049,10469.145,5.09599999999955,10,0.00196232339089499,NA,"role_play","MATT",0,0,0,1
"1844","Attack_Conclave",4,39,1844,"second_half_rp","LIAM","cold as ice.",10469.145,10471.756,2.61099999999897,4,0.00153198008425951,NA,"role_play","LIAM",1,0,0,0
"1845","Attack_Conclave",4,39,1845,"second_half_rp","MATT","""look, scanlan. father. i spent a lifetime hating you. i'd imagined the moment we would ""finally meet for so long, planned it out in my head, had it all worked out. my idea of you, what ""you'd be like, what you'd say, and you know what? up until last night, i was pretty spot-on. i don't ""know what i wanted. i have a lot to process, to think about. but i'd prefer not to do it in this ""dank cell, so if you have a way out, please, now's the time to do it.""",10471.756,10524.865,53.1090000000004,103,0.0019394076333578,NA,"role_play","MATT",0,0,0,1
"1846","Attack_Conclave",4,39,1846,"second_half_rp","SAM","you think now? all right, is anyone watching?",10524.865,10527.705,2.84000000000015,9,0.00316901408450688,NA,"role_play","SAM",1,0,0,0
"1847","Attack_Conclave",4,39,1847,"second_half_rp","MATT","there are two guards that are not watching directly, but they're muscled up against the bars and keeping an eye over the shoulder.",10527.705,10534.339,6.63400000000001,25,0.00376846548085619,NA,"role_play","MATT",0,0,0,1
"1848","Attack_Conclave",4,39,1848,"second_half_rp","SAM","i'll need a distraction. do you think you can come up with one?",10534.339,10539.426,5.08699999999953,15,0.00294869274621611,NA,"role_play","SAM",1,0,0,0
"1849","Attack_Conclave",4,39,1849,"second_half_rp","MATT","her eyes turn for a second and she goes, ""i think that can be done."" she leans up to the side of the bar and peeks her head out for a second. closes her mouth, cups it with her hand, and you start hearing from the opposite side of the room, through arcane ventriloquism, these three different male voices going, ""i'll fuck you up!"" you hear punches and you hear all of this screaming and chaos. at which point, the two guards look over. one of them gives the other a motion, and they both run off to see the other side of the room. she looks back at you.",10539.426,10577.558,38.1320000000014,112,0.00293716563516196,NA,"role_play","MATT",0,0,0,1
"1850","Attack_Conclave",4,39,1850,"second_half_rp","SAM","you'll have to teach me that trick. and then i dimension door us out onto the street.",10577.558,10583.615,6.05699999999888,19,0.00313686643552972,NA,"role_play","SAM",1,0,0,0
"1851","Attack_Conclave",4,39,1851,"second_half_rp","MATT","as you reach for her, she still pulls away a little bit, but you still grab hold and puff of smoke. you guys appear outside, landing a couple of feet above the ground and catch yourselves. you're off to the side of the stockade where it meets with one of the nearby walls. no one seems to immediately notice you, other than a couple of people that are walking down the street that see two individuals appear out of the ether and land onto the ground.",10583.615,10607.862,24.2469999999994,88,0.00362931496680011,NA,"role_play","MATT",0,0,0,1
"1852","Attack_Conclave",4,39,1852,"second_half_rp","SAM","all right. let's get out of here. percy, i didn't wait quite until nightfall.",10607.862,10618.174,10.3120000000017,17,0.0016485647788981,NA,"role_play","SAM",1,0,0,0
"1853","Attack_Conclave",4,39,1853,"second_half_rp","TALIESIN","i assumed you wouldn't. we're already walking back.",10618.174,10620.668,2.49399999999878,11,0.00441058540497409,NA,"role_play","TALIESIN",1,0,0,0
"1854","Attack_Conclave",4,39,1854,"second_half_rp","SAM","all right, we'll catch up.",10620.668,10622.59,1.92200000000048,7,0.00364203954214269,NA,"role_play","SAM",1,0,0,0
"1855","Attack_Conclave",4,39,1855,"second_half_rp","MATT","you guys head back towards greyskull? all right.",10622.59,10625.574,2.98400000000038,9,0.00301608579088434,NA,"role_play","MATT",0,0,0,1
"1856","Attack_Conclave",4,39,1856,"second_half_rp","MARISHA","i'm glad i came in handy for that field trip.",10625.574,10628.363,2.78899999999885,12,0.00430261742560235,NA,"role_play","MARISHA",1,0,0,0
"1857","Attack_Conclave",4,39,1857,"second_half_rp","SAM","oh, shit! burn it down! burn the stockades down!",10628.363,10632.594,4.23099999999977,10,0.00236350744504858,NA,"role_play","SAM",1,0,0,0
"1858","Attack_Conclave",4,39,1858,"second_half_rp","LIAM","i'd also like to point out that grog's single nut-flick did more damage than your two full-on punches.",10632.594,10642.289,9.69500000000153,23,0.00237235688499189,NA,"role_play","LIAM",1,0,0,0
"1859","Attack_Conclave",4,39,1859,"second_half_rp","MATT","this is true! all right. eventually, you guys make your way back. as you do, you gather, and about five minutes behind you, the rest of dr. dranzel's troupe arrives, looking a little bit frazzled and a little confused. he steps forward to the rest of you and goes, ""i don't know what ""you did, but there's a manhunt for two gnomes right now over by the promenade. but good on you. ""might want to lay low for a little bit.""",10642.289,10678.526,36.2369999999992,85,0.00234566879156668,NA,"role_play","MATT",0,0,0,1
"1860","Attack_Conclave",4,39,1860,"second_half_rp","SAM","good thinking.",10678.526,10680.114,1.58799999999974,3,0.00188916876574338,NA,"role_play","SAM",1,0,0,0
"1861","Attack_Conclave",4,39,1861,"second_half_rp","TALIESIN","the troupe may want to get out of town for a bit, as well.",10680.114,10682.686,2.57200000000012,15,0.00583203732503862,NA,"role_play","TALIESIN",1,0,0,0
"1862","Attack_Conclave",4,39,1862,"second_half_rp","MATT","""i think that's the plan. we were going to stay a few more days we had a couple of gigs ""lined up, but i think we've pressed our luck far enough, so all right! everyone feeling ""spectacular?"" he claps his hands and the rest of the troupe start grabbing their goods and their instruments and what little cases and bags they do. kaylie runs off real fast and comes back with her one over-the-shoulder satchel that carries all of her worldly belongings. ""then let us be off."" he gives a little tip of the hat to scanlan with a nod. looks to the rest of you. ""we greatly ""appreciate your hospitality. we're sorry for any confusion, misunderstandings, and general ""debauchery. good night to you all."" he turns around and they all start walking out. kaylie begins stepping and she stops and looks over her shoulder towards you, scanlan, and says, ""don't ""come looking for me. when i'm ready, i'll come find you."" she turns back around and leaves.",10682.686,10749.14,66.4539999999997,178,0.00267854455713728,NA,"role_play","MATT",0,0,0,1
"1863","Attack_Conclave",4,39,1863,"second_half_rp","SAM","oh, shit.",10749.14,10751.503,2.36300000000119,3,0.00126957257723169,NA,"role_play","SAM",1,0,0,0
"1864","Attack_Conclave",4,39,1864,"second_half_rp","MARISHA","i liked them. they were fun.",10751.503,10756.821,5.3179999999993,7,0.00131628431741273,NA,"role_play","MARISHA",1,0,0,0
"1865","Attack_Conclave",4,39,1865,"second_half_rp","TRAVIS","did you tell her you're her dad yet?",10756.821,10760.754,3.9330000000009,10,0.00254258835494475,NA,"role_play","TRAVIS",1,0,0,0
"1866","Attack_Conclave",4,39,1866,"second_half_rp","SAM","that's not she figured it out, grog.",10760.754,10770.685,9.93099999999868,9,0.000906253146712436,NA,"role_play","SAM",1,0,0,0
"1867","Attack_Conclave",4,39,1867,"second_half_rp","TRAVIS","that's awkward.",10770.685,10773.004,2.31900000000132,4,0.00172488141440177,NA,"role_play","TRAVIS",1,0,0,0
"1868","Attack_Conclave",4,39,1868,"second_half_rp","SAM","yes. yes, it is.",10773.004,10777.7,4.69599999999991,5,0.00106473594548554,NA,"role_play","SAM",1,0,0,0
"1869","Attack_Conclave",4,39,1869,"second_half_rp","LAURA","they forgot to grab their gold. i like them!",10777.7,10783.969,6.26899999999841,10,0.0015951507417455,NA,"role_play","LAURA",1,0,0,0
"1870","Attack_Conclave",4,39,1870,"second_half_rp","MATT","that they did, actually.",10783.969,10785.925,1.95600000000013,5,0.00255623721881373,NA,"role_play","MATT",0,0,0,1
"1871","Attack_Conclave",4,39,1871,"second_half_rp","MARISHA","maybe they thought we were even?",10785.925,10788.3,2.375,7,0.00294736842105263,NA,"role_play","MARISHA",1,0,0,0
"1872","Attack_Conclave",4,39,1872,"second_half_rp","LIAM","probably should check the silverware, though, in the keep.",10788.3,10790.658,2.35800000000017,10,0.00424088210347721,NA,"role_play","LIAM",1,0,0,0
"1873","Attack_Conclave",4,39,1873,"second_half_rp","LAURA","oh. i run and check the silverware.",10790.658,10792.667,2.00900000000001,8,0.00398208063713287,NA,"role_play","LAURA",1,0,0,0
"1874","Attack_Conclave",4,39,1874,"second_half_rp","TALIESIN","i check to make sure the skull is still there.",10792.667,10795.256,2.58899999999994,11,0.00424874468906923,NA,"role_play","TALIESIN",1,0,0,0
"1875","Attack_Conclave",4,39,1875,"second_half_rp","MATT","the kitchen is cleaned out.",10795.256,10797.402,2.14600000000064,6,0.00279589934762265,NA,"role_play","MATT",0,0,0,1
"1876","Attack_Conclave",4,39,1876,"second_half_rp","LAURA","no!",10797.402,10798.436,1.03399999999965,2,0.00193423597678982,NA,"role_play","LAURA",1,0,0,0
"1877","Attack_Conclave",4,39,1877,"second_half_rp","MATT","all of the silverware.",10798.436,10800.694,2.25799999999981,5,0.00221434898139965,NA,"role_play","MATT",0,0,0,1
"1878","Attack_Conclave",4,39,1878,"second_half_rp","LAURA","what about jarett? he was supposed to be keeping an eye on them.",10800.694,10803.355,2.66100000000006,14,0.00526118000751586,NA,"role_play","LAURA",1,0,0,0
"1879","Attack_Conclave",4,39,1879,"second_half_rp","MARISHA","yeah, what the fuck? what's with jarett?",10803.355,10806.02,2.66500000000087,9,0.00337711069418276,NA,"role_play","MARISHA",1,0,0,0
"1880","Attack_Conclave",4,39,1880,"second_half_rp","MATT","jarett was one man keeping track of multiple people, with one very small, quick child that you were the only one able to keep an eye on.",10806.02,10814.782,8.76199999999881,28,0.00319561743894132,NA,"role_play","MATT",0,0,0,1
"1881","Attack_Conclave",4,39,1881,"second_half_rp","LAURA","i hate your friends!",10814.782,10819.413,4.63100000000122,5,0.00107968041459699,NA,"role_play","LAURA",1,0,0,0
"1882","Attack_Conclave",4,39,1882,"second_half_rp","MARISHA","they were good drinking buddies.",10819.413,10821.852,2.43900000000031,6,0.00246002460024569,NA,"role_play","MARISHA",1,0,0,0
"1883","Attack_Conclave",4,39,1883,"second_half_rp","SAM","they're all right. they've got their good qualities, too.",10821.852,10825.647,3.79500000000007,12,0.00316205533596832,NA,"role_play","SAM",1,0,0,0
"1884","Attack_Conclave",4,39,1884,"second_half_rp","TRAVIS","just the silverware's missing?",10825.647,10828.218,2.57099999999991,6,0.00233372228704792,NA,"role_play","TRAVIS",1,0,0,0
"1885","Attack_Conclave",4,39,1885,"second_half_rp","LAURA","what about our rooms? is it just the kitchen that's cleaned out, or did they take everything in the keep?",10828.218,10832.527,4.30899999999929,22,0.00510559294499968,NA,"role_play","LAURA",1,0,0,0
"1886","Attack_Conclave",4,39,1886,"second_half_rp","MATT","oh, no, no, no. none of the rooms have been touched, except for the guest room where some of them were staying.",10832.527,10843.115,10.5879999999997,23,0.00217227049489994,NA,"role_play","MATT",0,0,0,1
"1887","Attack_Conclave",4,39,1887,"second_half_rp","LAURA","there was shit in there, anyway.",10843.115,10844.541,1.42599999999948,7,0.00490883590463013,NA,"role_play","LAURA",1,0,0,0
"1888","Attack_Conclave",4,39,1888,"second_half_rp","MATT","yeah, there wasn't much in there, but a couple of candlesticks, things that were just decor. anything that could possibly be hocked for a little bit of change from those rooms is gone.",10844.541,10852.519,7.97800000000097,35,0.00438706442717419,NA,"role_play","MATT",0,0,0,1
"1889","Attack_Conclave",4,39,1889,"second_half_rp","LAURA","they don't know i shopped for everything at home goods, so joke's on them.",10852.519,10857.367,4.84799999999996,17,0.00350660066006604,NA,"role_play","LAURA",1,0,0,0
"1890","Attack_Conclave",4,39,1890,"second_half_rp","MATT","you gather probably no more than two to three hundred gold worth of materials were taken in total. that includes fine cookware, that includes decor, that includes a couple of previous art pieces that you had collected",10857.367,10870.223,12.8559999999998,37,0.00287803360298698,NA,"role_play","MATT",0,0,0,1
"1891","Attack_Conclave",4,39,1891,"second_half_rp","TALIESIN","please tell me they stole the giant painting.",10870.223,10873.077,2.85399999999936,9,0.00315346881569797,NA,"role_play","TALIESIN",1,0,0,0
"1892","Attack_Conclave",4,39,1892,"second_half_rp","SAM","it's not here yet.",10873.077,10874.624,1.54700000000048,6,0.00387847446670856,NA,"role_play","SAM",1,0,0,0
"1893","Attack_Conclave",4,39,1893,"second_half_rp","TALIESIN","damn it!",10874.624,10875.685,1.06099999999969,3,0.00282752120640986,NA,"role_play","TALIESIN",1,0,0,0
"1894","Attack_Conclave",4,39,1894,"second_half_rp","MATT","it hasn't been delivered yet. that's probably in transit.",10875.685,10878.187,2.50200000000041,12,0.00479616306954358,NA,"role_play","MATT",0,0,0,1
"1895","Attack_Conclave",4,39,1895,"second_half_rp","TALIESIN","no!",10878.187,10879.51,1.32300000000032,2,0.00151171579742972,NA,"role_play","TALIESIN",1,0,0,0
"1896","Attack_Conclave",4,39,1896,"second_half_rp","LIAM","and where would it have been hidden on their person?",10879.51,10881.825,2.31500000000051,11,0.00475161987040932,NA,"role_play","LIAM",1,0,0,0
"1897","Attack_Conclave",4,39,1897,"second_half_rp","TALIESIN","they could have rolled it up and stuck it where the sun don't shine.",10881.825,10885.455,3.6299999999992,16,0.00440771349862356,NA,"role_play","TALIESIN",1,0,0,0
"1898","Attack_Conclave",4,39,1898,"second_half_rp","MARISHA","a 20 by six foot canvas?",10885.455,10888.612,3.15699999999924,7,0.00221729490022226,NA,"role_play","MARISHA",1,0,0,0
"1899","Attack_Conclave",4,39,1899,"second_half_rp","TALIESIN","some caverns run deep.",10888.612,10891.594,2.98199999999997,5,0.00167672702883972,NA,"role_play","TALIESIN",1,0,0,0
"1900","Attack_Conclave",4,39,1900,"second_half_rp","SAM","i'm going to check my bed just to see if there's any shit on it.",10891.594,10895.113,3.51900000000023,18,0.00511508951406616,NA,"role_play","SAM",1,0,0,0
"1901","Attack_Conclave",4,39,1901,"second_half_rp","MATT","you go and inspect pretty extensively. it does not appear that anyone has left you a scanlan surprise.",10895.113,10901.319,6.20600000000013,19,0.00306155333548173,NA,"role_play","MATT",0,0,0,1
"1902","Attack_Conclave",4,39,1902,"second_half_rp","MARISHA","percy and i go downstairs to make sure the skull is still there.",10901.319,10909.808,8.4890000000014,14,0.00164919307338882,NA,"role_play","MARISHA",1,0,0,0
"1903","Attack_Conclave",4,39,1903,"second_half_rp","MATT","skull is still in the workshop, yes.",10909.808,10912.274,2.46599999999853,8,0.00324412003244313,NA,"role_play","MATT",0,0,0,1
"1904","Attack_Conclave",4,39,1904,"second_half_rp","MARISHA","beautiful.",10912.274,10913.56,1.28600000000006,2,0.00155520995334363,NA,"role_play","MARISHA",1,0,0,0
"1905","Attack_Conclave",4,39,1905,"second_half_rp","MATT","what do you guys want to do right now?",10913.56,10915.583,2.02300000000105,10,0.00494315373207851,NA,"role_play","MATT",0,0,0,1
"1906","Attack_Conclave",4,39,1906,"second_half_rp","TALIESIN","i'm going to spend some time working on the special barrel and see if i can get that up and running.",10915.583,10922,6.41699999999946,23,0.0035842293906813,NA,"role_play","TALIESIN",1,0,0,0
"1907","Attack_Conclave",4,39,1907,"second_half_rp","MARISHA","what time is it?",10922,10923.44,1.44000000000051,5,0.00347222222222099,NA,"role_play","MARISHA",1,0,0,0
"1908","Attack_Conclave",4,39,1908,"second_half_rp","MATT","at this point, it's closing towards dusk.",10923.44,10925.399,1.95899999999892,9,0.00459418070444357,NA,"role_play","MATT",0,0,0,1
"1909","Attack_Conclave",4,39,1909,"second_half_rp","LAURA","we should heal up and get ready to take this to whitestone in the morning, yes?",10925.399,10930.444,5.04500000000007,17,0.00336967294350838,NA,"role_play","LAURA",1,0,0,0
"1910","Attack_Conclave",4,39,1910,"second_half_rp","MARISHA","i guess so.",10930.444,10931.926,1.48199999999997,4,0.00269905533063433,NA,"role_play","MARISHA",1,0,0,0
"1911","Attack_Conclave",4,39,1911,"second_half_rp","TALIESIN","18.",10931.926,10933.018,1.09200000000055,2,0.0018315018315009,NA,"role_play","TALIESIN",1,0,0,0
"1912","Attack_Conclave",4,39,1912,"second_half_rp","MATT","18? all right. you disassemble elements of the pistol. you get the feeling that the way it's weighted, to attach the hand mortar to the pistol, it's still going to continue to be a very unwieldy thing. you are probably best to design them as separate pieces. unfortunately, the way the pistol's balanced, for aim and such? the mechanism that's required to lob an object for the mortar to be able to do any help with is going to throw off your ability to aim much with the pistol, going forward. not to mention increase the misfire score by crazy amounts. but you could create them both separately and swap out as needed.",10933.018,10976.909,43.8909999999996,118,0.00268847827572853,NA,"role_play","MATT",0,0,0,1
"1913","Attack_Conclave",4,39,1913,"second_half_rp","TALIESIN","all right.",10976.909,10978.189,1.28000000000065,3,0.0023437499999988,NA,"role_play","TALIESIN",1,0,0,0
"1914","Attack_Conclave",4,39,1914,"second_half_rp","MATT","all right. you guys spend the evening. you rest up, you're back to full health, you're good to go. as the morning comes around",10978.189,10991.075,12.8860000000004,26,0.00201769362098395,NA,"role_play","MATT",0,0,0,1
"1915","Attack_Conclave",4,39,1915,"second_half_rp","TRAVIS","i have a question.",10991.075,10992.071,0.995999999999185,5,0.00502008032128925,NA,"role_play","TRAVIS",1,0,0,0
"1916","Attack_Conclave",4,39,1916,"second_half_rp","MATT","yes?",10992.071,10993.02,0.949000000000524,2,0.00210748155953519,NA,"role_play","MATT",0,0,0,1
"1917","Attack_Conclave",4,39,1917,"second_half_rp","TRAVIS","can i wait until everyone goes to bed and can i make my way into percy's workshop?",10993.02,10999.4,6.3799999999992,19,0.00297805642633266,NA,"role_play","TRAVIS",1,0,0,0
"1918","Attack_Conclave",4,39,1918,"second_half_rp","TALIESIN","it's locked.",10999.4,11000.85,1.45000000000073,4,0.00275862068965379,NA,"role_play","TALIESIN",1,0,0,0
"1919","Attack_Conclave",4,39,1919,"second_half_rp","MATT","as you get to the workshop, you check the door and it is, indeed, locked.",11000.85,11004.713,3.86299999999937,16,0.00414185865907393,NA,"role_play","MATT",0,0,0,1
"1920","Attack_Conclave",4,39,1920,"second_half_rp","MARISHA","we stashed it.",11004.713,11006.704,1.99099999999999,4,0.00200904068307385,NA,"role_play","MARISHA",1,0,0,0
"1921","Attack_Conclave",4,39,1921,"second_half_rp","TRAVIS","what's the door made of?",11006.704,11008.222,1.51800000000003,7,0.00461133069828713,NA,"role_play","TRAVIS",1,0,0,0
"1922","Attack_Conclave",4,39,1922,"second_half_rp","MATT","it's made of solid metal. it was constructed per specifications to be able to withstand concussive blasts in case of accident from the inside.",11008.222,11016.447,8.22500000000036,26,0.00316109422492387,NA,"role_play","MATT",0,0,0,1
"1923","Attack_Conclave",4,39,1923,"second_half_rp","TRAVIS","can i try to pick the lock?",11016.447,11020.488,4.04099999999926,8,0.00197970799307139,NA,"role_play","TRAVIS",1,0,0,0
"1924","Attack_Conclave",4,39,1924,"second_half_rp","MATT","you have no lockpicks.",11020.488,11022.49,2.00200000000041,5,0.00249750249750199,NA,"role_play","MATT",0,0,0,1
"1925","Attack_Conclave",4,39,1925,"second_half_rp","TRAVIS","can i shove an axe in the lock hole?",11022.49,11026.187,3.69700000000012,10,0.00270489586150925,NA,"role_play","TRAVIS",1,0,0,0
