"","arc","arc_no","episode","turn_number","segment","actor","text","start_turn","end_turn","time_in_sec","word_count","words_per_ms","encounter_count","rp_combat","actor_guest","vox_machina","guest","staff","matt"
"1218","Attack_Conclave",4,39,1218,"second_half_rp","TRAVIS","is the skull with the gem in there still?",7433.931,7436.241,2.3100000000004,10,0.00432900432900358,NA,"role_play","TRAVIS",1,0,0,0
"1219","Attack_Conclave",4,39,1219,"second_half_rp","MATT","it's still turned away, and i believe you put a tapestry over it.",7436.241,7438.715,2.47400000000016,15,0.00606305578011278,NA,"role_play","MATT",0,0,0,1
"1220","Attack_Conclave",4,39,1220,"second_half_rp","LAURA","yes, we did.",7438.715,7440.251,1.53600000000006,4,0.00260416666666657,NA,"role_play","LAURA",1,0,0,0
"1221","Attack_Conclave",4,39,1221,"second_half_rp","TALIESIN","let's bundle it up in the tapestry.",7440.251,7441.906,1.65499999999975,9,0.00543806646525763,NA,"role_play","TALIESIN",1,0,0,0
"1222","Attack_Conclave",4,39,1222,"second_half_rp","LIAM","that thing is trouble, though, that thing is trouble",7441.906,7443.914,2.00799999999981,9,0.00448207171314783,NA,"role_play","LIAM",1,0,0,0
"1223","Attack_Conclave",4,39,1223,"second_half_rp","TALIESIN","well, let's take it to somebody who",7443.914,7445.421,1.50700000000052,8,0.00530856005308378,NA,"role_play","TALIESIN",1,0,0,0
"1224","Attack_Conclave",4,39,1224,"second_half_rp","SAM","take the skull?",7445.421,7446.722,1.30099999999948,4,0.0030745580322841,NA,"role_play","SAM",1,0,0,0
"1225","Attack_Conclave",4,39,1225,"second_half_rp","TALIESIN","i think we should take the skull and show it to someone who might know what it is.",7446.722,7449.842,3.11999999999989,19,0.0060897435897438,NA,"role_play","TALIESIN",1,0,0,0
"1226","Attack_Conclave",4,39,1226,"second_half_rp","TRAVIS","all right, i go over and grab the tapestry and the skull, hold it like a knapsack.",7449.842,7453.908,4.06600000000071,18,0.00442695523856292,NA,"role_play","TRAVIS",1,0,0,0
"1227","Attack_Conclave",4,39,1227,"second_half_rp","MATT","okay, make no this is fine, it's relatively light.",7453.908,7457.281,3.37299999999959,11,0.00326119181737365,NA,"role_play","MATT",0,0,0,1
"1228","Attack_Conclave",4,39,1228,"second_half_rp","TRAVIS","can you hear me?",7457.281,7459.404,2.1230000000005,5,0.00235515779557175,NA,"role_play","TRAVIS",1,0,0,0
"1229","Attack_Conclave",4,39,1229,"second_half_rp","TALIESIN","yes, grog, we can hear you.",7459.404,7463.403,3.9989999999998,7,0.00175043760940244,NA,"role_play","TALIESIN",1,0,0,0
"1230","Attack_Conclave",4,39,1230,"second_half_rp","TRAVIS","yeah. right, good, maybe",7463.403,7467.557,4.15399999999954,4,0.000962927298989033,NA,"role_play","TRAVIS",1,0,0,0
"1231","Attack_Conclave",4,39,1231,"second_half_rp","SAM","oh shit, the whispers. if you haven't read the comics, check it out on geekandsundry.com.",7467.557,7478.996,11.4390000000003,18,0.00157356412273796,NA,"role_play","SAM",1,0,0,0
"1232","Attack_Conclave",4,39,1232,"second_half_rp","TALIESIN","and while you're there, spend some money at gilmore's glorious goods. gilmore's, where all of your magical items can be procured. with a smile a week.",7478.996,7488.492,9.49600000000009,30,0.00315922493681547,NA,"role_play","TALIESIN",1,0,0,0
"1233","Attack_Conclave",4,39,1233,"second_half_rp","LAURA","that was the lamest slogan ever.",7488.492,7490.576,2.08399999999983,7,0.0033589251439542,NA,"role_play","LAURA",1,0,0,0
"1234","Attack_Conclave",4,39,1234,"second_half_rp","MARISHA","all of your items can be purchased.",7490.576,7492.38,1.80400000000009,8,0.00443458980044324,NA,"role_play","MARISHA",1,0,0,0
"1235","Attack_Conclave",4,39,1235,"second_half_rp","TALIESIN","i'm exhausted.",7492.38,7493.611,1.23099999999977,4,0.00324939073923701,NA,"role_play","TALIESIN",1,0,0,0
"1236","Attack_Conclave",4,39,1236,"second_half_rp","TRAVIS","shut the fuck up! wait, wait, wait. last part, last part, last part.",7493.611,7496.2,2.58899999999994,14,0.00540749324063357,NA,"role_play","TRAVIS",1,0,0,0
"1237","Attack_Conclave",4,39,1237,"second_half_rp","SAM","and don't forget!",7496.2,7501.689,5.48900000000049,5,0.000910912734559948,NA,"role_play","SAM",1,0,0,0
"1238","Attack_Conclave",4,39,1238,"second_half_rp","TALIESIN","don't forget?",7501.723,7505.399,3.67600000000039,4,0.00108813928182796,NA,"role_play","TALIESIN",1,0,0,0
"1239","Attack_Conclave",4,39,1239,"second_half_rp","SAM","if someone's whispering in your ear, it's probably the sound of your conscience saying: ""go buy a t-shirt!""",7505.399,7511.423,6.02399999999943,22,0.00365205843293527,NA,"role_play","SAM",1,0,0,0
"1240","Attack_Conclave",4,39,1240,"second_half_rp","TRAVIS","i take off running out of the house.",7511.423,7514.761,3.33800000000065,9,0.00269622528460103,NA,"role_play","TRAVIS",1,0,0,0
"1241","Attack_Conclave",4,39,1241,"second_half_rp","MATT","as you guys are having this conversation, grog just bolts out of the house. just runs up the stairs, out through the foyer, and is",7514.761,7523.999,9.23799999999937,25,0.00270621346611839,NA,"role_play","MATT",0,0,0,1
"1242","Attack_Conclave",4,39,1242,"second_half_rp","LAURA AND TALIESIN","grog!",7523.999,7525.278,1.27900000000045,2,0.00156372165754441,NA,"role_play","LAURA AND TALIESIN",1,0,0,0
"1243","Attack_Conclave",4,39,1243,"second_half_rp","LIAM","i start running after him, and i'm hasted.",7525.278,7526.93,1.65200000000004,10,0.00605326876513301,NA,"role_play","LIAM",1,0,0,0
"1244","Attack_Conclave",4,39,1244,"second_half_rp","MARISHA","oh, it's reverse whispering!",7526.93,7528.917,1.98700000000008,6,0.0030196275792651,NA,"role_play","MARISHA",1,0,0,0
"1245","Attack_Conclave",4,39,1245,"second_half_rp","TALIESIN","it's the reverse whisper!",7528.917,7531.163,2.24599999999919,6,0.00267141585040168,NA,"role_play","TALIESIN",1,0,0,0
"1246","Attack_Conclave",4,39,1246,"second_half_rp","SAM","guys, this is the rest of the show.",7531.163,7533.017,1.85400000000027,9,0.00485436893203813,NA,"role_play","SAM",1,0,0,0
"1247","Attack_Conclave",4,39,1247,"second_half_rp","TALIESIN","they're not talking, there's just tongues in ears.",7533.017,7537.268,4.2510000000002,11,0.00258762644083733,NA,"role_play","TALIESIN",1,0,0,0
"1248","Attack_Conclave",4,39,1248,"second_half_rp","LAURA","lalalala.",7537.268,7539.234,1.96600000000035,2,0.00101729399796523,NA,"role_play","LAURA",1,0,0,0
"1249","Attack_Conclave",4,39,1249,"second_half_rp","MARISHA","wet willie.",7539.234,7541.611,2.3769999999995,3,0.00126209507782946,NA,"role_play","MARISHA",1,0,0,0
"1250","Attack_Conclave",4,39,1250,"second_half_rp","LIAM","i'm running out stealthing, after him.",7541.611,7544.415,2.80400000000009,8,0.00285306704707552,NA,"role_play","LIAM",1,0,0,0
"1251","Attack_Conclave",4,39,1251,"second_half_rp","LAURA","i stop and i get the golden tea set. and i take off after him.",7544.415,7548.597,4.18199999999979,16,0.00382592061214749,NA,"role_play","LAURA",1,0,0,0
"1252","Attack_Conclave",4,39,1252,"second_half_rp","TRAVIS","guys, you've got to come out of the house, now!",7548.68,7550.494,1.8139999999994,12,0.00661521499448952,NA,"role_play","TRAVIS",1,0,0,0
"1253","Attack_Conclave",4,39,1253,"second_half_rp","TALIESIN","okay, we're running out of the house.",7550.494,7551.944,1.45000000000073,9,0.00620689655172102,NA,"role_play","TALIESIN",1,0,0,0
"1254","Attack_Conclave",4,39,1254,"second_half_rp","TRAVIS","we've got to get out of the house. now!",7551.944,7553.658,1.71399999999994,11,0.00641773628938178,NA,"role_play","TRAVIS",1,0,0,0
"1255","Attack_Conclave",4,39,1255,"second_half_rp","TALIESIN","we're running out of the house.",7553.658,7555.129,1.47099999999955,8,0.00543847722637828,NA,"role_play","TALIESIN",1,0,0,0
"1256","Attack_Conclave",4,39,1256,"second_half_rp","MARISHA","okay, okay. we're running out of the house. christ.",7555.129,7557.072,1.94300000000021,11,0.00566134843026187,NA,"role_play","MARISHA",1,0,0,0
"1257","Attack_Conclave",4,39,1257,"second_half_rp","TALIESIN","i'm following him out of the house, so.",7557.072,7559.55,2.47800000000007,10,0.00403551251008867,NA,"role_play","TALIESIN",1,0,0,0
"1258","Attack_Conclave",4,39,1258,"second_half_rp","MATT","right. you all rush out. you're now out of the foyer. you burst out the front of the home itself. you're in the front yard at this point in time, in the slightly dead grass.",7559.55,7567.705,8.15499999999975,38,0.00465971796443914,NA,"role_play","MATT",0,0,0,1
"1259","Attack_Conclave",4,39,1259,"second_half_rp","TALIESIN","it's going to go poltergeist on us, isn't it?",7567.705,7569.91,2.20499999999993,12,0.00544217687074848,NA,"role_play","TALIESIN",1,0,0,0
"1260","Attack_Conclave",4,39,1260,"second_half_rp","MARISHA","the house just collapses.",7569.91,7572.083,2.17299999999977,5,0.00230096640589071,NA,"role_play","MARISHA",1,0,0,0
"1261","Attack_Conclave",4,39,1261,"second_half_rp","MATT","the sun's still high in the sky, late afternoon at this point.",7572.083,7575.535,3.45200000000023,14,0.00405561993047482,NA,"role_play","MATT",0,0,0,1
"1262","Attack_Conclave",4,39,1262,"second_half_rp","LAURA","what the fuck was that about?",7575.535,7576.686,1.15099999999984,7,0.00608166811468373,NA,"role_play","LAURA",1,0,0,0
"1263","Attack_Conclave",4,39,1263,"second_half_rp","TRAVIS","the house and the skull are linked. as long as the house stands, his evil will grow.",7576.686,7582.62,5.9340000000002,18,0.00303336703741143,NA,"role_play","TRAVIS",1,0,0,0
"1264","Attack_Conclave",4,39,1264,"second_half_rp","SAM","whose evil?",7582.62,7583.987,1.36700000000019,3,0.0021945866861738,NA,"role_play","SAM",1,0,0,0
"1265","Attack_Conclave",4,39,1265,"second_half_rp","TRAVIS","it didn't say. the house has to be taken down to the ground. the portal must be destroyed.",7583.987,7588.564,4.57700000000023,20,0.00436967445925257,NA,"role_play","TRAVIS",1,0,0,0
"1266","Attack_Conclave",4,39,1266,"second_half_rp","LIAM","says who? who's in there?",7588.564,7590.349,1.78499999999985,7,0.0039215686274513,NA,"role_play","LIAM",1,0,0,0
"1267","Attack_Conclave",4,39,1267,"second_half_rp","TRAVIS","i just heard this fucking i. have... premonitions at times, it runs in my family.",7590.349,7600.851,10.5019999999995,16,0.00152351932965157,NA,"role_play","TRAVIS",1,0,0,0
"1268","Attack_Conclave",4,39,1268,"second_half_rp","MARISHA","since when, grog?",7600.851,7602.462,1.61100000000079,4,0.00248292985723032,NA,"role_play","MARISHA",1,0,0,0
"1269","Attack_Conclave",4,39,1269,"second_half_rp","TRAVIS","you know, when i'm drinking ale, this voice goes like: ""stop!"" but i'm like: ""no."" and i keep going. and sure enough, i should've stopped.",7602.462,7610.257,7.79499999999916,29,0.00372033354714601,NA,"role_play","TRAVIS",1,0,0,0
"1270","Attack_Conclave",4,39,1270,"second_half_rp","MARISHA","but you haven't been drinking today.",7610.257,7611.884,1.62700000000041,8,0.00491702519975292,NA,"role_play","MARISHA",1,0,0,0
"1271","Attack_Conclave",4,39,1271,"second_half_rp","SAM","that voice is usually me.",7611.884,7613.587,1.70300000000043,6,0.00352319436288813,NA,"role_play","SAM",1,0,0,0
"1272","Attack_Conclave",4,39,1272,"second_half_rp","TRAVIS","are you saying anything?",7613.587,7616.376,2.78899999999976,5,0.00179275726066706,NA,"role_play","TRAVIS",1,0,0,0
"1273","Attack_Conclave",4,39,1273,"second_half_rp","MATT","grog. make a deception check.",7616.376,7620.968,4.59199999999964,6,0.00130662020905933,NA,"role_play","MATT",0,0,0,1
"1274","Attack_Conclave",4,39,1274,"second_half_rp","TRAVIS","12.",7620.968,7624.275,3.30699999999979,2,0.000604777744179053,NA,"role_play","TRAVIS",1,0,0,0
"1275","Attack_Conclave",4,39,1275,"second_half_rp","MATT","i'm going to say, over the course of everyone listening, grog hasn't been really fancy with wordplay or deception. he's a very blunt, upfront person, and it's very awkward to see a childlike mind attempt to convey a fictional story like the one he's been pretending.",7624.275,7645.29,21.0150000000003,52,0.00247442303116817,NA,"role_play","MATT",0,0,0,1
"1276","Attack_Conclave",4,39,1276,"second_half_rp","LAURA","so, you're lying.",7645.29,7646.81,1.52000000000044,5,0.00328947368420958,NA,"role_play","LAURA",1,0,0,0
"1277","Attack_Conclave",4,39,1277,"second_half_rp","TRAVIS","what?",7646.81,7648.066,1.2559999999994,2,0.00159235668789885,NA,"role_play","TRAVIS",1,0,0,0
"1278","Attack_Conclave",4,39,1278,"second_half_rp","LAURA","you're lying, grog.",7648.066,7649.51,1.44400000000041,5,0.00346260387811535,NA,"role_play","LAURA",1,0,0,0
"1279","Attack_Conclave",4,39,1279,"second_half_rp","TRAVIS","what? why do you say that?",7649.51,7651.149,1.63900000000012,7,0.00427089688834623,NA,"role_play","TRAVIS",1,0,0,0
"1280","Attack_Conclave",4,39,1280,"second_half_rp","TALIESIN","because you're really bad at it. and it's hilarious.",7651.149,7654.268,3.11899999999969,12,0.00384738698300776,NA,"role_play","TALIESIN",1,0,0,0
"1281","Attack_Conclave",4,39,1281,"second_half_rp","TRAVIS","reverse psychology. i'm really bad at it.",7654.268,7657.527,3.25900000000001,9,0.00276158330776311,NA,"role_play","TRAVIS",1,0,0,0
"1282","Attack_Conclave",4,39,1282,"second_half_rp","LAURA","yes, you are.",7657.527,7658.897,1.36999999999989,4,0.00291970802919731,NA,"role_play","LAURA",1,0,0,0
"1283","Attack_Conclave",4,39,1283,"second_half_rp","TRAVIS","that didn't work.",7658.897,7660.305,1.40800000000036,5,0.00355113636363546,NA,"role_play","TRAVIS",1,0,0,0
"1284","Attack_Conclave",4,39,1284,"second_half_rp","TALIESIN","no, it didn't.",7660.305,7661.388,1.08299999999963,5,0.00461680517082337,NA,"role_play","TALIESIN",1,0,0,0
"1285","Attack_Conclave",4,39,1285,"second_half_rp","LIAM","i want to walk right up to grog. right up to his nipples, because that's as high as i go.",7661.388,7666.353,4.96500000000015,22,0.00443101711983874,NA,"role_play","LIAM",1,0,0,0
"1286","Attack_Conclave",4,39,1286,"second_half_rp","SAM","kiss him on the mouth.",7666.353,7669.519,3.16600000000017,6,0.00189513581806686,NA,"role_play","SAM",1,0,0,0
"1287","Attack_Conclave",4,39,1287,"second_half_rp","LIAM","that's two episodes from today. will you come down here, please? big man? couple of things. first, and this is a smaller detail, i shaved half your beard, correct? it's correct. you've cut me open at least twice, right now. pike, come here.",7669.519,7689.351,19.8319999999994,47,0.00236990722065356,NA,"role_play","LIAM",1,0,0,0
"1288","Attack_Conclave",4,39,1288,"second_half_rp","MATT","pike walks up. ""yeah?""",7689.351,7691.289,1.9380000000001,5,0.00257997936016498,NA,"role_play","MATT",0,0,0,1
"1289","Attack_Conclave",4,39,1289,"second_half_rp","LIAM","i would say that makes you and i even. you've been acting all kinds of fucked-up for a while now, and i know you don't want to disappoint her, your best friend. something's going on with you, and it's time to talk about it. you're talking to yourself, you're talking to your own asshole. you're talking to that fucking sword, you're talking to trinkets we're picking up in houses. what is going on?",7691.289,7716.46,25.1710000000003,84,0.0033371737316753,NA,"role_play","LIAM",1,0,0,0
"1290","Attack_Conclave",4,39,1290,"second_half_rp","TRAVIS","talking to the sword?",7716.46,7717.748,1.28799999999956,5,0.00388198757764109,NA,"role_play","TRAVIS",1,0,0,0
"1291","Attack_Conclave",4,39,1291,"second_half_rp","LIAM","and she's listening. and she knows when you're lying, and she knows when you're telling the truth.",7717.748,7722.969,5.22100000000046,21,0.00402221796590656,NA,"role_play","LIAM",1,0,0,0
"1292","Attack_Conclave",4,39,1292,"second_half_rp","TRAVIS","pike?",7722.969,7723.86,0.890999999999622,2,0.00224466891133653,NA,"role_play","TRAVIS",1,0,0,0
"1293","Attack_Conclave",4,39,1293,"second_half_rp","MATT","she does give you this concerned look that only a possibly disappointed friend can give you, like, ""i am worried about you, grog.""",7723.86,7732.416,8.55600000000049,24,0.00280504908835888,NA,"role_play","MATT",0,0,0,1
"1294","Attack_Conclave",4,39,1294,"second_half_rp","TRAVIS","honestly, i'm hurt. i'm offended. and we are not fucking equal. if you want to get equal, we can step out here, and handle business like men.",7732.416,7749.335,16.9189999999999,30,0.00177315444175189,NA,"role_play","TRAVIS",1,0,0,0
"1295","Attack_Conclave",4,39,1295,"second_half_rp","MARISHA","who all is around to see this?",7749.335,7753.282,3.94700000000012,8,0.00202685583987833,NA,"role_play","MARISHA",1,0,0,0
"1296","Attack_Conclave",4,39,1296,"second_half_rp","TRAVIS","i've cut you open twice. twice.",7753.282,7755.91,2.6279999999997,8,0.00304414003044175,NA,"role_play","TRAVIS",1,0,0,0
"1297","Attack_Conclave",4,39,1297,"second_half_rp","LIAM","i walk away. i walk off. i leave the fucking house.",7755.91,7758.688,2.77800000000025,12,0.0043196544276454,NA,"role_play","LIAM",1,0,0,0
"1298","Attack_Conclave",4,39,1298,"second_half_rp","LAURA","we're already out of the house.",7758.688,7761.321,2.63299999999981,8,0.00303835928598579,NA,"role_play","LAURA",1,0,0,0
"1299","Attack_Conclave",4,39,1299,"second_half_rp","MATT","so as you guys are standing in front of the house, vax just steps out into the center of the cloudtop district, in the direction towards the exit.",7761.321,7767.01,5.68900000000031,29,0.00509755668834566,NA,"role_play","MATT",0,0,0,1
"1300","Attack_Conclave",4,39,1300,"second_half_rp","LIAM","gone. stealthed. laters.",7767.01,7769.213,2.20299999999952,4,0.00181570585565178,NA,"role_play","LIAM",1,0,0,0
"1301","Attack_Conclave",4,39,1301,"second_half_rp","TRAVIS","pike, can i talk to you for a second?",7769.213,7772.397,3.1840000000002,10,0.00314070351758775,NA,"role_play","TRAVIS",1,0,0,0
"1302","Attack_Conclave",4,39,1302,"second_half_rp","MATT","""yeah. grog, anything.""",7772.397,7774.835,2.4380000000001,5,0.00205086136177186,NA,"role_play","MATT",0,0,0,1
"1303","Attack_Conclave",4,39,1303,"second_half_rp","TRAVIS","talking to my sword. the skull has a voice.",7774.835,7781.204,6.36899999999969,10,0.00157010519704828,NA,"role_play","TRAVIS",1,0,0,0
"1304","Attack_Conclave",4,39,1304,"second_half_rp","MATT","""what do you mean?""",7781.204,7784.587,3.38300000000072,6,0.00177357375110811,NA,"role_play","MATT",0,0,0,1
"1305","Attack_Conclave",4,39,1305,"second_half_rp","TRAVIS","yeah. i picked it up, right, because i was just going to carry it out, and it said, like: ""i ""can grant you a wish. any wish that you want.""",7784.587,7794.432,9.84499999999935,31,0.00314880650076202,NA,"role_play","TRAVIS",1,0,0,0
"1306","Attack_Conclave",4,39,1306,"second_half_rp","MATT","""we've been told something similar before, and that didn't go too well. put the skull down, please.""",7794.432,7804.044,9.61200000000008,21,0.0021847690387016,NA,"role_play","MATT",0,0,0,1
"1307","Attack_Conclave",4,39,1307,"second_half_rp","TRAVIS","yeah. but it's a wish. we can wish for anything.",7804.044,7808.967,4.92299999999977,12,0.00243753808653271,NA,"role_play","TRAVIS",1,0,0,0
"1308","Attack_Conclave",4,39,1308,"second_half_rp","MATT","""grog, please, trust me? put the skull down.""",7808.967,7811.916,2.94900000000052,10,0.00339097999321744,NA,"role_play","MATT",0,0,0,1
"1309","Attack_Conclave",4,39,1309,"second_half_rp","TRAVIS","i don't want to put it down.",7811.916,7815.212,3.29600000000028,9,0.00273058252427162,NA,"role_play","TRAVIS",1,0,0,0
"1310","Attack_Conclave",4,39,1310,"second_half_rp","MATT","""i know. do you trust me?""",7815.212,7818.179,2.96699999999964,8,0.00269632625547724,NA,"role_play","MATT",0,0,0,1
"1311","Attack_Conclave",4,39,1311,"second_half_rp","TRAVIS","yes.",7818.179,7820.498,2.31899999999951,2,0.000862440707201564,NA,"role_play","TRAVIS",1,0,0,0
"1312","Attack_Conclave",4,39,1312,"second_half_rp","MATT","""put the skull down, grog.""",7820.498,7826.37,5.8720000000003,7,0.00119209809264299,NA,"role_play","MATT",0,0,0,1
"1313","Attack_Conclave",4,39,1313,"second_half_rp","TRAVIS","i drop the skull.",7826.37,7828.277,1.90700000000015,5,0.00262191924488705,NA,"role_play","TRAVIS",1,0,0,0
"1314","Attack_Conclave",4,39,1314,"second_half_rp","MATT","okay. the tapestry clatters to the ground and opens up, and the skull rolls for a second and stops on its side. you can see now, the golden skull is just resting there. the gem still with the intricate filigree, buried within the eye socket. pike turns to the rest of you and calls you over. ""we don't know what this is. and dangerous magics are drawn to imagery like this. ""let us see what this is about, first.""",7828.277,7859.656,31.3789999999999,81,0.0025813442110966,NA,"role_play","MATT",0,0,0,1
"1315","Attack_Conclave",4,39,1315,"second_half_rp","MARISHA","pike, can you discern what kind of entity this might be attached to?",7859.656,7865.984,6.32800000000043,14,0.00221238938053082,NA,"role_play","MARISHA",1,0,0,0
"1316","Attack_Conclave",4,39,1316,"second_half_rp","MATT","""i had a feeling before."" and she pulls out her healing symbol and casts detect good or evil again in the direction of the skull. you can see she recoils the moment that she concentrates. ""the ""aura is definitely evil from this object.""",7865.984,7881.659,15.6749999999993,45,0.00287081339712932,NA,"role_play","MATT",0,0,0,1
"1317","Attack_Conclave",4,39,1317,"second_half_rp","MARISHA","okay.",7881.659,7883.084,1.42500000000018,2,0.00140350877192965,NA,"role_play","MARISHA",1,0,0,0
"1318","Attack_Conclave",4,39,1318,"second_half_rp","LAURA","maybe it was lying to you.",7883.084,7885.223,2.13900000000012,7,0.00327255726975203,NA,"role_play","LAURA",1,0,0,0
"1319","Attack_Conclave",4,39,1319,"second_half_rp","SAM","what?",7885.223,7886.414,1.1909999999998,2,0.00167926112510523,NA,"role_play","SAM",1,0,0,0
"1320","Attack_Conclave",4,39,1320,"second_half_rp","TRAVIS","lying? i hadn't thought of that.",7886.414,7891.476,5.0619999999999,8,0.00158040300276574,NA,"role_play","TRAVIS",1,0,0,0
"1321","Attack_Conclave",4,39,1321,"second_half_rp","MARISHA","is that all you have, pike? that's all you can find out?",7891.476,7895.912,4.4360000000006,14,0.00315599639314655,NA,"role_play","MARISHA",1,0,0,0
"1322","Attack_Conclave",4,39,1322,"second_half_rp","MATT","""you have to take it to somebody who knows it or spend some time with it, perhaps.""",7895.912,7899.008,3.09599999999955,19,0.00613695090439366,NA,"role_play","MATT",0,0,0,1
"1323","Attack_Conclave",4,39,1323,"second_half_rp","LAURA","how about this, how about nobody ask the skull any more questions?",7899.008,7904.745,5.73700000000008,13,0.00226599267910054,NA,"role_play","LAURA",1,0,0,0
"1324","Attack_Conclave",4,39,1324,"second_half_rp","MARISHA","yeah, no one touch the is it just laying on the floor right now?",7904.745,7907.439,2.69400000000041,15,0.00556792873051139,NA,"role_play","MARISHA",1,0,0,0
"1325","Attack_Conclave",4,39,1325,"second_half_rp","MATT","just laying right there, off to the side.",7907.439,7909.16,1.72099999999955,9,0.00522951772225587,NA,"role_play","MATT",0,0,0,1
"1326","Attack_Conclave",4,39,1326,"second_half_rp","SAM","put it in the bag of holding?",7909.16,7910.82,1.65999999999985,8,0.00481927710843416,NA,"role_play","SAM",1,0,0,0
"1327","Attack_Conclave",4,39,1327,"second_half_rp","LAURA AND MARISHA","no.",7910.82,7911.788,0.967999999999847,2,0.00206611570247967,NA,"role_play","LAURA AND MARISHA",1,0,0,0
"1328","Attack_Conclave",4,39,1328,"second_half_rp","LAURA","i don't like evil things in the bag of holding. we have lots of weird things in there, i don't know how it'll react.",7911.788,7918.509,6.72100000000046,28,0.00416604671923792,NA,"role_play","LAURA",1,0,0,0
"1329","Attack_Conclave",4,39,1329,"second_half_rp","TALIESIN","i'm going to pull out my sword and pick it up by the eye socket.",7918.509,7921.916,3.40700000000015,17,0.00498972703257976,NA,"role_play","TALIESIN",1,0,0,0
"1330","Attack_Conclave",4,39,1330,"second_half_rp","MATT","the empty one? okay. you lift it up.",7921.916,7924.835,2.91899999999987,9,0.00308324768756437,NA,"role_play","MATT",0,0,0,1
"1331","Attack_Conclave",4,39,1331,"second_half_rp","TALIESIN","i'm going to carry it on a stick.",7924.835,7927.858,3.02300000000014,10,0.00330797221303326,NA,"role_play","TALIESIN",1,0,0,0
"1332","Attack_Conclave",4,39,1332,"second_half_rp","LAURA","should we put a cloth over it?",7927.858,7930.141,2.28299999999945,8,0.00350416119141565,NA,"role_play","LAURA",1,0,0,0
"1333","Attack_Conclave",4,39,1333,"second_half_rp","SAM","yeah, that might look a little weird.",7930.141,7931.61,1.46900000000005,8,0.00544588155207605,NA,"role_play","SAM",1,0,0,0
"1334","Attack_Conclave",4,39,1334,"second_half_rp","TALIESIN","it's going to look weird with a cloth over it, but please, go ahead.",7931.61,7934.669,3.0590000000002,16,0.00523046747303007,NA,"role_play","TALIESIN",1,0,0,0
"1335","Attack_Conclave",4,39,1335,"second_half_rp","MATT","okay. vex, as you approach it and go to throw the cloth over it, you get a brief view of the gem that's in the socket. and where there was a slight shimmer to its surface when it was looking to before, you can now see briefly what looks like some sort of a ghostly face appears across the surface for a second and then fades.",7934.669,7958.175,23.5060000000003,68,0.00289287841402191,NA,"role_play","MATT",0,0,0,1
"1336","Attack_Conclave",4,39,1336,"second_half_rp","LAURA","oh, shit.",7958.175,7959.477,1.30199999999968,3,0.00230414746543835,NA,"role_play","LAURA",1,0,0,0
"1337","Attack_Conclave",4,39,1337,"second_half_rp","MATT","you throw it over it.",7959.477,7960.865,1.38799999999992,6,0.00432276657060544,NA,"role_play","MATT",0,0,0,1
"1338","Attack_Conclave",4,39,1338,"second_half_rp","LAURA","that thing's alive. that is definitely alive.",7960.865,7963.083,2.21799999999985,9,0.00405770964833211,NA,"role_play","LAURA",1,0,0,0
"1339","Attack_Conclave",4,39,1339,"second_half_rp","TRAVIS","what, the skull?",7963.083,7964.161,1.07800000000043,4,0.00371057513914509,NA,"role_play","TRAVIS",1,0,0,0
