"","arc","arc_no","episode","turn_number","segment","actor","text","start_turn","end_turn","time_in_sec","word_count","words_per_ms","encounter_count","rp_combat","actor_guest","vox_machina","guest","staff","matt"
"1","Attack_Conclave",4,51,1,"proglog","LAURA","it's up on twitter and on facebook. there you go. twitter and facebook, go find it. next up... a really amazing game called mascarada that i'm lucky to be a part of. it's on kickstarter to finish up their big push for the final polish of the game. if you're looking for a great kind of isometric, beautifully drawn rpg experience, go check out the kickstarter and if it's something you wanna help make the best it can possibly be, do so, so go check out mascarada on kickstarter. also, this week, or as of last friday, the goblin one-shot that we did with marisha and taliesin and a bunch of other fantastic guests is up on the geek and sundry website if you haven't seen it yet. it's ridiculous and i think you'll enjoy it. and... also, as a reminder, that the ""how do you want to do this?"" sweaters are still up for pre-order in the store. oh wait, but it has to switch.",57.181,59.621,2.44,177,0.0725409836065572,NA,NA,"LAURA",1,0,0,0
"2","Attack_Conclave",4,51,2,"proglog","SAM","no, it switches. it switches?",107.188,108.021,0.832999999999998,6,0.007202881152461,NA,NA,"SAM",1,0,0,0
"3","Attack_Conclave",4,51,3,"proglog","SAM","they can switch cameras. oh.",108.923,109.97,1.047,6,0.00573065902578798,NA,NA,"SAM",1,0,0,0
"4","Attack_Conclave",4,51,4,"proglog","SAM","just one at a time. wait, wait. and, we finally have the ""how do you want to do this?"" t-shirts back in stock in the shop. so those who missed that, we finally, finally got them back up in stock on the website, so if you're looking for those, they're available.",110.803,111.636,0.832999999999998,55,0.0660264105642258,NA,NA,"SAM",1,0,0,0
"5","Attack_Conclave",4,51,5,"proglog","LAURA","they're for pre-order for another week. there's like modeling happening right now. and then, i know there was modeling. these european models are in these smoking hot oh, who? these european models?",124.335,126.541,2.206,36,0.0163191296464188,NA,NA,"LAURA",1,0,0,0
"6","Attack_Conclave",4,51,6,"proglog","MATT","look, they see something fascinating far away and they're turning to see it. oh, look at that. [audio silence] liam? what? oh man i hope in the last hour, i hope in the last hour, where you had all this time to kill, you went to wyrmwood gaming to get boxes for your dice where you could use the code critrole. critrole! to get free shipping. not free boxes, but free shipping with critrole. also, i think we got one more week on their kickstarter for the sentinel box, you can get this logo on any box, but right here. you could also get the vox machina box which is pretty sweet. inlaid and fancy. if you're nuts. i keep a human heart in here. it's true. critrole. all right. anything else, are we good to jump into this game for tonight?",134.913,136.666,1.75299999999999,146,0.0832857957786658,NA,NA,"MATT",0,0,0,1
"7","Attack_Conclave",4,51,7,"proglog","TRAVIS","light this candle.",185.321,186.154,0.832999999999998,4,0.00480192076830733,NA,NA,"TRAVIS",1,0,0,0
"8","Attack_Conclave",4,51,8,"proglog","LAURA","let's do it, oh my gosh. alright folks, let's go ahead and bring us down back into tonight's episode of critical role. welcome back. so, last we left off, the party having found their way back to the city of westruun, which had been overrun by the herd of roving nomadic tribal barbarians and other such brigands that wander the landscape of tal’dorei that grog once belonged to, had swooped in and taken westruun after the chroma conclave dragon attack across this countryside. the party had devised a plan to find their way into the town or at least one of them would, distract a cluster of these individuals, these goliaths, many of which are, you know, half-giant goliaths pulling them out of the city into a large pit that had been hidden after being carved by the druid keyleth. scanlan went into be the distraction. becoming invisible, leaping to the center of the main town square, right in front of the margrave's house, where apparently the leader of this clan, kevdak, which has a long history with grog, resides. as part of this distraction, scanlan released a thunderwave and in doing so unknowingly also revealed himself as the invisibility spell went away. and an entire cluster of very angry-looking individuals bared down on him, managed to escape thanks to dimension door, twice and made your way into the partially ruined temple of arathis where you came face to face with a number of refugee westruun villagers and dr. dranzel and kaylee. and that is where we left off so after appearing and having a moment of realizing the scenario, you see a handful of people, most of them filthy, completely beleaguered, and in need of not being in this circumstance as long as they possibly can. and you can see kaylee kinda holding them back defensively and dranzel, having just noticed your appearance and calling out to you with a chuckle, realizing that you're here and kaylee rolling her eyes, apparently unable to really escape through fate, though there is a look, a brief glance of appreciation that at least you're not burnt to a crisp somewhere outside emon. but dranzel walks up to you and is like, as hush as he can be, ""scanlan, so glad to see that you survived. ""what are you doing here?""",186.154,187.206,1.05199999999999,398,0.378326996197721,NA,NA,"LAURA",1,0,0,0
