"","arc","arc_no","episode","turn_number","segment","actor","text","start_turn","end_turn","time_in_sec","word_count","words_per_ms","encounter_count","rp_combat","actor_guest","vox_machina","guest","staff","matt"
"1284","Vestiges",5,6,1284,"combat","ORION","vax. pay attention, the door mechanical, it is not magical. that's how we open it.",5232.099,5235.556,3.45699999999943,17,0.00491755857680151,1,"combat","ORION",1,0,0,0
"1285","Vestiges",5,6,1285,"combat","LAURA","25.",5235.556,5236.413,0.856999999999971,2,0.00233372228704792,1,"combat","LAURA",1,0,0,0
"1286","Vestiges",5,6,1286,"combat","MATT","25. percy? and you get 2 attacks each. so -",5236.413,5239.484,3.07100000000082,10,0.00325626831650841,1,"combat","MATT",0,0,0,1
"1287","Vestiges",5,6,1287,"combat","TALIESIN","i hit a 23.",5239.484,5242.915,3.43099999999959,5,0.00145730107840297,1,"combat","TALIESIN",1,0,0,0
"1288","Vestiges",5,6,1288,"combat","MATT","23 hits. go ahead and roll second attack.",5242.915,5244.767,1.85199999999986,9,0.00485961123110187,1,"combat","MATT",0,0,0,1
"1289","Vestiges",5,6,1289,"combat","TALIESIN","okay, roll damage.",5244.767,5247.568,2.80100000000039,4,0.00142806140664029,1,"combat","TALIESIN",1,0,0,0
"1290","Vestiges",5,6,1290,"combat","MATT","well, roll both attacks first.",5247.568,5249.331,1.76299999999992,6,0.00340328984685211,1,"combat","MATT",0,0,0,1
"1291","Vestiges",5,6,1291,"combat","LAURA","18 for the second one.",5249.331,5250.571,1.23999999999978,6,0.00483870967742021,1,"combat","LAURA",1,0,0,0
"1292","Vestiges",5,6,1292,"combat","MATT","hits as well.",5250.571,5251.582,1.01100000000042,4,0.00395647873392515,1,"combat","MATT",0,0,0,1
"1293","Vestiges",5,6,1293,"combat","TALIESIN","i have to reload with my second attack.",5251.582,5253.361,1.77899999999954,9,0.00505902192242963,1,"combat","TALIESIN",1,0,0,0
"1294","Vestiges",5,6,1294,"combat","MATT","oh right. is this with the bad news?",5253.361,5255.617,2.25600000000031,9,0.00398936170212711,1,"combat","MATT",0,0,0,1
"1295","Vestiges",5,6,1295,"combat","TALIESIN","i've got the big gun out.",5255.617,5256.825,1.20799999999963,8,0.00662251655629342,1,"combat","TALIESIN",1,0,0,0
"1296","Vestiges",5,6,1296,"combat","MATT","you’ve got the bad news out. okay then, yeah. so you fire and then reload. go ahead and roll damage.",5256.825,5262.913,6.08799999999974,22,0.00361366622864667,1,"combat","MATT",0,0,0,1
"1297","Vestiges",5,6,1297,"combat","LAURA","i'm using my fire bow.",5262.913,5265.392,2.47900000000027,7,0.00282371924162938,1,"combat","LAURA",1,0,0,0
"1298","Vestiges",5,6,1298,"combat","MATT","you're using the fire bowstring. as you nock your first arrow, it bursts into flame as it hits your fingers.",5265.392,5270.336,4.94400000000041,22,0.00444983818770189,1,"combat","MATT",0,0,0,1
"1299","Vestiges",5,6,1299,"combat","TALIESIN","oh my god.",5270.336,5271.324,0.987999999999374,4,0.00404858299595398,1,"combat","TALIESIN",1,0,0,0
"1300","Vestiges",5,6,1300,"combat","TALIESIN","7 damage.",5273.03,5274.303,1.27300000000014,3,0.00235663786331475,1,"combat","TALIESIN",1,0,0,0
"1301","Vestiges",5,6,1301,"combat","MATT","7 damage? okay.",5274.303,5275.826,1.52300000000014,4,0.00262639527248827,1,"combat","MATT",0,0,0,1
"1302","Vestiges",5,6,1302,"combat","TALIESIN","i'm so embarrassed.",5275.826,5277.54,1.71399999999994,5,0.0029171528588099,1,"combat","TALIESIN",1,0,0,0
"1303","Vestiges",5,6,1303,"combat","MATT","i'm sorry.",5277.54,5278.953,1.41300000000047,4,0.00283085633404011,1,"combat","MATT",0,0,0,1
"1304","Vestiges",5,6,1304,"combat","LIAM","you got me right in the ear.",5278.953,5280.403,1.44999999999982,8,0.00551724137931104,1,"combat","LIAM",1,0,0,0
"1305","Vestiges",5,6,1305,"combat","LAURA","20 damage on the first attack.",5280.403,5281.643,1.23999999999978,7,0.00564516129032357,1,"combat","LAURA",1,0,0,0
"1306","Vestiges",5,6,1306,"combat","MATT","okay.",5281.643,5283.252,1.60900000000038,2,0.00124300807955222,1,"combat","MATT",0,0,0,1
"1307","Vestiges",5,6,1307,"combat","MARISHA","come on, vex.",5285.196,5286.836,1.64000000000033,4,0.00243902439024342,1,"combat","MARISHA",1,0,0,0
"1308","Vestiges",5,6,1308,"combat","LAURA","13 on the second.",5286.836,5288.632,1.79599999999937,5,0.00278396436525711,1,"combat","LAURA",1,0,0,0
"1309","Vestiges",5,6,1309,"combat","MATT","okay, as both are going up with their crossbows ready to go, first one, bad news with a cacophonous echoing gunshot that within this cavern, definitely carries some sound to it. and to some degree, suprise may be a little harder to find going forward.",5288.632,5308.431,19.799,46,0.00232334966412445,1,"combat","MATT",0,0,0,1
"1310","Vestiges",5,6,1310,"combat","TALIESIN","they were ready to start shooting at us.",5308.431,5312.21,3.77900000000045,9,0.00238158242921379,1,"combat","TALIESIN",1,0,0,0
"1311","Vestiges",5,6,1311,"combat","MATT","however, the shot hits the guy in the shoulder, knocks him off balance for a second. not enough of a wound to prevent his next action. you, however, place one arrow into the other guy’s shoulder. he's dropped the crossbow. as he goes to reach for his other weapon, the other one just, right at the bottom of his throat, out the back of his head, and he just drops below the wall.",5312.21,5331.821,19.6109999999999,76,0.00387537606445365,1,"combat","MATT",0,0,0,1
"1312","Vestiges",5,6,1312,"combat","ASHLEY","awesome.",5331.821,5333.301,1.48000000000047,2,0.00135135135135092,1,"combat","ASHLEY",1,0,0,0
"1313","Vestiges",5,6,1313,"combat","MATT","the other one does get a crossbow shot off at you, percy. that is a 23 versus armor class.",5333.301,5340.292,6.99099999999999,20,0.00286082105564298,1,"combat","MATT",0,0,0,1
"1314","Vestiges",5,6,1314,"combat","TALIESIN","that hits.",5340.292,5341.821,1.52899999999954,3,0.00196206671026874,1,"combat","TALIESIN",1,0,0,0
"1315","Vestiges",5,6,1315,"combat","MATT","you take 9 points of piercing damage. as the bolt just streaks you across the front of your torso. passes through, thankfully, but you do feel there is a wound that’s slowly turning warmer beneath your armor.",5341.835,5353.159,11.3239999999996,39,0.00344401271635476,1,"combat","MATT",0,0,0,1
"1316","Vestiges",5,6,1316,"combat","LAURA","can i shoot at the other one?",5353.159,5355.283,2.12400000000071,8,0.00376647834274828,1,"combat","LAURA",1,0,0,0
"1317","Vestiges",5,6,1317,"combat","MATT","that's been the round. now, you guys have been inspecting the door. the door is not magical. there is some sort of contraption that opens it from the inside.",5355.283,5361.789,6.5059999999994,31,0.00476483246234289,1,"combat","MATT",0,0,0,1
"1318","Vestiges",5,6,1318,"combat","LIAM","i’m getting my picks out, seeing if i can figure out some way to",5361.789,5365.497,3.70800000000054,15,0.00404530744336511,1,"combat","LIAM",1,0,0,0
"1319","Vestiges",5,6,1319,"combat","MATT","go ahead and make a check with your thieves’ tools.",5365.497,5369.369,3.87199999999939,11,0.00284090909090954,1,"combat","MATT",0,0,0,1
"1320","Vestiges",5,6,1320,"combat","LIAM","29.",5371.194,5372.504,1.30999999999949,2,0.0015267175572525,1,"combat","LIAM",1,0,0,0
"1321","Vestiges",5,6,1321,"combat","MATT","a 29. you take a second and you find that the contraption that holds this door in place definitely is on the other side. it's a series of winches and a chain pull. you find that there is one slight gap where you manage to hook one of the chains, pull it out ever so slightly, and you know with a strong yank from a strong person, you could probably pull it out from the outside.",5372.504,5391.168,18.6639999999998,78,0.00417916845263614,1,"combat","MATT",0,0,0,1
"1322","Vestiges",5,6,1322,"combat","ORION","grog!",5391.168,5393.175,2.00700000000052,2,0.000996512207274283,1,"combat","ORION",1,0,0,0
"1323","Vestiges",5,6,1323,"combat","LIAM","so this is the part where i ask grog over to pull. grog, grab this",5393.175,5396.064,2.88900000000012,15,0.00519210799584609,1,"combat","LIAM",1,0,0,0
"1324","Vestiges",5,6,1324,"combat","ASHLEY","i'll do it! i'll do it.",5396.064,5399.693,3.62899999999991,9,0.00248002204464046,1,"combat","ASHLEY",1,0,0,0
"1325","Vestiges",5,6,1325,"combat","TRAVIS","yeah, me and pike are on this.",5399.693,5403.18,3.48700000000008,8,0.00229423573272148,1,"combat","TRAVIS",1,0,0,0
"1326","Vestiges",5,6,1326,"combat","ASHLEY","i'll assist.",5403.18,5404.599,1.41899999999987,4,0.00281888653981703,1,"combat","ASHLEY",1,0,0,0
"1327","Vestiges",5,6,1327,"combat","MATT","grog, you reach over and grab the chain, and pike grabs onto the back of you and you both pull.",5404.599,5407.909,3.30999999999949,21,0.00634441087613391,1,"combat","MATT",0,0,0,1
"1328","Vestiges",5,6,1328,"combat","TRAVIS","give it a good heave-ho.",5407.909,5409.987,2.07800000000043,7,0.00336862367661143,1,"combat","TRAVIS",1,0,0,0
"1329","Vestiges",5,6,1329,"combat","MATT","go ahead and make a strength check with advantage.",5409.987,5412.242,2.25500000000011,10,0.00443458980044324,1,"combat","MATT",0,0,0,1
"1330","Vestiges",5,6,1330,"combat","TRAVIS","oh yeah, 23.",5414.47,5416.556,2.08599999999933,4,0.00191754554170723,1,"combat","TRAVIS",1,0,0,0
"1331","Vestiges",5,6,1331,"combat","MATT","23. as you pull, you hear the grinding of this chain against the stone, and you can see the actual door begin to rise upward this way.",5416.556,5424.874,8.31800000000021,28,0.00336619379658563,1,"combat","MATT",0,0,0,1
"1332","Vestiges",5,6,1332,"combat","SAM","it's a delorean.",5424.874,5427.298,2.42399999999998,5,0.00206270627062708,1,"combat","SAM",1,0,0,0
"1333","Vestiges",5,6,1333,"combat","MATT","essentially. when it opens up, it moves the magma out of the way. that's how this construct is used as an exit. it's what i mentioned before. this is supposed to be an exit for the royal individuals of the stronghold. it only opens part way, however, because the stone wall currently blocks the rest of its movement. however, you can still move through it.",5427.298,5446.788,19.4899999999998,68,0.00348896870189845,1,"combat","MATT",0,0,0,1
"1334","Vestiges",5,6,1334,"combat","LIAM","we can't leave this duergar behind though, we gotta take him out.",5446.788,5449.183,2.39500000000044,14,0.00584551148225363,1,"combat","LIAM",1,0,0,0
"1335","Vestiges",5,6,1335,"combat","MATT","yes, there is one duergar still there. so that's been all of your guys' actions. we're bringing it back. pike, you haven't gone yet.",5449.183,5456.095,6.91200000000026,28,0.00405092592592577,1,"combat","MATT",0,0,0,1
"1336","Vestiges",5,6,1336,"combat","ASHLEY","okay.",5456.095,5457.964,1.86899999999969,2,0.00107009095773159,1,"combat","ASHLEY",1,0,0,0
"1337","Vestiges",5,6,1337,"combat","MATT","keyleth you've gone, so the only one left to take an action is",5457.964,5463.25,5.28600000000006,14,0.00264850548618991,1,"combat","MATT",0,0,0,1
"1338","Vestiges",5,6,1338,"combat","MARISHA","tiberius, have you gone?",5463.25,5465.201,1.95100000000002,5,0.00256278831368526,1,"combat","MARISHA",1,0,0,0
"1339","Vestiges",5,6,1339,"combat","MATT","yeah, he checked the doorway.",5465.201,5467.197,1.99600000000009,6,0.00300601202404795,1,"combat","MATT",0,0,0,1
"1340","Vestiges",5,6,1340,"combat","MARISHA","oh right.",5467.197,5468.233,1.03600000000006,3,0.00289575289575273,1,"combat","MARISHA",1,0,0,0
"1341","Vestiges",5,6,1341,"combat","ASHLEY","where's he at?",5468.233,5469.609,1.3760000000002,5,0.00363372093023202,1,"combat","ASHLEY",1,0,0,0
"1342","Vestiges",5,6,1342,"combat","MATT","he's up on top of the wall, about 25 feet from you.",5469.609,5471.284,1.67499999999927,14,0.00835820895522751,1,"combat","MATT",0,0,0,1
"1343","Vestiges",5,6,1343,"combat","ASHLEY","i want to create a spiritual weapon, like a poisonous lasso, and and then put him down into the lava.",5471.284,5481.675,10.3910000000005,21,0.00202097969396583,1,"combat","ASHLEY",1,0,0,0
"1344","Vestiges",5,6,1344,"combat","MATT","huh. sure.",5481.675,5486.41,4.73499999999967,3,0.000633579725448829,1,"combat","MATT",0,0,0,1
"1345","Vestiges",5,6,1345,"combat","SAM","a lariat of truth?",5486.41,5488.565,2.15499999999975,5,0.00232018561484946,1,"combat","SAM",1,0,0,0
"1346","Vestiges",5,6,1346,"combat","TRAVIS","that's awesome.",5488.565,5490.123,1.55799999999999,4,0.00256739409499359,1,"combat","TRAVIS",1,0,0,0
"1347","Vestiges",5,6,1347,"combat","TALIESIN","well, all right then.",5490.123,5491.464,1.34100000000035,5,0.00372856077553967,1,"combat","TALIESIN",1,0,0,0
"1348","Vestiges",5,6,1348,"combat","MATT","so using your spiritual weapon, you take a moment, you grasp your sarenrae holy symbol around your neck, and as you pull your hand away from the symbol you see this glowing celestial rope extends out of nowhere. you begin to spin your fingers, and on its own, it begins to swirl and swirl. you then throw your hand forward and on its own, it cascades upward toward the edge of the wall. go ahead and roll an attack roll.",5491.464,5518.204,26.7399999999998,81,0.00302916978309651,1,"combat","MATT",0,0,0,1
"1349","Vestiges",5,6,1349,"combat","ASHLEY","an attack roll? which is?",5518.204,5520.588,2.38400000000001,6,0.00251677852348992,1,"combat","ASHLEY",1,0,0,0
"1350","Vestiges",5,6,1350,"combat","MATT","using your spell modifier as the attack bonus.",5520.588,5522.947,2.35900000000038,9,0.00381517592200024,1,"combat","MATT",0,0,0,1
"1351","Vestiges",5,6,1351,"combat","ASHLEY","10.",5529.719,5531.558,1.83899999999994,2,0.00108754758020667,1,"combat","ASHLEY",1,0,0,0
"1352","Vestiges",5,6,1352,"combat","SAM","ooh. that ain't gonna do it.",5531.558,5534.168,2.60999999999967,8,0.00306513409961724,1,"combat","SAM",1,0,0,0
"1353","Vestiges",5,6,1353,"combat","MATT","total of 10?",5534.168,5536.476,2.30799999999999,4,0.00173310225303293,1,"combat","MATT",0,0,0,1
"1354","Vestiges",5,6,1354,"combat","ASHLEY","i think so.",5536.476,5539.774,3.29800000000068,4,0.00121285627653098,1,"combat","ASHLEY",1,0,0,0
"1355","Vestiges",5,6,1355,"combat","MATT","what'd you roll?",5539.774,5541.14,1.36599999999999,5,0.00366032210834557,1,"combat","MATT",0,0,0,1
"1356","Vestiges",5,6,1356,"combat","ASHLEY","i rolled a 2, and then i have a plus 8.",5541.14,5544.45,3.30999999999949,12,0.00362537764350509,1,"combat","ASHLEY",1,0,0,0
"1357","Vestiges",5,6,1357,"combat","MATT","okay.",5544.45,5546.544,2.09400000000005,2,0.000955109837631304,1,"combat","MATT",0,0,0,1
"1358","Vestiges",5,6,1358,"combat","SAM","that ain't no good.",5546.544,5549.795,3.2510000000002,6,0.00184558597354649,1,"combat","SAM",1,0,0,0
"1359","Vestiges",5,6,1359,"combat","LIAM","it was a good idea though.",5549.795,5551.564,1.76900000000023,7,0.00395703787450485,1,"combat","LIAM",1,0,0,0
"1360","Vestiges",5,6,1360,"combat","LAURA","it was such a good idea.",5551.564,5553.135,1.57099999999991,7,0.00445576066199897,1,"combat","LAURA",1,0,0,0
"1361","Vestiges",5,6,1361,"combat","MATT","the celestial lasso, which you don't get the feeling poison is something you could really muster based on your deity's central good",5553.135,5558.803,5.66799999999967,24,0.00423429781227971,1,"combat","MATT",0,0,0,1
"1362","Vestiges",5,6,1362,"combat","ASHLEY","i was just kidding! i was just getting a little crazy with ideas.",5558.803,5562.369,3.5659999999998,14,0.00392596747055546,1,"combat","ASHLEY",1,0,0,0
"1363","Vestiges",5,6,1363,"combat","MATT","i like it. however, as it heads over the wall, you see it does not find purchase on the duergar. it instead finds purchase on part of the wall.",5562.369,5570.592,8.22299999999996,30,0.00364830353885445,1,"combat","MATT",0,0,0,1
"1364","Vestiges",5,6,1364,"combat","ASHLEY","fuck.",5570.592,5571.689,1.09700000000066,2,0.00182315405651668,1,"combat","ASHLEY",1,0,0,0
"1365","Vestiges",5,6,1365,"combat","TRAVIS","poisoning the wall effectively.",5571.689,5573.385,1.69599999999991,5,0.00294811320754732,1,"combat","TRAVIS",1,0,0,0
"1366","Vestiges",5,6,1366,"combat","MATT","yes, it is now a poisoned property.",5573.385,5576.139,2.75399999999991,8,0.00290486564996379,1,"combat","MATT",0,0,0,1
"1367","Vestiges",5,6,1367,"combat","ASHLEY","poisoning that wall, effectively. gosh dang it. that would have been cool.",5576.139,5578.34,2.20100000000002,13,0.00590640617900948,1,"combat","ASHLEY",1,0,0,0
"1368","Vestiges",5,6,1368,"combat","MATT","that would have been cool, unfortunate bad roll.",5578.34,5579.746,1.40599999999995,9,0.00640113798008558,1,"combat","MATT",0,0,0,1
"1369","Vestiges",5,6,1369,"combat","TRAVIS","it was going to be pretty cool.",5579.746,5580.989,1.24299999999948,8,0.0064360418342746,1,"combat","TRAVIS",1,0,0,0
"1370","Vestiges",5,6,1370,"combat","LIAM","remember it for the future though.",5580.989,5582.119,1.13000000000011,7,0.00619469026548613,1,"combat","LIAM",1,0,0,0
"1371","Vestiges",5,6,1371,"combat","MATT","that brings us to the top of the round order. i believe at the top we have",5582.119,5586.866,4.7470000000003,17,0.00358120918474804,1,"combat","MATT",0,0,0,1
"1372","Vestiges",5,6,1372,"combat","SAM","mister me?",5586.866,5588.153,1.28700000000026,3,0.00233100233100186,1,"combat","SAM",1,0,0,0
"1373","Vestiges",5,6,1373,"combat","MATT","yes, scanlan.",5588.153,5589.229,1.07600000000002,3,0.00278810408921927,1,"combat","MATT",0,0,0,1
"1374","Vestiges",5,6,1374,"combat","SAM","okay. boy, oh boy. we're still trying to get that fucker up on the roof right?",5589.229,5601.266,12.0369999999994,18,0.00149538921658229,1,"combat","SAM",1,0,0,0
"1375","Vestiges",5,6,1375,"combat","LIAM","yes, he's going to run and tell people.",5601.266,5602.629,1.36300000000028,10,0.0073367571533367,1,"combat","LIAM",1,0,0,0
"1376","Vestiges",5,6,1376,"combat","SAM","i've got almost nothing. so i'll just can i summon an unseen servant to push him?",5602.629,5616.696,14.067,19,0.00135067889386507,1,"combat","SAM",1,0,0,0
"1377","Vestiges",5,6,1377,"combat","MARISHA","oh yeah, that's a good idea.",5616.696,5619.524,2.82800000000043,8,0.0028288543140024,1,"combat","MARISHA",1,0,0,0
"1378","Vestiges",5,6,1378,"combat","MATT","we can give it a shot.",5619.524,5621.341,1.81700000000001,7,0.00385250412768298,1,"combat","MATT",0,0,0,1
"1379","Vestiges",5,6,1379,"combat","TRAVIS","roll high. roll really high.",5621.341,5623.768,2.42699999999968,6,0.00247218788627968,1,"combat","TRAVIS",1,0,0,0
"1380","Vestiges",5,6,1380,"combat","SAM","i don't have any ranged weapons.",5623.768,5625.672,1.90399999999954,8,0.00420168067226992,1,"combat","SAM",1,0,0,0
"1381","Vestiges",5,6,1381,"combat","LAURA","natural 20!",5625.672,5627.168,1.49600000000009,3,0.00200534759358276,1,"combat","LAURA",1,0,0,0
"1382","Vestiges",5,6,1382,"combat","MATT","so you conjure unseen servant. mark off your spell use.",5627.168,5629.556,2.38799999999992,11,0.00460636515912913,1,"combat","MATT",0,0,0,1
"1383","Vestiges",5,6,1383,"combat","ORION","i look up and go, “ooh, it's monty's cousin.”",5629.556,5632.076,2.52000000000044,12,0.00476190476190394,1,"combat","ORION",1,0,0,0
"1384","Vestiges",5,6,1384,"combat","MATT","you see a slight shimmer of ethereal energy behind the duergar. it's going to attempt to shove him. it isn't, unfortunately, on its own, extremely strong. it's mainly meant as an aide. however, it is possible. go ahead and make an athletics check. not your athletics, just make a d20 roll.",5632.076,5648.198,16.1220000000003,55,0.00341148740851005,1,"combat","MATT",0,0,0,1
"1385","Vestiges",5,6,1385,"combat","SAM","just a normal athletics.",5648.198,5649.99,1.79199999999946,5,0.00279017857142941,1,"combat","SAM",1,0,0,0
"1386","Vestiges",5,6,1386,"combat","LIAM","come on, 20.",5649.99,5651.114,1.1239999999998,4,0.00355871886121061,1,"combat","LIAM",1,0,0,0
"1387","Vestiges",5,6,1387,"combat","SAM","yeah, i mean it's a 5, so.",5651.114,5654.396,3.28200000000015,9,0.00274223034734905,1,"combat","SAM",1,0,0,0
"1388","Vestiges",5,6,1388,"combat","ASHLEY","what's your athletics? we're really rolling well tonight.",5654.396,5657.027,2.63100000000031,11,0.00418091980235602,1,"combat","ASHLEY",1,0,0,0
"1389","Vestiges",5,6,1389,"combat","MATT","you hear a sound as the duergar's armor is given a hefty slap, but no apparent force is placed upon its body.",5657.027,5664.201,7.17399999999998,24,0.00334541399498189,1,"combat","MATT",0,0,0,1
"1390","Vestiges",5,6,1390,"combat","ORION","a hefty slap.",5664.201,5665.779,1.57800000000043,4,0.00253485424588017,1,"combat","ORION",1,0,0,0
"1391","Vestiges",5,6,1391,"combat","SAM","thank you, jarvis!",5665.779,5668.837,3.05799999999999,4,0.0013080444735121,1,"combat","SAM",1,0,0,0
"1392","Vestiges",5,6,1392,"combat","SAM","but is he confused?",5668.837,5670.773,1.93599999999969,5,0.00258264462809958,1,"combat","SAM",1,0,0,0
"1393","Vestiges",5,6,1393,"combat","MATT","a little bit, but not enough to not be loading his crossbow for a second shot.",5670.773,5675.693,4.92000000000007,17,0.00345528455284548,1,"combat","MATT",0,0,0,1
"1394","Vestiges",5,6,1394,"combat","SAM","damn it!",5675.693,5677.268,1.57499999999982,3,0.00190476190476212,1,"combat","SAM",1,0,0,0
"1395","Vestiges",5,6,1395,"combat","MATT","good thinking on that point.",5677.268,5678.946,1.67799999999988,6,0.00357568533969036,1,"combat","MATT",0,0,0,1
"1396","Vestiges",5,6,1396,"combat","MARISHA","we're a party of 7 people just like, “aw, damn it, you!""",5678.946,5682.641,3.69499999999971,14,0.00378890392422222,1,"combat","MARISHA",1,0,0,0
"1397","Vestiges",5,6,1397,"combat","TALIESIN","like a cat in a tree, just -",5682.641,5686.71,4.06900000000041,8,0.00196608503317748,1,"combat","TALIESIN",1,0,0,0
"1398","Vestiges",5,6,1398,"combat","SAM","and i'm going to just give a little inspiration to vax. that's laura, obviously.",5686.71,5694.264,7.55400000000009,17,0.0022504633306857,1,"combat","SAM",1,0,0,0
"1399","Vestiges",5,6,1399,"combat","LAURA","yes, thank you.",5694.264,5695.514,1.25,4,0.0032,1,"combat","LAURA",1,0,0,0
"1400","Vestiges",5,6,1400,"combat","MARISHA","it inverted. that's what i always get mixed.",5695.514,5697.537,2.02300000000014,10,0.00494315373208073,1,"combat","MARISHA",1,0,0,0
"1401","Vestiges",5,6,1401,"combat","MATT","all right, a d8 inspiration die to you as scanlan hums a little tune under his breath.",5697.537,5699.624,2.08699999999953,18,0.00862482031624534,1,"combat","MATT",0,0,0,1
"1402","Vestiges",5,6,1402,"combat","LAURA","nice.",5699.624,5700.97,1.34600000000046,2,0.00148588410103961,1,"combat","LAURA",1,0,0,0
"1403","Vestiges",5,6,1403,"combat","LAURA","oh! i attack him.",5703.653,5705.622,1.96900000000005,5,0.00253936008125946,1,"combat","LAURA",1,0,0,0
"1404","Vestiges",5,6,1404,"combat","MATT","all right.",5705.622,5706.95,1.32799999999952,3,0.00225903614457913,1,"combat","MATT",0,0,0,1
"1405","Vestiges",5,6,1405,"combat","MARISHA","pew pew.",5706.95,5708.139,1.18900000000031,3,0.00252312867956201,1,"combat","MARISHA",1,0,0,0
"1406","Vestiges",5,6,1406,"combat","ASHLEY","pew pew!",5708.139,5709.398,1.25900000000001,3,0.00238284352660839,1,"combat","ASHLEY",1,0,0,0
"1407","Vestiges",5,6,1407,"combat","LAURA","it's good.",5710.127,5711.139,1.01199999999972,4,0.00395256916996158,1,"combat","LAURA",1,0,0,0
"1408","Vestiges",5,6,1408,"combat","LIAM","it's a 1.",5711.139,5712.188,1.04899999999998,5,0.00476644423260258,1,"combat","LIAM",1,0,0,0
"1409","Vestiges",5,6,1409,"combat","MARISHA","damn it! what is wrong with us?",5712.188,5713.707,1.51900000000023,8,0.00526662277814271,1,"combat","MARISHA",1,0,0,0
"1410","Vestiges",5,6,1410,"combat","TRAVIS","what in the hot and holy shit is happening right now?",5713.707,5715.271,1.5639999999994,12,0.00767263427110271,1,"combat","TRAVIS",1,0,0,0
"1411","Vestiges",5,6,1411,"combat","ASHLEY","what are we doing?",5715.271,5716.29,1.01900000000023,5,0.00490677134445423,1,"combat","ASHLEY",1,0,0,0
"1412","Vestiges",5,6,1412,"combat","LAURA","my first attack is a serious fail. my second attack, though, is a 25.",5716.29,5718.422,2.13199999999961,15,0.00703564727955102,1,"combat","LAURA",1,0,0,0
"1413","Vestiges",5,6,1413,"combat","MATT","that hits.",5718.422,5719.404,0.98200000000088,3,0.00305498981669787,1,"combat","MATT",0,0,0,1
"1414","Vestiges",5,6,1414,"combat","MARISHA","that's pretty cool.",5719.404,5720.405,1.00099999999929,5,0.00499500499500852,1,"combat","MARISHA",1,0,0,0
"1415","Vestiges",5,6,1415,"combat","MATT","so the first one you pull back, and as you pull back the actual arrow snaps.",5720.405,5723.367,2.96200000000044,17,0.0057393652937196,1,"combat","MATT",0,0,0,1
"1416","Vestiges",5,6,1416,"combat","LIAM","you almost shot me!",5723.367,5724.935,1.56800000000021,5,0.00318877551020365,1,"combat","LIAM",1,0,0,0
"1417","Vestiges",5,6,1417,"combat","LAURA","ow, that hurt my arm so bad.",5724.935,5726.777,1.84199999999964,8,0.00434310532030486,1,"combat","LAURA",1,0,0,0
"1418","Vestiges",5,6,1418,"combat","MATT","yeah, you're gonna have a little rash there probably tomorrow.",5726.777,5728.246,1.46900000000005,12,0.00816882232811408,1,"combat","MATT",0,0,0,1
"1419","Vestiges",5,6,1419,"combat","LAURA","great. 8.",5728.246,5730.816,2.56999999999971,3,0.00116731517509741,1,"combat","LAURA",1,0,0,0
"1420","Vestiges",5,6,1420,"combat","MATT","8 damage, all right. your second arrow manages to find its mark. as it sticks pretty close to where the first arrow hit, or where he was shot from the bad news. the duergar just shrugs it off angrily, and aims his crossbow from once on percy, now onto you.",5730.816,5748.7,17.884,51,0.00285171102661597,1,"combat","MATT",0,0,0,1
"1421","Vestiges",5,6,1421,"combat","LAURA","haha.",5748.7,5749.998,1.29799999999977,2,0.00154083204930689,1,"combat","LAURA",1,0,0,0
"1422","Vestiges",5,6,1422,"combat","MATT","it's getting its shot at you. that is a 17 versus armor class.",5749.998,5754.007,4.00900000000001,15,0.00374158144175604,1,"combat","MATT",0,0,0,1
"1423","Vestiges",5,6,1423,"combat","LAURA","nope.",5754.007,5754.915,0.908000000000357,2,0.0022026431718053,1,"combat","LAURA",1,0,0,0
"1424","Vestiges",5,6,1424,"combat","MATT","nope?",5754.915,5755.818,0.903000000000247,2,0.00221483942414114,1,"combat","MATT",0,0,0,1
