"","arc","arc_no","episode","turn_number","segment","actor","text","start_turn","end_turn","time_in_sec","word_count","words_per_ms","encounter_count","rp_combat","actor_guest","vox_machina","guest","staff","matt"
"582","Vestiges",5,6,582,"first_half_rp","MATT","okay, so as you walk up towards the arm to grab it, you have more of a view of what's happened. and what you see before you are definitely remnants of some battle long past.",3272.502,3281.895,9.39300000000003,37,0.00393910358777812,NA,"role_play","MATT",0,0,0,1
"583","Vestiges",5,6,583,"first_half_rp","LAURA","this is the skelly pile.",3281.895,3283.66,1.76499999999987,6,0.00339943342776229,NA,"role_play","LAURA",1,0,0,0
"584","Vestiges",5,6,584,"first_half_rp","MATT","against these rocky formations there's dried blood everywhere.",3283.66,3285.554,1.89400000000023,10,0.0052798310454059,NA,"role_play","MATT",0,0,0,1
"585","Vestiges",5,6,585,"first_half_rp","LIAM","not pretty.",3285.554,3286.52,0.965999999999894,3,0.00310559006211214,NA,"role_play","LIAM",1,0,0,0
"586","Vestiges",5,6,586,"first_half_rp","MATT","this terrible bloodbath, whatever this event was, it was probably a horrible thing to see. there are pieces of duergar flung about. and i say pieces the only reason you know duergar were there is because occasionally you see part of a head, or part of a foot. and you recognize the ashy skin from the areas that aren't currently caked with its own gore.",3286.52,3305.219,18.6990000000001,67,0.00358307930905395,NA,"role_play","MATT",0,0,0,1
"587","Vestiges",5,6,587,"first_half_rp","MATT","from what you can tell, because of your investigation check, the remains are torn apart by no blade. there's no cuts, there's no clean wounds. they're either pulled apart by force",3308.381,3325.212,16.8310000000001,34,0.00202008199156317,NA,"role_play","MATT",0,0,0,1
"588","Vestiges",5,6,588,"first_half_rp","TRAVIS","yeah.",3325.212,3326.549,1.33699999999999,2,0.00149588631264025,NA,"role_play","TRAVIS",1,0,0,0
"589","Vestiges",5,6,589,"first_half_rp","MATT","like, arms and limbs were wrenched from the body just out of sheer power.",3326.549,3330.435,3.88599999999997,15,0.00386001029336081,NA,"role_play","MATT",0,0,0,1
"590","Vestiges",5,6,590,"first_half_rp","TRAVIS","like a wookiee.",3330.435,3331.839,1.404,4,0.00284900284900286,NA,"role_play","TRAVIS",1,0,0,0
"591","Vestiges",5,6,591,"first_half_rp","MATT","or there appears to be some sort of gnawing, some chewing, like toothy fangs, sharp teeth have partially eaten portions of these bodies.",3331.839,3341.143,9.30400000000009,24,0.00257953568357693,NA,"role_play","MATT",0,0,0,1
"592","Vestiges",5,6,592,"first_half_rp","LIAM","this is the work of a beaver.",3341.143,3343.062,1.91899999999987,8,0.00416883793642551,NA,"role_play","LIAM",1,0,0,0
"593","Vestiges",5,6,593,"first_half_rp","LAURA","yes, definitely, a very large beaver.",3343.062,3344.555,1.49299999999994,7,0.00468854655056952,NA,"role_play","LAURA",1,0,0,0
"594","Vestiges",5,6,594,"first_half_rp","ORION","a busy beaver.",3344.555,3346.026,1.471,4,0.0027192386131883,NA,"role_play","ORION",1,0,0,0
"595","Vestiges",5,6,595,"first_half_rp","SAM","i think it's suicide.",3346.026,3349.759,3.73300000000017,6,0.00160728636485393,NA,"role_play","SAM",1,0,0,0
"596","Vestiges",5,6,596,"first_half_rp","LAURA","based on tracking and everything and insight, can we tell if that creature is anywhere nearby? or if it's gone?",3349.759,3356.376,6.61700000000019,22,0.00332476953302091,NA,"role_play","LAURA",1,0,0,0
"597","Vestiges",5,6,597,"first_half_rp","ORION","i think it might be foul play, actually.",3356.376,3357.714,1.33799999999974,9,0.00672645739910446,NA,"role_play","ORION",1,0,0,0
"598","Vestiges",5,6,598,"first_half_rp","MATT","from what you can tell",3357.714,3359.067,1.35300000000007,5,0.00369549150036937,NA,"role_play","MATT",0,0,0,1
"599","Vestiges",5,6,599,"first_half_rp","LIAM","it happened in the past.",3359.067,3360.278,1.21099999999979,6,0.00495458298926595,NA,"role_play","LIAM",1,0,0,0
"600","Vestiges",5,6,600,"first_half_rp","MATT","yeah, it happened quite some time ago. looking at the tracks, you can see duergar feet, you can see other creatures that resemble those hook horrors that you encountered earlier during the lava pool. however, there's a series of tracks that you haven't seen. well, there is very erratic footsteps that look human size, but they seem to be placed randomly, like one foot here, one foot here, one foot here.",3360.278,3385.111,24.8330000000001,74,0.00297990577054725,NA,"role_play","MATT",0,0,0,1
"601","Vestiges",5,6,601,"first_half_rp","LAURA","it's that big creature that it was like one of those things that that thing put together, like",3385.111,3388.965,3.85400000000027,19,0.0049299429164501,NA,"role_play","LAURA",1,0,0,0
"602","Vestiges",5,6,602,"first_half_rp","MATT","and you see what seem like strange strikes through the sand, like someone had been dragged very quickly in a very localized spot, scattered all about.",3388.965,3398.319,9.35399999999981,27,0.00288646568313027,NA,"role_play","MATT",0,0,0,1
"603","Vestiges",5,6,603,"first_half_rp","LIAM","it's a human centipede.",3398.319,3400.698,2.37899999999991,6,0.00252206809583869,NA,"role_play","LIAM",1,0,0,0
"604","Vestiges",5,6,604,"first_half_rp","SAM","it is. it's a human centipede.",3400.698,3402.572,1.87400000000025,8,0.00426894343649889,NA,"role_play","SAM",1,0,0,0
"605","Vestiges",5,6,605,"first_half_rp","MATT","it's a very strange pattern that you can't really grasp what kind of creature would make it.",3402.572,3407.455,4.88299999999981,20,0.00409584271963972,NA,"role_play","MATT",0,0,0,1
"606","Vestiges",5,6,606,"first_half_rp","LAURA","and it seems like it was here recently, or a while ago?",3407.455,3410.771,3.31600000000026,13,0.00392038600723733,NA,"role_play","LAURA",1,0,0,0
"607","Vestiges",5,6,607,"first_half_rp","MATT","best you can tell, the last time it was here was about two or three days ago, to feast on more of the remains.",3410.771,3417.221,6.44999999999982,25,0.00387596899224817,NA,"role_play","MATT",0,0,0,1
"608","Vestiges",5,6,608,"first_half_rp","LIAM","human? human footprints?",3417.221,3418.73,1.50900000000001,4,0.00265076209410203,NA,"role_play","LIAM",1,0,0,0
"609","Vestiges",5,6,609,"first_half_rp","LAURA","should we get out of here?",3418.73,3419.818,1.08800000000019,7,0.00643382352941062,NA,"role_play","LAURA",1,0,0,0
"610","Vestiges",5,6,610,"first_half_rp","MATT","human sized.",3419.818,3420.735,0.916999999999916,3,0.00327153762268296,NA,"role_play","MATT",0,0,0,1
"611","Vestiges",5,6,611,"first_half_rp","LIAM","human sized.",3420.735,3421.6,0.864999999999782,3,0.00346820809248642,NA,"role_play","LIAM",1,0,0,0
"612","Vestiges",5,6,612,"first_half_rp","TRAVIS","or set a trap.",3421.6,3422.674,1.07400000000007,5,0.00465549348230882,NA,"role_play","TRAVIS",1,0,0,0
"613","Vestiges",5,6,613,"first_half_rp","LAURA","we could try to set a trap, or we could look and see if we can loot anything? is there anything to loot? does it look like anything shiny?",3422.674,3431.639,8.96500000000015,30,0.00334634690462906,NA,"role_play","LAURA",1,0,0,0
"614","Vestiges",5,6,614,"first_half_rp","MATT","any semblance of armor that belonged to any of these individuals is in such tatters that it's unusable. you do manage to find, across some of the body parts, a couple of blood-soaked gold coin purses.",3431.639,3447.67,16.0309999999999,39,0.00243278647620237,NA,"role_play","MATT",0,0,0,1
"615","Vestiges",5,6,615,"first_half_rp","LAURA","okay.",3447.67,3448.655,0.985000000000127,2,0.00203045685279162,NA,"role_play","LAURA",1,0,0,0
"616","Vestiges",5,6,616,"first_half_rp","MARISHA","take it.",3448.655,3451.071,2.41599999999971,3,0.00124172185430478,NA,"role_play","MARISHA",1,0,0,0
"617","Vestiges",5,6,617,"first_half_rp","MATT","one of them contains a handful of gems.",3451.071,3453.002,1.93100000000004,9,0.00466079751424123,NA,"role_play","MATT",0,0,0,1
"618","Vestiges",5,6,618,"first_half_rp","LAURA","ooh!",3453.002,3454.081,1.07900000000018,2,0.00185356811862805,NA,"role_play","LAURA",1,0,0,0
"619","Vestiges",5,6,619,"first_half_rp","MARISHA","gems.",3454.081,3455.661,1.57999999999993,2,0.00126582278481018,NA,"role_play","MARISHA",1,0,0,0
"620","Vestiges",5,6,620,"first_half_rp","MATT","yes, those right there. so you can mark that down, until you get a chance to appraise them.",3455.661,3462.424,6.76299999999992,19,0.00280940411060184,NA,"role_play","MATT",0,0,0,1
"621","Vestiges",5,6,621,"first_half_rp","LIAM","i don't think we want to tangle with this. what are we trying to prove? let's just keep trucking.",3462.424,3467.414,4.99000000000024,22,0.00440881763527033,NA,"role_play","LIAM",1,0,0,0
"622","Vestiges",5,6,622,"first_half_rp","SAM","i'm really bad at stealthing, we should go.",3467.414,3471.463,4.04899999999998,10,0.00246974561620154,NA,"role_play","SAM",1,0,0,0
"623","Vestiges",5,6,623,"first_half_rp","SAM","we should leave.",3471.463,3472.823,1.35999999999967,4,0.00294117647058894,NA,"role_play","SAM",1,0,0,0
"624","Vestiges",5,6,624,"first_half_rp","LIAM","also, put the accordion back in the bag, all right?",3472.823,3475.251,2.42800000000034,11,0.00453047775947219,NA,"role_play","LIAM",1,0,0,0
"625","Vestiges",5,6,625,"first_half_rp","SAM","was i doing that? it's force of habit, i don't it's like breathing.",3475.251,3480.911,5.65999999999985,17,0.00300353356890467,NA,"role_play","SAM",1,0,0,0
"626","Vestiges",5,6,626,"first_half_rp","LIAM","yeah, we're going to go back to the group, i'm going to bring the arm.",3480.911,3483.832,2.92099999999982,18,0.00616227319411198,NA,"role_play","LIAM",1,0,0,0
"627","Vestiges",5,6,627,"first_half_rp","TRAVIS","i take out the cask of ale and pour a little tankard of ale, just because i'm bored.",3483.832,3488.868,5.03600000000006,20,0.00397140587768065,NA,"role_play","TRAVIS",1,0,0,0
"628","Vestiges",5,6,628,"first_half_rp","ASHLEY","have a sip sip.",3488.868,3490.037,1.16899999999987,5,0.0042771599657832,NA,"role_play","ASHLEY",1,0,0,0
"629","Vestiges",5,6,629,"first_half_rp","MATT","good man. well done. it's very tasty.",3490.037,3491.881,1.84400000000005,9,0.00488069414316689,NA,"role_play","MATT",0,0,0,1
"630","Vestiges",5,6,630,"first_half_rp","TRAVIS","would anyone else like a sip? keyleth?",3491.881,3495.047,3.16600000000017,8,0.00252684775742248,NA,"role_play","TRAVIS",1,0,0,0
"631","Vestiges",5,6,631,"first_half_rp","MATT","having been underground for what probably amounts now to four or five days, that little taste of ale on your lips is a very welcoming and very refreshing sensation.",3495.047,3502.865,7.81799999999976,30,0.00383729854182667,NA,"role_play","MATT",0,0,0,1
"632","Vestiges",5,6,632,"first_half_rp","TRAVIS","it's good shit, right?",3502.865,3505.056,2.19100000000026,6,0.00273847558192574,NA,"role_play","TRAVIS",1,0,0,0
"633","Vestiges",5,6,633,"first_half_rp","ASHLEY","oh, delicious. oh no, i'm drunk! just kidding.",3505.056,3508.494,3.4380000000001,10,0.00290866783013371,NA,"role_play","ASHLEY",1,0,0,0
"634","Vestiges",5,6,634,"first_half_rp","ASHLEY","that was fast! just kidding.",3508.494,3510.837,2.34299999999985,6,0.00256081946222808,NA,"role_play","ASHLEY",1,0,0,0
"635","Vestiges",5,6,635,"first_half_rp","LIAM","when we get back to the group, i'm going to toss the arm to grog.",3510.837,3513.249,2.41199999999981,17,0.00704809286898896,NA,"role_play","LIAM",1,0,0,0
"636","Vestiges",5,6,636,"first_half_rp","MATT","grog, you instinctively reach up and catch it. you look down and see what looks like a duergar arm that has been very heavily mangled.",3513.249,3518.141,4.89200000000028,26,0.0053147996729351,NA,"role_play","MATT",0,0,0,1
"637","Vestiges",5,6,637,"first_half_rp","TRAVIS","oh! thanks for the hand!",3518.141,3522.239,4.09799999999996,6,0.00146412884333823,NA,"role_play","TRAVIS",1,0,0,0
"638","Vestiges",5,6,638,"first_half_rp","LIAM","it's a back scratcher.",3522.239,3523.596,1.35699999999997,6,0.00442151805453215,NA,"role_play","LIAM",1,0,0,0
"639","Vestiges",5,6,639,"first_half_rp","ORION","that was clever, grog!",3523.596,3524.859,1.26299999999992,5,0.00395882818685694,NA,"role_play","ORION",1,0,0,0
"640","Vestiges",5,6,640,"first_half_rp","LAURA","well, we killed a lot of duergar this time.",3524.859,3526.049,1.19000000000005,10,0.00840336134453743,NA,"role_play","LAURA",1,0,0,0
"641","Vestiges",5,6,641,"first_half_rp","TRAVIS","don't negative anything. it was a good joke.",3526.049,3528.453,2.404,10,0.00415973377703828,NA,"role_play","TRAVIS",1,0,0,0
"642","Vestiges",5,6,642,"first_half_rp","MATT","it was a good joke. i considered it, but no.",3528.453,3530.645,2.19200000000001,11,0.00501824817518247,NA,"role_play","MATT",0,0,0,1
"643","Vestiges",5,6,643,"first_half_rp","TRAVIS","have mercy!",3530.645,3531.714,1.06899999999996,3,0.00280636108512639,NA,"role_play","TRAVIS",1,0,0,0
"644","Vestiges",5,6,644,"first_half_rp","ORION","that was a good joke.",3531.714,3533.615,1.90099999999984,6,0.0031562335612838,NA,"role_play","ORION",1,0,0,0
"645","Vestiges",5,6,645,"first_half_rp","LAURA","there's a big centipede-y human, creepy creature that's killed a lot of things and we should probably avoid that at all costs.",3533.615,3539.994,6.37900000000036,26,0.00407587396143573,NA,"role_play","LAURA",1,0,0,0
"646","Vestiges",5,6,646,"first_half_rp","ORION","i would agree with that.",3539.994,3541.337,1.34299999999985,6,0.00446760982874213,NA,"role_play","ORION",1,0,0,0
"647","Vestiges",5,6,647,"first_half_rp","LIAM","if we have to, we will, but",3541.337,3542.641,1.30400000000009,7,0.00536809815950884,NA,"role_play","LIAM",1,0,0,0
"648","Vestiges",5,6,648,"first_half_rp","TALIESIN","that seems fair.",3542.641,3543.975,1.33399999999983,4,0.00299850074962556,NA,"role_play","TALIESIN",1,0,0,0
"649","Vestiges",5,6,649,"first_half_rp","LAURA","can we avoid that and still head left of the keep?",3543.975,3547.059,3.08400000000029,12,0.00389105058365723,NA,"role_play","LAURA",1,0,0,0
"650","Vestiges",5,6,650,"first_half_rp","MATT","you haven't seen a creature.",3547.059,3548.551,1.49199999999973,7,0.00469168900804373,NA,"role_play","MATT",0,0,0,1
"651","Vestiges",5,6,651,"first_half_rp","SAM","wait, we didn't make it into the was there a structure that we could have entered?",3548.551,3552.176,3.625,18,0.00496551724137931,NA,"role_play","SAM",1,0,0,0
"652","Vestiges",5,6,652,"first_half_rp","LAURA","that's where we're going.",3552.176,3553.295,1.11900000000014,7,0.0062555853440564,NA,"role_play","LAURA",1,0,0,0
"653","Vestiges",5,6,653,"first_half_rp","LIAM AND MATT","you're heading towards that structure.",3553.295,3554.742,1.44700000000012,7,0.00483759502418759,NA,"role_play","LIAM AND MATT",1,0,0,0
"654","Vestiges",5,6,654,"first_half_rp","SAM","okay. but i mean, where we just were?",3554.742,3555.973,1.23099999999977,9,0.00731112916328327,NA,"role_play","SAM",1,0,0,0
"655","Vestiges",5,6,655,"first_half_rp","ORION","the magma fortress.",3555.973,3557.04,1.06700000000001,4,0.00374882849109651,NA,"role_play","ORION",1,0,0,0
"656","Vestiges",5,6,656,"first_half_rp","MATT","where you just were? no, there's just all these giant rocky spires jutting out of the ground.",3557.04,3559.774,2.73399999999992,19,0.00694952450621819,NA,"role_play","MATT",0,0,0,1
"657","Vestiges",5,6,657,"first_half_rp","LIAM","spike coated in dried blood.",3559.774,3561.025,1.2510000000002,6,0.00479616306954358,NA,"role_play","LIAM",1,0,0,0
"658","Vestiges",5,6,658,"first_half_rp","SAM","they didn't have doors in them?",3561.025,3562.195,1.17000000000007,8,0.00683760683760641,NA,"role_play","SAM",1,0,0,0
"659","Vestiges",5,6,659,"first_half_rp","LAURA","should we probably have looked for like a nest?",3562.195,3563.427,1.23199999999997,10,0.00811688311688331,NA,"role_play","LAURA",1,0,0,0
"660","Vestiges",5,6,660,"first_half_rp","MATT","there were no doors.",3563.427,3564.262,0.835000000000036,5,0.00598802395209555,NA,"role_play","MATT",0,0,0,1
"661","Vestiges",5,6,661,"first_half_rp","SAM","okay, good. i'm looking for a door!",3564.262,3565.241,0.978999999999814,9,0.0091930541368761,NA,"role_play","SAM",1,0,0,0
"662","Vestiges",5,6,662,"first_half_rp","LIAM","no, we should just keep going. if we're going to run into it, we're going to run into it. let's not find it.",3565.241,3568.566,3.32499999999982,27,0.00812030075188014,NA,"role_play","LIAM",1,0,0,0
"663","Vestiges",5,6,663,"first_half_rp","LAURA","yeah.",3568.566,3569.688,1.1220000000003,2,0.00178253119429543,NA,"role_play","LAURA",1,0,0,0
"664","Vestiges",5,6,664,"first_half_rp","MATT","it appears like there was, at one point in time, some very intense seismic activity in this area that created this cavern, and whatever is the source of a lot of this perpetually flowing, molten rock. that's why the entire terrain here is so dangerous and uninviting, is because of the sheer force that went into its creation.",3569.688,3585.726,16.038,60,0.00374111485222596,NA,"role_play","MATT",0,0,0,1
"665","Vestiges",5,6,665,"first_half_rp","SAM","okay.",3585.726,3586.653,0.92699999999968,2,0.00215749730312912,NA,"role_play","SAM",1,0,0,0
"666","Vestiges",5,6,666,"first_half_rp","LAURA","so we should just keep freaking being careful and keep going towards the giant thing.",3586.653,3589.752,3.09900000000016,16,0.00516295579219076,NA,"role_play","LAURA",1,0,0,0
"667","Vestiges",5,6,667,"first_half_rp","SAM","okay. let's go.",3589.752,3590.715,0.963000000000193,5,0.00519210799584527,NA,"role_play","SAM",1,0,0,0
"668","Vestiges",5,6,668,"first_half_rp","ASHLEY","keep trucking on.",3590.715,3591.63,0.914999999999964,4,0.00437158469945373,NA,"role_play","ASHLEY",1,0,0,0
"669","Vestiges",5,6,669,"first_half_rp","SAM","pike, i have this weird feeling, like you wanted to make out with me. is that something that happened? am i dreaming?",3591.63,3599.325,7.69499999999971,23,0.00298895386614696,NA,"role_play","SAM",1,0,0,0
"670","Vestiges",5,6,670,"first_half_rp","ASHLEY","well, you just, you know, you weren't paying attention.",3599.325,3602.189,2.86400000000003,11,0.00384078212290498,NA,"role_play","ASHLEY",1,0,0,0
"671","Vestiges",5,6,671,"first_half_rp","SAM","really?",3602.189,3603.372,1.18299999999999,2,0.00169061707523247,NA,"role_play","SAM",1,0,0,0
"672","Vestiges",5,6,672,"first_half_rp","LAURA","and that makes you want to make out with him?",3603.372,3604.903,1.53099999999995,11,0.00718484650555217,NA,"role_play","LAURA",1,0,0,0
"673","Vestiges",5,6,673,"first_half_rp","ASHLEY","no, i think you were moving along to try to go stealth and sometimes you should just stay put and see what happens.",3604.903,3613.476,8.57300000000032,24,0.00279948676076042,NA,"role_play","ASHLEY",1,0,0,0
"674","Vestiges",5,6,674,"first_half_rp","ORION","well said, cleric!",3613.476,3616.209,2.73299999999972,4,0.00146359312111248,NA,"role_play","ORION",1,0,0,0
"675","Vestiges",5,6,675,"first_half_rp","LIAM","that was the most adorable diss in history.",3616.209,3621.083,4.87400000000025,9,0.00184653262207623,NA,"role_play","LIAM",1,0,0,0
"676","Vestiges",5,6,676,"first_half_rp","TALIESIN","that was cold.",3621.083,3622.124,1.04099999999971,4,0.00384245917387234,NA,"role_play","TALIESIN",1,0,0,0
"677","Vestiges",5,6,677,"first_half_rp","SAM","all right.",3622.124,3623.287,1.16300000000001,3,0.00257953568357693,NA,"role_play","SAM",1,0,0,0
"678","Vestiges",5,6,678,"first_half_rp","ORION","yet inviting.",3623.287,3624.298,1.01099999999997,3,0.0029673590504452,NA,"role_play","ORION",1,0,0,0
"679","Vestiges",5,6,679,"first_half_rp","TRAVIS","it's all right, scanlan. we'll go pay for it later.",3624.298,3628.428,4.13000000000011,13,0.00314769975786917,NA,"role_play","TRAVIS",1,0,0,0
"680","Vestiges",5,6,680,"first_half_rp","MATT","a small hit to scanlan's morale, but the party marches on.",3628.428,3633.415,4.98700000000008,13,0.00260677762181668,NA,"role_play","MATT",0,0,0,1
"681","Vestiges",5,6,681,"first_half_rp","LIAM","you lose an inspiration die.",3633.415,3636.256,2.84099999999989,6,0.0021119324181627,NA,"role_play","LIAM",1,0,0,0
"682","Vestiges",5,6,682,"first_half_rp","TRAVIS","disadvantage on whatever roll.",3636.256,3638.731,2.47500000000036,5,0.00202020202020172,NA,"role_play","TRAVIS",1,0,0,0
"683","Vestiges",5,6,683,"first_half_rp","SAM","i deserved it, i deserved it.",3640.291,3641.701,1.40999999999985,7,0.00496453900709271,NA,"role_play","SAM",1,0,0,0
"684","Vestiges",5,6,684,"first_half_rp","LIAM","okay, twins in front, here we go.",3641.701,3643.737,2.03600000000006,8,0.00392927308447926,NA,"role_play","LIAM",1,0,0,0
"685","Vestiges",5,6,685,"first_half_rp","LAURA","let's keep going.",3643.737,3644.654,0.916999999999916,5,0.0054525627044716,NA,"role_play","LAURA",1,0,0,0
"686","Vestiges",5,6,686,"first_half_rp","MATT","twins in front. you guys continue to push forward. for the sake of the length of this journey, i'm going to have the party go ahead and roll a communal stealth check once more.",3644.654,3652.51,7.85600000000022,36,0.00458248472505079,NA,"role_play","MATT",0,0,0,1
"687","Vestiges",5,6,687,"first_half_rp","MARISHA","i still have pass without a trace up.",3653.893,3655.395,1.50199999999995,9,0.00599201065246357,NA,"role_play","MARISHA",1,0,0,0
"688","Vestiges",5,6,688,"first_half_rp","TALIESIN","oh, for the love of god.",3655.395,3656.704,1.3090000000002,7,0.0053475935828869,NA,"role_play","TALIESIN",1,0,0,0
"689","Vestiges",5,6,689,"first_half_rp","MARISHA","which gives everyone a plus 10.",3656.704,3658.181,1.47699999999986,7,0.00473933649289144,NA,"role_play","MARISHA",1,0,0,0
"690","Vestiges",5,6,690,"first_half_rp","LAURA","oh, really?!",3658.181,3659.595,1.41399999999976,3,0.00212164073550248,NA,"role_play","LAURA",1,0,0,0
"691","Vestiges",5,6,691,"first_half_rp","MATT","yes.",3659.595,3660.691,1.096,2,0.00182481751824817,NA,"role_play","MATT",0,0,0,1
"692","Vestiges",5,6,692,"first_half_rp","LIAM","percy! don't bang the guns together.",3660.691,3661.767,1.07600000000002,8,0.00743494423791807,NA,"role_play","LIAM",1,0,0,0
"693","Vestiges",5,6,693,"first_half_rp","TALIESIN","yeah, that happened too.",3661.767,3663.148,1.38100000000031,5,0.00362056480810925,NA,"role_play","TALIESIN",1,0,0,0
"694","Vestiges",5,6,694,"first_half_rp","ORION","24.",3663.148,3664.006,0.85799999999972,2,0.00233100233100309,NA,"role_play","ORION",1,0,0,0
"695","Vestiges",5,6,695,"first_half_rp","MATT","24?",3664.006,3664.733,0.727000000000317,2,0.00275103163686263,NA,"role_play","MATT",0,0,0,1
"696","Vestiges",5,6,696,"first_half_rp","SAM","19.",3664.733,3665.478,0.744999999999891,2,0.00268456375838965,NA,"role_play","SAM",1,0,0,0
"697","Vestiges",5,6,697,"first_half_rp","LIAM","we all have plus 10?",3665.478,3666.306,0.827999999999975,6,0.00724637681159443,NA,"role_play","LIAM",1,0,0,0
"698","Vestiges",5,6,698,"first_half_rp","MATT","yes.",3666.306,3666.937,0.630999999999858,2,0.00316957210776616,NA,"role_play","MATT",0,0,0,1
"699","Vestiges",5,6,699,"first_half_rp","LAURA","and this is plus 10, already?",3666.937,3667.634,0.697000000000116,7,0.010043041606885,NA,"role_play","LAURA",1,0,0,0
"700","Vestiges",5,6,700,"first_half_rp","SAM","yes.",3667.634,3668.389,0.755000000000109,2,0.00264900662251617,NA,"role_play","SAM",1,0,0,0
"701","Vestiges",5,6,701,"first_half_rp","TALIESIN","i rolled a 1.",3668.389,3669.437,1.04799999999977,5,0.00477099236641324,NA,"role_play","TALIESIN",1,0,0,0
"702","Vestiges",5,6,702,"first_half_rp","MATT","okay.",3669.437,3671.928,2.49099999999999,2,0.000802890405459659,NA,"role_play","MATT",0,0,0,1
"703","Vestiges",5,6,703,"first_half_rp","LAURA","oh, percy!",3671.928,3672.658,0.730000000000018,3,0.00410958904109579,NA,"role_play","LAURA",1,0,0,0
"704","Vestiges",5,6,704,"first_half_rp","SAM","i kiss percy!",3672.658,3675.069,2.41100000000006,4,0.00165906262961423,NA,"role_play","SAM",1,0,0,0
"705","Vestiges",5,6,705,"first_half_rp","TALIESIN","what?! ah!",3675.069,3676.799,1.73000000000002,3,0.00173410404624276,NA,"role_play","TALIESIN",1,0,0,0
"706","Vestiges",5,6,706,"first_half_rp","SAM","i don’t know! i thought it might help.",3676.799,3679.399,2.59999999999991,10,0.00384615384615398,NA,"role_play","SAM",1,0,0,0
"707","Vestiges",5,6,707,"first_half_rp","ORION","you have to use the tongue, scanlan.",3679.399,3681.527,2.12800000000016,8,0.00375939849624033,NA,"role_play","ORION",1,0,0,0
"708","Vestiges",5,6,708,"first_half_rp","MARISHA","23.",3681.527,3682.895,1.36799999999994,2,0.00146198830409363,NA,"role_play","MARISHA",1,0,0,0
"709","Vestiges",5,6,709,"first_half_rp","SAM","is that bubblegum?",3682.895,3684.404,1.50900000000001,4,0.00265076209410203,NA,"role_play","SAM",1,0,0,0
"710","Vestiges",5,6,710,"first_half_rp","MATT","okay. grog?",3684.404,3685.186,0.782000000000153,3,0.00383631713554912,NA,"role_play","MATT",0,0,0,1
"711","Vestiges",5,6,711,"first_half_rp","TRAVIS","26.",3685.186,3685.838,0.652000000000044,2,0.00306748466257648,NA,"role_play","TRAVIS",1,0,0,0
"712","Vestiges",5,6,712,"first_half_rp","ASHLEY","3.",3685.838,3686.79,0.951999999999771,2,0.00210084033613496,NA,"role_play","ASHLEY",1,0,0,0
"713","Vestiges",5,6,713,"first_half_rp","TALIESIN","i have a habit.",3686.79,3688.121,1.33100000000013,5,0.00375657400450752,NA,"role_play","TALIESIN",1,0,0,0
"714","Vestiges",5,6,714,"first_half_rp","LAURA","you have a plus 10.",3688.121,3689.03,0.909000000000106,6,0.00660066006600583,NA,"role_play","LAURA",1,0,0,0
"715","Vestiges",5,6,715,"first_half_rp","ASHLEY","oh! i get to do plus 10 bonus to that?",3689.03,3689.972,0.942000000000007,11,0.0116772823779192,NA,"role_play","ASHLEY",1,0,0,0
"716","Vestiges",5,6,716,"first_half_rp","ASHLEY","13!",3689.972,3690.972,1,2,0.002,NA,"role_play","ASHLEY",1,0,0,0
"717","Vestiges",5,6,717,"first_half_rp","MATT","all right, so that's three failures.",3690.972,3691.933,0.960999999999785,8,0.0083246618106158,NA,"role_play","MATT",0,0,0,1
