"","arc","arc_no","episode","turn_number","segment","actor","text","start_turn","end_turn","time_in_sec","word_count","words_per_ms","encounter_count","rp_combat","actor_guest","vox_machina","guest","staff","matt"
"1","Vestiges",5,6,1,"proglog","MATT","hello everyone! welcome to critical role tonight! we have some interesting adventurous points to go over. we're also coming off international tabletop day, which we had a great time. met a lot of the wonderful fans, one of which had created their own t-shirt of our group and inspired us to do the same! so you'll see a bunch of us wearing our fantastic, full assortment of critical role party member t-shirts tonight. just for fun. in the meantime, let’s go ahead and get this started, as we all have the chance to warm up with character backgrounds and maybe a little surprise. so be back here in a few minutes, guys!",0.244,71.239,70.995,118,0.00166208887949856,NA,NA,"MATT",0,0,0,1
"2","Vestiges",5,6,2,"proglog","ASHLEY","pike grew up in the outskirts of town, near the bramblewood. her ancestors were a family of deep gnomes with quite an unfavorable reputation. thievery, destruction, and trickery left them with the curse of the last name trickfoot. sarenrae, the goddess of healing and redemption, had other plans for pike's great-great-grandfather, wilhand, who left his family at a young age after a dream. a dream that changed the course of the trickfoot family. wilhand devoted his life to sarenrae and pledged from then on that him and his family would live a life of service and devotion. as a child, pike seemed to have an affinity to heal. whether it was animals, people, or even flowers, she felt she had a purpose in making things whole that had once been broken. she studied and learned the ways to heal through divine magic. she lived a peaceful life, quiet and simple, until one day, wilhand was captured and almost killed by a group of goliath barbarians. one of the goliaths took a stand against the murder of the innocent gnome and he himself was beaten, bloodied, and left for dead, abandoned by his herd. wilhand went to pike for help. she prayed and healed this barbarian as best she could, bringing him back to life. when he awoke, she discovered his name was grog strongjaw. after that, they were best of friends, a rather unlikely pair. little did she know that in a few years' time grog would soon return the favor and bring her back from the clutches of death. after being killed in battle, pike felt angry. she wanted to be stronger so that it would never happen again. she spent four months at sea training with the men and women aboard a ship called the broken howl. gripping her holy symbol in one hand, and her morningstar in the other, this time, pike is ready.",102.533,223.145,120.612,321,0.00266142672370908,NA,NA,"ASHLEY",1,0,0,0
"3","Vestiges",5,6,3,"proglog","TRAVIS","right, listen up! if you have ale, then you have a friend in grog strongjaw! a goliath of towering height and size, this barbarian has an appetite for the two great loves in his life: combat, women, and ale! wait. easily the brains of the group, grog is often consulted for his vast knowledge of shapes, colors, and shiny things! ...also ale. in his early years, armed with his two-handed great axe, grog often enjoyed proving his might amongst the ranks of his family's wandering herd. but after coming upon an unsuspecting elderly gnome in the woods, he objected to the killing such an innocent life. a creature of impulse, grog felt only pity for this... well this terrified little thing. and his disobedience cost him dearly. beaten bloody, and banished by the herd leader, his uncle kevdak, grog was abandoned and left to die. exiled from his herd, it was then that the relative of the very gnome he fought to save, saved him. it was the kindness of a gnome cleric named pike, that healed grog, bringing him back from death's edge. and they have remained close friends ever since. most nights, grog can be found challenging entire taverns to wrestling matches! ha! ...or accompanying scanlan to the nearest house, where you pay for... lady favors. also ale!",225.595,331.471,105.876,224,0.00211568249650535,NA,NA,"TRAVIS",1,0,0,0
"4","Vestiges",5,6,4,"proglog","MARISHA","a first impression of keyleth would leave you with little information on the half-elven druid. you might even think that her social awkwardness due to her sheltered upbringing is kinda sweet. of course, it would be unwise underestimate her based on first impressions. under that unintimidating petite frame is a vicious beast waiting to be unleashed, whose natural powers have made even the fiercest of champions pee their pants, literally! born to the air tribe of the ashari people, keyleth was raised with a deep love of nature and the elemental magics. it is her people’s inherent duty to protect the delicate areas in tal'dorei where the four elemental planes begin to bleed with this realm. since she was a little girl, she had quite a knack for air manipulation and beast shaping abilities. well, if you consider kittens and flying squirrels to be little beasts. which, i do. anyways, it wasn't long before the headmaster of the tribe, her father, kohren, realized her true prodigious abilities and she was inveterated to succeed him as the next headmaster. just like that, her jovial childhood was stripped and replaced with endless spell memorization, teachings from ancient traditions, and exceedingly high expectations. every druid leader to be must embark on a journey to seek out the sister tribes in order to introduce and establish respect amongst the fellow headmasters. they call this the aramente, or noble odyssey. when her father felt she was ready, he set her on the path to truly discovering herself. not knowing when, or if she will ever return. as she hiked down the mountain towards stillben, she meditated on the task ahead. part of the aramente is proving yourself a strong warrior, a valiant protector, and a wise and compassionate leader. with this knowledge, one thought plays in repeat in her mind: is she even worthy?",333.141,454.468,121.327,314,0.00258804717828678,NA,NA,"MARISHA",1,0,0,0
"5","Vestiges",5,6,5,"proglog","TALIESIN","percy was the third child of 7 children, born to a noble family who lived far to the north in the ancient castle of whitestone. with so many siblings to share the burdens of lordship, percy turned his attention to the sciences, engineering, and naturalism. one day, a mysterious couple, named lord and lady briarwood, came to court. during a feast held in their honor, the briarwoods violently took control of the castle, killing or imprisoning everyone who would stand in their way. percy awoke chained in the dungeon, only to be freed by his younger sister. together they fled, chased by the briarwoods’ men. as they ran, percy’s sister took several arrows to the chest and fell. percy kept running, eventually jumping into a freezing river and floating unconscious to freedom. he did not remember waking up on a fishing boat. he barely remembered the next two years, as he slowly made his way as far south as possible. then one night, percy had a dream. a roaring cloud of smoke offered him vengeance against those who destroyed his family. when he awoke, percy began to design his first gun.",456.968,529.585,72.617,193,0.00265777985871077,NA,NA,"TALIESIN",1,0,0,0
"6","Vestiges",5,6,6,"proglog","SAM","oh, you haven’t heard of scanlan shorthalt? well, gird your loins, ladies, because he has his eye on you. a talented musician, master of disguise, and dashingly handsome in his own mind, scanlan sings songs almost as much as he sings his own praises. born a poor gnome, scanlan used his endless charm and soaring tenor voice to croon for coin and support his single mother. one day he was discovered by a half-orc promoter, and joined dr. dranzel’s spectacular traveling troupe where he learned the ways of the world, and honed his skills as a bard extraordinaire. a loner much of his life, scanlan has never quite come to terms with the violent death of his mother at the hands of a goblin invasion. while his years on the road provided many, shall we say, educational experiences with the opposite sex, deep down scanlan yearns for the one thing he’s never known: the true love of a fellow gnome. still, scanlan considers himself a lover first, performer second, and fighter distant third. on the battlefield, he’ll support his allies, but rarely draws blood unless it’s to protect fellow gnome, pike. count on scanlan for a hearty laugh, a rollicking song, and a twinkle in his eye that melts hearts and makes the females swoon.",530.165,610.948,80.783,222,0.00274810294245076,NA,NA,"SAM",1,0,0,0
"7","Vestiges",5,6,7,"proglog","ORION","greetings and salutations. i am tiberius stormwind. i hail from a town called ty'rex, located in the heart of draconia, born from a politically respected family. at the age of 15, i succeeded in passing the sorcerer’s rite, showing prodigy-like control of my magic. the judges and the draconian high council were amazed at how powerful my spells were for how long i had been training. at 20 years old, i was the youngest appointed member of the magic guild in draconian history. for the next few years, i almost went mad from the malaise of being a guild member, as it’s rather boring. however, one day i happened upon a chamber, unused for quite some time. in the room were stacks of books and maps of the surrounding cities and areas around the known world. for months i would frequent the chamber, and learned of artifacts from legend. after a long period of research, i made a list of artifacts that caught my eye. i brought these findings to the high council and was told that all of the information in the chamber i had stumbled upon was either believed to be fiction, or unsolvable mysteries, and hence were lost forever. i found those answers to be unacceptable. a year later i devised a ruse and managed to convince the city council to lend support in me leaving draconia on a mission of peace and diplomacy for the surrounding kingdoms. going from town to town and making friends and allies, in and for the name of draconia. being a red dragonborn, i had quite the task on my hands in that respect, but it was exactly what i needed so i could explore the world and find these artifacts, as i felt the truth was out there. some may describe me as buffoonish, but i say poppycock to all that. i am much sharper than most give me credit for. i just don’t pay attention to things sometimes. i’ve also been known to be rather cunning, loyal, happy-go-lucky, and well, dangerous. i can’t help but show my true scales every now and then. but overall, i think i’m quite friendly for a dragonborn.",614.308,729.567,115.259,375,0.00325354202274877,NA,NA,"ORION",1,0,0,0
"8","Vestiges",5,6,8,"proglog","LIAM","never entirely welcome in the company of elves or men, vax'ildan learned at a young age to skip past formality, preferring instead to invite himself in your door. along with twin sister vex'ahlia, vax was born by a chance encounter between elven royalty and human peasantry. raised by their mother in their early years, the twins were eventually sent off to their father in the elven capital of singorn. but their cool reception among the elves there never warmed, and their time in the capital didn’t last. the siblings stole away one autumn night and set out on the open road. after a few years of wandering, they eventually decided to return to their mother, and journeyed back to the lands of their youth. but instead of finding their childhood home, they returned to a pile of rubble. their mother was gone, their home burned to ash. pressing the townspeople for answers, they learned of the day the dragon came. with their ties all severed, vax'ildan and his sister set out to find their fortune together in tal'dorei. an outsider since birth, vax quickly learned to solve life’s challenges in his own particular way, often by sidestepping them entirely. and when his knack for circumventing adversity isn’t enough, the way of blades the elves schooled him in more than makes up the difference.",731.467,819.872,88.405,231,0.00261297437927719,NA,NA,"LIAM",1,0,0,0
"9","Vestiges",5,6,9,"proglog","LAURA","like so many half-elves, vex'ahlia has spent most of her life suffering the cool reception of a people who don’t fully accept her. born of a human mother, and an elven father who only later in life took an interest in their existence, vex'ahlia and her twin brother vax'ildan quickly realized the only people they could truly rely on in this world were each other. it was at the age of 10 when the two were taken from their mother, and brought to live in singorn, the isolated elven city for which their father was an ambassador. he quietly took them in, but always kept an icy distance, and after too many years of disdainful looks, the pair decided to leave his indifference behind, and set out on their own. vax took to the cities, stealing small trinkets and learning the ways of the thief, while vex kept to the woods. she preferred the isolation. always the keen observer, she learned to hunt and to track, to spy and to shoot. and through a series of fateful events, earned herself a companion in the form of a bear her own stolen trinket to fight alongside her and protect her fiercely. also he is adorable, and gives expert massages.",820.772,903.905,83.1329999999999,214,0.00257418834879049,NA,NA,"LAURA",1,0,0,0
"10","Vestiges",5,6,10,"proglog","MATT","welcome back, everyone! the new intro tonight, which i think we're all pretty damn proud of, was put together by our fantastic overlord, zac.",904.875,919.46,14.585,26,0.00178265341103873,NA,NA,"MATT",0,0,0,1
"11","Vestiges",5,6,11,"proglog","MATT","it put him to work for quite some time, also the mixing and sound effects done by the amazing alex neat and the music you heard was composed by the amazingly talented jason charles miller. so if you don't know jason you should look him up. he's done stuff for the guild and many other web shows. also a fantastic musician on his own with his own stuff. he is the lead singer of godhead. he's just a good guy. also a voice actor, look him up if you have any time. good people, and he lent his talents to our intro so we really appreciate that, buddy. also we had a great time at tabletop day. got to meet some of our fans. got to take some pictures. bunch of cool folks. some of us got to go on the stream at certain points in the day. all around a good time! so those of you that got a chance to come, thank you so much! and a fan created, as i mentioned before, this awesome t-shirt with the roster, so we were all really inspired to go ahead and make some of our own. got the party showing off their critical role positive.",919.46,977.256,57.7959999999999,210,0.0036334694442522,NA,NA,"MATT",0,0,0,1
"12","Vestiges",5,6,12,"proglog","MARISHA","so one of the things we were actually talking about doing, so we'd like to give a shout out to the person who made this, big shout out to @ruzgofdi. thank you! for doing this. a lot of people have been asking for shirts. i don't know if you guys maybe would be into that or not. so we thought maybe we would wear these, see what you guys thought. but if you guys are into it, we thought about doing a limited run of these and making this the first of our fan-designed t shirts.",977.256,1016.436,39.1800000000001,100,0.00255232261357835,NA,NA,"MARISHA",1,0,0,0
"13","Vestiges",5,6,13,"proglog","SAM","first of many.",1016.436,1017.839,1.40300000000002,4,0.00285103349964358,NA,NA,"SAM",1,0,0,0
"14","Vestiges",5,6,14,"proglog","MARISHA","first of many. every once in awhile we'll have fans submit designs and then we'll pick a winner. each one will be a limited run. so if you guys will like this, let us know, and maybe we'll make it happen.",1017.839,1032.001,14.1619999999999,45,0.00317751729981643,NA,NA,"MARISHA",1,0,0,0
"15","Vestiges",5,6,15,"proglog","SAM","i'm wearing one right now in my underpants, which we will be selling next week.",1032.001,1036.27,4.26900000000001,17,0.00398219723588662,NA,NA,"SAM",1,0,0,0
"16","Vestiges",5,6,16,"proglog","MARISHA","yes, and there might be some stills of that to order.",1036.27,1040.148,3.87799999999993,12,0.00309437854564214,NA,NA,"MARISHA",1,0,0,0
"17","Vestiges",5,6,17,"proglog","ORION","i'm going to wear mine next game.",1040.148,1042.333,2.18500000000017,9,0.00411899313501112,NA,NA,"ORION",1,0,0,0
"18","Vestiges",5,6,18,"proglog","TALIESIN","next game.",1042.333,1043.137,0.80399999999986,3,0.00373134328358274,NA,NA,"TALIESIN",1,0,0,0
"19","Vestiges",5,6,19,"proglog","MATT","i guess some people are into the idea, let the chat know. people seem to be, and we'll be putting more designs out, getting some shirt possibilities to you guys in the near future.",1043.137,1053.275,10.1380000000001,36,0.00355099625172613,NA,NA,"MATT",0,0,0,1
"20","Vestiges",5,6,20,"proglog","MARISHA","let us know in the chat guys.",1053.275,1055.903,2.62799999999993,8,0.00304414003044148,NA,NA,"MARISHA",1,0,0,0
"21","Vestiges",5,6,21,"proglog","LIAM","wait wait wait, i've got some thing. i just gave everyone in the party rupees, treasure!",1055.903,1064.259,8.35599999999999,18,0.00215414073719483,NA,NA,"LIAM",1,0,0,0
"22","Vestiges",5,6,22,"proglog","MARISHA","rupees!",1064.259,1066.083,1.82400000000007,2,0.00109649122807013,NA,NA,"MARISHA",1,0,0,0
"23","Vestiges",5,6,23,"proglog","LIAM","these were sent to me by tim west who has a great new company called fantasy coin hq. if you go to fantasycoinhq.com he makes matt's holding up a dwarven coin at the moment they make gems, they make fantasy coins, nerd coins.",1066.083,1080.973,14.8899999999999,46,0.00308932169241104,NA,NA,"LIAM",1,0,0,0
"24","Vestiges",5,6,24,"proglog","SAM","are we doing free ads now for people?",1080.973,1082.987,2.01400000000012,9,0.00446871896722912,NA,NA,"SAM",1,0,0,0
"25","Vestiges",5,6,25,"proglog","LIAM","this is just a thank you!",1082.987,1084.231,1.24399999999991,7,0.00562700964630264,NA,NA,"LIAM",1,0,0,0
"26","Vestiges",5,6,26,"proglog","MATT","this is a thank you.",1084.231,1085.526,1.29500000000007,6,0.00463320463320437,NA,NA,"MATT",0,0,0,1
"27","Vestiges",5,6,27,"proglog","LIAM","check it out. or if you just hit a really tall tuft of grass with a sword, these will pop out of it so you don't have to order them. just mow your lawn.",1085.526,1094.8,9.27399999999989,36,0.00388182014233345,NA,NA,"LIAM",1,0,0,0
"28","Vestiges",5,6,28,"proglog","MARISHA","they’re hefty, too.",1094.8,1096.365,1.56500000000005,5,0.00319488817891363,NA,NA,"MARISHA",1,0,0,0
"29","Vestiges",5,6,29,"proglog","ORION","if these were rupees, this is what they would feel like.",1096.365,1102.239,5.87400000000002,12,0.00204290091930541,NA,NA,"ORION",1,0,0,0
"30","Vestiges",5,6,30,"proglog","MARISHA","i kind of want to throw them at people across the room!",1102.239,1106.266,4.02700000000004,13,0.0032282095852992,NA,NA,"MARISHA",1,0,0,0
"31","Vestiges",5,6,31,"proglog","ORION","i want to trade them, put them in a pouch.",1106.266,1109.162,2.89599999999996,11,0.00379834254143652,NA,NA,"ORION",1,0,0,0
"32","Vestiges",5,6,32,"proglog","MATT","also guys, as a note, we have, available tonight for the person, for people who have managed to get themselves to 2,150 subscribers tonight, we will send out another promo kit to one of you folks in the chat with another signed picture of our critical role cast. so be sure to see if we can get the subscribers to climb up as well, so keep an eye out for that in the evening so we can give out one of those before the night is over. that would be awesome.",1109.162,1134.555,25.393,93,0.00366242665301461,NA,NA,"MATT",0,0,0,1
"33","Vestiges",5,6,33,"proglog","SAM","let's do this!",1134.555,1135.874,1.31899999999996,5,0.0037907505686127,NA,NA,"SAM",1,0,0,0
"34","Vestiges",5,6,34,"proglog","MATT","let's kick into the game proper, guys! let's get some proper music playing, because that's what i do.",1135.874,1142.736,6.86200000000008,22,0.00320606237248612,NA,NA,"MATT",0,0,0,1
"35","Vestiges",5,6,35,"proglog","ORION","that’s what i baby do right.",1142.736,1145.198,2.46199999999999,8,0.00324939073923641,NA,NA,"ORION",1,0,0,0
"36","Vestiges",5,6,36,"proglog","MATT","so last we left off, music's not playing here. i need music!",1148.115,1154.286,6.17100000000005,14,0.00226867606546749,NA,NA,"MATT",0,0,0,1
"37","Vestiges",5,6,37,"first_half_rp","SAM","doesn't matter. the party had been travelling into the dwarven city of kraghammer at the behest of arcanist allura vysoren in search of a halfling paladin, a very revered folk hero named lady kima of vord who had gone missing following a vision quest somewhere beneath the dwarven city of kraghammer, supposedly for some great evil that was germinating there, festering and growing. after you guys traversed through the dwarven city, you began to find your way down into the mines. the mythril mines of greyspine beneath the dwarven town. after a few fateful encounters, the return of your gnome cleric.",1154.286,1189.366,35.0799999999999,103,0.00293614595210947,NA,"role_play","SAM",1,0,0,0
"38","Vestiges",5,6,38,"first_half_rp","ASHLEY","hey, that's me!",1190.076,1192.766,2.69000000000005,5,0.00185873605947952,NA,"role_play","ASHLEY",1,0,0,0
"39","Vestiges",5,6,39,"first_half_rp","MATT","grog having his proverbial brains blown out by an intellect devourer. the party then decided to make friends with a mind flayer, an illithid that had been cast out from its people seeking vengeance and possible return to its people. upon making this alliance, they made an attack on the dwarven, or the duergar, war camp that is threatening to rise up and attack kraghammer from deep within the mountains themselves. the attack was successful. the general was killed, interrogated, and some interesting information was gleaned from him before his brain was sucked out from his head by clarota, the mindflayer friend. however, this attack also announced to the local war camp of your presence and in the process of attempting to escape, the druid was damaged and lost her eagle form and thus began a freefall of many party members. a haphazard attempt to use the magic carpet far over its weight limit led most of the party to come crash landing and nearly killing everyone. managed to escape, walled themselves in thanks to keyleth’s stone wall spell. and after staying the evening in one of the deeper tunnels, and barely avoiding a roving band of duergar there, you managed to find yourselves in battle with 2 ogres carrying some sort of strange, mutated, black pudding ooze contained in a glass container. the glass container being shattered, of course, by an explosive arrow created by percy and fired by vex.",1192.766,1273.869,81.1029999999998,243,0.00299619002996191,NA,"role_play","MATT",0,0,0,1
"40","Vestiges",5,6,40,"first_half_rp","LAURA","go us!",1273.869,1274.894,1.02500000000009,3,0.00292682926829242,NA,"role_play","LAURA",1,0,0,0
"41","Vestiges",5,6,41,"first_half_rp","MATT","at the very start of the battle, led into a very rough battle with this strange mutating ooze that kept splitting and splitting, until through some good teamwork, crafty use of telekinesis and a nearby lava pool, and general high damage rolls, you guys managed to survive the encounter.",1274.894,1291.512,16.6179999999999,50,0.00300878565411001,NA,"role_play","MATT",0,0,0,1
"42","Vestiges",5,6,42,"first_half_rp","TRAVIS","barely.",1291.512,1292.204,0.692000000000007,2,0.00289017341040459,NA,"role_play","TRAVIS",1,0,0,0
"43","Vestiges",5,6,43,"first_half_rp","MATT","making your way to the bottom of this tunnel, you found yourself looping back around to the large crevice where the giant waterfall had fallen in before, where you had met clarota. which allowed you to retrieve your bear trinket.",1292.204,1303.228,11.0240000000001,41,0.00371915820029024,NA,"role_play","MATT",0,0,0,1
"44","Vestiges",5,6,44,"first_half_rp","LAURA","yeah! trinket!",1303.228,1305.504,2.27599999999984,3,0.00131810193321626,NA,"role_play","LAURA",1,0,0,0
"45","Vestiges",5,6,45,"first_half_rp","MATT","we pick up as you guys begin to step down into the lower tunnels, the ones that are partially coated with a series of magma pools and falls that are trickling out of the rockside. all right everyone.",1305.504,1320.319,14.8150000000001,39,0.00263246709416131,NA,"role_play","MATT",0,0,0,1
"46","Vestiges",5,6,46,"first_half_rp","SAM","i was just so out of it last time. have we rested? are we in some need of rest?",1324.249,1332.631,8.38200000000006,20,0.00238606537819134,NA,"role_play","SAM",1,0,0,0
"47","Vestiges",5,6,47,"first_half_rp","LAURA","we should probably rest.",1332.631,1334.162,1.53099999999995,5,0.00326583932070553,NA,"role_play","LAURA",1,0,0,0
"48","Vestiges",5,6,48,"first_half_rp","SAM","what are we around? what's near us? is this just a tunnel? is there any sort of shelter, caves?",1334.162,1339.686,5.52399999999989,21,0.00380159304851565,NA,"role_play","SAM",1,0,0,0
"49","Vestiges",5,6,49,"first_half_rp","LAURA","we're by that lake with the giant monster.",1339.686,1342.528,2.8420000000001,10,0.00351864883884576,NA,"role_play","LAURA",1,0,0,0
"50","Vestiges",5,6,50,"first_half_rp","LIAM","we circled all the way back around.",1342.528,1344.34,1.8119999999999,8,0.00441501103752784,NA,"role_play","LIAM",1,0,0,0
"51","Vestiges",5,6,51,"first_half_rp","SAM","oh shit.",1344.34,1345.415,1.07500000000005,3,0.00279069767441849,NA,"role_play","SAM",1,0,0,0
"52","Vestiges",5,6,52,"first_half_rp","LAURA","and went down to that place that you told us not to go in the first place? yeah, that's where we ended up.",1345.415,1349.487,4.07200000000012,25,0.00613948919449884,NA,"role_play","LAURA",1,0,0,0
"53","Vestiges",5,6,53,"first_half_rp","SAM","how was that for you?",1349.487,1352.941,3.45399999999995,6,0.00173711638679794,NA,"role_play","SAM",1,0,0,0
