"","arc","arc_no","episode","turn_number","segment","actor","text","start_turn","end_turn","time_in_sec","word_count","words_per_ms","encounter_count","rp_combat","actor_guest","vox_machina","guest","staff","matt"
"1788","Vestiges",5,6,1788,"combat","MATT","both duergar.",7759.673,7761.011,1.33800000000065,3,0.00224215246636663,2,"combat","MATT",0,0,0,1
"1789","Vestiges",5,6,1789,"combat","LIAM","i start to loot the bodies.",7761.011,7762.178,1.16699999999946,7,0.0059982862039445,2,"combat","LIAM",1,0,0,0
"1790","Vestiges",5,6,1790,"combat","MATT","stealth checks?",7762.178,7763.082,0.904000000000451,3,0.0033185840707948,2,"combat","MATT",0,0,0,1
"1791","Vestiges",5,6,1791,"combat","ORION","16.",7763.082,7763.725,0.643000000000029,2,0.00311041990668726,2,"combat","ORION",1,0,0,0
"1792","Vestiges",5,6,1792,"combat","MARISHA","17.",7763.725,7764.36,0.634999999999309,2,0.00314960629921603,2,"combat","MARISHA",1,0,0,0
"1793","Vestiges",5,6,1793,"combat","TALIESIN","12.",7764.36,7765.019,0.65900000000056,2,0.00303490136570303,2,"combat","TALIESIN",1,0,0,0
"1794","Vestiges",5,6,1794,"combat","SAM","12.",7765.019,7765.631,0.61200000000008,2,0.00326797385620872,2,"combat","SAM",1,0,0,0
"1795","Vestiges",5,6,1795,"combat","TRAVIS","20.",7765.631,7766.391,0.759999999999309,2,0.00263157894737081,2,"combat","TRAVIS",1,0,0,0
"1796","Vestiges",5,6,1796,"combat","ASHLEY","19.",7766.391,7767.89,1.49900000000071,2,0.00133422281520951,2,"combat","ASHLEY",1,0,0,0
"1797","Vestiges",5,6,1797,"combat","MATT","all right, go team!",7767.89,7769.883,1.99299999999948,5,0.00250878073256462,2,"combat","MATT",0,0,0,1
"1798","Vestiges",5,6,1798,"combat","MARISHA","woo! we’re stealthy bastards.",7769.883,7772.457,2.57400000000052,6,0.00233100233100186,2,"combat","MARISHA",1,0,0,0
"1799","Vestiges",5,6,1799,"combat","MATT","that was with disadvantage?",7772.457,7775.267,2.80999999999949,5,0.0017793594306053,2,"combat","MATT",0,0,0,1
"1800","Vestiges",5,6,1800,"combat","ASHLEY","i have to roll again?",7775.267,7776.496,1.22900000000027,6,0.00488201790073123,2,"combat","ASHLEY",1,0,0,0
"1801","Vestiges",5,6,1801,"combat","LIAM","yes.",7776.496,7777.489,0.992999999999483,2,0.0020140986908369,2,"combat","LIAM",1,0,0,0
"1802","Vestiges",5,6,1802,"combat","LAURA","why?",7777.489,7778.322,0.833000000000538,2,0.00240096038415211,2,"combat","LAURA",1,0,0,0
"1803","Vestiges",5,6,1803,"combat","MATT","because you’re in heavy plate armor.",7778.322,7779.596,1.27399999999943,8,0.00627943485086622,2,"combat","MATT",0,0,0,1
"1804","Vestiges",5,6,1804,"combat","LAURA AND MARISHA","no!",7779.596,7780.748,1.15200000000004,2,0.00173611111111105,2,"combat","LAURA AND MARISHA",1,0,0,0
"1805","Vestiges",5,6,1805,"combat","LAURA","that’s not bad, that’s still not bad.",7788.685,7790.265,1.57999999999993,10,0.00632911392405092,2,"combat","LAURA",1,0,0,0
"1806","Vestiges",5,6,1806,"combat","ASHLEY","i rolled an 8.",7790.265,7791.942,1.67699999999968,5,0.00298151460942216,2,"combat","ASHLEY",1,0,0,0
"1807","Vestiges",5,6,1807,"combat","MATT","okay.",7791.942,7792.665,0.722999999999956,2,0.0027662517289075,2,"combat","MATT",0,0,0,1
"1808","Vestiges",5,6,1808,"combat","LAURA","plus what?",7792.665,7793.488,0.82300000000032,3,0.00364520048602531,2,"combat","LAURA",1,0,0,0
"1809","Vestiges",5,6,1809,"combat","ASHLEY","plus nothing.",7793.488,7795.769,2.28099999999995,3,0.00131521262604124,2,"combat","ASHLEY",1,0,0,0
"1810","Vestiges",5,6,1810,"combat","MATT","okay.",7795.769,7797.588,1.81899999999951,2,0.00109950522265011,2,"combat","MATT",0,0,0,1
"1811","Vestiges",5,6,1811,"combat","MATT","you guys, all rush down the stairs the clanking of the plate armor as you're going down. the rest of you wince as you notice it, but you make it down anyway.",7800.56,7812.256,11.6959999999999,34,0.00290697674418607,2,"combat","MATT",0,0,0,1
"1812","Vestiges",5,6,1812,"combat","ASHLEY","oh my god.",7812.256,7813.437,1.18099999999959,4,0.0033869602032188,2,"combat","ASHLEY",1,0,0,0
"1813","Vestiges",5,6,1813,"combat","TRAVIS","i should have picked you up.",7813.437,7814.535,1.09799999999996,7,0.00637522768670335,2,"combat","TRAVIS",1,0,0,0
"1814","Vestiges",5,6,1814,"combat","MARISHA","i'm actually going to go ahead and throw guidance on pike now.",7814.535,7817.121,2.58600000000024,14,0.0054137664346476,2,"combat","MARISHA",1,0,0,0
"1815","Vestiges",5,6,1815,"combat","SAM","little late, little late.",7817.121,7818.28,1.15899999999965,5,0.00431406384814625,2,"combat","SAM",1,0,0,0
"1816","Vestiges",5,6,1816,"combat","TALIESIN","what does guidance do?",7818.28,7819.883,1.60300000000007,5,0.00311915159076718,2,"combat","TALIESIN",1,0,0,0
"1817","Vestiges",5,6,1817,"combat","MARISHA","it gives you a plus on your ability checks. and it gives you a 1d4 plus to your",7819.883,7827.979,8.09600000000046,18,0.00222332015810264,2,"combat","MARISHA",1,0,0,0
"1818","Vestiges",5,6,1818,"combat","SAM","do they already knew [sic] we were here? now they really know.",7827.979,7830.403,2.42399999999998,13,0.00536303630363041,2,"combat","SAM",1,0,0,0
"1819","Vestiges",5,6,1819,"combat","MATT","so, the rest of you have made it down.",7830.403,7834.781,4.3779999999997,10,0.00228414801279138,2,"combat","MATT",0,0,0,1
"1820","Vestiges",5,6,1820,"combat","LIAM","surprise!",7834.781,7837.051,2.27000000000044,2,0.000881057268722298,2,"combat","LIAM",1,0,0,0
"1821","Vestiges",5,6,1821,"combat","MATT","in this hallway, there are 2 dead duergar on the ground. one with a closed door and one with an open door.",7837.051,7840.25,3.19899999999961,23,0.00718974679587458,2,"combat","MATT",0,0,0,1
"1822","Vestiges",5,6,1822,"combat","LAURA","well, let's go look in the open door. stealthily.",7840.25,7843.682,3.43199999999979,11,0.0032051282051284,2,"combat","LAURA",1,0,0,0
"1823","Vestiges",5,6,1823,"combat","MATT","you glance over into the open door, you can see what appears to be a series of dungeon cells held underneath the stronghold.",7843.682,7852.498,8.8159999999998,24,0.00272232304900188,2,"combat","MATT",0,0,0,1
"1824","Vestiges",5,6,1824,"combat","LIAM","lady kima?",7852.498,7854.35,1.85200000000077,3,0.0016198704103665,2,"combat","LIAM",1,0,0,0
"1825","Vestiges",5,6,1825,"combat","MATT","within these, you can see there are a number of dwarven captives that are in very, very, very poor health",7854.35,7860.612,6.26199999999972,20,0.00319386777387431,2,"combat","MATT",0,0,0,1
"1826","Vestiges",5,6,1826,"combat","TALIESIN","i don't care about them.",7860.612,7861.935,1.32300000000032,7,0.00529100529100401,2,"combat","TALIESIN",1,0,0,0
"1827","Vestiges",5,6,1827,"combat","LAURA","we need to get them awake.",7861.935,7863.47,1.53499999999985,7,0.00456026058631965,2,"combat","LAURA",1,0,0,0
"1828","Vestiges",5,6,1828,"combat","MATT","that are currently lying down, unfed, gaunt.",7863.47,7865.366,1.89599999999973,8,0.00421940928270102,2,"combat","MATT",0,0,0,1
"1829","Vestiges",5,6,1829,"combat","SAM","are any of them lady kima? because if they're not, they're about to die.",7865.366,7867.672,2.30599999999959,17,0.00737207285342717,2,"combat","SAM",1,0,0,0
"1830","Vestiges",5,6,1830,"combat","LAURA","no, they're regular dwarves, they're good people.",7867.672,7869.22,1.54800000000068,10,0.00645994832041058,2,"combat","LAURA",1,0,0,0
"1831","Vestiges",5,6,1831,"combat","ORION","i go inspect them and see what's going on.",7869.22,7871.198,1.97800000000007,11,0.00556117290192095,2,"combat","ORION",1,0,0,0
"1832","Vestiges",5,6,1832,"combat","MATT","okay.",7871.198,7872.372,1.17399999999998,2,0.00170357751277686,2,"combat","MATT",0,0,0,1
"1833","Vestiges",5,6,1833,"combat","MARISHA","i'll go in with tiberius.",7872.372,7874.551,2.17900000000009,7,0.00321248279027064,2,"combat","MARISHA",1,0,0,0
"1834","Vestiges",5,6,1834,"combat","MATT","okay, you guys enter. as you look around, there are a series of largely decomposed bodies in a few of these cells. they are people who've just been left to die.",7874.551,7886.122,11.5709999999999,33,0.00285195747990668,2,"combat","MATT",0,0,0,1
"1835","Vestiges",5,6,1835,"combat","LAURA","oh no.",7886.122,7887.345,1.22299999999996,3,0.00245298446443181,2,"combat","LAURA",1,0,0,0
"1836","Vestiges",5,6,1836,"combat","MATT","one, there are these kind of strange deep underground, rat-like creatures that are feeding on one of them. one of the dwarves is just wheezing in pain. you can see his stomach is a little distended. the other one is either unconscious, asleep, or dead. you can't tell.",7887.345,7903.732,16.3869999999997,51,0.0031122231036798,2,"combat","MATT",0,0,0,1
"1837","Vestiges",5,6,1837,"combat","ASHLEY","can i do a mass cure on them?",7903.732,7908.373,4.64099999999962,9,0.00193923723335504,2,"combat","ASHLEY",1,0,0,0
"1838","Vestiges",5,6,1838,"combat","MATT","you can if you'd like.",7908.373,7909.676,1.30300000000079,7,0.00537221795855391,2,"combat","MATT",0,0,0,1
"1839","Vestiges",5,6,1839,"combat","ASHLEY","okay. i'll do that.",7909.676,7912.115,2.4389999999994,6,0.00246002460024661,2,"combat","ASHLEY",1,0,0,0
"1840","Vestiges",5,6,1840,"combat","LIAM","yes, i was about to say. i'm going to go start inspecting the other door.",7912.115,7914.419,2.30400000000009,17,0.00737847222222194,2,"combat","LIAM",1,0,0,0
"1841","Vestiges",5,6,1841,"combat","TALIESIN","i'll go with him.",7914.419,7915.539,1.11999999999989,6,0.00535714285714338,2,"combat","TALIESIN",1,0,0,0
"1842","Vestiges",5,6,1842,"combat","LAURA","why don't you unlock the prison cells here?",7915.539,7916.947,1.40800000000036,10,0.00710227272727093,2,"combat","LAURA",1,0,0,0
"1843","Vestiges",5,6,1843,"combat","MARISHA","yeah, can you unlock the prison cells?",7916.947,7918.162,1.21500000000015,8,0.00658436213991691,2,"combat","MARISHA",1,0,0,0
"1844","Vestiges",5,6,1844,"combat","LIAM","oh, sorry.",7918.162,7918.97,0.807999999999993,3,0.00371287128712875,2,"combat","LIAM",1,0,0,0
"1845","Vestiges",5,6,1845,"combat","LAURA","can we go in? can we talk to them?",7918.97,7921.762,2.79199999999946,10,0.00358166189111817,2,"combat","LAURA",1,0,0,0
"1846","Vestiges",5,6,1846,"combat","MATT","if you guys want to. so you go through. it's fairly simple over time for you to unlock the cells if you'd like, the 2 that are in there. there's a difference between healing magic and nutrition. you make them feel physically better for the moment, but their physical form itself is failing.",7921.762,7943.873,22.1109999999999,57,0.00257790240151962,2,"combat","MATT",0,0,0,1
"1847","Vestiges",5,6,1847,"combat","TRAVIS","just a thought, shouldn't we clear this mess before we let prisoners out?",7943.873,7947.215,3.34200000000055,15,0.00448833034111236,2,"combat","TRAVIS",1,0,0,0
"1848","Vestiges",5,6,1848,"combat","MATT","they need food, they need air, they need to be out of here soon. they're both on the edge of death.",7947.215,7951.613,4.39800000000014,23,0.00522964984083658,2,"combat","MATT",0,0,0,1
"1849","Vestiges",5,6,1849,"combat","SAM","put them in the bag of holding, grog.",7951.613,7952.777,1.16399999999976,9,0.00773195876288819,2,"combat","SAM",1,0,0,0
"1850","Vestiges",5,6,1850,"combat","MARISHA","i pull out a water.",7952.777,7954.053,1.27599999999984,6,0.00470219435736736,2,"combat","MARISHA",1,0,0,0
"1851","Vestiges",5,6,1851,"combat","ORION","i go to the room, i take out my bottle of water..",7954.053,7956.996,2.94300000000021,13,0.00441726129799493,2,"combat","ORION",1,0,0,0
"1852","Vestiges",5,6,1852,"combat","MARISHA","i'll do the opposite one.",7956.996,7959.931,2.93499999999949,7,0.00238500851788798,2,"combat","MARISHA",1,0,0,0
"1853","Vestiges",5,6,1853,"combat","MATT","you guys hear heavy footsteps coming from the stairway you guys just descended from.",7959.931,7963.901,3.97000000000025,15,0.0037783375314859,2,"combat","MATT",0,0,0,1
"1854","Vestiges",5,6,1854,"combat","TRAVIS","i go stand right next to the stairway.",7963.901,7966.932,3.03099999999995,9,0.00296931705707692,2,"combat","TRAVIS",1,0,0,0
"1855","Vestiges",5,6,1855,"combat","MARISHA AND TALIESIN","in the cells, in the cells.",7966.932,7968.557,1.625,7,0.00430769230769231,2,"combat","MARISHA AND TALIESIN",1,0,0,0
"1856","Vestiges",5,6,1856,"combat","LIAM","i pull my sister and we flank. i push her into flanking position to the door.",7968.557,7972.29,3.73300000000017,17,0.0045539780337528,2,"combat","LIAM",1,0,0,0
"1857","Vestiges",5,6,1857,"combat","LAURA","oh god, i nock an arrow, notch an arrow?",7972.29,7975.079,2.78899999999976,10,0.00358551452133412,2,"combat","LAURA",1,0,0,0
"1858","Vestiges",5,6,1858,"combat","ORION","where are they coming from?",7975.079,7976.735,1.65599999999995,6,0.00362318840579721,2,"combat","ORION",1,0,0,0
"1859","Vestiges",5,6,1859,"combat","LIAM","the stairs, from where we entered?",7976.735,7979.84,3.10500000000047,7,0.00225442834138452,2,"combat","LIAM",1,0,0,0
"1860","Vestiges",5,6,1860,"combat","MATT","what are you guys doing?",7979.84,7981.963,2.12299999999959,6,0.00282618935468731,2,"combat","MATT",0,0,0,1
"1861","Vestiges",5,6,1861,"combat","MARISHA","i jump in the cells and i pull a dead, decomposing corpse over the top of me.",7981.963,7989.142,7.17900000000009,18,0.002507312996239,2,"combat","MARISHA",1,0,0,0
"1862","Vestiges",5,6,1862,"combat","LAURA","eww, keyleth. all kinds of nastiness.",7989.142,7992.825,3.68299999999999,7,0.00190062449090416,2,"combat","LAURA",1,0,0,0
"1863","Vestiges",5,6,1863,"combat","TALIESIN","i find a corner of a cell and slowly pull out my gun.",7992.825,7995.062,2.23700000000008,14,0.00625838176128722,2,"combat","TALIESIN",1,0,0,0
"1864","Vestiges",5,6,1864,"combat","MARISHA","i’m going savage!",7995.062,7998.511,3.44900000000052,5,0.00144969556393135,2,"combat","MARISHA",1,0,0,0
"1865","Vestiges",5,6,1865,"combat","TALIESIN","i should make sure all the doors are shut, not locked.",7998.511,8001.253,2.74199999999928,12,0.0043763676148808,2,"combat","TALIESIN",1,0,0,0
"1866","Vestiges",5,6,1866,"combat","MATT","all right, all the doors are shut. pike, anything you doing?",8001.253,8006.21,4.95700000000033,12,0.00242081904377631,2,"combat","MATT",0,0,0,1
"1867","Vestiges",5,6,1867,"combat","ASHLEY","i'm just, you know, preparing.",8006.21,8008.678,2.46799999999985,7,0.00283630470016225,2,"combat","ASHLEY",1,0,0,0
"1868","Vestiges",5,6,1868,"combat","MATT","all right.",8008.678,8010.093,1.41499999999996,3,0.00212014134275624,2,"combat","MATT",0,0,0,1
"1869","Vestiges",5,6,1869,"combat","MARISHA","just kicking it, just chilling.",8010.093,8011.412,1.31900000000041,6,0.00454890068233367,2,"combat","MARISHA",1,0,0,0
"1870","Vestiges",5,6,1870,"combat","LAURA","do we need to move out of the way of the stairs?",8011.412,8013.643,2.23099999999977,13,0.00582698341550935,2,"combat","LAURA",1,0,0,0
"1871","Vestiges",5,6,1871,"combat","LIAM","vax is scooching scanlan out of the way to take that position right there.",8013.643,8017.23,3.58699999999953,15,0.00418176749372789,2,"combat","LIAM",1,0,0,0
"1872","Vestiges",5,6,1872,"combat","TALIESIN","the bear is at the back cell.",8017.23,8019.227,1.9970000000003,8,0.00400600901351968,2,"combat","TALIESIN",1,0,0,0
"1873","Vestiges",5,6,1873,"combat","LAURA","scanlan, where are you?",8019.227,8020.692,1.46500000000015,5,0.00341296928327611,2,"combat","LAURA",1,0,0,0
"1874","Vestiges",5,6,1874,"combat","SAM","there's voices coming from the stairs?",8020.692,8022.994,2.30199999999968,8,0.00347523892267642,2,"combat","SAM",1,0,0,0
"1875","Vestiges",5,6,1875,"combat","LIAM","yeah, someone's coming.",8022.994,8024.619,1.625,5,0.00307692307692308,2,"combat","LIAM",1,0,0,0
"1876","Vestiges",5,6,1876,"combat","SAM","but there's a bear in the stairs.",8024.619,8025.779,1.16000000000076,9,0.00775862068965006,2,"combat","SAM",1,0,0,0
"1877","Vestiges",5,6,1877,"combat","LAURA","well, trinket's coming down.",8025.779,8027.026,1.24699999999939,6,0.00481154771451719,2,"combat","LAURA",1,0,0,0
"1878","Vestiges",5,6,1878,"combat","MARISHA","i call, “trinket, trinket, trinket trinket!”",8027.026,8030.954,3.92799999999988,7,0.00178207739307541,2,"combat","MARISHA",1,0,0,0
"1879","Vestiges",5,6,1879,"combat","MATT","trinket barely hears you from way over at the side.",8030.954,8032.345,1.39100000000053,11,0.00790797987059367,2,"combat","MATT",0,0,0,1
"1880","Vestiges",5,6,1880,"combat","MARISHA","come on.",8032.345,8033.702,1.35699999999997,3,0.00221075902726608,2,"combat","MARISHA",1,0,0,0
"1881","Vestiges",5,6,1881,"combat","MATT","he's coming into this room. clarota just steps back, along the side of the stairs and out of view. a few moments pass as the footsteps slowly trail off.",8033.702,8047.743,14.0410000000002,31,0.00220781995584357,2,"combat","MATT",0,0,0,1
"1882","Vestiges",5,6,1882,"combat","ORION","i leave and turn around where vex and vax are.",8049.945,8052.676,2.73100000000068,11,0.00402782863419893,2,"combat","ORION",1,0,0,0
"1883","Vestiges",5,6,1883,"combat","MARISHA","i know.",8052.676,8053.667,0.990999999999985,3,0.0030272452068618,2,"combat","MARISHA",1,0,0,0
"1884","Vestiges",5,6,1884,"combat","LAURA","what's in the other door?",8053.667,8056.051,2.38400000000001,7,0.00293624161073824,2,"combat","LAURA",1,0,0,0
"1885","Vestiges",5,6,1885,"combat","MATT","the other door is currently locked from what you can tell.",8059.178,8062.824,3.64599999999973,12,0.00329127811300079,2,"combat","MATT",0,0,0,1
"1886","Vestiges",5,6,1886,"combat","LIAM","one moment. it is now not locked, i think.",8062.824,8067.359,4.53500000000076,10,0.00220507166482874,2,"combat","LIAM",1,0,0,0
"1887","Vestiges",5,6,1887,"combat","LIAM","25?",8068.477,8069.87,1.39300000000003,2,0.00143575017946874,2,"combat","LIAM",1,0,0,0
"1888","Vestiges",5,6,1888,"combat","MATT","you push the door open and you see immediately, the fast moving heft of some large blade towards your head.",8069.87,8083.073,13.2030000000004,21,0.00159054760281749,2,"combat","MATT",0,0,0,1
"1889","Vestiges",5,6,1889,"combat","SAM","oh, snap!",8083.073,8084.778,1.70499999999993,3,0.00175953079178893,2,"combat","SAM",1,0,0,0
"1890","Vestiges",5,6,1890,"combat","LAURA","oh, it's kima.",8084.778,8085.944,1.16600000000017,5,0.00428816466552254,2,"combat","LAURA",1,0,0,0
"1891","Vestiges",5,6,1891,"combat","LIAM","no, it's a trap ready to hit me.",8085.944,8087.742,1.79799999999977,10,0.00556173526140225,2,"combat","LIAM",1,0,0,0
"1892","Vestiges",5,6,1892,"combat","MATT","that is 24 versus armor class.",8087.742,8090.536,2.79399999999987,7,0.00250536864710105,2,"combat","MATT",0,0,0,1
"1893","Vestiges",5,6,1893,"combat","LIAM","that hits.",8090.536,8091.668,1.13199999999961,3,0.00265017667844615,2,"combat","LIAM",1,0,0,0
"1894","Vestiges",5,6,1894,"combat","MATT","that hits, all right.",8091.668,8093.137,1.46900000000005,5,0.00340367597004753,2,"combat","MATT",0,0,0,1
"1895","Vestiges",5,6,1895,"combat","LAURA","oh, you didn't check for traps.",8093.137,8094.618,1.48100000000068,8,0.00540175557055796,2,"combat","LAURA",1,0,0,0
"1896","Vestiges",5,6,1896,"combat","TRAVIS","i thought you were good at this shit.",8094.618,8095.771,1.15299999999934,9,0.0078057241977495,2,"combat","TRAVIS",1,0,0,0
"1897","Vestiges",5,6,1897,"combat","LIAM","i'm going to use uncanny dodge.",8095.771,8096.977,1.20600000000013,8,0.00663349917081188,2,"combat","LIAM",1,0,0,0
"1898","Vestiges",5,6,1898,"combat","MATT","what would have been 20 points of slashing damage is reduced to 10. so you take 10 damage as the axe hits you and imbeds itself in the wooden door, pulls back. now you see as a duergar wearing this nasty-looking black leather tunic with a hood pulled back, with a giant, gnarled, hefted greataxe, words escaped me on that one, has a bunch of scars on its face. as it's grinning, it pulls the axe out of the doorway.",8096.977,8126.584,29.607,83,0.00280339108994495,2,"combat","MATT",0,0,0,1
"1899","Vestiges",5,6,1899,"combat","LIAM","right, i spit on the ground, and yank my belt off and throw it at his head.",8126.584,8130.23,3.64599999999973,18,0.00493691716950119,2,"combat","LIAM",1,0,0,0
"1900","Vestiges",5,6,1900,"combat","LAURA","and i yell ‘hold.’",8130.23,8131.591,1.36100000000079,5,0.00367376928728664,2,"combat","LAURA",1,0,0,0
"1901","Vestiges",5,6,1901,"combat","MATT","okay. as you throw the belt",8131.591,8134.076,2.48499999999967,6,0.00241448692152949,2,"combat","MATT",0,0,0,1
"1902","Vestiges",5,6,1902,"combat","SAM","hold?",8134.076,8135.451,1.375,2,0.00145454545454545,2,"combat","SAM",1,0,0,0
"1903","Vestiges",5,6,1903,"combat","LAURA","yeah, tell him to stop attacking.",8135.451,8136.85,1.39900000000034,7,0.00500357398141407,2,"combat","LAURA",1,0,0,0
"1904","Vestiges",5,6,1904,"combat","LIAM","yeah, serpent.",8136.85,8137.985,1.13499999999931,3,0.00264317180616901,2,"combat","LIAM",1,0,0,0
"1905","Vestiges",5,6,1905,"combat","MATT","he ducks out of the way, pulls back out of the way, as the snake forms itself. it goes ahead and makes its attack. go ahead and roll for snake attack against him.",8137.985,8150.433,12.4480000000003,34,0.00273136246786625,2,"combat","MATT",0,0,0,1
"1906","Vestiges",5,6,1906,"combat","SAM","snake attack!",8150.433,8152.098,1.66499999999996,3,0.00180180180180184,2,"combat","SAM",1,0,0,0
"1907","Vestiges",5,6,1907,"combat","LIAM","okay, 12 plus, i don't know what, 12. is my attack, his attack, snake attack?",8152.098,8155.802,3.70399999999972,17,0.00458963282937399,2,"combat","LIAM",1,0,0,0
"1908","Vestiges",5,6,1908,"combat","MATT","did you roll a 12 on that?",8155.802,8156.699,0.896999999999935,8,0.00891861761427044,2,"combat","MATT",0,0,0,1
"1909","Vestiges",5,6,1909,"combat","LIAM","yeah.",8156.699,8157.422,0.722999999999956,2,0.0027662517289075,2,"combat","LIAM",1,0,0,0
"1910","Vestiges",5,6,1910,"combat","MATT","okay, that will not hit unfortunately.",8157.422,8158.986,1.56400000000031,7,0.00447570332480731,2,"combat","MATT",0,0,0,1
"1911","Vestiges",5,6,1911,"combat","LIAM","all right.",8158.986,8159.808,0.822000000000116,3,0.00364963503649583,2,"combat","LIAM",1,0,0,0
"1912","Vestiges",5,6,1912,"combat","MATT","as he slaps it off himself and it cascades off to the side of the room.",8159.808,8163.711,3.90300000000025,17,0.00435562387906711,2,"combat","MATT",0,0,0,1
"1913","Vestiges",5,6,1913,"combat","ASHLEY","is he in a cell?",8163.711,8165.004,1.29299999999967,6,0.00464037122969958,2,"combat","ASHLEY",1,0,0,0
"1914","Vestiges",5,6,1914,"combat","TRAVIS","is a base attack a straight line from him to vax to",8165.004,8167.561,2.55699999999979,12,0.00469299960891709,2,"combat","TRAVIS",1,0,0,0
"1915","Vestiges",5,6,1915,"combat","SAM","he's protecting the cells.",8167.561,8168.857,1.29600000000028,6,0.00462962962962864,2,"combat","SAM",1,0,0,0
"1916","Vestiges",5,6,1916,"combat","ASHLEY","he's protecting the cells.",8168.857,8170.184,1.32700000000023,6,0.0045214770158244,2,"combat","ASHLEY",1,0,0,0
"1917","Vestiges",5,6,1917,"combat","MATT","at which point he kicks the door closed again.",8170.184,8171.539,1.35499999999956,10,0.00738007380074039,2,"combat","MATT",0,0,0,1
"1918","Vestiges",5,6,1918,"combat","TRAVIS","can i, in my rage, bullrush through this?",8171.539,8173.599,2.0600000000004,9,0.0043689320388341,2,"combat","TRAVIS",1,0,0,0
"1919","Vestiges",5,6,1919,"combat","SAM","yes, yes.",8173.599,8174.896,1.29699999999957,3,0.00231303006939167,2,"combat","SAM",1,0,0,0
"1920","Vestiges",5,6,1920,"combat","MATT","now roll initiative, guys.",8174.896,8178.421,3.52500000000055,5,0.00141843971631184,2,"combat","MATT",0,0,0,1
"1921","Vestiges",5,6,1921,"combat","ORION","as he's going i immediately cast stone skin on myself.",8178.423,8182.22,3.79700000000048,12,0.00316038978140597,2,"combat","ORION",1,0,0,0
"1922","Vestiges",5,6,1922,"combat","MATT","okay.",8182.22,8183.552,1.33199999999943,2,0.00150150150150215,2,"combat","MATT",0,0,0,1
"1923","Vestiges",5,6,1923,"combat","LIAM","what i like is that there are 8 of us and 1 of him.",8188.172,8190.978,2.80600000000049,15,0.00534568781183085,2,"combat","LIAM",1,0,0,0
"1924","Vestiges",5,6,1924,"combat","LAURA","possibly, if no one else is behind that door.",8190.978,8192.641,1.66299999999956,10,0.00601322910403047,2,"combat","LAURA",1,0,0,0
"1925","Vestiges",5,6,1925,"combat","TALIESIN","so far.",8192.641,8193.63,0.988999999999578,3,0.00303336703741282,2,"combat","TALIESIN",1,0,0,0
"1926","Vestiges",5,6,1926,"combat","LAURA","he's in a room by himself.",8193.63,8195.483,1.85300000000097,8,0.00431732325957679,2,"combat","LAURA",1,0,0,0
"1927","Vestiges",5,6,1927,"combat","LIAM","i can see the square, it's very small.",8195.483,8197.565,2.08200000000033,10,0.00480307396733832,2,"combat","LIAM",1,0,0,0
"1928","Vestiges",5,6,1928,"combat","MATT","you've looked inside, seeing a brief bit of the room. 25 to 20?",8199.366,8203.7,4.33400000000074,15,0.00346100599907647,2,"combat","MATT",0,0,0,1
"1929","Vestiges",5,6,1929,"combat","TALIESIN","26.",8203.7,8204.571,0.870999999999185,2,0.00229621125143728,2,"combat","TALIESIN",1,0,0,0
"1930","Vestiges",5,6,1930,"combat","LIAM","20.",8204.571,8205.661,1.09000000000015,2,0.00183486238532086,2,"combat","LIAM",1,0,0,0
"1931","Vestiges",5,6,1931,"combat","MATT","26, all right percy.",8205.661,8207.077,1.41599999999926,5,0.00353107344632953,2,"combat","MATT",0,0,0,1
"1932","Vestiges",5,6,1932,"combat","MATT","all right. 20 to 15?",8212.782,8214.382,1.60000000000036,6,0.00374999999999915,2,"combat","MATT",0,0,0,1
"1933","Vestiges",5,6,1933,"combat","MARISHA","18.",8214.382,8215.409,1.02700000000004,2,0.00194741966893857,2,"combat","MARISHA",1,0,0,0
"1934","Vestiges",5,6,1934,"combat","LAURA","15.",8215.409,8216.415,1.00600000000122,2,0.00198807157057412,2,"combat","LAURA",1,0,0,0
"1935","Vestiges",5,6,1935,"combat","ORION","19.",8216.415,8217.665,1.25,2,0.0016,2,"combat","ORION",1,0,0,0
"1936","Vestiges",5,6,1936,"combat","MATT","15 to 10?",8222.916,8224.532,1.61599999999999,4,0.0024752475247525,2,"combat","MATT",0,0,0,1
"1937","Vestiges",5,6,1937,"combat","TRAVIS","14.",8224.532,8225.945,1.41300000000047,2,0.00141542816702006,2,"combat","TRAVIS",1,0,0,0
