"","arc","arc_no","episode","turn_number","segment","actor","text","start_turn","end_turn","time_in_sec","word_count","words_per_ms","encounter_count","rp_combat","actor_guest","vox_machina","guest","staff","matt"
"706","Vestiges",5,60,706,"first_half_rp","MATT","the door opens, the guard comes around with food and hands it out to the rest of",4918.116,4923.139,5.02300000000014,17,0.00338443161457287,NA,"role_play","MATT",0,0,0,1
"707","Vestiges",5,60,707,"first_half_rp","LAURA","does anybody have money for a tip? because i think you're supposed to tip them.",4923.139,4926.095,2.95600000000013,17,0.00575101488497945,NA,"role_play","LAURA",1,0,0,0
"708","Vestiges",5,60,708,"first_half_rp","TRAVIS","yeah.",4926.095,4927.302,1.20699999999943,2,0.0016570008285012,NA,"role_play","TRAVIS",1,0,0,0
"709","Vestiges",5,60,709,"first_half_rp","MATT","""you're not supposed to tip your guards."" slams the door behind.",4927.302,4934.985,7.68299999999999,14,0.00182220486789015,NA,"role_play","MATT",0,0,0,1
"710","Vestiges",5,60,710,"first_half_rp","MARISHA","that's an emon tradition. we're overseas, remember.",4934.985,4939.519,4.53400000000056,10,0.00220555800617529,NA,"role_play","MARISHA",1,0,0,0
"711","Vestiges",5,60,711,"first_half_rp","TALIESIN","i like it here.",4939.519,4942.833,3.3139999999994,5,0.00150875075437565,NA,"role_play","TALIESIN",1,0,0,0
"712","Vestiges",5,60,712,"first_half_rp","MATT","all right. you finish your meal.",4942.833,4945.88,3.04700000000048,7,0.00229734164752179,NA,"role_play","MATT",0,0,0,1
"713","Vestiges",5,60,713,"first_half_rp","LAURA","it's delicious!",4945.88,4947.223,1.34299999999985,4,0.00297840655249475,NA,"role_play","LAURA",1,0,0,0
"714","Vestiges",5,60,714,"first_half_rp","MATT","and prepare yourselves for an excursion into the city of syngorn to seemingly steal a piece of the threshold crest and the high warden tyrelda's travel hat.",4947.223,4957.031,9.80799999999999,29,0.00295676998368679,NA,"role_play","MATT",0,0,0,1
"715","Vestiges",5,60,715,"first_half_rp","MARISHA","i turn into minxie and resign to the idea that i'm going to be sleeping with garmelie and trinket and just cuddle next to them in minxie mode.",4957.031,4967.728,10.6970000000001,30,0.00280452463307466,NA,"role_play","MARISHA",1,0,0,0
"716","Vestiges",5,60,716,"first_half_rp","LAURA","are you coming with us, though, keyleth?",4967.728,4969.668,1.9399999999996,8,0.00412371134020704,NA,"role_play","LAURA",1,0,0,0
"717","Vestiges",5,60,717,"first_half_rp","MARISHA","oh, we're not sleeping?",4969.668,4971.013,1.34500000000025,6,0.00446096654275008,NA,"role_play","MARISHA",1,0,0,0
"718","Vestiges",5,60,718,"first_half_rp","SAM","no. it's like one in the afternoon, so we'll probably just go.",4971.013,4976.094,5.08100000000013,15,0.00295217476874623,NA,"role_play","SAM",1,0,0,0
"719","Vestiges",5,60,719,"first_half_rp","LIAM","but you know, blow a couple more spells.",4976.094,4978.03,1.93599999999969,9,0.00464876033057925,NA,"role_play","LIAM",1,0,0,0
"720","Vestiges",5,60,720,"first_half_rp","MATT","so that's one use of your beast form.",4978.03,4981.049,3.01900000000023,10,0.0033123550844648,NA,"role_play","MATT",0,0,0,1
"721","Vestiges",5,60,721,"first_half_rp","LAURA","just come on, then.",4981.049,4985.705,4.65599999999995,5,0.00107388316151204,NA,"role_play","LAURA",1,0,0,0
"722","Vestiges",5,60,722,"first_half_rp","MARISHA","i'll come on.",4985.705,4987.156,1.45100000000002,5,0.00344589937973806,NA,"role_play","MARISHA",1,0,0,0
"723","Vestiges",5,60,723,"first_half_rp","LIAM","just save it. you can stay like that, just walk close to me.",4987.156,4989.769,2.61300000000028,14,0.00535782625334806,NA,"role_play","LIAM",1,0,0,0
"724","Vestiges",5,60,724,"first_half_rp","MARISHA","am i going to freak people out if i walk around like this?",4989.769,4992.542,2.77300000000014,14,0.00504868373602571,NA,"role_play","MARISHA",1,0,0,0
"725","Vestiges",5,60,725,"first_half_rp","TALIESIN","god, i hope so.",4992.542,4993.646,1.10399999999936,5,0.004528985507249,NA,"role_play","TALIESIN",1,0,0,0
"726","Vestiges",5,60,726,"first_half_rp","LAURA","fuck them, that's what i say.",4993.646,4995.365,1.71900000000005,8,0.00465386852821394,NA,"role_play","LAURA",1,0,0,0
"727","Vestiges",5,60,727,"first_half_rp","MATT","all right. you guys make your way outside into the city streets of syngorn to hopefully wait for the other guard, who returns about ten minutes later to tell you, ""it has been 'sheduled.'""",4995.365,5006.876,11.5110000000004,35,0.00304056988967064,NA,"role_play","MATT",0,0,0,1
"728","Vestiges",5,60,728,"first_half_rp","TRAVIS","ah, very good.",5006.876,5008.567,1.6909999999998,4,0.00236546422235391,NA,"role_play","TRAVIS",1,0,0,0
"729","Vestiges",5,60,729,"first_half_rp","MATT","""as soon as you wish, attend to the central palace and there you will be greeted.""",5008.567,5014.417,5.85000000000036,18,0.00307692307692289,NA,"role_play","MATT",0,0,0,1
"730","Vestiges",5,60,730,"first_half_rp","LAURA","okay.",5014.417,5015.672,1.2549999999992,2,0.00159362549800898,NA,"role_play","LAURA",1,0,0,0
"731","Vestiges",5,60,731,"first_half_rp","TRAVIS","yep.",5015.672,5016.753,1.08100000000013,2,0.00185013876040681,NA,"role_play","TRAVIS",1,0,0,0
"732","Vestiges",5,60,732,"first_half_rp","MATT","""are you leaving now?""",5016.753,5018.928,2.17500000000018,6,0.00275862068965494,NA,"role_play","MATT",0,0,0,1
"733","Vestiges",5,60,733,"first_half_rp","SAM","yes.",5018.928,5019.892,0.963999999999942,2,0.00207468879668062,NA,"role_play","SAM",1,0,0,0
"734","Vestiges",5,60,734,"first_half_rp","TRAVIS","well, we waste no time.",5019.892,5021.767,1.875,6,0.0032,NA,"role_play","TRAVIS",1,0,0,0
"735","Vestiges",5,60,735,"first_half_rp","MATT","makes a big whistle and the other guards come down, and collectively you now have four guards watching you guys.",5021.767,5027.537,5.77000000000044,21,0.00363951473136888,NA,"role_play","MATT",0,0,0,1
"736","Vestiges",5,60,736,"first_half_rp","TRAVIS","four?",5027.537,5028.606,1.06899999999951,2,0.00187090739008506,NA,"role_play","TRAVIS",1,0,0,0
"737","Vestiges",5,60,737,"first_half_rp","LAURA","yeah. there were four of them.",5028.606,5030.225,1.6190000000006,7,0.00432365657813306,NA,"role_play","LAURA",1,0,0,0
"738","Vestiges",5,60,738,"first_half_rp","MARISHA","i drop minxie form, because that seems very aggressive.",5030.225,5034.689,4.46399999999994,10,0.00224014336917566,NA,"role_play","MARISHA",1,0,0,0
"739","Vestiges",5,60,739,"first_half_rp","SAM","as we walk i say to what do we say to her?",5034.689,5046.635,11.9459999999999,13,0.00108823036999833,NA,"role_play","SAM",1,0,0,0
"740","Vestiges",5,60,740,"first_half_rp","MARISHA","can we have your hat?",5046.635,5048.479,1.84400000000005,6,0.0032537960954446,NA,"role_play","MARISHA",1,0,0,0
"741","Vestiges",5,60,741,"first_half_rp","LIAM","i don't think we should lead with that. maybe work our way around to it. well, i would like advice other than this little hairy man for how to get to the bog.",5048.479,5061.918,13.4389999999994,35,0.0026043604434855,NA,"role_play","LIAM",1,0,0,0
"742","Vestiges",5,60,742,"first_half_rp","LAURA","and also what we might face.",5061.918,5063.839,1.92100000000028,7,0.00364393545028578,NA,"role_play","LAURA",1,0,0,0
"743","Vestiges",5,60,743,"first_half_rp","LIAM","yes.",5063.839,5065.17,1.33100000000013,2,0.00150262960180301,NA,"role_play","LIAM",1,0,0,0
"744","Vestiges",5,60,744,"first_half_rp","LAURA","and how we can fight what we might face.",5065.17,5067.53,2.35999999999967,10,0.00423728813559381,NA,"role_play","LAURA",1,0,0,0
"745","Vestiges",5,60,745,"first_half_rp","MARISHA","she might know about fenthras and the bow.",5067.53,5069.673,2.14300000000003,9,0.00419972001866536,NA,"role_play","MARISHA",1,0,0,0
"746","Vestiges",5,60,746,"first_half_rp","LAURA","yes, exactly.",5069.673,5070.77,1.09700000000066,3,0.00273473108477501,NA,"role_play","LAURA",1,0,0,0
"747","Vestiges",5,60,747,"first_half_rp","TRAVIS","wait, scanlan, can't you go invisible too? what if you two little buggers just went off and like found it on your own while we were distracting captain fancy hat.",5070.77,5079.259,8.48899999999958,32,0.00376958416774668,NA,"role_play","TRAVIS",1,0,0,0
"748","Vestiges",5,60,748,"first_half_rp","SAM","find fenthras on our own, what?",5079.259,5083.185,3.92600000000039,7,0.00178298522669366,NA,"role_play","SAM",1,0,0,0
"749","Vestiges",5,60,749,"first_half_rp","TRAVIS","yeah, you go invisible along with fauny tim over here and you just go find the fucking hat.",5083.185,5088.856,5.67099999999937,19,0.00335037912184837,NA,"role_play","TRAVIS",1,0,0,0
"750","Vestiges",5,60,750,"first_half_rp","SAM","oh, the hat.",5088.856,5089.808,0.952000000000226,4,0.00420168067226791,NA,"role_play","SAM",1,0,0,0
"751","Vestiges",5,60,751,"first_half_rp","TRAVIS","yeah.",5089.808,5091.078,1.27000000000044,2,0.00157480314960576,NA,"role_play","TRAVIS",1,0,0,0
"752","Vestiges",5,60,752,"first_half_rp","MARISHA","what if she's wearing the hat? what if the hat is on her head?",5091.078,5094.339,3.26099999999951,16,0.00490647040785109,NA,"role_play","MARISHA",1,0,0,0
"753","Vestiges",5,60,753,"first_half_rp","TRAVIS","we kill everybody.",5094.339,5102.126,7.78700000000026,4,0.000513676640554753,NA,"role_play","TRAVIS",1,0,0,0
"754","Vestiges",5,60,754,"first_half_rp","TALIESIN","to be fair, that usually is the plan.",5102.126,5104.302,2.17599999999948,9,0.0041360294117657,NA,"role_play","TALIESIN",1,0,0,0
"755","Vestiges",5,60,755,"first_half_rp","MATT","and thus ended the story of vox machina, murdered terribly in the streets of syngorn by their own people.",5104.302,5111.502,7.20000000000073,20,0.0027777777777775,NA,"role_play","MATT",0,0,0,1
"756","Vestiges",5,60,756,"first_half_rp","TALIESIN","clutching a hat.",5111.502,5112.871,1.36899999999969,4,0.00292184075967927,NA,"role_play","TALIESIN",1,0,0,0
"757","Vestiges",5,60,757,"first_half_rp","TRAVIS","tarantino film.",5112.871,5114.224,1.35300000000007,3,0.00221729490022162,NA,"role_play","TRAVIS",1,0,0,0
"758","Vestiges",5,60,758,"first_half_rp","MATT","as you guys make your way towards the palace, formulating your plan, we're going to go ahead and take a quick bathroom break here. guys, about ten, 15 minutes or so, we'll be back here in just a little bit. so use your restrooms, stretch your legs and come back. we'll see you all here in a few minutes. [no audio]",5114.224,5145.239,31.0149999999994,65,0.00209576011607291,NA,"role_play","MATT",0,0,0,1
"759","Vestiges",5,60,759,"first_half_rp","MATT","that's a lot of people. welcome back. first off, i want to say a big thanks to amanda mclean for making our awesome graphic for our intermission, thank you amanda, appreciate that.",5145.239,5162.444,17.2050000000008,34,0.00197616971810511,NA,"role_play","MATT",0,0,0,1
"760","Vestiges",5,60,760,"first_half_rp","MATT","we are back. brought to you by loot crate. let's dive back in, as you guys make your way through the city of syngorn towards the palace to what would be the northern side of the city. eventually you come upon the large, slightly swirling stairs that lead to the front of the large brass and ivory surrounded doorway that leads to the interior. you guys have not actually been inside this palace before; you've only seen it from a distance, as your father would not let you in too close to the center of the city. as you make your way up the stairs, you can see guards, the verdant guards step out in an aggressive and defensive way, but the guards to your sides immediately put their hands up and signal them to put their arms down and to stand at ease. you guys are brought to the front, the doors open, and a small elderly elvish gentleman comes out, his long white hair almost touching the ground as he shuffles up. he brings a small monocle up to the side of his face. ""yes? do you have business in the palace?""",5162.444,5232.237,69.7929999999997,197,0.00282263264224207,NA,"role_play","MATT",0,0,0,1
"761","Vestiges",5,60,761,"first_half_rp","LIAM","g'day mate.",5232.237,5233.704,1.46699999999964,4,0.00272665303340216,NA,"role_play","LIAM",1,0,0,0
"762","Vestiges",5,60,762,"first_half_rp","MARISHA","good day.",5233.704,5235.089,1.38500000000022,3,0.00216606498194912,NA,"role_play","MARISHA",1,0,0,0
"763","Vestiges",5,60,763,"first_half_rp","LAURA","we do. we have a meeting with the high warden tyrelda.",5235.089,5239.882,4.79299999999967,12,0.00250365115793884,NA,"role_play","LAURA",1,0,0,0
"764","Vestiges",5,60,764,"first_half_rp","MATT","""let me see your papers. oh, i see they're right here. very well. follow me, please."" he turns around and walks his way into the building. you all follow suit and are led through the main entryway to the palace itself. on the inside you can see these giant archways that the pillars that hold them up look like trees that spread to the top like the stone boughs actually hold a canopy made of marble with beautiful portraits and long artistic renditions of the creation of syngorn, the people, each bloodline that has progressed and taken on the central political structure of the city. as it goes, you can see busts of people who have been of historical importance to syngorn, and eventually you're brought to the very end of this hallway. amongst a series of other offshoot hallways and doors, there is the next portion of this journey, this large central chamber. the door is already partially ajar. you are led into what seems to be the equivalent of a throne room, but it appears that there is a half-circle table in the center of the room and a series of chairs that now sit empty across from one side. your side. the other side of the table, you see sitting quietly and patiently, an older elven woman, you can see the grey in her hair and the crow's-nests at the corner of her eyes, which in elven years means she's quite old, she's probably close to 150 or 200 years old, by your gathering. they can live quite a long time. she would be in the equivalent of her late 50s.",5239.882,5342.392,102.51,283,0.00276070627255877,NA,"role_play","MATT",0,0,0,1
"765","Vestiges",5,60,765,"first_half_rp","SAM","not old enough for our party to kill mercilessly.",5342.392,5347.177,4.78499999999985,10,0.00208986415882974,NA,"role_play","SAM",1,0,0,0
"766","Vestiges",5,60,766,"first_half_rp","MATT","no, that's a whole different gauge.",5347.177,5350.097,2.92000000000007,8,0.00273972602739719,NA,"role_play","MATT",0,0,0,1
"767","Vestiges",5,60,767,"first_half_rp","LIAM","throwback thursday.",5350.097,5352.092,1.99499999999989,3,0.00150375939849632,NA,"role_play","LIAM",1,0,0,0
"768","Vestiges",5,60,768,"first_half_rp","LAURA","is she wearing a hat?",5352.092,5354.596,2.50399999999991,6,0.00239616613418539,NA,"role_play","LAURA",1,0,0,0
"769","Vestiges",5,60,769,"first_half_rp","MATT","she is not wearing a hat.",5354.596,5356.196,1.60000000000036,7,0.00437499999999901,NA,"role_play","MATT",0,0,0,1
"770","Vestiges",5,60,770,"first_half_rp","TRAVIS","shit. all right, she lives.",5356.196,5359.133,2.9369999999999,6,0.00204290091930548,NA,"role_play","TRAVIS",1,0,0,0
"771","Vestiges",5,60,771,"first_half_rp","MATT","the guard behind ushers you guys forward toward the chairs. you all get the idea that you should sit.",5359.133,5369.712,10.5790000000006,20,0.00189053785802049,NA,"role_play","MATT",0,0,0,1
"772","Vestiges",5,60,772,"break","SAM","we sit.",5369.712,5371.907,2.19499999999971,3,0.00136674259681112,NA,NA,"SAM",1,0,0,0
"773","Vestiges",5,60,773,"break","MATT","all right.",5371.907,5373.292,1.38500000000022,3,0.00216606498194912,NA,NA,"MATT",0,0,0,1
"774","Vestiges",5,60,774,"break","MARISHA","are there chairs for all of us?",5373.292,5375.08,1.78799999999956,8,0.00447427293064988,NA,NA,"MARISHA",1,0,0,0
"775","Vestiges",5,60,775,"break","MATT","there are chairs for all of you but trinket, who currently, one of the guards is helping to put his hands out in front to keep back, like.",5375.08,5385.122,10.0420000000004,29,0.00288787094204331,NA,NA,"MATT",0,0,0,1
"776","Vestiges",5,60,776,"break","LAURA","no.",5385.122,5386.517,1.39499999999953,2,0.00143369175627289,NA,NA,"LAURA",1,0,0,0
"777","Vestiges",5,60,777,"break","LIAM","that's a good way to lose a finger.",5386.517,5387.978,1.46100000000024,10,0.00684462696782913,NA,NA,"LIAM",1,0,0,0
"778","Vestiges",5,60,778,"break","LAURA","i wouldn't mess with him if i were you, just to be safe. and i walk up and i give trinket a kiss on the nose and i put him in his pokeball.",5387.978,5396.564,8.58600000000024,35,0.00407640344747252,NA,NA,"LAURA",1,0,0,0
"779","Vestiges",5,60,779,"break","MATT","the guard leaps back for a second. ""that's much easier.""",5396.603,5401.916,5.3130000000001,12,0.00225861095426309,NA,NA,"MATT",0,0,0,1
"780","Vestiges",5,60,780,"break","LAURA","just watch closely, buddy.",5401.916,5405.597,3.68099999999959,5,0.00135832654170078,NA,NA,"LAURA",1,0,0,0
"781","Vestiges",5,60,781,"break","MATT","you step back, you all find your seats.",5405.597,5408.712,3.11500000000069,9,0.00288924558587416,NA,NA,"MATT",0,0,0,1
"782","Vestiges",5,60,782,"break","LAURA","just talking to my boobs. no big deal.",5408.712,5413.333,4.62099999999919,9,0.00194763038303432,NA,NA,"LAURA",1,0,0,0
"783","Vestiges",5,60,783,"break","LIAM","buddy, buddy.",5413.333,5421.141,7.80799999999999,3,0.00038422131147541,NA,NA,"LIAM",1,0,0,0
"784","Vestiges",5,60,784,"break","MATT","this meeting room pavilion, and as you all have your seat, you see the high warden waiting there patiently, smile on her face but definitely an expression that shows both intelligence and guard. as you all sit, she looks about the group, asks, ""so you've all come and made arrangements to ""meet with me. you've come quite a ways and with very short notice. i'm curious as to what your ""reasonings are. please, state your business.""",5421.141,5453.185,32.0440000000008,80,0.00249656722007234,NA,NA,"MATT",0,0,0,1
"785","Vestiges",5,60,785,"break","LIAM","you probably recognize the two of us even if you don't know us. we're syldor's children. this is my sister vex'ahlia. i'm vax'ildan.",5453.185,5466.729,13.5439999999999,30,0.00221500295333729,NA,NA,"LIAM",1,0,0,0
"786","Vestiges",5,60,786,"break","MATT","""strange. it has been some time since you've been within the city. welcome.""",5466.729,5472.798,6.06899999999951,16,0.00263634865711012,NA,NA,"MATT",0,0,0,1
"787","Vestiges",5,60,787,"break","LIAM","thank you.",5472.798,5474.471,1.67299999999977,3,0.00179318589360455,NA,NA,"LIAM",1,0,0,0
"788","Vestiges",5,60,788,"break","LAURA","we're back because we're searching for a certain bow, fenthras? said to be within the murk something?",5474.471,5488.69,14.2190000000001,20,0.00140656867571559,NA,NA,"LAURA",1,0,0,0
"789","Vestiges",5,60,789,"break","LIAM","bog of eternal stench, i believe.",5488.69,5491.326,2.63600000000042,7,0.00265553869499199,NA,NA,"LIAM",1,0,0,0
"790","Vestiges",5,60,790,"break","MARISHA","shadowmurk bog. that's the one.",5491.326,5495.386,4.0600000000004,7,0.00172413793103431,NA,NA,"MARISHA",1,0,0,0
"791","Vestiges",5,60,791,"break","MATT","""the shademirk?""",5495.386,5496.532,1.14599999999973,4,0.00349040139616138,NA,NA,"MATT",0,0,0,1
"792","Vestiges",5,60,792,"break","MARISHA","shademirk. that's it.",5496.532,5498.133,1.60099999999966,5,0.00312304809494133,NA,NA,"MARISHA",1,0,0,0
"793","Vestiges",5,60,793,"break","LIAM","it's not on a lark. we're not a bunch of fly-by-nights. we've already stopped to see vex's and my father. over the last several months, we have been dealing, a little more closely than most would want, with the conclave, these dragons. we know that you are struggling to do the same. we have felled two of them, and i don't say that to brag, just to impress upon you how serious we are. we've come a long way, and we are in need of help. thank you, darling. i think that the city's intentions are in the best possible place. brings me a great deal of personal satisfaction, actually. i would like to offer our aid in service of the very same purpose, and that bow, in my sister's hands, will go a long way to felling more of these beasts.",5498.133,5579.754,81.6210000000001,153,0.0018745175873856,NA,NA,"LIAM",1,0,0,0
"794","Vestiges",5,60,794,"break","MATT","""well. you stroll in here with a great deal of arrogance and an air of self-importance. not in ""a way that is negative, more in a way that means you aspire, and i hope, not reaching beyond your ""means. if you have indeed felled these two members of the conclave as you say, then perhaps this ""errand to the shademirk is not as dangerous as one would expect. i would not deny you this, and if ""you indeed have these capabilities, you should have no issue surviving the mirk, ""you and your companions.""",5579.754,5621.356,41.6019999999999,96,0.00230758136628048,NA,NA,"MATT",0,0,0,1
"795","Vestiges",5,60,795,"break","LAURA","syldor sent us here because he said you would know what we might face in the shademirk.",5621.356,5629.077,7.72100000000046,18,0.00233130423520256,NA,NA,"LAURA",1,0,0,0
"796","Vestiges",5,60,796,"break","MATT","""well. the shademirk, as far as i understand, was once a very beautiful landscape. ""that once was the fountain heart of the gilded run that provided the flowing rivers that spun ""throughout this entire region. there was an archfey many years before who was turned on by his ""beloved, who had been growing so spiteful, so full of angst and anger and vengeful thoughts that it ""turned his heart dark and black and he began to spill into the fen around him. it was there that ""these lands became the shademirk. it was there that he became one with the land and corrupted it ""and turned it. dryads turned foul and shadowed. other creatures began to crawl up from the bog ""itself, and to this day feed off the life of those they can reach. the only thing that holds its ""spread at bay is the gilded run, the rapids. now, it's found balance, and we watched it spread, as ""those who've lived here for a long time do. it does not force any sort of immediate threat to any ""of us, and it serves its own purpose. it has its new i shouldn't say new, it's been hundreds of ""years now but its own life, its own biome. and we could not be ones to mess with that, if you ""will. but it is dangerous, and it is, for those who have scouted far enough to see it, say it is ""akin to wading through an oil slick. it is to walk into a hungry swamp that ""never gives up its need to feed.""",5629.077,5741.703,112.626,271,0.00240619395166302,NA,NA,"MATT",0,0,0,1
"797","Vestiges",5,60,797,"break","LAURA","sounds lovely.",5741.703,5743.458,1.7549999999992,3,0.00170940170940249,NA,NA,"LAURA",1,0,0,0
"798","Vestiges",5,60,798,"break","MATT","""yes, quite.""",5743.458,5745.067,1.60900000000038,4,0.00248601615910445,NA,NA,"MATT",0,0,0,1
"799","Vestiges",5,60,799,"break","LAURA","you say you've lived here. i know the city goes back and forth between the feywild. do you travel more freely?",5745.067,5758.429,13.3620000000001,23,0.00172129920670557,NA,NA,"LAURA",1,0,0,0
"800","Vestiges",5,60,800,"break","MATT","""i haven't in my older years. when i was younger, perhaps. it is important to maintain an ""idea of the current state of the feywild. every few decades, perhaps every generation, just to be ""certain when we have to undergo this transition that we don't come into the middle of a war zone ""in its own right. but i grow tired in my older years, and find myself chained to politics more ""often than not.""",5758.429,5784.764,26.335,79,0.00299981013859882,NA,NA,"MATT",0,0,0,1
"801","Vestiges",5,60,801,"break","LAURA","how did you make that transition so easily? i know that the threshold crests are how the city gets around.",5784.764,5796.936,12.1719999999996,21,0.00172527111403227,NA,NA,"LAURA",1,0,0,0
"802","Vestiges",5,60,802,"break","MATT","""well, there are thin areas between the planes, there are doorways, and we have magical ""means to send small scouting parties between this veil.""",5796.936,5810.554,13.6180000000004,26,0.00190923777353497,NA,NA,"MATT",0,0,0,1
"803","Vestiges",5,60,803,"break","SAM","go on.",5810.554,5814.713,4.15899999999965,3,0.000721327242125572,NA,NA,"SAM",1,0,0,0
"804","Vestiges",5,60,804,"break","LAURA","well, i don't want to be a bother, yes, but. do they entail any part of those threshold crests? i'm wondering because perhaps we might find ourselves in need of traveling, as well.",5814.713,5829.848,15.1350000000002,36,0.00237859266600591,NA,NA,"LAURA",1,0,0,0
"805","Vestiges",5,60,805,"break","LIAM","we know we're strangers. but we read much wisdom and experience in your eyes, and it would seem that you have encountered this place yourself, or have experience in the past with those who have, and we're just looking for an edge, really.",5829.848,5846.146,16.2979999999998,46,0.00282243220027001,NA,NA,"LIAM",1,0,0,0
"806","Vestiges",5,60,806,"break","MATT","you make a persuasion check.",5846.146,5848.866,2.72000000000025,6,0.00220588235294097,NA,NA,"MATT",0,0,0,1
"807","Vestiges",5,60,807,"break","LAURA","oh, do i want to roll this one or do i want to roll",5848.866,5852.414,3.54799999999977,14,0.00394588500563723,NA,NA,"LAURA",1,0,0,0
"808","Vestiges",5,60,808,"break","TRAVIS","oh, just pick one.",5852.414,5853.559,1.14500000000044,5,0.00436681222707257,NA,NA,"TRAVIS",1,0,0,0
"809","Vestiges",5,60,809,"break","LAURA","okay.",5853.559,5854.853,1.29399999999987,2,0.00154559505409598,NA,NA,"LAURA",1,0,0,0
"810","Vestiges",5,60,810,"break","MATT","the ever-plight of laura bailey.",5854.853,5857.141,2.28799999999956,7,0.00305944055944115,NA,NA,"MATT",0,0,0,1
"811","Vestiges",5,60,811,"break","LAURA","ooh! that's a good, that's a good, i'm glad i switched!",5857.141,5860.132,2.99099999999999,15,0.00501504513540624,NA,NA,"LAURA",1,0,0,0
"812","Vestiges",5,60,812,"break","TRAVIS","there are 300 fucking dice on this table.",5860.132,5864.067,3.9350000000004,9,0.00228716645489176,NA,NA,"TRAVIS",1,0,0,0
