"","Episode","startTime","endTime","Actor","Text","vox_machina","guest","staff","Matt","Arc","Arc_no","timeDiffInSecs","wordCount","WordsPerMillisec","segment","encounter_count","rp_combat","turn_number","CR_GUEST"
"969",63,3365.675,3367.951,"MATT","all right. so with her return, what are you guys gonna do?",0,0,0,1,"Vestiges",5,2.27599999999984,13,0.00571177504393713,"first_half",NA,"role_play",969,"MATT"
"970",63,3369.822,3371.933,"LAURA","do you wanna go, maybe?",1,0,0,0,"Vestiges",5,2.11099999999988,6,0.00284225485551888,"first_half",NA,"role_play",970,"LAURA"
"971",63,3371.933,3375.253,"SAM","yeah, i guess we should go in and see what going on, what's cooking in the kitchen.",1,0,0,0,"Vestiges",5,3.32000000000016,19,0.00572289156626478,"first_half",NA,"role_play",971,"SAM"
"972",63,3375.253,3376.177,"LAURA","okay.",1,0,0,0,"Vestiges",5,0.923999999999978,2,0.00216450216450222,"first_half",NA,"role_play",972,"LAURA"
"973",63,3376.177,3379.599,"MATT","as you guys rush into the kitchen, and looking around, you can see now every cabinet's pulled off of its hinges and shattered in half, what was a central stone island is now just a pile of smashed granite.",0,0,0,1,"Vestiges",5,3.42200000000003,41,0.0119812974868497,"first_half",NA,"role_play",973,"MATT"
"974",63,3386.892,3388.103,"SAM","damn it.",1,0,0,0,"Vestiges",5,1.21100000000024,3,0.00247729149463204,"first_half",NA,"role_play",974,"SAM"
"975",63,3388.103,3393.699,"MATT","every single possible breakable utensil, platter",0,0,0,1,"Vestiges",5,5.596,6,0.00107219442458899,"first_half",NA,"role_play",975,"MATT"
"976",63,3393.699,3395.554,"TRAVIS","don't forget the holes in the wall.",1,0,0,0,"Vestiges",5,1.85500000000002,9,0.00485175202156329,"first_half",NA,"role_play",976,"TRAVIS"
"977",63,3395.554,3400.831,"MATT","oh, it is just ruin. you see every servant is now on the ground trying to scoop things up, and as soon as they get a handful to go ahead and set it somewhere, just slapped out of their hand by a fist.",0,0,0,1,"Vestiges",5,5.27700000000004,44,0.00833807087360236,"first_half",NA,"role_play",977,"MATT"
"978",63,3407.685,3410.909,"SAM","grog, what are you doing? this is our kitchen and we need to eat dinner here!",1,0,0,0,"Vestiges",5,3.22400000000016,17,0.00527295285359775,"first_half",NA,"role_play",978,"SAM"
"979",63,3410.909,3417.455,"TRAVIS","i'm trying to activate these, and they require pain.",1,0,0,0,"Vestiges",5,6.54599999999982,11,0.00168041552092886,"first_half",NA,"role_play",979,"TRAVIS"
"980",63,3417.455,3422.97,"MATT","with that, what was once a large black cauldron that was used in soup and other sort of base-like liquids, is now, pwang, a large heavy ding is now on the inside in the shape of a fist, and it's half as useful.",0,0,0,1,"Vestiges",5,5.51499999999987,46,0.00834088848594761,"first_half",NA,"role_play",980,"MATT"
"981",63,3431.08,3431.984,"LAURA","grog!",1,0,0,0,"Vestiges",5,0.903999999999996,2,0.00221238938053098,"first_half",NA,"role_play",981,"LAURA"
"982",63,3431.984,3434.158,"TRAVIS","do i notice any difference in the gauntlets?",1,0,0,0,"Vestiges",5,2.17399999999998,9,0.00413983440662378,"first_half",NA,"role_play",982,"TRAVIS"
"983",63,3434.158,3437.778,"MATT","make a perception check.",0,0,0,1,"Vestiges",5,3.61999999999989,5,0.0013812154696133,"first_half",NA,"role_play",983,"MATT"
"984",63,3437.778,3439.361,"TRAVIS","at disadvantage?",1,0,0,0,"Vestiges",5,1.58300000000008,3,0.00189513581806686,"first_half",NA,"role_play",984,"TRAVIS"
"985",63,3439.361,3440.383,"LAURA","because you're super tired.",1,0,0,0,"Vestiges",5,1.02199999999993,6,0.00587084148728022,"first_half",NA,"role_play",985,"LAURA"
"986",63,3440.383,3442.3,"MATT","yes, because you haven't rested yet.",0,0,0,1,"Vestiges",5,1.91700000000037,8,0.00417318727177801,"first_half",NA,"role_play",986,"MATT"
"987",63,3442.3,3444.904,"TRAVIS","one less. ten.",1,0,0,0,"Vestiges",5,2.60399999999981,4,0.00153609831029197,"first_half",NA,"role_play",987,"TRAVIS"
"988",63,3444.904,3447.895,"MATT","no difference whatsoever.",0,0,0,1,"Vestiges",5,2.99099999999999,4,0.00133734536944166,"first_half",NA,"role_play",988,"MATT"
"989",63,3447.895,3452.06,"TRAVIS","maybe i need to hit people.",1,0,0,0,"Vestiges",5,4.16499999999996,7,0.00168067226890758,"first_half",NA,"role_play",989,"TRAVIS"
"990",63,3452.06,3453.772,"LIAM","i start backing away slow.",1,0,0,0,"Vestiges",5,1.71199999999999,6,0.00350467289719628,"first_half",NA,"role_play",990,"LIAM"
"991",63,3455.424,3458.512,"TALIESIN","i walk in at this point and i'm just looking for some chicken.",1,0,0,0,"Vestiges",5,3.08800000000019,15,0.00485751295336757,"first_half",NA,"role_play",991,"TALIESIN"
"992",63,3458.512,3461.363,"MARISHA","i also walk in. scanlan!",1,0,0,0,"Vestiges",5,2.85099999999966,6,0.00210452472816581,"first_half",NA,"role_play",992,"MARISHA"
"993",63,3461.363,3463.327,"LAURA","oh, you're not an earth elemental anymore.",1,0,0,0,"Vestiges",5,1.9640000000004,9,0.00458248472504999,"first_half",NA,"role_play",993,"LAURA"
"994",63,3463.327,3464.552,"MARISHA","are you remodeling?",1,0,0,0,"Vestiges",5,1.22499999999991,4,0.00326530612244922,"first_half",NA,"role_play",994,"MARISHA"
"995",63,3464.552,3465.431,"LAURA","that's too bad.",1,0,0,0,"Vestiges",5,0.878999999999905,5,0.0056882821387947,"first_half",NA,"role_play",995,"LAURA"
"996",63,3465.431,3470.85,"SAM","i didn't intend to, but grog has forgotten that i have a whole training ground downstairs that he could've used. grog, if you need to hit something, someone, i can give you a few of the servants.",1,0,0,0,"Vestiges",5,5.41899999999987,40,0.00738143568924174,"first_half",NA,"role_play",996,"SAM"
"997",63,3480.902,3482.13,"TRAVIS","would you?",1,0,0,0,"Vestiges",5,1.22800000000007,3,0.00244299674267088,"first_half",NA,"role_play",997,"TRAVIS"
"998",63,3482.13,3484.253,"SAM","sure, i've got like a hundred of them.",1,0,0,0,"Vestiges",5,2.12300000000005,10,0.0047103155911445,"first_half",NA,"role_play",998,"SAM"
"999",63,3484.253,3485.115,"TRAVIS","how many?",1,0,0,0,"Vestiges",5,0.861999999999625,3,0.00348027842227529,"first_half",NA,"role_play",999,"TRAVIS"
"1000",63,3485.115,3486.196,"SAM","you guys don't mind, do you?",1,0,0,0,"Vestiges",5,1.08100000000013,8,0.00740055504162723,"first_half",NA,"role_play",1000,"SAM"
"1001",63,3486.196,3487.839,"LAURA","wait, do they feel pain?",1,0,0,0,"Vestiges",5,1.64300000000003,6,0.00365185636031643,"first_half",NA,"role_play",1001,"LAURA"
"1002",63,3487.839,3491.178,"MATT","they all turn to you and kinda go.",0,0,0,1,"Vestiges",5,3.33899999999994,9,0.00269541778975746,"first_half",NA,"role_play",1002,"MATT"
"1003",63,3491.178,3492.81,"TRAVIS","how many can i have?",1,0,0,0,"Vestiges",5,1.63200000000006,6,0.00367647058823515,"first_half",NA,"role_play",1003,"TRAVIS"
"1004",63,3492.81,3494.903,"SAM","have a dozen. baker's dozen.",1,0,0,0,"Vestiges",5,2.09299999999985,7,0.00334448160535141,"first_half",NA,"role_play",1004,"SAM"
"1005",63,3494.903,3496.538,"TRAVIS","i go into the next room.",1,0,0,0,"Vestiges",5,1.63500000000022,7,0.00428134556574866,"first_half",NA,"role_play",1005,"TRAVIS"
"1006",63,3496.538,3497.869,"TALIESIN","a dozen bakers.",1,0,0,0,"Vestiges",5,1.33100000000013,4,0.00300525920360602,"first_half",NA,"role_play",1006,"TALIESIN"
"1007",63,3497.869,3499.105,"TRAVIS","with the dozen servants.",1,0,0,0,"Vestiges",5,1.23599999999988,5,0.0040453074433661,"first_half",NA,"role_play",1007,"TRAVIS"
"1008",63,3499.105,3501.501,"LAURA","go downstairs, grog!",1,0,0,0,"Vestiges",5,2.39600000000019,4,0.00166944908180288,"first_half",NA,"role_play",1008,"LAURA"
"1009",63,3501.501,3503.908,"TRAVIS","what if a change happens, don't you wanna be there?",1,0,0,0,"Vestiges",5,2.4069999999997,12,0.0049854590776907,"first_half",NA,"role_play",1009,"TRAVIS"
"1010",63,3503.908,3505.569,"LAURA","all right, yeah.",1,0,0,0,"Vestiges",5,1.66100000000006,4,0.00240818783865133,"first_half",NA,"role_play",1010,"LAURA"
"1011",63,3505.569,3509.724,"LIAM","scanlan, does your house unbreak itself if grog breaks it, you know, if it goes away, it poofs and it comes back, is all his damage there or does it",1,0,0,0,"Vestiges",5,4.1550000000002,30,0.00722021660649785,"first_half",NA,"role_play",1011,"LIAM"
"1012",63,3513.392,3517.147,"TRAVIS","please. grog always leaves his mark.",1,0,0,0,"Vestiges",5,3.75500000000011,7,0.00186418109187744,"first_half",NA,"role_play",1012,"TRAVIS"
"1013",63,3517.147,3523.434,"SAM","the damage, i believe, i've never seen damage this bad in our place before, but. i believe it will reset. it goes back to normal at the end.",1,0,0,0,"Vestiges",5,6.28700000000026,30,0.0047717512327022,"first_half",NA,"role_play",1013,"SAM"
"1014",63,3526.508,3528.609,"MATT","we'll find out.",0,0,0,1,"Vestiges",5,2.10100000000011,5,0.00237981913374571,"first_half",NA,"role_play",1014,"MATT"
"1015",63,3528.609,3530.579,"LAURA","we haven't looked at the spa since we destroyed it.",1,0,0,0,"Vestiges",5,1.97000000000025,12,0.00609137055837485,"first_half",NA,"role_play",1015,"LAURA"
"1016",63,3530.579,3532.416,"SAM","i haven't been down to the spa in a while.",1,0,0,0,"Vestiges",5,1.83699999999999,12,0.00653238976592274,"first_half",NA,"role_play",1016,"SAM"
"1017",63,3532.416,3535.761,"TRAVIS","i pick up one of the servants by the head and i try and crush his head.",1,0,0,0,"Vestiges",5,3.3449999999998,18,0.00538116591928283,"first_half",NA,"role_play",1017,"TRAVIS"
"1018",63,3535.761,3537.291,"LAURA","oh, no!",1,0,0,0,"Vestiges",5,1.5300000000002,3,0.00196078431372523,"first_half",NA,"role_play",1018,"LAURA"
"1019",63,3537.291,3539.854,"MATT","your fingers pass through its spectral form. there's no actual",0,0,0,1,"Vestiges",5,2.56299999999965,11,0.00429184549356282,"first_half",NA,"role_play",1019,"MATT"
"1020",63,3539.854,3543.117,"TRAVIS","make yourself grabbable.",1,0,0,0,"Vestiges",5,3.26300000000037,4,0.0012258657676983,"first_half",NA,"role_play",1020,"TRAVIS"
"1021",63,3543.117,3544.434,"SAM","you have to try harder, grog.",1,0,0,0,"Vestiges",5,1.31700000000001,7,0.00531511009870916,"first_half",NA,"role_play",1021,"SAM"
"1022",63,3544.434,3546.106,"MATT","passes through again.",0,0,0,1,"Vestiges",5,1.67200000000003,4,0.00239234449760762,"first_half",NA,"role_play",1022,"MATT"
"1023",63,3546.106,3553.459,"TRAVIS","fix this. you fix this now. i will break more stuff.",1,0,0,0,"Vestiges",5,7.35299999999961,12,0.00163198694410453,"first_half",NA,"role_play",1023,"TRAVIS"
"1024",63,3553.459,3555.7,"SAM","i thought that would work, honestly.",1,0,0,0,"Vestiges",5,2.24099999999999,7,0.00312360553324411,"first_half",NA,"role_play",1024,"SAM"
"1025",63,3555.7,3557.038,"TALIESIN","is keyleth still covered in goop?",1,0,0,0,"Vestiges",5,1.33800000000019,7,0.00523168908819058,"first_half",NA,"role_play",1025,"TALIESIN"
"1026",63,3557.038,3558.011,"TRAVIS","i punched the cow before.",1,0,0,0,"Vestiges",5,0.972999999999956,6,0.00616649537512875,"first_half",NA,"role_play",1026,"TRAVIS"
"1027",63,3558.011,3559.324,"LAURA","you did punch a cow.",1,0,0,0,"Vestiges",5,1.3130000000001,6,0.00456968773800422,"first_half",NA,"role_play",1027,"LAURA"
"1028",63,3559.324,3560.36,"MARISHA","i kinda fwooshed it off.",1,0,0,0,"Vestiges",5,1.03600000000006,6,0.00579150579150547,"first_half",NA,"role_play",1028,"MARISHA"
"1029",63,3560.36,3561.383,"TALIESIN","do you have any left on you?",1,0,0,0,"Vestiges",5,1.02299999999968,8,0.00782013685239734,"first_half",NA,"role_play",1029,"TALIESIN"
"1030",63,3561.383,3564.268,"LIAM","grog, he doesn't want you to know this, he told me this the last time you were here, you actually have to do that 33 times before it takes hold, so just keep going.",1,0,0,0,"Vestiges",5,2.88500000000022,36,0.0124783362218361,"first_half",NA,"role_play",1030,"LIAM"
"1031",63,3569.402,3573.663,"TRAVIS","i grab again. i grab again. i grab again. i grab again.",1,0,0,0,"Vestiges",5,4.26099999999997,13,0.00305092701243842,"first_half",NA,"role_play",1031,"TRAVIS"
"1032",63,3573.663,3580.509,"MATT","as you keep going, you're not even sure quite what a 33 is, but you just keep going. the servant stands there, its kind of loosely formless face, other than you can see eyes, a nose, and a mouth, but the features are very plain and translucent, just stay wide and staring straight at you.",0,0,0,1,"Vestiges",5,6.846,57,0.00832602979842243,"first_half",NA,"role_play",1032,"MATT"
"1033",63,3595.867,3598.477,"TRAVIS","fine, fine. bring me a cow.",1,0,0,0,"Vestiges",5,2.60999999999967,7,0.00268199233716509,"first_half",NA,"role_play",1033,"TRAVIS"
"1034",63,3598.477,3601.075,"LAURA","ohh.",1,0,0,0,"Vestiges",5,2.59799999999996,2,0.000769822940723647,"first_half",NA,"role_play",1034,"LAURA"
"1035",63,3601.142,3603.329,"SAM","we usually have one cow.",1,0,0,0,"Vestiges",5,2.18700000000035,6,0.00274348422496526,"first_half",NA,"role_play",1035,"SAM"
"1036",63,3603.329,3605.933,"MATT","the servants vanish and come back, you hear a familiar.",0,0,0,1,"Vestiges",5,2.60399999999981,11,0.00422427035330291,"first_half",NA,"role_play",1036,"MATT"
"1037",63,3605.933,3608.391,"LAURA","no, i hated it when you punched the cow!",1,0,0,0,"Vestiges",5,2.45800000000008,10,0.00406834825061011,"first_half",NA,"role_play",1037,"LAURA"
"1038",63,3608.391,3609.679,"TRAVIS","no, no, no.",1,0,0,0,"Vestiges",5,1.28800000000001,4,0.00310559006211178,"first_half",NA,"role_play",1038,"TRAVIS"
"1039",63,3609.679,3611.304,"TALIESIN","i'm going back to my room.",1,0,0,0,"Vestiges",5,1.625,8,0.00492307692307692,"first_half",NA,"role_play",1039,"TALIESIN"
"1040",63,3611.304,3613.518,"TRAVIS","it's time to ring this bell.",1,0,0,0,"Vestiges",5,2.21399999999994,8,0.0036133694670281,"first_half",NA,"role_play",1040,"TRAVIS"
"1041",63,3613.518,3614.655,"LAURA","no.",1,0,0,0,"Vestiges",5,1.13700000000017,2,0.00175901495162682,"first_half",NA,"role_play",1041,"LAURA"
"1042",63,3614.655,3615.946,"TRAVIS","i beat the shit out of the cow.",1,0,0,0,"Vestiges",5,1.29099999999971,9,0.00697134004647715,"first_half",NA,"role_play",1042,"TRAVIS"
"1043",63,3617.71,3620.69,"LAURA","that is awful. i leave, i can't watch, i go and look for chicken.",1,0,0,0,"Vestiges",5,2.98000000000002,16,0.00536912751677849,"first_half",NA,"role_play",1043,"LAURA"
"1044",63,3620.69,3624.957,"SAM","before you beat this poor senseless cow",1,0,0,0,"Vestiges",5,4.26699999999983,7,0.00164049683618474,"first_half",NA,"role_play",1044,"SAM"
"1045",63,3624.957,3627.113,"TRAVIS","it's a purple, like, ethereal cow.",1,0,0,0,"Vestiges",5,2.15599999999995,8,0.00371057513914666,"first_half",NA,"role_play",1045,"TRAVIS"
"1046",63,3627.113,3628.648,"MATT","yeah.",0,0,0,1,"Vestiges",5,1.53500000000031,2,0.00130293159609094,"first_half",NA,"role_play",1046,"MATT"
"1047",63,3628.648,3630.624,"LAURA","it's still a cow, it's still a cow, don't.",1,0,0,0,"Vestiges",5,1.97599999999966,13,0.00657894736842219,"first_half",NA,"role_play",1047,"LAURA"
"1048",63,3630.624,3636.047,"TRAVIS","i'm gonna rocky ribs the shit out of this cow.",1,0,0,0,"Vestiges",5,5.42300000000023,12,0.00221279734464309,"first_half",NA,"role_play",1048,"TRAVIS"
"1049",63,3636.047,3639.373,"LIAM","street fighter it?",1,0,0,0,"Vestiges",5,3.32600000000002,4,0.00120264582080576,"first_half",NA,"role_play",1049,"LIAM"
"1050",63,3639.373,3646.028,"MATT","bonus round. you take the next half an hour, beating the non-living crap out of this spectral cow, which, every impact has a sound hit. does not seem to react in pain as much as. there's no physical damage seen upon its form, it just gets knocked around.",0,0,0,1,"Vestiges",5,6.65499999999975,51,0.00766341096919639,"first_half",NA,"role_play",1050,"MATT"
"1051",63,3658.32,3658.941,"LAURA","that's good.",1,0,0,0,"Vestiges",5,0.62099999999964,4,0.00644122383253192,"first_half",NA,"role_play",1051,"LAURA"
"1052",63,3658.941,3663.91,"SAM","i've got an idea. i can fix this, grog, i want you to be a satisfied customer. let's go downstairs.",1,0,0,0,"Vestiges",5,4.96900000000005,23,0.00462869792714827,"first_half",NA,"role_play",1052,"SAM"
"1053",63,3665.239,3666.101,"TRAVIS","okay.",1,0,0,0,"Vestiges",5,0.86200000000008,2,0.00232018561484897,"first_half",NA,"role_play",1053,"TRAVIS"
"1054",63,3666.101,3667.356,"SAM","okay. i take him downstairs.",1,0,0,0,"Vestiges",5,1.25500000000011,6,0.00478087649402349,"first_half",NA,"role_play",1054,"SAM"
"1055",63,3667.356,3668.38,"MATT","all right.",0,0,0,1,"Vestiges",5,1.02399999999989,3,0.00292968750000032,"first_half",NA,"role_play",1055,"MATT"
"1056",63,3668.38,3675.367,"SAM","i say, you're gonna punch me and keep punching me as long as you can. all right?",1,0,0,0,"Vestiges",5,6.98700000000008,19,0.00271933590954627,"first_half",NA,"role_play",1056,"SAM"
"1057",63,3675.367,3676.42,"TRAVIS","are you sure?",1,0,0,0,"Vestiges",5,1.05299999999988,4,0.00379867046533755,"first_half",NA,"role_play",1057,"TRAVIS"
"1058",63,3676.42,3680.299,"SAM","and i transform into a triceratops.",1,0,0,0,"Vestiges",5,3.87899999999991,7,0.00180458881154941,"first_half",NA,"role_play",1058,"SAM"
"1059",63,3680.299,3683.231,"LAURA","awesome.",1,0,0,0,"Vestiges",5,2.93200000000024,2,0.000682128240109084,"first_half",NA,"role_play",1059,"LAURA"
"1060",63,3683.231,3685.825,"MARISHA","i go downstairs to watch.",1,0,0,0,"Vestiges",5,2.5939999999996,6,0.00231303006939126,"first_half",NA,"role_play",1060,"MARISHA"
"1061",63,3685.825,3688.806,"TRAVIS","is this my day-birth or something?",1,0,0,0,"Vestiges",5,2.98100000000022,8,0.00268366320026817,"first_half",NA,"role_play",1061,"TRAVIS"
"1062",63,3688.806,3691.702,"SAM","birthday. i mean,",1,0,0,0,"Vestiges",5,2.89600000000019,4,0.00138121546961317,"first_half",NA,"role_play",1062,"SAM"
"1063",63,3691.702,3695.941,"MATT","yes, as you hear the growling creature you've never seen before in your life, horns protruding from the front of its bony, armored headpiece, its scaled armored body standing before you, massive, snorting, you just start punching the crap out of it.",0,0,0,1,"Vestiges",5,4.23899999999958,44,0.0103798065581515,"first_half",NA,"role_play",1063,"MATT"
"1064",63,3708.363,3710.349,"TRAVIS","yeah. rage-punching.",1,0,0,0,"Vestiges",5,1.98600000000033,4,0.00201409869083552,"first_half",NA,"role_play",1064,"TRAVIS"
"1065",63,3714.298,3716.032,"SAM","i'm gonna fight back a little.",1,0,0,0,"Vestiges",5,1.73400000000038,8,0.00461361014994132,"first_half",NA,"role_play",1065,"SAM"
"1066",63,3716.032,3720.94,"MATT","a little bit? all right. you guys do begin to scrap back and forth for the next ten minutes. 'cause it takes ten minutes of solid punching and missing for grog to eventually whittle your triceratops hitpoints down to zero. however, in the process, you do manage to get a bit gored, suffering a total of nine points of piercing damage throughout the entirety of this, just little scrapes and scratches, the occasional puncture wound, but eventually you get one solid crack with the gauntlets across his face, and the triceratops form shifts back down to a tiny little scanlan shorthalt.",0,0,0,1,"Vestiges",5,4.9079999999999,102,0.02078239608802,"first_half",NA,"role_play",1066,"MATT"
"1067",63,3750.609,3752.684,"LAURA","don't hit him, don't hit him!",1,0,0,0,"Vestiges",5,2.07500000000027,9,0.00433734939758979,"first_half",NA,"role_play",1067,"LAURA"
"1068",63,3752.684,3760.614,"SAM","wait, wait, did it work? are your gauntlets better or whatever you're trying to do?",1,0,0,0,"Vestiges",5,7.92999999999984,17,0.00214375788146284,"first_half",NA,"role_play",1068,"SAM"
"1069",63,3760.614,3762.002,"TRAVIS","do i feel anything?",1,0,0,0,"Vestiges",5,1.38799999999992,5,0.00360230547550453,"first_half",NA,"role_play",1069,"TRAVIS"
"1070",63,3762.002,3763.119,"MATT","perception check.",0,0,0,1,"Vestiges",5,1.11700000000019,3,0.00268576544315084,"first_half",NA,"role_play",1070,"MATT"
"1071",63,3763.119,3767.14,"LAURA","you need to rest so you can perceive things better. oh.",1,0,0,0,"Vestiges",5,4.02099999999973,12,0.002984332255658,"first_half",NA,"role_play",1071,"LAURA"
"1072",63,3767.14,3770.809,"TALIESIN","can you roll lower?",1,0,0,0,"Vestiges",5,3.66900000000032,5,0.00136276914690639,"first_half",NA,"role_play",1072,"TALIESIN"
"1073",63,3770.809,3772.973,"TRAVIS","i could. there's one number lower.",1,0,0,0,"Vestiges",5,2.16399999999976,8,0.00369685767098008,"first_half",NA,"role_play",1073,"TRAVIS"
"1074",63,3776.533,3781.072,"MATT","no seeming change whatsoever. although no scarring. the good thing about the gauntlets is that they're powerful enough where all those impacts don't appear to have scratched or dented the surface.",0,0,0,1,"Vestiges",5,4.53900000000021,34,0.0074906367041195,"first_half",NA,"role_play",1074,"MATT"
"1075",63,3785.886,3787.669,"TRAVIS","no.",1,0,0,0,"Vestiges",5,1.7829999999999,2,0.00112170499158727,"first_half",NA,"role_play",1075,"TRAVIS"
"1076",63,3787.669,3789.023,"SAM","am i okay?",1,0,0,0,"Vestiges",5,1.35400000000027,4,0.00295420974889158,"first_half",NA,"role_play",1076,"SAM"
"1077",63,3789.023,3793.755,"MATT","you're a little sore. that last hit did carry over a little bit, the form didn't absorb the entirety of the blow. you did come back with, uh. four points of bludgeoning damage to your chin, so you're, you know, a little bit of blood on the corner of your lip that you can taste, and your jaw is a little sore on the right side.",0,0,0,1,"Vestiges",5,4.73199999999997,70,0.0147928994082841,"first_half",NA,"role_play",1077,"MATT"
"1078",63,3809.252,3814.032,"TALIESIN","just for fun while everything's going on, i'm running two passive experiments in my lab while i'm working on the shoes.",1,0,0,0,"Vestiges",5,4.7800000000002,25,0.00523012552301233,"first_half",NA,"role_play",1078,"TALIESIN"
"1079",63,3815.613,3816.332,"MATT","sure.",0,0,0,1,"Vestiges",5,0.719000000000051,2,0.00278164116828909,"first_half",NA,"role_play",1079,"MATT"
"1080",63,3816.332,3819.631,"MARISHA","oh, and i help him finish the shoes by helping druidcraft them.",1,0,0,0,"Vestiges",5,3.29899999999998,13,0.00394058805698699,"first_half",NA,"role_play",1080,"MARISHA"
"1081",63,3819.631,3823.112,"TALIESIN","i'm leaving some of the muck on some chicken that i took from the kitchen to see if it has any effect on flesh after a long exposure.",1,0,0,0,"Vestiges",5,3.48100000000022,30,0.0086182131571382,"first_half",NA,"role_play",1081,"TALIESIN"
"1082",63,3826.311,3827.389,"MATT","okay.",0,0,0,1,"Vestiges",5,1.07799999999997,2,0.00185528756957333,"first_half",NA,"role_play",1082,"MATT"
"1083",63,3827.389,3829.863,"TALIESIN","and then i'm distilling some to see if i can even identify anything in there or anything weird.",1,0,0,0,"Vestiges",5,2.47399999999971,20,0.0080840743734852,"first_half",NA,"role_play",1083,"TALIESIN"
"1084",63,3832.363,3835.604,"MATT","all right. so what are you guys doing now?",0,0,0,1,"Vestiges",5,3.24099999999999,10,0.00308546744831843,"first_half",NA,"role_play",1084,"MATT"
"1085",63,3835.604,3838.685,"TRAVIS","being disappointed.",1,0,0,0,"Vestiges",5,3.08100000000013,3,0.000973709834469287,"first_half",NA,"role_play",1085,"TRAVIS"
"1086",63,3838.685,3841.767,"TALIESIN","do you have to roll for that?",1,0,0,0,"Vestiges",5,3.08199999999988,8,0.00259571706683982,"first_half",NA,"role_play",1086,"TALIESIN"
"1087",63,3841.767,3842.192,"MATT","disadvantage.",0,0,0,1,"Vestiges",5,0.425000000000182,2,0.00470588235293916,"first_half",NA,"role_play",1087,"MATT"
"1088",63,3842.192,3843.198,"LAURA","natural 20.",1,0,0,0,"Vestiges",5,1.00599999999986,3,0.00298210735586523,"first_half",NA,"role_play",1088,"LAURA"
"1089",63,3847.335,3848.994,"LAURA","i was saying it, but it really happened!",1,0,0,0,"Vestiges",5,1.65900000000011,9,0.00542495479204305,"first_half",NA,"role_play",1089,"LAURA"
"1090",63,3848.994,3850.825,"TALIESIN","metaphor! metaphor!",1,0,0,0,"Vestiges",5,1.83099999999968,3,0.00163844893500848,"first_half",NA,"role_play",1090,"TALIESIN"
"1091",63,3850.825,3861.597,"SAM","you know what, grog, you could, it might make you feel better if you repaid the favor. i've been meaning to try to upgrade mythcarver.",1,0,0,0,"Vestiges",5,10.7720000000004,27,0.00250649832900102,"first_half",NA,"role_play",1091,"SAM"
"1092",63,3865.669,3868.23,"TRAVIS","yeah, come get it. come get it.",1,0,0,0,"Vestiges",5,2.56100000000015,8,0.00312377977352578,"first_half",NA,"role_play",1092,"TRAVIS"
"1093",63,3868.23,3875.452,"SAM","all right, i'm gonna do a stab. i'm gonna sing a note and see if this does anything to mythcarver. i'll just go and i'll try and jam it through his arm.",1,0,0,0,"Vestiges",5,7.22200000000021,37,0.00512323456106327,"first_half",NA,"role_play",1093,"SAM"
"1094",63,3881.233,3885.304,"MATT","okay, you hit up a scale of notes, and one note resonates with the blade, and the harmonic resonance kind of causes it to shake ever so slightly as it kind of amplifies the sound. go ahead and roll an attack.",0,0,0,1,"Vestiges",5,4.07099999999991,42,0.010316875460575,"first_half",NA,"role_play",1094,"MATT"
"1095",63,3891.383,3892.452,"LAURA","oh my god.",1,0,0,0,"Vestiges",5,1.06900000000041,4,0.00374181478016693,"first_half",NA,"role_play",1095,"LAURA"
"1096",63,3892.452,3894.618,"SAM","18 plus nine.",1,0,0,0,"Vestiges",5,2.16599999999971,4,0.00184672206832896,"first_half",NA,"role_play",1096,"SAM"
"1097",63,3894.618,3897.577,"MATT","that definitely hits. go ahead and roll damage.",0,0,0,1,"Vestiges",5,2.95900000000029,9,0.00304156809732988,"first_half",NA,"role_play",1097,"MATT"
"1098",63,3897.577,3907.116,"SAM","uh, not much. 1d8. three, six, plus one... ooh, nine!",1,0,0,0,"Vestiges",5,9.53899999999976,11,0.0011531607086697,"first_half",NA,"role_play",1098,"SAM"
"1099",63,3907.116,3911.887,"MATT","nine points of damage to you, grog, as the blade kinda sinks about four inches through one of your pectoral muscles.",0,0,0,1,"Vestiges",5,4.77100000000019,22,0.00461119262209163,"first_half",NA,"role_play",1099,"MATT"
