"","Episode","startTime","endTime","Actor","Text","vox_machina","guest","staff","Matt","Arc","Arc_no","timeDiffInSecs","wordCount","WordsPerMillisec","segment","encounter_count","rp_combat","turn_number","CR_GUEST"
"348",69,2537.249,2546.471,"SAM","yeah, you're right. all right. what time is it? how long have we been awake? should we let the airship know so they don't keep hovering?",1,0,0,0,"Vestiges",5,9.22200000000021,29,0.00314465408805024,"first_half",NA,"role_play",348,"SAM"
"349",69,2548.695,2551.623,"LAURA","yes. i'll fly over to them.",1,0,0,0,"Vestiges",5,2.92799999999988,8,0.00273224043715858,"first_half",NA,"role_play",349,"LAURA"
"350",69,2551.623,2553.118,"SAM","we have flares.",1,0,0,0,"Vestiges",5,1.49499999999989,4,0.00267558528428113,"first_half",NA,"role_play",350,"SAM"
"351",69,2553.118,2559.425,"LAURA","yeah, but they might not understand what it means. i'll fly over to them and tell them, what, they can go?",1,0,0,0,"Vestiges",5,6.30700000000024,23,0.00364674171555401,"first_half",NA,"role_play",351,"LAURA"
"352",69,2561.04,2570.79,"SAM","but we don't i guess. is there anything we need from them? they can bring the arm back to ank'harel. weren't we supposed to bring her arm back to ank'harel?",1,0,0,0,"Vestiges",5,9.75,35,0.00358974358974359,"first_half",NA,"role_play",352,"SAM"
"353",69,2575.719,2578.152,"LAURA","yeah, but there wasn't a time limit on that.",1,0,0,0,"Vestiges",5,2.43299999999999,11,0.00452116728318949,"first_half",NA,"role_play",353,"LAURA"
"354",69,2578.152,2579.417,"SAM","we'll mail it?",1,0,0,0,"Vestiges",5,1.26499999999987,5,0.00395256916996087,"first_half",NA,"role_play",354,"SAM"
"355",69,2579.417,2581.864,"LIAM","we'll just hold onto it for now.",1,0,0,0,"Vestiges",5,2.44700000000012,9,0.00367797302819762,"first_half",NA,"role_play",355,"LIAM"
"356",69,2581.864,2583.547,"SAM","okay.",1,0,0,0,"Vestiges",5,1.68299999999999,2,0.00118835412953061,"first_half",NA,"role_play",356,"SAM"
"357",69,2583.547,2587.24,"LAURA","i'll fly up to the airship.",1,0,0,0,"Vestiges",5,3.69299999999976,8,0.00216626049282441,"first_half",NA,"role_play",357,"LAURA"
"358",69,2587.24,2591.756,"MATT","okay. it's a little ways south of the island, but it was at the ready. all of its various arbalest setups are still ready for war. they're basically just waiting for your guys' order to come and attack. as you come to the edge, you see captain damon immediately rush up and goes, ""we saw some sort of explosion on the island. is everyone all right?"" immediately his expression drops, and he steps on to the back of his heels and drops his hands in front of him in a very business-type setup. ""i'm sorry.""",0,0,0,1,"Vestiges",5,4.51600000000008,100,0.0221434898139943,"first_half",NA,"role_play",358,"MATT"
"359",69,2620.26,2627.372,"LAURA","we're going to find another way back home. you can take the airship back to ank'harel if you want.",1,0,0,0,"Vestiges",5,7.11199999999963,22,0.00309336332958397,"first_half",NA,"role_play",359,"LAURA"
"360",69,2628.62,2630.128,"MATT","""where are you going?""",0,0,0,1,"Vestiges",5,1.50800000000027,6,0.00397877984084811,"first_half",NA,"role_play",360,"MATT"
"361",69,2630.128,2640.615,"LAURA","somewhere with... clerics. i don't know.",1,0,0,0,"Vestiges",5,10.4869999999996,8,0.000762849241918593,"first_half",NA,"role_play",361,"LAURA"
"362",69,2645.511,2655.123,"MATT","""very good. i guess, if you need me and my crew, come find us in ank'harel.""",0,0,0,1,"Vestiges",5,9.61200000000008,19,0.0019766957969205,"first_half",NA,"role_play",362,"MATT"
"363",69,2655.123,2659.34,"LAURA","of course. thank you.",1,0,0,0,"Vestiges",5,4.2170000000001,5,0.00118567702157929,"first_half",NA,"role_play",363,"LAURA"
"364",69,2659.34,2668.216,"MATT","""safe travels. crew!"" and he starts shouting out to the rest of everyone on the deck. as you coast off, you hear him shouting at a distance over the wind, ""we're going home. ""whatever that is these days."" you hear the flare of various magical crystals. the vibration creaks. they glow a brighter blue as the ship turns around.",0,0,0,1,"Vestiges",5,8.87599999999975,62,0.00698512843623274,"first_half",NA,"role_play",364,"MATT"
"365",69,2685.073,2687.238,"LAURA","oh shit. i go back.",1,0,0,0,"Vestiges",5,2.16499999999996,6,0.00277136258660513,"first_half",NA,"role_play",365,"LAURA"
"366",69,2688.914,2690.15,"MARISHA","did you leave your purse?",1,0,0,0,"Vestiges",5,1.23599999999988,6,0.00485436893203932,"first_half",NA,"role_play",366,"MARISHA"
"367",69,2690.15,2695.798,"LAURA","oh, my wallet! no, but i go back up and i say to captain damon: are you willing to join a fight?",1,0,0,0,"Vestiges",5,5.64799999999968,23,0.00407223796034017,"first_half",NA,"role_play",367,"LAURA"
"368",69,2700.586,2707.633,"MATT","""explain.""",0,0,0,1,"Vestiges",5,7.04700000000003,3,0.000425713069391229,"first_half",NA,"role_play",368,"MATT"
"369",69,2707.633,2717.326,"LAURA","those dragons destroyed our home. we could use an airship in the fight against them.",1,0,0,0,"Vestiges",5,9.69300000000021,16,0.00165067574538323,"first_half",NA,"role_play",369,"LAURA"
"370",69,2717.326,2725.077,"MATT","""we're outfitted to take down relatively dangerous prey, but""",0,0,0,1,"Vestiges",5,7.7510000000002,12,0.00154818733066697,"first_half",NA,"role_play",370,"MATT"
"371",69,2725.077,2727.63,"LAURA","you wouldn't be fighting alone.",1,0,0,0,"Vestiges",5,2.55299999999988,7,0.00274187230708982,"first_half",NA,"role_play",371,"LAURA"
"372",69,2727.63,2737.052,"MATT","""i mean no offense here, and the honorable goal is fantastic, ""but i also have a crew to feed.""",0,0,0,1,"Vestiges",5,9.42200000000003,21,0.00222882615156017,"first_half",NA,"role_play",372,"MATT"
"373",69,2738.611,2746.891,"LAURA","of course. there's a lot of gold there. a lot of riches.",1,0,0,0,"Vestiges",5,8.2800000000002,14,0.00169082125603861,"first_half",NA,"role_play",373,"LAURA"
"374",69,2746.891,2749.823,"MATT","make a persuasion roll.",0,0,0,1,"Vestiges",5,2.93199999999979,5,0.00170532060027297,"first_half",NA,"role_play",374,"MATT"
"375",69,2749.823,2751.653,"LAURA","i've been rolling so well tonight.",1,0,0,0,"Vestiges",5,1.82999999999993,8,0.00437158469945373,"first_half",NA,"role_play",375,"LAURA"
"376",69,2751.653,2754.02,"LIAM","this is the one.",1,0,0,0,"Vestiges",5,2.36700000000019,5,0.00211237853823388,"first_half",NA,"role_play",376,"LIAM"
"377",69,2754.02,2758.219,"LAURA","20?",1,0,0,0,"Vestiges",5,4.19900000000007,2,0.000476303881876629,"first_half",NA,"role_play",377,"LAURA"
"378",69,2758.219,2765.042,"MATT","""we'll learn the details later, but i'm happy to help. convincing them will take some ""coin, but where would you like us to go?""",0,0,0,1,"Vestiges",5,6.82299999999987,28,0.00410376667155218,"first_half",NA,"role_play",378,"MATT"
"379",69,2768.921,2771.811,"LAURA","oh shit. should i?",1,0,0,0,"Vestiges",5,2.89000000000033,5,0.00173010380622818,"first_half",NA,"role_play",379,"LAURA"
"380",69,2771.811,2773.466,"SAM","we're not there.",1,0,0,0,"Vestiges",5,1.65499999999975,5,0.00302114803625424,"first_half",NA,"role_play",380,"SAM"
"381",69,2773.466,2778.538,"LAURA","do you know where whitestone is?",1,0,0,0,"Vestiges",5,5.07200000000012,7,0.00138012618296527,"first_half",NA,"role_play",381,"LAURA"
"382",69,2778.538,2780.671,"MATT","""i've not been there, but i can figure it out.""",0,0,0,1,"Vestiges",5,2.13299999999981,13,0.00609470229723448,"first_half",NA,"role_play",382,"MATT"
"383",69,2780.671,2782.044,"LAURA","it's in the mountains.",1,0,0,0,"Vestiges",5,1.37300000000005,6,0.00436999271667866,"first_half",NA,"role_play",383,"LAURA"
"384",69,2782.044,2792.794,"MATT","he looks over, and you can see teera, who is the halfling with the rotted teeth, comes up and goes, ""i know that's by the alabaster sierras. i can get us there.""",0,0,0,1,"Vestiges",5,10.75,34,0.00316279069767442,"first_half",NA,"role_play",384,"MATT"
"385",69,2797.793,2802.835,"LAURA","i'm trusting you with that location.",1,0,0,0,"Vestiges",5,5.04199999999992,8,0.00158667195557321,"first_half",NA,"role_play",385,"LAURA"
"386",69,2802.835,2811.704,"MATT","""all right."" she bows her head and backs away, uncomfortable with the tension of the situation. captain damon goes, ""we'll meet you in whitestone.""",0,0,0,1,"Vestiges",5,8.86900000000014,27,0.00304431164731081,"first_half",NA,"role_play",386,"MATT"
"387",69,2816.974,2818.804,"LAURA","thank you.",1,0,0,0,"Vestiges",5,1.82999999999993,3,0.00163934426229515,"first_half",NA,"role_play",387,"LAURA"
"388",69,2818.804,2820.432,"MATT","""safe travels.""",0,0,0,1,"Vestiges",5,1.6279999999997,4,0.00245700245700291,"first_half",NA,"role_play",388,"MATT"
"389",69,2820.432,2821.62,"LAURA","you, as well.",1,0,0,0,"Vestiges",5,1.1880000000001,4,0.00336700336700308,"first_half",NA,"role_play",389,"LAURA"
"390",69,2821.62,2827.504,"MATT","the ship continues making its way southward, turning around slowly to start turning more northeast direction. you guys watch as you see the ship go overhead from the island, heading in the opposite direction of ank'harel. eventually, vex makes her way back to your location on the island.",0,0,0,1,"Vestiges",5,5.88400000000001,50,0.00849762066621344,"first_half",NA,"role_play",390,"MATT"
"391",69,2843.804,2847.865,"SAM","how'd it go with damon?",1,0,0,0,"Vestiges",5,4.06099999999969,7,0.00172371337109099,"first_half",NA,"role_play",391,"SAM"
"392",69,2847.865,2851.919,"LAURA","we're getting married. it's wonderful.",1,0,0,0,"Vestiges",5,4.05400000000009,8,0.00197335964479522,"first_half",NA,"role_play",392,"LAURA"
"393",69,2851.919,2853.082,"SAM","i knew it!",1,0,0,0,"Vestiges",5,1.16300000000001,4,0.00343938091143591,"first_half",NA,"role_play",393,"SAM"
"394",69,2853.082,2855.945,"LAURA","they're heading to whitestone.",1,0,0,0,"Vestiges",5,2.86300000000028,6,0.00209570380719504,"first_half",NA,"role_play",394,"LAURA"
"395",69,2855.945,2861.6,"SAM","aren't we not supposed to tell anybody about whitestone? didn't we have some blood pact, don't ever say the word whitestone?",1,0,0,0,"Vestiges",5,5.65499999999975,25,0.00442086648983221,"first_half",NA,"role_play",395,"SAM"
"396",69,2863.622,2864.58,"LAURA","we did.",1,0,0,0,"Vestiges",5,0.958000000000084,3,0.00313152400835046,"first_half",NA,"role_play",396,"LAURA"
"397",69,2864.58,2866.234,"SAM","also, isn't it invisible?",1,0,0,0,"Vestiges",5,1.654,6,0.00362756952841597,"first_half",NA,"role_play",397,"SAM"
"398",69,2866.234,2867.396,"LAURA","it is.",1,0,0,0,"Vestiges",5,1.16200000000026,3,0.0025817555938032,"first_half",NA,"role_play",398,"LAURA"
"399",69,2867.396,2871.039,"SAM","great. all right, well, maybe they'll find it, anyway.",1,0,0,0,"Vestiges",5,3.64300000000003,11,0.00301948943178696,"first_half",NA,"role_play",399,"SAM"
"400",69,2872.219,2873.599,"TRAVIS","shall we?",1,0,0,0,"Vestiges",5,1.38000000000011,3,0.00217391304347809,"first_half",NA,"role_play",400,"TRAVIS"
"401",69,2874.979,2876.895,"LIAM","can you do the thing, scan-man?",1,0,0,0,"Vestiges",5,1.91600000000017,8,0.00417536534446728,"first_half",NA,"role_play",401,"LIAM"
"402",69,2876.895,2879.625,"SAM","sure. i'll house it up.",1,0,0,0,"Vestiges",5,2.73000000000002,7,0.00256410256410255,"first_half",NA,"role_play",402,"SAM"
"403",69,2879.625,2890.915,"MATT","okay. as you summon scanlan's magnificent mansion, you all come to a familiar space, spectral servants waiting to wait on you. but the somber atmosphere still remains. you find your way to your respective rooms, and if there's anything you'd like to do before the evening's rest, now's the time to speak up.",0,0,0,1,"Vestiges",5,11.29,59,0.00522586359610276,"first_half",NA,"role_play",403,"MATT"
"404",69,2904.752,2911.222,"LIAM","hey, just an idea. everybody remembers when they were kids putting blankets out in the living room and sleeping. i don't really want to go back to my room. want to camp out in the den together?",1,0,0,0,"Vestiges",5,6.47000000000025,39,0.00602782071097349,"first_half",NA,"role_play",404,"LIAM"
"405",69,2918.851,2921.117,"MARISHA","yeah, we can make a blanket fort.",1,0,0,0,"Vestiges",5,2.26600000000008,8,0.00353045013239176,"first_half",NA,"role_play",405,"MARISHA"
"406",69,2922.497,2923.595,"SAM","sounds good.",1,0,0,0,"Vestiges",5,1.09799999999996,3,0.00273224043715858,"first_half",NA,"role_play",406,"SAM"
"407",69,2927.765,2930.646,"LAURA","didn't you ever have blanket forts, grog?",1,0,0,0,"Vestiges",5,2.88100000000031,9,0.00312391530718467,"first_half",NA,"role_play",407,"LAURA"
"408",69,2930.646,2932.004,"TRAVIS","i didn't have blankets.",1,0,0,0,"Vestiges",5,1.35799999999972,6,0.00441826215022182,"first_half",NA,"role_play",408,"TRAVIS"
"409",69,2932.004,2934.278,"LAURA","we'll show you how it's done.",1,0,0,0,"Vestiges",5,2.27399999999989,9,0.00395778364116115,"first_half",NA,"role_play",409,"LAURA"
"410",69,2935.228,2936.401,"TRAVIS","fine.",1,0,0,0,"Vestiges",5,1.17299999999977,2,0.00170502983802249,"first_half",NA,"role_play",410,"TRAVIS"
"411",69,2938.501,2940.567,"LIAM","where do we put percival?",1,0,0,0,"Vestiges",5,2.0659999999998,6,0.00290416263310773,"first_half",NA,"role_play",411,"LIAM"
"412",69,2943.897,2944.954,"TRAVIS","with us.",1,0,0,0,"Vestiges",5,1.05700000000024,3,0.00283822138126708,"first_half",NA,"role_play",412,"TRAVIS"
"413",69,2944.954,2947.608,"SAM","yeah. we're still a team.",1,0,0,0,"Vestiges",5,2.654,7,0.00263752825923135,"first_half",NA,"role_play",413,"SAM"
"414",69,2948.518,2950.462,"MARISHA","that sounds a little weird, you guys.",1,0,0,0,"Vestiges",5,1.94399999999996,8,0.00411522633744864,"first_half",NA,"role_play",414,"MARISHA"
"415",69,2950.462,2954.325,"SAM","well, we're not going to let him sleep alone. we'll put him on a table, and we'll all sleep around him on the floor. it'll be super weird.",1,0,0,0,"Vestiges",5,3.86299999999983,33,0.00854258348433897,"first_half",NA,"role_play",415,"SAM"
"416",69,2972.231,2980.311,"TRAVIS","i reach into the bag of holding, and i take out one of the ten expensive-ass bottles of wine. i take out two of them. i de-cork two. i hand one to vex and one to keyleth and say: it'll be a hard night, but you both have to sleep. drink this, and we will attempt to remedy this when we wake. the best thing you can do for your friend now is to sleep, so do that. save your tears for later.",1,0,0,0,"Vestiges",5,8.07999999999993,87,0.0107673267326734,"first_half",NA,"role_play",416,"TRAVIS"
"417",69,3004.999,3008.805,"MARISHA","keyleth also pulls a vex.",1,0,0,0,"Vestiges",5,3.80600000000004,6,0.00157645822385705,"first_half",NA,"role_play",417,"MARISHA"
"418",69,3008.805,3011.623,"MATT","all right.",0,0,0,1,"Vestiges",5,2.81800000000021,3,0.00106458481192327,"first_half",NA,"role_play",418,"MATT"
"419",69,3011.623,3022.243,"MARISHA","i take out the dagger and i hand it to vex to vax, sorry.",1,0,0,0,"Vestiges",5,10.6199999999999,15,0.00141242937853109,"first_half",NA,"role_play",419,"MARISHA"
"420",69,3022.243,3026.121,"LAURA","thank you, you already said it. you said it's mine. it's mine. i take one of the blankets, and i cover up percy.",1,0,0,0,"Vestiges",5,3.87800000000016,26,0.00670448684889091,"first_half",NA,"role_play",420,"LAURA"
"421",69,3034.644,3043.357,"MATT","you take that and cover him up and put him currently to rest on the ground. kynan is still by the door.",0,0,0,1,"Vestiges",5,8.71300000000019,23,0.00263973373120619,"first_half",NA,"role_play",421,"MATT"
"422",69,3045.171,3054.937,"LIAM","come here. two things. one, there's blue people all over the place in here. don't pay them any mind.",1,0,0,0,"Vestiges",5,9.76600000000008,22,0.00225271349580174,"first_half",NA,"role_play",422,"LIAM"
"423",69,3056.917,3057.967,"MATT","""yeah.""",0,0,0,1,"Vestiges",5,1.05000000000018,3,0.00285714285714236,"first_half",NA,"role_play",423,"MATT"
"424",69,3057.967,3064.077,"LIAM","stay in the room, but give us a little bit of space.",1,0,0,0,"Vestiges",5,6.11000000000013,13,0.00212765957446804,"first_half",NA,"role_play",424,"LIAM"
"425",69,3064.077,3065.653,"MATT","""of course.""",0,0,0,1,"Vestiges",5,1.57599999999957,4,0.00253807106599054,"first_half",NA,"role_play",425,"MATT"
"426",69,3065.653,3084.323,"LIAM","hey. we'll work it out. have faith.",1,0,0,0,"Vestiges",5,18.6700000000001,9,0.000482056775575788,"first_half",NA,"role_play",426,"LIAM"
"427",69,3084.323,3091.986,"MATT","he doesn't say anything.",0,0,0,1,"Vestiges",5,7.66300000000001,6,0.000782983165861933,"first_half",NA,"role_play",427,"MATT"
"428",69,3091.986,3093.499,"LIAM","i go back to the group.",1,0,0,0,"Vestiges",5,1.51299999999992,7,0.00462656972901545,"first_half",NA,"role_play",428,"LIAM"
"429",69,3093.499,3095.64,"TRAVIS","and we sleep.",1,0,0,0,"Vestiges",5,2.14100000000008,4,0.00186828584773464,"first_half",NA,"role_play",429,"TRAVIS"
"430",69,3095.64,3103.63,"MARISHA","i druidcraft little fireflies above us. make it all pretty, and sleep, too.",1,0,0,0,"Vestiges",5,7.99000000000024,14,0.00175219023779719,"first_half",NA,"role_play",430,"MARISHA"
"431",69,3103.63,3112.503,"MATT","you guys take an evening's rest within the mansion. you recover half of your hit die. whatever your maximum hit die is, you recover half that for the evening's rest. you're at full hit points, and your spells are returned to you.",0,0,0,1,"Vestiges",5,8.87300000000005,46,0.00518426687704269,"first_half",NA,"role_play",431,"MATT"
"432",69,3120.405,3124.448,"TRAVIS","what?",1,0,0,0,"Vestiges",5,4.04299999999967,2,0.000494682166707931,"first_half",NA,"role_play",432,"TRAVIS"
"433",69,3124.448,3125.941,"LAURA","we're normal again.",1,0,0,0,"Vestiges",5,1.49299999999994,5,0.00334896182183537,"first_half",NA,"role_play",433,"LAURA"
"434",69,3125.941,3127.84,"LIAM","well, that's debatable.",1,0,0,0,"Vestiges",5,1.89900000000034,5,0.0026329647182723,"first_half",NA,"role_play",434,"LIAM"
"435",69,3127.84,3132.458,"MATT","grog is at level 15, so you would get back eight of your hit dice that you've spent.",0,0,0,1,"Vestiges",5,4.61799999999994,20,0.00433087916847126,"first_half",NA,"role_play",435,"MATT"
"436",69,3132.458,3138.833,"LAURA","morning comes.",1,0,0,0,"Vestiges",5,6.375,3,0.000470588235294118,"first_half",NA,"role_play",436,"LAURA"
"437",69,3138.833,3156.793,"MATT","all right. what's the plan?",0,0,0,1,"Vestiges",5,17.96,7,0.000389755011135857,"first_half",NA,"role_play",437,"MATT"
"438",69,3156.793,3162.224,"SAM","well, we're recovered. how'd you guys sleep? everyone sleep okay? not great.",1,0,0,0,"Vestiges",5,5.43100000000004,15,0.00276192229791933,"first_half",NA,"role_play",438,"SAM"
"439",69,3162.224,3166.164,"LAURA","can we tree stride, keyleth? can we go?",1,0,0,0,"Vestiges",5,3.94000000000005,9,0.00228426395939083,"first_half",NA,"role_play",439,"LAURA"
"440",69,3166.164,3167.775,"MARISHA","yes, let's go.",1,0,0,0,"Vestiges",5,1.61099999999988,5,0.00310366232153965,"first_half",NA,"role_play",440,"MARISHA"
"441",69,3167.775,3174.975,"MATT","as you guys make your way to the front door, you see kynan is leaning against the wall of the front, his knees pushed to his chest. he hasn't slept. he has big bags under his eyes. he's just staring at the floor.",0,0,0,1,"Vestiges",5,7.19999999999982,46,0.00638888888888905,"first_half",NA,"role_play",441,"MATT"
"442",69,3185.994,3191.579,"TRAVIS","kynan, is it? do me a favor. sulk around this group a little bit later. otherwise, i might kill you right now. so fall in line and pick your chin up.",1,0,0,0,"Vestiges",5,5.58500000000004,32,0.0057296329453894,"first_half",NA,"role_play",442,"TRAVIS"
"443",69,3197.222,3204.061,"MATT","he's not reacting.",0,0,0,1,"Vestiges",5,6.83899999999994,5,0.00073110103816348,"first_half",NA,"role_play",443,"MATT"
"444",69,3204.061,3205.739,"LAURA","i give him some water.",1,0,0,0,"Vestiges",5,1.67799999999988,6,0.00357568533969036,"first_half",NA,"role_play",444,"LAURA"
"445",69,3205.739,3212.054,"MATT","he acknowledges as you place it down. he doesn't drink any of it.",0,0,0,1,"Vestiges",5,6.31500000000005,15,0.00237529691211399,"first_half",NA,"role_play",445,"MATT"
"446",69,3212.054,3215.368,"LAURA","you should get up. we're leaving.",1,0,0,0,"Vestiges",5,3.31399999999985,8,0.00241400120700071,"first_half",NA,"role_play",446,"LAURA"
"447",69,3215.368,3217.504,"MARISHA","are we bringing him with us?",1,0,0,0,"Vestiges",5,2.13599999999997,7,0.00327715355805248,"first_half",NA,"role_play",447,"MARISHA"
"448",69,3217.504,3218.729,"LAURA AND LIAM","yes.",1,0,0,0,"Vestiges",5,1.22499999999991,2,0.00163265306122461,"first_half",NA,"role_play",448,"LAURA AND LIAM"
"449",69,3218.729,3226.799,"MATT","he stands up slowly and just follows you like a ghost right now. what's the plan?",0,0,0,1,"Vestiges",5,8.07000000000016,18,0.00223048327137542,"first_half",NA,"role_play",449,"MATT"
"450",69,3226.799,3228.73,"SAM","got to find a tree.",1,0,0,0,"Vestiges",5,1.93100000000004,6,0.00310719834282749,"first_half",NA,"role_play",450,"SAM"
"451",69,3228.73,3231.052,"LAURA","go to tree. go to sun tree.",1,0,0,0,"Vestiges",5,2.32200000000012,8,0.00344530577088699,"first_half",NA,"role_play",451,"LAURA"
"452",69,3231.052,3232.876,"SAM","where we going?",1,0,0,0,"Vestiges",5,1.82400000000007,4,0.00219298245614027,"first_half",NA,"role_play",452,"SAM"
"453",69,3232.876,3234.612,"LAURA AND TRAVIS","whitestone.",1,0,0,0,"Vestiges",5,1.73599999999988,2,0.00115207373271898,"first_half",NA,"role_play",453,"LAURA AND TRAVIS"
"454",69,3234.612,3236.063,"SAM","okay.",1,0,0,0,"Vestiges",5,1.45100000000002,2,0.00137835975189522,"first_half",NA,"role_play",454,"SAM"
"455",69,3236.063,3239.059,"MARISHA","closest, biggest, fattest tree.",1,0,0,0,"Vestiges",5,2.99600000000009,5,0.00166889185580769,"first_half",NA,"role_play",455,"MARISHA"
"456",69,3239.059,3243.304,"MATT","it doesn't take you long. you've seen a few that'll work in your initial travel into the jungle here. you find one thick jungle tree that's probably 35 feet up, slightly curving at the top, one of the few living trees in this forest. it's a nice wide solid trunk, so it's perfect for you to do this. as you all gather around, making sure you have everything you need, keyleth, you reach out, touch, and mark the space where the doorway is to open. as you finish the casting of your spell, the bark of this striated palm tree-type structure falls away into the entrance. on the other side, you can see that brief, hazy glimmer of a cloud-covered day at whitestone. you all quickly rush through, one after another. portal closes behind as you all stand now leaping outside of the sun tree in the center of the main town square in whitestone. it is getting close to... the sun is setting. it's later in the afternoon, evening.",0,0,0,1,"Vestiges",5,4.24499999999989,180,0.0424028268551248,"first_half",NA,"role_play",456,"MATT"
"457",69,3315.193,3318.583,"LAURA","do we see anyone around? we get pike. we go to pike.",1,0,0,0,"Vestiges",5,3.38999999999987,13,0.00383480825958716,"first_half",NA,"role_play",457,"LAURA"
"458",69,3318.583,3320.684,"MARISHA","pike immediately.",1,0,0,0,"Vestiges",5,2.10100000000011,3,0.00142789148024742,"first_half",NA,"role_play",458,"MARISHA"
"459",69,3320.684,3323.997,"MATT","all right. there is still that faint shimmer on the sky above you.",0,0,0,1,"Vestiges",5,3.31299999999965,14,0.00422577724117159,"first_half",NA,"role_play",459,"MATT"
"460",69,3323.997,3327.042,"TRAVIS","i have percy over my shoulders, fireman carry.",1,0,0,0,"Vestiges",5,3.04500000000007,9,0.00295566502463047,"first_half",NA,"role_play",460,"TRAVIS"
"461",69,3327.042,3330.96,"MATT","as you guys arrive, a number of people who live in whitestone",0,0,0,1,"Vestiges",5,3.91800000000012,12,0.00306278713629393,"first_half",NA,"role_play",461,"MATT"
"462",69,3330.96,3334.704,"LAURA","what?",1,0,0,0,"Vestiges",5,3.74400000000014,2,0.000534188034188014,"first_half",NA,"role_play",462,"LAURA"
"463",69,3334.704,3340.938,"TRAVIS","yeah, around my shoulders. yeah. no. fireman carry.",1,0,0,0,"Vestiges",5,6.23399999999992,9,0.00144369586140522,"first_half",NA,"role_play",463,"TRAVIS"
"464",69,3340.938,3347.465,"MATT","as you guys begin walking away from the sun tree, you can see a bunch of townsfolk and some guards begin to walk up to greet you, and be like, ""you've returned"" immediately, the energy is felt and everyone steps away and gives you space as people begin to see the limp body of percival being held over grog's shoulder.",0,0,0,1,"Vestiges",5,6.52700000000004,63,0.00965221388080276,"first_half",NA,"role_play",464,"MATT"
"465",69,3365.037,3367.884,"LAURA","someone should get cassandra.",1,0,0,0,"Vestiges",5,2.84700000000021,5,0.00175623463294683,"first_half",NA,"role_play",465,"LAURA"
"466",69,3367.884,3373.641,"MARISHA","immediately. tell them we're coming. to prepare quarters.",1,0,0,0,"Vestiges",5,5.75700000000006,10,0.00173701580684382,"first_half",NA,"role_play",466,"MARISHA"
"467",69,3373.641,3380.773,"MATT","""right away."" the guard rushes off up towards the castle whitestone. are you guys walking towards the castle whitestone, as well?",0,0,0,1,"Vestiges",5,7.13200000000006,23,0.00322490185081321,"first_half",NA,"role_play",467,"MATT"
"468",69,3382.503,3383.754,"SAM","that's where pike is, right?",1,0,0,0,"Vestiges",5,1.25099999999975,7,0.00559552358113621,"first_half",NA,"role_play",468,"SAM"
"469",69,3383.754,3385.913,"LAURA","is she building a temple here?",1,0,0,0,"Vestiges",5,2.15900000000011,7,0.00324224177860105,"first_half",NA,"role_play",469,"LAURA"
"470",69,3385.913,3387.465,"MATT","there is a temple being built here, yes.",0,0,0,1,"Vestiges",5,1.55200000000013,9,0.00579896907216445,"first_half",NA,"role_play",470,"MATT"
"471",69,3387.465,3388.693,"SAM","in the castle?",1,0,0,0,"Vestiges",5,1.22800000000007,4,0.00325732899022784,"first_half",NA,"role_play",471,"SAM"
"472",69,3388.693,3392.385,"MATT","no. the temple would be within the city itself.",0,0,0,1,"Vestiges",5,3.69200000000001,10,0.00270855904658721,"first_half",NA,"role_play",472,"MATT"
