"","Episode","startTime","endTime","Actor","Text","vox_machina","guest","staff","Matt","Arc","Arc_no","timeDiffInSecs","wordCount","WordsPerMillisec","segment","encounter_count","rp_combat","turn_number","CR_GUEST"
"709",69,6047.598,6056.71,"SAM","i stood up for you when you were down, and they turned their backs on you. i give him a big hug, and i say: i think that entitles me to one of the guns that we found. just one of them. the smallest one. you can teach me how to use it on weekends.",1,0,0,0,"Vestiges",5,9.11200000000008,56,0.00614574187884103,"second_half",NA,"role_play",709,"SAM"
"710",69,6065.924,6071.933,"TALIESIN","we'll discuss this.",1,0,0,0,"Vestiges",5,6.00900000000001,5,0.000832085205525044,"second_half",NA,"role_play",710,"TALIESIN"
"711",69,6071.933,6074.562,"SAM","it's a hard yes i'm expecting.",1,0,0,0,"Vestiges",5,2.62899999999991,9,0.00342335488779016,"second_half",NA,"role_play",711,"SAM"
"712",69,6079.268,6082.593,"LIAM","laughter. laughter's back.",1,0,0,0,"Vestiges",5,3.32499999999982,5,0.00150375939849632,"second_half",NA,"role_play",712,"LIAM"
"713",69,6082.593,6097.007,"TALIESIN","it was not pleasant. thank you. thank you for what you did.",1,0,0,0,"Vestiges",5,14.4139999999998,13,0.000901900929651742,"second_half",NA,"role_play",713,"TALIESIN"
"714",69,6097.007,6098.926,"MARISHA","what?",1,0,0,0,"Vestiges",5,1.91900000000078,2,0.00104220948410588,"second_half",NA,"role_play",714,"MARISHA"
"715",69,6098.926,6100.438,"TALIESIN","i saw what you did.",1,0,0,0,"Vestiges",5,1.51199999999972,6,0.00396825396825471,"second_half",NA,"role_play",715,"TALIESIN"
"716",69,6100.438,6102.294,"MARISHA","what do you mean you saw what i did?",1,0,0,0,"Vestiges",5,1.85599999999977,10,0.00538793103448343,"second_half",NA,"role_play",716,"MARISHA"
"717",69,6102.294,6105.227,"TALIESIN","it was the only thing i saw.",1,0,0,0,"Vestiges",5,2.93299999999999,8,0.00272758267984999,"second_half",NA,"role_play",717,"TALIESIN"
"718",69,6105.227,6107.527,"MARISHA","did you hear me yell for you?",1,0,0,0,"Vestiges",5,2.30000000000018,8,0.00347826086956494,"second_half",NA,"role_play",718,"MARISHA"
"719",69,6107.527,6114.854,"TALIESIN","no, but i saw your hand. thank you.",1,0,0,0,"Vestiges",5,7.32700000000023,9,0.00122833356080247,"second_half",NA,"role_play",719,"TALIESIN"
"720",69,6114.854,6116.487,"MARISHA","percy.",1,0,0,0,"Vestiges",5,1.63299999999981,2,0.0012247397428048,"second_half",NA,"role_play",720,"MARISHA"
"721",69,6116.487,6121.976,"TALIESIN","yes? i'm glad that that's not waiting for me any more.",1,0,0,0,"Vestiges",5,5.48899999999958,14,0.00255055565676828,"second_half",NA,"role_play",721,"TALIESIN"
"722",69,6121.976,6124.664,"MARISHA","are you sure?",1,0,0,0,"Vestiges",5,2.6880000000001,4,0.00148809523809518,"second_half",NA,"role_play",722,"MARISHA"
"723",69,6124.664,6126.156,"LAURA","is he gone?",1,0,0,0,"Vestiges",5,1.49200000000019,4,0.00268096514745274,"second_half",NA,"role_play",723,"LAURA"
"724",69,6126.156,6127.946,"MARISHA","do you still feel him?",1,0,0,0,"Vestiges",5,1.78999999999996,6,0.00335195530726264,"second_half",NA,"role_play",724,"MARISHA"
"725",69,6127.946,6138.36,"TALIESIN","i haven't felt him in a long time. i stopped feeling him after you did what you did. and then there was nothing, and then i was here. but in between, i did feel him, quite a bit. i'd rather not think about it at the moment.",1,0,0,0,"Vestiges",5,10.4139999999998,50,0.00480122911465346,"second_half",NA,"role_play",725,"TALIESIN"
"726",69,6157.243,6162.186,"MARISHA","you should rest and get better.",1,0,0,0,"Vestiges",5,4.9429999999993,7,0.00141614404207991,"second_half",NA,"role_play",726,"MARISHA"
"727",69,6162.186,6163.898,"TALIESIN","i think i'm going to rest.",1,0,0,0,"Vestiges",5,1.71200000000044,8,0.00467289719626047,"second_half",NA,"role_play",727,"TALIESIN"
"728",69,6163.898,6167.684,"LIAM","bedtime, percy.",1,0,0,0,"Vestiges",5,3.78600000000006,3,0.000792393026941351,"second_half",NA,"role_play",728,"LIAM"
"729",69,6167.684,6169.37,"TALIESIN","hello, pike!",1,0,0,0,"Vestiges",5,1.68599999999969,3,0.0017793594306053,"second_half",NA,"role_play",729,"TALIESIN"
"730",69,6169.37,6171.025,"ASHLEY","hi!",1,0,0,0,"Vestiges",5,1.65499999999975,2,0.0012084592145017,"second_half",NA,"role_play",730,"ASHLEY"
"731",69,6171.025,6175.566,"TALIESIN","i don't suppose you've had time to read any of those books.",1,0,0,0,"Vestiges",5,4.54100000000017,15,0.00330323717242886,"second_half",NA,"role_play",731,"TALIESIN"
"732",69,6175.566,6186.731,"ASHLEY","i've read all of them. just all of them. i've had lots of time on my hands.",1,0,0,0,"Vestiges",5,11.165,20,0.00179131213613973,"second_half",NA,"role_play",732,"ASHLEY"
"733",69,6186.731,6188.917,"TRAVIS","i want to insight-check pike.",1,0,0,0,"Vestiges",5,2.1860000000006,7,0.00320219579139893,"second_half",NA,"role_play",733,"TRAVIS"
"734",69,6191.458,6193.599,"MATT","roll an insight check. pike, roll a deception check.",0,0,0,1,"Vestiges",5,2.14100000000053,10,0.0046707146193356,"second_half",NA,"role_play",734,"MATT"
"735",69,6193.599,6198.055,"ASHLEY","yes! here we go!",1,0,0,0,"Vestiges",5,4.45600000000013,5,0.00112208258527824,"second_half",NA,"role_play",735,"ASHLEY"
"736",69,6198.055,6200.747,"MATT","what'd you roll?",0,0,0,1,"Vestiges",5,2.69200000000001,5,0.00185735512630014,"second_half",NA,"role_play",736,"MATT"
"737",69,6200.747,6202.25,"TRAVIS","11.",1,0,0,0,"Vestiges",5,1.5029999999997,2,0.00133067198935489,"second_half",NA,"role_play",737,"TRAVIS"
"738",69,6202.25,6203.558,"ASHLEY","all right.",1,0,0,0,"Vestiges",5,1.30799999999999,3,0.00229357798165139,"second_half",NA,"role_play",738,"ASHLEY"
"739",69,6203.558,6206.098,"MATT","pike, what'd you roll a deception check?",0,0,0,1,"Vestiges",5,2.53999999999996,9,0.00354330708661422,"second_half",NA,"role_play",739,"MATT"
"740",69,6206.098,6208.548,"ASHLEY","four.",1,0,0,0,"Vestiges",5,2.44999999999982,2,0.000816326530612306,"second_half",NA,"role_play",740,"ASHLEY"
"741",69,6211.331,6213.377,"MATT","she's lying through her fucking teeth, grog.",0,0,0,1,"Vestiges",5,2.04600000000028,9,0.00439882697947155,"second_half",NA,"role_play",741,"MATT"
"742",69,6213.377,6215.06,"TRAVIS","pike!",1,0,0,0,"Vestiges",5,1.68299999999999,2,0.00118835412953061,"second_half",NA,"role_play",742,"TRAVIS"
"743",69,6215.06,6219.245,"ASHLEY","hey, it was a joke! trying to make everyone laugh?",1,0,0,0,"Vestiges",5,4.18499999999949,11,0.00262843488649972,"second_half",NA,"role_play",743,"ASHLEY"
"744",69,6219.245,6222.899,"TALIESIN","you just lied to me. i'm so proud of you.",1,0,0,0,"Vestiges",5,3.65400000000045,12,0.00328407224958909,"second_half",NA,"role_play",744,"TALIESIN"
"745",69,6222.899,6224.756,"ASHLEY","i'm learning.",1,0,0,0,"Vestiges",5,1.85699999999997,4,0.00215401184706519,"second_half",NA,"role_play",745,"ASHLEY"
"746",69,6224.756,6227.124,"TALIESIN","i'm so proud of you.",1,0,0,0,"Vestiges",5,2.36799999999948,7,0.00295608108108173,"second_half",NA,"role_play",746,"TALIESIN"
"747",69,6227.124,6229.387,"TRAVIS","that was very clever, pike.",1,0,0,0,"Vestiges",5,2.26299999999992,6,0.00265134776844906,"second_half",NA,"role_play",747,"TRAVIS"
"748",69,6229.387,6231.562,"TALIESIN","you should do that more often.",1,0,0,0,"Vestiges",5,2.17500000000018,7,0.00321839080459743,"second_half",NA,"role_play",748,"TALIESIN"
"749",69,6231.562,6233.421,"ASHLEY","i give percy a big hug.",1,0,0,0,"Vestiges",5,1.85900000000038,7,0.00376546530392608,"second_half",NA,"role_play",749,"ASHLEY"
"750",69,6234.991,6237.478,"ASHLEY","please don't do that again?",1,0,0,0,"Vestiges",5,2.48700000000008,7,0.00281463610776026,"second_half",NA,"role_play",750,"ASHLEY"
"751",69,6237.478,6243.95,"TALIESIN","i can make no promises. oh, that hurts. hi.",1,0,0,0,"Vestiges",5,6.47199999999975,10,0.00154511742892466,"second_half",NA,"role_play",751,"TALIESIN"
"752",69,6243.95,6246.56,"TRAVIS","did you thank her for the necklace?",1,0,0,0,"Vestiges",5,2.61000000000058,8,0.00306513409961617,"second_half",NA,"role_play",752,"TRAVIS"
"753",69,6246.56,6250.482,"TALIESIN","thank you for the necklace. that was",1,0,0,0,"Vestiges",5,3.92199999999957,7,0.00178480367159632,"second_half",NA,"role_play",753,"TALIESIN"
"754",69,6250.482,6257.328,"ASHLEY","not enough?",1,0,0,0,"Vestiges",5,6.84600000000046,3,0.000438212094653783,"second_half",NA,"role_play",754,"ASHLEY"
"755",69,6257.328,6267.945,"TALIESIN","no, apparently just enough, because here we are, and she's been dealt with. so it was just enough. i'm very tired.",1,0,0,0,"Vestiges",5,10.6169999999993,24,0.00226052557219569,"second_half",NA,"role_play",755,"TALIESIN"
"756",69,6274.408,6278.07,"MARISHA","you should sleep, and we'll talk more tomorrow.",1,0,0,0,"Vestiges",5,3.66199999999935,10,0.00273074822501414,"second_half",NA,"role_play",756,"MARISHA"
"757",69,6278.07,6280.684,"TALIESIN","i'm going to not sleep in here, wherever this is.",1,0,0,0,"Vestiges",5,2.61400000000049,12,0.00459066564651789,"second_half",NA,"role_play",757,"TALIESIN"
"758",69,6280.684,6283.509,"MARISHA","no, this is still a construction zone.",1,0,0,0,"Vestiges",5,2.82499999999982,8,0.00283185840707983,"second_half",NA,"role_play",758,"MARISHA"
"759",69,6283.509,6285.728,"TALIESIN","is this what you've been building?",1,0,0,0,"Vestiges",5,2.21900000000005,8,0.0036052275799909,"second_half",NA,"role_play",759,"TALIESIN"
"760",69,6285.728,6292.649,"ASHLEY","yes. i know, it still needs some work. it's not very cozy yet, but it's coming around.",1,0,0,0,"Vestiges",5,6.92100000000028,20,0.00288975581563346,"second_half",NA,"role_play",760,"ASHLEY"
"761",69,6292.649,6298.455,"TALIESIN","i don't know if cozy is really the point. i'm going to lie down somewhere soft.",1,0,0,0,"Vestiges",5,5.80599999999959,19,0.00327247674819176,"second_half",NA,"role_play",761,"TALIESIN"
"762",69,6298.455,6302.158,"TRAVIS","we should all go back to the castle, then.",1,0,0,0,"Vestiges",5,3.70300000000043,10,0.00270051309748821,"second_half",NA,"role_play",762,"TRAVIS"
"763",69,6302.158,6310.103,"MARISHA","i'll go dump a few healing spells and stuff into him. let's get you to lie down first.",1,0,0,0,"Vestiges",5,7.94499999999971,21,0.0026431718061675,"second_half",NA,"role_play",763,"MARISHA"
"764",69,6310.103,6314.526,"MATT","so you go and heal him up. you guys make your way back to the castle. the guards are there waiting. as you enter, you can see there, sitting in the foyer, talking and discussing, is jarett and gilmore, who both look a little nervous and intense about apparently recently hearing what happened. as soon as you enter, gilmore turns. ""i take that as a good sign. he's standing.""",0,0,0,1,"Vestiges",5,4.42299999999977,71,0.0160524530861414,"second_half",NA,"role_play",764,"MATT"
"765",69,6341.487,6346.285,"TALIESIN","i am literally using my gun as a crutch.",1,0,0,0,"Vestiges",5,4.79799999999977,10,0.00208420175072957,"second_half",NA,"role_play",765,"TALIESIN"
"766",69,6346.285,6352.877,"MATT","""oh, come here, you white-haired fool!"" then he runs forward and lifts you up with a hug that hurts so much. he holds you up for a second and sets you back down. ""i know that hurt.""",0,0,0,1,"Vestiges",5,6.59200000000055,40,0.00606796116504803,"second_half",NA,"role_play",766,"MATT"
"767",69,6362.431,6367.319,"MATT","""and what did we learn? don't get killed again!""",0,0,0,1,"Vestiges",5,4.88800000000083,12,0.00245499181669353,"second_half",NA,"role_play",767,"MATT"
"768",69,6367.319,6374.831,"TALIESIN","third time's the charm, in theory. should we show them what we got?",1,0,0,0,"Vestiges",5,7.51199999999972,15,0.00199680511182116,"second_half",NA,"role_play",768,"TALIESIN"
"769",69,6374.831,6377.65,"SAM","what do we have?",1,0,0,0,"Vestiges",5,2.81899999999951,5,0.00177367860943628,"second_half",NA,"role_play",769,"SAM"
"770",69,6377.65,6380.591,"MARISHA","you heal 48 hit points, by the way.",1,0,0,0,"Vestiges",5,2.94100000000071,9,0.00306018361101592,"second_half",NA,"role_play",770,"MARISHA"
"771",69,6380.591,6382.819,"TALIESIN","thank you. i don't even know what hit point level i'm at.",1,0,0,0,"Vestiges",5,2.22800000000007,15,0.00673249551166946,"second_half",NA,"role_play",771,"TALIESIN"
"772",69,6382.819,6384.191,"MATT","you'd be at one.",0,0,0,1,"Vestiges",5,1.37199999999939,6,0.00437317784256755,"second_half",NA,"role_play",772,"MATT"
"773",69,6384.191,6385.685,"TALIESIN","i'm at 49.",1,0,0,0,"Vestiges",5,1.4940000000006,5,0.00334672021418876,"second_half",NA,"role_play",773,"TALIESIN"
"774",69,6385.685,6392.969,"LAURA","what do we have to show them?",1,0,0,0,"Vestiges",5,7.28399999999965,8,0.00109829763866013,"second_half",NA,"role_play",774,"LAURA"
"775",69,6392.969,6394.912,"TRAVIS","we have two vestiges to show them.",1,0,0,0,"Vestiges",5,1.94300000000021,8,0.00411734431291772,"second_half",NA,"role_play",775,"TRAVIS"
"776",69,6394.912,6398.311,"LAURA","oh shit, i haven't even looked at the cloak. i tucked it away.",1,0,0,0,"Vestiges",5,3.39899999999943,15,0.00441306266549059,"second_half",NA,"role_play",776,"LAURA"
"777",69,6398.311,6400.173,"TALIESIN","we have two vestiges.",1,0,0,0,"Vestiges",5,1.86200000000008,5,0.00268528464017174,"second_half",NA,"role_play",777,"TALIESIN"
"778",69,6400.173,6402.101,"LAURA","i pull out the cloak.",1,0,0,0,"Vestiges",5,1.92799999999988,6,0.00311203319502093,"second_half",NA,"role_play",778,"LAURA"
"779",69,6402.101,6403.361,"MATT","okay.",0,0,0,1,"Vestiges",5,1.26000000000022,2,0.00158730158730131,"second_half",NA,"role_play",779,"MATT"
"780",69,6403.361,6405.166,"SAM","get it identified.",1,0,0,0,"Vestiges",5,1.80500000000029,4,0.0022160664819941,"second_half",NA,"role_play",780,"SAM"
"781",69,6405.166,6414.274,"MATT","gilmore goes, ""i see you've also been prolific. here, let me have a look."" he takes the cloak and folding it over his hands, you see the sparkle of energy through the blue inside of it. he's like, ""very interesting."" he puts his hand over it, and his eyes flare with arcane energy. ""this is indeed ""cabal's ruin, one of the vestiges of divergence. well, to be specific about this: once attuned ""to whoever's wearing it, you have advantage on saving throws against spells and other magical ""effects, which is pretty badass, if i do say so myself. also, when you're hit by some sort of ""asshole's spell out there, you can use your reaction to have the cloak swallow part of it. ""you halve the damage you take from the spell, if there's any damage to be taken, ""and the cloak gains a number of charges equal to the spell level of the triggering spell.""",0,0,0,1,"Vestiges",5,9.10800000000017,164,0.0180061484409307,"second_half",NA,"role_play",781,"MATT"
"782",69,6471.052,6474.175,"LIAM","all this arcane terminology is fascinating.",1,0,0,0,"Vestiges",5,3.1230000000005,7,0.00224143451809122,"second_half",NA,"role_play",782,"LIAM"
"783",69,6474.175,6480.645,"MATT","it's the filter of game rules. you don't get a vestige now! you get whisper, keyleth.",0,0,0,1,"Vestiges",5,6.47000000000025,19,0.00293663060278196,"second_half",NA,"role_play",783,"MATT"
"784",69,6482.743,6487.936,"MATT","essentially, what this does is you can use your reaction to swallow a spell if you're hurt by one. even if you're not hurt by it, you can still swallow a spell. you can only use it once per short rest. but it does half damage to you and",0,0,0,1,"Vestiges",5,5.1929999999993,51,0.00982091276718792,"second_half",NA,"role_play",784,"MATT"
"785",69,6498.481,6502.474,"LIAM","excuse you.",1,0,0,0,"Vestiges",5,3.99300000000039,3,0.000751314800901504,"second_half",NA,"role_play",785,"LIAM"
"786",69,6502.474,6506.386,"MATT","it gains a number of charges equal to the spell level that you absorb. up to a maximum of six charges can be stored in the cloak. so, six charges. if you have the cloak on and you hit with an attack, you can expend any number of charges from the cloak to deal an additional 1d6 lightning damage per charge.",0,0,0,1,"Vestiges",5,3.91200000000026,62,0.0158486707566452,"second_half",NA,"role_play",786,"MATT"
"787",69,6521.964,6524.951,"LAURA","so you could do an additional 6d6 lightning damage?",1,0,0,0,"Vestiges",5,2.98700000000008,10,0.00334784064278531,"second_half",NA,"role_play",787,"LAURA"
"788",69,6524.951,6531.473,"MATT","yeah, onto an attack that you deal with the cloak. that's what cabal's ruin does.",0,0,0,1,"Vestiges",5,6.52199999999993,18,0.00275988960441585,"second_half",NA,"role_play",788,"MATT"
"789",69,6531.473,6534.005,"SAM","does it have to be a magic user to wear it?",1,0,0,0,"Vestiges",5,2.53200000000015,12,0.00473933649289071,"second_half",NA,"role_play",789,"SAM"
"790",69,6534.005,6540.451,"MATT","no. in fact, it doesn't channel through spells. it channels through physical attacks.",0,0,0,1,"Vestiges",5,6.44599999999991,15,0.00232702451132488,"second_half",NA,"role_play",790,"MATT"
"791",69,6540.451,6541.884,"MARISHA","oh, melee attacks.",1,0,0,0,"Vestiges",5,1.43299999999999,4,0.002791346824843,"second_half",NA,"role_play",791,"MARISHA"
"792",69,6541.884,6544.777,"MATT","melee weapon attacks is how the enchantment works.",0,0,0,1,"Vestiges",5,2.89300000000003,9,0.00311095748358103,"second_half",NA,"role_play",792,"MATT"
"793",69,6544.777,6550.041,"SAM","groggy? percy?",1,0,0,0,"Vestiges",5,5.26400000000012,3,0.000569908814589652,"second_half",NA,"role_play",793,"SAM"
"794",69,6550.041,6551.928,"LAURA","grog in a cloak?",1,0,0,0,"Vestiges",5,1.88699999999972,5,0.00264970853206187,"second_half",NA,"role_play",794,"LAURA"
"795",69,6551.928,6555.995,"LIAM","percy, you'd look pretty swag in that.",1,0,0,0,"Vestiges",5,4.06700000000001,9,0.00221293336611753,"second_half",NA,"role_play",795,"LIAM"
"796",69,6555.995,6558.283,"TALIESIN","i would.",1,0,0,0,"Vestiges",5,2.28800000000047,3,0.00131118881118854,"second_half",NA,"role_play",796,"TALIESIN"
"797",69,6558.283,6560.437,"SAM","but you already have a vestige.",1,0,0,0,"Vestiges",5,2.15399999999954,7,0.003249767873724,"second_half",NA,"role_play",797,"SAM"
"798",69,6560.437,6562.082,"TALIESIN","i do?",1,0,0,0,"Vestiges",5,1.64500000000044,3,0.00182370820668645,"second_half",NA,"role_play",798,"TALIESIN"
"799",69,6562.082,6564.062,"SAM","no, groggy. so does this go to percy?",1,0,0,0,"Vestiges",5,1.97999999999956,9,0.00454545454545555,"second_half",NA,"role_play",799,"SAM"
"800",69,6564.062,6568.175,"LIAM","yeah, this is going to david bowie you up. you should wear that.",1,0,0,0,"Vestiges",5,4.11300000000028,14,0.00340384147823949,"second_half",NA,"role_play",800,"LIAM"
"801",69,6568.175,6571.998,"MARISHA","it was worn by the woman who tried to kill you. and succeeded.",1,0,0,0,"Vestiges",5,3.82299999999941,14,0.00366204551399481,"second_half",NA,"role_play",801,"MARISHA"
"802",69,6571.998,6574.712,"SAM","that's pretty cool.",1,0,0,0,"Vestiges",5,2.71400000000085,5,0.00184229918938778,"second_half",NA,"role_play",802,"SAM"
"803",69,6574.712,6576.732,"TRAVIS","what about the other vestige?",1,0,0,0,"Vestiges",5,2.01999999999953,6,0.00297029702970367,"second_half",NA,"role_play",803,"TRAVIS"
"804",69,6576.732,6580.415,"LAURA AND MARISHA AND SAM","whisper.",1,0,0,0,"Vestiges",5,3.68299999999999,2,0.000543035568829759,"second_half",NA,"role_play",804,"LAURA AND MARISHA AND SAM"
"805",69,6580.415,6582.479,"LIAM","how are you doing, shaun?",1,0,0,0,"Vestiges",5,2.06400000000031,6,0.00290697674418562,"second_half",NA,"role_play",805,"LIAM"
"806",69,6582.479,6585.57,"MATT","""what do you mean? i'm doing fantastic.""",0,0,0,1,"Vestiges",5,3.09099999999944,10,0.00323519896473692,"second_half",NA,"role_play",806,"MATT"
"807",69,6585.57,6587.523,"LIAM","how are you holding up?",1,0,0,0,"Vestiges",5,1.95300000000043,6,0.00307219662058304,"second_half",NA,"role_play",807,"LIAM"
"808",69,6587.523,6591.308,"MATT","""it's a little rough, but it's okay."" ""i'm doing my job just as you are. ""i mean, you all look tired, exhausted, and emotionally drained. so do i! ""so i think we're all doing our part.""",0,0,0,1,"Vestiges",5,3.78499999999985,42,0.0110964332893003,"second_half",NA,"role_play",808,"MATT"
"809",69,6598.247,6600.631,"MARISHA","your parents are lovely, by the way.",1,0,0,0,"Vestiges",5,2.38400000000001,8,0.00335570469798656,"second_half",NA,"role_play",809,"MARISHA"
"810",69,6600.631,6603.593,"MATT","""ah, yes.""",0,0,0,1,"Vestiges",5,2.96199999999953,4,0.00135043889264032,"second_half",NA,"role_play",810,"MATT"
"811",69,6603.593,6605.354,"MARISHA","thank you so much again.",1,0,0,0,"Vestiges",5,1.76100000000042,6,0.00340715502555285,"second_half",NA,"role_play",811,"MARISHA"
"812",69,6605.354,6607.192,"TRAVIS","we gave them a bunch of water.",1,0,0,0,"Vestiges",5,1.83799999999974,8,0.00435255712731292,"second_half",NA,"role_play",812,"TRAVIS"
"813",69,6607.192,6611.501,"SAM","didn't he give us something to give to them? did we do that? yes, we gave them what you told us to.",1,0,0,0,"Vestiges",5,4.3090000000002,24,0.0055697377581803,"second_half",NA,"role_play",813,"SAM"
"814",69,6613.683,6614.977,"LAURA","the locket.",1,0,0,0,"Vestiges",5,1.29399999999987,3,0.00231839258114397,"second_half",NA,"role_play",814,"LAURA"
"815",69,6614.977,6617.114,"MATT","""thank you. i appreciate that.""",0,0,0,1,"Vestiges",5,2.13699999999972,7,0.00327562002807718,"second_half",NA,"role_play",815,"MATT"
"816",69,6617.114,6622.518,"MARISHA","we told them you're doing great and we told them you were doing fantastic and wonderful and successful.",1,0,0,0,"Vestiges",5,5.40400000000045,20,0.00370096225018474,"second_half",NA,"role_play",816,"MARISHA"
"817",69,6623.713,6627.522,"MATT","""well, thank you. when all this is done, i should go visit. it's been a while.""",0,0,0,1,"Vestiges",5,3.8090000000002,19,0.00498818587555763,"second_half",NA,"role_play",817,"MATT"
"818",69,6627.522,6629.806,"LIAM","they seem very proud of you.",1,0,0,0,"Vestiges",5,2.28399999999965,7,0.00306479859894968,"second_half",NA,"role_play",818,"LIAM"
"819",69,6629.806,6633.076,"MATT","""taken a while.""",0,0,0,1,"Vestiges",5,3.27000000000044,5,0.00152905198776738,"second_half",NA,"role_play",819,"MATT"
"820",69,6633.076,6638.783,"SAM","they told us you weren't potty-trained until you were six. is that true?",1,0,0,0,"Vestiges",5,5.70700000000033,16,0.00280357455756073,"second_half",NA,"role_play",820,"SAM"
"821",69,6638.783,6647.523,"MATT","""give me your dagger."" he takes it, runs his fingers on the blade. the slight curvature to it out there to the point. he does his identify. forged with a mercurial metal pulled from the far realm. light dances and shifts across this curved blade. it has a plus three bonus to attack and damage rolls made with the dagger. it also deals an additional 1d8 psychic damage on a hit. whenever whisper is thrown, you can choose to transform into shadow and merge with the blade, teleporting instantly to wherever the blade impacts. which means you can teleport as far as you can throw the dagger, which is the max range of the dagger. yeah, so 60 feet, you go wherever it throws to. if the target is a creature, you emerge adjacent to the target in a space of your choice around the creature. whenever you critically hit a creature with an attack with whisper, the target has to make a wisdom saving throw against a dc 18 or become frightened of you for one minute.",0,0,0,1,"Vestiges",5,8.73999999999978,180,0.0205949656750577,"second_half",NA,"role_play",821,"MATT"
"822",69,6699.15,6700.966,"LIAM","well, it's either pike or me.",1,0,0,0,"Vestiges",5,1.81600000000071,8,0.0044052863436106,"second_half",NA,"role_play",822,"LIAM"
"823",69,6702.366,6704.279,"LAURA","what about keyleth?",1,0,0,0,"Vestiges",5,1.91300000000047,4,0.00209095661264978,"second_half",NA,"role_play",823,"LAURA"
"824",69,6704.279,6706.086,"MATT","it's up to you guys.",0,0,0,1,"Vestiges",5,1.80699999999979,7,0.00387382401770936,"second_half",NA,"role_play",824,"MATT"
"825",69,6706.086,6710.061,"LIAM","you're going to fight with a little you want it?",1,0,0,0,"Vestiges",5,3.97499999999945,12,0.00301886792452872,"second_half",NA,"role_play",825,"LIAM"
"826",69,6710.061,6714.757,"MARISHA","i've been practicing my juggling, to be fair. i could use it in my knife juggling. yeah. no. what am i going to do with it?",1,0,0,0,"Vestiges",5,4.69599999999991,28,0.00596252129471902,"second_half",NA,"role_play",826,"MARISHA"
"827",69,6717.273,6723.688,"TRAVIS","i honestly would like to make a case for it. just consider one thing: i chase people around the battlefield. and i really have a hard time getting to them sometimes. it'd be really great to travel 50 feet, then throw another 60, and then be right on their fucking asses.",1,0,0,0,"Vestiges",5,6.41499999999996,53,0.00826188620420893,"second_half",NA,"role_play",827,"TRAVIS"
"828",69,6734.208,6737.644,"MARISHA","do they happen in the same turn? they happen in the same turn, yeah?",1,0,0,0,"Vestiges",5,3.4360000000006,15,0.0043655413271238,"second_half",NA,"role_play",828,"MARISHA"
"829",69,6737.644,6741.245,"MATT","yeah. the minute you throw and hit something, it immediately teleports you if you choose. it doesn't have to happen. you could throw it, and then it hits the ground and you stay where you are if you want to, but if you choose, you can travel with the blade and essentially appear nightcrawler-style in shadow next to whatever you hit.",0,0,0,1,"Vestiges",5,3.60099999999966,64,0.0177728408775357,"second_half",NA,"role_play",829,"MATT"
"830",69,6751.603,6759.535,"LIAM","this knife is so sexy, though, and you are so invulnerable to everything.",1,0,0,0,"Vestiges",5,7.93199999999979,14,0.00176500252143222,"second_half",NA,"role_play",830,"LIAM"
"831",69,6759.535,6767.752,"TRAVIS","i'm just saying, for consideration. obviously, daggers are your bag, baby.",1,0,0,0,"Vestiges",5,8.21700000000055,13,0.00158208591943521,"second_half",NA,"role_play",831,"TRAVIS"
"832",69,6767.752,6770.915,"LIAM","what if",1,0,0,0,"Vestiges",5,3.16299999999956,2,0.000632311097059842,"second_half",NA,"role_play",832,"LIAM"
