"","Episode","startTime","endTime","Actor","Text","vox_machina","guest","staff","Matt","Arc","Arc_no","timeDiffInSecs","wordCount","WordsPerMillisec","segment","encounter_count","rp_combat","turn_number","CR_GUEST"
"954",69,7595.975,7607.993,"TALIESIN","no. no, that's not a bad idea. we need a better way of communicating with them. and i'm rethinking. did you collect everything from the battle?",1,0,0,0,"Vestiges",5,12.018,29,0.00241304709602263,"second_half",NA,"role_play",954,"TALIESIN"
"955",69,7614.772,7617.131,"SAM","yes.",1,0,0,0,"Vestiges",5,2.35900000000038,2,0.000847816871555608,"second_half",NA,"role_play",955,"SAM"
"956",69,7617.131,7625.466,"TALIESIN","good. that is a discussion we should have in private downstairs. perhaps in the morning? bring everything downstairs and have a discussion with cassandra and anybody we trust.",1,0,0,0,"Vestiges",5,8.33500000000004,29,0.00347930413917215,"second_half",NA,"role_play",956,"TALIESIN"
"957",69,7635.812,7644.017,"LAURA","yes. we should sleep. you should. you look very tired.",1,0,0,0,"Vestiges",5,8.20499999999993,11,0.00134064594759294,"second_half",NA,"role_play",957,"LAURA"
"958",69,7644.017,7649.557,"TRAVIS","what time of the day is it right now?",1,0,0,0,"Vestiges",5,5.53999999999996,10,0.00180505415162456,"second_half",NA,"role_play",958,"TRAVIS"
"959",69,7649.557,7656.614,"MATT","it's getting later in the evening, close to 10pm, comparably, even though you guys woke up maybe three hours ago.",0,0,0,1,"Vestiges",5,7.05699999999979,22,0.00311747201360361,"second_half",NA,"role_play",959,"MATT"
"960",69,7660.896,7668.009,"LAURA","jetlag, man. it'll get you. i don't know what to do.",1,0,0,0,"Vestiges",5,7.11300000000028,14,0.00196822718965267,"second_half",NA,"role_play",960,"LAURA"
"961",69,7668.009,7673.378,"TALIESIN","we can have this conversation tonight. i'm going to feel miserable for a while.",1,0,0,0,"Vestiges",5,5.36899999999969,16,0.00298007077668112,"second_half",NA,"role_play",961,"TALIESIN"
"962",69,7673.378,7675.724,"MARISHA","i don't think it's a wise idea.",1,0,0,0,"Vestiges",5,2.34600000000046,10,0.00426257459505458,"second_half",NA,"role_play",962,"MARISHA"
"963",69,7675.724,7677.967,"TRAVIS","yeah, we could certainly let you sleep.",1,0,0,0,"Vestiges",5,2.24299999999948,8,0.0035666518056183,"second_half",NA,"role_play",963,"TRAVIS"
"964",69,7677.967,7683.153,"SAM","we do have to start planning for the next leg of our journey.",1,0,0,0,"Vestiges",5,5.1860000000006,14,0.00269957578094839,"second_half",NA,"role_play",964,"SAM"
"965",69,7683.153,7686.943,"LIAM","it's true, but percy needs to go the fuck to sleep, seriously.",1,0,0,0,"Vestiges",5,3.78999999999996,14,0.00369393139841692,"second_half",NA,"role_play",965,"LIAM"
"966",69,7686.943,7690.06,"TALIESIN","i will admit i fear sleep at the moment.",1,0,0,0,"Vestiges",5,3.11700000000019,10,0.00320821302534469,"second_half",NA,"role_play",966,"TALIESIN"
"967",69,7690.06,7692.929,"LAURA","how about some coffee, then?",1,0,0,0,"Vestiges",5,2.86899999999969,6,0.00209132101777646,"second_half",NA,"role_play",967,"LAURA"
"968",69,7692.929,7696.249,"LIAM","jack him up first?",1,0,0,0,"Vestiges",5,3.31999999999971,5,0.00150602409638567,"second_half",NA,"role_play",968,"LIAM"
"969",69,7696.249,7703.437,"TALIESIN","how am i physically, at the moment?",1,0,0,0,"Vestiges",5,7.1880000000001,8,0.00111296605453532,"second_half",NA,"role_play",969,"TALIESIN"
"970",69,7703.437,7709.174,"MATT","physically, you're sore and you're drained. the essence of the ritual and the following healing spells you're physically whole, but there is a very physical toll on you from the ritual as well.",0,0,0,1,"Vestiges",5,5.73700000000008,37,0.00644936377897847,"second_half",NA,"role_play",970,"MATT"
"971",69,7716.408,7718.313,"TALIESIN","so i'm not filled with holes or anything.",1,0,0,0,"Vestiges",5,1.90499999999975,10,0.0052493438320217,"second_half",NA,"role_play",971,"TALIESIN"
"972",69,7718.313,7724.129,"MATT","no, but you feel like a walking bruise, and every movement of your body is fraught with such physical exhaustion that you haven't felt, and only time is going to take care of that. you're effectively at minus four to any d20 rolls you make until you rest. then it becomes a minus three, then another night's rest becomes a minus two. so you're in a rough spot for the next few days, unless you're resting consistently.",0,0,0,1,"Vestiges",5,5.8159999999998,83,0.0142709766162316,"second_half",NA,"role_play",972,"MATT"
"973",69,7744.255,7753.278,"TALIESIN","we do have to have a conversation about all that. we either have it now or later.",1,0,0,0,"Vestiges",5,9.02300000000014,18,0.00199490191732237,"second_half",NA,"role_play",973,"TALIESIN"
"974",69,7754.459,7760.751,"TRAVIS","take a fucking nap, man! we'll convene in the morning!",1,0,0,0,"Vestiges",5,6.29200000000037,12,0.00190718372536543,"second_half",NA,"role_play",974,"TRAVIS"
"975",69,7760.751,7762.884,"LIAM","you're outvoted, percy. go to bed.",1,0,0,0,"Vestiges",5,2.13299999999981,8,0.00375058602906737,"second_half",NA,"role_play",975,"LIAM"
"976",69,7762.884,7764.699,"MARISHA","you literally just rose from the dead.",1,0,0,0,"Vestiges",5,1.8149999999996,8,0.00440771349862356,"second_half",NA,"role_play",976,"MARISHA"
"977",69,7764.699,7766.733,"TALIESIN","i'm going to need new clothes.",1,0,0,0,"Vestiges",5,2.03400000000056,8,0.00393313667649843,"second_half",NA,"role_play",977,"TALIESIN"
"978",69,7766.733,7771.413,"LIAM","nobody wants to talk to you right now. we want you to go to sleep. we're going to go have a drink and have a fabulous time. we'll see you in the morning.",1,0,0,0,"Vestiges",5,4.67999999999938,36,0.00769230769230871,"second_half",NA,"role_play",978,"LIAM"
"979",69,7774.814,7783.882,"TALIESIN","right. i'll see you in the morning. i'm going to go up to my room and pass out.",1,0,0,0,"Vestiges",5,9.0679999999993,21,0.00231583590648452,"second_half",NA,"role_play",979,"TALIESIN"
"980",69,7783.882,7789.261,"MATT","for the brief moment you have consciousness as you enter the room, it is a wondrous, welcoming sight. you have just enough time to get that thought across before you facedown in your bed and right to sleep. clothes still on, facedown from the corner of the bed. it's a terrible sight, but you don't care. the rest of you, what do you wish to do?",0,0,0,1,"Vestiges",5,5.37900000000081,69,0.0128276631344097,"second_half",NA,"role_play",980,"MATT"
"981",69,7805.993,7808.785,"LAURA","i give pike a huge hug.",1,0,0,0,"Vestiges",5,2.79199999999946,7,0.00250716332378272,"second_half",NA,"role_play",981,"LAURA"
"982",69,7808.785,7811.64,"TRAVIS","yeah!",1,0,0,0,"Vestiges",5,2.85500000000047,2,0.000700525394045418,"second_half",NA,"role_play",982,"TRAVIS"
"983",69,7811.64,7815.176,"ASHLEY","i give everybody a big hug!",1,0,0,0,"Vestiges",5,3.53600000000006,7,0.00197963800904974,"second_half",NA,"role_play",983,"ASHLEY"
"984",69,7815.176,7817.811,"TRAVIS","yeah, little pike!",1,0,0,0,"Vestiges",5,2.63499999999931,4,0.00151802656546529,"second_half",NA,"role_play",984,"TRAVIS"
"985",69,7817.811,7821.479,"ASHLEY","with my gauntlets on, so a big bear hug!",1,0,0,0,"Vestiges",5,3.66800000000057,10,0.00272628135223512,"second_half",NA,"role_play",985,"ASHLEY"
"986",69,7821.479,7824.091,"MATT","it hurts a little, and you're proud of her for it.",0,0,0,1,"Vestiges",5,2.61200000000008,13,0.00497702909647764,"second_half",NA,"role_play",986,"MATT"
"987",69,7826.273,7829.784,"TRAVIS","yeah, i give her a fist bump with the gauntlets, and the knuckles.",1,0,0,0,"Vestiges",5,3.51099999999951,14,0.00398746795784732,"second_half",NA,"role_play",987,"TRAVIS"
"988",69,7829.784,7834.785,"MATT","it actually causes this strange collision shockwave. it pushes you back a second because there's too much strength in one fistbump!",0,0,0,1,"Vestiges",5,5.0010000000002,23,0.00459908018396302,"second_half",NA,"role_play",988,"MATT"
"989",69,7836.647,7839.481,"TRAVIS","oh, pike, you're getting too strong for your own good!",1,0,0,0,"Vestiges",5,2.83399999999983,12,0.00423429781227971,"second_half",NA,"role_play",989,"TRAVIS"
"990",69,7839.481,7841.755,"ASHLEY","hey!",1,0,0,0,"Vestiges",5,2.27400000000034,2,0.000879507475813412,"second_half",NA,"role_play",990,"ASHLEY"
"991",69,7843.694,7849.36,"ASHLEY","oh man. should we all have a drink or something?",1,0,0,0,"Vestiges",5,5.66599999999926,11,0.00194140487116157,"second_half",NA,"role_play",991,"ASHLEY"
"992",69,7849.36,7851.511,"LIAM","jarett, shaun, can you get away?",1,0,0,0,"Vestiges",5,2.15100000000075,7,0.0032543003254289,"second_half",NA,"role_play",992,"LIAM"
"993",69,7851.511,7861.181,"MATT","shaun goes, ""for a moment, maybe. i should probably rest, as well. jarett?"" jarett goes, ""you know what? yes. drink sounds nice. it's been a while. good company.""",0,0,0,1,"Vestiges",5,9.66999999999916,30,0.00310237849017607,"second_half",NA,"role_play",993,"MATT"
"994",69,7866.76,7870.143,"LIAM","kynan, come on.",1,0,0,0,"Vestiges",5,3.38299999999981,4,0.00118238250073906,"second_half",NA,"role_play",994,"LIAM"
"995",69,7870.143,7879.72,"MATT","kynan's still in shock and nods and slinks as he walks behind you, he walks with his head low and you can see he averts his gaze towards the ground, watching where he's going to be walking. gilmore individually gives you all a brief hug or handshake. ""i'm sure we'll talk more tomorrow. ""i'm going to go join percy's plan of action.""",0,0,0,1,"Vestiges",5,9.57700000000023,69,0.00720476140753873,"second_half",NA,"role_play",995,"MATT"
"996",69,7898.21,7905.873,"TRAVIS","can i walk over to vax? so i'm assuming you're taking this little chick under your wing.",1,0,0,0,"Vestiges",5,7.66299999999956,20,0.0026099438862066,"second_half",NA,"role_play",996,"TRAVIS"
"997",69,7905.873,7910.445,"LIAM","well, i'm not taking him with us to draconia or anywhere, no.",1,0,0,0,"Vestiges",5,4.57200000000012,14,0.0030621172353455,"second_half",NA,"role_play",997,"LIAM"
"998",69,7910.445,7913.392,"TRAVIS","no, but you're sure he's clean?",1,0,0,0,"Vestiges",5,2.94700000000012,9,0.0030539531727179,"second_half",NA,"role_play",998,"TRAVIS"
"999",69,7913.392,7920.479,"LIAM","i might like to have pike take a look at him in the morning, but i think so.",1,0,0,0,"Vestiges",5,7.08700000000044,19,0.00268096514745292,"second_half",NA,"role_play",999,"LIAM"
"1000",69,7920.479,7922.487,"TRAVIS","he's pretty spaced out.",1,0,0,0,"Vestiges",5,2.00799999999981,6,0.00298804780876522,"second_half",NA,"role_play",1000,"TRAVIS"
"1001",69,7922.487,7925.961,"LAURA","why doesn't pike look at him now? are you tapped, pike?",1,0,0,0,"Vestiges",5,3.47400000000016,13,0.00374208405296471,"second_half",NA,"role_play",1001,"LAURA"
"1002",69,7925.961,7929.438,"ASHLEY","no. who is this guy?",1,0,0,0,"Vestiges",5,3.47699999999986,6,0.00172562553925805,"second_half",NA,"role_play",1002,"ASHLEY"
"1003",69,7929.438,7935.956,"MATT","you recognize him, pike, as you say that, looking at him, though much more harrowed, a little more built than you last saw him, but this is the young man who was waiting for you guys outside of greyskull keep a few months back, asking to join, who was bright-eyed and inexperienced.",0,0,0,1,"Vestiges",5,6.51800000000003,54,0.00828474992328932,"second_half",NA,"role_play",1003,"MATT"
"1004",69,7953.474,7955.082,"LIAM","and i clocked him.",1,0,0,0,"Vestiges",5,1.60800000000017,5,0.00310945273631807,"second_half",NA,"role_play",1004,"LIAM"
"1005",69,7955.082,7961.599,"ASHLEY","oh yeah. hi, again.",1,0,0,0,"Vestiges",5,6.51699999999983,5,0.000767224182906266,"second_half",NA,"role_play",1005,"ASHLEY"
"1006",69,7961.599,7966.915,"MATT","""hi."" it's one of the things where he's always looking down, but you step into his field of vision, already being shorter than him. as you're looking up at him with your gauntlets there at your side, he's looking at you, but he's also not wanting to look you in the eyes a little bit. ""hello, pike. it's good to see you.""",0,0,0,1,"Vestiges",5,5.3159999999998,70,0.0131677953348387,"second_half",NA,"role_play",1006,"MATT"
"1007",69,7979.383,7983.106,"ASHLEY","good to see you.",1,0,0,0,"Vestiges",5,3.72299999999996,5,0.00134300295460652,"second_half",NA,"role_play",1007,"ASHLEY"
"1008",69,7983.106,7989.197,"TRAVIS","pike, do us a favor and give him a once-over. make sure there's no funk on him.",1,0,0,0,"Vestiges",5,6.09100000000035,20,0.00328353308159561,"second_half",NA,"role_play",1008,"TRAVIS"
"1009",69,7989.197,7992.312,"LAURA","he was traveling with ripley, pike.",1,0,0,0,"Vestiges",5,3.11499999999978,7,0.00224719101123611,"second_half",NA,"role_play",1009,"LAURA"
"1010",69,7992.312,7994.647,"ASHLEY","he was probably what?",1,0,0,0,"Vestiges",5,2.33500000000004,5,0.00214132762312631,"second_half",NA,"role_play",1010,"ASHLEY"
"1011",69,7994.647,7998.082,"LAURA","he was traveling with ripley. oh no.",1,0,0,0,"Vestiges",5,3.4350000000004,8,0.00232896652110599,"second_half",NA,"role_play",1011,"LAURA"
"1012",69,7998.082,8002.099,"SAM","she froze, she froze in a weird position.",1,0,0,0,"Vestiges",5,4.01699999999983,9,0.00224047796863341,"second_half",NA,"role_play",1012,"SAM"
"1013",69,8007.571,8013.214,"MATT","welcome back. we had a bit of a technical difficulty there, but apparently, we're back up and streaming and everything's good, so we're going to jump right back into the story where we were.",0,0,0,1,"Vestiges",5,5.64300000000003,38,0.0067340067340067,"second_half",NA,"role_play",1013,"MATT"
"1014",69,8016.785,8021.888,"SAM","i am currently holding gilmore's severed head in my hands, right? blood spilled, dripping",1,0,0,0,"Vestiges",5,5.10300000000007,15,0.00293944738389179,"second_half",NA,"role_play",1014,"SAM"
"1015",69,8021.888,8026.273,"MATT","just gouts of it, anime-style like fist of the north star, spraying.",0,0,0,1,"Vestiges",5,4.38500000000022,14,0.00319270239452664,"second_half",NA,"role_play",1015,"MATT"
"1016",69,8026.273,8027.853,"LAURA","and percy's dead again.",1,0,0,0,"Vestiges",5,1.57999999999993,6,0.00379746835443055,"second_half",NA,"role_play",1016,"LAURA"
"1017",69,8027.853,8029.611,"SAM","percy died, yeah. percy died.",1,0,0,0,"Vestiges",5,1.75799999999981,6,0.00341296928327682,"second_half",NA,"role_play",1017,"SAM"
"1018",69,8029.611,8032.974,"MARISHA","yeah, he's gone. i've cried eight more times.",1,0,0,0,"Vestiges",5,3.36300000000028,11,0.00327088908712432,"second_half",NA,"role_play",1018,"MARISHA"
"1019",69,8032.974,8034.632,"LAURA","my bad, sorry.",1,0,0,0,"Vestiges",5,1.65799999999945,4,0.00241254523522397,"second_half",NA,"role_play",1019,"LAURA"
"1020",69,8034.632,8038.019,"SAM","we need to resurrect him. ready? one, two, three.",1,0,0,0,"Vestiges",5,3.38700000000063,10,0.00295246530853208,"second_half",NA,"role_play",1020,"SAM"
"1021",69,8040.356,8042.219,"MARISHA","thanks, vesh!",1,0,0,0,"Vestiges",5,1.86300000000028,3,0.0016103059581318,"second_half",NA,"role_play",1021,"MARISHA"
"1022",69,8042.219,8044.509,"TRAVIS","we're having pike check",1,0,0,0,"Vestiges",5,2.28999999999996,5,0.00218340611353715,"second_half",NA,"role_play",1022,"TRAVIS"
"1023",69,8044.509,8048.685,"MATT","so having pike check kynan. kynan's looking at you, pike. what are you going to do?",0,0,0,1,"Vestiges",5,4.17600000000039,18,0.00431034482758581,"second_half",NA,"role_play",1023,"MATT"
"1024",69,8048.685,8053.843,"ASHLEY","i'm going to detect evil.",1,0,0,0,"Vestiges",5,5.15799999999945,7,0.00135711516091523,"second_half",NA,"role_play",1024,"ASHLEY"
"1025",69,8053.843,8065.436,"MATT","okay. looking over and you finish the spell, there is no sense of evil from him. make an insight check. i'll say with advantage because of the nature of the spell, because why not?",0,0,0,1,"Vestiges",5,11.5929999999998,36,0.00310532217717592,"second_half",NA,"role_play",1025,"MATT"
"1026",69,8073.706,8076.001,"LAURA","because you are all powerful and you can do that.",1,0,0,0,"Vestiges",5,2.29500000000007,11,0.00479302832243994,"second_half",NA,"role_play",1026,"LAURA"
"1027",69,8076.001,8079.316,"MATT","because he is a broken man standing before you.",0,0,0,1,"Vestiges",5,3.3149999999996,10,0.00301659125188573,"second_half",NA,"role_play",1027,"MATT"
"1028",69,8079.316,8085.46,"ASHLEY","okay. 28!",1,0,0,0,"Vestiges",5,6.14400000000023,3,0.000488281249999982,"second_half",NA,"role_play",1028,"ASHLEY"
"1029",69,8085.46,8090.156,"MATT","you don't sense any evil in the sense of what the spell would gather. you do sense from looking at his expression, his reaction, and what bit of information you have, this is a person that's been heavily brainwashed, and their idea of what the world was, or as it was, has been broken, probably many times. kynan's in a rough spot, and the guilt is weighing so heavily on him right now that it's probably best that somebody keep an eye on him.",0,0,0,1,"Vestiges",5,4.69599999999991,89,0.0189522998296426,"second_half",NA,"role_play",1029,"MATT"
"1030",69,8117.183,8131.964,"ASHLEY","i put my hand on his shoulder and i say: kynan, you look like a man who feels like he's made a mistake, and you just need to turn that frown upside down.",1,0,0,0,"Vestiges",5,14.7809999999999,35,0.00236790474257494,"second_half",NA,"role_play",1030,"ASHLEY"
"1031",69,8142.24,8143.751,"SAM","wise.",1,0,0,0,"Vestiges",5,1.51100000000042,2,0.00132362673725972,"second_half",NA,"role_play",1031,"SAM"
"1032",69,8143.751,8153.249,"MATT","looking down at your smiling blue gnomish eyes, this broken boy of a man does mutter a slight chuckle in reaction, then catches himself and nods. ""i have a lot to think about. ""i have a lot of penance to deal with. thank you.""",0,0,0,1,"Vestiges",5,9.49799999999959,45,0.00473783954516761,"second_half",NA,"role_play",1032,"MATT"
"1033",69,8176.713,8178.653,"ASHLEY","you're welcome.",1,0,0,0,"Vestiges",5,1.94000000000051,4,0.00206185567010255,"second_half",NA,"role_play",1033,"ASHLEY"
"1034",69,8178.653,8182.385,"MATT","""maybe a drink would help.""",0,0,0,1,"Vestiges",5,3.73199999999997,7,0.00187566988210076,"second_half",NA,"role_play",1034,"MATT"
"1035",69,8182.385,8184.575,"ASHLEY","of course. that always helps.",1,0,0,0,"Vestiges",5,2.1899999999996,6,0.00273972602739776,"second_half",NA,"role_play",1035,"ASHLEY"
"1036",69,8184.575,8192.34,"MATT","jarett smacks him on the shoulder. ""all right, then. let's get this pup trashed. follow me."" he leads you down to one of the two taverns. the one that had been destroyed as part of the initial battle here in whitestone has been constructed. the roof's still mostly missing, but they have a covering over it. it doesn't appear to be a rainy evening, so it should be fine. there's a handful of folk in there having drinks. jarett treats you all to a round of finer ale of whitestone brand. they don't have a large selection of rare imported drinks here, but it's enough to at least get the job done. anything you guys want to do specifically while you're all having drinks tonight?",0,0,0,1,"Vestiges",5,7.76500000000033,133,0.01712813908564,"second_half",NA,"role_play",1036,"MATT"
"1037",69,8226.027,8232.882,"TRAVIS","wait, jarett! while we were in your hood, i acquired this delicious little bit. and i pull out the sandkheg bottle. this is called seraph's swine swallow. and i pour a little into a glass and i hand it to him.",1,0,0,0,"Vestiges",5,6.85499999999956,43,0.0062727935813279,"second_half",NA,"role_play",1037,"TRAVIS"
"1038",69,8246.611,8252.448,"MATT","he goes, ""i am not familiar with this. you say this is from ank'harel?""",0,0,0,1,"Vestiges",5,5.83699999999953,16,0.0027411341442524,"second_half",NA,"role_play",1038,"MATT"
"1039",69,8252.448,8259.435,"TRAVIS","yeah, and it's all in one. hit the back of the throat and swallow it all in one.",1,0,0,0,"Vestiges",5,6.98699999999917,20,0.00286245885215434,"second_half",NA,"role_play",1039,"TRAVIS"
"1040",69,8259.435,8262.508,"MATT","""to friends?""",0,0,0,1,"Vestiges",5,3.07300000000032,4,0.00130165961601028,"second_half",NA,"role_play",1040,"MATT"
"1041",69,8262.508,8264.69,"TRAVIS","yes. to friends, and to health.",1,0,0,0,"Vestiges",5,2.1820000000007,7,0.00320806599449943,"second_half",NA,"role_play",1041,"TRAVIS"
"1042",69,8264.69,8266.176,"MATT","""and to survival.""",0,0,0,1,"Vestiges",5,1.48599999999897,5,0.0033647375504734,"second_half",NA,"role_play",1042,"MATT"
"1043",69,8266.176,8271.414,"TRAVIS","and to fukasa. sukasa. mi casa.",1,0,0,0,"Vestiges",5,5.23800000000119,7,0.00133638793432577,"second_half",NA,"role_play",1043,"TRAVIS"
"1044",69,8273.709,8275.615,"MATT","make a deception check.",0,0,0,1,"Vestiges",5,1.90599999999904,5,0.0026232948583434,"second_half",NA,"role_play",1044,"MATT"
"1045",69,8275.615,8281.457,"TRAVIS","14.",1,0,0,0,"Vestiges",5,5.84200000000055,2,0.000342348510783946,"second_half",NA,"role_play",1045,"TRAVIS"
"1046",69,8281.457,8291.61,"MATT","he gives you a keen look, looks to vex, nods. ""to friends and trust.""",0,0,0,1,"Vestiges",5,10.1530000000002,15,0.00147739584359299,"second_half",NA,"role_play",1046,"MATT"
"1047",69,8291.61,8294.95,"LIAM","it's so worth it.",1,0,0,0,"Vestiges",5,3.34000000000015,6,0.00179640718562866,"second_half",NA,"role_play",1047,"LIAM"
"1048",69,8294.95,8299.982,"TRAVIS","i take his cup. i pour a little, and i'm like, can't let him take this ride by himself. i pound it, as well.",1,0,0,0,"Vestiges",5,5.03199999999924,27,0.00536565977742529,"second_half",NA,"role_play",1048,"TRAVIS"
"1049",69,8301.606,8303.388,"MATT","make a constitution saving throw.",0,0,0,1,"Vestiges",5,1.78200000000106,6,0.00336700336700136,"second_half",NA,"role_play",1049,"MATT"
"1050",69,8303.388,8306.306,"LAURA","oh no!",1,0,0,0,"Vestiges",5,2.91799999999967,3,0.00102810143934213,"second_half",NA,"role_play",1050,"LAURA"
"1051",69,8306.306,8308.295,"TRAVIS","not great. 13.",1,0,0,0,"Vestiges",5,1.98899999999958,4,0.00201106083459067,"second_half",NA,"role_play",1051,"TRAVIS"
"1052",69,8308.295,8320.654,"MATT","the fiery rumble in your stomach is matched directly behind by the heavy flow of numbness that fills the entirety of your chest, jaw, and tongue. jarett goes, ""that was quite strong.""",0,0,0,1,"Vestiges",5,12.3590000000004,33,0.00267011894166187,"second_half",NA,"role_play",1052,"MATT"
"1053",69,8328.545,8330.299,"TRAVIS","i think so, too.",1,0,0,0,"Vestiges",5,1.75400000000081,5,0.00285062713796903,"second_half",NA,"role_play",1053,"TRAVIS"
"1054",69,8330.299,8333.708,"MATT","""you fucker.""",0,0,0,1,"Vestiges",5,3.40899999999965,4,0.00117336462305673,"second_half",NA,"role_play",1054,"MATT"
"1055",69,8336.656,8340.78,"MATT","slams the glass down. ""well, i'm not going to have any conversation for a while.""",0,0,0,1,"Vestiges",5,4.1239999999998,17,0.00412221144519904,"second_half",NA,"role_play",1055,"MATT"
"1056",69,8343.002,8348.817,"TRAVIS","you're talking really funny. let's braid each other's hair.",1,0,0,0,"Vestiges",5,5.81499999999869,13,0.00223559759243387,"second_half",NA,"role_play",1056,"TRAVIS"
"1057",69,8348.817,8354.748,"MATT","""please don't. i think that i have far more than you do, and it's too short, anyway. ""be a waste of your time."" he became castilian, suddenly.",0,0,0,1,"Vestiges",5,5.93100000000049,31,0.00522677457427034,"second_half",NA,"role_play",1057,"MATT"
"1058",69,8358.92,8368.937,"LIAM","i get three drinks at the bar and i walk past keyleth and leave one on the table by her and go and sit down by kynan. i want to show you something. i bought these months ago. and i root around in my pack and i pull out the three finely made daggers that i bought.",1,0,0,0,"Vestiges",5,10.0169999999998,58,0.00579015673355306,"second_half",NA,"role_play",1058,"LIAM"
"1059",69,8383.509,8385.075,"LAURA","they were expensive!",1,0,0,0,"Vestiges",5,1.56600000000071,4,0.00255427841634622,"second_half",NA,"role_play",1059,"LAURA"
"1060",69,8385.075,8388.869,"LIAM","she's right. they were expensive. i'm actually not going to give them to you tonight because you're worrying me a little bit, but in a day or two, these are yours. i bought these for you months ago. i looked for you. i visited the butcher shop, and i missed you. i'm very sorry about that. i wish that this had not... i wish this had not played out the way it had.",1,0,0,0,"Vestiges",5,3.79399999999987,78,0.0205587770163423,"second_half",NA,"role_play",1060,"LIAM"
"1061",69,8418.692,8422.108,"MATT","""me, too.""",0,0,0,1,"Vestiges",5,3.41600000000108,4,0.00117096018735326,"second_half",NA,"role_play",1061,"MATT"
"1062",69,8422.108,8430.706,"LIAM","you can atone. it is not too late. i see the look in your eye. it is not too late.",1,0,0,0,"Vestiges",5,8.59799999999996,21,0.00244242847173763,"second_half",NA,"role_play",1062,"LIAM"
"1063",69,8430.706,8436.017,"MATT","he keeps looking over at keyleth, and you see every time he sees her, he has that spike of guilt in his heart.",0,0,0,1,"Vestiges",5,5.31099999999969,24,0.00451892299002097,"second_half",NA,"role_play",1063,"MATT"
"1064",69,8437.388,8442.672,"MARISHA","yeah. you better, motherfucker.",1,0,0,0,"Vestiges",5,5.28399999999965,5,0.000946252838758579,"second_half",NA,"role_play",1064,"MARISHA"
"1065",69,8442.672,8452.481,"LIAM","you fucked up, clearly. big time. and you can either curl in on yourself and rot in a ball, or you can make up for it. you know what's going on in tal'dorei. you know what's going on. i spent too much time looking inward. it's pointless. be of use.",1,0,0,0,"Vestiges",5,9.80899999999929,55,0.00560709552451871,"second_half",NA,"role_play",1065,"LIAM"
"1066",69,8471.315,8475.845,"MATT","make a persuasion check.",0,0,0,1,"Vestiges",5,4.52999999999884,5,0.00110375275938218,"second_half",NA,"role_play",1066,"MATT"
"1067",69,8475.845,8486.089,"LIAM","i'm going to use luck. that is a 17.",1,0,0,0,"Vestiges",5,10.2440000000006,11,0.00107379929714949,"second_half",NA,"role_play",1067,"LIAM"
