"","Episode","startTime","endTime","Actor","Text","vox_machina","guest","staff","Matt","Arc","Arc_no","timeDiffInSecs","wordCount","WordsPerMillisec","segment","encounter_count","rp_combat","turn_number","CR_GUEST"
"1",69,0.115,3.596,"MATT","hello, everyone, and welcome to tonight's episode of critical role, where a bunch of us nerdy-ass voice actors play dungeons and dragons and occasionally leave sobbing messes. tonight's going to be a very interesting episode. before we get into that, let's go ahead and coast through our announcements so we can get to the actual game at hand. first and foremost, we want to thank our sponsor for many weeks still going, loot crate!",0,0,0,1,"Vestiges",5,3.481,79,0.0226946279804654,"proglog",NA,NA,1,"MATT"
"2",69,24.243,26.666,"MATT","loot crate!",0,0,0,1,"Vestiges",5,2.423,3,0.00123813454395378,"proglog",NA,NA,2,"MATT"
"3",69,26.666,28.925,"MATT","thank you so much. sam, did you have something prepared?",0,0,0,1,"Vestiges",5,2.259,11,0.00486941124391323,"proglog",NA,NA,3,"MATT"
"4",69,28.925,33.658,"SAM","i don't really have anything prepared this week, guys. instead, i thought i'd tell you a little story about something that happened to a friend of mine. her name is jessie. we grew up together in a small town. when she went away to college, she didn't want to go because she was a homebody. her parents said, just go, have fun, you'll love it. she got to college. a couple of weeks into it, she and her roommate went out at night. she came home. she fell asleep. they were a little tipsy. she woke up in the middle of the night to this scratching sound and she couldn't figure out what it was. she just went back to sleep. got up again, heard another scratching sound. what was it? she couldn't figure it out. she went back to sleep. the next morning, she woke up. her roommate, the skin had been ripped off of her body, and the cat that they shared had also been turned essentially inside out. and on the wall in the blood of her roommate was written: use code criticalrole for $3 off.",1,0,0,0,"Vestiges",5,4.733,196,0.0414113669976759,"proglog",NA,NA,4,"SAM"
"5",69,86.897,89.002,"TRAVIS","that's a lot of blood.",1,0,0,0,"Vestiges",5,2.10499999999999,7,0.00332541567695964,"proglog",NA,NA,5,"TRAVIS"
"6",69,89.002,95.005,"SAM","that's a lot of blood, and it's a lot of savings for the new loot crate, whose theme is horror. channel your best final girl with items from the walking dead, nightmare on elm street, friday the 13th, texas chainsaw massacre, halloween, and the story i just told. hey, should we open them up, guys?",1,0,0,0,"Vestiges",5,6.003,58,0.00966183574879227,"proglog",NA,NA,6,"SAM"
"7",69,109.922,113.653,"TRAVIS","yeah! now, i think this is september's theme.",1,0,0,0,"Vestiges",5,3.73100000000001,10,0.0026802465826856,"proglog",NA,NA,7,"TRAVIS"
"8",69,113.653,119.28,"SAM","this is definitely horror. let's open them and see what horror items we have?",1,0,0,0,"Vestiges",5,5.627,16,0.00284343344588591,"proglog",NA,NA,8,"SAM"
"9",69,119.28,122.18,"LIAM","whoa, look at this scary car!",1,0,0,0,"Vestiges",5,2.90000000000001,7,0.00241379310344827,"proglog",NA,NA,9,"LIAM"
"10",69,122.18,123.598,"LAURA","whoa!",1,0,0,0,"Vestiges",5,1.41799999999999,2,0.00141043723554303,"proglog",NA,NA,10,"LAURA"
"11",69,123.598,128.002,"LAURA","look at this scary keychain of batman!",1,0,0,0,"Vestiges",5,4.40400000000001,8,0.00181653042688465,"proglog",NA,NA,11,"LAURA"
"12",69,128.002,129.877,"MATT","scary stark industries.",0,0,0,1,"Vestiges",5,1.875,4,0.00213333333333333,"proglog",NA,NA,12,"MATT"
"13",69,129.877,131.593,"TRAVIS","stark motor racing.",1,0,0,0,"Vestiges",5,1.71599999999998,4,0.00233100233100236,"proglog",NA,NA,13,"TRAVIS"
"14",69,131.593,133.69,"TALIESIN","the scariest stark industries.",1,0,0,0,"Vestiges",5,2.09700000000001,5,0.00238435860753456,"proglog",NA,NA,14,"TALIESIN"
"15",69,133.69,135.283,"SAM","look, it's dark knight.",1,0,0,0,"Vestiges",5,1.59299999999999,6,0.00376647834274955,"proglog",NA,NA,15,"SAM"
"16",69,135.283,137.423,"LAURA","no, it's gone in sixty seconds.",1,0,0,0,"Vestiges",5,2.14000000000001,8,0.00373831775700932,"proglog",NA,NA,16,"LAURA"
"17",69,137.423,143.798,"MARISHA","nicolas cage was scary in gone in sixty seconds, just throwing it out there.",1,0,0,0,"Vestiges",5,6.375,15,0.00235294117647059,"proglog",NA,NA,17,"MARISHA"
"18",69,143.798,145.801,"MATT","i forgot he was in that movie.",0,0,0,1,"Vestiges",5,2.00299999999999,8,0.00399400898652025,"proglog",NA,NA,18,"MATT"
"19",69,145.801,148.937,"LAURA","ashley, do you want this?",1,0,0,0,"Vestiges",5,3.13600000000002,6,0.00191326530612243,"proglog",NA,NA,19,"LAURA"
"20",69,148.937,156.988,"SAM","what's the pin? the pin says loot year. oh, it's like goodyear.",1,0,0,0,"Vestiges",5,8.05099999999999,15,0.00186312259346665,"proglog",NA,NA,20,"SAM"
"21",69,156.988,159.223,"TRAVIS","is this really a hood ornament?",1,0,0,0,"Vestiges",5,2.23500000000001,7,0.00313199105145412,"proglog",NA,NA,21,"TRAVIS"
"22",69,159.223,160.444,"MARISHA","yeah.",1,0,0,0,"Vestiges",5,1.22099999999998,2,0.00163800163800167,"proglog",NA,NA,22,"MARISHA"
"23",69,160.444,163.056,"LAURA","that's pretty sick.",1,0,0,0,"Vestiges",5,2.61200000000002,5,0.00191424196018375,"proglog",NA,NA,23,"LAURA"
"24",69,163.056,168.574,"SAM","but in all seriousness, loot crate is a big supporter of the show, so we want to support them. go online, go to lootcrate.com/criticalrole. sign up, get subscriptions for all of your friends and all of your dead friends who died tragically in a horror.",1,0,0,0,"Vestiges",5,5.518,48,0.00869880391446176,"proglog",NA,NA,24,"SAM"
"25",69,180.096,182.155,"LAURA","in a horror.",1,0,0,0,"Vestiges",5,2.059,4,0.00194269062651773,"proglog",NA,NA,25,"LAURA"
"26",69,182.155,184.548,"TRAVIS","i used to break those off of the front of people's cars when i was a kid because i was an asshole.",1,0,0,0,"Vestiges",5,2.393,24,0.0100292519849561,"proglog",NA,NA,26,"TRAVIS"
"27",69,185.584,196.192,"MATT","yeah, you were. great! thank you, sam. next up on the list, i will actually be down in san diego tomorrow for the first day of twitchcon. i have a panel in room frankerz. it's at 6:30 to 7:30pm about gming roleplaying games on twitch. it's going to be me, adam koebel, chris perkins, a bunch of great people that run a lot of great rpg programming on twitch. we're going to be talking about our experiences running it, answering questions, all that fun stuff, so if you're already down there or you're in the san diego area, come tomorrow and say hi at the panel at 6:30. it'll be awesome.",0,0,0,1,"Vestiges",5,10.608,121,0.0114064856711915,"proglog",NA,NA,27,"MATT"
"28",69,225.715,226.845,"LAURA","6:30am.",1,0,0,0,"Vestiges",5,1.13,3,0.00265486725663718,"proglog",NA,NA,28,"LAURA"
"29",69,226.845,234.408,"MATT","oh, totally. no, never. 6:30pm in frankerz, i think is the room, unless i'm reading the emails wrong. that's the only room information i was given. frankerz is the guy who's sending me the emails.",0,0,0,1,"Vestiges",5,7.56299999999999,40,0.00528890651857729,"proglog",NA,NA,29,"MATT"
"30",69,238.812,242.094,"SAM","they're our fucking sponsors! leave the box on the goddamn table!",1,0,0,0,"Vestiges",5,3.28199999999998,13,0.0039609993906155,"proglog",NA,NA,30,"SAM"
"31",69,242.094,246.068,"TRAVIS","i got it!",1,0,0,0,"Vestiges",5,3.97400000000002,4,0.00100654252642174,"proglog",NA,NA,31,"TRAVIS"
"32",69,246.068,253.507,"MATT","anyway, speaking of fun news, laura, you wanted to mention something about some things up on the store?",0,0,0,1,"Vestiges",5,7.43899999999999,19,0.00255410673477618,"proglog",NA,NA,32,"MATT"
"33",69,254.606,255.675,"LAURA","yes, this is exciting!",1,0,0,0,"Vestiges",5,1.06900000000002,5,0.0046772684752104,"proglog",NA,NA,33,"LAURA"
"34",69,255.675,257.544,"SAM","is it about your friend who went to college?",1,0,0,0,"Vestiges",5,1.86899999999997,10,0.00535045478865712,"proglog",NA,NA,34,"SAM"
"35",69,257.544,262.773,"LAURA","her face was ripped off, but when her body was discovered, she was wearing one of these how do you want to do this? hoodies. these sweatshirts that have been available before and then we took them away. but guess what, guys? they're back!",1,0,0,0,"Vestiges",5,5.22900000000004,46,0.00879709313444246,"proglog",NA,NA,35,"LAURA"
"36",69,270.219,271.59,"TRAVIS","we made more!",1,0,0,0,"Vestiges",5,1.37099999999998,4,0.00291757840991981,"proglog",NA,NA,36,"TRAVIS"
"37",69,271.59,276.028,"LAURA","for two weeks of preorder, you can get these comfy, cozy hoodies.",1,0,0,0,"Vestiges",5,4.43800000000005,13,0.00292924740874265,"proglog",NA,NA,37,"LAURA"
"38",69,276.028,277.606,"TRAVIS","what is that voice you're doing?",1,0,0,0,"Vestiges",5,1.57799999999997,8,0.00506970849176181,"proglog",NA,NA,38,"TRAVIS"
"39",69,279.645,283.415,"LAURA","there's other things in the store too, like our beautiful mug that i don't have on the table today that ashley used in blindspot!",1,0,0,0,"Vestiges",5,3.77000000000004,27,0.00716180371352778,"proglog",NA,NA,39,"LAURA"
"40",69,287.45,291.607,"MARISHA","yes. and christmas is right around the corner, you guys!",1,0,0,0,"Vestiges",5,4.15700000000004,11,0.00264613904257876,"proglog",NA,NA,40,"MARISHA"
"41",69,291.607,294.467,"TRAVIS","yeah, it's getting cold, so make sure you bundle up nice and warm.",1,0,0,0,"Vestiges",5,2.85999999999996,15,0.00524475524475532,"proglog",NA,NA,41,"TRAVIS"
"42",69,294.467,298.255,"MATT","it is, no joke, the most comfortable hoodie i've ever owned.",0,0,0,1,"Vestiges",5,3.78800000000001,13,0.00343189017951425,"proglog",NA,NA,42,"MATT"
"43",69,298.255,300.365,"LAURA","you'll be wearing it all the time.",1,0,0,0,"Vestiges",5,2.11000000000001,9,0.00426540284360187,"proglog",NA,NA,43,"LAURA"
"44",69,300.365,301.77,"LIAM","soft as hell.",1,0,0,0,"Vestiges",5,1.40499999999997,4,0.00284697508896803,"proglog",NA,NA,44,"LIAM"
"45",69,301.77,304.806,"MATT","i was a little worried when we started doing actual wearable merch, i was like, it's going to end up being that chintzy stuff that we don't want to hawk, but i'm actually really happy that it came out pretty high-quality.",0,0,0,1,"Vestiges",5,3.036,46,0.0151515151515151,"proglog",NA,NA,45,"MATT"
"46",69,309.071,310.985,"MARISHA","i miss school relay races.",1,0,0,0,"Vestiges",5,1.91399999999999,6,0.00313479623824453,"proglog",NA,NA,46,"MARISHA"
"47",69,310.985,313.625,"MATT","what?",0,0,0,1,"Vestiges",5,2.63999999999999,2,0.000757575757575761,"proglog",NA,NA,47,"MATT"
"48",69,313.625,316.16,"MARISHA","sorry, go ahead. nothing. don't worry about it. keep going.",1,0,0,0,"Vestiges",5,2.53500000000003,12,0.00473372781065084,"proglog",NA,NA,48,"MARISHA"
"49",69,316.16,321.472,"MATT","anyway, anything else you want to talk about? nope, then let's go ahead and get into tonight's episode of critical role! [dramatic music]",0,0,0,1,"Vestiges",5,5.31199999999995,26,0.00489457831325305,"proglog",NA,NA,49,"MATT"
"50",69,414.775,420.523,"MATT","welcome back. before we begin, real fast, i have been notified that twitch is having some audio sync issues. recommendation has been said to try and switch between the flash player or the html5 player on twitch. that seems to be fixing the issues for a lot of people out there. so if you're having issues with that, reloading or trying that switchover should fix the audio sync issues if you're having any. without further ado, last we picked up, vox machina, who had been traveling to collect the vestiges of divergence, artifacts from an old ancient time to gain enough power to combat the chroma conclave, a group of chromatic dragons that assailed pardon tal'dorei, led by thordak the cinder king. when you get nervous, you get the burps. i feel like robert durst.",0,0,0,1,"Vestiges",5,5.74800000000005,139,0.0241823242867082,"proglog",NA,NA,50,"MATT"
"51",69,462.599,469.372,"TRAVIS","robert kraft, the owner of the patriots.",1,0,0,0,"Vestiges",5,6.77300000000002,8,0.0011811604901816,"first_half",NA,"role_play",51,"TRAVIS"
"52",69,469.372,477.21,"MATT","different guy. you, in searching these artifacts, found that one in the city of ank'harel had been taken out from under your nose by a long-forgotten npc named ripley.",0,0,0,1,"Vestiges",5,7.83799999999997,32,0.0040826741515693,"first_half",NA,"role_play",52,"MATT"
"53",69,481.81,483.74,"MARISHA","well, she wasn't forgotten.",1,0,0,0,"Vestiges",5,1.93000000000001,6,0.00310880829015543,"first_half",NA,"role_play",53,"MARISHA"
"54",69,483.74,490.989,"MATT","you know what i mean. you gave chase down to the glintshore island of the hespet archipelago, and upon storming the beaches, destroying her ship, you walked into the jungle, where an ambush turned into folly. you charged into what appeared to be a couple of illusions. as the floor detonated beneath you, setting you across the ground and starting an encounter with snipers in position, at half-health and below for most of you. you gave a very good fight and still managed to push through. unfortunately, dr. ripley, with the reveal that she has now bound herself to orthax, the shadow demon that once plagued percy's inspiration and nightmares, bent on vengeance, managed to take him, slay him, and leave him cold on the ground. as a group, you did manage to dissect dr. ripley very aggressively and get vengeance back for your friend. but where we left off, you'd just let the adrenaline and the shock of the moment hit you as ripley's breath expends and a tiny tree begins to try and break and grow from her corpse on this parched land. so. what do you want to do?",0,0,0,1,"Vestiges",5,7.24899999999997,197,0.0271761622292731,"first_half",NA,"role_play",54,"MATT"
"55",69,566.299,573.171,"SAM","we have no idea.",1,0,0,0,"Vestiges",5,6.87200000000007,5,0.00072759022118742,"first_half",NA,"role_play",55,"SAM"
"56",69,573.171,574.575,"LAURA","oh no.",1,0,0,0,"Vestiges",5,1.404,3,0.00213675213675214,"first_half",NA,"role_play",56,"LAURA"
"57",69,574.575,576.571,"SAM","yeah.",1,0,0,0,"Vestiges",5,1.99599999999998,2,0.00100200400801604,"first_half",NA,"role_play",57,"SAM"
"58",69,576.571,582.586,"TRAVIS","wait, did she originally take percy's gun? was that what she was using?",1,0,0,0,"Vestiges",5,6.01499999999999,15,0.00249376558603492,"first_half",NA,"role_play",58,"TRAVIS"
"59",69,582.586,585.167,"SAM","i don't think so. she took his designs.",1,0,0,0,"Vestiges",5,2.58100000000002,10,0.00387446726075162,"first_half",NA,"role_play",59,"SAM"
"60",69,585.167,589.023,"MARISHA","he threw percy's gun into the pool of acid.",1,0,0,0,"Vestiges",5,3.85599999999999,11,0.00285269709543569,"first_half",NA,"role_play",60,"MARISHA"
"61",69,589.023,590.647,"TRAVIS","should we collect her gun now?",1,0,0,0,"Vestiges",5,1.62400000000002,7,0.00431034482758614,"first_half",NA,"role_play",61,"TRAVIS"
"62",69,590.647,594.795,"SAM","we're all extremely emotional, but we need to move quickly if we're going to do anything. we need to collect all the guns.",1,0,0,0,"Vestiges",5,4.14799999999991,26,0.0062680810028931,"first_half",NA,"role_play",62,"SAM"
"63",69,596.511,603.382,"MARISHA","we should collect her guns. we need her other hand, and we need the vestiges off of her fucking body.",1,0,0,0,"Vestiges",5,6.87099999999998,21,0.00305632367923156,"first_half",NA,"role_play",63,"MARISHA"
"64",69,604.836,606.977,"TRAVIS","well, let's collect those. quickly.",1,0,0,0,"Vestiges",5,2.14099999999996,7,0.00326950023353579,"first_half",NA,"role_play",64,"TRAVIS"
"65",69,606.977,608.133,"MARISHA","grog?",1,0,0,0,"Vestiges",5,1.15600000000006,2,0.00173010380622828,"first_half",NA,"role_play",65,"MARISHA"
"66",69,608.133,609.3,"TRAVIS","yes?",1,0,0,0,"Vestiges",5,1.16699999999992,2,0.00171379605826919,"first_half",NA,"role_play",66,"TRAVIS"
"67",69,609.3,611.09,"MARISHA","will you do the honors of taking her other hand?",1,0,0,0,"Vestiges",5,1.79000000000008,11,0.00614525139664778,"first_half",NA,"role_play",67,"MARISHA"
"68",69,611.09,614.404,"TRAVIS","i would love to use my teeth for that. no, i'll use the axe.",1,0,0,0,"Vestiges",5,3.31399999999996,16,0.00482800241400126,"first_half",NA,"role_play",68,"TRAVIS"
"69",69,614.404,620.825,"MATT","all right. with a heavy thud sound, her hand is jettisoned from the wrist, her left hand, as it scatters across the broken glass floor of the center of the jungle here in glintshore.",0,0,0,1,"Vestiges",5,6.42100000000005,35,0.0054508643513471,"first_half",NA,"role_play",69,"MATT"
"70",69,625.545,626.825,"TRAVIS","this one, right?",1,0,0,0,"Vestiges",5,1.28000000000009,4,0.00312499999999979,"first_half",NA,"role_play",70,"TRAVIS"
"71",69,626.825,630.178,"SAM","there's only one, so yes, that's the one.",1,0,0,0,"Vestiges",5,3.35299999999995,11,0.00328064419922462,"first_half",NA,"role_play",71,"SAM"
"72",69,630.178,632.39,"TRAVIS","bag of colding.",1,0,0,0,"Vestiges",5,2.21199999999999,4,0.00180831826401448,"first_half",NA,"role_play",72,"TRAVIS"
"73",69,632.39,639.91,"MATT","fair enough. kynan is still standing there, the adrenaline wearing off of him. and he's at a good 15, 20-foot distance from all of you just standing.",0,0,0,1,"Vestiges",5,7.51999999999998,30,0.00398936170212767,"first_half",NA,"role_play",73,"MATT"
"74",69,642.745,644.361,"TRAVIS","i forgot, are we killing him?",1,0,0,0,"Vestiges",5,1.61599999999999,7,0.00433168316831687,"first_half",NA,"role_play",74,"TRAVIS"
"75",69,644.361,648.551,"LIAM","hold on a second. i walk over. do you have the blade?",1,0,0,0,"Vestiges",5,4.19000000000005,13,0.00310262529832932,"first_half",NA,"role_play",75,"LIAM"
"76",69,648.551,654.945,"MATT","he looks down and he seems to have dropped it after everything that transpired. and he picks it up and holds it.",0,0,0,1,"Vestiges",5,6.39400000000001,23,0.00359712230215827,"first_half",NA,"role_play",76,"MATT"
"77",69,657.542,660.4,"LIAM","i've come a long way for that.",1,0,0,0,"Vestiges",5,2.85799999999995,9,0.00314905528341503,"first_half",NA,"role_play",77,"LIAM"
"78",69,660.4,668.271,"MATT","""take it."" he throws it to your feet and it spins and scatters and comes to a halt at the tip of your boot",0,0,0,1,"Vestiges",5,7.87099999999998,25,0.00317621649091603,"first_half",NA,"role_play",78,"MATT"
"79",69,669.815,678.062,"LIAM","wait here a moment, please. i bend down, i take the knife, and i walk it over to keyleth and put it in her hands. and i walk back to him. how?",1,0,0,0,"Vestiges",5,8.24699999999996,33,0.00400145507457259,"first_half",NA,"role_play",79,"LIAM"
"80",69,688.907,693.913,"MATT","""i didn't mean for any of this to happen.""",0,0,0,1,"Vestiges",5,5.00599999999997,12,0.00239712345185778,"first_half",NA,"role_play",80,"MATT"
"81",69,693.913,704.229,"LIAM","how? there are people behind me who want you dead, and i cannot blame them. how?",1,0,0,0,"Vestiges",5,10.316,17,0.00164792555253974,"first_half",NA,"role_play",81,"LIAM"
"82",69,704.229,714.329,"MATT","""i wouldn't blame them, either. look, after we met, i was hurt. i was angry. i knew i could be ""someone, despite what you told me, and i could prove it, prove that i was worth your attention. ""and i left emon and my home to seek that destiny and i'm sure many of you did the same.""",0,0,0,1,"Vestiges",5,10.0999999999999,62,0.00613861386138619,"first_half",NA,"role_play",82,"MATT"
"83",69,728.757,737.107,"LIAM","do you know what shape emon is in right now? and <i>this</i> is what you choose to do with your time?",1,0,0,0,"Vestiges",5,8.35000000000002,24,0.00287425149700598,"first_half",NA,"role_play",83,"LIAM"
"84",69,737.107,739.147,"MATT","""you don't know what i've been through!""",0,0,0,1,"Vestiges",5,2.04000000000008,11,0.00539215686274489,"first_half",NA,"role_play",84,"MATT"
"85",69,739.147,745.133,"LIAM","what has that man done to you? what has she done to you? what have any of them, except for me, done to you? and what have i done except be an asshole?",1,0,0,0,"Vestiges",5,5.98599999999999,34,0.00567991981289677,"first_half",NA,"role_play",85,"LIAM"
"86",69,748.487,762.716,"MATT","""look, when she picked me up in kymal, she taught me a lot. i learned a lot. she also told me ""that you weren't who i thought you were. when everything went down in emon, with the dragons. ""she said <i>you</i> did that!""",0,0,0,1,"Vestiges",5,14.229,48,0.00337339236769976,"first_half",NA,"role_play",86,"MATT"
"87",69,777.512,783.704,"LIAM","summoned the dragons?",1,0,0,0,"Vestiges",5,6.19200000000001,4,0.000645994832041343,"first_half",NA,"role_play",87,"LIAM"
"88",69,783.704,790.668,"MATT","""you were responsible for it. she had me listen in to a conversation where you admitted ""that it was your fault.""",0,0,0,1,"Vestiges",5,6.96400000000006,23,0.0033026995979322,"first_half",NA,"role_play",88,"MATT"
"89",69,793.867,795.313,"LIAM","i'd like to make an insight check.",1,0,0,0,"Vestiges",5,1.44600000000003,9,0.00622406639004138,"first_half",NA,"role_play",89,"LIAM"
"90",69,795.313,797.166,"MATT","go for it.",0,0,0,1,"Vestiges",5,1.85300000000007,4,0.00215866162978945,"first_half",NA,"role_play",90,"MATT"
"91",69,797.166,800.761,"LIAM","no.",1,0,0,0,"Vestiges",5,3.59499999999991,2,0.000556328233657872,"first_half",NA,"role_play",91,"LIAM"
"92",69,800.761,806.626,"MATT","he seems emotionally on the brim of a complete nervous breakdown, but he's holding his ground. his hands are shaking in place as he stands staring at you with the look of a man on the precipice.",0,0,0,1,"Vestiges",5,5.86500000000001,39,0.00664961636828643,"first_half",NA,"role_play",92,"MATT"
"93",69,812.523,815.877,"LIAM","kynan, what am i to do with you?",1,0,0,0,"Vestiges",5,3.35399999999993,9,0.00268336314847949,"first_half",NA,"role_play",93,"LIAM"
"94",69,815.877,818.985,"LAURA","we'll deal with him later.",1,0,0,0,"Vestiges",5,3.10800000000006,7,0.00225225225225221,"first_half",NA,"role_play",94,"LAURA"
"95",69,818.985,826.705,"LIAM","i ought to cut the heart from your ribs. i ought to cut out my own! is there anyone else here, now? is that it?",1,0,0,0,"Vestiges",5,7.72000000000003,26,0.00336787564766838,"first_half",NA,"role_play",95,"LIAM"
"96",69,828.934,836.247,"MATT","""well, we went back to the cavern to set up, but you got here too quickly""",0,0,0,1,"Vestiges",5,7.31299999999999,18,0.00246137016272392,"first_half",NA,"role_play",96,"MATT"
"97",69,836.247,838.535,"LIAM","how long have you been here?",1,0,0,0,"Vestiges",5,2.28800000000001,7,0.00305944055944054,"first_half",NA,"role_play",97,"LIAM"
"98",69,838.535,840.673,"MATT","""only a few hours.""",0,0,0,1,"Vestiges",5,2.13800000000003,6,0.00280636108512624,"first_half",NA,"role_play",98,"MATT"
"99",69,840.673,846.991,"LIAM","a few hours was all it took for that? are there more of you?",1,0,0,0,"Vestiges",5,6.31799999999998,15,0.00237416904083571,"first_half",NA,"role_play",99,"LIAM"
"100",69,846.991,849.995,"MATT","""we have a few people on the ship.""",0,0,0,1,"Vestiges",5,3.00400000000002,10,0.00332889480692408,"first_half",NA,"role_play",100,"MATT"
"101",69,849.995,853.099,"TRAVIS","not anymore.",1,0,0,0,"Vestiges",5,3.10400000000004,3,0.000966494845360812,"first_half",NA,"role_play",101,"TRAVIS"
"102",69,853.099,861.586,"LIAM","listen to me. i don't know what's going to happen in the next 24 hours for you, but the best thing you can do right now is help us. when anyone asks you to do something, you do it.",1,0,0,0,"Vestiges",5,8.48699999999997,42,0.00494874513962533,"first_half",NA,"role_play",102,"LIAM"
"103",69,866.307,872.099,"MATT","""well, i would ask for a chance to redeem myself, but i am also beginning to understand what ""i've done. and i accept whatever judgment you see fit. just know that just know that ""i've been very confused.""",0,0,0,1,"Vestiges",5,5.79200000000003,42,0.00725138121546958,"first_half",NA,"role_play",103,"MATT"
"104",69,887.008,897.565,"LIAM","look at me. kynan, look at me. you help right now. put all that out of your mind. right now, you help. can you do that?",1,0,0,0,"Vestiges",5,10.557,27,0.00255754475703324,"first_half",NA,"role_play",104,"LIAM"
"105",69,899.059,901.254,"MATT","""how can i help?""",0,0,0,1,"Vestiges",5,2.19500000000005,6,0.00273348519362181,"first_half",NA,"role_play",105,"MATT"
"106",69,901.254,905.272,"LIAM","just do whatever we ask.",1,0,0,0,"Vestiges",5,4.01800000000003,6,0.00149328023892483,"first_half",NA,"role_play",106,"LIAM"
"107",69,905.272,911.446,"MATT","""whatever you want me to tell you. i know a little bit. anything, just let me know.""",0,0,0,1,"Vestiges",5,6.17399999999998,19,0.00307742144476839,"first_half",NA,"role_play",107,"MATT"
"108",69,911.617,916.761,"LIAM","we're going to table this. just be johnny-on-the-spot right now, all right?",1,0,0,0,"Vestiges",5,5.14400000000001,17,0.00330482115085536,"first_half",NA,"role_play",108,"LIAM"
"109",69,916.761,919.362,"MATT","""okay.""",0,0,0,1,"Vestiges",5,2.601,3,0.00115340253748558,"first_half",NA,"role_play",109,"MATT"
"110",69,919.362,924.695,"LAURA","grog? can you pick him up? percy?",1,0,0,0,"Vestiges",5,5.33300000000008,8,0.00150009375585972,"first_half",NA,"role_play",110,"LAURA"
"111",69,924.695,928.912,"TRAVIS","yeah. where am i taking him?",1,0,0,0,"Vestiges",5,4.21699999999998,7,0.00165994783021106,"first_half",NA,"role_play",111,"TRAVIS"
"112",69,928.912,933.83,"MARISHA","i have nothing left. i have no way to get us out of here quickly right now.",1,0,0,0,"Vestiges",5,4.91800000000001,18,0.00366002440016266,"first_half",NA,"role_play",112,"MARISHA"
"113",69,933.83,936.803,"TRAVIS","can i ask, is orthax still here? that's who that was, right?",1,0,0,0,"Vestiges",5,2.97299999999996,14,0.0047090480995628,"first_half",NA,"role_play",113,"TRAVIS"
"114",69,936.803,938,"LIAM","yes.",1,0,0,0,"Vestiges",5,1.197,2,0.00167084377610693,"first_half",NA,"role_play",114,"LIAM"
"115",69,938,941.923,"MARISHA","orthax could have his soul, for all we know.",1,0,0,0,"Vestiges",5,3.923,10,0.00254906958959979,"first_half",NA,"role_play",115,"MARISHA"
