"","arc","arc_no","episode","turn_number","segment","actor","text","start_turn","end_turn","time_in_sec","word_count","words_per_ms","encounter_count","rp_combat","actor_guest","vox_machina","guest","staff","matt"
"1190","Fall_Conclave",6,7,1190,"break","ASHLEY","so future t-shirts were you guys saying something, like it would be artwork from",7472.491,7476.445,3.95399999999972,15,0.00379362670713228,NA,NA,"ASHLEY",1,0,0,0
"1191","Fall_Conclave",6,7,1191,"break","MARISHA","yes, this was, we got this from @rusegafdi. he wore this at tabletop day, so",7476.445,7483.705,7.26000000000022,15,0.00206611570247928,NA,NA,"MARISHA",1,0,0,0
"1192","Fall_Conclave",6,7,1192,"break","LAURA","a very similar design, so yeah.",7483.705,7485.792,2.08700000000044,7,0.0033540967896495,NA,NA,"LAURA",1,0,0,0
"1193","Fall_Conclave",6,7,1193,"break","MARISHA","yeah, so we're we decided we're going to do, like, fan-designed t-shirts. so, once every so often, we'll do a fan-designed t-shirt, and yes. and then but they'll all be limited, so yeah!",7485.792,7497.866,12.0739999999996,42,0.00347854894815317,NA,NA,"MARISHA",1,0,0,0
"1194","Fall_Conclave",6,7,1194,"break","MATT","yeah. shipping, shipping is included with the price, guys, don't worry. but yeah. so, anyway, check that out! thank you guys so much, and let's go ahead and get back to the game proper.",7497.866,7506.415,8.54899999999998,37,0.00432799157796235,NA,NA,"MATT",0,0,0,1
"1195","Fall_Conclave",6,7,1195,"break","OFFSCREEN","hey, the t-shirts are sold out already. they're now sold out. they bought all of them.",7506.415,7510.307,3.89199999999983,19,0.00488180883864359,NA,NA,"OFFSCREEN",0,0,1,0
"1196","Fall_Conclave",6,7,1196,"break","MARISHA","t-shirts are sold out!",7510.307,7512.525,2.21799999999985,6,0.00270513976555474,NA,NA,"MARISHA",1,0,0,0
"1197","Fall_Conclave",6,7,1197,"break","ORION","wait, what?",7512.525,7513.666,1.14100000000053,3,0.00262927256792165,NA,NA,"ORION",1,0,0,0
"1198","Fall_Conclave",6,7,1198,"break","TALIESIN","we didn't even finish telling you people!",7513.666,7516.085,2.41899999999987,9,0.00372054568003327,NA,NA,"TALIESIN",1,0,0,0
"1199","Fall_Conclave",6,7,1199,"break","LAURA","no they're not.",7516.085,7517.963,1.8779999999997,5,0.00266240681576187,NA,NA,"LAURA",1,0,0,0
"1200","Fall_Conclave",6,7,1200,"break","TALIESIN","let us finish our sentence first!",7517.963,7519.394,1.43100000000049,7,0.00489168413696546,NA,NA,"TALIESIN",1,0,0,0
"1201","Fall_Conclave",6,7,1201,"break","MATT","okay, so, so, so the limited run was very limited",7519.394,7523.693,4.29899999999998,10,0.00232612235403583,NA,NA,"MATT",0,0,0,1
"1202","Fall_Conclave",6,7,1202,"break","MARISHA","holy shit!",7523.693,7527.317,3.6239999999998,3,0.00082781456953647,NA,NA,"MARISHA",1,0,0,0
"1203","Fall_Conclave",6,7,1203,"break","MATT","i guess we'll have to order some more, then.",7527.317,7529.084,1.76699999999983,11,0.0062252405206571,NA,NA,"MATT",0,0,0,1
"1204","Fall_Conclave",6,7,1204,"break","SAM","uh, mental note: make more t-shirts.",7529.084,7532.551,3.46700000000055,8,0.00230747043553468,NA,NA,"SAM",1,0,0,0
"1205","Fall_Conclave",6,7,1205,"break","MARISHA","we didn't know! we didn't know!",7532.551,7534.545,1.99399999999969,9,0.0045135406218663,NA,NA,"MARISHA",1,0,0,0
"1206","Fall_Conclave",6,7,1206,"break","MATT","we were gauging interest. i guess there's interest.",7534.545,7538.416,3.87100000000009,10,0.00258331180573489,NA,NA,"MATT",0,0,0,1
"1207","Fall_Conclave",6,7,1207,"break","MARISHA","i'm sorry! now i almost feel guilty. congratulations to the 100 people who got 'em.",7538.416,7546.428,8.01199999999972,17,0.00212181727408894,NA,NA,"MARISHA",1,0,0,0
"1208","Fall_Conclave",6,7,1208,"break","ORION","hold on. tiberius is gonna work some magic, and then try to conjure up a few more. he was unaware there was a shortage of, of those okay.",7546.428,7556.517,10.0889999999999,29,0.00287441768262466,NA,NA,"ORION",1,0,0,0
"1209","Fall_Conclave",6,7,1209,"break","MATT","sorry, guys, all right, well, we'll thank you guys very much, we'll get more to you very soon.",7556.517,7562.518,6.0010000000002,21,0.00349941676387257,NA,NA,"MATT",0,0,0,1
"1210","Fall_Conclave",6,7,1210,"break","MARISHA","i don't know what to say! oh god, i'm like, going to cry.",7562.518,7567.876,5.35800000000017,16,0.00298618887644634,NA,NA,"MARISHA",1,0,0,0
"1211","Fall_Conclave",6,7,1211,"break","LAURA","second run, yeah! just hashtag them critical role and we'll oh, but if you're selling them already, there's somebody that's making really cool t-shirts on redbubble, but if you're making them there, like, we can't print them too, so, like, just submit them to us, and then we can",7567.876,7579.977,12.1009999999997,56,0.00462771671762677,NA,NA,"LAURA",1,0,0,0
"1212","Fall_Conclave",6,7,1212,"break","MATT","yeah, we'll figure it out! anyway, guys, thank you so much! let's get to the game!",7579.977,7585.525,5.54799999999977,19,0.00342465753424671,NA,NA,"MATT",0,0,0,1
"1213","Fall_Conclave",6,7,1213,"break","TALIESIN","thank you! cool!",7585.525,7587.777,2.25200000000041,4,0.00177619893428032,NA,NA,"TALIESIN",1,0,0,0
"1214","Fall_Conclave",6,7,1214,"break","SAM","guys, guys, the chatroom just solved the israeli-palestinian conflict!",7587.777,7594.386,6.60900000000038,11,0.00166439703434701,NA,NA,"SAM",1,0,0,0
"1215","Fall_Conclave",6,7,1215,"break","MATT","thank you so much, chat! nice.",7594.386,7597.374,2.98799999999937,7,0.00234270414993356,NA,NA,"MATT",0,0,0,1
"1216","Fall_Conclave",6,7,1216,"break","TALIESIN","we've got a box of stuff coming right for you right now. thank you.",7597.374,7601.592,4.21799999999985,16,0.00379326695116183,NA,NA,"TALIESIN",1,0,0,0
"1217","Fall_Conclave",6,7,1217,"break","MARISHA","oh my god, i'm like, shaking.",7601.592,7608.213,6.62100000000009,8,0.00120827669536322,NA,NA,"MARISHA",1,0,0,0
"1218","Fall_Conclave",6,7,1218,"break","MATT","all right, so. for all who didn't get 'em, we'll have more soon, i promise.",7608.213,7613.71,5.4970000000003,18,0.00327451337092942,NA,NA,"MATT",0,0,0,1
"1219","Fall_Conclave",6,7,1219,"break","LIAM","do you guys like and? what is that?",7613.71,7619.671,5.96100000000024,9,0.00150981378963255,NA,NA,"LIAM",1,0,0,0
"1220","Fall_Conclave",6,7,1220,"break","MARISHA","we didn't know if people liked our show or not!",7619.671,7622.266,2.59499999999935,12,0.00462427745664857,NA,NA,"MARISHA",1,0,0,0
"1221","Fall_Conclave",6,7,1221,"break","MATT","so. so. so, you've housed yourselves into this enchanting room, this magical laboratory, and taken about a 15-minute rest. you're able to use any of your unused hit dice to heal yourself up if need be. any",7622.266,7633.85,11.5840000000007,40,0.00345303867403293,NA,NA,"MATT",0,0,0,1
"1222","Fall_Conclave",6,7,1222,"second_half_rp","ASHLEY","oh, well, where's everybody at? 'cause maybe i can just do a some healing up.",7633.85,7637.678,3.82799999999952,17,0.00444096133751362,NA,"role_play","ASHLEY",1,0,0,0
"1223","Fall_Conclave",6,7,1223,"second_half_rp","TALIESIN","i just spent a healing surge, so.",7637.678,7639.225,1.54700000000048,8,0.00517129928894474,NA,"role_play","TALIESIN",1,0,0,0
"1224","Fall_Conclave",6,7,1224,"second_half_rp","LAURA","well, he's, well, as far as health goes",7639.225,7640.981,1.7559999999994,9,0.00512528473804274,NA,"role_play","LAURA",1,0,0,0
"1225","Fall_Conclave",6,7,1225,"second_half_rp","LIAM","i'm low, yeah, i'm pretty low.",7640.981,7642.563,1.58200000000033,9,0.0056890012642213,NA,"role_play","LIAM",1,0,0,0
"1226","Fall_Conclave",6,7,1226,"second_half_rp","ASHLEY","yeah, what are you at?",7642.563,7643.71,1.14699999999993,6,0.0052310374891023,NA,"role_play","ASHLEY",1,0,0,0
"1227","Fall_Conclave",6,7,1227,"second_half_rp","MATT","how many hit dice do you have left?",7643.71,7645.024,1.31400000000031,9,0.00684931506849156,NA,"role_play","MATT",0,0,0,1
"1228","Fall_Conclave",6,7,1228,"second_half_rp","LIAM","i know, i have, i don't have that many left. i'm at, like i accidentally erased it, but i believe i'm at 30?",7645.024,7651.113,6.08899999999994,27,0.0044342256528166,NA,"role_play","LIAM",1,0,0,0
"1229","Fall_Conclave",6,7,1229,"second_half_rp","ASHLEY","ooh, yeah, you i need to, i'll get on that. anybody else? what's everybody at?",7651.113,7656.413,5.29999999999927,18,0.00339622641509481,NA,"role_play","ASHLEY",1,0,0,0
"1230","Fall_Conclave",6,7,1230,"second_half_rp","SAM","i can sing to you and give you an extra little roll.",7656.413,7659.703,3.29000000000087,13,0.00395136778115397,NA,"role_play","SAM",1,0,0,0
"1231","Fall_Conclave",6,7,1231,"second_half_rp","LIAM","i'd like you to sing to me, either in the game or on another day.",7659.703,7663.262,3.55899999999929,17,0.00477662264681186,NA,"role_play","LIAM",1,0,0,0
"1232","Fall_Conclave",6,7,1232,"second_half_rp","SAM","are you vex or vax?",7663.262,7665.4,2.13799999999992,6,0.00280636108512639,NA,"role_play","SAM",1,0,0,0
"1233","Fall_Conclave",6,7,1233,"second_half_rp","LIAM","i'm vix.",7665.4,7666.724,1.32400000000052,4,0.00302114803625258,NA,"role_play","LIAM",1,0,0,0
"1234","Fall_Conclave",6,7,1234,"second_half_rp","SAM","all right, i'll sing to you and are you gonna use a dice?",7666.724,7670.333,3.60899999999947,15,0.00415627597672547,NA,"role_play","SAM",1,0,0,0
"1235","Fall_Conclave",6,7,1235,"second_half_rp","LIAM","thank you. ah, let me see how beautiful your song is",7670.333,7675.956,5.6230000000005,11,0.00195625111150614,NA,"role_play","LIAM",1,0,0,0
"1236","Fall_Conclave",6,7,1236,"second_half_rp","SAM","heal the vax, make him a better elf.",7675.956,7681.483,5.52700000000004,9,0.00162836982087931,NA,"role_play","SAM",1,0,0,0
"1237","Fall_Conclave",6,7,1237,"second_half_rp","ASHLEY AND SAM","for you and for me and the entire adventuring band.",7681.483,7687.479,5.99600000000009,11,0.00183455637091391,NA,"role_play","ASHLEY AND SAM",1,0,0,0
"1238","Fall_Conclave",6,7,1238,"second_half_rp","SAM","there are duergar dying, if you cared enough for the adventurers, you'd bring vax back to help us with the stabby-stab. thank you, thank you, thank you.",7687.479,7701.578,14.0990000000002,30,0.00212781048301296,NA,"role_play","SAM",1,0,0,0
"1239","Fall_Conclave",6,7,1239,"second_half_rp","LIAM","and please, vaccinate your kids.",7701.578,7707.835,6.25699999999961,6,0.000958926002876838,NA,"role_play","LIAM",1,0,0,0
"1240","Fall_Conclave",6,7,1240,"second_half_rp","LIAM","i mean, don't vax-inate them.",7707.835,7709.82,1.98499999999967,8,0.00403022670025255,NA,"role_play","LIAM",1,0,0,0
"1241","Fall_Conclave",6,7,1241,"second_half_rp","MATT","yeah, there's the difference. all right, so.",7709.82,7713.085,3.26500000000033,9,0.00275650842266435,NA,"role_play","MATT",0,0,0,1
"1242","Fall_Conclave",6,7,1242,"second_half_rp","SAM","you get a 1d6 for that.",7713.085,7715.362,2.27700000000004,7,0.00307422046552475,NA,"role_play","SAM",1,0,0,0
"1243","Fall_Conclave",6,7,1243,"second_half_rp","MATT","so, an extra 1d6 healing to anyone.",7715.362,7717.463,2.10099999999966,8,0.00380771061399396,NA,"role_play","MATT",0,0,0,1
"1244","Fall_Conclave",6,7,1244,"second_half_rp","LIAM","who needs more than one? three, okay.",7717.463,7719.41,1.94700000000012,8,0.00410888546481742,NA,"role_play","LIAM",1,0,0,0
"1245","Fall_Conclave",6,7,1245,"second_half_rp","ASHLEY","i healed you, 18, which was actually low, but i rolled really high for each roll. that's my",7719.41,7726.005,6.59500000000025,19,0.00288097043214545,NA,"role_play","ASHLEY",1,0,0,0
"1246","Fall_Conclave",6,7,1246,"second_half_rp","LIAM","oh, thanks. that's very good. okay, great, i am almost tip-top condition, thank you. i have a blister.",7726.005,7731.818,5.8130000000001,21,0.00361259246516422,NA,"role_play","LIAM",1,0,0,0
"1247","Fall_Conclave",6,7,1247,"second_half_rp","MATT","so, as you guys manage to pull yourself out of your rest mode, you now glance out, and the hallway's still quiet, you can hear the movement of footsteps up above you. what is your intent?",7731.818,7741.346,9.52799999999934,38,0.00398824517212454,NA,"role_play","MATT",0,0,0,1
"1248","Fall_Conclave",6,7,1248,"second_half_rp","SAM","to win!",7741.346,7744.618,3.27200000000084,3,0.000916870415647685,NA,"role_play","SAM",1,0,0,0
"1249","Fall_Conclave",6,7,1249,"second_half_rp","MARISHA","okay. wait, what are we gonna do, 'cause here's there's an army waiting upstairs for us?",7744.618,7749.971,5.35299999999916,19,0.00354941154492864,NA,"role_play","MARISHA",1,0,0,0
"1250","Fall_Conclave",6,7,1250,"second_half_rp","LIAM","they know we're up there, but kima needs her stuff, and we need to kind of put an end to this problem.",7749.971,7755.598,5.62700000000041,24,0.00426515016882855,NA,"role_play","LIAM",1,0,0,0
"1251","Fall_Conclave",6,7,1251,"second_half_rp","MARISHA","i'm gonna hop out of tiger form, by the way, since we rested and stuff.",7755.598,7758.332,2.73400000000038,17,0.00621799561082577,NA,"role_play","MARISHA",1,0,0,0
"1252","Fall_Conclave",6,7,1252,"second_half_rp","SAM","wait, they're above us?",7758.332,7759.787,1.45499999999993,6,0.00412371134020639,NA,"role_play","SAM",1,0,0,0
"1253","Fall_Conclave",6,7,1253,"second_half_rp","LIAM","yeah, they're all upstairs, including the mind flayer who vanished from the room we're in, so i'm sure he told everyone what's going on. but they don't know we've found the secret entrance, so i think we should go vex'ahlia's correct, we should use the stairwell near the secret entrance.",7759.787,7777.381,17.5940000000001,59,0.00335341593725133,NA,"role_play","LIAM",1,0,0,0
"1254","Fall_Conclave",6,7,1254,"second_half_rp","ORION","are we sure there's no other way out of here, through this particular floor? is that the only exit?",7777.381,7782.178,4.79699999999957,21,0.00437773608505355,NA,"role_play","ORION",1,0,0,0
"1255","Fall_Conclave",6,7,1255,"second_half_rp","LAURA","there's i mean, there's the front entrance, there's that door over there, there's like two other stairways, but we should use this back one, by the back entrance.",7782.178,7790.097,7.91899999999987,33,0.00416719282737726,NA,"role_play","LAURA",1,0,0,0
"1256","Fall_Conclave",6,7,1256,"second_half_rp","LIAM","also, lady kima, our purpose here was to find you, but your purpose is somewhat greater than our own. what do you suggest we do in this moment?",7790.097,7801.516,11.4189999999999,29,0.00253962693756024,NA,"role_play","LIAM",1,0,0,0
"1257","Fall_Conclave",6,7,1257,"second_half_rp","MATT","as she stands up, and she holds the greatsword and swings it a bit. ""what i'm seeking ""lies deeper into this cavern. whatever is at the heart of this illithid scourge."" and she glances over at clarota who's in the back corner, hands folded and there's a slight mental hiss sound in her direction. ""there's something far darker at the heart of this temple. i've seen it. but i have ""my thoughts and my ideas, but i need confirmation before i speak of any doom-saying. however, the ""link between those foul creatures and the assault that's currently mounting against kraghammer lie ""upstairs at the center of this duergar people.""",7801.516,7848.439,46.9230000000007,117,0.00249344671056834,NA,"role_play","MATT",0,0,0,1
"1258","Fall_Conclave",6,7,1258,"second_half_rp","SAM","oh, here? here at where we are now? yes, here?",7848.439,7853.976,5.53699999999935,11,0.00198663536210968,NA,"role_play","SAM",1,0,0,0
"1259","Fall_Conclave",6,7,1259,"second_half_rp","MATT","""the link between this k'varn character""",7853.976,7856.674,2.69800000000032,9,0.0033358042994807,NA,"role_play","MATT",0,0,0,1
"1260","Fall_Conclave",6,7,1260,"second_half_rp","LIAM","and let me ask you this. we can be on the same page, we can go up and fuck shit up. however, your weapons and armor would they be a great help? should they be our short-term purpose, or should we just go up and try to end this problem?",7856.674,7875.537,18.8630000000003,52,0.00275671950379045,NA,"role_play","LIAM",1,0,0,0
"1261","Fall_Conclave",6,7,1261,"second_half_rp","MATT","""to be honest, we've entirely lost the element of surprise. i would not wish to sacrifice ""as foolishly for a few additional trinkets of my own when i feel that this should do well enough, ""as long as we manage to work together and be smart about this.""",7875.537,7890.615,15.0779999999995,51,0.003382411460406,NA,"role_play","MATT",0,0,0,1
"1262","Fall_Conclave",6,7,1262,"second_half_rp","LAURA","so we should potentially just leave this castle for now and go find k'varn, rest up",7890.615,7896.432,5.81700000000001,17,0.00292246862643974,NA,"role_play","LAURA",1,0,0,0
"1263","Fall_Conclave",6,7,1263,"second_half_rp","SAM","no, no, no.",7896.432,7897.72,1.28800000000047,4,0.00310559006211068,NA,"role_play","SAM",1,0,0,0
"1264","Fall_Conclave",6,7,1264,"second_half_rp","LIAM","no, kima is saying this is the main event.",7897.72,7899.75,2.02999999999975,10,0.00492610837438485,NA,"role_play","LIAM",1,0,0,0
"1265","Fall_Conclave",6,7,1265,"second_half_rp","SAM","she just said there's a link upstairs. the link from to k'varn that we need to",7899.75,7906.724,6.97400000000016,18,0.00258101519931167,NA,"role_play","SAM",1,0,0,0
"1266","Fall_Conclave",6,7,1266,"second_half_rp","LAURA","i get it! okay. yeah.",7906.724,7908.735,2.01099999999951,6,0.00298359025360589,NA,"role_play","LAURA",1,0,0,0
"1267","Fall_Conclave",6,7,1267,"second_half_rp","MATT","""how do you think k'varn is able to send these armies up again and again towards the back ""door of kraghammer?""",7908.735,7913.268,4.53300000000036,24,0.00529450694903995,NA,"role_play","MATT",0,0,0,1
"1268","Fall_Conclave",6,7,1268,"second_half_rp","LAURA","right.",7913.268,7914.486,1.21799999999985,2,0.00164203612479495,NA,"role_play","LAURA",1,0,0,0
"1269","Fall_Conclave",6,7,1269,"second_half_rp","MATT","""besides, if we go on and leave them as they are, who's to say they wouldn't come up behind us, ""and then we're fighting a two-sided front once we get there?""",7914.486,7920.601,6.11499999999978,37,0.00605069501226514,NA,"role_play","MATT",0,0,0,1
"1270","Fall_Conclave",6,7,1270,"second_half_rp","LAURA","then let's we gotta go upstairs.",7920.601,7923.19,2.58899999999994,8,0.0030899961375049,NA,"role_play","LAURA",1,0,0,0
"1271","Fall_Conclave",6,7,1271,"second_half_rp","LIAM","vox machina, our years are short. let's make good use of them.",7923.19,7927.844,4.65400000000045,14,0.00300816501933791,NA,"role_play","LIAM",1,0,0,0
"1272","Fall_Conclave",6,7,1272,"second_half_rp","SAM","let's leave this decision up to grog.",7927.844,7930.106,2.26199999999972,9,0.00397877984084931,NA,"role_play","SAM",1,0,0,0
"1273","Fall_Conclave",6,7,1273,"second_half_rp","ORION","absolutely not!",7930.106,7933.523,3.41700000000037,3,0.000877963125548632,NA,"role_play","ORION",1,0,0,0
"1274","Fall_Conclave",6,7,1274,"second_half_rp","MATT","grog's standing there clutching his greataxe. ""i say, i haven't been able to kill much ""since we got here. let's kill something!""",7933.523,7942.355,8.83199999999943,26,0.00294384057971034,NA,"role_play","MATT",0,0,0,1
"1275","Fall_Conclave",6,7,1275,"second_half_rp","ORION","that's a terrible idea.",7942.355,7944.543,2.1880000000001,6,0.00274223034734905,NA,"role_play","ORION",1,0,0,0
"1276","Fall_Conclave",6,7,1276,"second_half_rp","LAURA","have some ale before we go out, grog.",7944.543,7946.613,2.07000000000062,9,0.00434782608695522,NA,"role_play","LAURA",1,0,0,0
"1277","Fall_Conclave",6,7,1277,"second_half_rp","MATT","""oh, yeah, of course."" and he goes into his bag of holding, and pulls out his now half-empty cask, and you see him frown as he hears it clink around. he pours everyone a small drink, to what is now an empty cask.",7946.613,7957.848,11.2349999999997,46,0.00409434801958178,NA,"role_play","MATT",0,0,0,1
"1278","Fall_Conclave",6,7,1278,"second_half_rp","LAURA","this could potentially kill us all.",7957.848,7960.673,2.82499999999982,7,0.00247787610619485,NA,"role_play","LAURA",1,0,0,0
"1279","Fall_Conclave",6,7,1279,"second_half_rp","MATT","vox machina.",7960.673,7962.329,1.65599999999995,3,0.00181159420289861,NA,"role_play","MATT",0,0,0,1
"1280","Fall_Conclave",6,7,1280,"second_half_rp","MATT","vox machina!",7962.329,7964.555,2.22600000000057,3,0.00134770889487836,NA,"role_play","MATT",0,0,0,1
"1281","Fall_Conclave",6,7,1281,"second_half_rp","LAURA","scanlan had a great idea, though. should we talk about what scanlan wants to do?",7964.555,7967.115,2.55999999999949,16,0.00625000000000124,NA,"role_play","LAURA",1,0,0,0
"1282","Fall_Conclave",6,7,1282,"second_half_rp","SAM","ah, yes, i have an idea. but also, are there two stairs up to the top floor?",7967.115,7970.946,3.83100000000013,18,0.00469851213782286,NA,"role_play","SAM",1,0,0,0
"1283","Fall_Conclave",6,7,1283,"second_half_rp","LIAM","there's multiple.",7970.946,7973.129,2.18299999999999,4,0.00183234081539167,NA,"role_play","LIAM",1,0,0,0
"1284","Fall_Conclave",6,7,1284,"second_half_rp","SAM","perhaps we should use more than one. one, half of our band go up, create a diversion. the other half sneak up and kill, kill, kill. that's one option. the other option",7973.129,7985.813,12.6840000000002,33,0.00260170293282872,NA,"role_play","SAM",1,0,0,0
"1285","Fall_Conclave",6,7,1285,"second_half_rp","LIAM","pike leads the diversion group.",7985.813,7987.521,1.70799999999963,6,0.00351288056206165,NA,"role_play","LIAM",1,0,0,0
"1286","Fall_Conclave",6,7,1286,"second_half_rp","ASHLEY","definitely the stealthy ones with me.",7987.521,7991.792,4.27100000000064,7,0.00163896043081221,NA,"role_play","ASHLEY",1,0,0,0
"1287","Fall_Conclave",6,7,1287,"second_half_rp","SAM","ah, i do have an idea about gaining the upper hand on our first meeting with this army that's upstairs. an intimidation technique of some sort.",7991.792,8002.462,10.6700000000001,28,0.00262417994376755,NA,"role_play","SAM",1,0,0,0
"1288","Fall_Conclave",6,7,1288,"second_half_rp","MARISHA","you're not going to kill another pony, are you?",8002.462,8005.063,2.60099999999966,11,0.00422914263744769,NA,"role_play","MARISHA",1,0,0,0
"1289","Fall_Conclave",6,7,1289,"second_half_rp","SAM","i can't anymore.",8005.063,8006.456,1.39300000000003,5,0.00358937544867186,NA,"role_play","SAM",1,0,0,0
"1290","Fall_Conclave",6,7,1290,"second_half_rp","MARISHA","good.",8006.456,8007.942,1.48599999999988,2,0.00134589502018854,NA,"role_play","MARISHA",1,0,0,0
"1291","Fall_Conclave",6,7,1291,"second_half_rp","SAM","much as i would love to. no, but we've heard over our eavesdropping that some of these duergar bastards are scared of that strange chimera sort of hodgepodge, human centipede thing? we could be one of those with a little bit of deception, and all of us sort of piling on each other. we could act like a big scary monster and go up and freak the fuck out of them.",8007.942,8032.725,24.7830000000004,73,0.00294556752612674,NA,"role_play","SAM",1,0,0,0
"1292","Fall_Conclave",6,7,1292,"second_half_rp","MARISHA","ah! that's actually a really good idea.",8032.725,8035.812,3.08699999999953,9,0.00291545189504417,NA,"role_play","MARISHA",1,0,0,0
"1293","Fall_Conclave",6,7,1293,"second_half_rp","LAURA","all of us piled on grog and trinket and you as the bases, and we become this",8035.812,8040.697,4.88500000000022,17,0.00348004094165798,NA,"role_play","LAURA",1,0,0,0
"1294","Fall_Conclave",6,7,1294,"second_half_rp","SAM","they would probably be, at least for the moment, intimidated a bit, and we could get a few licks in before they realized we're just a pile of idiots running at them.",8040.697,8051.834,11.1369999999997,34,0.00305288677381708,NA,"role_play","SAM",1,0,0,0
"1295","Fall_Conclave",6,7,1295,"second_half_rp","LAURA","i like it.",8051.834,8053.406,1.57200000000012,4,0.00254452926208633,NA,"role_play","LAURA",1,0,0,0
"1296","Fall_Conclave",6,7,1296,"second_half_rp","MARISHA","so we're basically gonna be like three kids little rascals-style on each other's shoulders with a giant coat?",8053.406,8061.661,8.25500000000011,22,0.00266505148394909,NA,"role_play","MARISHA",1,0,0,0
"1297","Fall_Conclave",6,7,1297,"second_half_rp","SAM","but that could be the diversion, at least.",8061.661,8064.614,2.95299999999952,9,0.00304774805282813,NA,"role_play","SAM",1,0,0,0
"1298","Fall_Conclave",6,7,1298,"second_half_rp","MARISHA","okay, well then, why don't i actually like this idea. why don't we have a few of our stealthy members, why don't we have the twins be in the shadows, and picking people off while",8064.614,8072.684,8.07000000000062,38,0.00470879801734784,NA,"role_play","MARISHA",1,0,0,0
"1299","Fall_Conclave",6,7,1299,"second_half_rp","LAURA","that's true, 'cause i've got range, so that makes sense.",8072.684,8074.668,1.98399999999947,13,0.00655241935484046,NA,"role_play","LAURA",1,0,0,0
"1300","Fall_Conclave",6,7,1300,"second_half_rp","MARISHA","right, why don't we have some of our ranged people i'll transform. i can transform into how about a giant scorpion? that sounds fun.",8074.668,8081.45,6.78200000000015,27,0.00398112651135349,NA,"role_play","MARISHA",1,0,0,0
"1301","Fall_Conclave",6,7,1301,"second_half_rp","SAM","can you transform into anything?",8081.45,8082.811,1.36099999999988,6,0.00440852314474691,NA,"role_play","SAM",1,0,0,0
"1302","Fall_Conclave",6,7,1302,"second_half_rp","MARISHA","i can transform into beasts. they have to be beasts.",8082.811,8085.824,3.01299999999992,11,0.00365084633255901,NA,"role_play","MARISHA",1,0,0,0
"1303","Fall_Conclave",6,7,1303,"second_half_rp","SAM","how about the type of beast that we know would scare them, like that big triceratops thing that we saw with the big metal thing on it.",8085.824,8092.848,7.02400000000034,28,0.0039863325740317,NA,"role_play","SAM",1,0,0,0
"1304","Fall_Conclave",6,7,1304,"second_half_rp","MARISHA","i can be a rhinoceros i can be, like can i do dinosaurs? i can be a dinosaur, right? that's a new thing i can be, right?",8092.848,8102.429,9.58100000000013,29,0.00302682392234627,NA,"role_play","MARISHA",1,0,0,0
