"","arc","arc_no","episode","turn_number","segment","actor","text","start_turn","end_turn","time_in_sec","word_count","words_per_ms","encounter_count","rp_combat","actor_guest","vox_machina","guest","staff","matt"
"561","Fall_Conclave",6,7,561,"combat","LIAM","in. so i'm just gonna go like this and throw a dagger and say peek-a-boo at the same time.",3542.738,3548.086,5.34799999999996,23,0.00430067314884072,2,"combat","LIAM",1,0,0,0
"562","Fall_Conclave",6,7,562,"combat","MATT","okay. as you step out.",3548.086,3549.87,1.78400000000011,6,0.00336322869955137,2,"combat","MATT",0,0,0,1
"563","Fall_Conclave",6,7,563,"combat","LIAM","that is a 29 to hit.",3549.87,3552.176,2.30600000000004,7,0.00303555941023412,2,"combat","LIAM",1,0,0,0
"564","Fall_Conclave",6,7,564,"combat","MATT","that does hit.",3552.176,3553.258,1.08199999999988,4,0.00369685767098008,2,"combat","MATT",0,0,0,1
"565","Fall_Conclave",6,7,565,"combat","LIAM","okay.",3553.258,3554.188,0.930000000000291,2,0.00215053763440793,2,"combat","LIAM",1,0,0,0
"566","Fall_Conclave",6,7,566,"combat","MATT","you do not get sneak attack bonus, unfortunately.",3554.188,3556.28,2.0920000000001,9,0.00430210325047781,2,"combat","MATT",0,0,0,1
"567","Fall_Conclave",6,7,567,"combat","LIAM","even though my ally is five feet away from him? i thought i remembered that rule.",3556.28,3560.565,4.28499999999985,17,0.00396732788798146,2,"combat","LIAM",1,0,0,0
"568","Fall_Conclave",6,7,568,"combat","MATT","you do if you are in melee with them.",3560.565,3562.254,1.68899999999985,10,0.00592066311426932,2,"combat","MATT",0,0,0,1
"569","Fall_Conclave",6,7,569,"combat","LAURA","oh, right.",3562.254,3563.676,1.42200000000003,3,0.00210970464135017,2,"combat","LAURA",1,0,0,0
"570","Fall_Conclave",6,7,570,"combat","MATT","you get the bonus if you're both like flanking them, or you're like harrying them in combat. because you're at a distance, you don't get the bonus.",3563.676,3567.953,4.27700000000004,32,0.00748187982230528,2,"combat","MATT",0,0,0,1
"571","Fall_Conclave",6,7,571,"combat","LIAM","okay, so that is a nine. and then i'm going to follow the nine of damage.",3567.953,3572.482,4.529,18,0.0039743872819607,2,"combat","LIAM",1,0,0,0
"572","Fall_Conclave",6,7,572,"combat","MATT","all right.",3572.482,3573.486,1.00399999999991,3,0.00298804780876522,2,"combat","MATT",0,0,0,1
"573","Fall_Conclave",6,7,573,"combat","LIAM","and immediately follow up with my other dagger, which also hits.",3573.486,3575.777,2.29100000000017,12,0.00523788738542083,2,"combat","LIAM",1,0,0,0
"574","Fall_Conclave",6,7,574,"combat","MATT","all right, go ahead and roll damage on the second dagger. which is 1d4 plus what?",3575.777,3579.572,3.79500000000007,17,0.00447957839262178,2,"combat","MATT",0,0,0,1
"575","Fall_Conclave",6,7,575,"combat","LIAM","six. that's a nine.",3579.572,3581.836,2.26399999999967,6,0.00265017667844562,2,"combat","LIAM",1,0,0,0
"576","Fall_Conclave",6,7,576,"combat","MATT","nine, okay. so, after the guy rips his arm out of keyleth's face, essentially, a dagger comes swinging out from behind the doorway, stabs him in the other shoulder. you see he looks down at it confused for a second, and as that dagger vanishes in a puff of dark smoke, returning to your the side of your hilt, he looks up just in time to see the second dagger catch him right in the middle of the forehead, and he just falls onto his back at that point, unmoving. that duergar is stripped.",3581.836,3605.844,24.0080000000003,96,0.00399866711096297,2,"combat","MATT",0,0,0,1
"577","Fall_Conclave",6,7,577,"combat","LAURA","what-what!",3605.904,3607.106,1.20200000000023,3,0.00249584026622249,2,"combat","LAURA",1,0,0,0
"578","Fall_Conclave",6,7,578,"combat","MATT","who's up next? who wants to do anything? who hasn't done anything yet this action?",3607.106,3612.223,5.11699999999973,18,0.00351768614422531,2,"combat","MATT",0,0,0,1
"579","Fall_Conclave",6,7,579,"combat","SAM","is there is a door next to me for another room?",3612.288,3615.017,2.72899999999981,12,0.00439721509710547,2,"combat","SAM",1,0,0,0
"580","Fall_Conclave",6,7,580,"combat","MATT","you're just finishing.",3615.079,3616.154,1.07499999999982,5,0.00465116279069846,2,"combat","MATT",0,0,0,1
"581","Fall_Conclave",6,7,581,"combat","SAM","oh, i'm just finishing, okay.",3616.154,3617.309,1.1550000000002,7,0.00606060606060501,2,"combat","SAM",1,0,0,0
"582","Fall_Conclave",6,7,582,"combat","MATT","sorry. so, pike, have you done anything yet?",3617.309,3619.775,2.46599999999989,9,0.00364963503649651,2,"combat","MATT",0,0,0,1
"583","Fall_Conclave",6,7,583,"combat","ASHLEY","can i is there a door there? somewhere, right there?",3619.775,3622.538,2.76299999999992,11,0.00398117987694546,2,"combat","ASHLEY",1,0,0,0
"584","Fall_Conclave",6,7,584,"combat","MATT","you move around here, there is a door over here, yes.",3622.538,3624.817,2.279,12,0.00526546731022379,2,"combat","MATT",0,0,0,1
"585","Fall_Conclave",6,7,585,"combat","ASHLEY","i can't really do anything. check it out, check it out.",3624.878,3628.956,4.07799999999997,13,0.00318783717508585,2,"combat","ASHLEY",1,0,0,0
"586","Fall_Conclave",6,7,586,"combat","LIAM","yeah, bust in. you can't stealth.",3628.956,3630.682,1.72599999999966,8,0.00463499420625816,2,"combat","LIAM",1,0,0,0
"587","Fall_Conclave",6,7,587,"combat","MATT","the door is a secondary guest room.",3630.682,3632.597,1.91500000000042,8,0.00417754569190509,2,"combat","MATT",0,0,0,1
"588","Fall_Conclave",6,7,588,"combat","LIAM","and now, poop on this bed.",3632.597,3634.613,2.01599999999962,7,0.00347222222222287,2,"combat","LIAM",1,0,0,0
"589","Fall_Conclave",6,7,589,"combat","ASHLEY","all right.",3634.613,3639.291,4.67800000000034,3,0.00064129970072676,2,"combat","ASHLEY",1,0,0,0
"590","Fall_Conclave",6,7,590,"combat","TALIESIN","i can't do anything that could make noise anyway.",3639.291,3642.37,3.07899999999972,11,0.00357258850276096,2,"combat","TALIESIN",1,0,0,0
"591","Fall_Conclave",6,7,591,"combat","MATT","it is a guest room of equal design and dressing as the one that scanlan, you are unaware, is currently fouling.",3642.37,3652.904,10.5340000000001,22,0.00208847541294853,2,"combat","MATT",0,0,0,1
"592","Fall_Conclave",6,7,592,"combat","ASHLEY","maybe i get a sudden urge for some reason to just poo on the bed.",3652.904,3662.048,9.14399999999978,16,0.00174978127734038,2,"combat","ASHLEY",1,0,0,0
"593","Fall_Conclave",6,7,593,"combat","MATT","you can do what you want. be aware, pike as a character has her intent, the more you stray from that, the more it will have ramifications for her in the end.",3662.048,3671.557,9.50900000000001,33,0.00347039646650541,2,"combat","MATT",0,0,0,1
"594","Fall_Conclave",6,7,594,"combat","ASHLEY","yes, i know, i'm just kidding, that's not what, that's not what i want to do. i was just, had this feeling that scanlan was doing something and i felt that",3671.557,3677.014,5.45700000000033,34,0.00623052959501519,2,"combat","ASHLEY",1,0,0,0
"595","Fall_Conclave",6,7,595,"combat","SAM","she could probably hear, muffled from behind the door,.",3677.014,3681.008,3.99399999999969,10,0.00250375563345037,2,"combat","SAM",1,0,0,0
"596","Fall_Conclave",6,7,596,"combat","ASHLEY","okay, so i'll just i guess i can't do anything while i'm in there, so? can i just",3681.008,3689.171,8.16300000000001,21,0.00257258360896729,2,"combat","ASHLEY",1,0,0,0
"597","Fall_Conclave",6,7,597,"combat","MATT","that's about as far as you're able to move. you can still use your action if you wanted to do anything, but right now your vision is currently fairly well-blocked by a woman and a bear, and a man the size of a bear.",3689.171,3698.956,9.78500000000031,48,0.00490546755237593,2,"combat","MATT",0,0,0,1
"598","Fall_Conclave",6,7,598,"combat","ASHLEY","yeah, okay, so i'll just hang out there.",3698.956,3701.334,2.3779999999997,10,0.00420521446593829,2,"combat","ASHLEY",1,0,0,0
"599","Fall_Conclave",6,7,599,"combat","MATT","okay, so that brings us back to kima, who currently doesn't have any sort of way of getting over there, kind of frustrating, trying to find a way over.",3701.334,3711.854,10.52,31,0.00294676806083651,2,"combat","MATT",0,0,0,1
"600","Fall_Conclave",6,7,600,"combat","MARISHA","it's a narrow hallway.",3711.854,3713.975,2.12100000000009,6,0.0028288543140027,2,"combat","MARISHA",1,0,0,0
"601","Fall_Conclave",6,7,601,"combat","MATT","clarota, who is still invisible, is just gonna hold on that point.",3714.136,3717.172,3.03600000000006,13,0.00428194993412377,2,"combat","MATT",0,0,0,1
"602","Fall_Conclave",6,7,602,"combat","ORION","as everybody is doing this, i'm going to why are you blocking me, i'm not supposed to be this close to this thing! keep going.",3717.216,3724.089,6.87300000000005,28,0.00407391241088314,2,"combat","ORION",1,0,0,0
"603","Fall_Conclave",6,7,603,"combat","MATT","okay, percy! stand there? all right, tiberius, you're up.",3724.089,3728.464,4.375,11,0.00251428571428571,2,"combat","MATT",0,0,0,1
"604","Fall_Conclave",6,7,604,"combat","ORION","oh, like i was saying. well, shit.",3728.464,3735.08,6.61599999999999,8,0.00120918984280532,2,"combat","ORION",1,0,0,0
"605","Fall_Conclave",6,7,605,"combat","SAM","aren't you right next to the guy? kill him.",3735.127,3746.371,11.2440000000001,11,0.000978299537531115,2,"combat","SAM",1,0,0,0
"606","Fall_Conclave",6,7,606,"combat","MATT","do it quick, or we are gonna move for the next turn.",3746.533,3749.677,3.14400000000023,13,0.00413486005089028,2,"combat","MATT",0,0,0,1
"607","Fall_Conclave",6,7,607,"combat","ORION","okay, i'll just lift up my hand and go, firebolt.",3749.677,3755.125,5.44799999999987,12,0.00220264317180622,2,"combat","ORION",1,0,0,0
"608","Fall_Conclave",6,7,608,"combat","MATT","okay, point-blank firebolt. go ahead and roll your spell attack.",3755.125,3759.123,3.99800000000005,12,0.00300150075037515,2,"combat","MATT",0,0,0,1
"609","Fall_Conclave",6,7,609,"combat","ORION","okay, okay, 20.",3759.123,3765.681,6.55799999999999,4,0.000609942055504728,2,"combat","ORION",1,0,0,0
"610","Fall_Conclave",6,7,610,"combat","MATT","20, all right. that'll hit, go ahead and roll for damage for the firebolt.",3765.681,3772.316,6.63499999999976,16,0.00241145440844018,2,"combat","MATT",0,0,0,1
"611","Fall_Conclave",6,7,611,"combat","ORION","okay, ten, 18, 20, 21, 23.",3772.316,3779.832,7.51600000000008,7,0.000931346460883439,2,"combat","ORION",1,0,0,0
"612","Fall_Conclave",6,7,612,"combat","MATT","23 damage? all right. so as you instinctively pull back, you release the blast of firebolt energy, the duergar who is currently harrying you with this warhammer takes the brunt of it right to the bottom of his face and his torso. the studded leather armor that he's wearing tears open with a sheer flaming burst of the impact of it, and you see most of his skin is charred and burned at that point. he reels back for a second, looking very, very hurt but not quite put down yet.",3779.832,3807.482,27.6500000000001,93,0.0033634719710669,2,"combat","MATT",0,0,0,1
"613","Fall_Conclave",6,7,613,"combat","ORION","as my bonus action, i'm gonna spend two sorcery points and do it again. so i roll for that. it's a 22.",3807.482,3818.682,11.1999999999998,25,0.00223214285714289,2,"combat","ORION",1,0,0,0
"614","Fall_Conclave",6,7,614,"combat","MATT","all right, the second blast, as he reaches back, before he can get a chance to get back to his feet, the second blast hits. this time, it sends him off his feet, flying about five to ten feet back, skidding across the ground.",3818.682,3830.042,11.3600000000001,45,0.00396126760563376,2,"combat","MATT",0,0,0,1
"615","Fall_Conclave",6,7,615,"combat","ORION","15 damage.",3830.042,3831.2,1.1579999999999,3,0.00259067357512975,2,"combat","ORION",1,0,0,0
"616","Fall_Conclave",6,7,616,"combat","MATT","yes, and that puts him, still on the floor, laid out with a burning, kind of crippling, crispy scent in the air of what was once a standing duergar, now dead and burning on the ground.",3831.2,3842.769,11.569,37,0.00319820209179706,2,"combat","MATT",0,0,0,1
"617","Fall_Conclave",6,7,617,"combat","MARISHA","so once again i grab him by the scruff, take him, and put him in the bathroom.",3842.769,3850.101,7.33200000000033,18,0.00245499181669383,2,"combat","MARISHA",1,0,0,0
"618","Fall_Conclave",6,7,618,"combat","LIAM","i give a couple of pats on tiberius's shoulder and start to inch down the hall.",3850.171,3854.297,4.1260000000002,18,0.00436257876878311,2,"combat","LIAM",1,0,0,0
"619","Fall_Conclave",6,7,619,"combat","MATT","all right, as you guys are doing this, scanlan steps out of the guest room, getting his pantaloons back on.",3854.347,3860.165,5.81799999999976,21,0.00360948779649379,2,"combat","MATT",0,0,0,1
"620","Fall_Conclave",6,7,620,"combat","SAM","my invisible pantaloons.",3860.165,3861.862,1.69700000000012,4,0.00235710076605759,2,"combat","SAM",1,0,0,0
"621","Fall_Conclave",6,7,621,"combat","MATT","yes. you hear the footprints of scanlan, you being still invisible, you essentially just",3861.862,3866.453,4.59099999999989,14,0.00304944456545422,2,"combat","MATT",0,0,0,1
"622","Fall_Conclave",6,7,622,"combat","SAM","i phantom pooped. did i find anything in there, by the way?",3866.51,3874.349,7.83899999999994,13,0.00165837479270316,2,"combat","SAM",1,0,0,0
"623","Fall_Conclave",6,7,623,"combat","LIAM","just relief.",3874.367,3876.116,1.7489999999998,3,0.00171526586620946,2,"combat","LIAM",1,0,0,0
"624","Fall_Conclave",6,7,624,"combat","MATT","you found a fun way to prank duergar.",3876.116,3879.753,3.63700000000017,9,0.0024745669507835,2,"combat","MATT",0,0,0,1
"625","Fall_Conclave",6,7,625,"combat","MARISHA","oh, yeah, did i find anything in the barracks?",3879.753,3881.784,2.03099999999995,10,0.00492368291482041,2,"combat","MARISHA",1,0,0,0
"626","Fall_Conclave",6,7,626,"combat","MATT","over there? no.",3881.784,3883.621,1.83699999999999,4,0.00217746325530758,2,"combat","MATT",0,0,0,1
"627","Fall_Conclave",6,7,627,"combat","TALIESIN","did liam did vax find anything shiny in the room? the shiny thing.",3883.621,3889.484,5.86299999999983,14,0.0023878560463927,2,"combat","TALIESIN",1,0,0,0
"628","Fall_Conclave",6,7,628,"combat","LIAM","no, i got interrupted. that's a good idea, thanks for the reminder, percy.",3889.484,3894.257,4.77300000000014,15,0.00314267756128212,2,"combat","LIAM",1,0,0,0
"629","Fall_Conclave",6,7,629,"combat","TALIESIN","you're welcome, yes.",3894.32,3895.706,1.38599999999997,5,0.00360750360750369,2,"combat","TALIESIN",1,0,0,0
"630","Fall_Conclave",6,7,630,"combat","LIAM","checking for i checked for traps before, but i can't remember what i rolled. i'm sure it was successful.",3895.706,3900.933,5.22699999999986,22,0.00420891524775217,2,"combat","LIAM",1,0,0,0
"631","Fall_Conclave",6,7,631,"combat","MATT","go ahead and roll again.",3900.933,3903.749,2.8159999999998,6,0.00213068181818197,2,"combat","MATT",0,0,0,1
"632","Fall_Conclave",6,7,632,"combat","LIAM","17.",3903.749,3904.768,1.01900000000023,2,0.00196270853778169,2,"combat","LIAM",1,0,0,0
"633","Fall_Conclave",6,7,633,"combat","MATT","okay, as you push the door open and get a glance inside of the main hall, you don't see any traps across the floor.",3904.768,3910.928,6.15999999999985,26,0.00422077922077932,2,"combat","MATT",0,0,0,1
"634","Fall_Conclave",6,7,634,"combat","LIAM","okay, i'm gonna go check out the shiny thing.",3910.928,3912.658,1.73000000000002,11,0.00635838150289011,2,"combat","LIAM",1,0,0,0
"635","Fall_Conclave",6,7,635,"combat","MATT","okay. everyone else staying out in the hallway?",3912.658,3914.864,2.20600000000013,9,0.00407978241160447,2,"combat","MATT",0,0,0,1
"636","Fall_Conclave",6,7,636,"combat","SAM","i'm coming with him.",3914.864,3916.126,1.26200000000017,6,0.00475435816164753,2,"combat","SAM",1,0,0,0
"637","Fall_Conclave",6,7,637,"combat","MATT","okay.",3916.126,3916.812,0.685999999999694,2,0.00291545189504503,2,"combat","MATT",0,0,0,1
"638","Fall_Conclave",6,7,638,"combat","SAM","if i can get there.",3916.872,3918.266,1.39400000000023,6,0.00430416068866499,2,"combat","SAM",1,0,0,0
"639","Fall_Conclave",6,7,639,"combat","MATT","you manage to scoot through, dancing around folks, people kind of let you get by. anyone else?",3918.266,3922.825,4.55899999999974,18,0.00394823426189976,2,"combat","MATT",0,0,0,1
"640","Fall_Conclave",6,7,640,"combat","LAURA","yeah, sure, i like shiny things.",3922.825,3925.51,2.6850000000004,7,0.00260707635009272,2,"combat","LAURA",1,0,0,0
"641","Fall_Conclave",6,7,641,"combat","MARISHA","i'm burying my shame, again. burying the duergar.",3925.51,3931.336,5.82599999999957,10,0.00171644352900802,2,"combat","MARISHA",1,0,0,0
"642","Fall_Conclave",6,7,642,"combat","MATT","so, you're dragging the duergar over in the",3931.336,3934.261,2.92500000000018,9,0.00307692307692289,2,"combat","MATT",0,0,0,1
"643","Fall_Conclave",6,7,643,"combat","TALIESIN","i'll go in, too.",3934.261,3935.534,1.27300000000014,6,0.0047132757266295,2,"combat","TALIESIN",1,0,0,0
"644","Fall_Conclave",6,7,644,"combat","ASHLEY","i'll follow, i'll follow.",3935.534,3937.752,2.21799999999985,7,0.0031559963931472,2,"combat","ASHLEY",1,0,0,0
"645","Fall_Conclave",6,7,645,"combat","LAURA","we're all going. it's a big, happy room.",3937.752,3940.192,2.44000000000005,11,0.00450819672131137,2,"combat","LAURA",1,0,0,0
"646","Fall_Conclave",6,7,646,"combat","LIAM","so say we all.",3940.192,3942.41,2.21799999999985,5,0.00225428313796228,2,"combat","LIAM",1,0,0,0
"647","Fall_Conclave",6,7,647,"combat","MARISHA","well, i guess i'll go after i bury duergar.",3942.41,3944.572,2.16200000000026,11,0.00508788159111872,2,"combat","MARISHA",1,0,0,0
"648","Fall_Conclave",6,7,648,"combat","MATT","yes, as you guys step in here, move up towards the back corner, where there's the shiny glint. tiberius, you stay inside or outside?",3944.572,3952.172,7.59999999999991,26,0.00342105263157899,2,"combat","MATT",0,0,0,1
"649","Fall_Conclave",6,7,649,"combat","ORION","i'm going to wait for everybody to go inside.",3952.172,3955.381,3.20899999999983,11,0.00342785914615163,2,"combat","ORION",1,0,0,0
"650","Fall_Conclave",6,7,650,"combat","MARISHA","we will be team outside posse.",3955.381,3958.043,2.66200000000026,7,0.00262960180315526,2,"combat","MARISHA",1,0,0,0
"651","Fall_Conclave",6,7,651,"combat","MATT","kima walks in, grog goes to start making his way in. as he does, you go over towards the glimmer. the glimmer on the table, you look, it's just formless and kind of this weird spark of light. it then vanishes, and the doors that you guys entered",3958.043,3973.352,15.3089999999997,49,0.00320073159579338,2,"combat","MATT",0,0,0,1
"652","Fall_Conclave",6,7,652,"combat","LAURA","it's a trap.",3973.421,3974.982,1.56100000000015,5,0.00320307495195357,2,"combat","LAURA",1,0,0,0
"653","Fall_Conclave",6,7,653,"combat","MATT","slam behind you, with tiberius, grog and keyleth all kept outside of the room.",3974.982,3980.342,5.36000000000013,15,0.0027985074626865,2,"combat","MATT",0,0,0,1
"654","Fall_Conclave",6,7,654,"combat","ASHLEY","no!",3980.342,3981.488,1.14599999999973,2,0.00174520069808069,2,"combat","ASHLEY",1,0,0,0
"655","Fall_Conclave",6,7,655,"combat","MATT","the rest of you guys, the flames go to darkness and the entire room goes pitch-black.",3981.488,3986.556,5.06800000000021,18,0.00355169692186252,2,"combat","MATT",0,0,0,1
"656","Fall_Conclave",6,7,656,"combat","MARISHA","oh, shit!",3986.556,3987.863,1.30699999999979,3,0.00229533282325974,2,"combat","MARISHA",1,0,0,0
"657","Fall_Conclave",6,7,657,"combat","LAURA","oh, no, we don't have light.",3987.863,3989.146,1.28300000000036,8,0.00623538581449554,2,"combat","LAURA",1,0,0,0
"658","Fall_Conclave",6,7,658,"combat","LIAM","in the darkness, i say, fuck!",3989.146,3993.942,4.79599999999982,7,0.00145954962468729,2,"combat","LIAM",1,0,0,0
"659","Fall_Conclave",6,7,659,"combat","LAURA","stupid, stupid, stupid!",3993.942,3995.397,1.45499999999993,4,0.00274914089347093,2,"combat","LAURA",1,0,0,0
"660","Fall_Conclave",6,7,660,"combat","ORION","i motion to grog and i'm like, you know what to do, damn it.",3995.397,3998.627,3.23000000000002,16,0.004953560371517,2,"combat","ORION",1,0,0,0
"661","Fall_Conclave",6,7,661,"combat","MATT","grog's gonna go for the door, however, at this point in time, i'm going to ask for",3998.627,4004.83,6.20299999999997,19,0.00306303401579882,2,"combat","MATT",0,0,0,1
"662","Fall_Conclave",6,7,662,"combat","LAURA","can we stealth? i mean, i guess we're all kind of",4004.894,4007.922,3.02800000000025,12,0.00396301188903534,2,"combat","LAURA",1,0,0,0
"663","Fall_Conclave",6,7,663,"combat","SAM","ask for?",4007.922,4009.385,1.46300000000019,3,0.00205058099794915,2,"combat","SAM",1,0,0,0
"664","Fall_Conclave",6,7,664,"combat","LIAM","roll for deus ex machina.",4009.385,4012.608,3.22299999999996,6,0.00186161960905991,2,"combat","LIAM",1,0,0,0
"665","Fall_Conclave",6,7,665,"combat","SAM","oh, you're gonna ask the chat room something?",4012.608,4015.333,2.72499999999991,10,0.00366972477064232,2,"combat","SAM",1,0,0,0
"666","Fall_Conclave",6,7,666,"combat","MATT","no, no, no. i'm not. i'm working out what's actually gonna happen here. all right, so, suddenly there is a cacophonous bit of pain streaking through pike, vex, and clarota. guys, go ahead and make an intelligence saving throw.",4015.333,4036.851,21.518,43,0.00199832698206153,2,"combat","MATT",0,0,0,1
"667","Fall_Conclave",6,7,667,"combat","SAM","intelligence?",4036.851,4038.32,1.46900000000005,2,0.00136147038801901,2,"combat","SAM",1,0,0,0
"668","Fall_Conclave",6,7,668,"combat","LAURA","all of us?",4038.32,4039.37,1.04999999999973,4,0.0038095238095248,2,"combat","LAURA",1,0,0,0
"669","Fall_Conclave",6,7,669,"combat","SAM","some sort of a mind thing.",4039.37,4040.715,1.34500000000025,7,0.00520446096654177,2,"combat","SAM",1,0,0,0
"670","Fall_Conclave",6,7,670,"combat","LAURA","oh, crud.",4040.715,4041.958,1.24299999999994,3,0.00241351568785209,2,"combat","LAURA",1,0,0,0
"671","Fall_Conclave",6,7,671,"combat","MARISHA","intelligence.",4041.958,4045.061,3.10300000000007,2,0.000644537544311943,2,"combat","MARISHA",1,0,0,0
"672","Fall_Conclave",6,7,672,"combat","LAURA","oh, oh, oh! oh, no, i don't get any advantage in this.",4045.061,4049.056,3.99499999999989,14,0.00350438047559459,2,"combat","LAURA",1,0,0,0
"673","Fall_Conclave",6,7,673,"combat","LIAM","13.",4049.056,4050.539,1.48300000000017,2,0.00134861766689128,2,"combat","LIAM",1,0,0,0
"674","Fall_Conclave",6,7,674,"combat","MATT","not you, just you two. so what's the",4050.539,4054.175,3.63599999999997,9,0.0024752475247525,2,"combat","MATT",0,0,0,1
"675","Fall_Conclave",6,7,675,"combat","TALIESIN","never mind, that was such a good roll.",4054.175,4055.873,1.69799999999987,9,0.00530035335689088,2,"combat","TALIESIN",1,0,0,0
"676","Fall_Conclave",6,7,676,"combat","ASHLEY","what was that? that's a one.",4055.873,4058.478,2.60500000000002,8,0.00307101727447215,2,"combat","ASHLEY",1,0,0,0
"677","Fall_Conclave",6,7,677,"combat","MATT","okay.",4058.478,4059.614,1.13599999999997,2,0.00176056338028174,2,"combat","MATT",0,0,0,1
"678","Fall_Conclave",6,7,678,"combat","ASHLEY","i rolled a one!",4059.614,4060.955,1.34099999999989,5,0.00372856077554093,2,"combat","ASHLEY",1,0,0,0
"679","Fall_Conclave",6,7,679,"combat","MATT","so in the darkness, suddenly there is this searing pain, like some sort of screaming sound is blasting you from the inside of your very mind. you two are both currently stunned.",4060.955,4072.077,11.1220000000003,33,0.00296709224959532,2,"combat","MATT",0,0,0,1
"680","Fall_Conclave",6,7,680,"combat","LAURA","oh, crud.",4072.077,4073.313,1.23599999999988,3,0.00242718446601966,2,"combat","LAURA",1,0,0,0
"681","Fall_Conclave",6,7,681,"combat","SAM","who's you two?",4073.313,4074.701,1.38799999999992,5,0.00360230547550453,2,"combat","SAM",1,0,0,0
"682","Fall_Conclave",6,7,682,"combat","LAURA","me and pike.",4074.701,4076.1,1.39899999999989,4,0.00285918513223754,2,"combat","LAURA",1,0,0,0
"683","Fall_Conclave",6,7,683,"combat","ASHLEY","i did bad things, i did bad things. i shouldn't have killed a man while he was down. wait, so what does that that means we just can't do anything, right?",4076.1,4088.398,12.2980000000002,34,0.00276467718328178,2,"combat","ASHLEY",1,0,0,0
"684","Fall_Conclave",6,7,684,"combat","MATT","on every turn, you get to try and break that, but right now neither of you can",4088.398,4091.907,3.50900000000001,17,0.00484468509546877,2,"combat","MATT",0,0,0,1
"685","Fall_Conclave",6,7,685,"combat","MARISHA","every turn they have to try and break out of it? it keeps going? it's like a keep-going thing?",4091.907,4096.959,5.05199999999968,22,0.00435471100554264,2,"combat","MARISHA",1,0,0,0
"686","Fall_Conclave",6,7,686,"combat","MATT","you both just sit there, grasping your heads, just screaming in pain as your body is unable to function or listen to any thought process. clarota also unfortunately falls victim to this and is also unable to make any actions.",4096.959,4109.607,12.6480000000001,41,0.00324161922833646,2,"combat","MATT",0,0,0,1
"687","Fall_Conclave",6,7,687,"combat","SAM","oh boy!",4109.607,4110.761,1.15400000000045,3,0.00259965337954838,2,"combat","SAM",1,0,0,0
"688","Fall_Conclave",6,7,688,"combat","LIAM","i'm pulling out my flametongue dagger to try to get a little bit of light in here.",4110.761,4115.715,4.95399999999972,19,0.00383528461849032,2,"combat","LIAM",1,0,0,0
"689","Fall_Conclave",6,7,689,"combat","MATT","all right, however you, as you are currently pulling out your flametongue dagger, you feel a presence nearby, and with a little bit of embers around the fire, you see, out of nothing, a figure step into view that apparently was not visible but a moment before. a tall, lithe figure, with long limbs, fingers and a wrapping of facial tentacles coming towards your face.",4115.715,4139.057,23.3419999999996,66,0.00282752120640909,2,"combat","MATT",0,0,0,1
