"","arc","arc_no","episode","turn_number","segment","actor","text","start_turn","end_turn","time_in_sec","word_count","words_per_ms","encounter_count","rp_combat","actor_guest","vox_machina","guest","staff","matt"
"1649","Daring_Deeds",7,86,1649,"second_half","SAM","doty, no! why? just pause for now.",8029.983,8038.131,8.14800000000014,8,0.000981836033382408,NA,"role_play","SAM",1,0,0,0
"1650","Daring_Deeds",7,86,1650,"second_half","LAURA","no, but seriously, was he your nanny? it's okay if he was. i just want to know.",8038.131,8043.066,4.93499999999949,19,0.00385005065856169,NA,"role_play","LAURA",1,0,0,0
"1651","Daring_Deeds",7,86,1651,"second_half","LIAM","i mean, honestly, we'd like",8043.066,8044.543,1.47699999999986,6,0.00406228842247838,NA,"role_play","LIAM",1,0,0,0
"1652","Daring_Deeds",7,86,1652,"second_half","LAURA","we'd like you more.",8044.543,8046.07,1.52700000000004,6,0.00392927308447926,NA,"role_play","LAURA",1,0,0,0
"1653","Daring_Deeds",7,86,1653,"second_half","LIAM","we like fuck-ups. we're a family of fuck-ups, so, you want in or not?",8046.07,8049.139,3.06900000000041,18,0.00586510263929539,NA,"role_play","LIAM",1,0,0,0
"1654","Daring_Deeds",7,86,1654,"second_half","LAURA","if you're honest.",8049.139,8050.78,1.64099999999962,5,0.00304692260816646,NA,"role_play","LAURA",1,0,0,0
"1655","Daring_Deeds",7,86,1655,"second_half","SAM","doty is my best friend. my only friend. because he listens to me, and understands me, and at night, when i play my characters, he plays with me. i play combat, and i pretend to be some of the characters i've read about, and he pretends to be the others.",8050.78,8078.313,27.5330000000004,52,0.00188864271964549,NA,"role_play","SAM",1,0,0,0
"1656","Daring_Deeds",7,86,1656,"second_half","TRAVIS","i'm gonna kill him.",8078.313,8081.972,3.65899999999965,6,0.00163979229297638,NA,"role_play","TRAVIS",1,0,0,0
"1657","Daring_Deeds",7,86,1657,"second_half","LAURA","no, that's really wonderful. so you want to be an actor.",8081.972,8085.009,3.03700000000026,13,0.00428054000658508,NA,"role_play","LAURA",1,0,0,0
"1658","Daring_Deeds",7,86,1658,"second_half","SAM","no, i want to be a hero. and i just haven't had the chance yet because my father says that i should just be focused on taking over the family business, learning financial things. and learning how to shake down a customer, and i'm so much more than that.",8085.009,8105.791,20.7820000000002,52,0.00250216533538637,NA,"role_play","SAM",1,0,0,0
"1659","Daring_Deeds",7,86,1659,"second_half","MARISHA","there are other ways of being a hero than being an adventurer. there are a lot of ways you could be a hero.",8105.791,8113.86,8.06899999999951,24,0.00297434626347769,NA,"role_play","MARISHA",1,0,0,0
"1660","Daring_Deeds",7,86,1660,"second_half","SAM","tell me one.",8113.86,8115.75,1.89000000000033,4,0.00211640211640175,NA,"role_play","SAM",1,0,0,0
"1661","Daring_Deeds",7,86,1661,"second_half","LAURA","you could be a philanthropist.",8115.75,8117.94,2.1899999999996,6,0.00273972602739776,NA,"role_play","LAURA",1,0,0,0
"1662","Daring_Deeds",7,86,1662,"second_half","MARISHA","yeah. people who spend a lot of their earnings and people who are more privileged, like you, who help people in less privileged places.",8117.94,8126.512,8.57200000000012,25,0.00291647223518428,NA,"role_play","MARISHA",1,0,0,0
"1663","Daring_Deeds",7,86,1663,"second_half","LIAM","there are many ways to help people in need.",8126.512,8128.086,1.57400000000052,10,0.00635324015247565,NA,"role_play","LIAM",1,0,0,0
"1664","Daring_Deeds",7,86,1664,"second_half","SAM","do they write books about philanthropists?",8128.086,8130.047,1.96099999999933,7,0.00356960734319347,NA,"role_play","SAM",1,0,0,0
"1665","Daring_Deeds",7,86,1665,"second_half","LAURA","a lot of times they do.",8130.047,8131.355,1.30799999999999,7,0.00535168195718657,NA,"role_play","LAURA",1,0,0,0
"1666","Daring_Deeds",7,86,1666,"second_half","MARISHA","yeah. people generally like them.",8131.355,8136.609,5.25400000000081,6,0.00114198705747984,NA,"role_play","MARISHA",1,0,0,0
"1667","Daring_Deeds",7,86,1667,"second_half","SAM","but the stories i've read of adventure and derring-do and bravery",8136.609,8141.329,4.71999999999935,13,0.00275423728813598,NA,"role_play","SAM",1,0,0,0
"1668","Daring_Deeds",7,86,1668,"second_half","TRAVIS","much cooler.",8141.329,8142.164,0.835000000000036,3,0.00359281437125733,NA,"role_play","TRAVIS",1,0,0,0
"1669","Daring_Deeds",7,86,1669,"second_half","SAM","much cooler!",8142.164,8143.787,1.6230000000005,3,0.00184842883548926,NA,"role_play","SAM",1,0,0,0
"1670","Daring_Deeds",7,86,1670,"second_half","TRAVIS","less boring.",8143.787,8144.775,0.987999999999374,3,0.00303643724696549,NA,"role_play","TRAVIS",1,0,0,0
"1671","Daring_Deeds",7,86,1671,"second_half","SAM","jumbo gets it.",8144.775,8146.015,1.24000000000069,4,0.00322580645161111,NA,"role_play","SAM",1,0,0,0
"1672","Daring_Deeds",7,86,1672,"second_half","TRAVIS","i promise you, none of their dads leave the adventurers' money to their daughters, it's always to the sons.",8146.015,8151.914,5.89899999999943,21,0.00355992541108697,NA,"role_play","TRAVIS",1,0,0,0
"1673","Daring_Deeds",7,86,1673,"second_half","LIAM","but first i'd like to suggest a mantra. i don't know if you've ever tried it. it helps for me, it has in the past. fuck your dad. that's one",8151.914,8161.251,9.33700000000044,34,0.00364142658241388,NA,"role_play","LIAM",1,0,0,0
"1674","Daring_Deeds",7,86,1674,"second_half","LAURA AND TALIESIN","well.",8161.251,8162.859,1.60800000000017,2,0.00124378109452723,NA,"role_play","LAURA AND TALIESIN",1,0,0,0
"1675","Daring_Deeds",7,86,1675,"second_half","LIAM","you know what i mean, you fucking third-grade assholes, jeepers creepers.",8162.859,8165.666,2.80699999999979,13,0.00463127894549376,NA,"role_play","LIAM",1,0,0,0
"1676","Daring_Deeds",7,86,1676,"second_half","SAM","he could have me or any of you killed.",8165.666,8168.05,2.38400000000001,10,0.0041946308724832,NA,"role_play","SAM",1,0,0,0
"1677","Daring_Deeds",7,86,1677,"second_half","LIAM","we'll see. the other thing is, you've done the impossible.",8168.05,8173.625,5.57499999999982,13,0.0023318385650225,NA,"role_play","LIAM",1,0,0,0
"1678","Daring_Deeds",7,86,1678,"second_half","SAM","which is?",8173.625,8175.775,2.14999999999964,3,0.00139534883720954,NA,"role_play","SAM",1,0,0,0
"1679","Daring_Deeds",7,86,1679,"second_half","LIAM","well, i've taken a shine to you for some reason. do you wanna shake off the child's play and do the real thing?",8175.775,8184.523,8.7480000000005,26,0.00297210791037934,NA,"role_play","LIAM",1,0,0,0
"1680","Daring_Deeds",7,86,1680,"second_half","SAM","very much.",8184.523,8185.322,0.798999999999978,3,0.00375469336670849,NA,"role_play","SAM",1,0,0,0
"1681","Daring_Deeds",7,86,1681,"second_half","LIAM","the truth is, you never stop being afraid. being brave doesn't mean you stop being afraid, it means you learn to compartmentalize it. you just live with it. so that feeling you're feeling? you're not gonna lose that.",8185.322,8200.685,15.3629999999994,42,0.00273384104667068,NA,"role_play","LIAM",1,0,0,0
"1682","Daring_Deeds",7,86,1682,"second_half","SAM","okay. but how will i survive in battle?",8200.685,8204.436,3.7510000000002,9,0.00239936017062104,NA,"role_play","SAM",1,0,0,0
"1683","Daring_Deeds",7,86,1683,"second_half","LIAM","well...",8204.436,8205.257,0.820999999999913,2,0.00243605359317931,NA,"role_play","LIAM",1,0,0,0
"1684","Daring_Deeds",7,86,1684,"second_half","TRAVIS","healing potions, people who look out for each other.",8205.257,8208.816,3.55900000000111,10,0.00280977802753495,NA,"role_play","TRAVIS",1,0,0,0
"1685","Daring_Deeds",7,86,1685,"second_half","TALIESIN","friends. friends.",8208.816,8210.118,1.30199999999968,3,0.00230414746543835,NA,"role_play","TALIESIN",1,0,0,0
"1686","Daring_Deeds",7,86,1686,"second_half","LAURA","hide behind your giant robot.",8210.118,8211.721,1.60299999999916,6,0.00374298190892274,NA,"role_play","LAURA",1,0,0,0
"1687","Daring_Deeds",7,86,1687,"second_half","LIAM","this guys absorbs damage, so stick by him.",8211.721,8215.842,4.121000000001,9,0.00218393593787862,NA,"role_play","LIAM",1,0,0,0
"1688","Daring_Deeds",7,86,1688,"second_half","LAURA","stay clear if what you do is cast spells. don't get up in the fray.",8215.842,8220.316,4.47400000000016,17,0.00379973178363867,NA,"role_play","LAURA",1,0,0,0
"1689","Daring_Deeds",7,86,1689,"second_half","MARISHA","i can cast spells, and so can vex, here. it's through my antlers, so respect the antlers.",8220.316,8229.761,9.44499999999971,19,0.00201164637374278,NA,"role_play","MARISHA",1,0,0,0
"1690","Daring_Deeds",7,86,1690,"second_half","SAM","oh, i do. i do. they look very powerful.",8229.761,8234.549,4.78800000000047,10,0.00208855472013346,NA,"role_play","SAM",1,0,0,0
"1691","Daring_Deeds",7,86,1691,"second_half","MARISHA","respect.",8234.549,8236.618,2.06899999999951,2,0.000966650555824301,NA,"role_play","MARISHA",1,0,0,0
"1692","Daring_Deeds",7,86,1692,"second_half","SAM","something about your eyes make me feel ashamed.",8236.618,8240.449,3.83100000000013,9,0.00234925606891143,NA,"role_play","SAM",1,0,0,0
"1693","Daring_Deeds",7,86,1693,"second_half","LIAM","wow.",8242.298,8245.102,2.80400000000009,2,0.000713266761768879,NA,"role_play","LIAM",1,0,0,0
"1694","Daring_Deeds",7,86,1694,"second_half","SAM","i'm sorry.",8245.102,8247.899,2.79699999999866,4,0.00143010368251767,NA,"role_play","SAM",1,0,0,0
"1695","Daring_Deeds",7,86,1695,"second_half","TRAVIS","oh, shit. that is a new one.",8247.899,8250.381,2.48199999999997,8,0.00322320709105564,NA,"role_play","TRAVIS",1,0,0,0
"1696","Daring_Deeds",7,86,1696,"second_half","LAURA","let's go get a drink.",8250.381,8252.337,1.95600000000013,7,0.00357873210633923,NA,"role_play","LAURA",1,0,0,0
"1697","Daring_Deeds",7,86,1697,"second_half","LIAM","can we get this guy drunk, please.",8252.337,8255.372,3.03499999999985,8,0.00263591433278431,NA,"role_play","LIAM",1,0,0,0
"1698","Daring_Deeds",7,86,1698,"second_half","TALIESIN","we're getting into shame and we're sober, i think something must be done about this.",8255.372,8258.449,3.07700000000114,18,0.005849853753654,NA,"role_play","TALIESIN",1,0,0,0
"1699","Daring_Deeds",7,86,1699,"second_half","TRAVIS","we got him so close to the brink, right? shouldn't we just introduce him to the deep end so he can say he's been there, and then we bring him up?",8258.449,8267.148,8.6989999999987,34,0.00390849522933729,NA,"role_play","TRAVIS",1,0,0,0
"1700","Daring_Deeds",7,86,1700,"second_half","LAURA","what, like knock him unconscious?",8267.148,8269.453,2.30500000000029,6,0.00260303687635542,NA,"role_play","LAURA",1,0,0,0
"1701","Daring_Deeds",7,86,1701,"second_half","TRAVIS","yeah.",8269.453,8271.091,1.63800000000083,2,0.0012210012210006,NA,"role_play","TRAVIS",1,0,0,0
"1702","Daring_Deeds",7,86,1702,"second_half","SAM","please don't.",8271.091,8272.367,1.27599999999984,4,0.00313479623824491,NA,"role_play","SAM",1,0,0,0
"1703","Daring_Deeds",7,86,1703,"second_half","TRAVIS","no, no, really, there's something to be said for it.",8272.367,8274.387,2.02000000000044,12,0.00594059405940466,NA,"role_play","TRAVIS",1,0,0,0
"1704","Daring_Deeds",7,86,1704,"second_half","TALIESIN","why don't we do it with wine?",8274.387,8276.159,1.77199999999903,9,0.00507900677201182,NA,"role_play","TALIESIN",1,0,0,0
"1705","Daring_Deeds",7,86,1705,"second_half","LIAM","yeah, yes, percy's right.",8276.159,8277.901,1.74200000000019,6,0.00344431687715232,NA,"role_play","LIAM",1,0,0,0
"1706","Daring_Deeds",7,86,1706,"second_half","MARISHA","we could do a little roleplay exercise, like in your stories.",8277.901,8282.358,4.45700000000033,12,0.00269239398698656,NA,"role_play","MARISHA",1,0,0,0
"1707","Daring_Deeds",7,86,1707,"second_half","TALIESIN","we have a magnificent library.",8282.358,8284.199,1.84100000000035,6,0.00325909831613192,NA,"role_play","TALIESIN",1,0,0,0
"1708","Daring_Deeds",7,86,1708,"second_half","SAM","you do?",8284.199,8285.274,1.07499999999891,3,0.00279069767442144,NA,"role_play","SAM",1,0,0,0
"1709","Daring_Deeds",7,86,1709,"second_half","TALIESIN","oh, yes.",8285.274,8286.218,0.944000000001324,3,0.00317796610169046,NA,"role_play","TALIESIN",1,0,0,0
"1710","Daring_Deeds",7,86,1710,"second_half","TRAVIS","oh, god.",8286.218,8287.047,0.828999999999724,3,0.00361881785283595,NA,"role_play","TRAVIS",1,0,0,0
"1711","Daring_Deeds",7,86,1711,"second_half","MARISHA","full disclosure.",8287.047,8289.754,2.70700000000033,3,0.0011082379017361,NA,"role_play","MARISHA",1,0,0,0
"1712","Daring_Deeds",7,86,1712,"second_half","TALIESIN","it's time we had another nerd.",8289.754,8292.844,3.08999999999833,8,0.00258899676375545,NA,"role_play","TALIESIN",1,0,0,0
"1713","Daring_Deeds",7,86,1713,"second_half","MARISHA","full disclosure, tary, there aren't many damsels you have to rescue in the wild. i've learned mainly because women in the world have to be tougher. so that doesn't happen very often. but, if you want, we can make pretend and do a little thought exercise, and i'll pretend to be in distress and you can rescue me if that'll make you feel better.",8292.844,8324.06,31.2160000000003,70,0.0022424397744746,NA,"role_play","MARISHA",1,0,0,0
"1714","Daring_Deeds",7,86,1714,"second_half","TRAVIS","yeah yeah yeah, he just has to vanquish me.",8324.06,8326.635,2.57500000000073,10,0.00388349514562997,NA,"role_play","TRAVIS",1,0,0,0
"1715","Daring_Deeds",7,86,1715,"second_half","MARISHA","yeah, but you have to vanquish grog.",8326.635,8328.658,2.02299999999923,8,0.00395452298566636,NA,"role_play","MARISHA",1,0,0,0
"1716","Daring_Deeds",7,86,1716,"second_half","SAM","all right, let's go get drunk, then.",8328.658,8330.686,2.02800000000025,9,0.00443786982248467,NA,"role_play","SAM",1,0,0,0
"1717","Daring_Deeds",7,86,1717,"second_half","MARISHA AND TALIESIN","okay!",8330.686,8335.193,4.50699999999961,2,0.00044375416019529,NA,"role_play","MARISHA AND TALIESIN",1,0,0,0
"1718","Daring_Deeds",7,86,1718,"second_half","LIAM","we really haven't had a barn-burner since we got back from the big do, you know. we should get your sister, we should get shaun, we should get allura and kima and anyone who's in town.",8335.193,8345.056,9.86300000000119,40,0.00405556118827894,NA,"role_play","LIAM",1,0,0,0
"1719","Daring_Deeds",7,86,1719,"second_half","TALIESIN","let's have a good drink, and in the morning we'll set off on the next leg of idiocy.",8345.056,8350.66,5.60399999999936,21,0.00374732334047152,NA,"role_play","TALIESIN",1,0,0,0
"1720","Daring_Deeds",7,86,1720,"second_half","LIAM","yeah, you know, tary, there's something you don't really know about we've just i mean, it's really complicated, it's hard to explain to you, you're an outsider. but we have just lost someone very dear to us. it's very complicated. and maybe we're dealing with shit that is hard, so i'm sorry if we pushed you too hard. i think there was benefit to be had from what just happened, but we're in a shitty headstate. a dear friend is gone, so, apologies.",8350.66,8384.806,34.1460000000006,94,0.00275288467170381,NA,"role_play","LIAM",1,0,0,0
"1721","Daring_Deeds",7,86,1721,"second_half","SAM","i understand. i haven't really experienced loss of that type before. i mean. but i want to understand, and i thank you for your honesty with me and for not holding back. did i at least cause you some harm in the battle?",8384.806,8407.684,22.8779999999988,45,0.00196695515342261,NA,"role_play","SAM",1,0,0,0
"1722","Daring_Deeds",7,86,1722,"second_half","MARISHA","yes!",8407.684,8408.617,0.933000000000902,2,0.00214362272239878,NA,"role_play","MARISHA",1,0,0,0
"1723","Daring_Deeds",7,86,1723,"second_half","LIAM","i thought you would go down in one shot, and you were still standing!",8408.617,8411.635,3.01800000000003,15,0.0049701789264413,NA,"role_play","LIAM",1,0,0,0
"1724","Daring_Deeds",7,86,1724,"second_half","TRAVIS","it was pretty weak, actually.",8411.635,8412.978,1.34299999999894,6,0.00446760982874516,NA,"role_play","TRAVIS",1,0,0,0
"1725","Daring_Deeds",7,86,1725,"second_half","TALIESIN","i still feel a little ill.",8412.978,8414.718,1.7400000000016,7,0.00402298850574343,NA,"role_play","TALIESIN",1,0,0,0
"1726","Daring_Deeds",7,86,1726,"second_half","MARISHA","yeah! and look, you singed a little of my hair!",8414.718,8418.249,3.53099999999904,11,0.00311526479750864,NA,"role_play","MARISHA",1,0,0,0
"1727","Daring_Deeds",7,86,1727,"second_half","SAM","that's good, right?",8418.249,8419.426,1.17699999999968,5,0.00424808836023905,NA,"role_play","SAM",1,0,0,0
"1728","Daring_Deeds",7,86,1728,"second_half","MARISHA","yeah!",8419.426,8420.395,0.96900000000096,2,0.00206398348813005,NA,"role_play","MARISHA",1,0,0,0
"1729","Daring_Deeds",7,86,1729,"second_half","SAM","all right.",8420.395,8421.345,0.949999999998909,3,0.00315789473684573,NA,"role_play","SAM",1,0,0,0
"1730","Daring_Deeds",7,86,1730,"second_half","TALIESIN","to be fair, we've killed dragons, so the fact that you actually managed to hold it together is actually quite impressive!",8421.345,8428.107,6.76200000000063,23,0.00340136054421737,NA,"role_play","TALIESIN",1,0,0,0
"1731","Daring_Deeds",7,86,1731,"second_half","LIAM","i mean, clearly we've been fucking with you a little bit, but you have ability and skill, and that's not bullshit. seriously.",8428.107,8434.656,6.54900000000089,25,0.00381737669873211,NA,"role_play","LIAM",1,0,0,0
"1732","Daring_Deeds",7,86,1732,"second_half","TRAVIS","yeah, the rest's just fake it 'til you make it, yeah?",8434.656,8436.632,1.97599999999875,13,0.00657894736842522,NA,"role_play","TRAVIS",1,0,0,0
"1733","Daring_Deeds",7,86,1733,"second_half","LIAM","yeah. that will get you",8436.632,8437.895,1.26300000000083,5,0.00395882818685409,NA,"role_play","LIAM",1,0,0,0
"1734","Daring_Deeds",7,86,1734,"second_half","LAURA","i didn't see any of it, so i'm not sure.",8437.895,8440.083,2.1880000000001,13,0.00594149908592294,NA,"role_play","LAURA",1,0,0,0
"1735","Daring_Deeds",7,86,1735,"second_half","SAM","it was really great. it was really great?",8440.083,8442.877,2.79399999999987,9,0.00322118826055849,NA,"role_play","SAM",1,0,0,0
"1736","Daring_Deeds",7,86,1736,"second_half","TALIESIN","yes!",8442.877,8443.431,0.554000000000087,2,0.00361010830324853,NA,"role_play","TALIESIN",1,0,0,0
"1737","Daring_Deeds",7,86,1737,"second_half","LIAM","yeah! yes!",8443.431,8445.23,1.79899999999907,3,0.00166759310728269,NA,"role_play","LIAM",1,0,0,0
"1738","Daring_Deeds",7,86,1738,"second_half","SAM","thank you, thank you all. i'm sorry for deceiving you before, and i promise to do better and to aid you in whatever way i can. please teach me your ways, and i will learn what i can.",8445.23,8461.849,16.6190000000006,40,0.00240688368734572,NA,"role_play","SAM",1,0,0,0
"1739","Daring_Deeds",7,86,1739,"second_half","TRAVIS","did you build dotty?",8461.849,8464.473,2.6239999999998,5,0.0019054878048782,NA,"role_play","TRAVIS",1,0,0,0
"1740","Daring_Deeds",7,86,1740,"second_half","SAM","for heaven's sake, yes! i did.",8464.473,8467.291,2.8179999999993,8,0.0028388928317963,NA,"role_play","SAM",1,0,0,0
"1741","Daring_Deeds",7,86,1741,"second_half","LIAM","i believe him, i believe him.",8467.291,8469.773,2.48199999999997,7,0.00282030620467368,NA,"role_play","LIAM",1,0,0,0
"1742","Daring_Deeds",7,86,1742,"second_half","TRAVIS","let's open him up and figure out if he's lying.",8469.773,8471.93,2.15700000000106,13,0.00602688919795716,NA,"role_play","TRAVIS",1,0,0,0
"1743","Daring_Deeds",7,86,1743,"second_half","SAM","please no, no, i, no",8471.93,8473.045,1.11499999999978,5,0.0044843049327363,NA,"role_play","SAM",1,0,0,0
"1744","Daring_Deeds",7,86,1744,"second_half","TALIESIN","no no no no no.",8473.045,8474.439,1.39400000000023,6,0.00430416068866499,NA,"role_play","TALIESIN",1,0,0,0
"1745","Daring_Deeds",7,86,1745,"second_half","LAURA","grog!",8474.505,8475.817,1.3119999999999,2,0.00152439024390256,NA,"role_play","LAURA",1,0,0,0
"1746","Daring_Deeds",7,86,1746,"second_half","TRAVIS","what.",8475.817,8476.534,0.717000000000553,2,0.00278940027893788,NA,"role_play","TRAVIS",1,0,0,0
"1747","Daring_Deeds",7,86,1747,"second_half","LAURA","stop.",8476.534,8477.713,1.17900000000009,2,0.00169635284139088,NA,"role_play","LAURA",1,0,0,0
"1748","Daring_Deeds",7,86,1748,"second_half","LIAM","he's just he's fucking with you, it's fine. it's all right. it's all right. let's go get drunk.",8477.713,8482.766,5.05299999999988,25,0.00494755590738187,NA,"role_play","LIAM",1,0,0,0
"1749","Daring_Deeds",7,86,1749,"second_half","MARISHA","yeah!",8482.766,8483.654,0.888000000000829,2,0.00225225225225015,NA,"role_play","MARISHA",1,0,0,0
"1750","Daring_Deeds",7,86,1750,"second_half","LAURA","that's all we do.",8483.654,8484.695,1.04099999999926,6,0.00576368876081103,NA,"role_play","LAURA",1,0,0,0
"1751","Daring_Deeds",7,86,1751,"second_half","LIAM","yeah.",8484.695,8485.883,1.1880000000001,2,0.00168350168350154,NA,"role_play","LIAM",1,0,0,0
"1752","Daring_Deeds",7,86,1752,"second_half","MARISHA","get drunk and make people cry.",8485.883,8487.579,1.69599999999991,7,0.00412735849056625,NA,"role_play","MARISHA",1,0,0,0
"1753","Daring_Deeds",7,86,1753,"second_half","LIAM","it's been too long, are you kidding?",8487.579,8488.815,1.23600000000079,9,0.00728155339805362,NA,"role_play","LIAM",1,0,0,0
"1754","Daring_Deeds",7,86,1754,"second_half","SAM","all right, i hang back just a little bit to collect myself. just try to dry my eyes, and i say to doty: doty, just delete most of that last chapter",8488.815,8498.406,9.59100000000035,31,0.00323219685121456,NA,"role_play","SAM",1,0,0,0
"1755","Daring_Deeds",7,86,1755,"second_half","SAM","and take this down. ""the battle a draw, taryon decided it was better to lie than tell the ""truth, and embarked on a new adventure pretending to be their humble intern, when in actuality, ""they were working for him."" end of chapter!",8501.806,8526.634,24.8279999999995,43,0.00173191557918482,NA,"role_play","SAM",1,0,0,0
"1756","Daring_Deeds",7,86,1756,"second_half","LIAM","oh my gosh, that can go in any direction.",8530.748,8532.9,2.15200000000004,10,0.00464684014869879,NA,"role_play","LIAM",1,0,0,0
"1757","Daring_Deeds",7,86,1757,"second_half","TALIESIN","i love it.",8532.9,8533.953,1.05299999999988,4,0.00379867046533755,NA,"role_play","TALIESIN",1,0,0,0
"1758","Daring_Deeds",7,86,1758,"second_half","LAURA","so dark. so dark!",8533.953,8535.856,1.90300000000025,5,0.00262743037309477,NA,"role_play","LAURA",1,0,0,0
"1759","Daring_Deeds",7,86,1759,"second_half","TRAVIS","we're getting to the deep end!",8535.856,8537.241,1.38500000000022,8,0.00577617328519765,NA,"role_play","TRAVIS",1,0,0,0
"1760","Daring_Deeds",7,86,1760,"second_half","MATT","as doty follows you, you guys make your way into the castle. wine bottles are brought about, and a raucous evening of drinking is easily found. the barn-burner you're looking for: shaun is able to be mustered, jarrett, kima's still back in emon, and actually allura is in town briefly to retrieve pike. and as pike comes in, she reaches you guys. ""hi. apparently there's still a lot of recovery that's needed in emon and they need kind of an ""all-hands-on-deck circumstance with anyone who's trained in healing, ""so i may have to go help with that for a little bit, if that's okay?""",8537.241,8575.465,38.2240000000002,115,0.00300858099623272,NA,"role_play","MATT",0,0,0,1
"1761","Daring_Deeds",7,86,1761,"second_half","LIAM","oh, man.",8575.465,8576.469,1.003999999999,3,0.00298804780876793,NA,"role_play","LIAM",1,0,0,0
"1762","Daring_Deeds",7,86,1762,"second_half","TRAVIS","yeah, of course!",8576.469,8577.453,0.984000000000378,4,0.00406504065040494,NA,"role_play","TRAVIS",1,0,0,0
"1763","Daring_Deeds",7,86,1763,"second_half","LAURA","whatever you need, dear.",8577.453,8578.517,1.06400000000031,5,0.0046992481202994,NA,"role_play","LAURA",1,0,0,0
"1764","Daring_Deeds",7,86,1764,"second_half","MATT","i mean, don't don't go don't go to any crazy hell places without me, let me know before that happens, please.",8578.517,8586.185,7.66799999999967,25,0.00326030255607735,NA,"role_play","MATT",0,0,0,1
"1765","Daring_Deeds",7,86,1765,"second_half","LAURA","oh. right.",8586.185,8586.984,0.799000000000888,3,0.00375469336670421,NA,"role_play","LAURA",1,0,0,0
"1766","Daring_Deeds",7,86,1766,"second_half","TRAVIS","no, we would never!",8586.984,8588.153,1.16899999999987,5,0.0042771599657832,NA,"role_play","TRAVIS",1,0,0,0
"1767","Daring_Deeds",7,86,1767,"second_half","SAM","that's exactly what they're planning on doing!",8588.153,8589.656,1.50300000000061,10,0.00665335994677041,NA,"role_play","SAM",1,0,0,0
"1768","Daring_Deeds",7,86,1768,"second_half","TRAVIS","no, tary, what did we say about lying?",8589.656,8591.107,1.45099999999911,9,0.0062026188835324,NA,"role_play","TRAVIS",1,0,0,0
"1769","Daring_Deeds",7,86,1769,"second_half","SAM","they just said that they're taking me to hell, or something like that!",8591.107,8593.916,2.80899999999929,15,0.00533997864008679,NA,"role_play","SAM",1,0,0,0
"1770","Daring_Deeds",7,86,1770,"second_half","LAURA","well, we won't, obviously, if you don't want us to, pike.",8593.916,8595.849,1.9330000000009,14,0.00724262803931374,NA,"role_play","LAURA",1,0,0,0
"1771","Daring_Deeds",7,86,1771,"second_half","TALIESIN","we've decided to go a little softer with him.",8595.849,8597.467,1.61800000000039,11,0.00679851668726658,NA,"role_play","TALIESIN",1,0,0,0
"1772","Daring_Deeds",7,86,1772,"second_half","LIAM","we're figuring it out.",8597.467,8598.888,1.42100000000028,6,0.00422237860661424,NA,"role_play","LIAM",1,0,0,0
"1773","Daring_Deeds",7,86,1773,"second_half","MATT","i mean, try and at least let me know?",8598.888,8600.779,1.89099999999962,10,0.00528820729772713,NA,"role_play","MATT",0,0,0,1
"1774","Daring_Deeds",7,86,1774,"second_half","LAURA","'course.",8600.779,8602.255,1.47599999999875,3,0.00203252032520498,NA,"role_play","LAURA",1,0,0,0
