"","arc","arc_no","episode","turn_number","segment","actor","text","start_turn","end_turn","time_in_sec","word_count","words_per_ms","encounter_count","rp_combat","actor_guest","vox_machina","guest","staff","matt"
"2319","Daring_Deeds",7,86,2319,"second_half","LAURA","ah. i pull out the deck. so, this is do you know what this is? do you remember this?",10359.367,10373.145,13.7780000000002,20,0.00145158949049206,NA,"role_play","LAURA",1,0,0,0
"2320","Daring_Deeds",7,86,2320,"second_half","TRAVIS","where did you find one?",10373.145,10378.397,5.25200000000041,6,0.00114242193450105,NA,"role_play","TRAVIS",1,0,0,0
"2321","Daring_Deeds",7,86,2321,"second_half","LAURA","okay. so, grog, i have to be honest with you. when you asked me for this before, i lied. to you.",10378.397,10403.435,25.0379999999986,22,0.000878664430066347,NA,"role_play","LAURA",1,0,0,0
"2322","Daring_Deeds",7,86,2322,"second_half","TRAVIS","you lied?",10403.435,10404.595,1.15999999999985,3,0.00258620689655205,NA,"role_play","TRAVIS",1,0,0,0
"2323","Daring_Deeds",7,86,2323,"second_half","LAURA","yeah.",10404.595,10405.583,0.988000000001193,2,0.00202429149797326,NA,"role_play","LAURA",1,0,0,0
"2324","Daring_Deeds",7,86,2324,"second_half","TRAVIS","what do you mean?",10405.583,10406.843,1.26000000000022,5,0.00396825396825328,NA,"role_play","TRAVIS",1,0,0,0
"2325","Daring_Deeds",7,86,2325,"second_half","LAURA","well, i sort of tricked you and thought it'd be funny if i gave you maybe the wrong thing. to see if you'd notice! but i'm still lying. i didn't i was afraid i gave you a false deck.",10406.843,10422.989,16.1459999999988,44,0.00272513315991597,NA,"role_play","LAURA",1,0,0,0
"2326","Daring_Deeds",7,86,2326,"second_half","TRAVIS","no, no, you gave it to me, it's in my bag.",10422.989,10425.144,2.15500000000065,13,0.00603248259860606,NA,"role_play","TRAVIS",1,0,0,0
"2327","Daring_Deeds",7,86,2327,"second_half","LAURA","you wanna pull it out?",10425.144,10426.844,1.69999999999891,6,0.00352941176470815,NA,"role_play","LAURA",1,0,0,0
"2328","Daring_Deeds",7,86,2328,"second_half","TRAVIS","but you said i wasn't supposed to look at it.",10426.844,10428.412,1.56800000000112,12,0.00765306122448433,NA,"role_play","TRAVIS",1,0,0,0
"2329","Daring_Deeds",7,86,2329,"second_half","LAURA","well, you're still not supposed to, technically. do you want me to pull it out?",10428.412,10433.112,4.69999999999891,17,0.00361702127659658,NA,"role_play","LAURA",1,0,0,0
"2330","Daring_Deeds",7,86,2330,"second_half","TRAVIS","phrasing.",10433.112,10440.335,7.22299999999996,2,0.000276893257649178,NA,"role_play","TRAVIS",1,0,0,0
"2331","Daring_Deeds",7,86,2331,"second_half","LAURA","should i should you do you just",10440.335,10442.366,2.03100000000086,7,0.00344657804037274,NA,"role_play","LAURA",1,0,0,0
"2332","Daring_Deeds",7,86,2332,"second_half","TRAVIS","you want me to get the deck out?",10442.366,10443.744,1.37800000000061,9,0.00653120464440929,NA,"role_play","TRAVIS",1,0,0,0
"2333","Daring_Deeds",7,86,2333,"second_half","LAURA","yeah, maybe close your eyes and get the deck out.",10443.744,10449.148,5.40399999999863,11,0.00203552923760229,NA,"role_play","LAURA",1,0,0,0
"2334","Daring_Deeds",7,86,2334,"second_half","TRAVIS","all right, i got it.",10449.148,10450.239,1.09100000000035,6,0.00549954170485617,NA,"role_play","TRAVIS",1,0,0,0
"2335","Daring_Deeds",7,86,2335,"second_half","LAURA","all right, i am taking it from your hand.",10450.239,10452.618,2.37900000000081,10,0.00420344682639621,NA,"role_play","LAURA",1,0,0,0
"2336","Daring_Deeds",7,86,2336,"second_half","TRAVIS","but these are mine!",10452.618,10453.831,1.21299999999974,5,0.00412201154163321,NA,"role_play","TRAVIS",1,0,0,0
"2337","Daring_Deeds",7,86,2337,"second_half","LAURA","these ones are",10453.831,10454.574,0.743000000000393,3,0.00403768506056314,NA,"role_play","LAURA",1,0,0,0
"2338","Daring_Deeds",7,86,2338,"second_half","TRAVIS","don't take them from me again!",10454.574,10456.236,1.66200000000026,8,0.0048134777376647,NA,"role_play","TRAVIS",1,0,0,0
"2339","Daring_Deeds",7,86,2339,"second_half","LAURA","grog! open your eyes. it's not really a deck, you see? it's a bag. with rocks in it.",10456.236,10465.515,9.27899999999863,21,0.00226317491108989,NA,"role_play","LAURA",1,0,0,0
"2340","Daring_Deeds",7,86,2340,"second_half","TRAVIS","did you take my salt lick rock?",10465.515,10467.117,1.60200000000077,8,0.00499375780274416,NA,"role_play","TRAVIS",1,0,0,0
"2341","Daring_Deeds",7,86,2341,"second_half","LAURA","no. you gave that to scanlan. here's your deck. still don't use it, still don't look at it, it's still very dangerous! but i want you to know that i trust you with it.",10467.117,10477.356,10.2389999999996,39,0.00380896571930868,NA,"role_play","LAURA",1,0,0,0
"2342","Daring_Deeds",7,86,2342,"second_half","TRAVIS","i know. you said, ""don't look at it,"" and i haven't looked at it.",10477.356,10479.345,1.98899999999958,17,0.00854700854701036,NA,"role_play","TRAVIS",1,0,0,0
"2343","Daring_Deeds",7,86,2343,"second_half","LAURA","oh, good, then still don't, how about that?",10479.345,10482.915,3.57000000000153,10,0.00280112044817807,NA,"role_play","LAURA",1,0,0,0
"2344","Daring_Deeds",7,86,2344,"second_half","TRAVIS","i'm very confused.",10482.915,10485.151,2.23599999999897,5,0.00223613595706722,NA,"role_play","TRAVIS",1,0,0,0
"2345","Daring_Deeds",7,86,2345,"second_half","LAURA","i know, basically, i just",10485.151,10486.237,1.08599999999933,5,0.00460405156538037,NA,"role_play","LAURA",1,0,0,0
"2346","Daring_Deeds",7,86,2346,"second_half","TRAVIS","do you want a card?",10486.237,10487.406,1.16900000000169,6,0.00513259195893185,NA,"role_play","TRAVIS",1,0,0,0
"2347","Daring_Deeds",7,86,2347,"second_half","LAURA","no! i don't know.",10487.406,10488.359,0.95299999999952,6,0.00629590766002416,NA,"role_play","LAURA",1,0,0,0
"2348","Daring_Deeds",7,86,2348,"second_half","TRAVIS","i open the flap",10488.359,10489.175,0.815999999998894,4,0.00490196078432037,NA,"role_play","TRAVIS",1,0,0,0
"2349","Daring_Deeds",7,86,2349,"second_half","LAURA","no no no! don't grog!",10489.175,10490.721,1.54600000000028,7,0.00452781371280643,NA,"role_play","LAURA",1,0,0,0
"2350","Daring_Deeds",7,86,2350,"second_half","TRAVIS","do you want a card? what're you worried about, it's a deck of cards.",10490.721,10493.305,2.58400000000074,17,0.00657894736841916,NA,"role_play","TRAVIS",1,0,0,0
"2351","Daring_Deeds",7,86,2351,"second_half","LAURA","you're making me regret giving this back to you right now. i just want to say. i close it. please don't make me regret this.",10493.305,10502.247,8.9419999999991,28,0.00313129053902962,NA,"role_play","LAURA",1,0,0,0
"2352","Daring_Deeds",7,86,2352,"second_half","TRAVIS","why?",10502.247,10504.017,1.77000000000044,2,0.00112994350282458,NA,"role_play","TRAVIS",1,0,0,0
"2353","Daring_Deeds",7,86,2353,"second_half","LAURA","i'm sorry that i lied to you. even though you didn't notice. i want you to know you can still trust me, and i can still trust you to not fuck with this.",10504.017,10514.174,10.1570000000011,36,0.00354435364773026,NA,"role_play","LAURA",1,0,0,0
"2354","Daring_Deeds",7,86,2354,"second_half","TRAVIS","i would like to insight check vex.",10514.174,10516.131,1.95699999999852,8,0.00408788962698317,NA,"role_play","TRAVIS",1,0,0,0
"2355","Daring_Deeds",7,86,2355,"second_half","MATT","make an insight check.",10516.131,10517.26,1.12900000000081,5,0.00442869796279574,NA,"role_play","MATT",0,0,0,1
"2356","Daring_Deeds",7,86,2356,"second_half","LIAM","i love you guys.",10517.26,10520.04,2.78000000000065,5,0.00179856115107871,NA,"role_play","LIAM",1,0,0,0
"2357","Daring_Deeds",7,86,2357,"second_half","TRAVIS","six.",10520.04,10527.713,7.67299999999886,2,0.00026065424214783,NA,"role_play","TRAVIS",1,0,0,0
"2358","Daring_Deeds",7,86,2358,"second_half","MATT","it's a lot of words. it's a lot of words. but you got your deck back.",10527.713,10532.849,5.13600000000042,19,0.00369937694704019,NA,"role_play","MATT",0,0,0,1
"2359","Daring_Deeds",7,86,2359,"second_half","TRAVIS","but i always had it.",10532.849,10534.823,1.97400000000016,6,0.0030395136778113,NA,"role_play","TRAVIS",1,0,0,0
"2360","Daring_Deeds",7,86,2360,"second_half","MATT","you it's really confusing. she's talking at you, but nothing changed.",10534.823,10539.824,5.0010000000002,14,0.00279944011197749,NA,"role_play","MATT",0,0,0,1
"2361","Daring_Deeds",7,86,2361,"second_half","TRAVIS","is this a lesson?",10539.824,10542.888,3.06400000000031,5,0.00163185378590062,NA,"role_play","TRAVIS",1,0,0,0
"2362","Daring_Deeds",7,86,2362,"second_half","LAURA","sure.",10542.888,10547.984,5.09599999999955,2,0.000392464678178999,NA,"role_play","LAURA",1,0,0,0
"2363","Daring_Deeds",7,86,2363,"second_half","TRAVIS","can we just skip to the part where you get so frustrated that i haven't got it and you just tell me the answer anyway?",10547.984,10554.306,6.32200000000012,27,0.00427080037962662,NA,"role_play","TRAVIS",1,0,0,0
"2364","Daring_Deeds",7,86,2364,"second_half","LAURA","grog?",10554.306,10555.171,0.864999999999782,2,0.00231213872832428,NA,"role_play","LAURA",1,0,0,0
"2365","Daring_Deeds",7,86,2365,"second_half","TRAVIS","yeah.",10555.171,10557.513,2.34200000000055,2,0.000853970964986989,NA,"role_play","TRAVIS",1,0,0,0
"2366","Daring_Deeds",7,86,2366,"second_half","LAURA","you're a good person. still don't look at the deck. i'm glad you have our back. don't do drugs.",10557.513,10571.907,14.3939999999984,24,0.00166736140058376,NA,"role_play","LAURA",1,0,0,0
"2367","Daring_Deeds",7,86,2367,"second_half","TRAVIS","what do you think scanlan did with the rest of those drugs?",10571.907,10575.006,3.09900000000016,13,0.00419490158115499,NA,"role_play","TRAVIS",1,0,0,0
"2368","Daring_Deeds",7,86,2368,"second_half","LAURA","what do you mean 'the rest of the drugs'?",10575.006,10576.523,1.51699999999983,10,0.00659195781147077,NA,"role_play","LAURA",1,0,0,0
"2369","Daring_Deeds",7,86,2369,"second_half","TRAVIS","well, you said he was doing drugs, right?",10576.523,10578.243,1.72000000000116,9,0.00523255813953134,NA,"role_play","TRAVIS",1,0,0,0
"2370","Daring_Deeds",7,86,2370,"second_half","LAURA","right.",10578.243,10578.938,0.694999999999709,2,0.00287769784172782,NA,"role_play","LAURA",1,0,0,0
"2371","Daring_Deeds",7,86,2371,"second_half","TRAVIS","well, did he just take them with him?",10578.938,10581.345,2.40699999999924,9,0.00373909430826873,NA,"role_play","TRAVIS",1,0,0,0
"2372","Daring_Deeds",7,86,2372,"second_half","LAURA","should we search his room?",10581.345,10583.188,1.84300000000076,6,0.00325556158437197,NA,"role_play","LAURA",1,0,0,0
"2373","Daring_Deeds",7,86,2373,"second_half","TRAVIS","ooh, maybe!",10583.188,10586.727,3.53900000000067,3,0.000847697089573165,NA,"role_play","TRAVIS",1,0,0,0
"2374","Daring_Deeds",7,86,2374,"second_half","LAURA","let's do it.",10586.727,10587.688,0.960999999999331,5,0.00520291363163734,NA,"role_play","LAURA",1,0,0,0
"2375","Daring_Deeds",7,86,2375,"second_half","TRAVIS","all right, i put the deck away.",10587.688,10589.089,1.40099999999984,8,0.00571020699500422,NA,"role_play","TRAVIS",1,0,0,0
"2376","Daring_Deeds",7,86,2376,"second_half","MATT","okay. you guys head up to scanlan's room.",10589.089,10590.861,1.77200000000084,10,0.00564334085778512,NA,"role_play","MATT",0,0,0,1
"2377","Daring_Deeds",7,86,2377,"second_half","LAURA","yeah.",10590.861,10591.652,0.790999999999258,2,0.00252844500632348,NA,"role_play","LAURA",1,0,0,0
"2378","Daring_Deeds",7,86,2378,"second_half","MATT","both you guys make investigation checks.",10591.652,10593.206,1.55400000000009,7,0.00450450450450425,NA,"role_play","MATT",0,0,0,1
"2379","Daring_Deeds",7,86,2379,"second_half","LIAM","you've done a lot of brilliant things. that was the most brilliant thing you have ever done.",10593.206,10597.213,4.00699999999961,19,0.00474170202146291,NA,"role_play","LIAM",1,0,0,0
"2380","Daring_Deeds",7,86,2380,"second_half","TALIESIN","i am so consistently proud of you.",10597.213,10600.015,2.80199999999968,8,0.00285510349750211,NA,"role_play","TALIESIN",1,0,0,0
"2381","Daring_Deeds",7,86,2381,"second_half","LIAM","oh my god.",10600.015,10601.234,1.21900000000096,4,0.00328137817883253,NA,"role_play","LIAM",1,0,0,0
"2382","Daring_Deeds",7,86,2382,"second_half","TRAVIS","16. 18 minus two.",10601.234,10602.83,1.59599999999955,5,0.00313283208020139,NA,"role_play","TRAVIS",1,0,0,0
"2383","Daring_Deeds",7,86,2383,"second_half","LAURA","oh! 16 for me as well.",10602.83,10604.587,1.75699999999961,7,0.00398406374502081,NA,"role_play","LAURA",1,0,0,0
"2384","Daring_Deeds",7,86,2384,"second_half","LAURA AND TRAVIS","hey!",10604.587,10606.503,1.91600000000108,2,0.00104384133611632,NA,"role_play","LAURA AND TRAVIS",1,0,0,0
"2385","Daring_Deeds",7,86,2385,"second_half","MATT","together you both see you both spend the better part of an hour thumbing through the various drawers and odd boxes and sundries that were left behind in the wake of scanlan's departure. and at the same time you both come to find that, no, there are no illegal substances remain.",10606.503,10623.648,17.1449999999986,53,0.00309128025663484,NA,"role_play","MATT",0,0,0,1
"2386","Daring_Deeds",7,86,2386,"second_half","LAURA","he took them with him!",10623.648,10624.762,1.1140000000014,6,0.00538599640932897,NA,"role_play","LAURA",1,0,0,0
"2387","Daring_Deeds",7,86,2387,"second_half","TRAVIS","what about nudey pictures?",10624.762,10625.892,1.1299999999992,5,0.00442477876106508,NA,"role_play","TRAVIS",1,0,0,0
"2388","Daring_Deeds",7,86,2388,"second_half","LAURA","oh, nudey pictures.",10625.892,10626.881,0.988999999999578,4,0.00404448938321709,NA,"role_play","LAURA",1,0,0,0
"2389","Daring_Deeds",7,86,2389,"second_half","TALIESIN","other things, what else is in the room?",10626.881,10628.962,2.08100000000013,9,0.00432484382508382,NA,"role_play","TALIESIN",1,0,0,0
"2390","Daring_Deeds",7,86,2390,"second_half","MATT","honestly? there are no nudey pictures, per se.",10628.962,10633.175,4.21299999999974,9,0.00213624495608843,NA,"role_play","MATT",0,0,0,1
"2391","Daring_Deeds",7,86,2391,"second_half","TRAVIS","boring.",10633.175,10634.286,1.11100000000079,2,0.00180018001800053,NA,"role_play","TRAVIS",1,0,0,0
"2392","Daring_Deeds",7,86,2392,"second_half","MATT","you do find a series of books on art and the human physique.",10634.286,10639.586,5.29999999999927,14,0.00264150943396263,NA,"role_play","MATT",0,0,0,1
"2393","Daring_Deeds",7,86,2393,"second_half","TRAVIS","ugh.",10639.586,10640.449,0.863000000001193,2,0.00231749710312542,NA,"role_play","TRAVIS",1,0,0,0
"2394","Daring_Deeds",7,86,2394,"second_half","MATT","and all the corresponding images have been torn out.",10640.449,10642.803,2.35399999999936,10,0.00424808836023905,NA,"role_play","MATT",0,0,0,1
"2395","Daring_Deeds",7,86,2395,"second_half","LAURA","yeah.",10642.803,10644.838,2.03499999999985,2,0.000982800982801053,NA,"role_play","LAURA",1,0,0,0
"2396","Daring_Deeds",7,86,2396,"second_half","TRAVIS","damn it.",10644.838,10645.892,1.05400000000009,3,0.00284629981024644,NA,"role_play","TRAVIS",1,0,0,0
"2397","Daring_Deeds",7,86,2397,"second_half","SAM","i have magic that can make things that are way more real than a drawing.",10645.892,10650.336,4.44399999999951,16,0.003600360036004,NA,"role_play","SAM",1,0,0,0
"2398","Daring_Deeds",7,86,2398,"second_half","TALIESIN","he has three original print issues of cherry comics number one through four.",10650.336,10655.374,5.03800000000047,14,0.00277888050813789,NA,"role_play","TALIESIN",1,0,0,0
"2399","Daring_Deeds",7,86,2399,"second_half","TRAVIS","well, there's no drugs.",10655.374,10656.672,1.29800000000068,6,0.00462249614791744,NA,"role_play","TRAVIS",1,0,0,0
"2400","Daring_Deeds",7,86,2400,"second_half","LAURA","well, i guess he took them with him.",10656.672,10659.396,2.72400000000016,9,0.00330396475770906,NA,"role_play","LAURA",1,0,0,0
"2401","Daring_Deeds",7,86,2401,"second_half","TRAVIS","all right. when do i get to look at the cards?",10659.396,10664.656,5.26000000000022,12,0.00228136882129268,NA,"role_play","TRAVIS",1,0,0,0
"2402","Daring_Deeds",7,86,2402,"second_half","LAURA","like, never, grog.",10664.656,10665.894,1.23799999999937,4,0.00323101777059937,NA,"role_play","LAURA",1,0,0,0
"2403","Daring_Deeds",7,86,2403,"second_half","TRAVIS","like, never never? never, never?",10665.894,10671.713,5.81899999999951,6,0.00103110500085934,NA,"role_play","TRAVIS",1,0,0,0
"2404","Daring_Deeds",7,86,2404,"second_half","LAURA","well, i heard from percival that they're super, super dangerous. but i don't know what they do.",10671.713,10679.924,8.21100000000115,20,0.0024357569114599,NA,"role_play","LAURA",1,0,0,0
"2405","Daring_Deeds",7,86,2405,"second_half","TRAVIS","yeah, you don't.",10679.924,10681.056,1.13199999999961,5,0.00441696113074358,NA,"role_play","TRAVIS",1,0,0,0
"2406","Daring_Deeds",7,86,2406,"second_half","LAURA","no, i don't.",10681.056,10683.312,2.2559999999994,5,0.00221631205673817,NA,"role_play","LAURA",1,0,0,0
"2407","Daring_Deeds",7,86,2407,"second_half","TRAVIS","only one way to find out! not today.",10683.312,10685.816,2.50400000000081,9,0.00359424920127679,NA,"role_play","TRAVIS",1,0,0,0
"2408","Daring_Deeds",7,86,2408,"second_half","LAURA","not today, how about that?",10685.816,10687.678,1.86199999999917,6,0.00322234156820767,NA,"role_play","LAURA",1,0,0,0
"2409","Daring_Deeds",7,86,2409,"second_half","TRAVIS","fair enough.",10687.678,10688.975,1.29700000000048,3,0.00231303006939005,NA,"role_play","TRAVIS",1,0,0,0
"2410","Daring_Deeds",7,86,2410,"second_half","LAURA","all right.",10688.975,10690.129,1.15400000000045,3,0.00259965337954838,NA,"role_play","LAURA",1,0,0,0
"2411","Daring_Deeds",7,86,2411,"second_half","MATT","all right. you've joined the rest of the party, the rest of after you guys finish your perusal of the workshop, which is quite a workshop, mundane in a lot of ways, but functional for the basic purposes of tinkering.",10690.129,10706.788,16.6589999999997,42,0.00252115973347745,NA,"role_play","MATT",0,0,0,1
"2412","Daring_Deeds",7,86,2412,"second_half","TALIESIN","rustic!",10706.788,10707.669,0.880999999999403,2,0.00227014755959291,NA,"role_play","TALIESIN",1,0,0,0
"2413","Daring_Deeds",7,86,2413,"second_half","MATT AND TALIESIN","rustic.",10707.669,10709.775,2.10599999999977,2,0.000949667616334388,NA,"role_play","MATT AND TALIESIN",1,0,0,0
"2414","Daring_Deeds",7,86,2414,"second_half","SAM","i think it's magnificent, what you've put together here.",10709.775,10712.926,3.15099999999984,12,0.00380831482069204,NA,"role_play","SAM",1,0,0,0
"2415","Daring_Deeds",7,86,2415,"second_half","TALIESIN","thank you.",10712.926,10713.844,0.917999999999665,3,0.00326797385621034,NA,"role_play","TALIESIN",1,0,0,0
"2416","Daring_Deeds",7,86,2416,"second_half","SAM","and i'm impressed, and from me that's quite a compliment.",10713.844,10720.08,6.23600000000079,13,0.00208466966003822,NA,"role_play","SAM",1,0,0,0
"2417","Daring_Deeds",7,86,2417,"second_half","TALIESIN","no, i'm feeling it. and, my workshop, obviously, is your workshop for as long as you stay here. anything you need to work on, of course, it's fully available.",10720.08,10727.087,7.00699999999961,32,0.00456686170971911,NA,"role_play","TALIESIN",1,0,0,0
"2418","Daring_Deeds",7,86,2418,"second_half","SAM","you know what? i don't normally do this, but... what's your name?",10727.087,10735.286,8.19900000000052,15,0.0018294914013903,NA,"role_play","SAM",1,0,0,0
"2419","Daring_Deeds",7,86,2419,"second_half","MARISHA","oh my god. he doesn't know any of our names!",10735.286,10738.917,3.6309999999994,12,0.00330487469016854,NA,"role_play","MARISHA",1,0,0,0
"2420","Daring_Deeds",7,86,2420,"second_half","LAURA","oh my god!",10738.917,10741.571,2.65400000000045,4,0.0015071590052748,NA,"role_play","LAURA",1,0,0,0
"2421","Daring_Deeds",7,86,2421,"second_half","MARISHA","we're like a bad speed dating session. holy shit.",10741.571,10744.884,3.3130000000001,11,0.00332025354663437,NA,"role_play","MARISHA",1,0,0,0
"2422","Daring_Deeds",7,86,2422,"second_half","TALIESIN","this is so amazing. percival fredrickstein von musel klossowski de rolo the third. at your service.",10744.884,10751.269,6.38500000000022,17,0.00266249021143296,NA,"role_play","TALIESIN",1,0,0,0
"2423","Daring_Deeds",7,86,2423,"second_half","MARISHA","oooh! he's still got it!",10751.269,10752.941,1.67200000000048,7,0.0041866028708122,NA,"role_play","MARISHA",1,0,0,0
"2424","Daring_Deeds",7,86,2424,"second_half","SAM","percival fredrickstein von musel klossowski de rolo the third. all right.",10752.941,10755.807,2.86599999999999,12,0.0041870202372645,NA,"role_play","SAM",1,0,0,0
"2425","Daring_Deeds",7,86,2425,"second_half","TALIESIN","percy to my friends.",10755.807,10758.47,2.66299999999865,5,0.00187758167480381,NA,"role_play","TALIESIN",1,0,0,0
"2426","Daring_Deeds",7,86,2426,"second_half","SAM","i'm tary to mine.",10758.47,10759.552,1.08200000000033,6,0.00554528650646779,NA,"role_play","SAM",1,0,0,0
"2427","Daring_Deeds",7,86,2427,"second_half","TALIESIN","tary, it's a pleasure. this is the castle i live in, this is my sister's castle, except of course, she's lovely. cassandra de rolo.",10759.552,10768.799,9.24700000000121,28,0.00302800908402686,NA,"role_play","TALIESIN",1,0,0,0
"2428","Daring_Deeds",7,86,2428,"second_half","SAM","hm.",10768.799,10769.767,0.967999999998938,2,0.00206611570248161,NA,"role_play","SAM",1,0,0,0
"2429","Daring_Deeds",7,86,2429,"second_half","TALIESIN","you are in whitestone, as our guest.",10769.767,10772.966,3.19900000000052,8,0.00250078149421653,NA,"role_play","TALIESIN",1,0,0,0
"2430","Daring_Deeds",7,86,2430,"second_half","SAM","it is my honor and privilege to be your guest, sir.",10772.966,10776.905,3.93900000000031,12,0.00304645849200281,NA,"role_play","SAM",1,0,0,0
"2431","Daring_Deeds",7,86,2431,"second_half","TALIESIN","a pleasure. i recommend eventually, not necessarily today 'cause i am actually enjoying it, learning everyone else's name as well.",10776.905,10783.511,6.60599999999977,22,0.00333030578262198,NA,"role_play","TALIESIN",1,0,0,0
"2432","Daring_Deeds",7,86,2432,"second_half","SAM","all right, well. okay.",10783.511,10794.33,10.8189999999995,5,0.000462149921434534,NA,"role_play","SAM",1,0,0,0
"2433","Daring_Deeds",7,86,2433,"second_half","SAM","let's tary-on! no? maybe?",10794.33,10797.172,2.84200000000055,7,0.00246305418719164,NA,"role_play","SAM",1,0,0,0
"2434","Daring_Deeds",7,86,2434,"second_half","TALIESIN","no it's i'm okay with it, i'm rolling with it.",10797.172,10798.918,1.74599999999919,14,0.00801832760596021,NA,"role_play","TALIESIN",1,0,0,0
"2435","Daring_Deeds",7,86,2435,"second_half","MARISHA","no! no.",10798.918,10800.18,1.26200000000063,3,0.00237717908082291,NA,"role_play","MARISHA",1,0,0,0
"2436","Daring_Deeds",7,86,2436,"second_half","SAM","doty! doty, put it as a maybe.",10800.18,10801.192,1.01199999999881,8,0.00790513833993027,NA,"role_play","SAM",1,0,0,0
"2437","Daring_Deeds",7,86,2437,"second_half","MARISHA","not becoming a catchphrase.",10801.192,10802.346,1.15400000000045,5,0.00433275563258063,NA,"role_play","MARISHA",1,0,0,0
"2438","Daring_Deeds",7,86,2438,"second_half","TALIESIN","it's not a catchphrase.",10802.346,10803.544,1.19800000000032,6,0.00500834724540768,NA,"role_play","TALIESIN",1,0,0,0
"2439","Daring_Deeds",7,86,2439,"second_half","SAM","doty, put it as a maybe for catchphrases.",10803.544,10806.957,3.41300000000047,9,0.00263697626721324,NA,"role_play","SAM",1,0,0,0
"2440","Daring_Deeds",7,86,2440,"second_half","MATT","you guys gather up",10806.957,10808.388,1.43100000000049,4,0.00279524807826598,NA,"role_play","MATT",0,0,0,1
"2441","Daring_Deeds",7,86,2441,"second_half","TALIESIN","another daring rescue.",10808.388,10809.94,1.55199999999968,4,0.0025773195876294,NA,"role_play","TALIESIN",1,0,0,0
"2442","Daring_Deeds",7,86,2442,"second_half","MATT","together, prepare yourselves for what the next step of your journey is. what are you doing?",10809.94,10813.506,3.56599999999889,17,0.00476724621424713,NA,"role_play","MATT",0,0,0,1
"2443","Daring_Deeds",7,86,2443,"second_half","MARISHA","are we going? are we going?",10813.506,10814.891,1.38500000000022,7,0.00505415162454794,NA,"role_play","MARISHA",1,0,0,0
"2444","Daring_Deeds",7,86,2444,"second_half","LAURA","yeah.",10814.891,10815.487,0.595999999999549,2,0.00335570469798912,NA,"role_play","LAURA",1,0,0,0
"2445","Daring_Deeds",7,86,2445,"second_half","MARISHA","going, going, gone, gotta go?",10815.487,10817.064,1.57700000000114,6,0.00380469245402389,NA,"role_play","MARISHA",1,0,0,0
"2446","Daring_Deeds",7,86,2446,"second_half","TALIESIN","got your stuff together? everything you need?",10817.064,10819.203,2.13899999999921,8,0.00374006545114677,NA,"role_play","TALIESIN",1,0,0,0
"2447","Daring_Deeds",7,86,2447,"second_half","LAURA","are we going to emon? no. we're going to the earth the earth people.",10819.203,10821.045,1.84200000000055,16,0.00868621064060543,NA,"role_play","LAURA",1,0,0,0
"2448","Daring_Deeds",7,86,2448,"second_half","MARISHA","got everything. earth people first.",10821.045,10822.001,0.956000000000131,6,0.0062761506276142,NA,"role_play","MARISHA",1,0,0,0
"2449","Daring_Deeds",7,86,2449,"second_half","MATT","okay.",10822.001,10822.837,0.835999999999331,2,0.00239234449760957,NA,"role_play","MATT",0,0,0,1
"2450","Daring_Deeds",7,86,2450,"second_half","MARISHA","so we can be like, where do i find the other fourth of my tribe.",10822.837,10825.701,2.86399999999958,16,0.00558659217877177,NA,"role_play","MARISHA",1,0,0,0
"2451","Daring_Deeds",7,86,2451,"second_half","TALIESIN","you've written your camp number. in pen, on your arm.",10825.701,10828.709,3.00800000000163,12,0.0039893617021255,NA,"role_play","TALIESIN",1,0,0,0
"2452","Daring_Deeds",7,86,2452,"second_half","MARISHA","yes, i've got my safety tags.",10828.709,10831.427,2.71799999999894,8,0.00294334069168621,NA,"role_play","MARISHA",1,0,0,0
