"","arc","arc_no","episode","turn_number","segment","actor","text","start_turn","end_turn","time_in_sec","word_count","words_per_ms","encounter_count","rp_combat","actor_guest","vox_machina","guest","staff","matt"
"813","Daring_Deeds",7,86,813,"first_half","TALIESIN","oh thank god! okay, i feel better.",4081.446,4083.927,2.48100000000022,8,0.00322450624748057,NA,"role_play","TALIESIN",1,0,0,0
"814","Daring_Deeds",7,86,814,"first_half","MATT","you can see very, very faint engravings of various runic glyphs that are similar some of the ones that you saw on",4083.927,4092.773,8.846,22,0.00248699977390911,NA,"role_play","MATT",0,0,0,1
"815","Daring_Deeds",7,86,815,"first_half","TALIESIN","fassbender?",4092.852,4093.963,1.11100000000033,2,0.00180018001800126,NA,"role_play","TALIESIN",1,0,0,0
"816","Daring_Deeds",7,86,816,"first_half","MATT","fassbender.",4093.963,4094.744,0.780999999999949,2,0.00256081946222808,NA,"role_play","MATT",0,0,0,1
"817","Daring_Deeds",7,86,817,"first_half","TALIESIN","all right. i feel better already, thank you. ego restored.",4094.744,4100.123,5.37899999999945,11,0.00204498977505133,NA,"role_play","TALIESIN",1,0,0,0
"818","Daring_Deeds",7,86,818,"first_half","MATT","you guys make your way to the sand herald district and there you can see the distant towers of the cerulean place. the large central one that leads up into the chamber of j'mon sa ord. as you approach the outside, you see the familiar faces and armor of the hands of ord there, guarding the exterior of the palace walls. as you approach, one of the guards steps up with their same kind of brass and sapphire emblazoned armor, and one of them approaches and steps forward. ""i'm sorry. do you have business at the palace?""",4102.599,4135.134,32.5349999999999,100,0.00307361303211927,NA,"role_play","MATT",0,0,0,1
"819","Daring_Deeds",7,86,819,"first_half","LAURA","yes. question: the symbol? scanlan?",4135.134,4140.757,5.62299999999959,6,0.0010670460608217,NA,"role_play","LAURA",1,0,0,0
"820","Daring_Deeds",7,86,820,"first_half","LIAM","scanlan had it...",4140.826,4142.515,1.68900000000031,4,0.00236826524570709,NA,"role_play","LIAM",1,0,0,0
"821","Daring_Deeds",7,86,821,"first_half","LAURA","that's what i thought.",4142.515,4144.398,1.88299999999981,6,0.00318640467339384,NA,"role_play","LAURA",1,0,0,0
"822","Daring_Deeds",7,86,822,"first_half","TRAVIS","oh, fucking shit.",4144.398,4145.757,1.35899999999947,4,0.00294334069168621,NA,"role_play","TRAVIS",1,0,0,0
"823","Daring_Deeds",7,86,823,"first_half","MARISHA","i thought we got it back, though.",4145.757,4147.53,1.77300000000014,8,0.00451212633953716,NA,"role_play","MARISHA",1,0,0,0
"824","Daring_Deeds",7,86,824,"first_half","LAURA","did he give back to us or did he not?",4147.53,4150.414,2.88400000000001,11,0.00381414701803049,NA,"role_play","LAURA",1,0,0,0
"825","Daring_Deeds",7,86,825,"first_half","MARISHA","wait, no. are we talking about the flute?",4150.414,4154.65,4.23599999999988,9,0.00212464589235134,NA,"role_play","MARISHA",1,0,0,0
"826","Daring_Deeds",7,86,826,"first_half","LIAM","no, there was a symbol.",4154.65,4157.416,2.76600000000053,6,0.00216919739696271,NA,"role_play","LIAM",1,0,0,0
"827","Daring_Deeds",7,86,827,"first_half","LAURA","remember the symbol that had",4157.416,4159.018,1.60199999999986,5,0.00312109862671687,NA,"role_play","LAURA",1,0,0,0
"828","Daring_Deeds",7,86,828,"first_half","LIAM","j'mon's symbol to show to all friends.",4159.018,4160.521,1.5029999999997,10,0.00665335994677444,NA,"role_play","LIAM",1,0,0,0
"829","Daring_Deeds",7,86,829,"first_half","TALIESIN","i think he still has the symbol, doesn't he?",4160.521,4162.089,1.56800000000021,11,0.00701530612244804,NA,"role_play","TALIESIN",1,0,0,0
"830","Daring_Deeds",7,86,830,"first_half","MARISHA","i have his flute because i picked it up last.",4162.089,4164.258,2.16899999999987,11,0.00507146150299708,NA,"role_play","MARISHA",1,0,0,0
"831","Daring_Deeds",7,86,831,"first_half","LAURA","yeah, that doesn't have his symbol on it though.",4164.258,4165.864,1.60599999999977,11,0.00684931506849414,NA,"role_play","LAURA",1,0,0,0
"832","Daring_Deeds",7,86,832,"first_half","LIAM","that's not the same thing.",4165.864,4167.232,1.36800000000039,7,0.00511695906432602,NA,"role_play","LIAM",1,0,0,0
"833","Daring_Deeds",7,86,833,"first_half","TALIESIN","we do bring news though, so...",4167.232,4169.751,2.51900000000023,7,0.00277888050813789,NA,"role_play","TALIESIN",1,0,0,0
"834","Daring_Deeds",7,86,834,"first_half","MARISHA","fuck!",4169.751,4172.018,2.26699999999983,2,0.000882223202470293,NA,"role_play","MARISHA",1,0,0,0
"835","Daring_Deeds",7,86,835,"first_half","LIAM","we are friends to the man on top. j'mon, i misspoke.",4172.018,4182.288,10.2699999999995,13,0.00126582278481018,NA,"role_play","LIAM",1,0,0,0
"836","Daring_Deeds",7,86,836,"first_half","LAURA","j'mon sa ord.",4182.288,4183.59,1.30200000000059,5,0.00384024577572791,NA,"role_play","LAURA",1,0,0,0
"837","Daring_Deeds",7,86,837,"first_half","MARISHA","we need to speak with him.",4183.59,4185.118,1.52800000000025,7,0.00458115183245999,NA,"role_play","MARISHA",1,0,0,0
"838","Daring_Deeds",7,86,838,"first_half","LIAM","vox machina is here, he knows us.",4185.118,4186.893,1.77499999999964,8,0.00450704225352205,NA,"role_play","LIAM",1,0,0,0
"839","Daring_Deeds",7,86,839,"first_half","MARISHA","and return this: i show the flute. maybe they'll recognize it?",4186.893,4191.18,4.28700000000026,13,0.00303242360625127,NA,"role_play","MARISHA",1,0,0,0
"840","Daring_Deeds",7,86,840,"first_half","MATT","the guard takes the flute and",4191.243,4192.843,1.59999999999945,6,0.00375000000000128,NA,"role_play","MATT",0,0,0,1
"841","Daring_Deeds",7,86,841,"first_half","MARISHA","i take it and i dust the ash and drug use off of it. and then",4192.843,4199.482,6.63900000000012,16,0.0024100015062509,NA,"role_play","MARISHA",1,0,0,0
"842","Daring_Deeds",7,86,842,"first_half","MATT","the guard takes it and looks at it, confused. ""please to be patient, for just a moment.""",4199.482,4206.544,7.0619999999999,18,0.00254885301614277,NA,"role_play","MATT",0,0,0,1
"843","Daring_Deeds",7,86,843,"first_half","LAURA","of course, be pleased!",4206.544,4208.477,1.93299999999999,5,0.0025866528711847,NA,"role_play","LAURA",1,0,0,0
"844","Daring_Deeds",7,86,844,"first_half","MATT","""be pleased."" turns around and walks back up the stairs, the front of the palace, and enters through one of the side doorways. about two, three minutes pass. the guards just keep a view out, and then eventually you see an older woman in familiar ceremonial robes exit from the doorway that the guard went into. this is the grand maven, gameshega, who you met and escorted you up into the palace originally. she walks up with her bracelets still jingling as she steps down the stairs, her long robes trailing behind her a good like two-three feet. her headdress still has little brass quills that streak down, past her shoulders into her mid-back, and as she steps up: ""it is good to see all of you once more. ""i do not believe we have met, i'm sorry, what is your name?""",4208.477,4255.832,47.3550000000005,147,0.00310421286031039,NA,"role_play","MATT",0,0,0,1
"845","Daring_Deeds",7,86,845,"first_half","SAM","taryon darrington. nice to meet you. be pleased.",4255.832,4257.955,2.12299999999959,9,0.00423928403203096,NA,"role_play","SAM",1,0,0,0
"846","Daring_Deeds",7,86,846,"first_half","MATT","taryon darrington, friend of vox machina, it is a pleasure to make your acquaintance. so j'mon would like to extend their greetings to all of you, and respect in the wake of the news of the destruction of the conclave. you've aided in closing a far too lingering chapter in the history of marquet and the ruin of the cinder king. thank you.",4257.955,4287.101,29.1459999999997,66,0.00226446167570166,NA,"role_play","MATT",0,0,0,1
"847","Daring_Deeds",7,86,847,"first_half","SAM","you're welcome.",4287.101,4289.846,2.74499999999989,4,0.00145719489981791,NA,"role_play","SAM",1,0,0,0
"848","Daring_Deeds",7,86,848,"first_half","TALIESIN","we wanted to make sure that they were aware that all of the dragons had been dealt with, and that the conclave had been completely vanquished.",4289.846,4298.19,8.34400000000005,27,0.00323585810162989,NA,"role_play","TALIESIN",1,0,0,0
"849","Daring_Deeds",7,86,849,"first_half","MATT","this information did make it to the ears of j'mon.",4298.19,4300.822,2.63200000000052,12,0.00455927051671643,NA,"role_play","MATT",0,0,0,1
"850","Daring_Deeds",7,86,850,"first_half","TALIESIN","excellent. and we thank you for your time.",4300.822,4305.126,4.30400000000009,9,0.00209107806691446,NA,"role_play","TALIESIN",1,0,0,0
"851","Daring_Deeds",7,86,851,"first_half","MATT","of course. anything else?",4305.387,4308.432,3.04500000000007,5,0.00164203612479471,NA,"role_play","MATT",0,0,0,1
"852","Daring_Deeds",7,86,852,"first_half","LAURA","um.",4308.432,4310.768,2.33600000000024,2,0.000856164383561556,NA,"role_play","LAURA",1,0,0,0
"853","Daring_Deeds",7,86,853,"first_half","MARISHA","i guess not?",4310.768,4312.249,1.48099999999977,4,0.00270087778528064,NA,"role_play","MARISHA",1,0,0,0
"854","Daring_Deeds",7,86,854,"first_half","LAURA","well, could i take you aside for a moment?",4312.249,4318.525,6.27599999999984,10,0.00159337157425116,NA,"role_play","LAURA",1,0,0,0
"855","Daring_Deeds",7,86,855,"first_half","MATT","""of course, my dear."" and she walks alongside you as you pull her off a little bit.",4318.525,4325.039,6.51400000000012,19,0.00291679459625417,NA,"role_play","MATT",0,0,0,1
"856","Daring_Deeds",7,86,856,"first_half","LAURA","we have in our service, in emon, a wonderful man, who has been of great aid in battling the conclave as well, and we learned recently that he was expelled from marquet due to crimes in his youth and was wondering if we could maybe speak in his name and his regard, to you, to clear his name?",4325.039,4354.507,29.4679999999998,59,0.00200217184742773,NA,"role_play","LAURA",1,0,0,0
"857","Daring_Deeds",7,86,857,"first_half","MATT","i can see what i can do. what is the name of this gentleman?",4354.507,4357.896,3.38900000000012,15,0.00442608439067555,NA,"role_play","MATT",0,0,0,1
"858","Daring_Deeds",7,86,858,"first_half","LAURA","jarett. his last name?",4357.896,4360.981,3.08500000000004,5,0.00162074554294974,NA,"role_play","LAURA",1,0,0,0
"859","Daring_Deeds",7,86,859,"first_half","LIAM","serpersveshzhg?",4360.981,4363.36,2.37899999999991,2,0.000840689365279563,NA,"role_play","LIAM",1,0,0,0
"860","Daring_Deeds",7,86,860,"first_half","SAM","anderson?",4363.36,4364.523,1.16300000000047,2,0.00171969045571728,NA,"role_play","SAM",1,0,0,0
"861","Daring_Deeds",7,86,861,"first_half","MARISHA","howarth.",4364.523,4365.531,1.00799999999981,2,0.00198412698412736,NA,"role_play","MARISHA",1,0,0,0
"862","Daring_Deeds",7,86,862,"first_half","LAURA","jarett...",4365.602,4366.762,1.15999999999985,2,0.0017241379310347,NA,"role_play","LAURA",1,0,0,0
"863","Daring_Deeds",7,86,863,"first_half","MARISHA","howarth. howarth.",4366.762,4368.217,1.45499999999993,3,0.0020618556701032,NA,"role_play","MARISHA",1,0,0,0
"864","Daring_Deeds",7,86,864,"first_half","MATT","there you go.",4368.217,4369.04,0.82300000000032,4,0.00486026731470042,NA,"role_play","MATT",0,0,0,1
"865","Daring_Deeds",7,86,865,"first_half","LAURA","jarett howorth?",4369.04,4369.807,0.766999999999825,3,0.00391134289439463,NA,"role_play","LAURA",1,0,0,0
"866","Daring_Deeds",7,86,866,"first_half","MARISHA","howarth.",4369.807,4370.636,0.829000000000633,2,0.00241254523522132,NA,"role_play","MARISHA",1,0,0,0
"867","Daring_Deeds",7,86,867,"first_half","LAURA","jarett howarth.",4370.636,4371.546,0.909999999999854,3,0.00329670329670382,NA,"role_play","LAURA",1,0,0,0
"868","Daring_Deeds",7,86,868,"first_half","SAM","you have his name?",4371.546,4372.624,1.07799999999952,5,0.00463821892393528,NA,"role_play","SAM",1,0,0,0
"869","Daring_Deeds",7,86,869,"first_half","LAURA","of course she does, because she takes killer notes.",4372.624,4373.911,1.28700000000026,10,0.00777000777000619,NA,"role_play","LAURA",1,0,0,0
"870","Daring_Deeds",7,86,870,"first_half","SAM","holy bajoly!",4373.911,4375.02,1.10900000000038,3,0.00270513976555363,NA,"role_play","SAM",1,0,0,0
"871","Daring_Deeds",7,86,871,"first_half","TALIESIN","she writes everything down.",4375.02,4376.641,1.62099999999919,5,0.00308451573103178,NA,"role_play","TALIESIN",1,0,0,0
"872","Daring_Deeds",7,86,872,"first_half","SAM","i didn't know that he had a name!",4376.641,4378.699,2.05799999999999,10,0.00485908649173957,NA,"role_play","SAM",1,0,0,0
"873","Daring_Deeds",7,86,873,"first_half","MATT","jarrett howarth.",4378.699,4381.614,2.91499999999996,3,0.00102915951972557,NA,"role_play","MATT",0,0,0,1
"874","Daring_Deeds",7,86,874,"first_half","LAURA","yes.",4381.614,4382.287,0.673000000000684,2,0.00297176820207722,NA,"role_play","LAURA",1,0,0,0
"875","Daring_Deeds",7,86,875,"first_half","MATT","okay. i will go and take this into the archives, discover and see what can be done.",4382.287,4387.121,4.83399999999983,18,0.00372362432767907,NA,"role_play","MATT",0,0,0,1
"876","Daring_Deeds",7,86,876,"first_half","LAURA","thank you so much. if you find out anything, will you please send word?",4387.121,4392.051,4.93000000000029,15,0.0030425963488842,NA,"role_play","LAURA",1,0,0,0
"877","Daring_Deeds",7,86,877,"first_half","MATT","yes, should we be sending it to emon as well?",4392.051,4394.623,2.57199999999921,11,0.0042768273716965,NA,"role_play","MATT",0,0,0,1
"878","Daring_Deeds",7,86,878,"first_half","LAURA","if you could, send it to whitestone?",4394.623,4396.57,1.94700000000012,8,0.00410888546481742,NA,"role_play","LAURA",1,0,0,0
"879","Daring_Deeds",7,86,879,"first_half","MATT","to whitestone?",4396.57,4397.658,1.08800000000065,3,0.00275735294117483,NA,"role_play","MATT",0,0,0,1
"880","Daring_Deeds",7,86,880,"first_half","LAURA","that would be wonderful.",4397.658,4398.632,0.973999999999251,5,0.00513347022587664,NA,"role_play","LAURA",1,0,0,0
"881","Daring_Deeds",7,86,881,"first_half","MATT","okay. very well. we have not sent anything to whitestone before. we will find a way to do so.",4398.632,4405.21,6.57800000000043,20,0.00304043782304632,NA,"role_play","MATT",0,0,0,1
"882","Daring_Deeds",7,86,882,"first_half","LAURA","it's an up and coming city. very prominent on tal'dorei.",4405.21,4407.906,2.69599999999991,13,0.00482195845697345,NA,"role_play","LAURA",1,0,0,0
"883","Daring_Deeds",7,86,883,"first_half","TALIESIN","it's on the move.",4407.906,4409.203,1.29700000000048,6,0.00462606013878009,NA,"role_play","TALIESIN",1,0,0,0
"884","Daring_Deeds",7,86,884,"first_half","LAURA","it's on the move.",4409.203,4412.543,3.33999999999924,6,0.00179640718562915,NA,"role_play","LAURA",1,0,0,0
"885","Daring_Deeds",7,86,885,"first_half","LIAM","would you send j'mon, would you send them our thanks?",4412.543,4417.464,4.92100000000028,12,0.00243852875431809,NA,"role_play","LIAM",1,0,0,0
"886","Daring_Deeds",7,86,886,"first_half","MATT","i will do this. i apologize, j'mon is not currently taking audiences.",4417.53,4423.082,5.55200000000059,14,0.00252161383285276,NA,"role_play","MATT",0,0,0,1
"887","Daring_Deeds",7,86,887,"first_half","LAURA","totally fine.",4423.082,4423.973,0.890999999999622,3,0.0033670033670048,NA,"role_play","LAURA",1,0,0,0
"888","Daring_Deeds",7,86,888,"first_half","MATT","but i will continue to pass this word onto them.",4423.973,4428.056,4.08299999999963,11,0.00269409747734533,NA,"role_play","MATT",0,0,0,1
"889","Daring_Deeds",7,86,889,"first_half","LAURA","thank you so much.",4428.056,4429.136,1.08000000000084,5,0.00462962962962604,NA,"role_play","LAURA",1,0,0,0
"890","Daring_Deeds",7,86,890,"first_half","MATT","thank you very much. and good day! be pleased.",4429.136,4431.673,2.53699999999935,10,0.00394166338194819,NA,"role_play","MATT",0,0,0,1
"891","Daring_Deeds",7,86,891,"first_half","LAURA","be pleased.",4431.673,4432.726,1.05299999999988,3,0.00284900284900316,NA,"role_play","LAURA",1,0,0,0
"892","Daring_Deeds",7,86,892,"first_half","TRAVIS","beep-beep!",4432.726,4435.154,2.42800000000079,3,0.00123558484349218,NA,"role_play","TRAVIS",1,0,0,0
"893","Daring_Deeds",7,86,893,"first_half","MATT","as the grand maven turns around and heads back up the stairs, the guards take their place and the palace is at rest.",4435.154,4444.111,8.95699999999943,24,0.00267946857206671,NA,"role_play","MATT",0,0,0,1
"894","Daring_Deeds",7,86,894,"first_half","LAURA","welp.",4444.111,4445.16,1.04899999999998,2,0.00190657769304103,NA,"role_play","LAURA",1,0,0,0
"895","Daring_Deeds",7,86,895,"first_half","TRAVIS","he must be sick.",4445.16,4447.061,1.90099999999984,5,0.00263019463440317,NA,"role_play","TRAVIS",1,0,0,0
"896","Daring_Deeds",7,86,896,"first_half","LAURA","probably.",4447.061,4447.744,0.682999999999993,2,0.00292825768667646,NA,"role_play","LAURA",1,0,0,0
"897","Daring_Deeds",7,86,897,"first_half","TRAVIS","yeah.",4447.744,4449.185,1.44100000000071,2,0.0013879250520465,NA,"role_play","TRAVIS",1,0,0,0
"898","Daring_Deeds",7,86,898,"first_half","TALIESIN","the flu, perhaps.",4449.185,4450.689,1.50399999999991,4,0.00265957446808527,NA,"role_play","TALIESIN",1,0,0,0
"899","Daring_Deeds",7,86,899,"first_half","MARISHA","it's been going around.",4450.689,4451.918,1.22899999999936,6,0.00488201790073485,NA,"role_play","MARISHA",1,0,0,0
"900","Daring_Deeds",7,86,900,"first_half","LAURA","lots of travel happening. happens when you travel, i hear.",4451.918,4454.256,2.33800000000065,11,0.00470487596235969,NA,"role_play","LAURA",1,0,0,0
"901","Daring_Deeds",7,86,901,"first_half","MARISHA","it's true, yeah. anytime you fly.",4454.256,4458.326,4.06999999999971,8,0.00196560196560211,NA,"role_play","MARISHA",1,0,0,0
"902","Daring_Deeds",7,86,902,"first_half","TALIESIN","so i think that concludes this little jaunt, it might be back home now.",4458.326,4463.605,5.27899999999954,15,0.00284144724379642,NA,"role_play","TALIESIN",1,0,0,0
"903","Daring_Deeds",7,86,903,"first_half","LAURA","oh jeez.",4463.605,4466.322,2.71700000000055,3,0.00110415899889562,NA,"role_play","LAURA",1,0,0,0
"904","Daring_Deeds",7,86,904,"first_half","TRAVIS","well, i think it's about time that we see what tary jumbo's worth.",4466.322,4471.364,5.04199999999946,16,0.00317334391114671,NA,"role_play","TRAVIS",1,0,0,0
"905","Daring_Deeds",7,86,905,"first_half","SAM","i'm sorry?",4471.364,4472.479,1.11500000000069,4,0.00358744394618612,NA,"role_play","SAM",1,0,0,0
"906","Daring_Deeds",7,86,906,"break","TRAVIS","one of your things on your list, right, it was to get in a kerfuffle?",4472.479,4476.217,3.73799999999937,16,0.00428036383092634,NA,NA,"TRAVIS",1,0,0,0
"907","Daring_Deeds",7,86,907,"break","SAM","there's no kerfuffle on the list",4476.217,4478.663,2.44599999999991,7,0.00286181520850378,NA,NA,"SAM",1,0,0,0
"908","Daring_Deeds",7,86,908,"break","TRAVIS","riff-ram, bah-zhu.",4478.663,4479.841,1.17800000000079,5,0.00424448217317201,NA,NA,"TRAVIS",1,0,0,0
"909","Daring_Deeds",7,86,909,"break","SAM","but we are going to have an adventure, is that right?",4479.841,4484.055,4.21399999999994,12,0.00284765068818229,NA,NA,"SAM",1,0,0,0
"910","Daring_Deeds",7,86,910,"break","LAURA","so many.",4484.055,4484.747,0.692000000000007,3,0.00433526011560689,NA,NA,"LAURA",1,0,0,0
"911","Daring_Deeds",7,86,911,"break","SAM","at some point?",4484.747,4485.535,0.787999999999556,4,0.00507614213198255,NA,NA,"SAM",1,0,0,0
"912","Daring_Deeds",7,86,912,"break","TALIESIN","oh yes.",4485.535,4486.408,0.873000000000502,3,0.00343642611683651,NA,NA,"TALIESIN",1,0,0,0
"913","Daring_Deeds",7,86,913,"break","LAURA","all of them.",4486.408,4487.209,0.800999999999476,4,0.00499375780274983,NA,NA,"LAURA",1,0,0,0
"914","Daring_Deeds",7,86,914,"break","LIAM","buddy boy, you're buying in for shit you're not really ready for, yes.",4487.209,4490.17,2.96100000000024,16,0.00540357987166454,NA,NA,"LIAM",1,0,0,0
"915","Daring_Deeds",7,86,915,"break","SAM","all right.",4490.17,4490.978,0.807999999999993,3,0.00371287128712875,NA,NA,"SAM",1,0,0,0
"916","Daring_Deeds",7,86,916,"break","TRAVIS","we gotta know how",4490.978,4492.03,1.05199999999968,4,0.00380228136882245,NA,NA,"TRAVIS",1,0,0,0
"917","Daring_Deeds",7,86,917,"break","SAM","so far, we've delivered a dead body part to someone, and had a brief conversation with a guard.",4492.03,4500.31,8.28000000000065,20,0.00241545893719788,NA,NA,"SAM",1,0,0,0
"918","Daring_Deeds",7,86,918,"break","TALIESIN","it's only been two hours.",4500.31,4502.873,2.56299999999919,7,0.00273117440499501,NA,NA,"TALIESIN",1,0,0,0
"919","Daring_Deeds",7,86,919,"break","SAM","is this what you all are about?",4502.873,4505.49,2.61700000000019,8,0.00305693542223898,NA,NA,"SAM",1,0,0,0
"920","Daring_Deeds",7,86,920,"break","LIAM","we're gonna take a little time for a day. and then we're gonna take you to hell.",4505.49,4511.415,5.92500000000018,20,0.00337552742616023,NA,NA,"LIAM",1,0,0,0
"921","Daring_Deeds",7,86,921,"break","SAM","all right.",4511.415,4512.308,0.893000000000029,3,0.00335946248600213,NA,NA,"SAM",1,0,0,0
"922","Daring_Deeds",7,86,922,"break","LIAM","how does that sound?",4512.308,4513.521,1.21299999999974,5,0.00412201154163321,NA,NA,"LIAM",1,0,0,0
"923","Daring_Deeds",7,86,923,"break","SAM","are you speaking metaphorically?",4513.521,4515.324,1.80299999999988,5,0.00277315585135903,NA,NA,"SAM",1,0,0,0
"924","Daring_Deeds",7,86,924,"break","TRAVIS","no, no, literally hell.",4515.324,4516.41,1.08600000000024,5,0.00460405156537651,NA,NA,"TRAVIS",1,0,0,0
"925","Daring_Deeds",7,86,925,"break","TALIESIN","no, we're going to hell.",4516.41,4517.797,1.38699999999972,7,0.0050468637346802,NA,NA,"TALIESIN",1,0,0,0
"926","Daring_Deeds",7,86,926,"break","TRAVIS","there's like seven or eleven of them.",4517.797,4519.594,1.79700000000048,9,0.00500834724540768,NA,NA,"TRAVIS",1,0,0,0
"927","Daring_Deeds",7,86,927,"break","SAM","all right.",4519.594,4520.939,1.34500000000025,3,0.00223048327137504,NA,NA,"SAM",1,0,0,0
"928","Daring_Deeds",7,86,928,"break","LIAM","wow.",4520.939,4522.633,1.69399999999951,2,0.00118063754427425,NA,NA,"LIAM",1,0,0,0
"929","Daring_Deeds",7,86,929,"break","TRAVIS","are those together? close?",4522.633,4524.752,2.1190000000006,5,0.00235960358659679,NA,NA,"TRAVIS",1,0,0,0
"930","Daring_Deeds",7,86,930,"break","LAURA","very big numbers, grog.",4524.752,4526.23,1.47799999999916,5,0.00338294993234293,NA,NA,"LAURA",1,0,0,0
"931","Daring_Deeds",7,86,931,"break","LIAM","sure.",4526.23,4527.523,1.29300000000057,2,0.00154679040989877,NA,NA,"LIAM",1,0,0,0
"932","Daring_Deeds",7,86,932,"break","TALIESIN","we're taking this one to hell then?",4527.523,4529.634,2.11099999999988,9,0.00426338228327832,NA,NA,"TALIESIN",1,0,0,0
"933","Daring_Deeds",7,86,933,"break","MARISHA","might be a good trial run.",4529.634,4531.768,2.13400000000001,7,0.00328022492970944,NA,NA,"MARISHA",1,0,0,0
"934","Daring_Deeds",7,86,934,"break","LIAM","i don't know. do you want to put him through his paces?",4531.768,4534.273,2.50500000000011,14,0.00558882235528918,NA,NA,"LIAM",1,0,0,0
"935","Daring_Deeds",7,86,935,"break","TRAVIS","yeah, i think so.",4534.273,4535.299,1.02599999999984,5,0.00487329434697932,NA,NA,"TRAVIS",1,0,0,0
"936","Daring_Deeds",7,86,936,"break","LIAM","yeah.",4535.299,4536.6,1.30100000000039,2,0.00153727901614097,NA,NA,"LIAM",1,0,0,0
"937","Daring_Deeds",7,86,937,"break","MARISHA","i want to save traveling the ozmit sea and heading to the water ashari for when pike is back.",4536.6,4544.236,7.63599999999951,20,0.00261917234154024,NA,NA,"MARISHA",1,0,0,0
"938","Daring_Deeds",7,86,938,"break","LAURA","yeah.",4544.441,4545.023,0.582000000000335,2,0.00343642611683651,NA,NA,"LAURA",1,0,0,0
"939","Daring_Deeds",7,86,939,"break","LIAM","yeah.",4545.023,4545.798,0.774999999999636,2,0.00258064516129153,NA,NA,"LIAM",1,0,0,0
"940","Daring_Deeds",7,86,940,"break","MARISHA","so, yeah.",4545.798,4546.991,1.19300000000021,3,0.00251466890192747,NA,NA,"MARISHA",1,0,0,0
"941","Daring_Deeds",7,86,941,"break","LIAM","yeah. let's take this fucker to hell.",4546.991,4549.117,2.1260000000002,9,0.00423330197554052,NA,NA,"LIAM",1,0,0,0
"942","Daring_Deeds",7,86,942,"break","SAM","i don't know what you're talking about.",4549.117,4550.937,1.81999999999971,10,0.00549450549450637,NA,NA,"SAM",1,0,0,0
"943","Daring_Deeds",7,86,943,"break","MARISHA","no, we're speaking insanely literally right now. that's what's impressive about it.",4550.937,4555.67,4.73300000000017,16,0.00338051975491219,NA,NA,"MARISHA",1,0,0,0
"944","Daring_Deeds",7,86,944,"break","SAM","i...",4555.67,4556.535,0.864999999999782,2,0.00231213872832428,NA,NA,"SAM",1,0,0,0
"945","Daring_Deeds",7,86,945,"break","LIAM","we are going to hell.",4556.535,4560.89,4.35500000000047,6,0.00137772675086093,NA,NA,"LIAM",1,0,0,0
"946","Daring_Deeds",7,86,946,"break","SAM","all right.",4560.89,4562.157,1.26699999999983,3,0.00236779794790877,NA,NA,"SAM",1,0,0,0
"947","Daring_Deeds",7,86,947,"break","LIAM","and you are coming along.",4562.157,4563.851,1.69399999999951,6,0.00354191263282276,NA,NA,"LIAM",1,0,0,0
"948","Daring_Deeds",7,86,948,"break","MARISHA","and we're taking you with us.",4563.929,4565.491,1.5619999999999,8,0.00512163892445616,NA,NA,"MARISHA",1,0,0,0
"949","Daring_Deeds",7,86,949,"break","LAURA","shouldn't we see him fight first?",4565.491,4566.864,1.37299999999959,8,0.00582665695557347,NA,NA,"LAURA",1,0,0,0
"950","Daring_Deeds",7,86,950,"break","LIAM","yeah, well, let's bring him home.",4566.864,4568.381,1.51700000000073,8,0.00527356624917345,NA,NA,"LIAM",1,0,0,0
"951","Daring_Deeds",7,86,951,"break","LAURA","i'd hate for him to die immediately.",4568.381,4569.821,1.4399999999996,9,0.00625000000000174,NA,NA,"LAURA",1,0,0,0
"952","Daring_Deeds",7,86,952,"break","LIAM","yeah, we want grog to run him out like a labrador.",4569.821,4572.803,2.98199999999997,12,0.00402414486921533,NA,NA,"LIAM",1,0,0,0
