"","arc","arc_no","episode","turn_number","segment","actor","text","start_turn","end_turn","time_in_sec","word_count","words_per_ms","encounter_count","rp_combat","actor_guest","vox_machina","guest","staff","matt"
"1311","Daring_Deeds",7,96,1311,"second_half_rp","ASHLEY","no.",9191.618,9192.549,0.931000000000495,2,0.00214822771213635,NA,"role_play","ASHLEY",1,0,0,0
"1312","Daring_Deeds",7,96,1312,"second_half_rp","TRAVIS","she's telling the truth.",9192.549,9195.658,3.10899999999856,6,0.00192988099067314,NA,"role_play","TRAVIS",1,0,0,0
"1313","Daring_Deeds",7,96,1313,"second_half_rp","TRAVIS","not a lie in that little soul of hers.",9195.658,9198.379,2.72100000000137,10,0.00367511944138,NA,"role_play","TRAVIS",1,0,0,0
"1314","Daring_Deeds",7,96,1314,"second_half_rp","MARISHA","it's hard to take you seriously, ever, but even more so now with that ridiculous hat.",9198.379,9202.264,3.8849999999984,18,0.00463320463320654,NA,"role_play","MARISHA",1,0,0,0
"1315","Daring_Deeds",7,96,1315,"second_half_rp","LAURA","yeah, maybe you should take it off, it's kind of annoying",9202.264,9204.778,2.51400000000103,12,0.00477326968973551,NA,"role_play","LAURA",1,0,0,0
"1316","Daring_Deeds",7,96,1316,"second_half_rp","TRAVIS","heavy is the head that wears the crown.",9204.778,9211.927,7.14899999999943,9,0.00125891733109536,NA,"role_play","TRAVIS",1,0,0,0
"1317","Daring_Deeds",7,96,1317,"second_half_rp","LIAM","don't let these people tear you down, grog.",9211.927,9214.59,2.66300000000047,10,0.00375516334960505,NA,"role_play","LIAM",1,0,0,0
"1318","Daring_Deeds",7,96,1318,"second_half_rp","TALIESIN","at what point will the lack of circulation begin to make you talk like this?",9214.59,9218.455,3.86499999999978,16,0.00413971539456686,NA,"role_play","TALIESIN",1,0,0,0
"1319","Daring_Deeds",7,96,1319,"second_half_rp","TRAVIS","i'm gonna get you for this.",9218.455,9220.456,2.0010000000002,8,0.00399800099949984,NA,"role_play","TRAVIS",1,0,0,0
"1320","Daring_Deeds",7,96,1320,"second_half_rp","LIAM","and also, i mean, if we take you at your word, and of course we do, so the curse, you you're very in tune with divine things and with curses and things of fiendish nature. you don't sense anything in yourself. it doesn't really add up. is it possible i mean, they're family, and i know you love them to a degree but is it possible they're jerking you around?",9220.456,9248.116,27.6599999999999,76,0.0027476500361533,NA,"role_play","LIAM",1,0,0,0
"1321","Daring_Deeds",7,96,1321,"second_half_rp","ASHLEY","anything's possible. i just i don't feel like they're lying. unless.",9248.116,9259.616,11.5,15,0.00130434782608696,NA,"role_play","ASHLEY",1,0,0,0
"1322","Daring_Deeds",7,96,1322,"second_half_rp","TALIESIN","i don't feel like they're telling the whole truth.",9259.616,9261.967,2.35100000000057,12,0.00510421097405236,NA,"role_play","TALIESIN",1,0,0,0
"1323","Daring_Deeds",7,96,1323,"second_half_rp","ASHLEY","yeah. i don't feel like they're telling the whole truth, but i think something's there, and i can't seem to get to the bottom of it.",9261.967,9267.84,5.87299999999959,31,0.00527839264430481,NA,"role_play","ASHLEY",1,0,0,0
"1324","Daring_Deeds",7,96,1324,"second_half_rp","LAURA","have you prayed to sarenrae?",9267.895,9269.615,1.71999999999935,6,0.00348837209302458,NA,"role_play","LAURA",1,0,0,0
"1325","Daring_Deeds",7,96,1325,"second_half_rp","ASHLEY","no. i haven't, yet.",9269.615,9272.897,3.28200000000106,6,0.00182815356489886,NA,"role_play","ASHLEY",1,0,0,0
"1326","Daring_Deeds",7,96,1326,"second_half_rp","MARISHA","i feel like we're not one to speak on curses and bad things not existing.",9272.897,9284.03,11.1329999999998,17,0.0015269918261026,NA,"role_play","MARISHA",1,0,0,0
"1327","Daring_Deeds",7,96,1327,"second_half_rp","TRAVIS","yeah, what about a second opinion? like one time it was really burning when i was peeing, and the guy's like, oh, eat this and it'll be fine, and i was like, mm, i'm gonna get a second opinion.",9284.03,9294.398,10.3679999999986,43,0.00414737654321045,NA,"role_play","TRAVIS",1,0,0,0
"1328","Daring_Deeds",7,96,1328,"second_half_rp","MARISHA","that was cranberry juice, grog, and that was a solid opinion.",9294.398,9297.931,3.53300000000127,12,0.00339654684404067,NA,"role_play","MARISHA",1,0,0,0
"1329","Daring_Deeds",7,96,1329,"second_half_rp","TRAVIS","yeah, it actually turned out to be true.",9297.931,9299.681,1.75,9,0.00514285714285714,NA,"role_play","TRAVIS",1,0,0,0
"1330","Daring_Deeds",7,96,1330,"second_half_rp","ASHLEY","that's a very good analogy.",9299.681,9303.297,3.61599999999999,7,0.00193584070796461,NA,"role_play","ASHLEY",1,0,0,0
"1331","Daring_Deeds",7,96,1331,"second_half_rp","SAM","what if we do this: what if we go up to the mountain, full moon, go through the motions, and keyleth, you're super-powerful, you must have some sort of way of telling if this ogden is telling the truth, right?",9303.297,9323.296,19.9989999999998,43,0.00215010750537529,NA,"role_play","SAM",1,0,0,0
"1332","Daring_Deeds",7,96,1332,"second_half_rp","MARISHA","um. i could look at his face and his weird tics and deduce very hard.",9323.296,9333.069,9.77299999999923,16,0.00163716361403881,NA,"role_play","MARISHA",1,0,0,0
"1333","Daring_Deeds",7,96,1333,"second_half_rp","TALIESIN","talk to his tics. does he have tics?",9333.069,9335.555,2.48600000000079,9,0.00362027353177681,NA,"role_play","TALIESIN",1,0,0,0
"1334","Daring_Deeds",7,96,1334,"second_half_rp","LAURA","when is the next full moon?",9335.555,9337.047,1.49200000000019,7,0.0046916890080423,NA,"role_play","LAURA",1,0,0,0
"1335","Daring_Deeds",7,96,1335,"second_half_rp","MATT","make a nature check.",9337.047,9338.649,1.60199999999895,5,0.00312109862671865,NA,"role_play","MATT",0,0,0,1
"1336","Daring_Deeds",7,96,1336,"second_half_rp","LIAM","am i remembering that incorrectly?",9338.649,9341.959,3.31000000000131,6,0.00181268882175155,NA,"role_play","LIAM",1,0,0,0
"1337","Daring_Deeds",7,96,1337,"second_half_rp","ASHLEY","yes.",9341.959,9343.522,1.5630000000001,2,0.00127959053102999,NA,"role_play","ASHLEY",1,0,0,0
"1338","Daring_Deeds",7,96,1338,"second_half_rp","LAURA","so maybe just try to cure yourself of this curse. is that possible?",9343.522,9347.46,3.93799999999828,14,0.00355510411376488,NA,"role_play","LAURA",1,0,0,0
"1339","Daring_Deeds",7,96,1339,"second_half_rp","MARISHA","25.",9347.533,9348.351,0.81800000000112,2,0.00244498777505778,NA,"role_play","MARISHA",1,0,0,0
"1340","Daring_Deeds",7,96,1340,"second_half_rp","MATT","25. four days.",9348.351,9349.825,1.47400000000016,4,0.00271370420624122,NA,"role_play","MATT",0,0,0,1
"1341","Daring_Deeds",7,96,1341,"second_half_rp","TALIESIN","we'd have to start right now.",9349.825,9352.823,2.99799999999959,8,0.00266844563042064,NA,"role_play","TALIESIN",1,0,0,0
"1342","Daring_Deeds",7,96,1342,"second_half_rp","SAM","the other option is and i've been holding onto it 'cause it's valuable i do happen to have a potion of mind reading, so we could go up there with him and i could just read his mind.",9352.823,9368.627,15.8040000000001,41,0.00259427992913185,NA,"role_play","SAM",1,0,0,0
"1343","Daring_Deeds",7,96,1343,"second_half_rp","LIAM","you could also do that now.",9368.627,9370.707,2.07999999999993,7,0.00336538461538473,NA,"role_play","LIAM",1,0,0,0
"1344","Daring_Deeds",7,96,1344,"second_half_rp","TRAVIS","but what if he thinks he's telling the truth?",9370.707,9375.008,4.30099999999948,11,0.00255754475703356,NA,"role_play","TRAVIS",1,0,0,0
"1345","Daring_Deeds",7,96,1345,"second_half_rp","SAM","that is the smartest thing you've ever said.",9375.008,9377.18,2.17200000000048,10,0.00460405156537651,NA,"role_play","SAM",1,0,0,0
"1346","Daring_Deeds",7,96,1346,"second_half_rp","TRAVIS","this fucking hat is magic!",9377.18,9380.608,3.42799999999988,6,0.00175029171528594,NA,"role_play","TRAVIS",1,0,0,0
"1347","Daring_Deeds",7,96,1347,"second_half_rp","ASHLEY","what if how much of that potion do you have?",9380.608,9385.391,4.78299999999945,11,0.00229981183357752,NA,"role_play","ASHLEY",1,0,0,0
"1348","Daring_Deeds",7,96,1348,"second_half_rp","SAM","one. i have one of it.",9385.391,9388.099,2.70800000000054,7,0.00258493353028014,NA,"role_play","SAM",1,0,0,0
"1349","Daring_Deeds",7,96,1349,"second_half_rp","ASHLEY","i mean, gnomes are small, what if we give them all a shot?",9388.099,9393.128,5.02900000000045,14,0.0027838536488365,NA,"role_play","ASHLEY",1,0,0,0
"1350","Daring_Deeds",7,96,1350,"second_half_rp","LAURA","we take the potion, and then we read their minds.",9393.128,9398.446,5.3179999999993,11,0.00206844678450572,NA,"role_play","LAURA",1,0,0,0
"1351","Daring_Deeds",7,96,1351,"second_half_rp","ASHLEY","i understand. i think i thought",9398.446,9402.725,4.27900000000045,6,0.00140219677494727,NA,"role_play","ASHLEY",1,0,0,0
"1352","Daring_Deeds",7,96,1352,"second_half_rp","MARISHA","you thought it was truth serum, yeah. yeah, i was kinda with you there. okay, hang on. i mean, we're, as taryon said, awesome.",9402.725,9419.758,17.0329999999994,26,0.00152644865848652,NA,"role_play","MARISHA",1,0,0,0
"1353","Daring_Deeds",7,96,1353,"second_half_rp","SAM","i said that about you.",9419.758,9423.458,3.70000000000073,6,0.0016216216216213,NA,"role_play","SAM",1,0,0,0
"1354","Daring_Deeds",7,96,1354,"second_half_rp","MARISHA","i was being generous.",9423.458,9425.754,2.29600000000028,5,0.00217770034843179,NA,"role_play","MARISHA",1,0,0,0
"1355","Daring_Deeds",7,96,1355,"second_half_rp","SAM","thank you.",9425.754,9427.064,1.30999999999949,3,0.00229007633587875,NA,"role_play","SAM",1,0,0,0
"1356","Daring_Deeds",7,96,1356,"second_half_rp","MARISHA","if we just go through with this, is there any harm in that?",9427.064,9431.949,4.88500000000022,14,0.00286591606960069,NA,"role_play","MARISHA",1,0,0,0
"1357","Daring_Deeds",7,96,1357,"second_half_rp","TALIESIN","we should start, at the very least. my worry is, if i understand this curse correctly, the only person i think that could possibly be at risk from it would be jb.",9431.949,9445.559,13.6099999999988,33,0.0024246877296108,NA,"role_play","TALIESIN",1,0,0,0
"1358","Daring_Deeds",7,96,1358,"second_half_rp","SAM","why?",9445.559,9447.221,1.66200000000026,2,0.00120336943441618,NA,"role_play","SAM",1,0,0,0
"1359","Daring_Deeds",7,96,1359,"second_half_rp","TALIESIN","think about it. what avarice have any of us ever experienced from pike?",9447.221,9454.648,7.42699999999968,14,0.00188501413760611,NA,"role_play","TALIESIN",1,0,0,0
"1360","Daring_Deeds",7,96,1360,"second_half_rp","ASHLEY","i don't even know what that word means.",9454.648,9458.972,4.32400000000052,10,0.00231267345050851,NA,"role_play","ASHLEY",1,0,0,0
"1361","Daring_Deeds",7,96,1361,"second_half_rp","TALIESIN","i...",9458.972,9461.817,2.84499999999935,2,0.000702987697715452,NA,"role_play","TALIESIN",1,0,0,0
"1362","Daring_Deeds",7,96,1362,"second_half_rp","ASHLEY","like, if you were to just define avarice.",9461.817,9466.597,4.78000000000065,9,0.00188284518828426,NA,"role_play","ASHLEY",1,0,0,0
"1363","Daring_Deeds",7,96,1363,"second_half_rp","SAM","you know, it's sinful in a sort of vague way.",9466.597,9469.867,3.27000000000044,12,0.00366972477064171,NA,"role_play","SAM",1,0,0,0
"1364","Daring_Deeds",7,96,1364,"second_half_rp","ASHLEY","i mean, i don't even",9469.867,9472.009,2.14199999999983,6,0.0028011204481795,NA,"role_play","ASHLEY",1,0,0,0
"1365","Daring_Deeds",7,96,1365,"second_half_rp","LAURA","trinket doesn't even know, and he knows everything.",9472.009,9474.227,2.21800000000076,10,0.00450856627592272,NA,"role_play","LAURA",1,0,0,0
"1366","Daring_Deeds",7,96,1366,"second_half_rp","TRAVIS","scholars maintain...",9474.227,9476.183,1.95600000000013,3,0.00153374233128824,NA,"role_play","TRAVIS",1,0,0,0
"1367","Daring_Deeds",7,96,1367,"second_half_rp","TALIESIN","what i'm saying is perhaps",9476.183,9478.806,2.62299999999959,6,0.00228745711017954,NA,"role_play","TALIESIN",1,0,0,0
"1368","Daring_Deeds",7,96,1368,"second_half_rp","SAM","google? maybe we could google it?",9478.806,9480.777,1.97099999999955,7,0.00355149670218245,NA,"role_play","SAM",1,0,0,0
"1369","Daring_Deeds",7,96,1369,"second_half_rp","TALIESIN","please do, actually. google avarice.",9480.777,9484.431,3.65400000000045,6,0.00164203612479454,NA,"role_play","TALIESIN",1,0,0,0
"1370","Daring_Deeds",7,96,1370,"second_half_rp","SAM","i think it's having hate in your heart? i think?",9484.431,9487.517,3.08599999999933,12,0.00388852883992307,NA,"role_play","SAM",1,0,0,0
"1371","Daring_Deeds",7,96,1371,"second_half_rp","TALIESIN","hate and greed.",9487.517,9491.737,4.21999999999935,4,0.000947867298578346,NA,"role_play","TALIESIN",1,0,0,0
"1372","Daring_Deeds",7,96,1372,"second_half_rp","TRAVIS","i thought it was pride.",9491.737,9493.82,2.08300000000054,6,0.00288046087373905,NA,"role_play","TRAVIS",1,0,0,0
"1373","Daring_Deeds",7,96,1373,"second_half_rp","MARISHA","hate, greed, pride, any of the seven deadly sins.",9493.82,9496.444,2.6239999999998,10,0.00381097560975639,NA,"role_play","MARISHA",1,0,0,0
"1374","Daring_Deeds",7,96,1374,"second_half_rp","SAM","what is avarice?",9496.444,9497.88,1.43599999999969,4,0.00278551532033485,NA,"role_play","SAM",1,0,0,0
"1375","Daring_Deeds",7,96,1375,"second_half_rp","MATT","it's tary.",9497.88,9500.156,2.27600000000166,4,0.00175746924428694,NA,"role_play","MATT",0,0,0,1
"1376","Daring_Deeds",7,96,1376,"second_half_rp","TALIESIN","it's a covet-ness, it's someone is",9500.156,9507.785,7.628999999999,9,0.00117970900511223,NA,"role_play","TALIESIN",1,0,0,0
"1377","Daring_Deeds",7,96,1377,"second_half_rp","MARISHA","man, i feel like we're really getting off the point.",9507.785,9511.904,4.1190000000006,12,0.00291332847778545,NA,"role_play","MARISHA",1,0,0,0
"1378","Daring_Deeds",7,96,1378,"second_half_rp","TALIESIN","the point i'm trying to make is, and i'm having a notion",9511.904,9516.06,4.15599999999904,14,0.00336862367661291,NA,"role_play","TALIESIN",1,0,0,0
"1379","Daring_Deeds",7,96,1379,"second_half_rp","MATT","my apologies for using a word with a",9516.06,9518.778,2.71800000000076,8,0.00294334069168424,NA,"role_play","MATT",0,0,0,1
"1380","Daring_Deeds",7,96,1380,"second_half_rp","LAURA","five-dollar word.",9518.778,9520.337,1.55899999999929,4,0.00256574727389469,NA,"role_play","LAURA",1,0,0,0
"1381","Daring_Deeds",7,96,1381,"second_half_rp","MARISHA","why did you use an sat word, matt? why?",9520.337,9522.821,2.48400000000038,10,0.0040257648953295,NA,"role_play","MARISHA",1,0,0,0
"1382","Daring_Deeds",7,96,1382,"second_half_rp","MATT","i read a lot of books growing up, i'm sorry!",9522.821,9524.816,1.9950000000008,12,0.00601503759398255,NA,"role_play","MATT",0,0,0,1
"1383","Daring_Deeds",7,96,1383,"second_half_rp","SAM","doesn't say.",9524.816,9526.643,1.82699999999932,4,0.00218938149972715,NA,"role_play","SAM",1,0,0,0
"1384","Daring_Deeds",7,96,1384,"second_half_rp","LIAM","it's pronounced av-riggle.",9526.643,9528.384,1.74099999999999,6,0.00344629523262496,NA,"role_play","LIAM",1,0,0,0
"1385","Daring_Deeds",7,96,1385,"second_half_rp","TALIESIN","the point i'm trying to make in all of this is that perhaps they're trying to save one of their own, and perhaps they need to move the curse to another trickfoot.",9528.384,9539.641,11.2569999999996,35,0.0031091765123924,NA,"role_play","TALIESIN",1,0,0,0
"1386","Daring_Deeds",7,96,1386,"second_half_rp","SAM","oh, it's just greed. it's just greed.",9539.641,9541.742,2.10100000000057,10,0.00475963826749038,NA,"role_play","SAM",1,0,0,0
"1387","Daring_Deeds",7,96,1387,"second_half_rp","TRAVIS","like i said, greed.",9541.742,9546.103,4.36099999999897,5,0.00114652602614106,NA,"role_play","TRAVIS",1,0,0,0
"1388","Daring_Deeds",7,96,1388,"second_half_rp","LAURA","so, wait, i have a question. what if all of them are actually cursed, and they're trying to bring you in?",9546.103,9554.681,8.57800000000134,23,0.00268127768710613,NA,"role_play","LAURA",1,0,0,0
"1389","Daring_Deeds",7,96,1389,"second_half_rp","TRAVIS","ooh. ooh! that's a good thought. we kill all of them. no.",9554.681,9560.885,6.20399999999972,14,0.00225660863958746,NA,"role_play","TRAVIS",1,0,0,0
"1390","Daring_Deeds",7,96,1390,"second_half_rp","SAM","yes. yes! of course. they'll be easily killed, they're half our size.",9560.885,9564.568,3.68299999999908,15,0.0040727667662242,NA,"role_play","SAM",1,0,0,0
"1391","Daring_Deeds",7,96,1391,"second_half_rp","LAURA","what did ogden say this exorcism entailed?",9564.568,9567.257,2.68900000000031,8,0.002975083674228,NA,"role_play","LAURA",1,0,0,0
"1392","Daring_Deeds",7,96,1392,"second_half_rp","ASHLEY","he said that we go to the highest mountain, we have to wait 'til a full moon, you have to have it be hallowed ground, and just sort of set up a ritual, and he said maybe we could get help from whomever, and i was thinking of vax, and i don't know! this is so beyond anything that i know!",9567.257,9593.519,26.2620000000006,63,0.00239890335846464,NA,"role_play","ASHLEY",1,0,0,0
"1393","Daring_Deeds",7,96,1393,"second_half_rp","LAURA","and then what would happen? we just send the curse out of you and all is well?",9593.519,9597.462,3.9429999999993,18,0.0045650519908707,NA,"role_play","LAURA",1,0,0,0
"1394","Daring_Deeds",7,96,1394,"second_half_rp","ASHLEY","i guess? this sounds so ridiculous as i'm saying it out loud.",9597.462,9602.076,4.61399999999958,14,0.00303424360641554,NA,"role_play","ASHLEY",1,0,0,0
"1395","Daring_Deeds",7,96,1395,"second_half_rp","TRAVIS","i mean, do you want to go see another cleric and see if you even need to exercise or not?",9602.076,9607.879,5.8030000000017,21,0.00361881785283368,NA,"role_play","TRAVIS",1,0,0,0
"1396","Daring_Deeds",7,96,1396,"second_half_rp","MARISHA","very fit.",9607.879,9611.449,3.56999999999971,3,0.00084033613445385,NA,"role_play","MARISHA",1,0,0,0
"1397","Daring_Deeds",7,96,1397,"second_half_rp","LAURA","very strong.",9611.449,9613.144,1.69499999999971,3,0.00176991150442508,NA,"role_play","LAURA",1,0,0,0
"1398","Daring_Deeds",7,96,1398,"second_half_rp","ASHLEY","i feel like i like the mind-reading serum. we could just see. we have four days 'til a full moon.",9613.144,9624.444,11.2999999999993,22,0.00194690265486738,NA,"role_play","ASHLEY",1,0,0,0
"1399","Daring_Deeds",7,96,1399,"second_half_rp","TALIESIN","we should start consecrating the ground, at the very least.",9624.444,9629.348,4.90400000000045,11,0.00224306688417598,NA,"role_play","TALIESIN",1,0,0,0
"1400","Daring_Deeds",7,96,1400,"second_half_rp","LIAM","also, do we really imagine whatever trouble they might be bringing to pike's doorstep is something we can't handle? i mean, we've dealt with pretty terrible things. i have a hard time imagining it could be worse i'm not saying it's not dangerous, it should be",9629.348,9647.446,18.098,51,0.00281799093822523,NA,"role_play","LIAM",1,0,0,0
"1401","Daring_Deeds",7,96,1401,"second_half_rp","TRAVIS","avarice.",9647.446,9648.801,1.35499999999956,2,0.00147601476014808,NA,"role_play","TRAVIS",1,0,0,0
"1402","Daring_Deeds",7,96,1402,"second_half_rp","LIAM","oh, i got a nosebleed. we could just do i mean, keyleth could do her trick of turning us into ladybugs or flies or whatever and we could all hang out and follow along. i mean, mind-reading first.",9648.801,9664.755,15.9539999999997,40,0.00250720822364302,NA,"role_play","LIAM",1,0,0,0
"1403","Daring_Deeds",7,96,1403,"second_half_rp","ASHLEY","i think you're allowed to be there.",9664.755,9666.175,1.42000000000007,9,0.00633802816901376,NA,"role_play","ASHLEY",1,0,0,0
"1404","Daring_Deeds",7,96,1404,"second_half_rp","LAURA","yeah, we can be there.",9666.175,9667.24,1.06500000000051,6,0.00563380281689871,NA,"role_play","LAURA",1,0,0,0
"1405","Daring_Deeds",7,96,1405,"second_half_rp","LIAM","we can just be there, they don't care? oh. i was shooting guns today.",9667.24,9671.46,4.21999999999935,16,0.00379146919431338,NA,"role_play","LIAM",1,0,0,0
"1406","Daring_Deeds",7,96,1406,"second_half_rp","MARISHA","ogden at dinner the other night said that each generation is affected by a blood curse, and he believes it's you in this generation? because you and jb are in the same age, right? so you're the same generation. so maybe percy's theory isn't quite wrong.",9671.46,9695.625,24.1650000000009,51,0.00211049037864673,NA,"role_play","MARISHA",1,0,0,0
"1407","Daring_Deeds",7,96,1407,"second_half_rp","SAM","percy's very smart.",9695.625,9697.352,1.72700000000077,5,0.00289519397799523,NA,"role_play","SAM",1,0,0,0
"1408","Daring_Deeds",7,96,1408,"second_half_rp","MARISHA","i don't know.",9697.352,9698.749,1.39699999999903,5,0.00357909806728954,NA,"role_play","MARISHA",1,0,0,0
"1409","Daring_Deeds",7,96,1409,"second_half_rp","TALIESIN","i tend to veer towards the worst-case scenario. somebody has to.",9698.749,9705.109,6.36000000000058,13,0.00204402515723252,NA,"role_play","TALIESIN",1,0,0,0
"1410","Daring_Deeds",7,96,1410,"second_half_rp","LAURA","will jb be there at the exorcism?",9705.109,9707.71,2.60099999999875,8,0.00307574009996303,NA,"role_play","LAURA",1,0,0,0
"1411","Daring_Deeds",7,96,1411,"second_half_rp","TALIESIN","that is a question.",9707.71,9709.228,1.51800000000003,5,0.00329380764163367,NA,"role_play","TALIESIN",1,0,0,0
"1412","Daring_Deeds",7,96,1412,"second_half_rp","LAURA","we need to make sure she is, just in case.",9709.228,9711.063,1.83500000000095,11,0.00599455040871626,NA,"role_play","LAURA",1,0,0,0
"1413","Daring_Deeds",7,96,1413,"second_half_rp","MARISHA","or isn't, just in case. right?",9711.063,9713.815,2.75200000000041,8,0.00290697674418562,NA,"role_play","MARISHA",1,0,0,0
"1414","Daring_Deeds",7,96,1414,"second_half_rp","LAURA","no. if there is a curse, and she is affected, it would be good to get it out of her as well.",9713.815,9720.593,6.77800000000025,23,0.00339333136618459,NA,"role_play","LAURA",1,0,0,0
"1415","Daring_Deeds",7,96,1415,"second_half_rp","MARISHA","but what if it goes out of pike and into her?",9720.593,9722.748,2.15499999999884,12,0.00556844547564106,NA,"role_play","MARISHA",1,0,0,0
"1416","Daring_Deeds",7,96,1416,"second_half_rp","TRAVIS","what if it goes out of her and into pike?",9722.748,9725.174,2.4260000000013,11,0.00453421269579313,NA,"role_play","TRAVIS",1,0,0,0
"1417","Daring_Deeds",7,96,1417,"second_half_rp","MARISHA","man, so many variables.",9725.174,9728.931,3.75699999999961,5,0.00133084908171427,NA,"role_play","MARISHA",1,0,0,0
"1418","Daring_Deeds",7,96,1418,"second_half_rp","SAM","we should all be there together, because stronger in numbers, and if pike's lying to us we kill her, and if jb's lying to us we kill her.",9728.931,9740.735,11.8040000000001,31,0.00262622839715349,NA,"role_play","SAM",1,0,0,0
"1419","Daring_Deeds",7,96,1419,"second_half_rp","ASHLEY","well, hold on. well, okay, yeah. if it comes down to that, everybody, we have to know that that has to be",9740.735,9748.374,7.63899999999921,22,0.00287995810970052,NA,"role_play","ASHLEY",1,0,0,0
"1420","Daring_Deeds",7,96,1420,"second_half_rp","LAURA","we're not going to kill you.",9748.374,9749.766,1.39199999999983,8,0.00574712643678233,NA,"role_play","LAURA",1,0,0,0
"1421","Daring_Deeds",7,96,1421,"second_half_rp","SAM","no, if you're infected with evil, we might have to",9749.766,9751.335,1.56899999999951,11,0.00701083492670712,NA,"role_play","SAM",1,0,0,0
"1422","Daring_Deeds",7,96,1422,"second_half_rp","TRAVIS","yeah, what does it do? do you turn into a crazy beast?",9751.335,9754.126,2.79100000000108,13,0.00465782873521855,NA,"role_play","TRAVIS",1,0,0,0
"1423","Daring_Deeds",7,96,1423,"second_half_rp","ASHLEY","i have no idea.",9754.126,9755.728,1.60199999999895,5,0.00312109862671865,NA,"role_play","ASHLEY",1,0,0,0
"1424","Daring_Deeds",7,96,1424,"second_half_rp","TRAVIS","like, do you get tentacles?",9755.728,9757.239,1.51100000000042,6,0.00397088021177917,NA,"role_play","TRAVIS",1,0,0,0
"1425","Daring_Deeds",7,96,1425,"second_half_rp","ASHLEY","that's i feel like that would be an upgrade.",9757.239,9761.021,3.78200000000106,11,0.00290851401374852,NA,"role_play","ASHLEY",1,0,0,0
"1426","Daring_Deeds",7,96,1426,"second_half_rp","TRAVIS","that's not really that bad.",9761.021,9762.994,1.97299999999996,7,0.00354789660415619,NA,"role_play","TRAVIS",1,0,0,0
"1427","Daring_Deeds",7,96,1427,"second_half_rp","ASHLEY","no. i doubt that's what it is.",9762.994,9765.395,2.40099999999984,9,0.00374843815077076,NA,"role_play","ASHLEY",1,0,0,0
"1428","Daring_Deeds",7,96,1428,"second_half_rp","TRAVIS","maybe we're approaching this the wrong way.",9765.395,9767.155,1.76000000000022,9,0.00511363636363573,NA,"role_play","TRAVIS",1,0,0,0
"1429","Daring_Deeds",7,96,1429,"second_half_rp","ASHLEY","i'm intrigued by this mind-reading serum.",9767.155,9769.372,2.21699999999873,9,0.00405953991881152,NA,"role_play","ASHLEY",1,0,0,0
"1430","Daring_Deeds",7,96,1430,"second_half_rp","SAM","i've never used it, so it should probably work great.",9769.372,9773.71,4.33799999999974,12,0.0027662517289075,NA,"role_play","SAM",1,0,0,0
"1431","Daring_Deeds",7,96,1431,"second_half_rp","LAURA","how much was that?",9773.71,9777.433,3.72300000000178,5,0.00134300295460586,NA,"role_play","LAURA",1,0,0,0
"1432","Daring_Deeds",7,96,1432,"second_half_rp","SAM","about a thousand.",9777.433,9778.96,1.52699999999822,4,0.00261951538965596,NA,"role_play","SAM",1,0,0,0
"1433","Daring_Deeds",7,96,1433,"second_half_rp","LIAM","that's not bad.",9778.96,9780.911,1.95100000000093,5,0.00256278831368407,NA,"role_play","LIAM",1,0,0,0
"1434","Daring_Deeds",7,96,1434,"second_half_rp","TRAVIS","do it.",9780.911,9783.256,2.34499999999935,3,0.0012793176972285,NA,"role_play","TRAVIS",1,0,0,0
"1435","Daring_Deeds",7,96,1435,"second_half_rp","MARISHA","i mean, maybe ogden just isn't telling you things because he's so old, it's locked away and he doesn't remember. you know?",9783.256,9793.109,9.85300000000097,27,0.002740282147569,NA,"role_play","MARISHA",1,0,0,0
