"","arc","arc_no","episode","turn_number","segment","actor","text","start_turn","end_turn","time_in_sec","word_count","words_per_ms","encounter_count","rp_combat","actor_guest","vox_machina","guest","staff","matt"
"1890","Daring_Deeds",7,96,1890,"second_half_rp","MATT","over here? all righty.",12550.622,12552.985,2.36300000000119,5,0.00211595429538615,NA,"role_play","MATT",0,0,0,1
"1891","Daring_Deeds",7,96,1891,"second_half_rp","TRAVIS","i would like to stay near pike if i can.",12552.985,12554.951,1.96599999999853,11,0.00559511698881395,NA,"role_play","TRAVIS",1,0,0,0
"1892","Daring_Deeds",7,96,1892,"second_half_rp","MATT","all righty. so you want to stay near this central rock there?",12554.951,12557.876,2.92500000000109,13,0.00444444444444279,NA,"role_play","MATT",0,0,0,1
"1893","Daring_Deeds",7,96,1893,"second_half_rp","TRAVIS","yeah, as long as i'm out of the way of the ritual. just near pike.",12557.876,12560.569,2.6929999999993,17,0.00631266245822667,NA,"role_play","TRAVIS",1,0,0,0
"1894","Daring_Deeds",7,96,1894,"second_half_rp","LAURA","trinket stays near grog.",12560.569,12562.039,1.47000000000116,5,0.00340136054421499,NA,"role_play","LAURA",1,0,0,0
"1895","Daring_Deeds",7,96,1895,"second_half_rp","MATT","okay, trinket's gonna hang next to grog. perfect.",12562.039,12565.529,3.48999999999978,10,0.00286532951289416,NA,"role_play","MATT",0,0,0,1
"1896","Daring_Deeds",7,96,1896,"second_half_rp","LIAM","i'm gonna play lookout and go out towards the edge past the arch, but sink in against the wall a bit and hide.",12565.529,12576.298,10.7690000000002,25,0.00232147831739247,NA,"role_play","LIAM",1,0,0,0
"1897","Daring_Deeds",7,96,1897,"second_half_rp","MATT","there a bit, right there?",12576.298,12577.398,1.09999999999854,6,0.00545454545455267,NA,"role_play","MATT",0,0,0,1
"1898","Daring_Deeds",7,96,1898,"second_half_rp","LIAM","into the cracks of it, yeah.",12577.398,12578.635,1.23700000000099,7,0.00565885206143444,NA,"role_play","LIAM",1,0,0,0
"1899","Daring_Deeds",7,96,1899,"second_half_rp","MATT","okay. so you're hiding on this side. poking through. keyleth?",12578.635,12583.399,4.76399999999921,12,0.00251889168765785,NA,"role_play","MATT",0,0,0,1
"1900","Daring_Deeds",7,96,1900,"second_half_rp","MARISHA","i'll go by that spire closest to you.",12583.399,12587.679,4.28000000000065,10,0.00233644859813048,NA,"role_play","MARISHA",1,0,0,0
"1901","Daring_Deeds",7,96,1901,"second_half_rp","MATT","over here?",12587.679,12590.109,2.43000000000029,3,0.00123456790123442,NA,"role_play","MATT",0,0,0,1
"1902","Daring_Deeds",7,96,1902,"second_half_rp","MARISHA","yeah, little close to the stalagtite.",12590.109,12593.069,2.95999999999913,7,0.00236486486486556,NA,"role_play","MARISHA",1,0,0,0
"1903","Daring_Deeds",7,96,1903,"second_half_rp","MATT","over here?",12593.069,12594.406,1.33700000000135,3,0.00224382946895809,NA,"role_play","MATT",0,0,0,1
"1904","Daring_Deeds",7,96,1904,"second_half_rp","MARISHA","yeah, thank you.",12594.406,12595.449,1.04299999999967,4,0.00383509108341446,NA,"role_play","MARISHA",1,0,0,0
"1905","Daring_Deeds",7,96,1905,"second_half_rp","MATT","okay. there's keyleth. taryon?",12595.449,12598.208,2.75900000000001,6,0.00217470097861543,NA,"role_play","MATT",0,0,0,1
"1906","Daring_Deeds",7,96,1906,"second_half_rp","SAM","i'm just gonna stay where the gnomes are all within 30 feet of me. so close to the action.",12598.208,12606.167,7.95899999999892,21,0.00263852242744099,NA,"role_play","SAM",1,0,0,0
"1907","Daring_Deeds",7,96,1907,"second_half_rp","MATT","okay, so pretty much where you are? okay.",12606.167,12609.621,3.45399999999972,9,0.00260567458019708,NA,"role_play","MATT",0,0,0,1
"1908","Daring_Deeds",7,96,1908,"second_half_rp","SAM","within visual 30 feet.",12609.621,12612.455,2.83400000000074,5,0.00176429075511598,NA,"role_play","SAM",1,0,0,0
"1909","Daring_Deeds",7,96,1909,"second_half_rp","MATT","got you. so pike, the circle puts you at about there, in the centerpiece. you watch as the sulfur is drawn around you in a wide circle. all right. jb now begins taking the water and splashing it throughout the center of the circle. she opens the jug with the help of grog and walks around with grog and is just taking big handfuls and splashing all the blessed water to fill in the circle between oh god where the sulfur was, in the interior of it, all around. so it soaks all the dirt, you can see it actually goes darker in color as it absorbs the liquid, and it seems you can now very, very clearly see the circle. and at this point, as the night has really hit the moonlight, the full moon is plainly visible, and that bright, bright white moonlight is making stark shadows and a very visible perspective of everything on this field. so, pike, you're asked to stand in the center there, as right over here next to taryon, facing you, ogden hobbles over, looks at you. he holds the diamond in his hand. ""pike. are you ready?""",12612.455,12696.449,83.9940000000006,197,0.00234540562421124,NA,"role_play","MATT",0,0,0,1
"1910","Daring_Deeds",7,96,1910,"second_half_rp","ASHLEY","two seconds. just quietly, just sort of muttering to myself, or not to myself, to sarenrae, i don't know what this is, i just hope that you're here and watching, and please be by my side and guide this ritual if it is your will. okay. i'm ready.",12696.449,12740.622,44.1729999999989,52,0.00117718968600732,NA,"role_play","ASHLEY",1,0,0,0
"1911","Daring_Deeds",7,96,1911,"second_half_rp","MATT","okay. ogden is holding the diamond out. ""close your eyes. concentrate on the goodness ""within you."" he holds the diamond out in front of him and just starts chanting slowly under his breath.",12740.622,12759.079,18.4570000000003,34,0.00184211952104889,NA,"role_play","MATT",0,0,0,1
"1912","Daring_Deeds",7,96,1912,"second_half_rp","SAM","okay. i'm gonna drink the potion of mind reading.",12759.079,12762.457,3.37800000000061,11,0.00325636471284725,NA,"role_play","SAM",1,0,0,0
"1913","Daring_Deeds",7,96,1913,"second_half_rp","MATT","okay, you drink the potion of mind reading.",12762.496,12764.808,2.31200000000172,9,0.00389273356401095,NA,"role_play","MATT",0,0,0,1
"1914","Daring_Deeds",7,96,1914,"second_half_rp","SAM","yes.",12764.808,12765.838,1.02999999999884,2,0.00194174757281773,NA,"role_play","SAM",1,0,0,0
"1915","Daring_Deeds",7,96,1915,"second_half_rp","MATT","okay. he's loudly",12765.838,12770.023,4.18499999999949,4,0.000955794504181717,NA,"role_play","MATT",0,0,0,1
"1916","Daring_Deeds",7,96,1916,"second_half_rp","LAURA","what if he's stealing her soul?",12770.023,12771.777,1.75400000000081,8,0.00456100342075045,NA,"role_play","LAURA",1,0,0,0
"1917","Daring_Deeds",7,96,1917,"second_half_rp","MATT","he's holding this diamond forward and he's loudly speaking in a language i don't think any of you understand.",12771.777,12782.251,10.4740000000002,23,0.00219591369104446,NA,"role_play","MATT",0,0,0,1
"1918","Daring_Deeds",7,96,1918,"second_half_rp","SAM","i'm going to scan his surface thoughts, what is most on his mind in that moment.",12782.251,12788.548,6.29700000000048,18,0.00285850404954719,NA,"role_play","SAM",1,0,0,0
"1919","Daring_Deeds",7,96,1919,"second_half_rp","MATT","currently, at that moment, it sounds like a bunch of gibberish.",12788.548,12797.379,8.83100000000013,12,0.00135884950741703,NA,"role_play","MATT",0,0,0,1
"1920","Daring_Deeds",7,96,1920,"second_half_rp","LAURA","what is he speaking?",12797.379,12800.713,3.33399999999892,5,0.00149970005998849,NA,"role_play","LAURA",1,0,0,0
"1921","Daring_Deeds",7,96,1921,"second_half_rp","SAM","as an action, if it's my turn again, i will attempt to probe deeper into the same creature's mind.",12800.713,12809.773,9.05999999999949,22,0.00242825607064031,NA,"role_play","SAM",1,0,0,0
"1922","Daring_Deeds",7,96,1922,"second_half_rp","MATT","okay.",12809.773,12810.974,1.20100000000093,2,0.00166527893422019,NA,"role_play","MATT",0,0,0,1
"1923","Daring_Deeds",7,96,1923,"second_half_rp","SAM","he makes a wisdom saving throw.",12810.974,12812.597,1.62299999999959,7,0.00431300061614403,NA,"role_play","SAM",1,0,0,0
"1924","Daring_Deeds",7,96,1924,"second_half_rp","MATT","against a dc of?",12812.597,12813.947,1.35000000000036,5,0.00370370370370271,NA,"role_play","MATT",0,0,0,1
"1925","Daring_Deeds",7,96,1925,"second_half_rp","SAM","13. it's not very good.",12813.947,12816.755,2.80799999999908,7,0.00249287749287831,NA,"role_play","SAM",1,0,0,0
"1926","Daring_Deeds",7,96,1926,"second_half_rp","MATT","okay. as you focus your attention, pushing in to probe deeper, all you get is the gibberish.",12816.755,12823.023,6.26800000000003,18,0.00287172941927248,NA,"role_play","MATT",0,0,0,1
"1927","Daring_Deeds",7,96,1927,"second_half_rp","SAM","more gibberish.",12823.023,12824.577,1.55400000000009,3,0.00193050193050182,NA,"role_play","SAM",1,0,0,0
"1928","Daring_Deeds",7,96,1928,"second_half_rp","MATT","natural 17, sorry.",12824.577,12826.934,2.35699999999997,4,0.00169707254985153,NA,"role_play","MATT",0,0,0,1
"1929","Daring_Deeds",7,96,1929,"second_half_rp","SAM","ugh! waste of 1,000 bucks.",12826.934,12830.376,3.44200000000092,7,0.00203370133643176,NA,"role_play","SAM",1,0,0,0
"1930","Daring_Deeds",7,96,1930,"second_half_rp","LAURA","you can't try the other gnomes?",12830.376,12834.659,4.28299999999945,8,0.00186784963810437,NA,"role_play","LAURA",1,0,0,0
"1931","Daring_Deeds",7,96,1931,"second_half_rp","SAM","i believe that breaks the spell.",12834.659,12839.31,4.65099999999984,7,0.00150505267684374,NA,"role_play","SAM",1,0,0,0
"1932","Daring_Deeds",7,96,1932,"second_half_rp","MATT","is that what it says?",12839.31,12841.486,2.1760000000013,6,0.00275735294117483,NA,"role_play","MATT",0,0,0,1
"1933","Daring_Deeds",7,96,1933,"second_half_rp","SAM","it says if i probe deeper, he makes a wisdom saving throw. if he succeeds, the spell ends. and! he's aware i was probing.",12841.486,12855.871,14.3849999999984,26,0.00180743830378887,NA,"role_play","SAM",1,0,0,0
"1934","Daring_Deeds",7,96,1934,"second_half_rp","MATT","as he's chanting. goes right back into concentrating again.",12855.871,12869.504,13.6330000000016,11,0.000806865693537643,NA,"role_play","MATT",0,0,0,1
"1935","Daring_Deeds",7,96,1935,"second_half_rp","SAM","the plan failed! the plan failed!",12869.504,12871.492,1.98799999999937,7,0.00352112676056449,NA,"role_play","SAM",1,0,0,0
"1936","Daring_Deeds",7,96,1936,"second_half_rp","MATT","what languages do you know?",12871.492,12875.238,3.74599999999919,6,0.00160170848905534,NA,"role_play","MATT",0,0,0,1
"1937","Daring_Deeds",7,96,1937,"second_half_rp","SAM","i know sylvan, common, gnome, draconic, undercommon.",12875.238,12883.604,8.36599999999999,8,0.000956251494142961,NA,"role_play","SAM",1,0,0,0
"1938","Daring_Deeds",7,96,1938,"second_half_rp","MATT","languages?",12883.604,12884.884,1.28000000000065,2,0.0015624999999992,NA,"role_play","MATT",0,0,0,1
"1939","Daring_Deeds",7,96,1939,"second_half_rp","TALIESIN","common, celestial, elven.",12884.884,12887.021,2.13700000000063,4,0.00187178287318616,NA,"role_play","TALIESIN",1,0,0,0
"1940","Daring_Deeds",7,96,1940,"second_half_rp","MARISHA","common, elven, celestial sorry, sylvan, druidic, primordial.",12887.021,12892.717,5.69599999999991,8,0.00140449438202249,NA,"role_play","MARISHA",1,0,0,0
"1941","Daring_Deeds",7,96,1941,"second_half_rp","LIAM","common, elven, and abyssal.",12892.717,12895.22,2.50299999999879,5,0.00199760287654911,NA,"role_play","LIAM",1,0,0,0
"1942","Daring_Deeds",7,96,1942,"second_half_rp","LAURA","elvish, common, undercommon, abyssal, and draconic.",12895.22,12899.167,3.94700000000012,7,0.00177349885989354,NA,"role_play","LAURA",1,0,0,0
"1943","Daring_Deeds",7,96,1943,"second_half_rp","ASHLEY","gnomish, common, undercommon, dwarvish.",12899.167,12903.702,4.53499999999985,5,0.00110253583241459,NA,"role_play","ASHLEY",1,0,0,0
"1944","Daring_Deeds",7,96,1944,"second_half_rp","TRAVIS","come on.",12903.702,12907.418,3.71600000000035,3,0.00080731969860057,NA,"role_play","TRAVIS",1,0,0,0
"1945","Daring_Deeds",7,96,1945,"second_half_rp","MATT","barely common.",12907.418,12908.731,1.3130000000001,3,0.00228484386900211,NA,"role_play","MATT",0,0,0,1
"1946","Daring_Deeds",7,96,1946,"second_half_rp","TRAVIS","i just have spoken giant, that's it.",12908.731,12911.533,2.80199999999968,9,0.00321199143468987,NA,"role_play","TRAVIS",1,0,0,0
"1947","Daring_Deeds",7,96,1947,"second_half_rp","MATT","okay. none of you know the language he's speaking. it just sounds like gibberish to you. oh, and dwarvish, because you have the belt. as he begins chanting, the diamond begins to glow faintly, a greenish color. just very, very, on the inside, just ever-so-gently. he begins to chant louder and louder. as he does, the diamond flashes brighter and brighter green, and eventually the green coloration fades and the diamond vanishes from his hand.",12911.533,12950.187,38.6540000000005,79,0.0020437729601076,NA,"role_play","MATT",0,0,0,1
"1948","Daring_Deeds",7,96,1948,"second_half_rp","SAM","another thousand!",12950.187,12951.734,1.54700000000048,3,0.00193923723335428,NA,"role_play","SAM",1,0,0,0
"1949","Daring_Deeds",7,96,1949,"second_half_rp","MATT","and he falls to his knees. ""look!"" and as he points forward, towards pike, you guys glance over and look at pike, and you watch as from the ground around her, this black cloud-like mass begins to pour out of her legs and knees in a swirl around her person. you, pike, look around you as it begins to fill the space around you and it begins to coalesce into this large cloud of darkness. it rumbles and gathers like a miniature thunderstorm, and you watch as the clouds begin to churn, forming dozens of screaming faces, all wailing in a discordant moan.",12951.734,13006.524,54.7899999999991,105,0.00191640810366859,NA,"role_play","MATT",0,0,0,1
"1950","Daring_Deeds",7,96,1950,"combat","SAM","that don't look good. that's tall.",13006.524,13009.524,3,9,0.003,1,"combat","SAM",1,0,0,0
"1951","Daring_Deeds",7,96,1951,"combat","MATT","roll initative.",13009.524,13012.809,3.28499999999985,3,0.000913242009132461,1,"combat","MATT",0,0,0,1
"1952","Daring_Deeds",7,96,1952,"combat","LAURA","oh my god, i totally thought he was gonna steal your soul and stick you in that diamond, i was like, this was a bad idea.",13012.809,13019.124,6.31500000000051,27,0.00427553444180488,1,"combat","LAURA",1,0,0,0
"1953","Daring_Deeds",7,96,1953,"combat","MATT","all righty. who's at the top? we've got 25 to 20.",13019.124,13031.027,11.9030000000002,14,0.00117617407376289,1,"combat","MATT",0,0,0,1
"1954","Daring_Deeds",7,96,1954,"combat","LIAM","21.",13031.027,13032.04,1.01300000000083,2,0.00197433366238733,1,"combat","LIAM",1,0,0,0
"1955","Daring_Deeds",7,96,1955,"combat","TALIESIN","22.",13032.04,13032.936,0.895999999998821,2,0.00223214285714579,1,"combat","TALIESIN",1,0,0,0
"1956","Daring_Deeds",7,96,1956,"combat","TRAVIS","20.",13032.936,13033.973,1.03700000000026,2,0.00192864030858196,1,"combat","TRAVIS",1,0,0,0
"1957","Daring_Deeds",7,96,1957,"combat","ASHLEY","this music.",13033.973,13039.121,5.14799999999923,3,0.00058275058275067,1,"combat","ASHLEY",1,0,0,0
"1958","Daring_Deeds",7,96,1958,"combat","MATT","all righty. 20 to 15.",13039.121,13043.728,4.60699999999997,6,0.00130236596483613,1,"combat","MATT",0,0,0,1
"1959","Daring_Deeds",7,96,1959,"combat","LAURA","18.",13043.728,13044.649,0.921000000000276,2,0.00217155266015136,1,"combat","LAURA",1,0,0,0
"1960","Daring_Deeds",7,96,1960,"combat","MATT","18.",13044.649,13045.784,1.13500000000022,2,0.0017621145374446,1,"combat","MATT",0,0,0,1
"1961","Daring_Deeds",7,96,1961,"combat","MARISHA","15.",13045.784,13047.708,1.92400000000089,2,0.00103950103950056,1,"combat","MARISHA",1,0,0,0
"1962","Daring_Deeds",7,96,1962,"combat","MATT","15, keyleth.",13047.708,13048.925,1.21699999999873,3,0.00246507806080782,1,"combat","MATT",0,0,0,1
"1963","Daring_Deeds",7,96,1963,"combat","SAM","my plan was foolproof.",13048.925,13051.967,3.04200000000128,5,0.00164365548980864,1,"combat","SAM",1,0,0,0
"1964","Daring_Deeds",7,96,1964,"combat","MATT","15 to ten?",13051.967,13053.422,1.45499999999993,4,0.00274914089347093,1,"combat","MATT",0,0,0,1
"1965","Daring_Deeds",7,96,1965,"combat","LAURA","you really should've tried that when he was speaking english.",13053.422,13056.959,3.53700000000026,12,0.00339270568278177,1,"combat","LAURA",1,0,0,0
"1966","Daring_Deeds",7,96,1966,"combat","MATT","ten to five?",13056.959,13058.418,1.45899999999892,4,0.0027416038382474,1,"combat","MATT",0,0,0,1
"1967","Daring_Deeds",7,96,1967,"combat","LAURA","common.",13058.418,13059.735,1.31700000000092,2,0.00151860288534443,1,"combat","LAURA",1,0,0,0
"1968","Daring_Deeds",7,96,1968,"combat","MARISHA","oh, sorry, eight. sorry.",13059.735,13062.596,2.86099999999897,5,0.00174764068507578,1,"combat","MARISHA",1,0,0,0
"1969","Daring_Deeds",7,96,1969,"combat","ASHLEY","pike fashion.",13062.596,13065.613,3.01699999999983,3,0.000994365263506852,1,"combat","ASHLEY",1,0,0,0
"1970","Daring_Deeds",7,96,1970,"combat","MATT","tary, what'd you get?",13065.613,13066.915,1.3020000000015,6,0.00460829493087027,1,"combat","MATT",0,0,0,1
"1971","Daring_Deeds",7,96,1971,"combat","SAM","three.",13066.915,13068.325,1.40999999999985,2,0.0014184397163122,1,"combat","SAM",1,0,0,0
"1972","Daring_Deeds",7,96,1972,"combat","TRAVIS","that happens a lot for you.",13068.325,13070.223,1.89799999999923,7,0.00368809272919012,1,"combat","TRAVIS",1,0,0,0
"1973","Daring_Deeds",7,96,1973,"combat","LIAM","if it makes you feel better, i rolled a one and used luck.",13070.223,13072.665,2.44200000000092,14,0.00573300573300358,1,"combat","LIAM",1,0,0,0
"1974","Daring_Deeds",7,96,1974,"combat","SAM","and then got?",13072.665,13074.283,1.61799999999857,4,0.00247218788628154,1,"combat","SAM",1,0,0,0
"1975","Daring_Deeds",7,96,1975,"combat","LIAM","21.",13074.283,13075.699,1.41600000000108,2,0.00141242937853,1,"combat","LIAM",1,0,0,0
"1976","Daring_Deeds",7,96,1976,"combat","SAM","oh, jesus.",13075.699,13077.098,1.39899999999943,3,0.00214438884917885,1,"combat","SAM",1,0,0,0
"1977","Daring_Deeds",7,96,1977,"combat","MATT","percival, you're up first.",13077.098,13079.071,1.97299999999996,6,0.00304105423213387,1,"combat","MATT",0,0,0,1
"1978","Daring_Deeds",7,96,1978,"combat","TALIESIN","just 'cause this thing's weird, first thing i'm gonna do is i'm going to hit it with a sharpshooter with where's my runs? with a deadeye. so i'm getting advantage on it and hitting with sharpshooter. and let's see what happens.",13079.071,13110.324,31.2530000000006,48,0.00153585255815439,1,"combat","TALIESIN",1,0,0,0
"1979","Daring_Deeds",7,96,1979,"combat","SAM","what if it's good?",13110.324,13111.417,1.09299999999894,6,0.00548947849954788,1,"combat","SAM",1,0,0,0
"1980","Daring_Deeds",7,96,1980,"combat","TALIESIN","with animus.",13111.417,13112.375,0.958000000000538,3,0.00313152400834897,1,"combat","TALIESIN",1,0,0,0
"1981","Daring_Deeds",7,96,1981,"combat","SAM","you don't even know if it's a good guy.",13112.375,13114.518,2.14300000000003,12,0.00559962669155382,1,"combat","SAM",1,0,0,0
"1982","Daring_Deeds",7,96,1982,"combat","TRAVIS","is it surrounding pike or is it just next to pike?",13114.518,13117.115,2.59699999999975,12,0.00462071621101315,1,"combat","TRAVIS",1,0,0,0
"1983","Daring_Deeds",7,96,1983,"combat","MATT","it's pseudo-surrounding her and right behind her, like it's kind of forming behind her and adjacent to her body.",13117.115,13122.682,5.56700000000092,23,0.0041314891323866,1,"combat","MATT",0,0,0,1
"1984","Daring_Deeds",7,96,1984,"combat","TRAVIS","what did you do?",13122.682,13124.085,1.40299999999843,5,0.00356379187455852,1,"combat","TRAVIS",1,0,0,0
"1985","Daring_Deeds",7,96,1985,"combat","TALIESIN","that's, yeah, 30 to hit.",13124.085,13127.962,3.87700000000041,7,0.00180551973175116,1,"combat","TALIESIN",1,0,0,0
"1986","Daring_Deeds",7,96,1986,"combat","MATT","okay. go ahead and roll damage.",13127.962,13129.781,1.81900000000132,7,0.00384826827927152,1,"combat","MATT",0,0,0,1
"1987","Daring_Deeds",7,96,1987,"combat","TALIESIN","that's my brain is made of swiss cheese. here we go. 1d10 plus 1d6, so that's yeah, that's nice. so that's, oh yeah, that's really good. 26 points of damage, plus six points of psychic damage, and just because i'm irritated by this thing, i'm gonna drop some cabal's ruin into it. let's just drop where's my pen? here's my pen.",13129.781,13165.783,36.0019999999986,73,0.0020276651297151,1,"combat","TALIESIN",1,0,0,0
"1988","Daring_Deeds",7,96,1988,"combat","SAM","where's my pen?",13165.783,13168.07,2.28700000000026,5,0.00218627022299931,1,"combat","SAM",1,0,0,0
"1989","Daring_Deeds",7,96,1989,"combat","MATT AND SAM","they took my pen!",13168.07,13170.288,2.21800000000076,5,0.00225428313796136,1,"combat","MATT AND SAM",1,0,0,0
"1990","Daring_Deeds",7,96,1990,"combat","TALIESIN","let's drop five points of cabal's ruin into that. that's 5d6, if i recall?",13170.288,13173.461,3.17299999999886,18,0.00567286479672437,1,"combat","TALIESIN",1,0,0,0
"1991","Daring_Deeds",7,96,1991,"combat","MATT","5d6 of kids in the hall damage, got it.",13173.461,13177.391,3.93000000000029,10,0.00254452926208633,1,"combat","MATT",0,0,0,1
"1992","Daring_Deeds",7,96,1992,"combat","TALIESIN","so that's, ugh, three, four, five. ten points of lightning damage.",13177.391,13186.86,9.46900000000096,13,0.00137290104551681,1,"combat","TALIESIN",1,0,0,0
"1993","Daring_Deeds",7,96,1993,"combat","MATT","got you. so as you fire this is with bad news, or with your",13186.86,13191.876,5.01599999999962,14,0.00279106858054248,1,"combat","MATT",0,0,0,1
"1994","Daring_Deeds",7,96,1994,"combat","TALIESIN","this is animus.",13191.876,13193.25,1.3739999999998,4,0.00291120815138326,1,"combat","TALIESIN",1,0,0,0
"1995","Daring_Deeds",7,96,1995,"combat","MATT","this is animus, okay. so as you fire and turn it over, you look down and watch as the bullet just seems to pass through it, and then almost catch the edge of the rock here and splinter off, and doesn't seem to affect it directly at all.",13193.25,13207.691,14.4410000000007,50,0.00346236410220882,1,"combat","MATT",0,0,0,1
"1996","Daring_Deeds",7,96,1996,"combat","TALIESIN","the lightning and the psychic didn't do anything?",13207.691,13211.176,3.48499999999876,10,0.00286944045911149,1,"combat","TALIESIN",1,0,0,0
"1997","Daring_Deeds",7,96,1997,"combat","MATT","nope. you watch as the energy kind of crackles and dissipates amongst the rock.",13211.176,13215.23,4.05400000000009,15,0.00370004933399104,1,"combat","MATT",0,0,0,1
"1998","Daring_Deeds",7,96,1998,"combat","SAM","wait, no damage, it took?",13215.23,13217.19,1.96000000000095,6,0.00306122448979444,1,"combat","SAM",1,0,0,0
"1999","Daring_Deeds",7,96,1999,"combat","LIAM","best you can tell.",13217.19,13220.796,3.60599999999977,5,0.00138657792567951,1,"combat","LIAM",1,0,0,0
"2000","Daring_Deeds",7,96,2000,"combat","TRAVIS","doesn't seem to have affected it.",13220.796,13222.428,1.63199999999961,8,0.00490196078431491,1,"combat","TRAVIS",1,0,0,0
"2001","Daring_Deeds",7,96,2001,"combat","SAM","oh shit.",13222.428,13224.169,1.74099999999999,3,0.00172314761631248,1,"combat","SAM",1,0,0,0
"2002","Daring_Deeds",7,96,2002,"combat","TALIESIN","i'm going to i don't know what to do.",13224.169,13232.689,8.52000000000044,12,0.00140845070422528,1,"combat","TALIESIN",1,0,0,0
"2003","Daring_Deeds",7,96,2003,"combat","MARISHA","you just shot at it, you didn't do anything?",13232.689,13235.084,2.39500000000044,11,0.00459290187891357,1,"combat","MARISHA",1,0,0,0
"2004","Daring_Deeds",7,96,2004,"combat","TALIESIN","i just shot at it. i'm going to attempt to hex it with a bonus action. does it catch?",13235.084,13243.91,8.82599999999911,21,0.00237933378654001,1,"combat","TALIESIN",1,0,0,0
"2005","Daring_Deeds",7,96,2005,"combat","MATT","okay. you go ahead and attempt to hex it. as you focus on it, nothing seems to hit.",13243.91,13253.42,9.51000000000022,19,0.00199789695057829,1,"combat","MATT",0,0,0,1
"2006","Daring_Deeds",7,96,2006,"combat","MARISHA","including a hex?",13253.42,13256.523,3.10299999999916,4,0.00128907508862426,1,"combat","MARISHA",1,0,0,0
"2007","Daring_Deeds",7,96,2007,"combat","MATT","the hex has no effect, and you don't sense any connection with this creature, you don't see any of the smoke or shadow surrounding it. the hex has no effect.",13256.523,13265.129,8.60600000000159,33,0.0038345340460137,1,"combat","MATT",0,0,0,1
"2008","Daring_Deeds",7,96,2008,"combat","SAM","maybe it's not there.",13265.129,13266.222,1.09299999999894,6,0.00548947849954788,1,"combat","SAM",1,0,0,0
"2009","Daring_Deeds",7,96,2009,"combat","TALIESIN","maybe it's an illusion. i'm going to since i don't have much left, i burnt a little bit, i'm just i'm going to reload, hunker down, and watch what happens. i'm also going to watch the gnomes, all of them. are any of them doing weird shit? that's where i'm gonna use the rest of my turn, to just look at the gnomes and see what they're doing.",13266.222,13287.047,20.8250000000007,78,0.00374549819927958,1,"combat","TALIESIN",1,0,0,0
"2010","Daring_Deeds",7,96,2010,"combat","MATT","okay. right now, the two other gnomes are just waiting off to the side, watching aghast, and you watch as ogden is slowly, with his staff, backing up, hand out, looking freaked out, backing into taryon. look over and noticing his presence, and then focusing back on the horrible thing that's surrounding pike right now, and he looks genuinely frightened. is that your turn?",13287.047,13313.517,26.4699999999993,66,0.00249338874197211,1,"combat","MATT",0,0,0,1
"2011","Daring_Deeds",7,96,2011,"combat","TALIESIN","that's my turn.",13313.517,13314.707,1.19000000000051,5,0.00420168067226711,1,"combat","TALIESIN",1,0,0,0
"2012","Daring_Deeds",7,96,2012,"combat","MATT","okay. percival's done. vax, you're up.",13314.707,13316.576,1.86899999999878,9,0.00481540930979448,1,"combat","MATT",0,0,0,1
